"","id_tweet","id_twitter","created_at","created_at_datetime","in_reply_to_user_id","in_reply_to_status_id","in_reply_to_screen_name","text","retweet_count","favorite_count","longitude","latitude","retweeted","creation_date","modification_date","RT_temp","is_retweeted"
"2013",753349408419217408,470472926,"Wed Jul 13 22:04:30 +0000 2016","2016-07-13 22:04:30",NA,NA,"","En esta mesa de #GastronomíaMexicana, nos acompaña también Georgius Gotsis Fontes, Coordinador General de Promoción Comercial @SAGARPA_mx",6,5,0,0,0,"2016-09-25 10:25:41","2016-10-01 20:44:48",0,0
"2014",753348328541200384,470472926,"Wed Jul 13 22:00:12 +0000 2016","2016-07-13 22:00:12",NA,NA,"","Participo con mi amiga @LuceroSenadora en la mesa redonda sobre la Ley Federal de Fomento a la Gastronomía. https://t.co/Vr4KhkpVET",13,11,0,0,0,"2016-09-25 10:25:41","2016-10-01 20:44:48",0,0
"2015",753346413988237312,470472926,"Wed Jul 13 21:52:36 +0000 2016","2016-07-13 21:52:36",NA,NA,"","Los invito a que sigan la transmisión de @CanalCongreso https://t.co/2HOqso2OD0 en la mesa redonda sobre la Ley del Fomento a la Gastronomía",3,7,0,0,0,"2016-09-25 10:25:41","2016-10-01 20:44:48",0,0
"2016",753287603080663040,470472926,"Wed Jul 13 17:58:54 +0000 2016","2016-07-13 17:58:54",NA,NA,"","La #ReformaEnergética promueve los certificados de #EnergíasLimpias, fomenta la inversión y el uso de tecnologías amigables con el ambiente.",4,2,0,0,0,"2016-09-25 10:25:46","2016-10-01 20:44:48",0,0
"2017",753287042612592640,470472926,"Wed Jul 13 17:56:41 +0000 2016","2016-07-13 17:56:41",NA,NA,"","Se firmó convenio entre @SEGOB_mx - @cirt_ para incorporar en medios la perspectiva de igualdad y no discriminación https://t.co/1Vb8I4zoOa",3,3,0,0,0,"2016-09-25 10:25:46","2016-10-01 20:44:48",0,0
"2018",753286912069087232,470472926,"Wed Jul 13 17:56:09 +0000 2016","2016-07-13 17:56:09",NA,NA,"","Infórmate de las nuevas disposiciones para el Programa Hoy no Circula. https://t.co/TK2E0uTucc",6,1,0,0,0,"2016-09-25 10:25:47","2016-10-01 20:44:48",0,0
"2019",753263264255971328,470472926,"Wed Jul 13 16:22:11 +0000 2016","2016-07-13 16:22:11",NA,NA,"","Visiten mi tierra, no se arrepentirán. https://t.co/8rBAYyuETX",4,2,0,0,0,"2016-09-25 10:25:52","2016-10-01 20:44:48",0,0
"2020",753261335232729088,470472926,"Wed Jul 13 16:14:31 +0000 2016","2016-07-13 16:14:31",NA,NA,"","RT @CanalCongreso: En unos momentos iniciarán los trabajos de la Sesión de la #ComisiónPermanente, en vivo por @CanalCongreso https://t.co/…",6,0,0,0,0,"2016-09-25 10:25:53","2016-10-01 20:44:48",1,1
"2021",750476797318356992,470472926,"Tue Jul 05 23:49:46 +0000 2016","2016-07-05 23:49:46",NA,NA,"","Les comparto el enlace,donde pueden consultar modificaciones aprobadas a Ley Gral. Responsabilidades Administrativas https://t.co/4DsoLUqnd2",8,5,0,0,0,"2016-09-25 10:25:53","2016-10-01 20:44:48",0,0
"2022",750476005597257728,470472926,"Tue Jul 05 23:46:37 +0000 2016","2016-07-05 23:46:37",NA,NA,"","Con estas modificaciones a Ley Gral. Responsabilidades Administrativas, queda concluido este #PeriodoExtraordinario.",4,4,0,0,0,"2016-09-25 10:25:59","2016-10-01 20:44:48",0,0
"2023",750475114718720000,470472926,"Tue Jul 05 23:43:05 +0000 2016","2016-07-05 23:43:05",NA,NA,"","Votamos y aprobamos con 77 votos a favor, los articulos reservados del dictamen de la Ley General de Responsabilidades Administrativas.",5,4,0,0,0,"2016-09-25 10:25:59","2016-10-01 20:44:48",0,0
"2024",750474250767601664,470472926,"Tue Jul 05 23:39:39 +0000 2016","2016-07-05 23:39:39",NA,NA,"","Hemos aprobado con 80 votos en pro, 19 en contra y 4 abstenciones el dictamen de la Ley Gral. de Responsabilidades Administrativas.",27,7,0,0,0,"2016-09-25 10:25:59","2016-10-01 20:44:48",0,0
"2025",750439177733349376,470472926,"Tue Jul 05 21:20:17 +0000 2016","2016-07-05 21:20:17",NA,NA,"","Mi amiga @LisbethLecona sube a Tribuna para fijar postura de nuestro grupo parlamentario .@Senado_PRI",25,6,0,0,0,"2016-09-25 10:25:59","2016-10-01 20:44:48",0,0
"2026",750433124765405184,470472926,"Tue Jul 05 20:56:13 +0000 2016","2016-07-05 20:56:13",NA,NA,"","Análisis que realizaremos con la firme intención de empoderar a la sociedad.  https://t.co/9WKGVTCoZy",24,2,0,0,0,"2016-09-25 10:25:59","2016-10-01 20:44:48",0,0
"2027",750411548405796864,470472926,"Tue Jul 05 19:30:29 +0000 2016","2016-07-05 19:30:29",NA,NA,"","Entramos a la discusión del dictamen por las observaciones del Ejecutivo federal a la Ley Federal de Responsabilidades Administrativas.",3,2,0,0,0,"2016-09-25 10:26:00","2016-10-01 20:44:48",0,0
"2028",750411145261953024,470472926,"Tue Jul 05 19:28:53 +0000 2016","2016-07-05 19:28:53",NA,NA,"","La #MesaDirectiva nos informa que existe un acuerdo para normar discusión de observaciones del Ejecutivo.",1,0,0,0,0,"2016-09-25 10:26:00","2016-10-01 20:44:48",0,0
"2029",750408784791556096,470472926,"Tue Jul 05 19:19:30 +0000 2016","2016-07-05 19:19:30",NA,NA,"","Felicito a mi amiga María Lorena Marín Moreno por su toma de protesta como suplente de  @AnaLiliaHerrera.",1,3,0,0,0,"2016-09-25 10:26:00","2016-10-01 20:44:48",0,0
"2030",750408204891271168,470472926,"Tue Jul 05 19:17:12 +0000 2016","2016-07-05 19:17:12",NA,NA,"","Amigos damos inicio a la sesión del #PeriodoExtraordinario. Nos pueden seguir por internet, o por el @CanalCongreso.",1,1,0,0,0,"2016-09-25 10:26:00","2016-10-01 20:44:48",0,0
"2031",750403860179480576,470472926,"Tue Jul 05 18:59:56 +0000 2016","2016-07-05 18:59:56",NA,NA,"","En el #PeriodoExtraordinario, que estamos por comenzar, los Senadores del #PRI, refrendaremos nuestro compromiso para combatir la corrupción",23,4,0,0,0,"2016-09-25 10:26:00","2016-10-01 20:44:48",0,0
"2032",750398656985968640,470472926,"Tue Jul 05 18:39:16 +0000 2016","2016-07-05 18:39:16",NA,NA,"","#LaLupaLaTienesTú. Los Senadores del #PRI, refrendamos nuestro compromiso para combatir la corrupción. https://t.co/YsmLroi8Xc",30,13,0,0,0,"2016-09-25 10:26:00","2016-10-01 20:44:48",0,0
"2033",750397927558815744,470472926,"Tue Jul 05 18:36:22 +0000 2016","2016-07-05 18:36:22",NA,NA,"","Los Senadores del PRI, escuchamos a los ciudadanos por eso todos los partidos en el @senadomexicano aprobamos las #LeyesAnticorrupción.",28,8,0,0,0,"2016-09-25 10:26:00","2016-10-01 20:44:48",0,0
"2034",750397574738092032,470472926,"Tue Jul 05 18:34:58 +0000 2016","2016-07-05 18:34:58",NA,NA,"","En el @Senado_PRI, dialogaremos con los otros partidos, para dar buen cauce a las observaciones hechas por el P.E. https://t.co/RodAgfE6dc",26,7,0,0,0,"2016-09-25 10:26:00","2016-10-01 20:44:48",0,0
"2035",750396737957687296,470472926,"Tue Jul 05 18:31:38 +0000 2016","2016-07-05 18:31:38",NA,NA,"","El día de hoy dará inicio el #PeriodoExtraordinario,donde retomamos el debate para analizar y discutir las observaciones del Ejecutivo. #SNA",23,1,0,0,0,"2016-09-25 10:26:00","2016-10-01 20:44:48",0,0
"2036",750334371765202944,470472926,"Tue Jul 05 14:23:49 +0000 2016","2016-07-05 14:23:49",NA,NA,"","¡Buen día amigos! Excelente martes a todos.",22,4,0,0,0,"2016-09-25 10:26:00","2016-10-01 20:44:48",0,0
"2037",748947657482203136,470472926,"Fri Jul 01 18:33:30 +0000 2016","2016-07-01 18:33:30",NA,NA,"","Felicidades amigo Secretario @ppcalzada por la recepción del premio “Foro Jurídico 2016”. https://t.co/tAfxeGqJ3D",78,17,0,0,0,"2016-09-25 10:26:00","2016-10-01 20:44:48",0,0
"2038",747533309173870592,470472926,"Mon Jun 27 20:53:24 +0000 2016","2016-06-27 20:53:24",NA,NA,"","Hay que conservar la calma, suena la #Alertasísmica en la #CDMX.",4,8,0,0,0,"2016-09-25 10:26:00","2016-10-01 20:44:48",0,0
"2039",745310118670016512,470472926,"Tue Jun 21 17:39:14 +0000 2016","2016-06-21 17:39:14",NA,NA,"","Felicidades mi senadora @AngelicaAraujo, te mando un abrazo. ¡Qué pases un feliz cumpleaños!",64,7,0,0,0,"2016-09-25 10:26:01","2016-10-01 20:44:48",0,0
"2040",745255123547348992,470472926,"Tue Jun 21 14:00:42 +0000 2016","2016-06-21 14:00:42",NA,NA,"","¡Buen y lluvioso día amigos! Manejen con cuidado.",67,6,0,0,0,"2016-09-25 10:26:01","2016-10-01 20:44:48",0,0
"2041",744749942560825344,470472926,"Mon Jun 20 04:33:17 +0000 2016","2016-06-20 04:33:17",NA,NA,"","Agradezco a Dios y a la vida, por la dicha de seguir disfrutando a mi señor padre. ¡Felicidades a todos los papás! https://t.co/NfqMflQqxg",70,31,0,0,0,"2016-09-25 10:26:01","2016-10-01 20:44:48",0,0
"2042",744014740817608704,470472926,"Sat Jun 18 03:51:51 +0000 2016","2016-06-18 03:51:51",NA,NA,"","Hemos aprobado en lo general con 102 votos en pro, 6 en contra y 2 abstenciones el dictamen en materia de seguridad pública.",2,3,0,0,0,"2016-09-25 10:26:01","2016-10-01 20:44:48",0,0
"2043",744009565063155712,470472926,"Sat Jun 18 03:31:17 +0000 2016","2016-06-18 03:31:17",NA,NA,"","La Mesa Directiva determina un tiempo para recibir las reservas del dictamen que reforma la #CPEUM en materia de seguridad #MandoMixto",4,0,0,0,0,"2016-09-25 10:26:01","2016-10-01 20:44:48",0,0
"2044",744002044814471168,470472926,"Sat Jun 18 03:01:25 +0000 2016","2016-06-18 03:01:25",NA,NA,"","Damos paso a la discusión en lo general del dictamen que reforma la #CPEUM en materia de seguridad pública #MandoMixto.",2,5,0,0,0,"2016-09-25 10:26:01","2016-09-28 19:14:40",0,0
"2045",743984981265965056,470472926,"Sat Jun 18 01:53:36 +0000 2016","2016-06-18 01:53:36",NA,NA,"","Te envío un abrazo de solidaridad estimado Secretario Pedro @JoaquinColdwell, por la irreparable pérdida de tú Señor Padre.",5,2,0,0,0,"2016-09-25 10:26:01","2016-09-28 19:14:40",0,0
"2046",743983981956210688,470472926,"Sat Jun 18 01:49:38 +0000 2016","2016-06-18 01:49:38",NA,NA,"","Ahora pasamos a la discusión del dictamen con reformas constitucionales en materia de seguridad pública.",1,1,0,0,0,"2016-09-25 10:26:01","2016-09-28 19:14:40",0,0
"2047",743983596147376128,470472926,"Sat Jun 18 01:48:06 +0000 2016","2016-06-18 01:48:06",NA,NA,"","Hemos aprobado en lo general y lo particular  la Ley de Fiscalización y Rendición de cuentas de la Federación. ¡Un logro x la transparencia!",1,1,0,0,0,"2016-09-25 10:26:01","2016-09-28 19:14:40",0,0
"2048",743969608365858816,470472926,"Sat Jun 18 00:52:31 +0000 2016","2016-06-18 00:52:31",NA,NA,"","También con 81 votos aprobamos los artículos reservados de la Ley de Fiscalización y Rendición de Cuentas de la Federación.",1,0,0,0,0,"2016-09-25 10:26:01","2016-09-28 19:14:40",0,0
"2049",743968147078713344,470472926,"Sat Jun 18 00:46:43 +0000 2016","2016-06-18 00:46:43",NA,NA,"","Votamos y aprobamos en lo general con 105 votos en pro y 4 en contra la Ley de Fiscalización y Rendición de Cuentas de la Federación.",2,0,0,0,0,"2016-09-25 10:26:01","2016-09-28 19:14:40",0,0
"2050",743929204274659328,470472926,"Fri Jun 17 22:11:58 +0000 2016","2016-06-17 22:11:58",NA,NA,"","Aprobamos con 105 votos en pro y 4 en contra el dictamen en materia de control interno del Ejecutivo Federal.",1,0,0,0,0,"2016-09-25 10:26:01","2016-09-28 19:14:40",0,0
"2051",743928955036536832,470472926,"Fri Jun 17 22:10:59 +0000 2016","2016-06-17 22:10:59",NA,NA,"","Ahora estamos con el análisis referente al dictamen que expide la Ley de Fiscalización y Rendición de Cuentas de la Federación.",2,0,0,0,0,"2016-09-25 10:26:01","2016-09-27 17:23:38",0,0
"2052",743928681102381056,470472926,"Fri Jun 17 22:09:53 +0000 2016","2016-06-17 22:09:53",NA,NA,"","Amigos, por aquí pueden seguir nuestros trabajos de la Sesión Extraordinaria. https://t.co/vp84Fggu6q",2,0,0,0,0,"2016-09-25 10:26:01","2016-09-27 17:23:38",0,0
"2053",743864183133900800,470472926,"Fri Jun 17 17:53:36 +0000 2016","2016-06-17 17:53:36",NA,NA,"","Queda aprobado en Comisiones, la minuta de la Ley de Fiscalización y Rendición de Cuentas.",1,0,0,0,0,"2016-09-25 10:26:05","2016-09-27 17:23:38",0,0
"2054",743849021001740288,470472926,"Fri Jun 17 16:53:21 +0000 2016","2016-06-17 16:53:21",NA,NA,"","Le mando un abrazo a mi amiga Gobernadora @claudiapavlovic, hoy día de su cumpleaños. ¡Qué sigan los éxitos Claudia!",1,0,0,0,0,"2016-09-25 10:26:05","2016-09-27 17:23:38",0,0
"2055",743815479286849536,470472926,"Fri Jun 17 14:40:04 +0000 2016","2016-06-17 14:40:04",NA,NA,"","Hoy a las 11:00 estamos citados en el @senadomexicano, para dar continuidad a la sesión extraordinaria.",1,4,0,0,0,"2016-09-25 10:26:05","2016-09-27 17:23:38",0,0
"2056",743815002457419776,470472926,"Fri Jun 17 14:38:10 +0000 2016","2016-06-17 14:38:10",NA,NA,"","¡Buen día amigos! Excelente viernes para todos. Éxito en sus actividades.",2,5,0,0,0,"2016-09-25 10:26:05","2016-09-27 03:30:00",0,0
"2057",743255058444234752,470472926,"Thu Jun 16 01:33:09 +0000 2016","2016-06-16 01:33:09",NA,NA,"","Por hoy, hemos concluido sesión extraordinaria y nos citan a la siguiente, mañana, el jueves 16 de junio a las 12 horas.",42,3,0,0,0,"2016-09-25 10:26:05","2016-09-27 03:30:00",0,0
"2058",743254777266483200,470472926,"Thu Jun 16 01:32:02 +0000 2016","2016-06-16 01:32:02",NA,NA,"","Con 99 votos en pro y 7 en contra aprobamos artículos reservados de dictamen que modifica Código Penal Federal para combatir la corrupción.",45,4,0,0,0,"2016-09-25 10:26:05","2016-09-27 03:30:00",0,0
"2059",743243085971230720,470472926,"Thu Jun 16 00:45:35 +0000 2016","2016-06-16 00:45:35",NA,NA,"","Ahora discutiremos los artículos reservados del dictamen sobre #CódigoPenal Federal en materia de #CombateAlaCorrupción.",44,1,0,0,0,"2016-09-25 10:26:05","2016-09-27 03:30:00",0,0
"2060",743242757766946816,470472926,"Thu Jun 16 00:44:16 +0000 2016","2016-06-16 00:44:16",NA,NA,"","Aprobamos en lo general con  104 votos en pro y 7 en contra, el dictamen que modifica el Código Penal Federal para combatir la corrupción.",42,1,0,0,0,"2016-09-25 10:26:05","2016-09-27 03:30:00",0,0
"2061",743231504084434944,470472926,"Wed Jun 15 23:59:33 +0000 2016","2016-06-15 23:59:33",NA,NA,"","En ese mismo sentido aprobamos que no solo funcionarios, sino también los empresarios que reciban dinero público presenten su #Ley3de3.",46,2,0,0,0,"2016-09-25 10:26:05","2016-09-27 03:30:00",0,0
"2062",743231093910888448,470472926,"Wed Jun 15 23:57:56 +0000 2016","2016-06-15 23:57:56",NA,NA,"","Aprobamos tal como lo propusieron, que el formato que se utilizará lo habrá de aprobar un Comité conformado por ciudadanos.",42,0,0,0,0,"2016-09-25 10:26:05","2016-09-27 03:30:00",0,0
"2063",743230911739617280,470472926,"Wed Jun 15 23:57:12 +0000 2016","2016-06-15 23:57:12",NA,NA,"","Mis compañeros del @Senado_PRI y su servidor, votamos A FAVOR de la #Ley3de3. ¡Qué no te engañen! https://t.co/uBnuElU1RC",59,15,0,0,0,"2016-09-25 10:26:05","2016-09-27 03:30:00",0,0
"2064",743229852585582592,470472926,"Wed Jun 15 23:53:00 +0000 2016","2016-06-15 23:53:00",NA,NA,"","También aprobamos con 86 votos en pro y 17 en contra, artículos reservados del dictamen referente a Fiscalía para el combate a la corrupción",41,6,0,0,0,"2016-09-25 10:26:05","2016-09-27 03:30:00",0,0
"2065",743228881222545408,470472926,"Wed Jun 15 23:49:08 +0000 2016","2016-06-15 23:49:08",NA,NA,"","Aprobamos en lo general con 100 votos, 6 en contra y 2 abstenciones dictamen referente a Fiscalía para el combate a la corrupción.",41,3,0,0,0,"2016-09-25 10:26:05","2016-09-27 03:30:00",0,0
"2066",743203926913101824,470472926,"Wed Jun 15 22:09:58 +0000 2016","2016-06-15 22:09:58",NA,NA,"","Continuamos con la sesión, ahora discutimos el dictamen que reforma Ley Orgánica de la @PGR_mx para el #CombatealaCorrupción.",43,2,0,0,0,"2016-09-25 10:26:05","2016-09-27 03:30:00",0,0
"2067",743173469391585280,470472926,"Wed Jun 15 20:08:57 +0000 2016","2016-06-15 20:08:57",NA,NA,"","Continuamos con el análisis y la discusión de la Ley Orgánica del Tribunal Federal de Justicia Administrativa.",42,1,0,0,0,"2016-09-25 10:26:05","2016-09-27 03:30:00",0,0
"2068",743173274377412608,470472926,"Wed Jun 15 20:08:10 +0000 2016","2016-06-15 20:08:10",NA,NA,"","Amigos buena tarde. En este momento se reanuda la sesión extraordinaria, nos pueden sintonizar por el @CanalCongreso.",3,2,0,0,0,"2016-09-25 10:26:05","2016-09-27 03:30:00",0,0
"2069",743122085552132096,470472926,"Wed Jun 15 16:44:46 +0000 2016","2016-06-15 16:44:46",NA,NA,"","¡Feliz cumpleaños amigos gobernador @Paco_Olvera! Te mando un abrazo con todo afecto.",3,1,0,0,0,"2016-09-25 10:26:05","2016-09-25 10:26:07",0,0
"2070",780497952959639552,470472926,"Mon Sep 26 20:03:07 +0000 2016","2016-09-26 20:03:07",NA,NA,"","RT @AngelicaAraujo: Hoy celebramos el Día Nacional de la Donación y Transplante de Órganos. Mi reconocimiento a todas esas personas que ayu…",4,0,0,0,0,"2016-09-27 03:29:59","2016-11-05 15:58:30",1,1
"2071",780874232775311360,470472926,"Tue Sep 27 20:58:19 +0000 2016","2016-09-27 20:58:19",NA,NA,"","Coincido con el Secretario @JoseAMeadeK, debemos impulsar la actividad económica con la simplificación fiscal para pequeñas empresas.",46,4,0,0,0,"2016-09-27 17:23:24","2016-11-15 03:59:08",0,0
"2072",780865921426391040,470472926,"Tue Sep 27 20:25:18 +0000 2016","2016-09-27 20:25:18",NA,NA,"","Para la implementación del Sistema Nacional Anticorrupción #SNA se acreditan más 9 mil 400 millones de pesos: @JoseAMeadeK",63,3,0,0,0,"2016-09-27 17:23:24","2016-11-15 03:59:08",0,0
"2073",780849621899763712,470472926,"Tue Sep 27 19:20:32 +0000 2016","2016-09-27 19:20:32",NA,NA,"","Continuamos con el desahogo de la comparecencia del Secretario @JoseAMeadeK, para tratar el análisis del tema econó… https://t.co/KXNjDq2tUI",66,9,0,0,0,"2016-09-27 17:23:24","2016-11-15 03:59:08",0,0
"2074",780824909811359744,470472926,"Tue Sep 27 17:42:20 +0000 2016","2016-09-27 17:42:20",NA,NA,"","Procedemos a las participaciones de los grupos parlamentarios en comparecencia del titular de la @SHCP_mx; @JoseAMeadeK.",61,2,0,0,0,"2016-09-27 17:23:30","2016-11-15 03:59:08",0,0
"2075",780824494604558336,470472926,"Tue Sep 27 17:40:41 +0000 2016","2016-09-27 17:40:41",NA,NA,"","RT @JoseAMeadeK: Con ánimo de apertura, sostendré hoy un diálogo franco y productivo en el @senadomexicano para revisar los desafíos de nue…",214,0,0,0,0,"2016-09-27 17:23:30","2016-11-14 06:46:51",1,1
"2076",780823207393714176,470472926,"Tue Sep 27 17:35:34 +0000 2016","2016-09-27 17:35:34",NA,NA,"","Los invito a seguir la comparecencia del titular de la @SHCP_mx, @JoseAMeadeK, ante el Pleno del @senadomexicano: https://t.co/OT3zc468pK",62,2,0,0,0,"2016-09-27 17:23:30","2016-11-14 06:46:51",0,0
"2077",780808848336494592,470472926,"Tue Sep 27 16:38:30 +0000 2016","2016-09-27 16:38:30",NA,NA,"","Amigos, ya comenzamos la sesión ordinaria del día de hoy, pueden seguir los trabajos del orden del día, por aquí: https://t.co/OT3zc468pK",63,2,0,0,0,"2016-09-27 17:23:37","2016-11-14 06:46:51",0,0
"2078",780775580039909376,470472926,"Tue Sep 27 14:26:19 +0000 2016","2016-09-27 14:26:19",NA,NA,"","RT @cultura_mx: #Michoacán: ""Cincuenta años de Farabeuf"",  110 piezas dan cuenta de la importancia de esta obra de Salvador Elizondo en #MA…",10,0,0,0,0,"2016-09-27 17:23:37","2016-11-14 06:46:51",1,1
"2079",780770149691301888,470472926,"Tue Sep 27 14:04:44 +0000 2016","2016-09-27 14:04:44",NA,NA,"","RT @laaficion: ¡Hoy tenemos futbol para dar y regalar! No te pierdas los mejores partidos de hoy con nuestra #AgendaFutbolera ⚽️  https://t…",27,0,0,0,0,"2016-09-27 17:23:37","2016-11-05 15:58:30",1,1
"2080",780757299337924608,470472926,"Tue Sep 27 13:13:40 +0000 2016","2016-09-27 13:13:40",NA,NA,"","Feliz cumpleaños amigo @HectorYunes, que sea de plenitud para ti y para tu familia. ¡Un abrazo!",60,2,0,0,0,"2016-09-27 17:23:37","2016-11-05 15:58:30",0,0
"2081",780756589313601536,470472926,"Tue Sep 27 13:10:51 +0000 2016","2016-09-27 13:10:51",NA,NA,"","Como un apartado en la sesión de hoy, atenderemos la comparecencia del titular de la @SHCP_mx, el Secretario @JoseAMeadeK.",62,0,0,0,0,"2016-09-27 17:23:37","2016-11-05 15:58:30",0,0
"2082",780755752797425664,470472926,"Tue Sep 27 13:07:31 +0000 2016","2016-09-27 13:07:31",112255125,780755596525998080,"pcesarmendez","Un abrazo con afecto @pcesarmendez.",3,0,0,0,0,"2016-09-27 17:23:37","2016-11-05 15:58:30",0,0
"2083",780755466288635904,470472926,"Tue Sep 27 13:06:23 +0000 2016","2016-09-27 13:06:23",NA,NA,"","¡Buen día amigos! Excelente martes, que sea productiva la jornada en sus labores.",65,3,0,0,0,"2016-09-27 17:23:38","2016-11-05 15:58:30",0,0
"2084",780979100479389696,470472926,"Wed Sep 28 03:55:02 +0000 2016","2016-09-28 03:55:02",NA,NA,"","Sesión Ordinaria, martes 27 de Septiembre. https://t.co/R6e3NZDRcP",41,2,0,0,0,"2016-09-28 19:14:40","2016-11-15 03:59:08",0,0
"2085",780978184787415040,470472926,"Wed Sep 28 03:51:23 +0000 2016","2016-09-28 03:51:23",NA,NA,"","Un gusto saludar el día de hoy, al secretario de Hacienda @JoseAMeadeK. https://t.co/SefFnpJxYN",42,9,0,0,0,"2016-09-28 19:14:40","2016-11-15 03:59:08",0,0
"2086",780883859080523776,470472926,"Tue Sep 27 21:36:34 +0000 2016","2016-09-27 21:36:34",NA,NA,"","También concluye la sesión y nos citan a la siguiente, el jueves 29 de septiembre a las 11 horas. ¡Buena tarde!",43,2,0,0,0,"2016-09-28 19:14:40","2016-11-15 03:59:08",0,0
"2087",780883705266974720,470472926,"Tue Sep 27 21:35:58 +0000 2016","2016-09-27 21:35:58",NA,NA,"","Concluye la comparecencia del encargado de la política económica del país.",42,2,0,0,0,"2016-09-28 19:14:40","2016-11-15 03:59:08",0,0
"2088",780883499192492032,470472926,"Tue Sep 27 21:35:08 +0000 2016","2016-09-27 21:35:08",NA,NA,"","No se puede hablar de crisis en una economía que crece, que genera empleos; puntualiza el titular de la @SHCP_mx, @JoseAMeadeK",44,2,0,0,0,"2016-09-28 19:14:40","2016-11-15 03:59:08",0,0
"2089",781576786685497344,470472926,"Thu Sep 29 19:30:01 +0000 2016","2016-09-29 19:30:01",NA,NA,"","Ahora analizamos el dictamen que expide Ley General de Asentamientos Humanos, Ordenamiento Territorial y Desarrollo Urbano.",6,7,0,0,0,"2016-10-01 20:44:41","2016-11-16 11:55:58",0,0
"2090",781574423388106752,470472926,"Thu Sep 29 19:20:38 +0000 2016","2016-09-29 19:20:38",NA,NA,"","Con dicha aprobación se dotará al @CanalCongreso de un marco jurídico acorde a su operación y de la autonomía técnica y de gestión.",45,5,0,0,0,"2016-10-01 20:44:41","2016-11-16 11:55:58",0,0
"2091",781574140213940224,470472926,"Thu Sep 29 19:19:30 +0000 2016","2016-09-29 19:19:30",NA,NA,"","Con 84 votos a favor, hemos aprobado el dictamen sobre la autonomía del @CanalCongreso.",45,3,0,0,0,"2016-10-01 20:44:41","2016-11-16 11:55:58",0,0
"2092",781537036507369472,470472926,"Thu Sep 29 16:52:04 +0000 2016","2016-09-29 16:52:04",NA,NA,"","Amigos, ya iniciamos la sesión ordinaria de hoy, los invito a seguir nuestros trabajos, por el siguiente enlace: https://t.co/mTsseNuEis",43,2,0,0,0,"2016-10-01 20:44:41","2016-11-16 11:55:58",0,0
"2093",781532217486913536,470472926,"Thu Sep 29 16:32:55 +0000 2016","2016-09-29 16:32:55",NA,NA,"","Les comparto los asuntos programados, para la sesión del día de hoy amigos:      https://t.co/gbUEmlprdg",42,1,0,0,0,"2016-10-01 20:44:48","2016-11-15 03:59:08",0,0
"2094",781479473942192128,470472926,"Thu Sep 29 13:03:20 +0000 2016","2016-09-29 13:03:20",NA,NA,"","Amigos, buen día. ¡Excelente  jueves para todos!",42,1,0,0,0,"2016-10-01 20:44:48","2016-11-15 03:59:08",0,0
"2095",781479050166415360,470472926,"Thu Sep 29 13:01:39 +0000 2016","2016-09-29 13:01:39",NA,NA,"","RT @gobmx: ¡El 29 de septiembre de 1934 abrió sus puertas el Palacio de Bellas Artes!

@PalacioOficial 

@cultura_mx @bellasartesinba https…",241,0,0,0,0,"2016-10-01 20:44:48","2016-11-15 03:59:08",1,1
"2096",786617077792505856,470472926,"Thu Oct 13 17:18:20 +0000 2016","2016-10-13 17:18:20",NA,NA,"","Aprobamos con 89 votos el dictamen sobre participación de integrantes del Ejército y Fuerza Aérea en competencia “CAMBRIAN PATROLS""en el RU.",61,2,0,0,0,"2016-10-13 20:17:13","2016-12-07 13:26:02",0,0
"2097",786613330827841536,470472926,"Thu Oct 13 17:03:27 +0000 2016","2016-10-13 17:03:27",NA,NA,"","Aprobamos  en lo gral. el dictamen que expide la Ley General de Asentamientos Humanos, Ordenamiento Territorial y Desarrollo Urbano.",63,3,0,0,0,"2016-10-13 20:17:13","2016-12-07 13:26:02",0,0
"2098",786611482188316672,470472926,"Thu Oct 13 16:56:06 +0000 2016","2016-10-13 16:56:06",NA,NA,"","RT @PRI_Nacional: ¿Conoces la Técnica de autoexploración de senos? Aquí te la compartimos. Mes de lucha contra el cáncer de mama. https://t…",85,0,0,0,0,"2016-10-13 20:17:13","2016-12-07 13:26:02",1,1
"2099",786605840614592512,470472926,"Thu Oct 13 16:33:41 +0000 2016","2016-10-13 16:33:41",NA,NA,"","Después de nuestra reunión de comisión, nos incorporamos a la sesión de hoy, aquí nos pueden seguir #EnVivo:  https://t.co/T3BpdB99J2",62,3,0,0,0,"2016-10-13 20:17:13","2016-12-07 13:26:02",0,0
"2100",786594416718864384,470472926,"Thu Oct 13 15:48:17 +0000 2016","2016-10-13 15:48:17",NA,NA,"","¡Envío un abrazo de felicitación con todo afecto al Secretario del Trabajo Alfonso @navarreteprida, por motivo de su cumpleaños!",24,3,0,0,0,"2016-10-13 20:17:14","2016-12-07 13:26:02",0,0
"2101",786594052477063168,470472926,"Thu Oct 13 15:46:50 +0000 2016","2016-10-13 15:46:50",NA,NA,"","La reunión del Pdte. @EPN y el PM de Finlandia, Juha Sipilä, da un renovado impulso a los vínculos entre naciones. https://t.co/bB47gRQKSe",23,3,0,0,0,"2016-10-13 20:17:14","2016-12-07 13:26:02",0,0
"2102",786585809650528256,470472926,"Thu Oct 13 15:14:05 +0000 2016","2016-10-13 15:14:05",NA,NA,"","Amigos, estoy participando en la reunión de Comisión de Relaciones exteriores Asia-Pacífico, los invito a seguirnos https://t.co/PAn1Q6BZaM",26,4,0,0,0,"2016-10-13 20:17:20","2016-12-07 13:26:02",0,0
"2103",786584424410296320,470472926,"Thu Oct 13 15:08:35 +0000 2016","2016-10-13 15:08:35",NA,NA,"","Aquí comparto con Ustedes, los temas que habremos de tratar en la sesión de hoy amigos. https://t.co/6Er1UZCsBI",25,6,0,0,0,"2016-10-13 20:17:21","2016-12-07 13:26:02",0,0
