"","id_tweet","id_twitter","created_at","created_at_datetime","in_reply_to_user_id","in_reply_to_status_id","in_reply_to_screen_name","text","retweet_count","favorite_count","longitude","latitude","retweeted","creation_date","modification_date","RT_temp","is_retweeted"
"645",648867163906805760,470472926,"Tue Sep 29 14:29:21 +0000 2015","2015-09-29 14:29:21",NA,NA,"","En la sesión del día de hoy.  https://t.co/Fo0Q5kSdks",24,3,0,0,0,"2015-09-29 10:40:53","2015-10-21 13:41:19",0,NA
"646",648893642791251968,470472926,"Tue Sep 29 16:14:34 +0000 2015","2015-09-29 16:14:34",NA,NA,"","En unos minutos daremos inicio a la sesión en el @senadomexicano
Les comparto el Orden del Día http://t.co/pKB6GCg2jK",67,5,0,0,0,"2015-10-01 14:40:12","2015-10-21 13:41:19",0,NA
"647",648900147460489216,470472926,"Tue Sep 29 16:40:25 +0000 2015","2015-09-29 16:40:25",NA,NA,"","Iniciamos la sesión del Senado de la República, aquí puedes seguirnos  #EnVivo https://t.co/mP4M02E8Du …",68,4,0,0,0,"2015-10-01 14:40:11","2015-10-21 13:41:19",0,NA
"648",648902025191682048,470472926,"Tue Sep 29 16:47:53 +0000 2015","2015-09-29 16:47:53",NA,NA,"","En votación económica aprobamos el acuerdo que establece las normas para el análisis del #TercerInforme de Gobierno.",67,6,0,0,0,"2015-10-01 14:40:11","2015-10-21 13:41:19",0,NA
"649",648903667320360960,470472926,"Tue Sep 29 16:54:24 +0000 2015","2015-09-29 16:54:24",NA,NA,"","Se declara un receso para recibir al titular de @SEGOB_mx, @osoriochong para analizar la #PolíticaInterior en el marco del #TercerInforme.",64,4,0,0,0,"2015-10-01 14:40:11","2015-10-21 13:41:19",0,NA
"650",648909412661248000,470472926,"Tue Sep 29 17:17:14 +0000 2015","2015-09-29 17:17:14",NA,NA,"","Iniciamos la comparecencia del secretario de Gobernación #Segob, @osoriochong , con motivo de la Glosa al #TercerInforme",66,4,0,0,0,"2015-10-01 14:40:11","2015-10-21 13:41:19",0,NA
"651",648919838820188160,470472926,"Tue Sep 29 17:58:40 +0000 2015","2015-09-29 17:58:40",NA,NA,"","""Ni perdón para los culpables ni olvido para las víctimas de #Ayotzinapa"": @OsorioChong en su comparecencia: #GlosaTercerInforme",70,7,0,0,0,"2015-10-01 14:40:11","2015-10-21 13:41:19",0,NA
"652",648934194022711296,470472926,"Tue Sep 29 18:55:43 +0000 2015","2015-09-29 18:55:43",NA,NA,"","#GlosaTercerInforme seguimos con la comparecencia de @osoriochong po el @Senado_PRI hace uso de la voz mi compañera  Cristina Diaz.",62,5,0,0,0,"2015-10-01 14:40:11","2015-10-21 13:41:19",0,NA
"653",648943998485164032,470472926,"Tue Sep 29 19:34:40 +0000 2015","2015-09-29 19:34:40",NA,NA,"","En el Consejo Nacional de Seguridad se acordó desarrollar una política nacional penitenciaria, con protocolos homologados: @osoriochong.",62,4,0,0,0,"2015-10-01 14:40:11","2015-10-21 13:41:19",0,NA
"654",648951381911470080,470472926,"Tue Sep 29 20:04:01 +0000 2015","2015-09-29 20:04:01",NA,NA,"","Seguimos con la formulación preguntas al titular de @SEGOB_mx, en representación del @Senado_PRI hace uso de la tribuna el @HectorYunes",59,4,0,0,0,"2015-10-01 14:40:11","2015-10-21 13:41:19",0,NA
"655",648952413571813376,470472926,"Tue Sep 29 20:08:07 +0000 2015","2015-09-29 20:08:07",NA,NA,"","RT @Senado_PRI: #EnVivo | Más que solidarizarnos con los mexicanos que deportan, tenemos acciones para darles las oportunidades que merecen…",7,0,0,0,0,"2015-10-01 14:40:11","2015-10-21 13:41:19",1,NA
"656",648965271445635072,470472926,"Tue Sep 29 20:59:12 +0000 2015","2015-09-29 20:59:12",NA,NA,"","Seguimos en el Pleno del @senadomexicano, con el desahogo de la comparecencia del titular de la @SEGOB_mx.",63,5,0,0,0,"2015-10-01 14:40:11","2015-10-21 13:41:19",0,NA
"657",648973910692630528,470472926,"Tue Sep 29 21:33:32 +0000 2015","2015-09-29 21:33:32",NA,NA,"","#GlosaTercerInforme Roberto Gil, Presidente de la Mesa Directiva da por terminada la comparecencia del titular de @SEGOB_mx",41,3,0,0,0,"2015-10-01 14:40:11","2015-10-21 13:41:19",0,NA
"658",648974047250792448,470472926,"Tue Sep 29 21:34:04 +0000 2015","2015-09-29 21:34:04",NA,NA,"","Termina la sesión y se cita para la siguiente, mañana, 30 de septiembre a las 11 horas en la que comparecerá el titular de la @SEP_mx.",0,2,0,0,0,"2015-10-01 14:40:11","2015-10-21 13:41:19",0,NA
"659",649207457051340800,470472926,"Wed Sep 30 13:01:34 +0000 2015","2015-09-30 13:01:34",NA,NA,"","¡Amigos buenos días! Hoy nuestro #Morelia está de fiesta, en conmemoración al 250 aniversario de Don José María #Morelos.",42,10,0,0,0,"2015-10-01 14:40:10","2015-10-21 13:41:19",0,NA
"660",649208532936491008,470472926,"Wed Sep 30 13:05:50 +0000 2015","2015-09-30 13:05:50",NA,NA,"","Comparto con ustedes las actividades de hoy en el @senadomexicano. ¡Buen día! http://t.co/xge7R8LHBL",43,3,0,0,0,"2015-10-01 14:40:10","2015-10-21 13:41:19",0,NA
"661",649230626931871744,470472926,"Wed Sep 30 14:33:38 +0000 2015","2015-09-30 14:33:38",NA,NA,"","Un abrazo con todo afecto y estima para mi amigo senador @MBarbosaMX, por su cumpleaños. ¡Felicidades!",0,4,0,0,0,"2015-10-01 14:40:10","2015-10-21 13:41:19",0,NA
"662",649249285679157248,470472926,"Wed Sep 30 15:47:46 +0000 2015","2015-09-30 15:47:46",NA,NA,"","""No hay otra nobleza que la de la virtud, el saber, el patriotismo y la caridad"". #JoséMaríaMorelos 250 Aniversario. http://t.co/fvv2Ej4RjC",77,16,0,0,0,"2015-10-01 14:40:10","2015-10-21 13:41:19",0,NA
"663",649257668238962688,470472926,"Wed Sep 30 16:21:05 +0000 2015","2015-09-30 16:21:05",NA,NA,"","En unos minutos comenzaremos la sesión de hoy. Hoy recibiremos en el @senadomexicano al Secretario @aurelionuno, titular de la @SEP_mx",44,2,0,0,0,"2015-10-01 14:40:10","2015-10-21 13:41:19",0,NA
"664",649262847130636288,470472926,"Wed Sep 30 16:41:40 +0000 2015","2015-09-30 16:41:40",NA,NA,"","Iniciamos la sesión en el Senado de la República. Aquí pueden seguirnos #EnVivo. https://t.co/crQssou3tL",4,2,0,0,0,"2015-10-01 14:40:10","2015-10-21 13:41:19",0,NA
"665",649267268208037888,470472926,"Wed Sep 30 16:59:14 +0000 2015","2015-09-30 16:59:14",NA,NA,"","Estamos por iniciar la comparecencia del titular de la @SEP_mx, @aurelionuno; #EnVivo https://t.co/crQssou3tL http://t.co/gNyttktmBR",42,2,0,0,0,"2015-10-01 14:40:10","2015-10-21 13:41:19",0,NA
"666",649270033814675456,470472926,"Wed Sep 30 17:10:13 +0000 2015","2015-09-30 17:10:13",NA,NA,"","El gran reto del siglo XXI es tener un sistema de educación, pública, laica y de calidad: @aurelionuno #TercerInforme",55,3,0,0,0,"2015-10-01 14:40:10","2015-10-21 13:41:19",0,NA
"667",649273841299025920,470472926,"Wed Sep 30 17:25:21 +0000 2015","2015-09-30 17:25:21",NA,NA,"","Iniciamos los posicionamientos de los grupos parlamentarios, en torno a la comparecencia del titular de la @SEP_mx",64,2,0,0,0,"2015-10-01 14:40:10","2015-10-21 13:41:19",0,NA
"668",649274675252490240,470472926,"Wed Sep 30 17:28:40 +0000 2015","2015-09-30 17:28:40",NA,NA,"","#AlertaSismica. Se declara un receso en la sesión",67,4,0,0,0,"2015-10-01 14:40:10","2015-10-21 13:41:19",0,NA
"669",649275659479453696,470472926,"Wed Sep 30 17:32:34 +0000 2015","2015-09-30 17:32:34",NA,NA,"","RT @SSP_CDMX: Despegan helicópteros de la policia capitalina ante #sismo. Conserve la calma y evacue estructuras. http://t.co/0DrOyj4qXW",167,0,0,0,0,"2015-10-01 14:40:09","2015-10-21 13:41:19",1,NA
"670",649275727930519552,470472926,"Wed Sep 30 17:32:51 +0000 2015","2015-09-30 17:32:51",NA,NA,"","RT @LUISFELIPE_P: Preliminar sismo magnitud 5.8 sentido en el la Ciudad de México al momento no se registran daños!",1159,0,0,0,0,"2015-10-01 14:40:09","2015-10-21 13:41:19",1,NA
"671",649282137535844352,470472926,"Wed Sep 30 17:58:19 +0000 2015","2015-09-30 17:58:19",NA,NA,"","Reanudamos la Sesión Ordinaria del #Senado; continúa comparecencia del titular de la #SEP, Aurelio Nuño, con motivo de #GlosaTercerInforme",26,6,0,0,0,"2015-10-01 14:40:09","2015-10-21 13:41:19",0,NA
"672",649298840911151104,470472926,"Wed Sep 30 19:04:41 +0000 2015","2015-09-30 19:04:41",NA,NA,"","Por nuestro GP @Mely_Romero hace uso de la tribuna para referirse al análisis de la #PolíticaSocial del titular de la @SEP_mx, @aurelionuno",25,7,0,0,0,"2015-10-01 14:40:09","2015-10-21 13:41:19",0,NA
"673",649304366583705600,470472926,"Wed Sep 30 19:26:39 +0000 2015","2015-09-30 19:26:39",NA,NA,"","Seguimos con el desahogo de la comparecencia. Inicia ronda de preguntas y respuestas al titular de la @SEP_mx, @aurelionuno.",21,1,0,0,0,"2015-10-01 14:40:09","2015-10-21 13:41:19",0,NA
"674",649317546387083264,470472926,"Wed Sep 30 20:19:01 +0000 2015","2015-09-30 20:19:01",NA,NA,"","Comparto con Ustedes, la efemeride que escribí en conmemoración al 250 Aniv. del ilustre Michoacano #JoséMaMorelos http://t.co/hr124Gp2pG",24,4,0,0,0,"2015-10-01 14:40:08","2015-10-21 13:41:19",0,NA
"675",649339801942913024,470472926,"Wed Sep 30 21:47:27 +0000 2015","2015-09-30 21:47:27",NA,NA,"","Una de las prioridades del @gobmx es una vinculación más eficiente entre el sector productivo y educativo: @aurelionuno #GlosaTercerInforme",24,3,0,0,0,"2015-10-01 14:40:08","2015-10-23 21:32:36",0,NA
"676",649341778391269376,470472926,"Wed Sep 30 21:55:18 +0000 2015","2015-09-30 21:55:18",NA,NA,"","Seguimos en el @senadomexicano, desahogando la comparecencia del titular de la @SEP_mx. ¡Buena tarde!",21,2,0,0,0,"2015-10-01 14:40:08","2015-10-23 21:32:36",0,NA
"677",649344081273876480,470472926,"Wed Sep 30 22:04:27 +0000 2015","2015-09-30 22:04:27",NA,NA,"","Voy a ser un Secretario de Educación Pública cercano al Congreso de la Unión, cercano a los senadores, los voy a escuchar: @aurelionuno.",17,2,0,0,0,"2015-10-01 14:40:08","2015-10-23 21:32:36",0,NA
"678",649345367536873472,470472926,"Wed Sep 30 22:09:34 +0000 2015","2015-09-30 22:09:34",NA,NA,"","Concluye comparecencia de @aurelionuno titular de la @SEP_mx ante el @senadomexicano.",1,2,0,0,0,"2015-10-01 14:40:08","2015-10-23 21:32:36",0,NA
"679",649345668134211584,470472926,"Wed Sep 30 22:10:46 +0000 2015","2015-09-30 22:10:46",NA,NA,"","Termina la sesión y se cita para la siguiente, el martes 6 de octubre a las 11 horas, en la que comparecerá la titular de @SRE_mx.",5,3,0,0,0,"2015-10-01 14:40:08","2015-10-23 21:32:36",0,NA
"680",649907706556354560,470472926,"Fri Oct 02 11:24:06 +0000 2015","2015-10-02 11:24:06",NA,NA,"","¡Buenos días amigos! Estoy por salir a Puerto Vallarta, para acompañar al Presidente @EPN, en la clausura del XXII del Comercio Exterior.",5,2,0,0,0,"2015-10-19 01:27:39","2015-10-23 21:32:36",0,NA
"681",650005233297297408,470472926,"Fri Oct 02 17:51:38 +0000 2015","2015-10-02 17:51:38",NA,NA,"","Estamos camino al evento con @EPN, Clausura del 22 Congreso del Comercio Exterior Mexicano y entrega del Premio Nacional de Exportación.",5,6,0,0,0,"2015-10-19 01:27:39","2015-10-23 21:32:36",0,NA
"682",651021563328790528,470472926,"Mon Oct 05 13:10:10 +0000 2015","2015-10-05 13:10:10",NA,NA,"","¡Amigos buenos días! Excelente inicio de semana. A entrarle con todo.",26,8,0,0,0,"2015-10-19 01:27:39","2015-10-23 21:32:36",0,NA
"683",651021925142020096,470472926,"Mon Oct 05 13:11:37 +0000 2015","2015-10-05 13:11:37",38321844,650330107723145216,"MariaElenaBT","Muchas gracias mi Senadora @MariaElenaBT. Será un espléndido evento. Te mando un abrazo amiga.",21,1,0,0,0,"2015-10-19 01:27:39","2015-10-23 21:32:36",0,NA
"684",651066790835937280,470472926,"Mon Oct 05 16:09:53 +0000 2015","2015-10-05 16:09:53",NA,NA,"","Felicidades al nuevo Director General de @Canal22, Lic. Ernesto Velázquez Briseño. Éxito en la encomienda.",23,1,0,0,0,"2015-10-19 01:27:39","2015-10-23 21:32:36",0,NA
"685",651204486489202688,470472926,"Tue Oct 06 01:17:03 +0000 2015","2015-10-06 01:17:03",NA,NA,"","Les comparto una foto del atardecer en mi Morelia. Desde la calzada Fray Antonio de San Miguel o de #SanDiego. http://t.co/X6wZixwdIh",74,23,0,0,0,"2015-10-19 01:27:39","2015-10-23 21:32:36",0,NA
"686",651258078193577984,470472926,"Tue Oct 06 04:50:00 +0000 2015","2015-10-06 04:50:00",NA,NA,"","Mañana tenemos sesión en el @senadomexicano. Seguimos con la Glosa del #TercerInforme. Comparece la titular de @SRE_mx mi amiga @ruizmassieu",63,6,0,0,0,"2015-10-19 01:27:39","2015-10-23 21:32:36",0,NA
"687",651258261279117312,470472926,"Tue Oct 06 04:50:43 +0000 2015","2015-10-06 04:50:43",NA,NA,"","Por hoy, vamos a descansar. Mañana nos leemos. ¡Buena noche!",62,11,0,0,0,"2015-10-19 01:27:39","2015-10-23 21:32:36",0,NA
"688",651385480584409088,470472926,"Tue Oct 06 13:16:15 +0000 2015","2015-10-06 13:16:15",NA,NA,"","¡Buen día amigos! Comenzando con toda la actitud nuestras actividades. Saludos.",25,3,0,0,0,"2015-10-19 01:27:39","2015-10-23 21:32:36",0,NA
"689",651389523885101056,470472926,"Tue Oct 06 13:32:19 +0000 2015","2015-10-06 13:32:19",NA,NA,"","Claudia Ruiz Massieu, titular de @SRE_mx, comparecerá hoy ante el #Senado, en vivo por @CanalCongreso http://t.co/dgUG6MrwOA",23,2,0,0,0,"2015-10-19 01:27:39","2015-10-23 21:32:36",0,NA
"690",651394834180083712,470472926,"Tue Oct 06 13:53:25 +0000 2015","2015-10-06 13:53:25",NA,NA,"","La mejor medicina contra el #CáncerDeMama, es la prevención. ¡Autoexplórate! http://t.co/cJy127k0cs",71,13,0,0,0,"2015-10-19 01:27:39","2015-10-23 21:32:36",0,NA
"691",651431557459148800,470472926,"Tue Oct 06 16:19:20 +0000 2015","2015-10-06 16:19:20",NA,NA,"","Comparto con ustedes los asuntos del Orden del Día de la sesión de #HoyEnElSenado. http://t.co/GriTIaXBy0",65,4,0,0,0,"2015-10-19 01:27:38","2015-10-23 21:32:36",0,NA
"692",651442346270130176,470472926,"Tue Oct 06 17:02:13 +0000 2015","2015-10-06 17:02:13",NA,NA,"","Iniciamos la Sesión Ordinaria en el Senado, aquí puede seguir las transmisión #EnVivo:
http://t.co/CVAjTtp8EJ",63,5,0,0,0,"2015-10-19 01:27:38","2015-10-23 21:32:36",0,NA
"693",651443689974185984,470472926,"Tue Oct 06 17:07:33 +0000 2015","2015-10-06 17:07:33",NA,NA,"","Después de nombrar una comisión de cortesía para recibir a la Canciller Claudia @ruizmassieu, se decreta un receso en la sesión.",63,5,0,0,0,"2015-10-19 01:27:38","2015-10-23 21:32:36",0,NA
"694",651444379920433152,470472926,"Tue Oct 06 17:10:18 +0000 2015","2015-10-06 17:10:18",NA,NA,"","RT @ruizmassieu: Hoy compareceré ante el @senadomexicano con motivo de la glosa del #TercerInforme.  #MéxicoGlobal",122,0,0,0,0,"2015-10-19 01:27:38","2015-10-23 21:32:36",1,NA
"695",651444750432624640,470472926,"Tue Oct 06 17:11:46 +0000 2015","2015-10-06 17:11:46",NA,NA,"","Se reanuda Sesión, para iniciar la comparecencia de la titular de la @SRE_mx, la maestra Claudia @ruizmassieu.",66,6,0,0,0,"2015-10-19 01:27:38","2015-10-23 21:32:36",0,NA
"696",651449086789312512,470472926,"Tue Oct 06 17:29:00 +0000 2015","2015-10-06 17:29:00",NA,NA,"","La #PolíticaExterior tiene por objeto fortalecer la presencia de #México en el mundo"" Claudia @ruizmassieu",63,3,0,0,0,"2015-10-19 01:27:38","2015-10-23 21:32:36",0,NA
"697",651453153712340992,470472926,"Tue Oct 06 17:45:09 +0000 2015","2015-10-06 17:45:09",NA,NA,"","Seguimos con los posicionamientos de Grupos Parlamentarios sobre la presentación de la titular de la @SRE_mx, la Canciller @ruizmassieu.",61,4,0,0,0,"2015-10-19 01:27:38","2015-10-23 21:32:36",0,NA
"698",651461615481524224,470472926,"Tue Oct 06 18:18:47 +0000 2015","2015-10-06 18:18:47",NA,NA,"","Para fijar la postura sobre #PolíticaExterior de parte de nuestro Grupo Parlamentario, @Senado_PRI, hace uso de la Tribuna @MarcelaGuerraNL",23,2,0,0,0,"2015-10-19 01:27:38","2015-10-23 21:32:36",0,NA
"699",651464580346941440,470472926,"Tue Oct 06 18:30:34 +0000 2015","2015-10-06 18:30:34",NA,NA,"","Iniciamos la primera ronda de preguntas y respuestas en comparecencia de la titular de @SRE_mx",62,3,0,0,0,"2015-10-19 01:27:38","2015-10-23 21:32:36",0,NA
"700",651472960566358016,470472926,"Tue Oct 06 19:03:52 +0000 2015","2015-10-06 19:03:52",NA,NA,"","Espléndida reflexión de mi compañera senadora @LuzMaBeristain, sobre el trabajo y la trayectoria de la canciller @ruizmassieu. ????????????????????????",22,4,0,0,0,"2015-10-19 01:27:38","2015-10-23 21:32:36",0,NA
"701",651479299569008640,470472926,"Tue Oct 06 19:29:03 +0000 2015","2015-10-06 19:29:03",NA,NA,"","Contamos con la red consular más robusta y reconocida a nivel mundial: @ruizmassieu",23,1,0,0,0,"2015-10-19 01:27:38","2015-10-27 19:20:33",0,NA
"702",651488285764640768,470472926,"Tue Oct 06 20:04:46 +0000 2015","2015-10-06 20:04:46",282203918,NA,"ruizmassieu","@ruizmassieu refiere que mexicanos que viajen al exterior deben estar informados, ""vamos a instrumentar una campaña de viajero responsable""",22,4,0,0,0,"2015-10-19 01:27:38","2015-10-28 03:39:29",0,NA
"703",651495552664793088,470472926,"Tue Oct 06 20:33:38 +0000 2015","2015-10-06 20:33:38",NA,NA,"","México tiene un compromiso de construir un andamiaje de política para atender el fenómeno de la migración: @ruizmassieu",22,3,0,0,0,"2015-10-19 01:27:37","2015-10-28 03:39:29",0,NA
"704",651501768325533696,470472926,"Tue Oct 06 20:58:20 +0000 2015","2015-10-06 20:58:20",NA,NA,"","Seguiremos desplegando una #PolíticaExteior responsable, proactiva y productiva en beneficio de los mexicanos: @ruizmassieu.",25,2,0,0,0,"2015-10-19 01:27:37","2015-10-28 03:39:29",0,NA
"705",651508919156649984,470472926,"Tue Oct 06 21:26:45 +0000 2015","2015-10-06 21:26:45",NA,NA,"","Se levanta la sesión y se cita para el día de mañana 7 de octubre a las 11 horas. Para la comparecencia del titular de la @SHCP_mx",22,3,0,0,0,"2015-10-19 01:27:37","2015-10-28 03:39:29",0,NA
"706",651609226427547648,470472926,"Wed Oct 07 04:05:20 +0000 2015","2015-10-07 04:05:20",NA,NA,"","Mañana comparecerá el titular de @SHCP_mx, @LVidegaray para analizar la #PolíticaEconómica de nuestro país. #TercerInforme.",2,3,0,0,0,"2015-10-19 01:27:37","2015-10-28 03:39:29",0,NA
"707",651621067778199552,470472926,"Wed Oct 07 04:52:23 +0000 2015","2015-10-07 04:52:23",NA,NA,"","Antes de despedirme les comparto una foto del @senadomexicano, iluminado de rosa. #CáncerDeMama http://t.co/70VKgEU9fM",6,2,0,0,0,"2015-10-19 01:27:37","2015-10-28 03:39:29",0,NA
"708",651756768092024832,470472926,"Wed Oct 07 13:51:37 +0000 2015","2015-10-07 13:51:37",NA,NA,"","Buenos días amigos. Hoy tenemos sesión. Comparece el titular de la @SHCP_mx, para analizar la política económica del país.",1,1,0,0,0,"2015-10-19 01:27:37","2015-10-28 03:39:29",0,NA
"709",651757525067366400,470472926,"Wed Oct 07 13:54:37 +0000 2015","2015-10-07 13:54:37",NA,NA,"","Felicidades estimada Senadora. @Marce_Torres7 le envió un abrazo por su cumpleaños.",1,2,0,0,0,"2015-10-19 01:27:37","2015-10-28 03:39:29",0,NA
"710",651783058065002496,470472926,"Wed Oct 07 15:36:05 +0000 2015","2015-10-07 15:36:05",NA,NA,"","Felicidades a la secretaria general del @CDEPRIMICH, mi amiga @YanitziPalomo, por su cumpleaños. Un abrazo.",3,4,0,0,0,"2015-10-19 01:27:37","2015-10-28 03:39:29",0,NA
"711",651788568772280320,470472926,"Wed Oct 07 15:57:59 +0000 2015","2015-10-07 15:57:59",NA,NA,"","El @IBDSenado nos comparte la Gaceta Plus, síntesis de los asuntos agendados en la Sesión. http://t.co/qB5ncRNqHd. http://t.co/7dVHkozxZB",22,0,0,0,0,"2015-10-19 01:27:37","2015-10-28 03:39:29",0,NA
"712",651788773659795456,470472926,"Wed Oct 07 15:58:47 +0000 2015","2015-10-07 15:58:47",NA,NA,"","RT @IBDSenado: #Efemérides Hoy conmemoramos el sacrificio del Senador #Belisario #Domínguez, prócer de la libertad de expresión. http://t.c…",20,0,0,0,0,"2015-10-19 01:27:37","2015-10-28 03:39:29",1,NA
"713",651800079825682432,470472926,"Wed Oct 07 16:43:43 +0000 2015","2015-10-07 16:43:43",NA,NA,"","Iniciamos la sesión en el @senadomexicano. Aquí pueden seguir la transmisión #EnVivo https://t.co/CAGeOcAQ6b",22,2,0,0,0,"2015-10-19 01:27:36","2015-10-28 03:39:29",0,NA
"714",651800413096689664,470472926,"Wed Oct 07 16:45:03 +0000 2015","2015-10-07 16:45:03",NA,NA,"","Mi compañera @SoyBlancaAlcala  presenta una iniciativa, que reforma la Ley de Protección al Ahorro Bancario.",22,2,0,0,0,"2015-10-19 01:27:36","2015-10-28 03:39:29",0,NA
"715",651816504128724992,470472926,"Wed Oct 07 17:48:59 +0000 2015","2015-10-07 17:48:59",NA,NA,"","Iniciamos posicionamientos de Grupos Parlamentarios sobre la comparecencia del titular de la @SHCP_mx, @LVidegaray. https://t.co/CAGeOcAQ6b",23,2,0,0,0,"2015-10-19 01:27:36","2015-10-28 03:39:29",0,NA
"716",651825327841214464,470472926,"Wed Oct 07 18:24:03 +0000 2015","2015-10-07 18:24:03",NA,NA,"","Buscamos  evitar que socios del TPP manipulen tipos de cambio para generar una ventaja desleal contra exportaciones mexicanas: @LVidegaray.",22,1,0,0,0,"2015-10-19 01:27:36","2015-10-28 03:39:29",0,NA
"717",651839137473892352,470472926,"Wed Oct 07 19:18:55 +0000 2015","2015-10-07 19:18:55",NA,NA,"","La región fronteriza hoy está haciendo un mayor esfuerzo de contribución al gasto público federal: @LVidegaray Glosa #TercerInforme",24,4,0,0,0,"2015-10-19 01:27:36","2015-10-28 03:39:29",0,NA
"718",651841263105282048,470472926,"Wed Oct 07 19:27:22 +0000 2015","2015-10-07 19:27:22",NA,NA,"","Un logro de la #ReformaHacendaria,  es que los ingresos tributarios superan por primera vez el 13% del PIB: @LVidegaray",24,2,0,0,0,"2015-10-19 01:27:36","2015-10-28 03:39:29",0,NA
"719",651841744552628224,470472926,"Wed Oct 07 19:29:17 +0000 2015","2015-10-07 19:29:17",NA,NA,"","Se creció  económicamente tras el  primer año de aplicación de la #ReformaHacendaria e inversión creció 2.3% en 2014: @LVidegaray",23,1,0,0,0,"2015-10-19 01:27:36","2015-10-28 03:39:29",0,NA
"720",651846308043448320,470472926,"Wed Oct 07 19:47:25 +0000 2015","2015-10-07 19:47:25",NA,NA,"","Las empresas públicas como privadas pueden acceder a fideicomisos para infraestructura en materia energética: @LVidegaray",21,1,0,0,0,"2015-10-19 01:27:36","2015-10-28 03:39:29",0,NA
"721",651851834080911360,470472926,"Wed Oct 07 20:09:22 +0000 2015","2015-10-07 20:09:22",NA,NA,"","La deducción inmediata de inversiones es como un financiamiento fiscal para contribuyentes, principalmente #PyMEs: @LVidegaray",22,2,0,0,0,"2015-10-19 01:27:36","2015-10-28 03:39:29",0,NA
"722",651858732712759296,470472926,"Wed Oct 07 20:36:47 +0000 2015","2015-10-07 20:36:47",NA,NA,"","RT @CanalCongreso: Continúa la Comparecencia de @lvidegaray, titular de @SHCP_mx, #EnVivo por @CanalCongreso y http://t.co/2X4ltPh7xJ http:…",6,0,0,0,0,"2015-10-19 01:27:35","2015-10-28 03:39:29",1,NA
"723",651872318398947328,470472926,"Wed Oct 07 21:30:46 +0000 2015","2015-10-07 21:30:46",NA,NA,"","Seguimos desahogando la comparecencia de @LVidegaray, titular de @SHCP_mx.",22,3,0,0,0,"2015-10-19 01:27:35","2015-10-28 03:39:29",0,NA
"724",651876746325700608,470472926,"Wed Oct 07 21:48:22 +0000 2015","2015-10-07 21:48:22",NA,NA,"","En un entorno como el que está viviendo el mundo sería poco prudente seguir por el camino de incrementar el déficit: @LVidegaray",23,3,0,0,0,"2015-10-19 01:27:35","2015-10-29 04:16:16",0,NA
"725",651881192229175296,470472926,"Wed Oct 07 22:06:02 +0000 2015","2015-10-07 22:06:02",NA,NA,"","Concluimos los trabajos de la comparecencia del titular de la @SHCP_mx y también concluimos la sesión. Buena tarde.",21,2,0,0,0,"2015-10-19 01:27:35","2015-10-29 04:16:16",0,NA
"726",651945193592086528,470472926,"Thu Oct 08 02:20:21 +0000 2015","2015-10-08 02:20:21",3272010060,651879124286353408,"AlfredoAnayaO","@AlfredoAnayaO Saludos Fredy, espero verte pronto amigo.",0,1,0,0,0,"2015-10-19 01:27:35","2015-10-29 04:16:16",0,NA
"727",652123592394608640,470472926,"Thu Oct 08 14:09:14 +0000 2015","2015-10-08 14:09:14",NA,NA,"","¡Buen día amigos! Ya estoy rumbo al @senadomexicano, para comenzar las actividades de hoy. Éxito a todos.",14,1,0,0,0,"2015-10-19 01:27:35","2015-10-29 04:16:16",0,NA
"728",652141045703032832,470472926,"Thu Oct 08 15:18:36 +0000 2015","2015-10-08 15:18:36",NA,NA,"","Mi querida Senadora @SoyBlancaAlcala, te mando un abrazo con todo afecto. ¡Feliz cumpleaños!",21,1,0,0,0,"2015-10-19 01:27:35","2015-10-29 04:16:16",0,NA
"729",652141707954294784,470472926,"Thu Oct 08 15:21:14 +0000 2015","2015-10-08 15:21:14",NA,NA,"","En la sesión de hoy, analizaremos la #PolíticaInterior, con @ArelyGomezGlz, titular de la @PGR_mx.",61,2,0,0,0,"2015-10-19 01:27:35","2015-10-29 04:16:16",0,NA
"730",652160025637490688,470472926,"Thu Oct 08 16:34:01 +0000 2015","2015-10-08 16:34:01",NA,NA,"","Iniciamos la sesión ordinaria del día de hoy, aquí pueden seguir los trabajos #EnVIVO https://t.co/r0QzRAqawq",24,3,0,0,0,"2015-10-19 01:27:34","2015-10-29 04:16:16",0,NA
"731",652160533693501440,470472926,"Thu Oct 08 16:36:02 +0000 2015","2015-10-08 16:36:02",NA,NA,"","Se turna a comisiones de Pesca y Acuacultura y de Estudios Legislativos iniciativa presentada por mi compañera @DivaGastelum",65,5,0,0,0,"2015-10-19 01:27:34","2015-10-29 22:30:07",0,NA
"732",652167789017300992,470472926,"Thu Oct 08 17:04:52 +0000 2015","2015-10-08 17:04:52",NA,NA,"","RT @ArelyGomezGlz: La #rendicióndecuentas es fundamental para el ejercicio de gobierno y para la consolidación de una democracia participat…",37,0,0,0,0,"2015-10-19 01:27:34","2015-10-29 22:30:07",1,NA
"733",652168287053189120,470472926,"Thu Oct 08 17:06:50 +0000 2015","2015-10-08 17:06:50",NA,NA,"","En estos momentos recibimos en el Pleno del @senadomexicano, a la titular de la @PGR_mx @ArelyGomezGlz. Estamos por iniciar su comparecencia",63,3,0,0,0,"2015-10-19 01:27:34","2015-10-30 22:01:19",0,NA
"734",652169312837308416,470472926,"Thu Oct 08 17:10:55 +0000 2015","2015-10-08 17:10:55",NA,NA,"","RT @turismo_mich: La #MariposaMonarca promocionándose en el metro de Londres #México #VíveloparaCreerlo #esMichoacán #elAlmadeMéxico http:/…",45,0,0,0,0,"2015-10-19 01:27:34","2015-10-30 22:01:19",1,NA
"735",652172372917661696,470472926,"Thu Oct 08 17:23:05 +0000 2015","2015-10-08 17:23:05",NA,NA,"","RT @NoticiasMVS: Comparece @ArelyGomezGlz, titular de la @PGR_mx ante el @senadomexicano por glosa del #TercerInforme de @EPN http://t.co/G…",3,0,0,0,0,"2015-10-19 01:27:34","2015-10-30 22:01:19",1,NA
