"","id_tweet","id_twitter","created_at","created_at_datetime","in_reply_to_user_id","in_reply_to_status_id","in_reply_to_screen_name","text","retweet_count","favorite_count","longitude","latitude","retweeted","creation_date","modification_date","RT_temp","is_retweeted"
"1283",674737537118679040,470472926,"Wed Dec 09 23:48:59 +0000 2015","2015-12-09 23:48:59",NA,NA,"","Concluye la sesión por hoy amigos, nos citan a la de mañana a las 11:00 horas. ¡Buenas y frías tardes!",60,3,0,0,0,"2015-12-11 01:31:27","2016-02-08 10:47:15",0,NA
"1284",674728849700089856,470472926,"Wed Dec 09 23:14:28 +0000 2015","2015-12-09 23:14:28",NA,NA,"","En estos momentos, rendirán protesta los magistrados de los órganos jurisdiccionales en materia electoral de  Durango, Sinaloa y Oaxaca.",60,5,0,0,0,"2015-12-11 01:31:27","2016-02-08 10:47:15",0,NA
"1285",674728122667819008,470472926,"Wed Dec 09 23:11:34 +0000 2015","2015-12-09 23:11:34",NA,NA,"","Queda aprobado con 74 votos a favor, las planillas de magistrados electorales de órganos jurisdiccionales locales Durango, Oaxaca, y Sinaloa",61,3,0,0,0,"2015-12-11 01:31:27","2016-02-08 10:47:15",0,NA
"1286",674723775368204288,470472926,"Wed Dec 09 22:54:18 +0000 2015","2015-12-09 22:54:18",NA,NA,"","Procedemos a la elección por cédula de los magistrados órganos jurisdiccionales locales en materia electoral de #Durango, #Sinaloa y #Oaxaca",60,0,0,0,0,"2015-12-11 01:31:27","2016-02-08 10:47:15",0,NA
"1287",674723458526281728,470472926,"Wed Dec 09 22:53:02 +0000 2015","2015-12-09 22:53:02",NA,NA,"","Aprobamos con 70 votos el dictamen que reforma la Ley Gral. de Sociedades Mercantiles. Se turna a @Mx_Diputados",61,0,0,0,0,"2015-12-11 01:31:27","2016-02-08 10:47:15",0,NA
"1288",674720099111055360,470472926,"Wed Dec 09 22:39:41 +0000 2015","2015-12-09 22:39:41",NA,NA,"","Estamos votando el dictamen que reforma la Ley General de Sociedades Mercantiles https://t.co/Yl8d5P7IMz",60,2,0,0,0,"2015-12-11 01:31:27","2016-02-08 10:47:15",0,NA
"1289",674712059980812288,470472926,"Wed Dec 09 22:07:45 +0000 2015","2015-12-09 22:07:45",NA,NA,"","Seguimos en sesión amigos, aquí pueden ver la transmisión #EnVIvo. https://t.co/NJUFzphjzk ¡Buena tarde!",62,1,0,0,0,"2015-12-11 01:31:29","2016-02-08 10:47:15",0,NA
"1290",674710323186692096,470472926,"Wed Dec 09 22:00:51 +0000 2015","2015-12-09 22:00:51",NA,NA,"","Les comparto la nota, sobre nuestra aprobación en torno a la suspensión de garantías: https://t.co/anyGWnWa0I",62,0,0,0,0,"2015-12-11 01:31:30","2016-02-08 10:47:15",0,NA
"1291",674707532078702592,470472926,"Wed Dec 09 21:49:45 +0000 2015","2015-12-09 21:49:45",NA,NA,"","Aprobamos en lo general y en lo particular proyecto que expide la Ley Reglamentaria del art. 33 Constitucional, sobre derecho de audiencia.",62,1,0,0,0,"2015-12-11 01:31:32","2016-02-08 10:47:15",0,NA
"1292",674706750998646784,470472926,"Wed Dec 09 21:46:39 +0000 2015","2015-12-09 21:46:39",NA,NA,"","Con 78 votos en pro y 5 en contra aprobamos en lo general el dictamen que expide Ley Reglamentaria del art. 33 Constitucional.",61,0,0,0,0,"2015-12-11 01:31:32","2016-02-08 10:47:15",0,NA
"1293",674705085385994240,470472926,"Wed Dec 09 21:40:02 +0000 2015","2015-12-09 21:40:02",NA,NA,"","Estamos votando en lo general el dictamen que expide Ley Reglamentaria del art. 33 Constitucional, en materia de derecho de audiencia.",60,1,0,0,0,"2015-12-11 01:31:32","2016-02-08 10:47:15",0,NA
"1294",674686057074417664,470472926,"Wed Dec 09 20:24:25 +0000 2015","2015-12-09 20:24:25",NA,NA,"","Aprobamos en el Pleno,con 88 votos en pro y 7 en contra en lo general el dictamen que expide Ley Reglamentaria sobre suspensión de garantías",62,4,0,0,0,"2015-12-11 01:31:32","2016-02-08 10:47:15",0,NA
"1295",674681839731126272,470472926,"Wed Dec 09 20:07:40 +0000 2015","2015-12-09 20:07:40",NA,NA,"","Continuamos con el análisis del Art. 29 Constitucional, en lo referente a la Ley Reglamentaria sobre suspensión de garantías.",62,3,0,0,0,"2015-12-11 01:31:32","2016-02-08 10:47:15",0,NA
"1296",674670748267450368,470472926,"Wed Dec 09 19:23:35 +0000 2015","2015-12-09 19:23:35",NA,NA,"","Estamos discutiendo en lo general del dictamen que expide Ley Reglamentaria sobre suspensión de garantías. Hablan los oradores en contra.",62,3,0,0,0,"2015-12-11 01:31:32","2016-02-08 10:47:15",0,NA
"1297",674669269297197056,470472926,"Wed Dec 09 19:17:43 +0000 2015","2015-12-09 19:17:43",NA,NA,"","Se da cuenta de modificaciones que remiten las comisiones dictaminadoras al dictamen en materia de suspensión de garantías.",61,4,0,0,0,"2015-12-11 01:31:32","2016-02-08 07:38:19",0,NA
"1298",674666681805836288,470472926,"Wed Dec 09 19:07:26 +0000 2015","2015-12-09 19:07:26",NA,NA,"","Celebramos en el Senado, la jornada electoral en #Venezuela. https://t.co/uxSvEybFdW …",62,1,0,0,0,"2015-12-11 01:31:32","2016-02-08 07:38:19",0,NA
"1299",674650218986496000,470472926,"Wed Dec 09 18:02:01 +0000 2015","2015-12-09 18:02:01",NA,NA,"","Comenzamos con la paso a presentación de iniciativas, mi compañero @ManuelCota, propone que la autoridad apoye a jóvenes del sector primario",60,2,0,0,0,"2015-12-11 01:31:34","2016-02-08 07:38:19",0,NA
"1300",674649679213101056,470472926,"Wed Dec 09 17:59:52 +0000 2015","2015-12-09 17:59:52",NA,NA,"","Da inicio la sesión en el #Senado, aquí nos pueden seguir en vivo: https://t.co/mjz8CdaBff …",64,4,0,0,0,"2015-12-11 01:31:34","2016-02-08 07:38:19",0,NA
"1301",674646094140182528,470472926,"Wed Dec 09 17:45:37 +0000 2015","2015-12-09 17:45:37",NA,NA,"","Envío un abrazo a Don Javier Pérez y a todo el equipo de @GrupoRadiorama, por 45 años de información. ¡Muchas felicidades por su trabajo!",60,4,0,0,0,"2015-12-11 01:31:36","2016-02-04 06:48:12",0,NA
"1302",674645102724190208,470472926,"Wed Dec 09 17:41:41 +0000 2015","2015-12-09 17:41:41",NA,NA,"","Antes de iniciar la sesión, estoy en las Comparecencias de candidatos a Magistrado del Tribunal Federal de Justicia Fiscal y Administrativa",63,7,0,0,0,"2015-12-11 01:31:36","2016-02-04 06:48:12",0,NA
"1303",674636138204672000,470472926,"Wed Dec 09 17:06:04 +0000 2015","2015-12-09 17:06:04",NA,NA,"","En la sesión de hoy analizaremos y discutiremos 43 dictámenes, además de 16 presentaciones de iniciativas y 23 proposiciones.",61,1,0,0,0,"2015-12-11 01:31:36","2016-02-04 06:48:12",0,NA
"1304",674600766540148736,470472926,"Wed Dec 09 14:45:30 +0000 2015","2015-12-09 14:45:30",NA,NA,"","https://t.co/GTTiwCeN1a Aquí les comparto el orden del día, para la sesión de hoy.",61,0,0,0,0,"2015-12-11 01:31:36","2016-02-04 06:48:12",0,NA
"1305",674600304185225216,470472926,"Wed Dec 09 14:43:40 +0000 2015","2015-12-09 14:43:40",NA,NA,"","RT @CanalCongreso: #SesiónDiputados con 305 votos a favor, 105 votos en contra, se avala en lo particular y general #ReformaPensionissste/ …",15,0,0,0,0,"2015-12-11 01:31:38","2016-02-04 06:48:12",1,NA
"1306",674599916140756992,470472926,"Wed Dec 09 14:42:08 +0000 2015","2015-12-09 14:42:08",NA,NA,"","Estimado amigo @EmilioLozoyaAus, te envío un abrazo de felicitación, con todo afecto por tu cumpleaños.",61,1,0,0,0,"2015-12-11 01:31:38","2016-02-04 06:48:12",0,NA
"1307",674599409099800576,470472926,"Wed Dec 09 14:40:07 +0000 2015","2015-12-09 14:40:07",NA,NA,"","Amigos buen día. Excelente miércoles a todos. ¡Hoy también tendremos sesión!",62,2,0,0,0,"2015-12-11 01:31:38","2016-02-04 06:48:12",0,NA
"1308",675705396162510848,470472926,"Sat Dec 12 15:54:55 +0000 2015","2015-12-12 15:54:55",NA,NA,"","¡Felicidades a todas las ""Lupitas"" en su día.",66,4,0,0,0,"2015-12-14 01:07:27","2016-02-10 02:14:36",0,NA
"1309",676617776723681280,470472926,"Tue Dec 15 04:20:23 +0000 2015","2015-12-15 04:20:23",NA,NA,"","En la sesión de hoy, también designamos a los magistrados del órgano electoral de #Chihuahua. ¡Mucho éxito a todos! https://t.co/gxIwBmi71o",67,4,0,0,0,"2015-12-14 23:54:45","2016-02-16 17:40:11",0,NA
"1310",676617193308618752,470472926,"Tue Dec 15 04:18:04 +0000 2015","2015-12-15 04:18:04",NA,NA,"","El protocolo, suscrito en Colombia, el 10 de febrero de 2014, y es un tratado internacional integrado por Chile, Colombia, México y Perú.",62,2,0,0,0,"2015-12-14 23:54:45","2016-02-16 17:40:11",0,NA
"1311",676616862034038784,470472926,"Tue Dec 15 04:16:45 +0000 2015","2015-12-15 04:16:45",NA,NA,"","Ratificamos en el Senado, protocolo adicional a la Alianza del Pacífico. https://t.co/spv4BoM5PX",66,3,0,0,0,"2015-12-14 23:54:45","2016-02-16 17:40:11",0,NA
"1312",676550478361071616,470472926,"Mon Dec 14 23:52:58 +0000 2015","2015-12-14 23:52:58",NA,NA,"","Concluimos la sesión del @senadomexicano y nos citan para mañana martes 15 de diciembre a las 11:00 horas.",62,4,0,0,0,"2015-12-14 23:54:45","2016-02-16 17:40:11",0,NA
"1313",676544937505062912,470472926,"Mon Dec 14 23:30:57 +0000 2015","2015-12-14 23:30:57",NA,NA,"","Procedemos a la elección de senadores que integrarán la Comisión Permanente del 1er Receso del 1er Año de Ejercicio de la LXIII Legislatura.",62,4,0,0,0,"2015-12-14 23:54:45","2016-02-16 17:40:11",0,NA
"1314",676543879491883008,470472926,"Mon Dec 14 23:26:45 +0000 2015","2015-12-14 23:26:45",NA,NA,"","Rinden protesta magistrados de órganos jurisdiccionales locales en materia electoral de #Chihuahua y #Puebla. https://t.co/OP7AbZmq1P",65,6,0,0,0,"2015-12-14 23:54:45","2016-02-16 17:40:11",0,NA
"1315",676536654392262656,470472926,"Mon Dec 14 22:58:02 +0000 2015","2015-12-14 22:58:02",NA,NA,"","Comenzamos a votar, vía cédula, la elección de Magistrados de órganos jurisdiccionales locales en materia electoral de #Chihuahua.",66,4,0,0,0,"2015-12-14 23:54:45","2016-02-16 17:40:11",0,NA
"1316",676536340243083264,470472926,"Mon Dec 14 22:56:47 +0000 2015","2015-12-14 22:56:47",NA,NA,"","Hemos aprobado los dictámenes con puntos de acuerdo en materia de salud, de cultura, e igualdad de género y medio ambiente.",64,3,0,0,0,"2015-12-14 23:54:45","2016-02-16 17:40:11",0,NA
"1317",676533887460225024,470472926,"Mon Dec 14 22:47:02 +0000 2015","2015-12-14 22:47:02",NA,NA,"","Continuamos desahogando los asuntos, de la sesión de hoy:  Dan lectura a diverso exhortos para su votación en conjunto.",60,2,0,0,0,"2015-12-14 23:54:45","2016-02-16 17:40:11",0,NA
"1318",676527595198877696,470472926,"Mon Dec 14 22:22:02 +0000 2015","2015-12-14 22:22:02",NA,NA,"","Felicidades a Álvaro Vizcaíno Zamora, con 90 votos lo ratificamos como Secretario Ejecutivo del Sistema Nacional de Seguridad Pública.",60,3,0,0,0,"2015-12-14 23:54:45","2016-02-16 17:40:11",0,NA
"1319",676520512449720320,470472926,"Mon Dec 14 21:53:53 +0000 2015","2015-12-14 21:53:53",NA,NA,"","Discutimos y aprobamos con 97 votos a favor, el Protocolo Adicional al Acuerdo Marco de la Alianza del Pacífico.",62,5,0,0,0,"2015-12-14 23:54:45","2016-02-16 17:40:11",0,NA
"1320",676513234107523072,470472926,"Mon Dec 14 21:24:58 +0000 2015","2015-12-14 21:24:58",NA,NA,"","Con 92 votos en pro y 0 en contra se ratifica la designación de Óscar Guillermo Levín Coppel como Vocal de la Junta de Gobierno del IPAB.",63,5,0,0,0,"2015-12-14 23:54:45","2016-02-16 17:40:11",0,NA
"1321",676512976438824960,470472926,"Mon Dec 14 21:23:57 +0000 2015","2015-12-14 21:23:57",NA,NA,"","Con 80 votos en pro y 0 en contra aprobamos el dictamen en materia de prestación de servicios turísticos.",61,2,0,0,0,"2015-12-14 23:54:45","2016-02-16 17:40:11",0,NA
"1322",676500985691308032,470472926,"Mon Dec 14 20:36:18 +0000 2015","2015-12-14 20:36:18",NA,NA,"","Aprobamos con 72 votos en pro y 0 en contra, el dictamen en materia de información para la salud.",63,5,0,0,0,"2015-12-14 23:54:45","2016-02-16 17:40:11",0,NA
"1323",676500660708241408,470472926,"Mon Dec 14 20:35:00 +0000 2015","2015-12-14 20:35:00",NA,NA,"","Estamos analizando el dictamen en materia de información para la salud.",61,3,0,0,0,"2015-12-14 23:54:45","2016-02-16 17:40:11",0,NA
"1324",676494563167473664,470472926,"Mon Dec 14 20:10:47 +0000 2015","2015-12-14 20:10:47",NA,NA,"","Aprobamos el acuerdo sobre la conclusión de los proyectos de ley o decreto enviados por @Mx_Diputados en las LIX, LX y LXI Legislaturas.",60,3,0,0,0,"2015-12-14 23:54:45","2016-02-15 22:24:42",0,NA
"1325",676493972622065664,470472926,"Mon Dec 14 20:08:26 +0000 2015","2015-12-14 20:08:26",NA,NA,"","Amigos, buena tarde. Iniciamos la sesión del Senado de la República, síguenos #EnVivo  en este enlace https://t.co/uXRfmO1YAI …",62,2,0,0,0,"2015-12-14 23:54:45","2016-02-10 02:14:36",0,NA
"1326",676440922742124544,470472926,"Mon Dec 14 16:37:38 +0000 2015","2015-12-14 16:37:38",NA,NA,"","Comparto con Ustedes, los asuntos programados para hoy, en el orden del día: https://t.co/hWzsJA93lB",65,3,0,0,0,"2015-12-14 23:54:45","2016-02-10 02:14:36",0,NA
"1327",676440699856752640,470472926,"Mon Dec 14 16:36:45 +0000 2015","2015-12-14 16:36:45",NA,NA,"","Senadores del GP del PRI hicimos un llamado a las autoridades de los tres órdenes de gobierno, para evitar abusos en esta temporada.",65,4,0,0,0,"2015-12-14 23:54:47","2016-02-10 02:14:36",0,NA
"1328",676396098563399680,470472926,"Mon Dec 14 13:39:31 +0000 2015","2015-12-14 13:39:31",NA,NA,"","Hoy tenemos sesión en el #Senado. Les estaré informando.",66,6,0,0,0,"2015-12-14 23:54:47","2016-02-10 02:14:36",0,NA
"1329",676395795155824640,470472926,"Mon Dec 14 13:38:19 +0000 2015","2015-12-14 13:38:19",NA,NA,"","Buenos días amigos. Excelente inicio de semana. ¡A darle!",66,4,0,0,0,"2015-12-14 23:54:47","2016-02-10 02:14:36",0,NA
"1330",676850974464598016,470472926,"Tue Dec 15 19:47:02 +0000 2015","2015-12-15 19:47:02",NA,NA,"","En la reunión de comisiones unidas, estamos analizando la creación de la Secretaria de Cultura.",40,3,0,0,0,"2015-12-15 14:48:20","2016-02-22 17:14:16",0,NA
"1331",676850425077829632,470472926,"Tue Dec 15 19:44:51 +0000 2015","2015-12-15 19:44:51",NA,NA,"","Hemos aprobado con 105 votos, la ratificación de Juan José Ignacio Gómez Camacho como Representante Permanente de México ante la #ONU.",1,3,0,0,0,"2015-12-15 14:48:20","2016-02-22 17:14:16",0,NA
"1332",676846388592771072,470472926,"Tue Dec 15 19:28:48 +0000 2015","2015-12-15 19:28:48",NA,NA,"","Participo ahora, en la reunión de las Comisiones Unidas de Radio, Televisión y Cinematografía y Estudios Legislativos Primera.",0,3,0,0,0,"2015-12-15 14:48:20","2016-02-22 17:14:16",0,NA
"1333",676840260974743552,470472926,"Tue Dec 15 19:04:27 +0000 2015","2015-12-15 19:04:27",NA,NA,"","Aprobamos el dictamen con 94 votos la ratificación, a Eréndira Araceli Paz Campos, como Embajadora de México en #Venezuela.",41,2,0,0,0,"2015-12-15 14:48:20","2016-02-22 17:14:16",0,NA
"1334",676838601376698368,470472926,"Tue Dec 15 18:57:52 +0000 2015","2015-12-15 18:57:52",NA,NA,"","Posterior al análisis, a votación dictamen que ratifica nombramiento de Eréndira Araceli Paz Campos como Embajadora de México en# Venezuela.",41,3,0,0,0,"2015-12-15 14:48:20","2016-02-22 17:14:16",0,NA
"1335",676831530241527808,470472926,"Tue Dec 15 18:29:46 +0000 2015","2015-12-15 18:29:46",NA,NA,"","También ratificamos el nombramiento de Alejandro Ives Estivill Castro, como Cónsul General de México en Montreal, Quebec, Canadá.",60,3,0,0,0,"2015-12-15 14:48:20","2016-02-22 17:14:16",0,NA
"1336",676830796498382848,470472926,"Tue Dec 15 18:26:51 +0000 2015","2015-12-15 18:26:51",NA,NA,"","Aprobado con 90 votos a favor, el dictamen que ratifica a Agustín García-López, como Embajador de México en Canadá. ¡Felicidades y éxito!",60,4,0,0,0,"2015-12-15 14:48:20","2016-02-22 17:14:16",0,NA
"1337",676827502342377472,470472926,"Tue Dec 15 18:13:46 +0000 2015","2015-12-15 18:13:46",NA,NA,"","Estamos analizando el dictamen que ratifica a Agustín García-López, como Embajador de México en Canadá.",63,3,0,0,0,"2015-12-15 14:48:20","2016-02-22 17:14:16",0,NA
"1338",676824623242043392,470472926,"Tue Dec 15 18:02:19 +0000 2015","2015-12-15 18:02:19",NA,NA,"","Aprobamos como primeros asuntos de la sesión de hoy, la licencia de mi amiga @LetyHerreraAle. ¡Mucho éxito en todos tus proyectos senadora!",66,11,0,0,0,"2015-12-15 14:48:20","2016-02-22 17:14:16",0,NA
"1339",676823639317090304,470472926,"Tue Dec 15 17:58:25 +0000 2015","2015-12-15 17:58:25",NA,NA,"","Amigos, ya iniciamos la sesión de hoy. Aquí nos pueden seguir en vivo: https://t.co/bq0Tt1m28l",61,5,0,0,0,"2015-12-15 14:48:20","2016-02-22 17:14:16",0,NA
"1340",676770437624295424,470472926,"Tue Dec 15 14:27:00 +0000 2015","2015-12-15 14:27:00",NA,NA,"","¡Buenos días! Excelente y productivo martes a todos.",64,6,0,0,0,"2015-12-15 14:48:22","2016-02-20 05:31:11",0,NA
"1341",677009711082917888,470472926,"Wed Dec 16 06:17:48 +0000 2015","2015-12-16 06:17:48",NA,NA,"","Fueron grandes logros alcanzados en este 1º periodo del 1º año de la LXIII Legislatura. ¡Felicidades compañeros! https://t.co/vuerLAmj4N",30,11,0,0,0,"2015-12-16 06:43:54","2016-02-25 09:32:58",0,NA
"1342",677005950197305344,470472926,"Wed Dec 16 06:02:51 +0000 2015","2015-12-16 06:02:51",166757868,NA,"rgilzuarth","@rgilzuarth clausura los trabajos del Senado del 1er periodo de sesiones ordinarias del 1er año de ejercicio de la LXIII Legislatura.",23,3,0,0,0,"2015-12-16 06:43:54","2016-02-25 09:32:58",0,NA
"1343",677000318727659520,470472926,"Wed Dec 16 05:40:28 +0000 2015","2015-12-16 05:40:28",NA,NA,"","Hemos aprobado también, con 85 votos, el dictamen en materia del sector social de la economía.",5,5,0,0,0,"2015-12-16 06:43:54","2016-02-24 05:52:06",0,NA
"1344",676998726276268032,470472926,"Wed Dec 16 05:34:09 +0000 2015","2015-12-16 05:34:09",NA,NA,"","Con 78 votos en pro, 2 en contra y 2 abstenciones aprobamos en el Pleno, el dictamen que crea la Secretaría de Cultura.",3,4,0,0,0,"2015-12-16 06:43:54","2016-02-24 05:52:06",0,NA
"1345",676998012254687232,470472926,"Wed Dec 16 05:31:18 +0000 2015","2015-12-16 05:31:18",NA,NA,"","Agotados los oradores, se somete a votación el dictamen que crea la Secretaría de Cultura.",0,3,0,0,0,"2015-12-16 06:43:54","2016-02-24 05:52:06",0,NA
"1346",676979925392470016,470472926,"Wed Dec 16 04:19:26 +0000 2015","2015-12-16 04:19:26",NA,NA,"","Estamos en los posicionamientos de senadores en torno al dictamen que crea la #SecretaríadeCultura.",3,6,0,0,0,"2015-12-16 06:43:54","2016-02-24 05:52:06",0,NA
"1347",676973449814908928,470472926,"Wed Dec 16 03:53:42 +0000 2015","2015-12-16 03:53:42",NA,NA,"","Aprobado con 63 votos en pro y 17 en contra en lo general y particular dictamen en materia de robo de hidrocaburos.",1,0,0,0,0,"2015-12-16 06:43:54","2016-02-24 05:52:06",0,NA
"1348",676970100642226176,470472926,"Wed Dec 16 03:40:24 +0000 2015","2015-12-16 03:40:24",NA,NA,"","Con 65 votos en pro, 21 en contra y 4 abstenciones los senadores aprobamos el dictamen en materia de robo de hidrocarburos.",2,4,0,0,0,"2015-12-16 06:43:54","2016-02-24 05:52:06",0,NA
"1349",676962227631599616,470472926,"Wed Dec 16 03:09:07 +0000 2015","2015-12-16 03:09:07",NA,NA,"","Continuamos en sesión, seguimos analizando el dictamen sobre la #LeyDeHidrocarburos. Aquí pueden seguirnos; https://t.co/NJUFzpyUXU",62,0,0,0,0,"2015-12-16 06:43:54","2016-02-24 05:52:06",0,NA
"1350",676956441622749184,470472926,"Wed Dec 16 02:46:07 +0000 2015","2015-12-16 02:46:07",224745665,676952473270112256,"luiszendejas","Gracias @luiszendejas, te mando un abrazo amigo.",0,1,0,0,0,"2015-12-16 06:43:56","2016-02-22 17:14:16",0,NA
"1351",676951230783094784,470472926,"Wed Dec 16 02:25:25 +0000 2015","2015-12-16 02:25:25",NA,NA,"","Ahora continuamos con la discusión en lo general a favor y en contra al dictamen que expide la #LeyRoboHidrocarburos",21,2,0,0,0,"2015-12-16 06:43:56","2016-02-22 17:14:16",0,NA
"1352",676944076084748288,470472926,"Wed Dec 16 01:56:59 +0000 2015","2015-12-16 01:56:59",NA,NA,"","Con la #LeyDeHidrocarburos, se da certeza jurídica y sanciones ejemplares a quienes atentan contra el patrimonio nacional.",22,3,0,0,0,"2015-12-16 06:43:56","2016-02-22 17:14:16",0,NA
"1353",676934929461170176,470472926,"Wed Dec 16 01:20:38 +0000 2015","2015-12-16 01:20:38",NA,NA,"","Mi compañero Omar Fayad,  de la  Comisión Seguridad Pública, sube a Tribuna para fundamentar el dictamen relativo a #LeyRoboHidrocarburos",2,3,0,0,0,"2015-12-16 06:43:56","2016-02-22 17:14:16",0,NA
"1354",676930728127524864,470472926,"Wed Dec 16 01:03:57 +0000 2015","2015-12-16 01:03:57",NA,NA,"","Posterior a su análisis y discusión, ratificamos a Julio Santaella Castell como miembro de la Junta de Gobierno del INEGI. ¡Felicidades!",2,4,0,0,0,"2015-12-16 06:43:56","2016-02-22 17:14:16",0,NA
"1355",676920602972831744,470472926,"Wed Dec 16 00:23:42 +0000 2015","2015-12-16 00:23:42",NA,NA,"","Aprobamos con 74 votos a favor, 20 en contra y 1 abstención, la #ReformaPolíticaDF 
Se remite a los congresos locales.",5,3,0,0,0,"2015-12-16 06:43:56","2016-02-22 17:14:16",0,NA
"1356",676916750655619072,470472926,"Wed Dec 16 00:08:24 +0000 2015","2015-12-16 00:08:24",NA,NA,"","Fija posicionamiento del GPPRI, @EGandaraC #ReformaPolíticaDF permitirá que Cd de México sea reconocida plenamente en derechos y autonomía.",1,0,0,0,0,"2015-12-16 06:43:56","2016-02-22 17:14:16",0,NA
"1357",676894596757102592,470472926,"Tue Dec 15 22:40:22 +0000 2015","2015-12-15 22:40:22",NA,NA,"","Continuamos analizando el dictamen materia de #ReformaPolíticaDF. Sigue la sesión por el @CanalCongreso.",4,1,0,0,0,"2015-12-16 06:43:57","2016-02-22 17:14:16",0,NA
"1358",676890321083568128,470472926,"Tue Dec 15 22:23:23 +0000 2015","2015-12-15 22:23:23",NA,NA,"","Te mando un abrazo estimado @DanielPerezDias. ¡Qué te la pases bien en tu cumpleaños!",1,2,0,0,0,"2015-12-16 06:43:57","2016-02-22 17:14:16",0,NA
"1359",676876092515356672,470472926,"Tue Dec 15 21:26:50 +0000 2015","2015-12-15 21:26:50",NA,NA,"","Seguimos en sesión; ahora analizamos el dictamen en materia de reforma política de la #CDMX.",2,1,0,0,0,"2015-12-16 06:43:57","2016-02-22 17:14:16",0,NA
"1360",676864708108943360,470472926,"Tue Dec 15 20:41:36 +0000 2015","2015-12-15 20:41:36",NA,NA,"","Felicidades a los nuevos embajadores, ante #Bélgica, @EloyCantuS; ante #Francia, Juan Gómez Robledo; y ante #Italia, Juan José Guerra Abud.",42,4,0,0,0,"2015-12-16 06:43:57","2016-02-22 17:14:16",0,NA
"1361",676861589790658560,470472926,"Tue Dec 15 20:29:13 +0000 2015","2015-12-15 20:29:13",NA,NA,"","Felicidades a @EloyCantuSCon, con 100 votos en su favor, lo ratificamos como Embajador de México ante #Bélgica.",41,4,0,0,0,"2015-12-16 06:43:57","2016-02-22 17:14:16",0,NA
"1362",676859847820771328,470472926,"Tue Dec 15 20:22:17 +0000 2015","2015-12-15 20:22:17",NA,NA,"","Con 85 votos en pro, 6 en contra y 8 abstenciones en contra, ratificamos a Juan Guerra, como Embajador de México ante Italia. ¡Éxito!",44,4,0,0,0,"2015-12-16 06:43:57","2016-02-22 17:14:16",0,NA
"1363",676857169749213184,470472926,"Tue Dec 15 20:11:39 +0000 2015","2015-12-15 20:11:39",NA,NA,"","En la reunión de Comisión de Radio Televisión y Cinematografía, aprobamos el dictamen para la creación de la Secretaria de Cultura.",42,2,0,0,0,"2015-12-16 06:43:57","2016-02-22 17:14:16",0,NA
"1364",676855536244002816,470472926,"Tue Dec 15 20:05:09 +0000 2015","2015-12-15 20:05:09",292096200,676829880462389248,"Politicaenchis","Un abrazo Alex. @Politicaenchis @FelipeIbarraMx",2,4,0,0,0,"2015-12-16 06:43:57","2016-02-22 17:14:16",0,NA
"1365",676853254274314240,470472926,"Tue Dec 15 19:56:05 +0000 2015","2015-12-15 19:56:05",NA,NA,"","Discutimos el dictamen que ratifica a Juan Guerra Abud,como Embajador Extraordinario y Plenipotenciario de México ante la República Italiana",41,3,0,0,0,"2015-12-16 06:43:57","2016-02-22 17:14:16",0,NA
"1366",680598852051709952,470472926,"Sat Dec 26 03:59:45 +0000 2015","2015-12-26 03:59:45",NA,NA,"","Te mando un abrazo estimado amigo @EGandaraC. Mi pésame y solidaridad para toda tu familia, por la irreparable pérdida de tu señora madre.",4,3,0,0,0,"2015-12-27 07:55:57","2016-02-25 09:32:58",0,NA
"1367",682275815388614656,470472926,"Wed Dec 30 19:03:25 +0000 2015","2015-12-30 19:03:25",NA,NA,"","Te mando un abrazo hasta Uruapan amigo @pcesarmendez .",2,4,0,0,0,"2016-01-01 08:30:07","2016-02-25 09:32:58",0,NA
"1368",682275497682669568,470472926,"Wed Dec 30 19:02:09 +0000 2015","2015-12-30 19:02:09",NA,NA,"","Endurecen penas de prisión a quien posea cartuchos de uso exclusivo del Ejército. https://t.co/k7cxDqumLs…",5,4,0,0,0,"2016-01-01 08:30:07","2016-02-25 09:32:58",0,NA
"1369",682275421501575168,470472926,"Wed Dec 30 19:01:51 +0000 2015","2015-12-30 19:01:51",NA,NA,"","Avala Senado dictamen que privilegia uso de la lengua materna de pueblos indígenas. https://t.co/k7cxDqumLs…",4,5,0,0,0,"2016-01-01 08:30:09","2016-02-25 09:32:58",0,NA
"1370",683290235350847488,470472926,"Sat Jan 02 14:14:21 +0000 2016","2016-01-02 14:14:21",NA,NA,"","¡Que sea un año muy productivo para todos amigos, mis mejores deseos para este #2016! https://t.co/VBhm0zW07r",35,18,0,0,0,"2016-01-02 21:14:32","2016-02-25 09:32:58",0,NA
"1371",683289448537178112,470472926,"Sat Jan 02 14:11:14 +0000 2016","2016-01-02 14:11:14",2500151826,682815798843326464,"JulioCesarCanoP","Muchas gracias @JulioCesarCanoP. Igual feliz año amigo.",2,1,0,0,0,"2016-01-02 21:14:32","2016-02-25 09:32:58",0,NA
"1372",685296515544301568,470472926,"Fri Jan 08 03:06:36 +0000 2016","2016-01-08 03:06:36",NA,NA,"","Mi pésame y solidaridad para la familia y amigos de Don Joaquín Gamboa Pascoe, gran político y pionero del desarrollo sindical en México.",6,3,0,0,0,"2016-01-08 07:53:49","2016-02-25 09:32:58",0,NA
"1373",685540087480758272,470472926,"Fri Jan 08 19:14:28 +0000 2016","2016-01-08 19:14:28",NA,NA,"","Mi reconocimiento al @gobrep, por la captura de Joaquín Guzmán. Sin duda un gran logro para la seguridad y el Estado de Derecho, del país.",17,12,0,0,0,"2016-01-08 17:14:42","2016-02-25 14:26:03",0,NA
