"","id_tweet","id_twitter","created_at","created_at_datetime","in_reply_to_user_id","in_reply_to_status_id","in_reply_to_screen_name","text","retweet_count","favorite_count","longitude","latitude","retweeted","creation_date","modification_date","RT_temp","is_retweeted"
"1",589961501911293952,566955206,"Mon Apr 20 01:19:17 +0000 2015","2015-04-20 01:19:17",NA,NA,"","Todo documento público, debe ser público. Gobierno de Transparencia Total, solo con @FelipeCantuR #ContigoGanamos",13,2,0,0,0,"2015-08-02 22:33:49","2015-08-02 22:33:49",0,NA
"2",589964348488953856,566955206,"Mon Apr 20 01:30:36 +0000 2015","2015-04-20 01:30:36",NA,NA,"","RT @BuenGobiernoNL: Es tiempo de cambiar al gobierno que #NuevoLeón necesita! @FelipeCantuR tiene la capacidad y experiencia  #ContigoGanam…",25,0,0,0,0,"2015-08-02 22:33:49","2015-08-02 22:33:49",1,NA
"3",589964477853929472,566955206,"Mon Apr 20 01:31:07 +0000 2015","2015-04-20 01:31:07",NA,NA,"","RT @chipimariana: #ContigoGanamos @FelipeCantuR porque tus obras no se cayeron ! Y siguen funcionando",21,0,0,0,0,"2015-08-02 22:33:49","2015-08-03 01:07:24",1,NA
"4",589964738316009472,566955206,"Mon Apr 20 01:32:09 +0000 2015","2015-04-20 01:32:09",NA,NA,"","RT @LuisAngel_AJ: El Gobierno Estatal a abandonado municipios rurales y las carreteras, seguramente por que el gobernador anda en Helicópte…",26,0,0,0,0,"2015-08-02 22:33:49","2015-08-03 01:07:24",1,NA
"5",589965410662912000,566955206,"Mon Apr 20 01:34:49 +0000 2015","2015-04-20 01:34:49",NA,NA,"","RT @AnaRent: ""La impunidad crece cuando el funcionario se cree superior"", dice @FelipeCantuR, eso es cierto. #DebateNL #EsTuEleccion2015",87,0,0,0,0,"2015-08-02 22:33:49","2015-08-03 01:07:24",1,NA
"6",589965478388338688,566955206,"Mon Apr 20 01:35:05 +0000 2015","2015-04-20 01:35:05",NA,NA,"","RT @BuenGobiernoNL: ¡Queremos un #NuevoLeón libre y generoso para todos! ¡Con @FelipeCantuR #ClaroQuePodemos!  #ContigoGanamos",6,0,0,0,0,"2015-08-02 22:33:48","2015-08-03 01:07:24",1,NA
"7",589965530557091840,566955206,"Mon Apr 20 01:35:18 +0000 2015","2015-04-20 01:35:18",NA,NA,"","RT @ELNORTELOCAL: . @FelipeCantuR señala que PRI es el campeón de la impunidad, solo el 1% se castiga en #NL. Eliminará gastos a funcionari…",36,0,0,0,0,"2015-08-02 22:33:48","2015-08-03 01:07:24",1,NA
"8",589965593190666240,566955206,"Mon Apr 20 01:35:33 +0000 2015","2015-04-20 01:35:33",NA,NA,"","RT @MarioCantuG: Medicinas a los centros de salud ahorros que hara desde el gobierno central #FelipeContigo #YoConFelipe #ContigoGanamos #f…",17,0,0,0,0,"2015-08-02 22:33:48","2015-08-03 01:07:24",1,NA
"9",589973005008154624,566955206,"Mon Apr 20 02:05:00 +0000 2015","2015-04-20 02:05:00",NA,NA,"","RT @ELNORTELOCAL: . @FelipeCantuR dijo que ninguna concesión del transporte público está vigente, pero así le conviene al PRI tenerlos agar…",31,0,0,0,0,"2015-08-02 22:33:48","2015-08-03 01:07:24",1,NA
"10",589973756421902336,566955206,"Mon Apr 20 02:07:59 +0000 2015","2015-04-20 02:07:59",NA,NA,"","RT @FelipeCantuR: Haciéndose pasar por campesinos de Mina? ¿Continuidad a la impunidad, a la corrupción, a una exagerada deuda?... #Denunci…",361,0,0,0,0,"2015-08-02 22:33:48","2015-08-03 01:07:24",1,NA
"11",589973861162057728,566955206,"Mon Apr 20 02:08:24 +0000 2015","2015-04-20 02:08:24",NA,NA,"","RT @FelipeCantuR: ¿Continuidad a que padres y hermanos del gobernador, despojen a la gente humilde y trabajadora… #DenunciaAlPRI",306,0,0,0,0,"2015-08-02 22:33:48","2015-08-03 01:07:24",1,NA
"12",589973996847833088,566955206,"Mon Apr 20 02:08:56 +0000 2015","2015-04-20 02:08:56",NA,NA,"","RT @FelipeCantuR: La oportunidad de cambiar Nuevo León está en nosotros. ¡Buenos días! #CambiemosElRumbo http://t.co/8iq89QnOC7",69,0,0,0,0,"2015-08-02 22:33:48","2015-08-03 01:07:24",1,NA
"13",589979220790546432,566955206,"Mon Apr 20 02:29:42 +0000 2015","2015-04-20 02:29:42",NA,NA,"","RT @ELNORTELOCAL: . @FelipeCantuR propone subsidiar tarifas de transporte a los municipios periféricos y modificar integración de Consejo d…",19,0,0,0,0,"2015-08-02 22:33:48","2015-08-03 01:07:24",1,NA
"14",589979323378970624,566955206,"Mon Apr 20 02:30:06 +0000 2015","2015-04-20 02:30:06",NA,NA,"","RT @ELNORTELOCAL: . @FelipeCantuR aseguró que va por ampliaciones del Metro a García, Juárez y Santa Catarina para tener una mayor movilida…",18,0,0,0,0,"2015-08-02 22:33:48","2015-08-03 01:07:24",1,NA
"15",589985528642048000,566955206,"Mon Apr 20 02:54:46 +0000 2015","2015-04-20 02:54:46",NA,NA,"","Ha quedado claro, quien presentó las mejores propuestas para cambiar el rumbo de Nuevo León. #ContigoGanamos @FelipeCantuR",15,5,0,0,0,"2015-08-02 22:33:48","2015-08-03 01:07:24",0,NA
"16",589986055975149568,566955206,"Mon Apr 20 02:56:51 +0000 2015","2015-04-20 02:56:51",NA,NA,"","#ContigoGanamos por un gobierno transparente y sobre todo, que escuche a los ciudadanos. @FelipeCantuR",13,2,0,0,0,"2015-08-02 22:33:48","2015-08-03 01:07:24",0,NA
"17",589986969028931584,566955206,"Mon Apr 20 03:00:29 +0000 2015","2015-04-20 03:00:29",NA,NA,"","Vamos por los mejores seis años para Nuevo León, con un gobierno eficiente e incluyente, porque #ContigoGanamos @FelipeCantuR",9,3,0,0,0,"2015-08-02 22:33:48","2015-08-03 01:07:24",0,NA
"18",589990105441443840,566955206,"Mon Apr 20 03:12:57 +0000 2015","2015-04-20 03:12:57",NA,NA,"","Si a ti, como a mi, te duele Nuevo León, te invito a cambiar de rumbo este 7 de junio, te invito a votar por @FelipeCantuR #ContigoGanamos",11,4,0,0,0,"2015-08-02 22:33:48","2015-08-03 01:07:24",0,NA
"19",589992809878294528,566955206,"Mon Apr 20 03:23:42 +0000 2015","2015-04-20 03:23:42",NA,NA,"","#ContigoGanamos @FelipeCantuR con guarderías para las madres trabajadoras. Transparencia total y cero privilegios para los funcionarios",7,1,0,0,0,"2015-08-02 22:33:48","2015-08-03 01:07:24",0,NA
"20",589993600462753792,566955206,"Mon Apr 20 03:26:50 +0000 2015","2015-04-20 03:26:50",NA,NA,"","Brindando respuestas y soluciones a lo que verdaderamente interesa a la gente: #ContigoGanamos @FelipeCantuR",4,0,0,0,0,"2015-08-02 22:33:48","2015-08-03 01:07:24",0,NA
"21",589997909183045632,566955206,"Mon Apr 20 03:43:57 +0000 2015","2015-04-20 03:43:57",NA,NA,"","RT @PANNLMX: Este próximo 7 de junio con tu ayuda #CambiemosElRumbo #ContigoGanamos http://t.co/TukD2fWkcy",66,0,0,0,0,"2015-08-02 22:33:48","2015-08-03 01:07:24",1,NA
"22",589999274928115712,566955206,"Mon Apr 20 03:49:23 +0000 2015","2015-04-20 03:49:23",NA,NA,"","Responsables, coherentes, reflejando los verdaderos intereses de los ciudadanos, las mejores propuestas son de @FelipeCantuR #ContigoGanamos",11,4,0,0,0,"2015-08-02 22:33:48","2015-08-03 01:07:24",0,NA
"23",590003377905356800,566955206,"Mon Apr 20 04:05:41 +0000 2015","2015-04-20 04:05:41",NA,NA,"","Luego de ver el #DebateNL me queda claro que Nuevo León necesita mas transparencia, mejor transporte. Nuevo León necesita a @FelipeCantuR",10,6,0,0,0,"2015-08-02 22:33:48","2015-08-03 01:07:24",0,NA
"24",590137014634291200,566955206,"Mon Apr 20 12:56:43 +0000 2015","2015-04-20 12:56:43",NA,NA,"","Tus sueños son siempre posibles, hoy tienes una nueva oportunidad para realizarlos, excelente inicio de semana. http://t.co/H91alF85gO",3,3,0,0,0,"2015-08-02 22:33:48","2015-08-03 01:07:24",0,NA
"25",590198122988568576,566955206,"Mon Apr 20 16:59:32 +0000 2015","2015-04-20 16:59:32",NA,NA,"","Hoy bien temprano nos fuimos a recorrer la col. Laderas del Mirador http://t.co/pL6NZq96fc",0,0,0,0,0,"2015-08-02 22:33:48","2015-08-03 01:07:24",0,NA
"26",590198132346114048,566955206,"Mon Apr 20 16:59:34 +0000 2015","2015-04-20 16:59:34",NA,NA,"","Como la Sra Ana que ya esta bien decidida #VamosConElPAN http://t.co/zN1Ej3evm0",0,0,0,0,0,"2015-08-02 22:33:48","2015-08-03 01:07:24",0,NA
"27",590198139002433536,566955206,"Mon Apr 20 16:59:36 +0000 2015","2015-04-20 16:59:36",NA,NA,"","Tenemos un compromiso de hacer bien las cosas http://t.co/KOwZH2xAES",0,0,0,0,0,"2015-08-02 22:33:48","2015-08-03 01:07:24",0,NA
"28",590198147621724160,566955206,"Mon Apr 20 16:59:38 +0000 2015","2015-04-20 16:59:38",NA,NA,"","Impulsar el emprendimiento, para dar el impulso que falta a los nuevos emprendedores http://t.co/JPDkL6t2Ay",0,0,0,0,0,"2015-08-02 22:33:48","2015-08-03 01:07:24",0,NA
"29",590198161051877376,566955206,"Mon Apr 20 16:59:41 +0000 2015","2015-04-20 16:59:41",NA,NA,"","Por tus hijos y los hijos de tus hijos #CambiemosElRumbo http://t.co/tivO5qGTM0",0,0,0,0,0,"2015-08-02 22:33:48","2015-08-03 01:07:24",0,NA
"30",590218008515194880,566955206,"Mon Apr 20 18:18:33 +0000 2015","2015-04-20 18:18:33",NA,NA,"","Gracias por sus buenos deseos, me llenan de energía y me empujan a seguir luchando por #Ca… http://t.co/cR97L1dVrF http://t.co/sT08HQCIm8",2,0,0,0,0,"2015-08-02 22:33:47","2015-08-10 15:59:01",0,NA
"31",590314238687649792,566955206,"Tue Apr 21 00:40:56 +0000 2015","2015-04-21 00:40:56",NA,NA,"","Estamos recorriendo la col. Valle de las Brisas, presentando nuestras propuestas y trabajo junto a @Rafa_Serna http://t.co/4W6r89sU1Q",1,1,-100.290558,25.6258347,0,"2015-08-02 22:33:47","2015-08-10 15:59:01",0,NA
"32",590315060787941376,566955206,"Tue Apr 21 00:44:12 +0000 2015","2015-04-21 00:44:12",NA,NA,"","Solo haciendo mancuerna con el ciudadano tendremos un mejor #NL #CambiemosElRumbo http://t.co/xY5rCwN0ek",2,3,-100.2881405,25.6246324,0,"2015-08-02 22:33:47","2015-08-11 23:14:31",0,NA
"33",590315759026311168,566955206,"Tue Apr 21 00:46:59 +0000 2015","2015-04-21 00:46:59",NA,NA,"","Ya sabemos que con los candidatos de @PANNLMX #CambiaremosElRumbo de #NL y de #México http://t.co/9k8nrLjPgI",1,2,-100.2881405,25.6246324,0,"2015-08-02 22:33:47","2015-08-11 23:14:31",0,NA
"34",590328753856872448,566955206,"Tue Apr 21 01:38:37 +0000 2015","2015-04-21 01:38:37",NA,NA,"","http://t.co/qVpJOL6SAE",2,1,0,0,0,"2015-08-02 22:33:47","2015-08-11 23:14:31",0,NA
"35",590328761314385920,566955206,"Tue Apr 21 01:38:39 +0000 2015","2015-04-21 01:38:39",NA,NA,"","http://t.co/rsZqKvZnn9",2,1,0,0,0,"2015-08-02 22:33:47","2015-08-11 23:14:31",0,NA
"36",590328766632747008,566955206,"Tue Apr 21 01:38:40 +0000 2015","2015-04-21 01:38:40",NA,NA,"","http://t.co/h3Pf9AdYfN",2,1,0,0,0,"2015-08-02 22:33:47","2015-08-11 23:14:31",0,NA
"37",590328782021533696,566955206,"Tue Apr 21 01:38:44 +0000 2015","2015-04-21 01:38:44",NA,NA,"","http://t.co/15nl0CArNe",0,1,0,0,0,"2015-08-02 22:33:47","2015-08-11 23:14:31",0,NA
"38",590334119655174144,566955206,"Tue Apr 21 01:59:56 +0000 2015","2015-04-21 01:59:56",NA,NA,"","Los Neoleoneses unidos lograremos #CambiarElRumbo de #NuevoLeón http://t.co/LBctercFHs http://t.co/9aTnq6SFZN",0,1,0,0,0,"2015-08-02 22:33:47","2015-08-11 23:14:31",0,NA
"39",590334130744885248,566955206,"Tue Apr 21 01:59:59 +0000 2015","2015-04-21 01:59:59",NA,NA,"","Hasta el segundo piso entregando las propuestas de #AcciónNacional a los ciudadanos http://t.co/LSAgbQzH45 http://t.co/YoRWLLeloo",0,1,0,0,0,"2015-08-02 22:33:46","2015-08-11 23:14:31",0,NA
"40",590500786586525696,566955206,"Tue Apr 21 13:02:13 +0000 2015","2015-04-21 13:02:13",NA,NA,"","RT @IvanGarzaT: ¡Que tengan un excelente día! Trabajando por un mejor #Monterrey #FelizMartes http://t.co/U5huIX9UQc",50,0,0,0,0,"2015-08-02 22:33:46","2015-08-11 23:14:31",1,NA
"41",590508855659888640,566955206,"Tue Apr 21 13:34:16 +0000 2015","2015-04-21 13:34:16",71865936,590399290834423808,"edgarito_so","Claro que si @edgarito_so, cuando la termine te invito para que la visites, buen martes.",1,0,0,0,0,"2015-08-02 22:33:46","2015-08-11 23:14:31",0,NA
"42",590562405169631232,566955206,"Tue Apr 21 17:07:04 +0000 2015","2015-04-21 17:07:04",NA,NA,"","Hoy bien tempranito nos fuimos a recorrer la col. Venustiano Carranza #CambiemosElRumbo http://t.co/0xm1vWFNBk",13,1,0,0,0,"2015-08-02 22:33:46","2015-08-11 23:14:31",0,NA
"43",590562410915880960,566955206,"Tue Apr 21 17:07:05 +0000 2015","2015-04-21 17:07:05",NA,NA,"","fuimos a presentar las propuestas para cambiar el rumbo de México #NL http://t.co/n4iNQ0Oi5B",10,1,0,0,0,"2015-08-02 22:33:46","2015-08-11 23:14:31",0,NA
"44",590562419304435712,566955206,"Tue Apr 21 17:07:07 +0000 2015","2015-04-21 17:07:07",NA,NA,"","Junto a mi compañero @Rafa_Serna gestionaremos más recursos para Nuevo León #ElNLqueMerecemos http://t.co/zkyxWDTFAz",17,3,0,0,0,"2015-08-02 22:33:46","2015-08-11 23:14:31",0,NA
"45",590562427319746560,566955206,"Tue Apr 21 17:07:09 +0000 2015","2015-04-21 17:07:09",NA,NA,"","Impulsaremos también reformas a la Ley del Adulto Mayor #CambiemoElRumbo http://t.co/0OApopP4v1",16,3,0,0,0,"2015-08-02 22:33:46","2015-08-11 23:14:31",0,NA
"46",590599989652541440,566955206,"Tue Apr 21 19:36:25 +0000 2015","2015-04-21 19:36:25",26689829,590597676938440704,"aguilarjulio","@aguilarjulio ayer fuimos a valle de las brisas, pronto estaré en tu colonia. Un abrazo",0,1,0,0,0,"2015-08-02 22:33:46","2015-08-11 23:14:31",0,NA
"47",590611981276737536,566955206,"Tue Apr 21 20:24:04 +0000 2015","2015-04-21 20:24:04",26689829,590605112835514368,"aguilarjulio","Comparto conforme voy visitando @aguilarjulio, pero pronto iré a Brisas",0,1,0,0,0,"2015-08-02 22:33:46","2015-08-11 23:14:31",0,NA
"48",590682338587242496,566955206,"Wed Apr 22 01:03:38 +0000 2015","2015-04-22 01:03:38",138136335,590665637254602752,"jaimesgaona","@jaimesgaona más inversión a infraestructura escolar; mejores salarios a los maestros; reformas para garantizar educación de nuestros hijos",0,1,0,0,0,"2015-08-02 22:33:46","2015-08-11 23:14:31",0,NA
"49",590682775256244224,566955206,"Wed Apr 22 01:05:22 +0000 2015","2015-04-22 01:05:22",138136335,590665637254602752,"jaimesgaona","@jaimesgaona Eso es tan solo una parte de lo que se debe hacer.  En lo que todos nos debemos involucrar. agradezco en lo que vale tu interés",1,1,0,0,0,"2015-08-02 22:33:46","2015-08-11 23:14:31",0,NA
"50",590685104562970624,566955206,"Wed Apr 22 01:14:37 +0000 2015","2015-04-22 01:14:37",NA,NA,"","Hoy se da un gran paso en el Senado, al aprobarse dictamen con el que se creará el Sistema Nacional Anticorrupción. http://t.co/tnY8H9Xz1t",9,4,0,0,0,"2015-08-02 22:33:46","2015-08-11 23:14:31",0,NA
"51",590685786875494400,566955206,"Wed Apr 22 01:17:20 +0000 2015","2015-04-22 01:17:20",NA,NA,"","El #SistemaNacionalAnticorrupción es una iniciativa de @AccionNacional. #Juntos #CambiamoselRumbo #BuenasIdeas",57,7,0,0,0,"2015-08-02 22:33:45","2015-08-11 23:14:31",0,NA
"52",590690738398191616,566955206,"Wed Apr 22 01:37:01 +0000 2015","2015-04-22 01:37:01",NA,NA,"","Hoy se da un gran paso en el Senado, al aprobarse el dictamen con el que se creará el #SistemaNacionalAnticorrupció… http://t.co/97Cr5LFnMz",0,0,0,0,0,"2015-08-02 22:33:45","2015-08-11 23:14:31",0,NA
"53",590862639112269824,566955206,"Wed Apr 22 13:00:05 +0000 2015","2015-04-22 13:00:05",NA,NA,"","Amigos que esté Miércoles este lleno de éxito. Bonito día. http://t.co/pMEX9PRtVJ",7,1,0,0,0,"2015-08-02 22:33:45","2015-08-11 23:14:31",0,NA
"54",590863568284692480,566955206,"Wed Apr 22 13:03:47 +0000 2015","2015-04-22 13:03:47",NA,NA,"","RT @FelipeCantuR: #AdiosALaTenencia se suma a mis propuestas de Gobierno que integran un verdadero beneficio a la economía familiar https:/…",549,0,0,0,0,"2015-08-02 22:33:45","2015-08-11 23:14:31",1,NA
"55",590864694375649280,566955206,"Wed Apr 22 13:08:15 +0000 2015","2015-04-22 13:08:15",NA,NA,"","Bien por @FelipeCantuR anuncia eliminación de la tenencia. Beneficio a la economía familiar e impulso al sector automotriz. #AdiosTenencia",13,4,0,0,0,"2015-08-02 22:33:45","2015-08-11 23:14:31",0,NA
"56",590868572731117568,566955206,"Wed Apr 22 13:23:40 +0000 2015","2015-04-22 13:23:40",NA,NA,"","Menos impuestos. Más eficiencia administrativa. Excelente @FelipeCantuR #AdiosTenencia http://t.co/JpXHnbyfkC",61,31,0,0,0,"2015-08-02 22:33:45","2015-08-11 23:14:31",0,NA
"57",590868611461304320,566955206,"Wed Apr 22 13:23:49 +0000 2015","2015-04-22 13:23:49",NA,NA,"","RT @AnaRent: Propone el candidato @FelipeCantuR ahora sí ELIMINAR la #Tenencia... #AdiósALaTenencia https://t.co/P9liGBYUi6 #NL #NuevoLeón …",54,0,0,0,0,"2015-08-02 22:33:44","2015-08-11 23:14:31",1,NA
"58",590870720609148928,566955206,"Wed Apr 22 13:32:12 +0000 2015","2015-04-22 13:32:12",26689829,590869630110928896,"aguilarjulio","Claro, estan todas en mi página juancarlosruiz.mx te invito a que la visites @aguilarjulio",0,0,0,0,0,"2015-08-02 22:33:44","2015-08-11 23:14:31",0,NA
"59",590876790005977088,566955206,"Wed Apr 22 13:56:19 +0000 2015","2015-04-22 13:56:19",161743777,NA,"elnortelocal","@ELNORTELOCAL @ELNORTECOM ya da cuenta del anuncio que @FelipeCantuR hará realidad. #AdiosALaTenencia  https://t.co/GsALOysblO",41,3,0,0,0,"2015-08-02 22:33:44","2015-08-11 23:14:31",0,NA
"60",590882335773560832,566955206,"Wed Apr 22 14:18:21 +0000 2015","2015-04-22 14:18:21",26689829,590877954919370752,"aguilarjulio","Claro @aguilarjulio a tus órdenes, buen día",0,0,0,0,0,"2015-08-02 22:33:44","2015-08-11 23:14:31",0,NA
"61",590891269380911104,566955206,"Wed Apr 22 14:53:51 +0000 2015","2015-04-22 14:53:51",NA,NA,"","RT @MarioCantuG: #AdiosALaTenencia #FelipeGobernador #YoConFelipe #BuenGobierno http://t.co/lNnEmHup91",20,0,0,0,0,"2015-08-02 22:33:44","2015-08-11 23:14:30",1,NA
"62",590906423015505920,566955206,"Wed Apr 22 15:54:04 +0000 2015","2015-04-22 15:54:04",NA,NA,"","Empezamos a recorrer Valle del Marqués para que todos conozcan las propuestas de #AcciónNacional #CambiemosElRumbo http://t.co/5HvinY33kH",19,1,0,0,0,"2015-08-02 22:33:44","2015-08-11 23:14:30",0,NA
"63",590919845543288832,566955206,"Wed Apr 22 16:47:24 +0000 2015","2015-04-22 16:47:24",NA,NA,"","En Valle del Marqués gracias a todas mas familias por recibirnos #ElNLqueMerecemos http://t.co/5beVFBDUZP",2,1,0,0,0,"2015-08-02 22:33:44","2015-08-11 23:14:30",0,NA
"64",590919850081574912,566955206,"Wed Apr 22 16:47:25 +0000 2015","2015-04-22 16:47:25",NA,NA,"","Gracias a la Sra. Mary por su apoyo, ella ya se convenció de votar por el #PAN http://t.co/lP00RMr0eR",1,2,0,0,0,"2015-08-02 22:33:44","2015-08-11 23:14:30",0,NA
"65",590919854171017216,566955206,"Wed Apr 22 16:47:26 +0000 2015","2015-04-22 16:47:26",NA,NA,"","En Valle del Marqués sigamos moviendo almas y #CambiemosElRumbo http://t.co/ymwKCDFTAo",7,1,0,0,0,"2015-08-02 22:33:44","2015-08-11 23:14:30",0,NA
"66",590919858667331584,566955206,"Wed Apr 22 16:47:27 +0000 2015","2015-04-22 16:47:27",NA,NA,"","Tu que conoces las propuestas del #PAN compartelas con tus amigos para que juntos #CambiemosElRumbo http://t.co/meUAv8QVQy",13,1,0,0,0,"2015-08-02 22:33:44","2015-08-27 02:41:48",0,NA
"67",591226094017191936,566955206,"Thu Apr 23 13:04:19 +0000 2015","2015-04-23 13:04:19",NA,NA,"","Recuerda cual es tu misión en esta vida, bonito jueves. http://t.co/mHYXpRhfVs",12,1,0,0,0,"2015-08-02 22:33:44","2015-08-27 02:41:48",0,NA
"68",591264820420186112,566955206,"Thu Apr 23 15:38:13 +0000 2015","2015-04-23 15:38:13",NA,NA,"","RT @FelipeCantuR: Saludos al Consejo Universitario @uanl por la apertura al diálogo y su entusiasmo.
¡Gracias por este primer encuentro! #F…",73,0,0,0,0,"2015-08-02 22:33:43","2015-08-27 02:41:48",1,NA
"69",591282726327619584,566955206,"Thu Apr 23 16:49:22 +0000 2015","2015-04-23 16:49:22",NA,NA,"","RT @Rafa_Serna: Gracias a las 38 familias que me recibieron y atendieron en sus casas. Créanme #VamosAGanar con la #FormulaGanadora @JcRuiz…",7,0,0,0,0,"2015-08-02 22:33:43","2015-08-27 02:41:48",1,NA
"70",591293221143187456,566955206,"Thu Apr 23 17:31:04 +0000 2015","2015-04-23 17:31:04",126041909,591287275662626816,"imdeleon","Es lo que vamos a hacer @imdeleon , pero esto es trabajo de todos, hagamos lo juntos, hagamolo bien gracias por tus comentario, buen jueves",0,0,0,0,0,"2015-08-02 22:33:43","2015-08-27 02:41:48",0,NA
"71",591333356685557760,566955206,"Thu Apr 23 20:10:33 +0000 2015","2015-04-23 20:10:33",NA,NA,"","Hoy se llevo a cabo el 5to Parlamento Infantil en el Congreso del Estado http://t.co/Rm09fgPVcE",2,1,0,0,0,"2015-08-02 22:33:43","2015-08-27 02:41:48",0,NA
"72",591333361777385472,566955206,"Thu Apr 23 20:10:34 +0000 2015","2015-04-23 20:10:34",NA,NA,"","Son 42 niños con #BuenasIdeas para seguir cambiando el rumbo de este país http://t.co/G4Omfvz2gn",2,1,0,0,0,"2015-08-02 22:33:43","2015-08-27 02:41:48",0,NA
"73",591333366902824960,566955206,"Thu Apr 23 20:10:35 +0000 2015","2015-04-23 20:10:35",NA,NA,"","Por ellos seguiremos trabajando duro, solo asi #CambiaremosElRumbo de NL http://t.co/CUqjsIMlpq",4,1,0,0,0,"2015-08-02 22:33:43","2015-08-27 02:41:48",0,NA
"74",591347118901567488,566955206,"Thu Apr 23 21:05:14 +0000 2015","2015-04-23 21:05:14",NA,NA,"","Ahorita los invitó a que sintonicen el 660AM de su radio estaré como invitado con José Luis Portugal @PeriodicoABC #ABCnoticias",2,1,0,0,0,"2015-08-02 22:33:43","2015-08-27 02:41:48",0,NA
"75",591399255392309248,566955206,"Fri Apr 24 00:32:24 +0000 2015","2015-04-24 00:32:24",NA,NA,"","Hoy fuimos a Paseo Residencial a entregar nuestras propuestas http://t.co/HNxhX3W4Fc",0,1,0,0,0,"2015-08-02 22:33:43","2015-08-27 02:41:48",0,NA
"76",591399258617729024,566955206,"Fri Apr 24 00:32:25 +0000 2015","2015-04-24 00:32:25",NA,NA,"","Con la energía y optmismo que nos caracteriza @Rafa_Serna y un servidor visitamos Paseo Residencial http://t.co/It1LYl5KBw",2,2,0,0,0,"2015-08-02 22:33:43","2015-08-27 02:41:48",0,NA
"77",591399267014672384,566955206,"Fri Apr 24 00:32:27 +0000 2015","2015-04-24 00:32:27",NA,NA,"","Gracias a todas y cada una de las personas que nos abrieron sus puertas en Paseo Residencial http://t.co/Ddyqe7T4j4",4,2,0,0,0,"2015-08-02 22:33:43","2015-08-27 02:41:48",0,NA
"78",591610884339929088,566955206,"Fri Apr 24 14:33:21 +0000 2015","2015-04-24 14:33:21",NA,NA,"","Escucha y respeta a tus mayores, de ellos siempre habrá algo que aprender. http://t.co/wFIVzLahih http://t.co/j5xOmjWOwQ",6,1,0,0,0,"2015-08-02 22:33:42","2015-08-27 02:41:48",0,NA
"79",592360873915613184,566955206,"Sun Apr 26 16:13:32 +0000 2015","2015-04-26 16:13:32",NA,NA,"","Hoy acompañamos al próximo Alcalde de #Mty @IvanGarzaT en la presentación de la ampliación del Parque Río La Silla http://t.co/sqyfv3g8NH",4,2,0,0,0,"2015-08-02 22:33:42","2015-08-27 02:41:48",0,NA
"80",592361662113447936,566955206,"Sun Apr 26 16:16:40 +0000 2015","2015-04-26 16:16:40",NA,NA,"","Con @IvanGarzaT y @MarcosMendozaNL haremos sinergia para #CambiarElRumbo de #NuevoLeón http://t.co/l3bXimz5Ut",1,2,0,0,0,"2015-08-02 22:33:42","2015-08-27 02:41:48",0,NA
"81",592482820053938176,566955206,"Mon Apr 27 00:18:06 +0000 2015","2015-04-27 00:18:06",NA,NA,"","Conviviendo en la comida dominguera http://t.co/XIZ4WCt8nv http://t.co/MLWvtCbsnx",0,0,0,0,0,"2015-08-02 22:33:42","2015-08-27 02:41:48",0,NA
"82",592682662491455488,566955206,"Mon Apr 27 13:32:12 +0000 2015","2015-04-27 13:32:12",NA,NA,"","RT @DivadeMty: Inicia reunión de candidatos a Di. federales del @PANNLMX con @caintra_nl http://t.co/uJDSh7YEgi",5,0,0,0,0,"2015-08-02 22:33:42","2015-08-27 02:41:48",1,NA
"83",592690646428823552,566955206,"Mon Apr 27 14:03:56 +0000 2015","2015-04-27 14:03:56",NA,NA,"","RT @Rafa_Serna: Para andar en tendencia nacional #FelizLunes a todos @FelipeCantuR @IvanGarzaT @JcRuizMty @MarcosMendozaNL",5,0,0,0,0,"2015-08-02 22:33:42","2015-08-27 02:41:48",1,NA
"84",592850090269761536,566955206,"Tue Apr 28 00:37:30 +0000 2015","2015-04-28 00:37:30",NA,NA,"","Hoy visitamos a nuestros amigos de Cortijo del Río, presentando las propuestas para que juntos #CambiemosElRumbo http://t.co/Zt4BJWA2wY",3,1,0,0,0,"2015-08-02 22:33:42","2015-08-27 02:41:48",0,NA
"85",592851750555648000,566955206,"Tue Apr 28 00:44:06 +0000 2015","2015-04-28 00:44:06",NA,NA,"","Mejorar la calidad de vida de los adultos mayores es una de mis propuestas para que juntos #CambiemosElRumbo http://t.co/6W7xJQkTQW",1,2,0,0,0,"2015-08-02 22:33:42","2015-08-27 02:41:48",0,NA
"86",592885342040100864,566955206,"Tue Apr 28 02:57:35 +0000 2015","2015-04-28 02:57:35",NA,NA,"","Hoy empezamos desayunando con Caintra Nuevo León con propuestas en materia de política ind… http://t.co/t9UrC1XPi2 http://t.co/RIbCjTOQD0",1,2,0,0,0,"2015-08-02 22:33:41","2015-08-27 02:41:48",0,NA
"87",593061117896753152,566955206,"Tue Apr 28 14:36:03 +0000 2015","2015-04-28 14:36:03",NA,NA,"","RT @FelipeCantuR: Hoy va a ser un gran día para Nuevo León, solo hay que creer que con un Buen Gobierno cambiaremos el rumbo de nuestro est…",69,0,0,0,0,"2015-08-02 22:33:41","2015-08-29 19:17:38",1,NA
"88",593079064707104768,566955206,"Tue Apr 28 15:47:22 +0000 2015","2015-04-28 15:47:22",NA,NA,"","Las propuestas del #PAN son acciones encaminadas a cambiar el rumbo de #NuevoLeón y de #México, hagamoslo realidad. http://t.co/3vcv7673u9",16,5,0,0,0,"2015-08-02 22:33:41","2015-08-29 19:17:38",0,NA
"89",593101759771377664,566955206,"Tue Apr 28 17:17:33 +0000 2015","2015-04-28 17:17:33",NA,NA,"","RT @FelipeCantuR: Hoy quiero saludar a los jóvenes @JovenConFelipe que están apoyando mi campaña, los invito a que sigamos trabajando junto…",163,0,0,0,0,"2015-08-02 22:33:41","2015-08-29 19:17:38",1,NA
"90",593170606419476480,566955206,"Tue Apr 28 21:51:07 +0000 2015","2015-04-28 21:51:07",NA,NA,"","Con cada paso reafirmamos nuestro compromiso de servir, porque lo damos pensando en las vidas que vamos cambiar. http://t.co/KNls9s7rhk",11,3,0,0,0,"2015-08-02 22:33:41","2015-08-29 19:17:38",0,NA
"91",593206624745033728,566955206,"Wed Apr 29 00:14:15 +0000 2015","2015-04-29 00:14:15",NA,NA,"","Estamos entregando nuestras propuestas para que #CambiemosElRumbo de #Mty #NL y MX http://t.co/hzxkHHEZaW",0,1,0,0,0,"2015-08-02 22:33:41","2015-08-29 19:17:38",0,NA
"92",593206632911372288,566955206,"Wed Apr 29 00:14:17 +0000 2015","2015-04-29 00:14:17",NA,NA,"","Hasta el Cerro de la Campana estamos hoy visitando a todos los vecinos, gracias por abrirnos las puertas de su hoga… http://t.co/RegrjavK4N",2,2,0,0,0,"2015-08-02 22:33:41","2015-08-29 19:17:38",0,NA
