"","id_tweet","id_twitter","created_at","created_at_datetime","in_reply_to_user_id","in_reply_to_status_id","in_reply_to_screen_name","text","retweet_count","favorite_count","longitude","latitude","retweeted","creation_date","modification_date","RT_temp","is_retweeted"
"1089",829377366124138496,566955206,"Wed Feb 08 17:12:27 +0000 2017","2017-02-08 17:12:27",NA,NA,"","Programa Somos Mexicanos, del Instituto Nacional de Migración, para atender a nuestros migrantes de Nuevo León https://t.co/XUU3tGI0fT",2,4,0,0,0,"2017-02-09 03:47:50","2017-06-10 21:21:46",0,0
"1090",829028050096513024,566955206,"Tue Feb 07 18:04:24 +0000 2017","2017-02-07 18:04:24",NA,NA,"","Tempranito en la Sesión del Gpo de Amistad México Cuba, preparando la Inter-parlamentaria que se llevará a cabo en… https://t.co/tJcychKyeo",1,3,0,0,0,"2017-02-09 03:47:50","2017-06-10 21:21:46",0,0
"1091",828291120664809472,566955206,"Sun Feb 05 17:16:06 +0000 2017","2017-02-05 17:16:06",NA,NA,"","Hoy Celebramos el Centenario de nuestra #ConstitucionMexicana y te comparto estos interesantes datos que a lo mejor… https://t.co/MT6UbVfTsZ",1,4,0,0,0,"2017-02-09 03:47:59","2017-06-10 21:21:46",0,0
"1092",828291053702766592,566955206,"Sun Feb 05 17:15:50 +0000 2017","2017-02-05 17:15:50",NA,NA,"","Hoy Celebramos el Centenario de nuestra #ConstitucionMexicana y te comparto estos interesantes datos que a lo mejor… https://t.co/VmR9rsgCnm",1,3,0,0,0,"2017-02-09 03:48:07","2017-06-10 21:21:46",0,0
"1093",828291011000549376,566955206,"Sun Feb 05 17:15:40 +0000 2017","2017-02-05 17:15:40",NA,NA,"","Hoy Celebramos el Centenario de nuestra #ConstitucionMexicana y te comparto estos interesantes datos que a lo mejor… https://t.co/SZSoN8cVu3",1,3,0,0,0,"2017-02-09 03:48:16","2017-06-10 21:21:46",0,0
"1094",828290953635053568,566955206,"Sun Feb 05 17:15:26 +0000 2017","2017-02-05 17:15:26",NA,NA,"","Hoy Celebramos el Centenario de nuestra #ConstitucionMexicana y te comparto estos interesantes datos que a lo mejor… https://t.co/U22xDLoUgu",1,6,0,0,0,"2017-02-09 03:48:24","2017-06-10 21:21:46",0,0
"1095",828290842062385152,566955206,"Sun Feb 05 17:15:00 +0000 2017","2017-02-05 17:15:00",NA,NA,"","Hoy Celebramos el Centenario de nuestra #ConstitucionMexicana y te comparto estos interesantes datos que a lo mejor… https://t.co/O9m3b1WoN7",1,4,0,0,0,"2017-02-09 03:48:32","2017-06-10 21:21:46",0,0
"1096",830081119127224320,566955206,"Fri Feb 10 15:48:55 +0000 2017","2017-02-10 15:48:55",NA,NA,"","Hoy conmemoramos el Día de la #FuerzaAéreaMexicana. Honor, Valor, Lealtad por México. ¡Felicidades! https://t.co/AvBBG2gDNt",3,6,0,0,0,"2017-02-10 15:05:36","2017-06-10 21:21:46",0,0
"1097",829709195268222976,566955206,"Thu Feb 09 15:11:02 +0000 2017","2017-02-09 15:11:02",NA,NA,"","Hoy es el #DíaDelOdontólogo Muchas felicidades a los que se dedican a esta bonita profesión. https://t.co/to1zdXvUlT",0,2,0,0,0,"2017-02-10 15:05:36","2017-06-10 21:21:46",0,0
"1098",830819122489458688,566955206,"Sun Feb 12 16:41:29 +0000 2017","2017-02-12 16:41:29",NA,NA,"","Hoy llevamos Lentes a bajo costo a la Col. Sierra Ventana. Estamos ayudando a Madres de Familia, Jóvenes y Niños a… https://t.co/mnLKifiSDv",1,2,0,0,0,"2017-02-12 15:31:12","2017-06-10 21:21:46",0,0
"1099",830647589028573184,566955206,"Sun Feb 12 05:19:52 +0000 2017","2017-02-12 05:19:52",NA,NA,"","Te regalo esta Luna de Febrero https://t.co/0B6VyHbAm9",1,3,0,0,0,"2017-02-12 15:31:20","2017-06-10 21:21:46",0,0
"1100",830610121877123072,566955206,"Sun Feb 12 02:50:59 +0000 2017","2017-02-12 02:50:59",NA,NA,"","Felicidades a Mis Rayados por su triunfo ante Pumas, 2 a 0 ????????",2,3,0,0,0,"2017-02-12 15:31:20","2017-06-10 21:21:46",0,0
"1101",830605005749039104,566955206,"Sun Feb 12 02:30:39 +0000 2017","2017-02-12 02:30:39",NA,NA,"","Gooooooooool de Dorlan !!!",0,3,0,0,0,"2017-02-12 15:31:20","2017-06-10 21:21:46",0,0
"1102",830437279118348288,566955206,"Sat Feb 11 15:24:10 +0000 2017","2017-02-11 15:24:10",NA,NA,"","Ayer regresamos a la Col. España para atender a los vecinos y anotar gestorías que nos solicitaron. @JesusPFlores… https://t.co/wt96MJVq6j",1,2,0,0,0,"2017-02-12 15:31:20","2017-06-10 21:21:46",0,0
"1103",831180614116265984,566955206,"Mon Feb 13 16:37:55 +0000 2017","2017-02-13 16:37:55",NA,NA,"","Hoy es el #DíaMundialdelaRadio uno de los medios de comunicación más utilizados y extendidos del mundo. https://t.co/Lez6GvZBaG",16,8,0,0,0,"2017-02-13 18:37:09","2017-06-10 21:21:46",0,0
"1104",831512174816227328,566955206,"Tue Feb 14 14:35:25 +0000 2017","2017-02-14 14:35:25",NA,NA,"","Feliz día de San Valentín a todos. Que sea el pretexto para expresar nuestro cariño y amor a quienes queremos. https://t.co/uX13Vv5s7F",1,1,0,0,0,"2017-02-14 11:22:58","2017-06-10 21:21:46",0,0
"1105",831699510275538944,566955206,"Wed Feb 15 02:59:50 +0000 2017","2017-02-15 02:59:50",NA,NA,"","RT @sclacdtuvida: Impulsa Santa Catarina iniciativa para facultar a municipios a proceder contra empresas contaminantes #SantaCatarina http…",8,0,0,0,0,"2017-02-15 05:14:43","2017-06-10 21:21:46",1,1
"1106",831607325068820480,566955206,"Tue Feb 14 20:53:31 +0000 2017","2017-02-14 20:53:31",NA,NA,"","En esta Reforma damos a los Gobiernos Municipales facultades para combatir esta problemática. https://t.co/UwQIcsTKr6",4,6,0,0,0,"2017-02-15 05:14:44","2017-06-10 21:21:46",0,0
"1107",831606916329664512,566955206,"Tue Feb 14 20:51:54 +0000 2017","2017-02-14 20:51:54",NA,NA,"","La Contaminación del Área Metropolitana de Monterrey es muy grave. Hoy presentamos una Reforma a la Ley de Equilibr… https://t.co/uQiqM3FQyn",2,4,0,0,0,"2017-02-15 05:14:44","2017-06-10 21:21:46",0,0
"1108",831579988407095296,566955206,"Tue Feb 14 19:04:53 +0000 2017","2017-02-14 19:04:53",NA,NA,"","RT @diputadospan: #EstamosContigo @MarkoCortes presentó iniciativas para consolidar la democracia, que sea más eficaz y cueste menos #Democ…",17,0,0,0,0,"2017-02-15 05:14:53","2017-06-10 21:21:46",1,1
"1109",832233062482182144,566955206,"Thu Feb 16 14:19:58 +0000 2017","2017-02-16 14:19:58",NA,NA,"","Muchas felicidades Estimada Compañera Angelica ???? https://t.co/gOA0A0LddF",2,3,0,0,0,"2017-02-16 11:03:01","2017-06-10 21:21:46",0,0
"1110",831932590881964032,566955206,"Wed Feb 15 18:26:00 +0000 2017","2017-02-15 18:26:00",NA,NA,"","Lamentablemente en México se estima que existen anualmente entre 5,000 y 6,000 casos nuevos de cáncer en menores de… https://t.co/Yqb22CSh3a",2,4,0,0,0,"2017-02-16 11:03:03","2017-06-10 21:21:46",0,0
"1111",832340111752847360,566955206,"Thu Feb 16 21:25:21 +0000 2017","2017-02-16 21:25:21",NA,NA,"","Un transporte público, que afecta tanto al tráfico como a la Contaminación de nuestra metrópoli. #MetroMty #BroncoCumple",2,4,0,0,0,"2017-02-17 11:02:52","2017-06-10 21:21:46",0,0
"1112",832339898610941952,566955206,"Thu Feb 16 21:24:30 +0000 2017","2017-02-16 21:24:30",NA,NA,"","Hoy hacemos mancuerna con los Diputados Locales de #NL en la búsqueda de un mejor transporte público. #MetroMty https://t.co/IBZmAqvM13",2,5,0,0,0,"2017-02-17 11:02:53","2017-06-10 21:21:46",0,0
"1113",832326769025904640,566955206,"Thu Feb 16 20:32:20 +0000 2017","2017-02-16 20:32:20",NA,NA,"","RT @ReforestamosMx: Pedimos la participación de todos los actores involucrados para reformar la Ley General de Desarrollo Forestal Sustenta…",35,0,0,0,0,"2017-02-17 11:02:53","2017-06-10 21:21:46",1,1
"1114",832290592826720256,566955206,"Thu Feb 16 18:08:35 +0000 2017","2017-02-16 18:08:35",NA,NA,"","Estoy convencido de que la #LeyForestal requiere un proceso de consulta pública para garantizar la conservación de #PNCumbres #MTY",1,5,0,0,0,"2017-02-17 11:02:54","2017-06-10 21:21:46",0,0
"1115",832814331356016640,566955206,"Sat Feb 18 04:49:44 +0000 2017","2017-02-18 04:49:44",NA,NA,"","RT @LuzArgeliaBC: Nos Preocupa a los @diputadospan que en análisis de cuenta pública 2015 la ASF haga observaciones por 165 mil millones en…",8,0,0,0,0,"2017-02-18 19:42:03","2017-06-10 21:21:46",1,1
"1116",833525733536342016,566955206,"Mon Feb 20 03:56:35 +0000 2017","2017-02-20 03:56:35",NA,NA,"","RT @XimenaTamariz_: Los @diputadospan proponemos una amplia reforma para un modelo de democracia moderna, cuyo centro sea la voz de los ciu…",10,0,0,0,0,"2017-02-20 04:54:54","2017-06-10 21:21:46",1,1
"1117",833406516921135104,566955206,"Sun Feb 19 20:02:52 +0000 2017","2017-02-19 20:02:52",NA,NA,"","Hoy en el #DíadelEjércitoMexicano nuestro reconocimiento para todos ellos que dan su vida por salvaguardar la sober… https://t.co/oDiJyk85a2",1,3,0,0,0,"2017-02-20 04:54:54","2017-06-10 21:21:46",0,0
"1118",833850928272793600,566955206,"Tue Feb 21 01:28:48 +0000 2017","2017-02-21 01:28:48",NA,NA,"","Hoy me reuní con integrantes de la mesa directiva de la Florida para escuchar sus inquietudes y atender su problemá… https://t.co/eTBp2Gfbw2",0,3,0,0,0,"2017-02-21 00:32:31","2017-06-13 22:16:20",0,0
"1119",833733627921965056,566955206,"Mon Feb 20 17:42:41 +0000 2017","2017-02-20 17:42:41",NA,NA,"","Hoy Conmemoramos el #DiaMundialDeLaJusticiaSocial https://t.co/8vwE6MP6B4",3,2,0,0,0,"2017-02-21 00:32:39","2017-06-13 22:16:20",0,0
"1120",833707060726468608,566955206,"Mon Feb 20 15:57:07 +0000 2017","2017-02-20 15:57:07",NA,NA,"","RT @diputadospan: #DemocraciaEficaz Proponemos un sistema democrático más eficaz y que cueste menos a los mexicanos: @MarkoCortes https://t…",45,0,0,0,0,"2017-02-21 00:32:39","2017-06-10 21:21:46",1,1
"1121",834126883700801536,566955206,"Tue Feb 21 19:45:21 +0000 2017","2017-02-21 19:45:21",NA,NA,"","Cuando los minutos cuenta para salvar una vida, la respuesta profesional la tiene la #CruzRojaMexicana. Hoy celebra… https://t.co/m4t3H2yrFT",0,2,0,0,0,"2017-02-22 03:11:16","2017-06-13 22:16:20",0,0
"1122",834091451600486400,566955206,"Tue Feb 21 17:24:33 +0000 2017","2017-02-21 17:24:33",NA,NA,"","Espero recibir comentarios de ustedes, ante la necesidad urgente de establecer una postura clara al respecto.… https://t.co/BQEUAWq56P",1,1,0,0,0,"2017-02-22 03:11:16","2017-06-13 22:16:20",0,0
"1123",834425921876680704,566955206,"Wed Feb 22 15:33:37 +0000 2017","2017-02-22 15:33:37",NA,NA,"","RT @RosaMariaPaya: Llueve en La Habana. Mi hogar de Peñón 221 en El Cerro huele a infancia. Cuántas memorias de mi padre a quien hoy honram…",79,0,0,0,0,"2017-02-23 10:27:30","2017-06-18 03:23:48",1,1
"1124",835327273683337216,566955206,"Sat Feb 25 03:15:16 +0000 2017","2017-02-25 03:15:16",NA,NA,"","Dijo el wey que solo toma enserio a Fox News. https://t.co/zap2Bj7wDY",0,0,0,0,0,"2017-02-25 00:47:34","2017-07-01 08:31:35",0,0
"1125",835178197385887744,566955206,"Fri Feb 24 17:22:53 +0000 2017","2017-02-24 17:22:53",NA,NA,"","En un frente común por el bien de nuestro planeta ???? que nuestros esfuerzos tengan un mayor impacto @PANNLMX… https://t.co/Uebn5IHaeP",1,0,0,0,0,"2017-02-25 00:47:44","2017-07-01 08:31:35",0,0
"1126",835177250588930048,566955206,"Fri Feb 24 17:19:08 +0000 2017","2017-02-24 17:19:08",NA,NA,"","Para trabajar juntos por el medio ambiente de nuestro Estado. @PANNLMX @VinculacionNL @MauroGuerraNL @cesarsantosg https://t.co/Dj1FsBHgDI",1,2,0,0,0,"2017-02-25 00:47:54","2017-06-29 15:29:00",0,0
"1127",835176897885634560,566955206,"Fri Feb 24 17:17:43 +0000 2017","2017-02-24 17:17:43",NA,NA,"","Hoy nos reunimos con Organismos de la Sociedad Civil, Catedráticos y Especialistas del Medio Ambiente. @PANNLMX… https://t.co/L5HMISljXJ",4,4,0,0,0,"2017-02-25 00:47:54","2017-06-29 15:29:00",0,0
"1128",835158645457420288,566955206,"Fri Feb 24 16:05:12 +0000 2017","2017-02-24 16:05:12",NA,NA,"","Este es el símbolo que nos enorgullece a los mexicanos, y nos identificas como hermanos en cualquier territorio.… https://t.co/WOTPz3zP7f",1,3,0,0,0,"2017-02-25 00:48:04","2017-06-29 15:29:00",0,0
"1129",834885567926063104,566955206,"Thu Feb 23 22:00:05 +0000 2017","2017-02-23 22:00:05",NA,NA,"","La propuesta de #LeyForestal representa un retroceso en lo que a servicios ambientales se refiere, por lo que debemos revisarla a fondo.",6,2,0,0,0,"2017-02-25 00:48:15","2017-06-29 15:29:00",0,0
"1130",834885494873825280,566955206,"Thu Feb 23 21:59:48 +0000 2017","2017-02-23 21:59:48",NA,NA,"","La importancia de los recursos forestales de #México requiere de una #LeyForestal que recoja las voces de todos los sectores involucrados.",0,0,0,0,0,"2017-02-25 00:48:15","2017-06-27 11:37:19",0,0
"1131",834885414255153152,566955206,"Thu Feb 23 21:59:28 +0000 2017","2017-02-23 21:59:28",NA,NA,"","El Consejo Nacional Forestal señaló debilidades de #LeyForestal en materia de transparencia y competitividad, es necesario revisarlas.",1,0,0,0,0,"2017-02-25 00:48:15","2017-06-27 11:37:19",0,0
"1132",834885290636369920,566955206,"Thu Feb 23 21:58:59 +0000 2017","2017-02-23 21:58:59",NA,NA,"","No existe una alineación entre la ley de aguas ni la ley de biodiversidad con la propuesta de #LeyForestal.",0,1,0,0,0,"2017-02-25 00:48:15","2017-06-27 11:37:19",0,0
"1133",834885157794435072,566955206,"Thu Feb 23 21:58:27 +0000 2017","2017-02-23 21:58:27",NA,NA,"","La nueva #LeyForestal no contribuye al cumplimiento del #ODS15 #Agenda2030 de la #ONU suscrita por el Estado mexicano en 2015.",1,0,0,0,0,"2017-02-25 00:48:15","2017-06-26 08:17:08",0,0
"1134",834885082041098240,566955206,"Thu Feb 23 21:58:09 +0000 2017","2017-02-23 21:58:09",NA,NA,"","La propuesta de #LeyForestal no está apegada al respeto a los #DDHH consagrados en nuestra Constitución.",0,0,0,0,0,"2017-02-25 00:48:16","2017-06-24 06:51:53",0,0
"1135",834883806700072960,566955206,"Thu Feb 23 21:53:05 +0000 2017","2017-02-23 21:53:05",NA,NA,"","La #LeyForestal transgrede #DDHH fundamentales, tanto de comunidades indígenas como de campesinos, en relación a los servicios ambientales.",3,1,0,0,0,"2017-02-25 00:48:16","2017-06-24 06:51:53",0,0
"1136",834883736529338368,566955206,"Thu Feb 23 21:52:48 +0000 2017","2017-02-23 21:52:48",NA,NA,"","La propuesta de #LeyForestal no prioriza el manejo forestal #sustentable a cargo de las comunidades a lo largo del territorio nacional.",0,0,0,0,0,"2017-02-25 00:48:16","2017-06-22 01:34:03",0,0
"1137",834883673367314432,566955206,"Thu Feb 23 21:52:33 +0000 2017","2017-02-23 21:52:33",NA,NA,"","Los recursos forestales de #México requiere una #LeyForestal emanada de un proceso participativo, transparente y responsable.",1,4,0,0,0,"2017-02-25 00:48:16","2017-06-22 01:34:03",0,0
"1138",834808101324759040,566955206,"Thu Feb 23 16:52:15 +0000 2017","2017-02-23 16:52:15",4851540815,834807187419561984,"oscarsepu68","@oscarsepu68 Buenos días, con mucho gusto de poder servirte",0,1,0,0,0,"2017-02-25 00:48:17","2017-06-19 22:56:19",0,0
"1139",835663309558837248,566955206,"Sun Feb 26 01:30:33 +0000 2017","2017-02-26 01:30:33",NA,NA,"","RT @JovitaMorin: Felicidades @RicardoAnayaC  a disfrutar todos los festejos y seguir luchando por la democracia de nuestro México",2,0,0,0,0,"2017-02-26 16:26:18","2017-07-01 08:31:35",1,1
"1140",835623426794512384,566955206,"Sat Feb 25 22:52:04 +0000 2017","2017-02-25 22:52:04",NA,NA,"","RT @LaraPaola1: @nuevoleon @JaimeRdzNL Gobernador es importante avanzar en contra de la Trata https://t.co/2kfCVgdFt7",12,0,0,0,0,"2017-02-26 16:26:18","2017-07-01 08:31:35",1,1
"1141",835540659348070400,566955206,"Sat Feb 25 17:23:11 +0000 2017","2017-02-25 17:23:11",NA,NA,"","¡Feliz Cumpleaños! a nuestro Presidente Nacional @RicardoAnayaC Siempre mis mejores deseos. https://t.co/OIiaEgzLzA",10,8,0,0,0,"2017-02-26 16:26:23","2017-07-01 08:31:35",0,0
"1142",835477470434349056,566955206,"Sat Feb 25 13:12:06 +0000 2017","2017-02-25 13:12:06",NA,NA,"","RT @LuzArgeliaBC: Después que miente está Diputada desde la más alta Tribuna ahora dice que fue una confusión del medio...#NoMientasMorena…",20,0,0,0,0,"2017-02-26 16:26:23","2017-07-01 08:31:35",1,1
"1143",836290217267056640,566955206,"Mon Feb 27 19:01:39 +0000 2017","2017-02-27 19:01:39",NA,NA,"","Con mucha energía en este inicio de semana. Sigo trabajando para tí. #JuntoalCiudadano https://t.co/OZGk0gIWDa",15,20,0,0,0,"2017-02-27 16:25:42","2017-07-05 11:00:19",0,0
"1144",836079572613382144,566955206,"Mon Feb 27 05:04:38 +0000 2017","2017-02-27 05:04:38",NA,NA,"","Morat - Yo Más Te Adoro https://t.co/b0LFvKZoQy",0,1,0,0,0,"2017-02-27 16:25:42","2017-07-01 08:31:35",0,0
"1145",836671703509917696,566955206,"Tue Feb 28 20:17:33 +0000 2017","2017-02-28 20:17:33",NA,NA,"","Muchas gracias Mayra ???????? https://t.co/OiXeFs6znB",0,2,0,0,0,"2017-02-28 18:15:12","2017-07-12 17:29:03",0,0
"1146",836656569752371200,566955206,"Tue Feb 28 19:17:25 +0000 2017","2017-02-28 19:17:25",NA,NA,"","Muchas gracias Mi Estimado Marcos, a la órden ???????? https://t.co/1c4bGuECSL",0,2,0,0,0,"2017-02-28 18:15:22","2017-07-12 17:29:03",0,0
"1147",836656111726047232,566955206,"Tue Feb 28 19:15:36 +0000 2017","2017-02-28 19:15:36",NA,NA,"","Muchas gracias Walter, a la órden ???????? https://t.co/a99etcfdG4",1,0,0,0,0,"2017-02-28 18:15:33","2017-07-12 17:29:03",0,0
"1148",836632660646612992,566955206,"Tue Feb 28 17:42:24 +0000 2017","2017-02-28 17:42:24",NA,NA,"","Gracias Mi Presidente ???????? https://t.co/HJhbjbfYWl",0,4,0,0,0,"2017-02-28 18:15:44","2017-07-11 02:04:29",0,0
"1149",836608589615648768,566955206,"Tue Feb 28 16:06:45 +0000 2017","2017-02-28 16:06:45",NA,NA,"","Gracias Mi Estimado Javier https://t.co/xlJyejq5l0",0,0,0,0,0,"2017-02-28 18:15:55","2017-07-11 02:04:29",0,0
"1150",836603106913767424,566955206,"Tue Feb 28 15:44:58 +0000 2017","2017-02-28 15:44:58",NA,NA,"","Muchas gracias, Equipo muy trabajador ???????? https://t.co/GT8XJhiQBG",1,1,0,0,0,"2017-02-28 18:16:06","2017-07-10 06:03:47",0,0
"1151",836598859392499712,566955206,"Tue Feb 28 15:28:05 +0000 2017","2017-02-28 15:28:05",NA,NA,"","¿Sabes cuantas muertes ha provocado la contaminación en #Mty? No más discursos, sólo queremos que se aplique la Ley. https://t.co/wLf1Qa2CQX",5,4,0,0,0,"2017-02-28 18:16:18","2017-07-10 06:03:47",0,0
"1152",836588881973768192,566955206,"Tue Feb 28 14:48:27 +0000 2017","2017-02-28 14:48:27",99166169,836587326105137152,"MarkoCortes","Muchas gracias @MarkoCortes igualmente muchas felicidades @LuzArgeliaBC un abrazo a los 2 ????????",0,0,0,0,0,"2017-02-28 18:16:18","2017-07-09 13:30:53",0,0
"1153",836588742794182656,566955206,"Tue Feb 28 14:47:54 +0000 2017","2017-02-28 14:47:54",19545349,836576713668706304,"diputadospan","Muchas gracias @diputadospan abrazo fuerte a todos ????",0,1,0,0,0,"2017-02-28 18:16:18","2017-07-09 13:30:53",0,0
"1154",836588609109098496,566955206,"Tue Feb 28 14:47:22 +0000 2017","2017-02-28 14:47:22",411695171,836568003420516352,"Rafa_Narro","Muchas gracias @Rafa_Narro un abrazo",0,1,0,0,0,"2017-02-28 18:16:19","2017-07-09 13:30:53",0,0
"1155",836588478079074304,566955206,"Tue Feb 28 14:46:50 +0000 2017","2017-02-28 14:46:50",142004355,836566043623587840,"JLozanoA","Muchas gracias @JLozanoA y muchas felicidades a @AaronIrizar @LuzArgeliaBC @daniDlosantos @GustavoPuebla01 un abrazo",0,3,0,0,0,"2017-02-28 18:16:19","2017-07-09 13:30:53",0,0
"1156",836554692872196096,566955206,"Tue Feb 28 12:32:35 +0000 2017","2017-02-28 12:32:35",NA,NA,"","RT @elmundoes: Eva morirá al poco de nacer pero será un milagro para algunas familias. Esta es su historia https://t.co/IwdkoDHvzE",300,0,0,0,0,"2017-02-28 18:16:19","2017-07-08 00:54:20",1,1
"1157",836332570824433664,566955206,"Mon Feb 27 21:49:57 +0000 2017","2017-02-27 21:49:57",NA,NA,"","RT @maricelacj: Compartimos boletín sobre las acciones que realizamos contra la #violenciaobstétrica https://t.co/x9VX5EiVae",2,0,0,0,0,"2017-02-28 18:16:19","2017-07-08 00:54:20",1,1
"1158",836332294994481152,566955206,"Mon Feb 27 21:48:52 +0000 2017","2017-02-27 21:48:52",NA,NA,"","RT @anaschwarz: Si alguien tiene dudas sobre la similitud entre #MORENA y la revolución bolivariana de #Venezuela solo lean esta columna ????…",2,0,0,0,0,"2017-02-28 18:16:26","2017-07-07 20:20:00",1,1
"1159",836332149137522688,566955206,"Mon Feb 27 21:48:17 +0000 2017","2017-02-27 21:48:17",NA,NA,"","RT @JovitaMorin: Hoy recordamos a Manuel Gómez Morín, forjador de la historia del PAN, hombre de lucha por un mejor México https://t.co/PFE…",8,0,0,0,0,"2017-02-28 18:16:27","2017-07-05 11:00:19",1,1
"1160",836963406410301440,566955206,"Wed Mar 01 15:36:40 +0000 2017","2017-03-01 15:36:40",NA,NA,"","La discriminación sigue minando los esfuerzos para conseguir un mundo más justo y equitativo. #Dia0discriminación https://t.co/zSXP3If9IR",1,1,0,0,0,"2017-03-01 11:06:25","2017-07-14 14:10:18",0,0
"1161",836795673735544832,566955206,"Wed Mar 01 04:30:10 +0000 2017","2017-03-01 04:30:10",NA,NA,"","Muchas Gracias Mi Coordinadora !!!, ???????????????? https://t.co/Zpz5RBsGj0",0,1,0,0,0,"2017-03-01 11:06:25","2017-07-14 14:10:18",0,0
"1162",837343698161561600,566955206,"Thu Mar 02 16:47:49 +0000 2017","2017-03-02 16:47:49",NA,NA,"","RT @eleconomista: ¿Quién consideras que es el candidato más fuerte para la contienda por la gubernatura del Estado de México?",1167,0,0,0,0,"2017-03-02 16:47:47","2017-07-15 06:25:02",1,1
"1163",837318315949211648,566955206,"Thu Mar 02 15:06:57 +0000 2017","2017-03-02 15:06:57",NA,NA,"","RT @ONUMedioAmb: Nadie debería ser amenazado por defender el #medioambiente. Sin embargo, Berta Cáceres murió hace un año justo por eso. #C…",230,0,0,0,0,"2017-03-02 16:47:47","2017-07-15 06:25:02",1,1
"1164",836994976886231040,566955206,"Wed Mar 01 17:42:07 +0000 2017","2017-03-01 17:42:07",NA,NA,"","Feliz Aniversario @CristinaJM2015, sigue cosechando éxitos, Bendiciones Siempre ????",0,0,0,0,0,"2017-03-02 16:47:47","2017-07-14 14:10:18",0,0
"1165",837781482336890880,566955206,"Fri Mar 03 21:47:25 +0000 2017","2017-03-03 21:47:25",NA,NA,"","Yo ya acudí a actualizar mis datos en el @PAN_MTY Si aún no haz hecho tu trámite asiste a tu Comité, es obligación… https://t.co/CTs2bZLvU9",0,2,0,0,0,"2017-03-04 07:08:07","2017-07-15 21:41:37",0,0
"1166",837761642817589248,566955206,"Fri Mar 03 20:28:35 +0000 2017","2017-03-03 20:28:35",NA,NA,"","Sra Leos Vzz, totalmente de acuerdo, que se apliquen las leyes y se sancione a los culpables, por nuestra salud y p… https://t.co/cij6pOg0ZP",1,4,0,0,0,"2017-03-04 07:08:18","2017-07-15 06:25:02",0,0
"1167",837707784196145152,566955206,"Fri Mar 03 16:54:34 +0000 2017","2017-03-03 16:54:34",NA,NA,"","Tomemos conciencia acerca de la flora y fauna del mundo y el daño que estamos provocando. #DiaMundialDeLaNaturaleza https://t.co/IHKPg4bB9F",1,2,0,0,0,"2017-03-04 07:08:29","2017-07-15 06:25:02",0,0
"1168",838518253731270656,566955206,"Sun Mar 05 22:35:05 +0000 2017","2017-03-05 22:35:05",NA,NA,"","Fuente y origen de nuestra inspiración y trabajo. ¡Feliz Día de la Familia! #diadelafamilia #FelizDomingo… https://t.co/kibvG9OX4r",3,7,0,0,0,"2017-03-05 23:36:40","2017-07-15 21:41:37",0,0
"1169",838177007611621376,566955206,"Sat Mar 04 23:59:05 +0000 2017","2017-03-04 23:59:05",NA,NA,"","Gracias Vecinos de San Ángel Sur por la sorpresa. Detalles como este, me comprometen aún más con ustedes y con mi c… https://t.co/cvwx8wP4Ib",2,3,0,0,0,"2017-03-05 23:36:50","2017-07-15 21:41:37",0,0
"1170",839701958629945344,566955206,"Thu Mar 09 04:58:42 +0000 2017","2017-03-09 04:58:42",NA,NA,"","Ese Mi Iron Man del IMEX ????✔️???? https://t.co/wpevb7GWN1",0,2,0,0,0,"2017-03-09 05:23:08","2017-07-20 01:04:22",0,0
"1171",839516827105415168,566955206,"Wed Mar 08 16:43:03 +0000 2017","2017-03-08 16:43:03",NA,NA,"","RT @CanalCongreso: ????#EnVivo #TV #Internet
Sigue la reunión de la #ComisiónDeEnergía de la #CámaraDeDiputados https://t.co/2X4ltPyIWj https:…",3,0,0,0,0,"2017-03-09 05:23:18","2017-07-18 05:09:56",1,1
"1172",839508572186771456,566955206,"Wed Mar 08 16:10:15 +0000 2017","2017-03-08 16:10:15",NA,NA,"","El Camino hacia la igualdad de género no termina hasta que el día de la mujer sea una realidad diaria y tangible.… https://t.co/9YOuWkCVI8",1,2,0,0,0,"2017-03-09 05:23:24","2017-07-18 05:09:56",0,0
"1173",839281824056537088,566955206,"Wed Mar 08 01:09:14 +0000 2017","2017-03-08 01:09:14",NA,NA,"","RT @diputadospan: Entregando firmas ciudadanas que respaldan nuestra iniciativa para #QueBajeLaGasolina https://t.co/hvqI0NDa7K",71,0,0,0,0,"2017-03-09 05:23:34","2017-07-18 05:09:56",1,1
"1174",839276049464717312,566955206,"Wed Mar 08 00:46:17 +0000 2017","2017-03-08 00:46:17",NA,NA,"","RT @AlemanMargarita: Los @diputadospan presentamos 120 mil firmas ciudadanas a favor de que disminuya el IEPS para que pueda bajar la #Gaso…",24,0,0,0,0,"2017-03-09 05:23:39","2017-07-18 05:09:56",1,1
"1175",839122844231544832,566955206,"Tue Mar 07 14:37:30 +0000 2017","2017-03-07 14:37:30",NA,NA,"","Nuestra recompensa se encuentra en el esfuerzo y no en el resultado. #TuesdayMotivation #FelizMartes https://t.co/LnOCzmF5Zb",2,5,0,0,0,"2017-03-09 05:23:39","2017-07-15 21:41:37",0,0
"1176",840374334921236480,566955206,"Sat Mar 11 01:30:29 +0000 2017","2017-03-11 01:30:29",NA,NA,"","Hoy regresamos a la Col. República ahora con nuestra Brigada de Lentes ???? #VecinoALaVista https://t.co/BPtTYavLd0",2,3,0,0,0,"2017-03-11 07:18:03","2017-07-20 01:04:22",0,0
"1177",840294914827067392,566955206,"Fri Mar 10 20:14:54 +0000 2017","2017-03-10 20:14:54",NA,NA,"","RT @RicardoAnayaC: Ya demostramos que unidos podemos escribir una nueva historia, ¡este 2017 vamos juntos por el cambio! https://t.co/LNU9I…",92,0,0,0,0,"2017-03-11 07:18:03","2017-07-20 01:04:22",1,1
"1178",840765252614549504,566955206,"Sun Mar 12 03:23:51 +0000 2017","2017-03-12 03:23:51",NA,NA,"","RT @RicardoAnayaC: El cambio lo hacemos juntos. ¡Sígueme en Instagram! #SePuede https://t.co/Co96hVeiPy",79,0,0,0,0,"2017-03-13 09:45:40","2017-07-22 00:25:01",1,1
"1179",840725375663689728,566955206,"Sun Mar 12 00:45:24 +0000 2017","2017-03-12 00:45:24",NA,NA,"","A la Col. Altamira acudimos la semana pasada para realizar los estudios de la vista, ahora vamos a entregarlos.… https://t.co/7bVt7WdiH0",2,2,0,0,0,"2017-03-13 09:45:40","2017-07-22 00:25:01",0,0
