"","id_tweet","id_twitter","created_at","created_at_datetime","in_reply_to_user_id","in_reply_to_status_id","in_reply_to_screen_name","text","retweet_count","favorite_count","longitude","latitude","retweeted","creation_date","modification_date","RT_temp","is_retweeted"
"1160",838901525061615616,2932681820,"Mon Mar 06 23:58:04 +0000 2017","2017-03-06 23:58:04",NA,NA,"","Lamento la muerte de Jesús Silva Herzog Flores, de raíces potosinas, fundador de Infonavit y ex titular de Hacienda. Q.E.P.D.",12,16,0,0,0,"2017-03-09 09:21:11","2017-05-10 21:53:19",0,0
"1161",840336378822983680,2932681820,"Fri Mar 10 22:59:40 +0000 2017","2017-03-10 22:59:40",NA,NA,"","Envío un abrazo solidario a @RamonZamanillo y familia, por la pérdida de su mamá la Sra. Teresa Pérez Velasco.",6,6,0,0,0,"2017-03-11 09:25:34","2017-05-13 04:35:55",0,0
"1162",842445199993389056,2932681820,"Thu Mar 16 18:39:22 +0000 2017","2017-03-16 18:39:22",NA,NA,"","Ayudemos a salvar vidas con la #ColectaNacional2017 @CruzRoja_MX Todos podemos necesitarlo #ProsperemosJuntos https://t.co/vmRloUH1ji",20,15,0,0,0,"2017-03-16 18:03:12","2017-05-13 04:35:55",0,0
"1163",842091425202286592,2932681820,"Wed Mar 15 19:13:35 +0000 2017","2017-03-15 19:13:35",NA,NA,"","Envío mi más sentido pésame al Dip. Fernando Chávez Méndez por la pérdida de su señora madre, Delia Méndez Rivera. Q.E.P.D. @FERNANDOCH63",5,10,0,0,0,"2017-03-16 18:03:12","2017-05-13 04:35:55",0,0
"1164",843263926993207296,2932681820,"Sun Mar 19 00:52:41 +0000 2017","2017-03-19 00:52:41",NA,NA,"","La primer terminal privada de almacenamiento de gasolina y diésel de #México estará en #SLP https://t.co/eQelL4bonS",4,7,0,0,0,"2017-03-18 22:36:33","2017-03-19 05:26:53",0,0
"1165",843212891973206016,2932681820,"Sat Mar 18 21:29:54 +0000 2017","2017-03-18 21:29:54",NA,NA,"","Arrancamos en #SLP #CampañadeReforestación2017 es responsabilidad de todos nosotros, vamos por más de 7 millones de… https://t.co/BUl0t2pTSX",12,22,0,0,0,"2017-03-18 22:36:33","2017-05-16 18:03:28",0,0
"1166",842895520905355264,2932681820,"Sat Mar 18 00:28:47 +0000 2017","2017-03-18 00:28:47",NA,NA,"","Reunión con @AmiaMexico para seguir impulsando a #SLP con inversión y empleos. #ProsperemosJuntos https://t.co/ybVkVmJgX6",19,15,0,0,0,"2017-03-18 22:36:35","2017-05-13 04:35:55",0,0
"1167",843620607782764544,2932681820,"Mon Mar 20 00:30:01 +0000 2017","2017-03-20 00:30:01",NA,NA,"","Asistimos a la @AmiaMexico donde refrendamos a #SLP como una de las opciones más atractivas de inversión del país https://t.co/XFdNZT6pfQ",13,10,0,0,0,"2017-03-20 02:40:59","2017-05-16 18:03:28",0,0
"1168",843592949158088704,2932681820,"Sun Mar 19 22:40:06 +0000 2017","2017-03-19 22:40:06",NA,NA,"","Arrancamos la #ColectaNacional2017 , la Cruz Roja es de todos. #Ayudarnosmueve https://t.co/GZMOufiooI",11,8,0,0,0,"2017-03-20 02:41:00","2017-05-16 18:03:28",0,0
"1169",843537558663389184,2932681820,"Sun Mar 19 19:00:00 +0000 2017","2017-03-19 19:00:00",NA,NA,"","Gracias Amy Glover por darnos otra perspectiva de la relación bilateral entre #USA y #México @chilangagringa https://t.co/qWO6aBZKi5",10,8,0,0,0,"2017-03-20 02:41:00","2017-05-16 18:03:28",0,0
"1170",843531283808604160,2932681820,"Sun Mar 19 18:35:04 +0000 2017","2017-03-19 18:35:04",NA,NA,"","La primer terminal privada de almacenamiento de gasolina y diésel de #México estará en #SLP https://t.co/RGI9uf95te",26,18,0,0,0,"2017-03-20 02:41:01","2017-05-16 18:03:28",0,0
"1171",843941513067356160,2932681820,"Mon Mar 20 21:45:11 +0000 2017","2017-03-20 21:45:11",NA,NA,"","Arrancamos la Campaña de Reforestación 2017, en 2016 logramos más de 6 millones y con tu ayuda este año ¡lograremos… https://t.co/3UhIVbNDPN",23,30,0,0,0,"2017-03-21 11:23:34","2017-05-16 18:03:28",0,0
"1172",844611921856815104,2932681820,"Wed Mar 22 18:09:08 +0000 2017","2017-03-22 18:09:08",NA,NA,"","Felicidades a @canacoslp e integrantes por su 104 Aniversario, y a quienes fueron reconocidos como empresarios dist… https://t.co/8OQANzugzQ",13,13,0,0,0,"2017-03-22 19:52:33","2017-05-16 18:03:28",0,0
"1173",844609638884564992,2932681820,"Wed Mar 22 18:00:04 +0000 2017","2017-03-22 18:00:04",NA,NA,"","Más preparación para jóvenes en Tamasopo, entregamos becas e iniciamos la construcción de 2 aulas didácticas benefi… https://t.co/D2mO9fyRCB",15,14,0,0,0,"2017-03-22 19:52:46","2017-05-16 18:03:28",0,0
"1174",844602078022414336,2932681820,"Wed Mar 22 17:30:02 +0000 2017","2017-03-22 17:30:02",NA,NA,"","Mejor bienestar para las familias de Tamasopo con la entrega de 100 acciones de vivienda con una inversión de 4,311… https://t.co/JC3D1J4dpj",13,15,0,0,0,"2017-03-22 19:52:56","2017-05-16 18:03:28",0,0
"1175",844594535950888960,2932681820,"Wed Mar 22 17:00:03 +0000 2017","2017-03-22 17:00:03",NA,NA,"","Entregamos la ampliación de la Clínica IMSS-PROSPERA en Tamasopo. Salud de calidad para más potosinos y más potosin… https://t.co/bggmdMApXq",16,15,0,0,0,"2017-03-22 19:53:08","2017-05-16 18:03:28",0,0
"1176",844335858195091456,2932681820,"Tue Mar 21 23:52:10 +0000 2017","2017-03-21 23:52:10",NA,NA,"","Conmemoramos el Día Mundial del Síndrome de Down recordatorio de una sociedad más incluyente con más oportunidades… https://t.co/PHq8gy7JFa",13,14,0,0,0,"2017-03-22 19:53:18","2017-05-16 18:03:28",0,0
"1177",844314085214834688,2932681820,"Tue Mar 21 22:25:39 +0000 2017","2017-03-21 22:25:39",NA,NA,"","Hoy celebramos el natalicio de Benito Juárez, abogado y político mexicano de origen zapoteca, Presidente y arquitec… https://t.co/BDVF9SaScG",20,23,0,0,0,"2017-03-22 19:53:28","2017-05-16 18:03:28",0,0
"1178",845112637469929472,2932681820,"Fri Mar 24 03:18:48 +0000 2017","2017-03-24 03:18:48",NA,NA,"","#SanLuisPotosí es y siempre será tu casa @paula_hdz.",10,10,0,0,0,"2017-03-24 11:06:58","2017-05-21 20:45:43",0,0
"1179",845107358669983744,2932681820,"Fri Mar 24 02:57:50 +0000 2017","2017-03-24 02:57:50",NA,NA,"","RT @paula_hdz: Gracias a las #MujeresPROSPERA por confiar y creer en este programa https://t.co/ELSEZgIG5a",201,0,0,0,0,"2017-03-24 11:06:59","2017-05-21 20:45:43",1,1
"1180",845107335198658560,2932681820,"Fri Mar 24 02:57:44 +0000 2017","2017-03-24 02:57:44",NA,NA,"","RT @paula_hdz: Escuchando testimonios de #MujeresPROSPERA con apoyos productivos en #SLP https://t.co/OkcqsENDHn",88,0,0,0,0,"2017-03-24 11:06:59","2017-05-21 20:45:43",1,1
"1181",845107309860868096,2932681820,"Fri Mar 24 02:57:38 +0000 2017","2017-03-24 02:57:38",NA,NA,"","RT @paula_hdz: Siempre vamos a ir a un lado de ustedes para que saquen adelante a sus familias: @JMCarrerasGob https://t.co/Bs3buHpgJq",93,0,0,0,0,"2017-03-24 11:06:59","2017-05-21 20:45:43",1,1
"1182",845082164949504000,2932681820,"Fri Mar 24 01:17:43 +0000 2017","2017-03-24 01:17:43",NA,NA,"","Con el ombudsman, Luis Raúl González Pérez, firmamos el convenio de Derechos Humanos para impulsar acciones conjunt… https://t.co/puozJZpA2T",15,12,0,0,0,"2017-03-24 11:06:59","2017-05-21 20:45:43",0,0
"1183",845081788653326336,2932681820,"Fri Mar 24 01:16:13 +0000 2017","2017-03-24 01:16:13",NA,NA,"","Gracias @paula_hdz Coordinadora de @Prospera_Mx por acompañarnos.",8,8,0,0,0,"2017-03-24 11:07:12","2017-05-21 20:45:43",0,0
"1184",845081676195627008,2932681820,"Fri Mar 24 01:15:47 +0000 2017","2017-03-24 01:15:47",NA,NA,"","Más de mil familias de Santa María del Río, se beneficiaron con proyectos productivos, apoyos alimentarios y educat… https://t.co/6co8fp6nn4",17,10,0,0,0,"2017-03-24 11:07:12","2017-05-16 18:03:28",0,0
"1185",844993170412756992,2932681820,"Thu Mar 23 19:24:05 +0000 2017","2017-03-23 19:24:05",NA,NA,"","Recordamos con aprecio a Luis Donaldo Colosio Murrieta, su legado y principios permanecen en nuestra memoria. https://t.co/PdJKPhmAzL",13,21,0,0,0,"2017-03-24 11:07:23","2017-05-16 18:03:28",0,0
"1186",844764638696783872,2932681820,"Thu Mar 23 04:15:59 +0000 2017","2017-03-23 04:15:59",NA,NA,"","#SLP no sería lo mismo sin sus cascadas, manantiales, ríos, lagos y lagunas.  #DiaMundialDelAgua #cuídala https://t.co/jYfc8hh49t",30,50,0,0,0,"2017-03-24 11:07:23","2017-05-16 18:03:28",0,0
"1187",844715600391929856,2932681820,"Thu Mar 23 01:01:07 +0000 2017","2017-03-23 01:01:07",NA,NA,"","#SLP continúa creciendo, hoy inauguramos la planta @ContinentalMex con inversión de 167mdd, generará cerca de 1,000… https://t.co/ulIU6wU4bK",26,32,0,0,0,"2017-03-24 11:07:24","2017-05-16 18:03:28",0,0
"1188",845822866268532736,2932681820,"Sun Mar 26 02:21:00 +0000 2017","2017-03-26 02:21:00",NA,NA,"","La preservación y difusión de nuestra entidad y raíces es vital. Sintámonos orgullosos del patrimonio que represent… https://t.co/koqnyL61tN",29,25,0,0,0,"2017-03-26 03:16:19","2017-05-21 20:45:43",0,0
"1189",845821709139824640,2932681820,"Sun Mar 26 02:16:24 +0000 2017","2017-03-26 02:16:24",NA,NA,"","La reforestación es la vía para un #SLP verde, les invito a plantar un árbol para ayudar a nuestra casa, la tierra. https://t.co/NA1bCXDX8l",20,19,0,0,0,"2017-03-26 03:16:29","2017-05-21 20:45:43",0,0
"1190",845450137379860480,2932681820,"Sat Mar 25 01:39:55 +0000 2017","2017-03-25 01:39:55",NA,NA,"","Les invito a vivir y a conocer una de las más grandes representaciones del Vía Crucis en México, nuestra tradiciona… https://t.co/t5MSgggcRl",37,24,0,0,0,"2017-03-26 03:16:29","2017-05-21 20:45:43",0,0
"1191",845436941181038592,2932681820,"Sat Mar 25 00:47:28 +0000 2017","2017-03-25 00:47:28",NA,NA,"","#SLP es el corazón de México, somos centro para el comercio, la industria y el transporte, estamos en constante mov… https://t.co/9OwSSQ0l4W",34,31,0,0,0,"2017-03-26 03:16:40","2017-05-21 20:45:43",0,0
"1192",846052728119943168,2932681820,"Sun Mar 26 17:34:23 +0000 2017","2017-03-26 17:34:23",NA,NA,"","El talento de las y los potosinos, contribuye a la atracción de inversiones y con ello generamos más empleos. Conti… https://t.co/XedtzCqTPp",48,24,0,0,0,"2017-03-28 07:09:29","2017-05-24 03:11:34",0,0
"1193",846903672231542784,2932681820,"Wed Mar 29 01:55:44 +0000 2017","2017-03-29 01:55:44",NA,NA,"","Desde Alemania, parte de las actividades que estamos realizando para seguir posicionando a SLP como un destino de i… https://t.co/cn16K8XrOP",61,63,0,0,0,"2017-03-29 07:31:54","2017-05-24 03:11:34",0,0
"1194",847606935662673920,2932681820,"Fri Mar 31 00:30:15 +0000 2017","2017-03-31 00:30:15",NA,NA,"","Disfruta #SemanaSanta2017 visitando nuestro maravilloso estado. A donde vayas somos #TuDestinoporTradición Visita:… https://t.co/ViyAyudNtx",71,51,0,0,0,"2017-03-31 10:03:17","2017-05-24 03:11:34",0,0
"1195",847271707970682880,2932681820,"Thu Mar 30 02:18:11 +0000 2017","2017-03-30 02:18:11",NA,NA,"","“Operativo Semana Santa y Pascua 2017” entrará pronto en vigor para la seguridad de #SLP participarán más de 15 Dep… https://t.co/rrYNQgz3sg",44,21,0,0,0,"2017-03-31 10:03:29","2017-05-24 03:11:34",0,0
"1196",847233978721484800,2932681820,"Wed Mar 29 23:48:16 +0000 2017","2017-03-29 23:48:16",NA,NA,"","RT @SECTUR_mx: Seguimos en vivo en #BlueRoom #TianguisTurístico con el Srio. Arturo Esper De SLP @secturslp https://t.co/TR9upxIzUb",26,0,0,0,0,"2017-03-31 10:03:39","2017-03-31 10:03:39",1,1
"1197",848335290691407872,2932681820,"Sun Apr 02 00:44:29 +0000 2017","2017-04-02 00:44:29",NA,NA,"","SLP ocupa el 2do lugar a nivel nacional en donación de órganos. Como yo, conviértete en donador voluntario y salvem… https://t.co/2JjuiLXSpb",39,34,0,0,0,"2017-04-01 22:20:01","2017-05-24 03:11:34",0,0
"1198",848247937486532608,2932681820,"Sat Apr 01 18:57:22 +0000 2017","2017-04-01 18:57:22",NA,NA,"","Más bienestar y oportunidades para las y los potosinos, #SLP es el 2do Estado con menor tasa de desocupación en el país #prosperemosJuntos",30,26,0,0,0,"2017-04-01 22:20:05","2017-05-24 03:11:34",0,0
"1199",847966620081422336,2932681820,"Sat Apr 01 00:19:31 +0000 2017","2017-04-01 00:19:31",NA,NA,"","Gastón Zúñiga y Ruth Hernández son algunos de los talentos potosinos que se preparan para el proyecto de BMW. Conóc… https://t.co/aupMGE9SDw",48,47,0,0,0,"2017-04-01 22:20:06","2017-05-24 03:11:34",0,0
"1200",847884563573374976,2932681820,"Fri Mar 31 18:53:27 +0000 2017","2017-03-31 18:53:27",NA,NA,"","Mi más sentido pésame para @maradi5 por la muerte de su Sra. Madre Caridad Torres de Rangel. Les deseo pronta resignación. Q.E.P.D.",6,11,0,0,0,"2017-04-01 22:20:10","2017-05-24 03:11:34",0,0
"1201",848707686246088704,2932681820,"Mon Apr 03 01:24:15 +0000 2017","2017-04-03 01:24:15",NA,NA,"","#DíaMundialAutismo promovamos la igualdad de oportunidades y su plena integración a la sociedad.  #ProsperemosJuntos https://t.co/i1xiqFu6dt",20,23,0,0,0,"2017-04-03 20:57:37","2017-05-24 03:11:34",0,0
"1202",849419270010396672,2932681820,"Wed Apr 05 00:31:50 +0000 2017","2017-04-05 00:31:50",NA,NA,"","Siguen llegando inversiones a SLP. Hoy la cadena H-E-B inauguró una sucursal en la carretera 57 que generará 400 em… https://t.co/WF1ZzEbHe1",38,48,0,0,0,"2017-04-05 06:45:38","2017-05-24 03:11:34",0,0
"1203",851112000209829888,2932681820,"Sun Apr 09 16:38:08 +0000 2017","2017-04-09 16:38:08",NA,NA,"","Al fortalecer la educación, infraestructura y servicios de salud en Tanlajás construimos un San Luis incluyente par… https://t.co/ROQiwdhECu",44,27,0,0,0,"2017-04-09 13:48:08","2017-06-03 13:15:34",0,0
"1204",850858436937924608,2932681820,"Sat Apr 08 23:50:34 +0000 2017","2017-04-08 23:50:34",NA,NA,"","Con orgullo les comunico que en SLP se creará el Instituto Universitario de Ciencias Penales y Forenses de la… https://t.co/HRJpkKiFu5",34,32,0,0,0,"2017-04-09 13:48:18","2017-06-03 13:15:34",0,0
"1205",850799349428658176,2932681820,"Sat Apr 08 19:55:46 +0000 2017","2017-04-08 19:55:46",NA,NA,"","En SLP estamos comprometidos con el bienestar de las familias. Con trabajo impulsamos más inversiones y mejores emp… https://t.co/zLwQFU3sQN",37,14,0,0,0,"2017-04-09 13:48:27","2017-06-01 07:56:15",0,0
"1206",850768766258434048,2932681820,"Sat Apr 08 17:54:15 +0000 2017","2017-04-08 17:54:15",NA,NA,"","En estas vacaciones, la prevención es nuestra mejor acompañante. Les deseo una feliz #SemanaSanta2017… https://t.co/ajVDbEbZUZ",21,21,0,0,0,"2017-04-09 13:48:37","2017-06-01 07:56:15",0,0
"1207",850534106773336064,2932681820,"Sat Apr 08 02:21:47 +0000 2017","2017-04-08 02:21:47",NA,NA,"","Agradezco al titular de la @ASF_Mexico Juan Manuel Portal por ofrecer en SLP su ponencia sobre los alcances del SNA… https://t.co/nVnu8uEOoP",7,10,0,0,0,"2017-04-09 13:48:47","2017-06-01 07:56:15",0,0
"1208",850491704390033408,2932681820,"Fri Apr 07 23:33:18 +0000 2017","2017-04-07 23:33:18",NA,NA,"","Gracias a procuradores, fiscales y delegados por venir a SLP para dar mejores resultados en procuración de justicia… https://t.co/Cj8MahV3fA",12,7,0,0,0,"2017-04-09 13:48:57","2017-05-30 04:47:58",0,0
"1209",850483786206728192,2932681820,"Fri Apr 07 23:01:50 +0000 2017","2017-04-07 23:01:50",NA,NA,"","Rescatamos la infraestructura urbana con los diseños de jóvenes potosinos. Apoyando el arte emergente embellecemos… https://t.co/HtkiS85jaV",7,9,0,0,0,"2017-04-09 13:49:06","2017-05-30 04:47:58",0,0
"1210",850473837942546432,2932681820,"Fri Apr 07 22:22:18 +0000 2017","2017-04-07 22:22:18",NA,NA,"","Con resultados, en San Luis Potosí conmemoramos el Día Mundial de la Salud. #ProsperemosJuntos https://t.co/ka876NFJcZ",10,10,0,0,0,"2017-04-09 13:49:16","2017-05-30 04:47:58",0,0
"1211",850417150737080320,2932681820,"Fri Apr 07 18:37:03 +0000 2017","2017-04-07 18:37:03",NA,NA,"","RT @PGR_mx: Intercambiamos información y aspiramos a tener inteligencia compartida, un federalismo cooperativo para una mejor procuración d…",26,0,0,0,0,"2017-04-09 13:49:16","2017-05-30 04:47:58",1,1
"1212",850417092620722176,2932681820,"Fri Apr 07 18:36:49 +0000 2017","2017-04-07 18:36:49",NA,NA,"","RT @PGR_mx: La procuración de justicia es una sola cadena de valor constitucional, todos los elementos forman parte de un proceso igualitar…",33,0,0,0,0,"2017-04-09 13:49:16","2017-05-30 04:47:58",1,1
"1213",850417055278825472,2932681820,"Fri Apr 07 18:36:40 +0000 2017","2017-04-07 18:36:40",NA,NA,"","RT @PGR_mx: La sociedad demanda un esfuerzo coordinado y proyectos de vida con libertad, paz y pleno desarrollo para todos, Dr. Juan Manuel…",19,0,0,0,0,"2017-04-09 13:49:16","2017-05-30 04:47:58",1,1
"1214",850392736729640960,2932681820,"Fri Apr 07 17:00:02 +0000 2017","2017-04-07 17:00:02",NA,NA,"","Celebro el Día Mundial de la Salud con la convicción de seguir ampliando la atención médica para las familias de SL… https://t.co/DxN7VP5KYg",4,4,0,0,0,"2017-04-09 13:49:16","2017-05-27 17:27:15",0,0
"1215",850385508312035328,2932681820,"Fri Apr 07 16:31:19 +0000 2017","2017-04-07 16:31:19",NA,NA,"","Agradezco la presencia de @RaulCervantesA titular de la @PGR_mx en la 1a. Sesión Ordinaria 2017 de la #CNPJ Zona NE y NO. #JMCLalmomento",16,13,0,0,0,"2017-04-09 13:49:25","2017-05-27 17:27:15",0,0
"1216",850382337527341056,2932681820,"Fri Apr 07 16:18:43 +0000 2017","2017-04-07 16:18:43",NA,NA,"","RT @PGR_mx: 1a. Sesión Ordinaria 2017 de la #CNPJ Zona NE y NO. https://t.co/I1mvCxDECi",48,0,0,0,0,"2017-04-09 13:49:26","2017-05-27 17:27:15",1,1
"1217",850368323686604800,2932681820,"Fri Apr 07 15:23:02 +0000 2017","2017-04-07 15:23:02",NA,NA,"","En Ciudad Valles entregué obras y presencié la inauguración de la FENAHUAP. Con infraestructura y cultura, SLP avan… https://t.co/9IZvOIXXfC",16,22,0,0,0,"2017-04-09 13:49:31","2017-05-27 17:27:15",0,0
"1218",850164787086450688,2932681820,"Fri Apr 07 01:54:15 +0000 2017","2017-04-07 01:54:15",NA,NA,"","Soy un convencido que con esfuerzo, trabajo y perseverancia las cosas sí cambian. #ProsperemosJuntos https://t.co/SehEgCRqEz",24,22,0,0,0,"2017-04-09 13:49:40","2017-05-26 19:18:59",0,0
"1219",850144934191538176,2932681820,"Fri Apr 07 00:35:21 +0000 2017","2017-04-07 00:35:21",NA,NA,"","La modernización del Entronque Cerro Gordo beneficiará a 190 mil habitantes de #SLP con una conectividad más eficie… https://t.co/oBIU1O6fE5",39,28,0,0,0,"2017-04-09 13:49:40","2017-05-26 19:18:59",0,0
"1220",850129438725492736,2932681820,"Thu Apr 06 23:33:47 +0000 2017","2017-04-06 23:33:47",NA,NA,"","Banderazo de Inicio del Operativo de Seguridad Semana Santa 2017. Garantizamos el bienestar de potosinos y turistas… https://t.co/bFDLZmbpGK",29,18,0,0,0,"2017-04-09 13:49:50","2017-05-26 19:18:59",0,0
"1221",850111572953374720,2932681820,"Thu Apr 06 22:22:47 +0000 2017","2017-04-06 22:22:47",NA,NA,"","Los artistas urbanos, a través del programa “Enchúlame Tu Barrio”, contribuyen al embellecimiento de San Luis Potos… https://t.co/nYDJiUyr2r",25,40,0,0,0,"2017-04-09 13:50:00","2017-05-26 19:18:59",0,0
"1222",850058921058250752,2932681820,"Thu Apr 06 18:53:34 +0000 2017","2017-04-06 18:53:34",NA,NA,"","Celebramos el Día Internacional del Deporte para el Desarrollo y la Paz ampliando espacios y programas deportivos e… https://t.co/JrjoImdm6i",17,14,0,0,0,"2017-04-09 13:50:09","2017-05-24 03:11:34",0,0
"1223",850025731358769152,2932681820,"Thu Apr 06 16:41:41 +0000 2017","2017-04-06 16:41:41",NA,NA,"","Acompáñame a dar el Banderazo de Inicio del Operativo de Seguridad Semana Santa 2017 a través de Facebook Live. #JMCLenDirecto",8,7,0,0,0,"2017-04-09 13:50:20","2017-05-24 03:11:34",0,0
"1224",849971055925968896,2932681820,"Thu Apr 06 13:04:26 +0000 2017","2017-04-06 13:04:26",NA,NA,"","Celebramos a Leonora Carrington con la exposición “Un paseo por los sueños de la novia del viento” en el @CEARTSLP.… https://t.co/u5P1AogOv9",27,28,0,0,0,"2017-04-09 13:50:20","2017-05-24 03:11:34",0,0
"1225",849786074041692160,2932681820,"Thu Apr 06 00:49:22 +0000 2017","2017-04-06 00:49:22",NA,NA,"","En #SLP se edificará el primer Museo Leonora Carrington en el mundo y se exhibirán 100 de sus obras. #ProsperemosJuntos",46,45,0,0,0,"2017-04-09 13:50:30","2017-05-24 03:11:34",0,0
"1226",849749894831120384,2932681820,"Wed Apr 05 22:25:37 +0000 2017","2017-04-05 22:25:37",NA,NA,"","En SLP apostamos por los jóvenes y sus ideas. Hoy inauguré la Academia del Emprendimiento que inicia con 2500 alumn… https://t.co/uRMe6kE9xG",46,48,0,0,0,"2017-04-09 13:50:30","2017-05-24 03:11:34",0,0
"1227",849707223634804736,2932681820,"Wed Apr 05 19:36:03 +0000 2017","2017-04-05 19:36:03",NA,NA,"","Cada nueva empresa que llega genera crecimiento económico y empleo. Bienvenida la nueva tienda de @HEB_mexico en… https://t.co/NUeAAqGobR",31,35,0,0,0,"2017-04-09 13:50:39","2017-05-24 03:11:34",0,0
"1228",851608241196810240,2932681820,"Tue Apr 11 01:30:01 +0000 2017","2017-04-11 01:30:01",NA,NA,"","Hoy inauguramos con gusto el torneo San Luis Open Challenger Tour 2017, en su edición #63, el más antiguo de Latinoamérica. #JMCLalmomento",11,19,0,0,0,"2017-04-11 09:32:26","2017-06-03 13:15:34",0,0
"1229",851559163901526016,2932681820,"Mon Apr 10 22:15:00 +0000 2017","2017-04-10 22:15:00",NA,NA,"","En SLP honramos nuestra tradición y cultura. Los invito a visitar el Altar de Dolores instalado en Palacio de Gobie… https://t.co/EYllj0mvwz",33,27,0,0,0,"2017-04-11 09:32:27","2017-06-03 13:15:34",0,0
"1230",851540301923704832,2932681820,"Mon Apr 10 21:00:03 +0000 2017","2017-04-10 21:00:03",NA,NA,"","Esta Semana Santa los invito a la proyección Fiesta de Luz ""Vialucis Potosino” en la Catedral de San Luis Potosí.… https://t.co/Ndq9Sg1w2B",40,38,0,0,0,"2017-04-11 09:32:39","2017-06-03 13:15:34",0,0
"1231",851515036749058048,2932681820,"Mon Apr 10 19:19:39 +0000 2017","2017-04-10 19:19:39",NA,NA,"","En Tanlajás se destinarán 134.5 mdp en infraestructura y apoyos sociales en beneficio de pueblos y comunidades indí… https://t.co/MjpfaVs3rm",17,19,0,0,0,"2017-04-11 09:32:51","2017-06-03 13:15:34",0,0
"1232",851514751947493376,2932681820,"Mon Apr 10 19:18:31 +0000 2017","2017-04-10 19:18:31",NA,NA,"","San Luis Potosí, la mejor oferta vacacional del centro de México. #ProsperemosJuntos https://t.co/opLrfxzVQY",16,19,0,0,0,"2017-04-11 09:33:03","2017-06-03 13:15:34",0,0
"1233",851984855235674112,2932681820,"Wed Apr 12 02:26:33 +0000 2017","2017-04-12 02:26:33",NA,NA,"","Inauguramos la Copa Gobernador, tradición futbolística en la que participarán más de mil deportistas de todo el est… https://t.co/k6ovy1h4jY",23,20,0,0,0,"2017-04-12 01:33:10","2017-06-07 05:27:55",0,0
"1234",851966853060722688,2932681820,"Wed Apr 12 01:15:01 +0000 2017","2017-04-12 01:15:01",NA,NA,"","Declaramos inaugurada la XXXIII edición de la Copa Gobernador, el evento futbolístico amateur más importante del año en SLP. #JMCLalmomento",15,12,0,0,0,"2017-04-12 01:33:20","2017-06-07 05:27:55",0,0
"1235",851868145773981696,2932681820,"Tue Apr 11 18:42:47 +0000 2017","2017-04-11 18:42:47",NA,NA,"","En SLP estamos listos para la Semana Santa. Supervisé la rehabilitación realizada en vialidades del Centro Históric… https://t.co/iNCfxyB1Sw",23,21,0,0,0,"2017-04-12 01:33:20","2017-06-07 05:27:55",0,0
"1236",851805079858368512,2932681820,"Tue Apr 11 14:32:11 +0000 2017","2017-04-11 14:32:11",NA,NA,"","Inicio recorrido por las vialidades rehabilitadas en el Centro Histórico. Embellecemos #SLP para la Semana Santa 2017. #JMCLalmomento",11,11,0,0,0,"2017-04-12 01:33:29","2017-06-03 13:15:34",0,0
"1237",851794694921101312,2932681820,"Tue Apr 11 13:50:55 +0000 2017","2017-04-11 13:50:55",NA,NA,"","Inauguramos el torneo San Luis Open Challenger Tour 2017. El mayor de los éxitos a los que hacen posible este gran… https://t.co/Mpr8vFWGkA",15,11,0,0,0,"2017-04-12 01:33:30","2017-06-03 13:15:34",0,0
"1238",852572681983582208,2932681820,"Thu Apr 13 17:22:22 +0000 2017","2017-04-13 17:22:22",NA,NA,"","Las rehabilitaciones impulsadas por este gobierno le han dado una nueva cara al Centro Histórico de la capital.… https://t.co/nQE5zb9fKN",53,31,0,0,0,"2017-04-13 15:11:12","2017-06-07 05:27:55",0,0
"1239",852544414127869952,2932681820,"Thu Apr 13 15:30:02 +0000 2017","2017-04-13 15:30:02",NA,NA,"","Un gran gusto para los potosinos recibir a @edelamadrid titular de la @SECTUR_mx. Disfruta tu estancia. SLP es tu casa. #ProsperemosJuntos",34,29,0,0,0,"2017-04-13 15:11:21","2017-06-07 05:27:55",0,0
"1240",852523276983123968,2932681820,"Thu Apr 13 14:06:03 +0000 2017","2017-04-13 14:06:03",NA,NA,"","RT @edelamadrid: Variada arquitectura, rica historia y deliciosa gastronomía, tres excelentes razones para visitar San Luis Potosí: https:/…",107,0,0,0,0,"2017-04-13 15:11:22","2017-06-07 05:27:55",1,1
"1241",852343591791861760,2932681820,"Thu Apr 13 02:12:02 +0000 2017","2017-04-13 02:12:02",NA,NA,"","En #SLP la Semana Santa es una oportunidad para disfrutar lo mejor del tenis. #ProsperemosJuntos https://t.co/p5CYZPmmXs",8,11,0,0,0,"2017-04-13 15:11:22","2017-06-07 05:27:55",0,0
"1242",852210147241992192,2932681820,"Wed Apr 12 17:21:47 +0000 2017","2017-04-12 17:21:47",NA,NA,"","Modernizamos el Centro Histórico de SLP que se sigue consolidando como  uno de los más bellos e importantes de Méxi… https://t.co/ktvVu8WrSd",21,25,0,0,0,"2017-04-13 15:11:22","2017-06-07 05:27:55",0,0
"1243",854735714348539904,2932681820,"Wed Apr 19 16:37:29 +0000 2017","2017-04-19 16:37:29",NA,NA,"","Agradezco al secretario de Turismo @edelamadrid los generosos comentarios sobre su viaje a nuestro hermoso SLP.… https://t.co/ZfhJSlQePA",87,71,0,0,0,"2017-04-19 13:48:10","2017-06-13 23:37:51",0,0
"1244",854710570829848576,2932681820,"Wed Apr 19 14:57:34 +0000 2017","2017-04-19 14:57:34",NA,NA,"","Rumbo a Durango para la 4a. Reunión del Mecanismo de Coordinación Regional Noreste @SEP_mx con @aurelionuno y colegas gobernadores.",6,11,0,0,0,"2017-04-19 13:48:20","2017-06-10 22:20:28",0,0
"1245",854440809948631040,2932681820,"Tue Apr 18 21:05:38 +0000 2017","2017-04-18 21:05:38",NA,NA,"","Me reuní con los consejeros y presidente de la @CEDHSLP para seguir sumando esfuerzos por los derechos humanos en S… https://t.co/lxOPsfqETn",27,21,0,0,0,"2017-04-19 13:48:20","2017-06-10 22:20:28",0,0
