"","id_tweet","id_twitter","created_at","created_at_datetime","in_reply_to_user_id","in_reply_to_status_id","in_reply_to_screen_name","text","retweet_count","favorite_count","longitude","latitude","retweeted","creation_date","modification_date","RT_temp","is_retweeted"
"365",715382602580897792,2932681820,"Thu Mar 31 03:37:58 +0000 2016","2016-03-31 03:37:58",NA,NA,"","También agradezco a @JuanCLastiri subsecretario de @Sedatu_mx por trabajar junto a los potosinos y su respaldo para dar más apoyos a #SLP .",129,116,0,0,0,"2016-03-30 23:59:46","2016-04-11 07:03:03",0,NA
"366",715381939591467008,2932681820,"Thu Mar 31 03:35:20 +0000 2016","2016-03-31 03:35:20",NA,NA,"","y mejora del servicio en la capital y en la zona industrial, gracias por su respaldo para #SLP. @EnriqueOchoaR @CFEmx",23,10,0,0,0,"2016-03-30 23:59:47","2016-04-11 07:03:03",0,NA
"367",715381558765494272,2932681820,"Thu Mar 31 03:33:49 +0000 2016","2016-03-31 03:33:49",NA,NA,"","Agradezco a @EnriqueOchoaR director general de la @CFEmx, con quien dialogué sobre los proyectos de modernización https://t.co/JlGrqrg9Ej",28,14,0,0,0,"2016-03-30 23:59:47","2016-04-11 07:03:03",0,NA
"368",715279556282679296,2932681820,"Wed Mar 30 20:48:30 +0000 2016","2016-03-30 20:48:30",NA,NA,"","y Almacenamiento Nacional Integrado de Gas Natural 2015-2019. https://t.co/EWWB4B5DCz",4,5,0,0,0,"2016-03-30 23:59:47","2016-04-11 07:03:03",0,NA
"369",715279404079800320,2932681820,"Wed Mar 30 20:47:53 +0000 2016","2016-03-30 20:47:53",NA,NA,"","requerimientos de infraestructura, e incluirlos en la actualización del Plan Quinquenal de Expansión del Sistema de Transporte",5,5,0,0,0,"2016-03-30 23:59:47","2016-04-11 07:03:03",0,NA
"370",715279266158522368,2932681820,"Wed Mar 30 20:47:20 +0000 2016","2016-03-30 20:47:20",NA,NA,"","Escuchar y trabajar de la mano del sector industrial es la base de nuestro gobierno, por ello hoy nos reunimos para conocer sus",6,7,0,0,0,"2016-03-30 23:59:47","2016-04-11 07:03:03",0,NA
"371",715267846327042048,2932681820,"Wed Mar 30 20:01:58 +0000 2016","2016-03-30 20:01:58",NA,NA,"","la entidad será de 80 millones de dólares, y que a corto plazo generará más de mil empleos. https://t.co/kN4XtixkOC",7,10,0,0,0,"2016-03-30 23:59:47","2016-04-11 07:03:03",0,NA
"372",715267668178120704,2932681820,"Wed Mar 30 20:01:15 +0000 2016","2016-03-30 20:01:15",NA,NA,"","Japonesa radicada en el estado. Asimismo inauguramos la Planta JTEKT Automotive México cuya inversión para https://t.co/tlyLnrGubY",4,9,0,0,0,"2016-03-30 23:59:47","2016-04-11 07:03:03",0,NA
"373",715267439655669760,2932681820,"Wed Mar 30 20:00:21 +0000 2016","2016-03-30 20:00:21",NA,NA,"","por ello hoy me reuní con el Excelentísimo Señor Akira Yamada,  Embajador de Japón en México y con la Comunidad https://t.co/c4Rhhj9Yys",8,15,0,0,0,"2016-03-30 23:59:47","2016-04-11 07:03:03",0,NA
"374",715267266934284288,2932681820,"Wed Mar 30 19:59:40 +0000 2016","2016-03-30 19:59:40",NA,NA,"","Continuamos fortaleciendo los vínculos de San Luis Potosí con el extranjero en beneficio de todas y todos los potosinos,",4,4,0,0,0,"2016-03-30 23:59:47","2016-04-11 07:03:03",0,NA
"375",715253881270198272,2932681820,"Wed Mar 30 19:06:28 +0000 2016","2016-03-30 19:06:28",NA,NA,"","Yoshira Aleida Galindo Ceballos. Deseo pronta resignación para todos sus familiares y amigos.",3,2,0,0,0,"2016-03-30 23:59:47","2016-04-11 07:03:03",0,NA
"376",715253778669182976,2932681820,"Wed Mar 30 19:06:04 +0000 2016","2016-03-30 19:06:04",NA,NA,"","Envío mi más sentido pésame al Mtro. Enrique Galindo Ceballos Comisionado General de la @PoliciaFedMx, por el fallecimiento de su hermana",9,5,0,0,0,"2016-03-30 23:59:47","2016-04-11 07:03:03",0,NA
"377",715698166549520384,2932681820,"Fri Apr 01 00:31:54 +0000 2016","2016-04-01 00:31:54",NA,NA,"","sino también el “Club de Migrantes del Altiplano Potosino” de Dallas  Texas, quienes contribuyeron a mejorar la comunidad.",6,5,0,0,0,"2016-03-31 20:48:09","2016-04-11 07:03:03",0,NA
"378",715698126128963584,2932681820,"Fri Apr 01 00:31:44 +0000 2016","2016-04-01 00:31:44",NA,NA,"","del municipio de Salinas de Hidalgo, se beneficiarán cerca de mil  habitantes. En este proyecto, no solamente participaron las autoridades",3,5,0,0,0,"2016-03-31 20:48:09","2016-04-11 07:03:03",0,NA
"379",715698071804387328,2932681820,"Fri Apr 01 00:31:32 +0000 2016","2016-04-01 00:31:32",NA,NA,"","Con la inauguración de la segunda etapa del sistema de drenaje sanitario de la localidad de Palma Pegada https://t.co/3o25FF2aM9",15,8,0,0,0,"2016-03-31 20:48:09","2016-04-11 07:03:03",0,NA
"380",715656607053455360,2932681820,"Thu Mar 31 21:46:46 +0000 2016","2016-03-31 21:46:46",NA,NA,"","3 de ellas en el Centro de Prevención y Reinserción Social de ""La Pila"".",2,2,0,0,0,"2016-03-31 20:48:09","2016-04-11 07:03:03",0,NA
"381",715656504704049152,2932681820,"Thu Mar 31 21:46:21 +0000 2016","2016-03-31 21:46:21",NA,NA,"","los procesos, así como dar un mejor servicio a la sociedad. Para ello se inauguraron 5 salas de oralidad, https://t.co/RVCaYw1IDZ",7,10,0,0,0,"2016-03-31 20:48:09","2016-04-11 07:03:03",0,NA
"382",715656371954319360,2932681820,"Thu Mar 31 21:45:49 +0000 2016","2016-03-31 21:45:49",NA,NA,"","Santa María del Río y Salinas de Hidalgo. Esto permitirá avanzar en la impartición de justicia y agilizar https://t.co/c0kH9S5IV0",3,14,0,0,0,"2016-03-31 20:48:09","2016-04-11 07:03:03",0,NA
"383",715656168526360576,2932681820,"Thu Mar 31 21:45:01 +0000 2016","2016-03-31 21:45:01",NA,NA,"","Este día pusimos en marcha el Sistema de Justicia Penal Acusatorio en los municipios de San Luis Potosí, https://t.co/V6mmg5Pffp",12,10,0,0,0,"2016-03-31 20:48:09","2016-04-11 07:03:03",0,NA
"384",717195244312375296,2932681820,"Tue Apr 05 03:40:45 +0000 2016","2016-04-05 03:40:45",NA,NA,"","Agradezco nuevamente a @JoseAMeadeK  por su apoyo decidido para nuestro estado en beneficio de los potosinos. https://t.co/WNv2KWto9Z",21,14,0,0,0,"2016-04-05 05:57:07","2016-04-11 07:03:03",0,NA
"385",717194890644480000,2932681820,"Tue Apr 05 03:39:21 +0000 2016","2016-04-05 03:39:21",NA,NA,"","Durante 2016 ejerceremos cerca de 500 millones de pesos, para ese fin.",10,4,0,0,0,"2016-04-05 05:57:07","2016-04-11 07:03:03",0,NA
"386",717194711535075328,2932681820,"Tue Apr 05 03:38:38 +0000 2016","2016-04-05 03:38:38",NA,NA,"","Miles de potosinos y potosinas se verán beneficiados con los apoyos alimentarios y de comedores comunitarios.",13,10,0,0,0,"2016-04-05 05:57:07","2016-04-11 07:03:03",0,NA
"387",716729707769638912,2932681820,"Sun Apr 03 20:50:53 +0000 2016","2016-04-03 20:50:53",NA,NA,"","Los invito a participar en bien de nuestra comunidad. https://t.co/58fNPwnZZI",16,15,0,0,0,"2016-04-05 05:57:07","2016-04-11 07:03:03",0,NA
"388",716729644192432128,2932681820,"Sun Apr 03 20:50:38 +0000 2016","2016-04-03 20:50:38",NA,NA,"","públicos para una mejor convivencia social, esta vez fue en el “Parque del RíoEspañita”. https://t.co/c4mjcbpIxd",7,6,0,0,0,"2016-04-05 05:57:07","2016-04-11 07:03:03",0,NA
"389",716729498922692608,2932681820,"Sun Apr 03 20:50:03 +0000 2016","2016-04-03 20:50:03",NA,NA,"","El cuidado de nuestro entorno requiere la participación de todos y todas. Hoy continuamos con el rescate de espacios https://t.co/8mVQrBan9e",11,11,0,0,0,"2016-04-05 05:57:07","2016-04-11 07:03:03",0,NA
"390",716081260678918144,2932681820,"Sat Apr 02 01:54:11 +0000 2016","2016-04-02 01:54:11",NA,NA,"","para todos y todas. Traduciremos las fortalezas de las 4 regiones en beneficios para la ciudadanía. #ProsperemosJuntos",12,5,0,0,0,"2016-04-05 05:57:07","2016-04-11 07:03:03",0,NA
"391",716081022551465984,2932681820,"Sat Apr 02 01:53:14 +0000 2016","2016-04-02 01:53:14",NA,NA,"","y con buen gobierno. Estoy convencido que lo vamos a lograr, vamos a crear las oportunidades de desarrollo https://t.co/Miyu8HOrQQ",5,11,0,0,0,"2016-04-05 05:57:07","2016-04-11 07:03:03",0,NA
"392",716080846604636160,2932681820,"Sat Apr 02 01:52:32 +0000 2016","2016-04-02 01:52:32",NA,NA,"","Los potosinos construimos un Plan Estatal de Desarrollo para avanzar juntos al #SLP que queremos, próspero, incluyente, sustentable, seguro",8,12,0,0,0,"2016-04-05 05:57:07","2016-04-11 07:03:03",0,NA
"393",717439184865132544,2932681820,"Tue Apr 05 19:50:05 +0000 2016","2016-04-05 19:50:05",NA,NA,"","de ser un Estado donde los potosinos, con inversión y empleos bien remunerados, Prosperemos Juntos.",11,8,0,0,0,"2016-04-05 17:24:08","2016-04-11 07:03:03",0,NA
"394",717439098680553472,2932681820,"Tue Apr 05 19:49:45 +0000 2016","2016-04-05 19:49:45",NA,NA,"","para el logro de este gran proyecto de inversión. Nos sentimos acompañados con su respaldo, con su gestión, para avanzar en nuestra decisión",5,8,0,0,0,"2016-04-05 17:24:08","2016-04-11 07:03:03",0,NA
"395",717438925745172480,2932681820,"Tue Apr 05 19:49:03 +0000 2016","2016-04-05 19:49:03",NA,NA,"","Agradezco, también, al Señor Presidente @EPN y al Gobierno Federal, por su apoyo incondicional a San Luis Potosí, y en particular",8,7,0,0,0,"2016-04-05 17:24:08","2016-04-11 07:03:03",0,NA
"396",717438680743280640,2932681820,"Tue Apr 05 19:48:05 +0000 2016","2016-04-05 19:48:05",NA,NA,"","Bienvenidos a nuestro Estado. Trabajaremos junto con ustedes para el éxito de este gran proyecto",5,7,0,0,0,"2016-04-05 17:24:08","2016-04-11 07:03:03",0,NA
"397",717438497313828864,2932681820,"Tue Apr 05 19:47:21 +0000 2016","2016-04-05 19:47:21",NA,NA,"","Quiero agradecer y felicitar a @Ford  Motor Company por la decisión de invertir en México y en especial en San Luis Potosí.",19,21,0,0,0,"2016-04-05 17:24:08","2016-04-11 07:03:03",0,NA
"398",717436618487902208,2932681820,"Tue Apr 05 19:39:53 +0000 2016","2016-04-05 19:39:53",NA,NA,"","en San Luis Potosí, se fortalece la confianza del sector productivo e industrial en nuestro estado. https://t.co/53DEjqSVWP",9,15,0,0,0,"2016-04-05 17:24:08","2016-04-11 07:03:03",0,NA
"399",717436553815920640,2932681820,"Tue Apr 05 19:39:38 +0000 2016","2016-04-05 19:39:38",NA,NA,"","Con la inversión de @Ford por 1.6 mil mdd, para la construcción de una planta de producción de vehículos compactos https://t.co/5Eb3MO07ib",30,29,0,0,0,"2016-04-05 17:24:08","2016-04-11 07:03:03",0,NA
"400",717384947393122304,2932681820,"Tue Apr 05 16:14:34 +0000 2016","2016-04-05 16:14:34",NA,NA,"","Con el #PED avanzaremos juntos al San Luis Potosí que queremos todos: próspero, incluyente, sustentable, seguro y con buen gobierno.",8,10,0,0,0,"2016-04-05 17:24:08","2016-04-11 07:03:03",0,NA
"401",717384750277615616,2932681820,"Tue Apr 05 16:13:47 +0000 2016","2016-04-05 16:13:47",NA,NA,"","Los potosinos construimos el #PED a partir de las aspiraciones de progreso de todos los sectores de la sociedad https://t.co/Yde2QVz2FD",7,5,0,0,0,"2016-04-05 17:24:08","2016-04-11 07:03:03",0,NA
"402",718948478030729216,2932681820,"Sat Apr 09 23:47:29 +0000 2016","2016-04-09 23:47:29",NA,NA,"","son las bases para que Prosperemos Juntos.",3,5,0,0,0,"2016-04-11 07:02:59","2016-04-11 07:02:59",0,NA
"403",718948341480972288,2932681820,"Sat Apr 09 23:46:56 +0000 2016","2016-04-09 23:46:56",NA,NA,"","hortalizas y las instalaciones del proyecto de manejo eficiente del hato caprino en la localidad de Juache, https://t.co/vIcP9Ra6XI",3,6,0,0,0,"2016-04-11 07:02:59","2016-04-11 07:02:59",0,NA
"404",718948072525443072,2932681820,"Sat Apr 09 23:45:52 +0000 2016","2016-04-09 23:45:52",NA,NA,"","Dotar de caminos seguros, agua y fuentes de sustento a sus habitantes, como el invernadero de productores de https://t.co/v0zk6RMGrk",2,9,0,0,0,"2016-04-11 07:02:59","2016-04-11 07:02:59",0,NA
"405",718947732744851456,2932681820,"Sat Apr 09 23:44:31 +0000 2016","2016-04-09 23:44:31",NA,NA,"","y Palo Blanco: así como la inauguración de la primera etapa del camino El Retiro – Salsipuedes. https://t.co/0jJ3JjYckt",2,5,0,0,0,"2016-04-11 07:02:59","2016-04-11 07:02:59",0,NA
"406",718947598724300800,2932681820,"Sat Apr 09 23:43:59 +0000 2016","2016-04-09 23:43:59",NA,NA,"","de distintas comunidades, como la inauguración del sistema de abastecimiento de agua potable para las localidades de El Cúcamo, Matancillas",2,5,0,0,0,"2016-04-11 07:02:59","2016-04-11 07:02:59",0,NA
"407",718947445133021184,2932681820,"Sat Apr 09 23:43:22 +0000 2016","2016-04-09 23:43:22",NA,NA,"","Hoy en el municipio de Moctezuma, entregamos obras y proyectos para mejorar la calidad de vida de los habitantes https://t.co/Vloq9yS7TL",3,9,0,0,0,"2016-04-11 07:02:59","2016-04-11 07:02:59",0,NA
"408",718889545710743552,2932681820,"Sat Apr 09 19:53:18 +0000 2016","2016-04-09 19:53:18",NA,NA,"","a más de 1 millón 600 mil potosinos y potosinas en el estado. https://t.co/ueXXsTIDbr",4,5,0,0,0,"2016-04-11 07:02:59","2016-04-11 07:02:59",0,NA
"409",718889429490753536,2932681820,"Sat Apr 09 19:52:50 +0000 2016","2016-04-09 19:52:50",NA,NA,"","Hoy se realizó la feria del Seguro Popular, los invito a afiliarse a este servicio que actualmente beneficia https://t.co/o3Y3tZiGUs",20,22,0,0,0,"2016-04-11 07:02:59","2016-04-11 07:02:59",0,NA
"410",718478039995129856,2932681820,"Fri Apr 08 16:38:08 +0000 2016","2016-04-08 16:38:08",NA,NA,"","se suma a las acciones que la Federación y el Estado estamos realizando para que los potosinos Prosperemos Juntos. https://t.co/wUHDQuE1m5",3,8,0,0,0,"2016-04-11 07:02:59","2016-04-11 07:02:59",0,NA
"411",718477939700932608,2932681820,"Fri Apr 08 16:37:44 +0000 2016","2016-04-08 16:37:44",NA,NA,"","La inversión de Ford Motor Company por 1,600 mdd, y que implicará la creación de 2 mil 800 empleos directos,",6,11,0,0,0,"2016-04-11 07:03:03","2016-04-11 07:03:03",0,NA
"412",718238190914641920,2932681820,"Fri Apr 08 00:45:03 +0000 2016","2016-04-08 00:45:03",NA,NA,"","la planta BMW de Carolina del Sur.",3,3,0,0,0,"2016-04-11 07:03:03","2016-04-11 07:03:03",0,NA
"413",718238108047777792,2932681820,"Fri Apr 08 00:44:43 +0000 2016","2016-04-08 00:44:43",NA,NA,"","y de la Región de las Américas, Duncan Seaman,  y al Gerente de Relaciones Gubernamentales, Max Metcalf, por la invitación para conocer",3,3,0,0,0,"2016-04-11 07:03:03","2016-04-11 07:03:03",0,NA
"414",718238012031807488,2932681820,"Fri Apr 08 00:44:20 +0000 2016","2016-04-08 00:44:20",NA,NA,"","Agradezco al CEO de manufacturas de BMW, Manfred Erlacher, así como a los vicepresidentes de Integración de Proyectos, Rich Morris",4,6,0,0,0,"2016-04-11 07:03:03","2016-04-11 07:03:03",0,NA
"415",718224213048455168,2932681820,"Thu Apr 07 23:49:31 +0000 2016","2016-04-07 23:49:31",NA,NA,"","ahí compartí experiencias que contribuirán en la construcción de políticas públicas para un mayor crecimiento de SLP.",4,6,0,0,0,"2016-04-11 07:03:03","2016-04-11 07:03:03",0,NA
"416",718224087752028160,2932681820,"Thu Apr 07 23:49:01 +0000 2016","2016-04-07 23:49:01",NA,NA,"","También visite el  Ayuntamiento de Greer, donde me reuní con el alcalde, Rick Danner y Reno Deaton del Departamento de Desarrollo,",4,7,0,0,0,"2016-04-11 07:03:03","2016-04-11 07:03:03",0,NA
"417",718223978800803840,2932681820,"Thu Apr 07 23:48:35 +0000 2016","2016-04-07 23:48:35",NA,NA,"","de su planta en esta región, así  como el impacto económico y social de la empresa en la comunidad. https://t.co/Ze4R9XNvNr",8,22,0,0,0,"2016-04-11 07:03:03","2016-04-11 07:03:03",0,NA
"418",718223105836072960,2932681820,"Thu Apr 07 23:45:07 +0000 2016","2016-04-07 23:45:07",NA,NA,"","Hoy me reuní con directivos de la BMW en el estado de Carolina del Sur, Estados Unidos, para conocer los detalles de la producción",7,7,0,0,0,"2016-04-11 07:03:03","2016-04-11 07:03:03",0,NA
"419",779871906719600640,2932681820,"Sun Sep 25 02:35:26 +0000 2016","2016-09-25 02:35:26",NA,NA,"","En particular de todas y todos los que han dedicado su vida a esta manifestación de nuestra identidad. Enhorabuena.",15,14,0,0,0,"2016-09-25 17:36:59","2016-11-18 16:46:02",0,0
"420",779871722786873344,2932681820,"Sun Sep 25 02:34:42 +0000 2016","2016-09-25 02:34:42",NA,NA,"","La compañía representa la concreción de un anhelo largamente esperado por la comunidad artística y cultural de San Luis Potosí.",16,8,0,0,0,"2016-09-25 17:36:59","2016-11-16 12:47:55",0,0
"421",779871518314500096,2932681820,"Sun Sep 25 02:33:53 +0000 2016","2016-09-25 02:33:53",NA,NA,"","Con gusto les comparto que hoy debutó la Compañía Estatal de Danza Folklórica, un nuevo bien artístico y cultural d… https://t.co/L2KjpI9mqB",20,34,0,0,0,"2016-09-25 17:36:59","2016-11-16 12:47:55",0,0
"422",779757931822657536,2932681820,"Sat Sep 24 19:02:32 +0000 2016","2016-09-24 19:02:32",627437938,779707971806777344,"SLP_Estado","@SLP_Estado Lo agradezco, es trabajando junto a todas las potosinas y todos los potosinos que lo lograremos.",3,8,0,0,0,"2016-09-25 17:37:02","2016-11-16 12:47:55",0,0
"423",779747254890487808,2932681820,"Sat Sep 24 18:20:07 +0000 2016","2016-09-24 18:20:07",NA,NA,"","Me uno a la pena de la familia Meza Rojo por el fallecimiento de su Sr. Padre Esteban Antonio y deseo para su familia pronta resignación.",2,11,0,0,0,"2016-09-25 17:37:02","2016-11-16 12:47:55",0,0
"424",779699428701589504,2932681820,"Sat Sep 24 15:10:04 +0000 2016","2016-09-24 15:10:04",189704894,779536742491627520,"Azuletcheverry","@Azuletcheverry muchas gracias diputada.",0,3,0,0,0,"2016-09-25 17:37:02","2016-11-16 12:47:55",0,0
"425",779699239504928768,2932681820,"Sat Sep 24 15:09:19 +0000 2016","2016-09-24 15:09:19",774255112009027584,779556129420345344,"INDEPI_SLP","@INDEPI_SLP @GobEdoSLP Gracias.",0,1,0,0,0,"2016-09-25 17:37:02","2016-11-16 12:47:55",0,0
"426",779526249043472384,2932681820,"Sat Sep 24 03:41:55 +0000 2016","2016-09-24 03:41:55",321560708,779522667263070208,"Potosinos_slp","@Potosinos_slp lo agradezco Jorge todos y todas queremos que a nuestro estado le vaya bien.",2,4,0,0,0,"2016-09-25 17:37:02","2016-11-16 12:47:55",0,0
"427",779525952535535616,2932681820,"Sat Sep 24 03:40:44 +0000 2016","2016-09-24 03:40:44",548883886,779523877512761344,"PilyMelladoR","@PilyMelladoR Gracias, trabajando de la mano lo lograremos.",1,1,0,0,0,"2016-09-25 17:37:03","2016-11-15 04:32:10",0,0
"428",779523124274409472,2932681820,"Sat Sep 24 03:29:30 +0000 2016","2016-09-24 03:29:30",118535809,779497263613698048,"gloriaserrato","@gloriaserrato @GobEdoSLP @CEEAVSLP es un compromiso diario. Gracias por tu colaboración.",0,2,0,0,0,"2016-09-25 17:37:03","2016-11-15 04:32:10",0,0
"429",779522806492954624,2932681820,"Sat Sep 24 03:28:14 +0000 2016","2016-09-24 03:28:14",219890533,779519842227396608,"Cristina_Diaz_S","@Cristina_Diaz_S gracias Senadora.",1,3,0,0,0,"2016-09-25 17:37:03","2016-11-15 04:32:10",0,0
"430",779491261698875392,2932681820,"Sat Sep 24 01:22:53 +0000 2016","2016-09-24 01:22:53",NA,NA,"","RT @PanchDominguez: Asistí al Primer Informe de Gobierno del Estado de San Luis Potosí, encabezado por su gobernador, @JMCarrerasGob. https…",27,0,0,0,0,"2016-09-25 17:37:03","2016-11-15 04:32:10",1,1
"431",779459368152469504,2932681820,"Fri Sep 23 23:16:09 +0000 2016","2016-09-23 23:16:09",NA,NA,"","Agradezco a las jóvenes y los jóvenes y a todos y todas quienes integran @Mov_PRImx por su entusiasmo siempre.",23,19,0,0,0,"2016-09-25 17:37:03","2016-11-14 17:18:56",0,0
"432",779457776212848640,2932681820,"Fri Sep 23 23:09:50 +0000 2016","2016-09-23 23:09:50",NA,NA,"","RT @RafaMorenoValle: Un gusto acompañar a @JMCarrerasGob en su Primer Informe como Gobernador de San Luis Potosí. Enhorabuena. https://t.co…",57,0,0,0,0,"2016-09-25 17:37:03","2016-11-14 17:18:56",1,1
"433",779457652598280192,2932681820,"Fri Sep 23 23:09:20 +0000 2016","2016-09-23 23:09:20",86847132,779404869606092800,"cesarloredo","@cesarloredo Gracias César, mucho éxito para ti.",1,2,0,0,0,"2016-09-25 17:37:04","2016-11-14 17:18:56",0,0
"434",779457435660541952,2932681820,"Fri Sep 23 23:08:28 +0000 2016","2016-09-23 23:08:28",NA,NA,"","RT @paolongoria: @JMCarrerasGob muchas felicidades por su #1erInformeGobSLP !! Agradecida por el gran apoyo al deporte y en especial el Rac…",13,0,0,0,0,"2016-09-25 17:37:04","2016-11-14 17:18:56",1,1
"435",779457363405213696,2932681820,"Fri Sep 23 23:08:11 +0000 2016","2016-09-23 23:08:11",NA,NA,"","RT @ManceraMiguelMX: Asistí al 1° Informe del Gobernador @JMCarrerasGob; gracias a la gente de San Luis Potosí por su recibimiento #mm http…",163,0,0,0,0,"2016-09-25 17:37:04","2016-11-14 17:18:56",1,1
"436",779457302973657088,2932681820,"Fri Sep 23 23:07:57 +0000 2016","2016-09-23 23:07:57",NA,NA,"","RT @SSalud_mx: #Foto Dr. José Narro, Secretario de @SSalud_mx. 1er Informe de Gobierno de @JMCarrerasGob, Gob. de @GobEdoSLP https://t.co/V…",7,0,0,0,0,"2016-09-25 17:37:04","2016-11-14 07:06:43",1,1
"437",779457269549309952,2932681820,"Fri Sep 23 23:07:49 +0000 2016","2016-09-23 23:07:49",NA,NA,"","RT @omarfayad: Mi reconocimiento a tu trabajo y resultados amigo Gobernador @JMCarrerasGob. ¡Felicidades! #1erInformeGobSLP https://t.co/vO…",200,0,0,0,0,"2016-09-25 17:37:05","2016-11-13 13:18:40",1,1
"438",779457142378012672,2932681820,"Fri Sep 23 23:07:19 +0000 2016","2016-09-23 23:07:19",138824377,779415153531953152,"nachoperaltacol","Lo agradezco gobernador @nachoperaltacol. Un abrazo.",0,2,0,0,0,"2016-09-25 17:37:05","2016-11-13 13:18:40",0,0
"439",779456967462957056,2932681820,"Fri Sep 23 23:06:37 +0000 2016","2016-09-23 23:06:37",NA,NA,"","RT @nachoperaltacol: Felicidades por los resultados presentados en favor de las familias potosinas, Gob. @JMCarrerasGob 

#1erInformeGobSLP",17,0,0,0,0,"2016-09-25 17:37:05","2016-11-12 08:10:05",1,1
"440",779456881945227264,2932681820,"Fri Sep 23 23:06:16 +0000 2016","2016-09-23 23:06:16",179358216,779416742623780864,"Sosamontes","@Sosamontes  Gracias por habernos acompañado.",1,1,0,0,0,"2016-09-25 17:37:05","2016-11-12 08:10:05",0,0
"441",779456543385194496,2932681820,"Fri Sep 23 23:04:56 +0000 2016","2016-09-23 23:04:56",41121003,779425772473753600,"big_oyuma","@big_oyuma Lo agradezco, Saludos.",0,1,0,0,0,"2016-09-25 17:37:05","2016-11-05 17:52:42",0,0
"442",779456352556953600,2932681820,"Fri Sep 23 23:04:10 +0000 2016","2016-09-23 23:04:10",NA,NA,"","RT @ATelloC: A un año de asumir el máximo honor que un potosino puede tener para servir a su estado, felicidades @JMCarrerasGob por tu #1er…",76,0,0,0,0,"2016-09-25 17:37:05","2016-11-05 17:52:42",1,1
"443",779456024616906752,2932681820,"Fri Sep 23 23:02:52 +0000 2016","2016-09-23 23:02:52",267827623,779436273857536000,"vafenern","@vafenern @GobEdoSLP Gracias, es posible por el trabajo conjunto con los diferentes sectores y con la ciudadanía.",0,1,0,0,0,"2016-09-25 17:37:05","2016-11-05 17:52:42",0,0
"444",779455776532213760,2932681820,"Fri Sep 23 23:01:53 +0000 2016","2016-09-23 23:01:53",1318804242,779442177222946816,"karmengaby","@karmengaby Gracias por acompañarnos.",0,2,0,0,0,"2016-09-25 17:37:05","2016-11-05 17:52:42",0,0
"445",779454248190828544,2932681820,"Fri Sep 23 22:55:48 +0000 2016","2016-09-23 22:55:48",NA,NA,"","Gracias querida amiga @Chely_Escalante por tu apoyo siempre en favor de nuestra gente.",0,5,0,0,0,"2016-09-25 17:37:05","2016-11-05 17:52:42",0,0
"446",779454181891452928,2932681820,"Fri Sep 23 22:55:33 +0000 2016","2016-09-23 22:55:33",NA,NA,"","El agradecimiento es mutuo @paolongoria, el apoyo al racquetbol y al deporte en #SLP es y será permanente.",0,7,0,0,0,"2016-09-25 17:37:05","2016-11-05 17:52:42",0,0
"447",779454081068695552,2932681820,"Fri Sep 23 22:55:09 +0000 2016","2016-09-23 22:55:09",NA,NA,"","Agradezco el reconocimiento presidente @EnriqueOchoaR, nuestro compromiso es seguir trabajando por las potosinas y los potosinos.",0,5,0,0,0,"2016-09-25 17:37:05","2016-11-05 17:52:42",0,0
"448",779453978799017984,2932681820,"Fri Sep 23 22:54:44 +0000 2016","2016-09-23 22:54:44",NA,NA,"","Gracias secretario @CarlosMadrazoS, seguiremos trabajando con todos los partidos por el bien de nuestra gente.",1,3,0,0,0,"2016-09-25 17:37:06","2016-11-05 17:52:42",0,0
"449",779453871500386304,2932681820,"Fri Sep 23 22:54:19 +0000 2016","2016-09-23 22:54:19",NA,NA,"","Gracias estimado gobernador de Guerrero @HectorAstudillo, por la felicitación.",0,2,0,0,0,"2016-09-25 17:37:06","2016-11-05 17:52:42",0,0
"450",779446225124794368,2932681820,"Fri Sep 23 22:23:56 +0000 2016","2016-09-23 22:23:56",NA,NA,"","Gracias a todos y a todas quienes estuvieron este día y que nos acompañan diariamente en la construcción de un mejor #SLP. #1erInformeGobSLP",21,28,0,0,0,"2016-09-25 17:37:06","2016-11-05 17:52:42",0,0
"451",779446073504825344,2932681820,"Fri Sep 23 22:23:19 +0000 2016","2016-09-23 22:23:19",NA,NA,"","Gracias a los diputados locales, diputados federales y alcaldes que nos acompañaron.",1,3,0,0,0,"2016-09-25 17:37:06","2016-11-05 17:52:42",0,0
"452",779446001220268032,2932681820,"Fri Sep 23 22:23:02 +0000 2016","2016-09-23 22:23:02",NA,NA,"","Agradezco al igual a los ex gobernadores Gonzalo Martínez Corbalá, Florencio Salazar Mtz, Horacio Sánchez Unzueta y Fernando Silva Nieto.",2,10,0,0,0,"2016-09-25 17:37:06","2016-11-05 17:52:42",0,0
"453",779445357348425728,2932681820,"Fri Sep 23 22:20:29 +0000 2016","2016-09-23 22:20:29",NA,NA,"","A los senadores Teófilo Torres Corzo y Octavio Pedroza Gaitán, gracias por su asistencia.",1,5,0,0,0,"2016-09-25 17:37:06","2016-11-05 17:52:42",0,0
"454",779443701311340544,2932681820,"Fri Sep 23 22:13:54 +0000 2016","2016-09-23 22:13:54",NA,NA,"","Gracias al Arzobispo de San Luis Potosí, Jesús Carlos Cabrero Romero por acompañarnos en el Primer Informe de Actividades.",3,8,0,0,0,"2016-09-25 17:37:06","2016-11-05 17:52:42",0,0
"455",779443615281983488,2932681820,"Fri Sep 23 22:13:33 +0000 2016","2016-09-23 22:13:33",NA,NA,"","Así como a @jpcastanon Presidente del Consejo Coordinador Empresarial @cceoficialmx por su presencia en el #1erInformeGobSLP",1,4,0,0,0,"2016-09-25 17:37:06","2016-11-05 17:52:42",0,0
