"","id_tweet","id_twitter","created_at","created_at_datetime","in_reply_to_user_id","in_reply_to_status_id","in_reply_to_screen_name","text","retweet_count","favorite_count","longitude","latitude","retweeted","creation_date","modification_date","RT_temp","is_retweeted"
"721",789577955957575680,2932681820,"Fri Oct 21 21:23:49 +0000 2016","2016-10-21 21:23:49",NA,NA,"","Esta vinculación entre el sector productivo y educativo, permitirá desarrollar el talento humano, para impulsar a la industria en #SLP.",3,4,0,0,0,"2016-10-24 04:32:04","2016-12-15 07:02:56",0,0
"722",789577685605371904,2932681820,"Fri Oct 21 21:22:44 +0000 2016","2016-10-21 21:22:44",NA,NA,"","En éste participaron más de 3 mil estudiantes de nivel medio superior y superior. https://t.co/ovMNlaCfPk",1,2,0,0,0,"2016-10-24 04:32:04","2016-12-15 07:02:56",0,0
"723",789577520362295296,2932681820,"Fri Oct 21 21:22:05 +0000 2016","2016-10-21 21:22:05",NA,NA,"","Por ello reconozco el esfuerzo de la Coparmex, al realizar el 1er Congreso Universitario. https://t.co/dRqG7b5LRw",1,4,0,0,0,"2016-10-24 04:32:04","2016-12-15 07:02:56",0,0
"724",789577149183176704,2932681820,"Fri Oct 21 21:20:36 +0000 2016","2016-10-21 21:20:36",NA,NA,"","Y con ello de su desarrollo, en beneficio de las y los potosinos.",2,3,0,0,0,"2016-10-24 04:32:04","2016-12-15 07:02:56",0,0
"725",789576983428509696,2932681820,"Fri Oct 21 21:19:57 +0000 2016","2016-10-21 21:19:57",NA,NA,"","Con la llegada de  BMW y Ford, nuestro estado atraviesa por una época de fortalecimiento de su industria manufacturera.",3,7,0,0,0,"2016-10-24 04:32:04","2016-12-15 07:02:56",0,0
"726",789571297474859008,2932681820,"Fri Oct 21 20:57:21 +0000 2016","2016-10-21 20:57:21",NA,NA,"","#ElFuturoMePertenece #Tesla  permanecerá hasta el próximo 20 de febrero, conmemorando el 160 Aniv. del natalicio de… https://t.co/PFYzEWq012",10,20,0,0,0,"2016-10-24 04:32:04","2016-12-14 08:27:33",0,0
"727",789569041132249088,2932681820,"Fri Oct 21 20:48:23 +0000 2016","2016-10-21 20:48:23",NA,NA,"","Los y las invito a visitar la extraordinaria exposición “El Futuro me Pertenece: Nikola Tesla”, inaugurada anoche e… https://t.co/Rim4LH44Pp",14,18,0,0,0,"2016-10-24 04:32:10","2016-12-14 08:27:33",0,0
"728",789244922956095488,2932681820,"Thu Oct 20 23:20:27 +0000 2016","2016-10-20 23:20:27",NA,NA,"","Agradezco a @CocoGarciaQ, Dir. Gral. de la Admón. del @PBPSALUD, el respaldo para realizar acciones a favor de quie… https://t.co/JSIb4EpeJn",9,9,0,0,0,"2016-10-24 04:32:15","2016-12-14 08:27:33",0,0
"729",789244253272616960,2932681820,"Thu Oct 20 23:17:48 +0000 2016","2016-10-20 23:17:48",NA,NA,"","Gracias al trabajo conjunto con el @DIF_SLP  y la Beneficencia Pública @PBPSALUD, entre otras instituciones. https://t.co/5yAZRoCUMh",10,9,0,0,0,"2016-10-24 04:32:21","2016-12-14 08:27:33",0,0
"730",789243864318029824,2932681820,"Thu Oct 20 23:16:15 +0000 2016","2016-10-20 23:16:15",NA,NA,"","Para mejorar la calidad de vida de personas con discapacidad, mi esposa y yo entregamos apoyos funcionales del Prog… https://t.co/lSiucj66Vh",24,21,0,0,0,"2016-10-24 04:32:22","2016-12-13 06:51:45",0,0
"731",789240063263514624,2932681820,"Thu Oct 20 23:01:09 +0000 2016","2016-10-20 23:01:09",NA,NA,"","Solamente en este municipio tenemos programada una inversión aproximada de 50 mdp, para beneficiar casi a la mitad de los planteles.",7,4,0,0,0,"2016-10-24 04:32:27","2016-12-13 06:51:45",0,0
"732",789239902185459712,2932681820,"Thu Oct 20 23:00:30 +0000 2016","2016-10-20 23:00:30",NA,NA,"","Con esto, los pequeños y pequeñas contarán con espacios mejor acondicionados para su educación y desarrollo. https://t.co/qd1m8jmEKO",6,9,0,0,0,"2016-10-24 04:32:27","2016-12-13 06:51:45",0,0
"733",789239722983890944,2932681820,"Thu Oct 20 22:59:47 +0000 2016","2016-10-20 22:59:47",NA,NA,"","Con #EscuelasAlCIEN en Villa de Reyes entregamos la rehabilitación de los planteles; Niño Artillero, Librado Rivera… https://t.co/tA9seb5kjY",4,5,0,0,0,"2016-10-24 04:32:27","2016-12-13 06:51:45",0,0
"734",788746908961341440,2932681820,"Wed Oct 19 14:21:31 +0000 2016","2016-10-19 14:21:31",NA,NA,"","Las y los invito a que hoy, como todos los días nos unamos para prevenir el cáncer de mama, y promovamos su oportun… https://t.co/oiQ9XZ0wwF",20,14,0,0,0,"2016-10-24 04:32:33","2016-12-12 18:38:37",0,0
"735",790727042178228224,2932681820,"Tue Oct 25 01:29:52 +0000 2016","2016-10-25 01:29:52",NA,NA,"","Agradezco su trabajo, profesionalismo y dedicación día con día a favor de la salud de los potosinos y las potosinas. https://t.co/6S72XptxXJ",10,11,0,0,0,"2016-10-25 08:06:20","2016-12-21 04:49:30",0,0
"736",790726679589040128,2932681820,"Tue Oct 25 01:28:26 +0000 2016","2016-10-25 01:28:26",NA,NA,"","Hoy reconocimos a los doctores y las doctoras de los distintos centros y unidades de salud del estado, por su desem… https://t.co/5ZuWes0jaZ",11,12,0,0,0,"2016-10-25 08:06:20","2016-12-20 03:03:11",0,0
"737",790653560912392192,2932681820,"Mon Oct 24 20:37:53 +0000 2016","2016-10-24 20:37:53",NA,NA,"","Ahí se instalaron módulos de revisión, para fomentar la prevención y detección oportuna de este padecimiento. https://t.co/I21hH9FNFn",16,25,0,0,0,"2016-10-25 08:06:26","2016-12-18 06:44:25",0,0
"738",790653257504788480,2932681820,"Mon Oct 24 20:36:40 +0000 2016","2016-10-24 20:36:40",NA,NA,"","Dentro de las acciones del Mes de la Lucha contra el Cáncer de Mama, realizamos en Palacio de Gobierno una feria de… https://t.co/vd3lYuUgtw",15,13,0,0,0,"2016-10-25 08:06:26","2016-12-16 03:07:52",0,0
"739",791055068401283072,2932681820,"Tue Oct 25 23:13:20 +0000 2016","2016-10-25 23:13:20",NA,NA,"","Agradezco a @BoschMexico su confianza en nuestro estado, para seguir creciendo de la mano en beneficio de las potos… https://t.co/AoVlUr0rvR",12,21,0,0,0,"2016-10-25 22:33:23","2016-12-23 06:31:38",0,0
"740",791054830189973504,2932681820,"Tue Oct 25 23:12:23 +0000 2016","2016-10-25 23:12:23",NA,NA,"","La empresa @BoschMexico invirtió 80 millones de dólares para su ampliación, lo que generará mil nuevas fuentes de e… https://t.co/feRmTbmeYt",16,30,0,0,0,"2016-10-25 22:33:28","2016-12-21 04:49:30",0,0
"741",791054447652634624,2932681820,"Tue Oct 25 23:10:52 +0000 2016","2016-10-25 23:10:52",NA,NA,"","Seguimos impulsando el desarrollo y la generación de empleos, por eso hoy inauguramos la ampliación de la empresa R… https://t.co/f1psU3Dwrn",14,20,0,0,0,"2016-10-25 22:33:33","2016-12-21 04:49:30",0,0
"742",791764935319707648,2932681820,"Thu Oct 27 22:14:05 +0000 2016","2016-10-27 22:14:05",NA,NA,"","Agradezco a @SantaellaJulio, presidente del @INEGI_INFORMA, por su presencia y trabajo conjunto con SLP.",13,7,0,0,0,"2016-10-28 03:52:43","2017-01-03 20:01:56",0,0
"743",791763071681257472,2932681820,"Thu Oct 27 22:06:41 +0000 2016","2016-10-27 22:06:41",NA,NA,"","Entre sus objetivos está fortalecer la capacidad institucional para desarrollar, implementar y evaluar políticas públicas a favor de #SLP.",15,7,0,0,0,"2016-10-28 03:52:43","2017-01-02 16:08:58",0,0
"744",791762635062599680,2932681820,"Thu Oct 27 22:04:57 +0000 2016","2016-10-27 22:04:57",NA,NA,"","Hoy tomamos protesta a los integrantes del Comité Estatal de Información Estadística y Geográfica de San Luis Potos… https://t.co/sAXh8WQIMw",12,13,0,0,0,"2016-10-28 03:52:43","2016-12-31 03:01:30",0,0
"745",791421159413645312,2932681820,"Wed Oct 26 23:28:02 +0000 2016","2016-10-26 23:28:02",NA,NA,"","Finalmente en Ciudad Fernández saludamos a los beneficiarios del Programa 100 acciones de ampliación de vivienda.",14,9,0,0,0,"2016-10-28 03:52:45","2016-12-31 03:01:30",0,0
"746",791421114001928192,2932681820,"Wed Oct 26 23:27:52 +0000 2016","2016-10-26 23:27:52",NA,NA,"","Además de entregar constancias de alfabetización y certificados de primaria y secundaria del IEEA.",10,8,0,0,0,"2016-10-28 03:52:45","2016-12-24 08:38:04",0,0
"747",791420972226125824,2932681820,"Wed Oct 26 23:27:18 +0000 2016","2016-10-26 23:27:18",NA,NA,"","Así como el techado de la primaria Vanguardia Revolucionaria y la inauguración de su cancha, dando a niños y niñas instalaciones más dignas.",9,9,0,0,0,"2016-10-28 03:52:45","2016-12-24 08:38:04",0,0
"748",791420848271822848,2932681820,"Wed Oct 26 23:26:48 +0000 2016","2016-10-26 23:26:48",NA,NA,"","Hoy en Rioverde inauguramos aulas didácticas y la mejora de la secundaria Benito Juárez. https://t.co/05UzS4xJ46",16,12,0,0,0,"2016-10-28 03:52:45","2016-12-24 08:38:04",0,0
"749",791420550715363328,2932681820,"Wed Oct 26 23:25:37 +0000 2016","2016-10-26 23:25:37",NA,NA,"","Los municipios de la Zona Media son beneficiados con la rehabilitación de planteles educativos.",4,5,0,0,0,"2016-10-28 03:52:45","2016-12-24 08:38:04",0,0
"750",792484634424582144,2932681820,"Sat Oct 29 21:53:55 +0000 2016","2016-10-29 21:53:55",NA,NA,"","Hagamos de estas celebraciones una gran fiesta cultural en San Luis Potosí.",10,9,0,0,0,"2016-10-29 20:19:14","2017-01-17 01:16:06",0,0
"751",792484632260337664,2932681820,"Sat Oct 29 21:53:54 +0000 2016","2016-10-29 21:53:54",NA,NA,"","Invito a todos y todas a visitar el Altar de Muertos alusivo a los festejos de Xantolo, ubicado en el patio central… https://t.co/2xLPF53CWx",23,22,0,0,0,"2016-10-29 20:19:14","2017-01-17 01:16:06",0,0
"752",792445331040460800,2932681820,"Sat Oct 29 19:17:44 +0000 2016","2016-10-29 19:17:44",NA,NA,"","Conmemoramos el Aniversario de la Fundación de la Cruz Roja, agradecemos su gran labor diaria salvando vidas y brin… https://t.co/2A20c47PbD",9,15,0,0,0,"2016-10-29 20:19:20","2017-01-17 01:16:06",0,0
"753",792215800404774912,2932681820,"Sat Oct 29 04:05:40 +0000 2016","2016-10-29 04:05:40",NA,NA,"","Les comparto el enlace en donde consultar el programa del Festival de Música Antigua y Barroca, Los Fundadores: https://t.co/3jExd2NnP9",7,9,0,0,0,"2016-10-29 20:19:26","2017-01-17 01:16:06",0,0
"754",792203112945549312,2932681820,"Sat Oct 29 03:15:15 +0000 2016","2016-10-29 03:15:15",NA,NA,"","El Festival de Música Antigua y Barroca se realizará del 28 de oct. al 06 de nov. en templos, capillas y espacios culturales.",8,7,0,0,0,"2016-10-29 20:19:32","2017-01-16 06:26:54",0,0
"755",792201831422185472,2932681820,"Sat Oct 29 03:10:09 +0000 2016","2016-10-29 03:10:09",NA,NA,"","Invito a todos y a todas a disfrutar de la XIX edición del magnífico Festival de Música Antigua y Barroca, el cual… https://t.co/n5oiv7Zgcu",7,11,0,0,0,"2016-10-29 20:19:32","2017-01-16 06:26:54",0,0
"756",792134319670034432,2932681820,"Fri Oct 28 22:41:53 +0000 2016","2016-10-28 22:41:53",NA,NA,"","Agradezco y felicito también a todas las personas que integran el gran equipo del @DIF_SLP.",16,15,0,0,0,"2016-10-29 20:19:39","2017-01-16 06:26:54",0,0
"757",792134222030839808,2932681820,"Fri Oct 28 22:41:30 +0000 2016","2016-10-28 22:41:30",NA,NA,"","La labor que día con día realiza el @DIF_SLP es parte fundamental para alcanzar el SLP incluyente que queremos, par… https://t.co/XZCfzKrgra",25,28,0,0,0,"2016-10-29 20:19:39","2017-01-10 11:18:32",0,0
"758",792133661013323776,2932681820,"Fri Oct 28 22:39:16 +0000 2016","2016-10-28 22:39:16",NA,NA,"","Felicito a mi esposa la Presidenta del @DIF_SLP, quien rindió su Primer Informe de Actividades. https://t.co/tEBaeGqvpb",12,22,0,0,0,"2016-10-29 20:19:45","2017-01-05 10:15:15",0,0
"759",794258857618833408,2932681820,"Thu Nov 03 19:24:02 +0000 2016","2016-11-03 19:24:02",NA,NA,"","Con gran orgullo hoy celebramos los 424 años de la Fundación de la Ciudad de San Luis Potosí. #SLP https://t.co/or4i6auR4y",49,53,0,0,0,"2016-11-03 19:04:45","2017-01-20 04:52:01",0,0
"760",793853759495348224,2932681820,"Wed Nov 02 16:34:20 +0000 2016","2016-11-02 16:34:20",NA,NA,"","Hoy recordamos a nuestros muertos y antepasados, como un rasgo distintivo de nuestra mexicanidad. #2denoviembre… https://t.co/OdyzxuO5qF",27,34,0,0,0,"2016-11-03 19:04:45","2017-01-20 04:52:01",0,0
"761",793628065842593792,2932681820,"Wed Nov 02 01:37:30 +0000 2016","2016-11-02 01:37:30",NA,NA,"","Beneficiando a los municipios de Aquismón, Coxcatlán, Huehuetlán, Matlapa, Tamazunchale, Xilitla y Axtla de Terraza… https://t.co/dsXvmZDjJa",24,22,0,0,0,"2016-11-03 19:04:51","2017-01-20 04:52:01",0,0
"762",793627899379060736,2932681820,"Wed Nov 02 01:36:50 +0000 2016","2016-11-02 01:36:50",NA,NA,"","También ahí nos reunimos con cafeticultores indígenas, a quienes entregamos apoyos para el fortalecimiento de su ac… https://t.co/T8jAJGMOaH",23,26,0,0,0,"2016-11-03 19:04:56","2017-01-19 07:18:51",0,0
"763",793627242509107200,2932681820,"Wed Nov 02 01:34:14 +0000 2016","2016-11-02 01:34:14",NA,NA,"","En el municipio de Huehuetlán tuvimos la oportunidad de acudir al festival del Día de Muertos: Sanctorum Teenek.",10,11,0,0,0,"2016-11-03 19:05:02","2017-01-19 07:18:51",0,0
"764",793201606149808128,2932681820,"Mon Oct 31 21:22:54 +0000 2016","2016-10-31 21:22:54",NA,NA,"","Así como a proteger la salud de todas y todos, sobre todo la de menores de edad y adultos mayores.… https://t.co/tIXhlOO1Bo",14,25,0,0,0,"2016-11-03 19:05:02","2017-01-19 07:18:51",0,0
"765",793201024060133376,2932681820,"Mon Oct 31 21:20:35 +0000 2016","2016-10-31 21:20:35",NA,NA,"","Hoy iniciamos la campaña de vacunación contra la #influenza. Les invito a acudir a instituciones de salud pública p… https://t.co/Grc8hqxVeu",22,13,0,0,0,"2016-11-03 19:05:08","2017-01-19 07:18:51",0,0
"766",793172347708583936,2932681820,"Mon Oct 31 19:26:38 +0000 2016","2016-10-31 19:26:38",NA,NA,"","En #Xantolo ¡vivos y muertos, estamos de fiesta. Es una de nuestras tradiciones más importantes. Les comparto:  https://t.co/aMiLDlDfX5",32,32,0,0,0,"2016-11-03 19:05:14","2017-01-19 07:18:51",0,0
"767",794563616846454784,2932681820,"Fri Nov 04 15:35:03 +0000 2016","2016-11-04 15:35:03",NA,NA,"","Invito a todos y a todas a que asistan a disfrutar las distintas funciones, pueden consultar el programa en: https://t.co/VyjVIUs8k7 @37_mnt",17,5,0,0,0,"2016-11-05 17:52:23","2017-01-21 08:46:59",0,0
"768",794563448608735232,2932681820,"Fri Nov 04 15:34:23 +0000 2016","2016-11-04 15:34:23",NA,NA,"","Así como al dramaturgo Sergio Galindo, por su carrera en el campo de las artes. https://t.co/T6FY1eHF8W",7,4,0,0,0,"2016-11-05 17:52:30","2017-01-21 08:46:59",0,0
"769",794563240093061120,2932681820,"Fri Nov 04 15:33:33 +0000 2016","2016-11-04 15:33:33",NA,NA,"","#SLP es sede de la 37 Muestra Nacional de Teatro. Durante la inauguración entregamos la medalla Xavier Villaurrutia al maestro Bruno Bert.",9,6,0,0,0,"2016-11-05 17:52:30","2017-01-21 08:46:59",0,0
"770",794373152537133056,2932681820,"Fri Nov 04 02:58:12 +0000 2016","2016-11-04 02:58:12",NA,NA,"","SLP será uno de los primeros  estados en donde se acreditará a estas guarderías como escuela de educación inicial y preescolar.",6,8,0,0,0,"2016-11-05 17:52:30","2017-01-21 08:46:59",0,0
"771",794373024317206528,2932681820,"Fri Nov 04 02:57:42 +0000 2016","2016-11-04 02:57:42",NA,NA,"","Además entregamos mil 200 constancias de validez oficial de estudios de 1er. año de preescolar a menores asistentes a guarderías del IMSS.",4,5,0,0,0,"2016-11-05 17:52:30","2017-01-21 08:46:59",0,0
"772",794372498179506176,2932681820,"Fri Nov 04 02:55:36 +0000 2016","2016-11-04 02:55:36",NA,NA,"","Éste será entre organismos estatales y federales para mejorar los servicios médicos en beneficio de las familias potosinas.",5,8,0,0,0,"2016-11-05 17:52:30","2017-01-20 04:52:01",0,0
"773",794371384646377472,2932681820,"Fri Nov 04 02:51:11 +0000 2016","2016-11-04 02:51:11",NA,NA,"","Junto con @arriolamikel, Dir. Gral de @Tu_IMSS, firmamos un convenio para intercambio de los servicios en atención… https://t.co/6TtMQmgp1Z",3,9,0,0,0,"2016-11-05 17:52:30","2017-01-20 04:52:01",0,0
"774",794328388290760704,2932681820,"Fri Nov 04 00:00:20 +0000 2016","2016-11-04 00:00:20",NA,NA,"","Con ello buscamos espacios más accesibles, para que quienes tienen alguna discapacidad, vivan la mejor experiencia en nuestro bello estado.",5,12,0,0,0,"2016-11-05 17:52:36","2017-01-20 04:52:01",0,0
"775",794327855832256512,2932681820,"Thu Nov 03 23:58:13 +0000 2016","2016-11-03 23:58:13",NA,NA,"","Por ello hoy inauguramos el Segundo Congreso Internacional de Turismo Inclusivo que se realizará del 3 al 5 de novi… https://t.co/0LPc3jLfAN",8,15,0,0,0,"2016-11-05 17:52:36","2017-01-20 04:52:01",0,0
"776",794327548935012352,2932681820,"Thu Nov 03 23:57:00 +0000 2016","2016-11-03 23:57:00",NA,NA,"","#SLP es un centro de suma importancia para el Turismo de Congresos y Convenciones.",5,10,0,0,0,"2016-11-05 17:52:42","2017-01-20 04:52:01",0,0
"777",797267699239964672,2932681820,"Sat Nov 12 02:40:06 +0000 2016","2016-11-12 02:40:06",NA,NA,"","Entregamos la modernización del camino Carretera 57-San Francisco y la ampliación de la red de distribución eléctrica en Zaragoza de Solís.",5,12,0,0,0,"2016-11-12 08:09:22","2017-01-27 08:08:15",0,0
"778",797267474312007680,2932681820,"Sat Nov 12 02:39:13 +0000 2016","2016-11-12 02:39:13",NA,NA,"","Y entregamos 117 cuartos adicionales para mejorar las viviendas de decenas de familias de escasos recursos. https://t.co/ujKMesHcwy",6,9,0,0,0,"2016-11-12 08:09:22","2017-01-26 14:53:26",0,0
"779",797267241402306560,2932681820,"Sat Nov 12 02:38:17 +0000 2016","2016-11-12 02:38:17",NA,NA,"","Hoy en el municipio de Villa de Guadalupe inauguramos el Instituto de Capacitación para el Trabajo. https://t.co/ZF28lRkr0Y",5,7,0,0,0,"2016-11-12 08:09:22","2017-01-26 14:53:26",0,0
"780",797114081379397632,2932681820,"Fri Nov 11 16:29:41 +0000 2016","2016-11-11 16:29:41",NA,NA,"","RT @GobEdoSLP: Participa el próximo 15 de noviembre en la #FeriaDelEmpleo. Regístrate en https://t.co/BC8QLvOtEj  @STPSSLP https://t.co/c8X…",6,0,0,0,0,"2016-11-12 08:09:22","2017-01-26 14:53:26",1,1
"781",797113986684633088,2932681820,"Fri Nov 11 16:29:18 +0000 2016","2016-11-11 16:29:18",NA,NA,"","RT @GobEdoSLP: Ante la primera #TormentaInvernal: ¡Abrígate bien! El frío y viento pueden enfermarte, utiliza ropa gruesa y lleva paraguas…",11,0,0,0,0,"2016-11-12 08:09:28","2017-01-26 14:53:26",1,1
"782",796796770218950656,2932681820,"Thu Nov 10 19:28:48 +0000 2016","2016-11-10 19:28:48",NA,NA,"","Lamento el deceso de Marco Octavio Álvarez Jiménez, delegado de @Banobras_mx en SLP. Deseo pronta resignación para su familia y amigos.",16,8,0,0,0,"2016-11-12 08:09:28","2017-01-26 14:53:26",0,0
"783",796782870274506752,2932681820,"Thu Nov 10 18:33:34 +0000 2016","2016-11-10 18:33:34",NA,NA,"","#SLP es el primer estado en el país en contar con un Instituto de Profesionalización del Magisterio. Les comparto https://t.co/cPAP2J6WaB",71,36,0,0,0,"2016-11-12 08:09:29","2017-01-26 14:53:26",0,0
"784",796524223980273664,2932681820,"Thu Nov 10 01:25:48 +0000 2016","2016-11-10 01:25:48",NA,NA,"","Agradezco a José Abraham Cepeda Izaguirre Director de @conaza_gob, su respaldo y el de el Presidente @EPN a nuestros productores.",13,10,0,0,0,"2016-11-12 08:09:35","2017-01-26 14:53:26",0,0
"785",796523920107143168,2932681820,"Thu Nov 10 01:24:35 +0000 2016","2016-11-10 01:24:35",NA,NA,"","Iniciamos la perforación del pozo profundo de Tanque Colorado que beneficia a 21 localidades de Matehuala, Villa de… https://t.co/fyv9RlpOtL",20,18,0,0,0,"2016-11-12 08:09:35","2017-01-26 14:53:26",0,0
"786",796523400978120704,2932681820,"Thu Nov 10 01:22:32 +0000 2016","2016-11-10 01:22:32",NA,NA,"","En Matehuala inauguramos la olla de agua en la comunidad de Tanque Colorado y el Centro Caprino de Negocios. https://t.co/Rtd1MKgDkW",18,15,0,0,0,"2016-11-12 08:09:41","2017-01-26 14:53:26",0,0
"787",796523074103504896,2932681820,"Thu Nov 10 01:21:14 +0000 2016","2016-11-10 01:21:14",NA,NA,"","Con el director de la @conaza_gob José Abraham Cepeda Izaguirre, entregamos apoyos para fortalecer a los productores caprinos del Altiplano.",12,5,0,0,0,"2016-11-12 08:09:41","2017-01-26 14:53:26",0,0
"788",796394701565751296,2932681820,"Wed Nov 09 16:51:07 +0000 2016","2016-11-09 16:51:07",NA,NA,"","RT @JonathanPeled: Muchas gracias Gobernador @JMCarrerasGob por su hospitalidad en #SLP @IsraelinMexico",4,0,0,0,0,"2016-11-12 08:09:41","2017-01-24 01:14:14",1,1
"789",796159842595454976,2932681820,"Wed Nov 09 01:17:53 +0000 2016","2016-11-09 01:17:53",NA,NA,"","Con @JonathanPeled, Embajador de Israel en México, inauguramos la planta del ramo automotriz #Foamotive, primera de… https://t.co/jBSmd7cOMj",28,22,0,0,0,"2016-11-12 08:09:41","2017-01-24 01:14:14",0,0
"790",796158401604505600,2932681820,"Wed Nov 09 01:12:09 +0000 2016","2016-11-09 01:12:09",NA,NA,"","RT @JonathanPeled: Con el Gob. Juan Manuel Carrera inaugurando la planta israelí Foamotive en #sanluispotosi https://t.co/OJbITgjhWN",4,0,0,0,0,"2016-11-12 08:09:47","2017-01-24 01:14:14",1,1
"791",795758156898975744,2932681820,"Mon Nov 07 22:41:43 +0000 2016","2016-11-07 22:41:43",NA,NA,"","Hoy clausuramos el 27º Consejo Ordinario del Sindicato Nacional de Trabajadores del Instituto Mexicano del Seguro S… https://t.co/a3DDkhcvaF",13,12,0,0,0,"2016-11-12 08:09:47","2017-01-23 07:26:29",0,0
"792",795758118588203008,2932681820,"Mon Nov 07 22:41:34 +0000 2016","2016-11-07 22:41:34",NA,NA,"","Reconocemos el compromiso de las y los trabajadores de @Tu_IMSS  en favor del bienestar de la población. https://t.co/wfbxKWXC5X",11,7,0,0,0,"2016-11-12 08:09:53","2017-01-23 07:26:29",0,0
"793",795666954476392448,2932681820,"Mon Nov 07 16:39:19 +0000 2016","2016-11-07 16:39:19",NA,NA,"","Hoy conmemoramos el Día del Ferrocarrilero, honramos a los trabajadores ferroviarios en su labor diaria. Recordamos… https://t.co/XFKOzNZTEq",16,29,0,0,0,"2016-11-12 08:09:53","2017-01-22 02:43:40",0,0
"794",795085796789211136,2932681820,"Sun Nov 06 02:10:00 +0000 2016","2016-11-06 02:10:00",NA,NA,"","En diciembre iniciará la segunda etapa de ésta importante acción.",8,8,0,0,0,"2016-11-12 08:09:59","2017-01-22 02:43:40",0,0
"795",795085732402499584,2932681820,"Sun Nov 06 02:09:45 +0000 2016","2016-11-06 02:09:45",NA,NA,"","En éstas se destinaron 13.2 millones de pesos a través del Fideicomiso de Desarrollo Económico, y tienen un avance… https://t.co/1FqGLxptWk",11,17,0,0,0,"2016-11-12 08:09:59","2017-01-21 08:46:59",0,0
"796",795085131019001856,2932681820,"Sun Nov 06 02:07:21 +0000 2016","2016-11-06 02:07:21",NA,NA,"","Hoy supervisamos los trabajos de rehabilitación de la primera etapa de calles y avenidas de la Zona Industrial. https://t.co/Tno4kjtQ8v",20,31,0,0,0,"2016-11-12 08:10:04","2017-01-21 08:46:59",0,0
"797",797576323833040896,2932681820,"Sat Nov 12 23:06:28 +0000 2016","2016-11-12 23:06:28",NA,NA,"","Leer expande y enriquece nuestros conocimientos, nuestra visión del mundo y nos lleva a lugares maravillosos.… https://t.co/8jHJ2HhMLa",7,9,0,0,0,"2016-11-13 13:18:32","2017-01-27 08:08:15",0,0
"798",797561573631881216,2932681820,"Sat Nov 12 22:07:51 +0000 2016","2016-11-12 22:07:51",NA,NA,"","Trabajadores y trabajadoras postales realizan una importante labor en nuestro país. Reconocemos su esfuerzo y dedic… https://t.co/jPE1xPn4g6",5,16,0,0,0,"2016-11-13 13:18:33","2017-01-27 08:08:15",0,0
"799",797946447849099264,2932681820,"Sun Nov 13 23:37:12 +0000 2016","2016-11-13 23:37:12",NA,NA,"","La cual impulsa el Gobierno Federal en 13 ciudades en forma simultánea. Con ello se busca combatir principalmente l… https://t.co/QOjo5yjs4h",8,7,0,0,0,"2016-11-14 07:06:34","2017-01-27 08:08:15",0,0
"800",797946058307317760,2932681820,"Sun Nov 13 23:35:40 +0000 2016","2016-11-13 23:35:40",NA,NA,"","Con mi esposa, la Presidenta del @DIF_SLP Lorena Valle Rodríguez, participamos en la 2da Carrera Nacional “Moviendo… https://t.co/ujSaWhfDg6",15,21,0,0,0,"2016-11-14 07:06:37","2017-01-27 08:08:15",0,0
"801",798198873202143232,2932681820,"Mon Nov 14 16:20:15 +0000 2016","2016-11-14 16:20:15",NA,NA,"","Mantener una dieta sana y equilibrada es uno de los principales aspectos para tratar y prevenir la diabetes.… https://t.co/umggTUpcjt",17,14,0,0,0,"2016-11-14 17:18:49","2017-01-28 08:29:23",0,0
"802",798340554262052864,2932681820,"Tue Nov 15 01:43:15 +0000 2016","2016-11-15 01:43:15",NA,NA,"","Agradezco a Jaime Urrutia Fucugauchi Pdte de la @amciencias su apoyo al impulso de la ciencia en #SLP al ser sede de tan importante reunión.",14,10,0,0,0,"2016-11-15 04:32:04","2017-01-28 08:29:23",0,0
"803",798340049339154432,2932681820,"Tue Nov 15 01:41:14 +0000 2016","2016-11-15 01:41:14",NA,NA,"","El reto es afianzar esta posición mediante un mayor esfuerzo entre el sector público y privado para la apertura de centros de investigación.",9,9,0,0,0,"2016-11-15 04:32:04","2017-01-28 08:29:23",0,0
"804",798339864827527168,2932681820,"Tue Nov 15 01:40:30 +0000 2016","2016-11-15 01:40:30",NA,NA,"","Este año se invierten más de 860 millones de pesos en este rubro.",9,5,0,0,0,"2016-11-15 04:32:04","2017-01-28 08:29:23",0,0
"805",798339719377534976,2932681820,"Tue Nov 15 01:39:56 +0000 2016","2016-11-15 01:39:56",NA,NA,"","Urrutia Fucugauchi, aseguró que tenemos el potencial para ser polo científico y tecnológico de excelencia en #Mx y a nivel internacional.",16,5,0,0,0,"2016-11-15 04:32:04","2017-01-28 08:29:23",0,0
"806",798338863504596992,2932681820,"Tue Nov 15 01:36:32 +0000 2016","2016-11-15 01:36:32",NA,NA,"","SLP fue sede de la reunión “Construyendo el futuro, encuentros de ciencia”, encabezada por Jaime Urrutia Fucugauchi… https://t.co/foEG6Jwz3W",16,18,0,0,0,"2016-11-15 04:32:04","2017-01-28 08:29:23",0,0
"807",798723168982573056,2932681820,"Wed Nov 16 03:03:37 +0000 2016","2016-11-16 03:03:37",NA,NA,"","RT @PC_SLP: Actualizamos el estado de las vialidades por acumulación de agua https://t.co/s4u4nZ0iX0",4,0,0,0,0,"2016-11-16 12:47:48","2017-01-30 06:31:34",1,1
