"","id_tweet","id_twitter","created_at","created_at_datetime","in_reply_to_user_id","in_reply_to_status_id","in_reply_to_screen_name","text","retweet_count","favorite_count","longitude","latitude","retweeted","creation_date","modification_date","RT_temp","is_retweeted"
"1",599384878187163648,175614590,"Sat May 16 01:24:25 +0000 2015","2015-05-16 01:24:25",NA,NA,"","Hoy nos acompañó Lucecita a Telchac Puerto. Les manda un saludo a todos los amig@s del #DistritoIIFederal!! http://t.co/Zf0fgSgvKN",0,0,0,0,0,"2015-08-02 21:08:08","2015-08-03 00:23:32",0,NA
"2",599424476615348224,175614590,"Sat May 16 04:01:46 +0000 2015","2015-05-16 04:01:46",NA,NA,"","En Muxupip están listos para ganar este 7 de Junio con la fórmula perfecta de #LosMejoresCandidatos ???? http://t.co/KXE1WiYgIF",3,1,0,0,0,"2015-08-02 21:08:08","2015-08-03 00:23:32",0,NA
"3",599600786524360704,175614590,"Sat May 16 15:42:22 +0000 2015","2015-05-16 15:42:22",NA,NA,"","Es un gusto para mi saludar a mis amig@s de @CNOP_Progreso esta mañana. #JuntosNadieNosPara http://t.co/lvuRrNHBwF",9,5,0,0,0,"2015-08-02 21:08:08","2015-08-03 00:23:32",0,NA
"4",599723846606954496,175614590,"Sat May 16 23:51:22 +0000 2015","2015-05-16 23:51:22",NA,NA,"","Saludando a mis amig@s de Cnop Progreso !! http://t.co/8IVwQVcxry",0,0,0,0,0,"2015-08-02 21:08:07","2015-08-03 00:23:32",0,NA
"5",599724917299380224,175614590,"Sat May 16 23:55:37 +0000 2015","2015-05-16 23:55:37",NA,NA,"","RT @rgolmedo: Apoyando a nuestras candidatas en Progreso, @JessiSaiden, @LucelyAlpizarC y María Ester Alonzo. 
#SensibilidadyOrden http://t…",12,0,0,0,0,"2015-08-02 21:08:07","2015-08-03 00:23:32",1,NA
"6",599725215954833408,175614590,"Sat May 16 23:56:48 +0000 2015","2015-05-16 23:56:48",NA,NA,"","RT @ViCaballeroD: @JessiSaiden @LucelyAlpizarC y @MariesterAlonzo que sigan los éxitos en esta campaña. Siempre es un gusto visitar #Progre…",5,0,0,0,0,"2015-08-02 21:08:07","2015-08-03 00:23:32",1,NA
"7",599942324278398976,175614590,"Sun May 17 14:19:31 +0000 2015","2015-05-17 14:19:31",NA,NA,"","Bonito domingo mis amig@s, que tengan un excelente día. Saludos!!",1,1,0,0,0,"2015-08-02 21:08:07","2015-08-03 00:23:32",0,NA
"8",600012184857391104,175614590,"Sun May 17 18:57:07 +0000 2015","2015-05-17 18:57:07",NA,NA,"","Un gusto saludar a mis amig@s de la #UNTRAC esta mañana. #JuntosNadieNosPara http://t.co/LdQa5ShgG2",38,15,0,0,0,"2015-08-02 21:08:07","2015-08-03 00:23:32",0,NA
"9",600019183452065792,175614590,"Sun May 17 19:24:55 +0000 2015","2015-05-17 19:24:55",NA,NA,"","RT @jc_ramirezmarin: En #Progreso acompañando a #LosMejoresCandidatos @JessiSaiden y @LucelyAlpizarC en el aniversario de la UNTRAC. http:/…",58,0,0,0,0,"2015-08-02 21:08:07","2015-08-03 00:23:32",1,NA
"10",600024376549990400,175614590,"Sun May 17 19:45:33 +0000 2015","2015-05-17 19:45:33",NA,NA,"","http://t.co/igbGCv1oSE",0,0,0,0,0,"2015-08-02 21:08:06","2015-08-03 00:23:32",0,NA
"11",600072958468431872,175614590,"Sun May 17 22:58:36 +0000 2015","2015-05-17 22:58:36",NA,NA,"","Hoy pude disfrutar de una gran convivencia con amig@s de San Ignacio, Comisaría de Progreso. http://t.co/GFGYbPHJcL",3,0,0,0,0,"2015-08-02 21:08:06","2015-08-03 00:23:32",0,NA
"12",600270656714989568,175614590,"Mon May 18 12:04:11 +0000 2015","2015-05-18 12:04:11",NA,NA,"","Hola!! Buen inicio de semana, mucho éxito y buena vibra para todas las actividades que tengan este lunes. En un... http://t.co/N97VpHZ0MN",0,1,0,0,0,"2015-08-02 21:08:05","2015-08-03 00:23:32",0,NA
"13",600295678846316544,175614590,"Mon May 18 13:43:37 +0000 2015","2015-05-18 13:43:37",NA,NA,"","Buen día queridos amig@s. Hoy estaremos saludando a tod@s l@s amig@s de Progreso, Dzidzantun, Temax y Motul.... http://t.co/aeHtsOO1xP",2,1,0,0,0,"2015-08-02 21:08:05","2015-08-04 14:45:04",0,NA
"14",600357288935759872,175614590,"Mon May 18 17:48:26 +0000 2015","2015-05-18 17:48:26",NA,NA,"","Estoy saludando a mis amig@s de las colonias Francisco I Madero y Revolución. http://t.co/8tn5Z2p3jG",2,3,0,0,0,"2015-08-02 21:08:05","2015-08-04 14:45:04",0,NA
"15",600414292861550592,175614590,"Mon May 18 21:34:57 +0000 2015","2015-05-18 21:34:57",NA,NA,"","Hoy es el Día Internacional del Museo, te dejamos una foto del Palacio de Cantón en Mérida. http://t.co/7OaVN8cUBi",0,0,0,0,0,"2015-08-02 21:08:05","2015-08-04 14:45:04",0,NA
"16",600427721387319296,175614590,"Mon May 18 22:28:18 +0000 2015","2015-05-18 22:28:18",NA,NA,"","Hoy es el Día Internacional del Museo; les invito a visitar el Centro Cultural y Artesanal (Museo /Tienda) en... http://t.co/3AdG9V5IbR",1,0,0,0,0,"2015-08-02 21:08:04","2015-08-04 14:45:04",0,NA
"17",600466486268792832,175614590,"Tue May 19 01:02:21 +0000 2015","2015-05-19 01:02:21",NA,NA,"","Una verdadera fiesta se vive en Dzidzantún con toda la gente del municipio. #JuntosNadieNosPara http://t.co/5rJPFx6Hfz",0,1,0,0,0,"2015-08-02 21:08:04","2015-08-04 14:45:04",0,NA
"18",600512358084005888,175614590,"Tue May 19 04:04:37 +0000 2015","2015-05-19 04:04:37",NA,NA,"","Terminando mis actividades de hoy; en Temax se disfruta estos días con gran alegría, Sensibilidad y Orden. http://t.co/rPwhc5dt4k",1,1,0,0,0,"2015-08-02 21:08:04","2015-08-04 14:45:04",0,NA
"19",600523372024442880,175614590,"Tue May 19 04:48:23 +0000 2015","2015-05-19 04:48:23",NA,NA,"","Una gran fiesta priísta se vivió en Temax. Gracias a mis amig@s por su grato recibimiento. En equipo trabajaremos... http://t.co/dTAVVyDVEd",1,1,0,0,0,"2015-08-02 21:08:04","2015-08-04 14:45:04",0,NA
"20",600661271646601216,175614590,"Tue May 19 13:56:21 +0000 2015","2015-05-19 13:56:21",NA,NA,"","RT @CCQ_PRI: Camino a Yucatán, hogar de la gran Chichén Itzá, la jarana y la trova. #TrabajandoPorLoQueMásQuieres @hendricksjoaqui http://t…",170,0,0,0,0,"2015-08-02 21:08:03","2015-08-04 14:45:04",1,NA
"21",600661373425586176,175614590,"Tue May 19 13:56:45 +0000 2015","2015-05-19 13:56:45",204472461,600649322284220416,"CCQ_PRI","@CCQ_PRI Bienvenido Líder, lo esperamos con mucho ánimo.",0,0,0,0,0,"2015-08-02 21:08:03","2015-08-04 14:45:04",0,NA
"22",600665472254763008,175614590,"Tue May 19 14:13:03 +0000 2015","2015-05-19 14:13:03",NA,NA,"","Hoy recibimos a nuestro Presidente del Comité Ejecutivo Nacional del PRI, Dr. César Camacho ¡Bienvenido a Tierras... http://t.co/caItksn7VE",0,1,0,0,0,"2015-08-02 21:08:03","2015-08-04 14:45:04",0,NA
"23",600666361350619136,175614590,"Tue May 19 14:16:35 +0000 2015","2015-05-19 14:16:35",NA,NA,"","Hoy recibimos a nuestro Presidente del Comité Ejecutivo Nacional del PRI, Dr. @CCQ_PRI ¡Bienvenido a Yucatán! http://t.co/rgtmRrrIkG",4,3,0,0,0,"2015-08-02 21:08:03","2015-08-04 14:45:04",0,NA
"24",600682470233739264,175614590,"Tue May 19 15:20:35 +0000 2015","2015-05-19 15:20:35",NA,NA,"","Con mucho entusiasmo recibimos al Dr. César Camacho, Líder Nacional de nuestro Partido Revolucionario... http://t.co/u94N5lDGZu",0,0,0,0,0,"2015-08-02 21:08:03","2015-08-04 14:45:04",0,NA
"25",600690905658437632,175614590,"Tue May 19 15:54:06 +0000 2015","2015-05-19 15:54:06",NA,NA,"","Estoy en Toma de Protesta de Activistas de Mérida junto a Nuestro Presidente @CCQ_PRI y #LosMejoresCandidatos http://t.co/vrqq6c2EhO",6,4,0,0,0,"2015-08-02 21:08:03","2015-08-04 14:45:04",0,NA
"26",600698539665018880,175614590,"Tue May 19 16:24:26 +0000 2015","2015-05-19 16:24:26",NA,NA,"","RT @ONMPRIYucatan: “Tenemos un profundo respeto por los ciudadanos"" @CCQ_PRI http://t.co/NAajcd1prO",3,0,0,0,0,"2015-08-02 21:08:03","2015-08-04 14:45:04",1,NA
"27",600705849800003584,175614590,"Tue May 19 16:53:29 +0000 2015","2015-05-19 16:53:29",NA,NA,"","En la Toma de Protesta de Activistas de Mérida junto a nuestro Presidente Nacional @CCQ_PRI #LosMejoresCandidatos http://t.co/jTCiOp8zWR",4,4,0,0,0,"2015-08-02 21:08:03","2015-08-04 14:45:04",0,NA
"28",600760406219493376,175614590,"Tue May 19 20:30:17 +0000 2015","2015-05-19 20:30:17",NA,NA,"","Participé en la Toma de Protesta de Activistas de Mérida en la cual fue encabezada por nuestro dirigente... http://t.co/oxF140YFkE",0,1,0,0,0,"2015-08-02 21:08:02","2015-08-04 14:45:04",0,NA
"29",600821092521889792,175614590,"Wed May 20 00:31:25 +0000 2015","2015-05-20 00:31:25",NA,NA,"","RT @gioovis: Hoy en la mañana con dos grandes mujeres  ! @lucelyalpizarc https://t.co/jTIzRV4ncf",1,0,0,0,0,"2015-08-02 21:08:02","2015-08-04 14:45:04",1,NA
"30",600825831158517760,175614590,"Wed May 20 00:50:15 +0000 2015","2015-05-20 00:50:15",NA,NA,"","En la colonia Ismael García en Progreso, @MariesterAlonzo y yo su amiga, caminamos y saludamos a la gente. http://t.co/ALd3Qp83zk",5,1,0,0,0,"2015-08-02 21:08:02","2015-08-04 14:45:04",0,NA
"31",600831509583495168,175614590,"Wed May 20 01:12:49 +0000 2015","2015-05-20 01:12:49",NA,NA,"","Hoy junto a mi amiga Todos Con Maria Ester Alonzo, Candidata a Diputada Local Distrito IX, caminé la colonia... http://t.co/6ULDCcNoKI",2,0,0,0,0,"2015-08-02 21:08:01","2015-08-04 14:45:04",0,NA
"32",600856064251146240,175614590,"Wed May 20 02:50:23 +0000 2015","2015-05-20 02:50:23",NA,NA,"","Hace unos minutos platiqué con amig@s durante una reunión de trabajo en la que pudimos expresar nuestras propuestas. http://t.co/n6vwfN6l3a",7,1,0,0,0,"2015-08-02 21:08:01","2015-08-04 14:45:04",0,NA
"33",600856333571661824,175614590,"Wed May 20 02:51:27 +0000 2015","2015-05-20 02:51:27",1639401312,600805976229347328,"HdzJE94","@HdzJE94 Emilio muchas gracias por tus palabras. Es un gusto para mi trabajar para la gente y estar cerca de todos.",1,1,0,0,0,"2015-08-02 21:08:01","2015-08-04 14:45:04",0,NA
"34",600858599146004480,175614590,"Wed May 20 03:00:28 +0000 2015","2015-05-20 03:00:28",NA,NA,"","Hace unos minutos platiqué con amig@s durante una reunión de trabajo en la que pudimos expresar nuestras... http://t.co/1C04CFPJpK",2,0,0,0,0,"2015-08-02 21:08:01","2015-08-04 14:45:04",0,NA
"35",601001297161101312,175614590,"Wed May 20 12:27:29 +0000 2015","2015-05-20 12:27:29",NA,NA,"","Hoy estaré en Acanceh, Conkal y Tixpehual para acercarme más a la gente, escuchar sus necesidades y explicarles... http://t.co/VHhX3vbp9T",1,1,0,0,0,"2015-08-02 21:08:00","2015-08-04 14:45:04",0,NA
"36",601032283168972800,175614590,"Wed May 20 14:30:37 +0000 2015","2015-05-20 14:30:37",NA,NA,"","Que bonita foto de Acanceh !! https://t.co/t7XXy4MVxO",0,0,0,0,0,"2015-08-02 21:08:00","2015-08-04 14:45:04",0,NA
"37",601072005991927808,175614590,"Wed May 20 17:08:28 +0000 2015","2015-05-20 17:08:28",NA,NA,"","Escuchamos a la ciudadanía de Acanceh durante nuestras visitas vecinales en el municipio. #DistritoIIFederal http://t.co/Das4P7xcyc",1,1,0,0,0,"2015-08-02 21:08:00","2015-08-04 14:45:04",0,NA
"38",601131767093796864,175614590,"Wed May 20 21:05:56 +0000 2015","2015-05-20 21:05:56",NA,NA,"","Los jóvenes del #DistritoIIFederal tienen la actitud para ganar este 7 de junio. Vamos con todo por la juventud !! http://t.co/eIb9ipfIoT",8,4,0,0,0,"2015-08-02 21:08:00","2015-08-04 14:45:04",0,NA
"39",601135156569706496,175614590,"Wed May 20 21:19:24 +0000 2015","2015-05-20 21:19:24",NA,NA,"","Los jóvenes del #DistritoIIFederal tienen la actitud para ganar este 7 de junio. Vamos con todo por la juventud !! http://t.co/Y6ikIHmtxq",1,1,0,0,0,"2015-08-02 21:07:59","2015-08-04 14:45:04",0,NA
"40",601178698449031168,175614590,"Thu May 21 00:12:25 +0000 2015","2015-05-21 00:12:25",NA,NA,"","Mis respetos para quienes ejercen la profesión de la Psicología, ya que hacen una gran labor para la sociedad. http://t.co/GubHlfyG5N",0,1,0,0,0,"2015-08-02 21:07:59","2015-08-04 14:45:04",0,NA
"41",601230626625228800,175614590,"Thu May 21 03:38:46 +0000 2015","2015-05-21 03:38:46",NA,NA,"","Gran fiesta priísta se vivió durante la caminata en Tixpehual. Ya estamos listos para este 7 de junio ???? http://t.co/gBwsadf0bI",2,2,0,0,0,"2015-08-02 21:07:59","2015-08-04 14:45:04",0,NA
"42",601234317843570688,175614590,"Thu May 21 03:53:26 +0000 2015","2015-05-21 03:53:26",NA,NA,"","Gran ánimo y fiesta priísta se vivió esta noche en Tixpehual. Juntos; Gerardo Concha, Candidato a Presidente... http://t.co/4HGqL0kmQ6",2,0,0,0,0,"2015-08-02 21:07:59","2015-08-10 15:13:38",0,NA
"43",601379299292278784,175614590,"Thu May 21 13:29:32 +0000 2015","2015-05-21 13:29:32",NA,NA,"","Que rápido pasa el tiempo, ya a 17 días para culminar con un gran trabajo y esfuerzo. Bonito jueves amig@s!!",2,3,0,0,0,"2015-08-02 21:07:59","2015-08-10 15:13:38",0,NA
"44",601406375504125952,175614590,"Thu May 21 15:17:08 +0000 2015","2015-05-21 15:17:08",NA,NA,"","RT @ONMPRIYucatan: Estamos realizando una reunión de trabajo con todas nuestra coordinadoras y presidentas municipales del ONMPRI. http://t…",3,0,0,0,0,"2015-08-02 21:07:59","2015-08-10 15:13:38",1,NA
"45",601430288867069952,175614590,"Thu May 21 16:52:09 +0000 2015","2015-05-21 16:52:09",NA,NA,"","Gracias @ONMPRIYucatan y a las #MujeresEnMovimiento por su gran apoyo en el #DistritoIIFederal http://t.co/MEbJOEkEbj",2,2,0,0,0,"2015-08-02 21:07:59","2015-08-10 15:13:38",0,NA
"46",601436056324427776,175614590,"Thu May 21 17:15:04 +0000 2015","2015-05-21 17:15:04",NA,NA,"","Muchas gracias ONMPRI Yucatán por su gran apoyo. Las mujeres son la fuerza de nuestro estado, con ustedes nadie... http://t.co/2KPNsTOU5r",1,1,0,0,0,"2015-08-02 21:07:58","2015-08-10 15:13:38",0,NA
"47",601506770712944640,175614590,"Thu May 21 21:56:04 +0000 2015","2015-05-21 21:56:04",NA,NA,"","Estoy en camino a Dzilam González para participar en la Priciruta, aprovecharé para convivir con los jóvenes,... http://t.co/AoCE9O1nd8",0,2,0,0,0,"2015-08-02 21:07:58","2015-08-11 22:38:34",0,NA
"48",601560026336079872,175614590,"Fri May 22 01:27:41 +0000 2015","2015-05-22 01:27:41",NA,NA,"","Vamos a seguir recorriendo las calles de los municipios y en Dzilam González no es la excepción. Participamos en... http://t.co/TIZY1BdHeA",2,1,0,0,0,"2015-08-02 21:07:58","2015-08-11 22:38:34",0,NA
"49",601598861220544512,175614590,"Fri May 22 04:02:00 +0000 2015","2015-05-22 04:02:00",NA,NA,"","RT @paulinoarce: En dzilam de bravo  caminata con @LucelyAlpizarC @cesarpf_5 @WalterSalazarMX  vamos a ganar http://t.co/nfoIZksQif",1,0,0,0,0,"2015-08-02 21:07:57","2015-08-11 22:38:34",1,NA
"50",601598987276193792,175614590,"Fri May 22 04:02:30 +0000 2015","2015-05-22 04:02:30",175800759,601533125554884608,"ComuniqueTV","@ComuniqueTV @asseretto @angieacereto @eduardo_sorial @PRI_Yucatan gracias amigos!!",3,3,0,0,0,"2015-08-02 21:07:57","2015-08-11 22:38:34",0,NA
"51",601721775932715008,175614590,"Fri May 22 12:10:25 +0000 2015","2015-05-22 12:10:25",NA,NA,"","Buenos días a tod@s!! Vamos a disfrutar este viernes con la mejor actitud. El #equipoLucy esa con todo y hoy nos... http://t.co/BaufXVsbZJ",2,3,0,0,0,"2015-08-02 21:07:57","2015-08-11 22:38:34",0,NA
"52",601845117469753344,175614590,"Fri May 22 20:20:32 +0000 2015","2015-05-22 20:20:32",NA,NA,"","Jornadas de trabajo en el Distrito II Federal http://t.co/YlI2tm1h5B",0,2,0,0,0,"2015-08-02 21:07:56","2015-08-11 22:38:34",0,NA
"53",601860137960222720,175614590,"Fri May 22 21:20:13 +0000 2015","2015-05-22 21:20:13",NA,NA,"","En un rato más estaré en Progreso dialogando con la gente. Quiero saber cuales son sus opiniones. Para mi... http://t.co/wsD5SbYUnt",0,0,0,0,0,"2015-08-02 21:07:56","2015-08-11 22:38:34",0,NA
"54",601898526566588416,175614590,"Fri May 22 23:52:46 +0000 2015","2015-05-22 23:52:46",NA,NA,"","RT @jc_ramirezmarin: Nos encontramos en caminata en #Progreso con #LosMejoresCandidatos @JessiSaiden @MariesterAlonzo y @LucelyAlpizarC htt…",51,0,0,0,0,"2015-08-02 21:07:56","2015-08-11 22:38:34",1,NA
"55",601899189476331520,175614590,"Fri May 22 23:55:24 +0000 2015","2015-05-22 23:55:24",NA,NA,"","RT @ComuniqueInform: @LucelyAlpizarC inicia caminata en progreso parque de la termo eléctrica http://t.co/DsFZl3c8LN",3,0,0,0,0,"2015-08-02 21:07:56","2015-08-11 22:38:34",1,NA
"56",601899291729219584,175614590,"Fri May 22 23:55:48 +0000 2015","2015-05-22 23:55:48",NA,NA,"","#LosMejoresCandidatos están en Progreso #JuntosNadieNosPara @jc_ramirezmarin @JessiSaiden @MariesterAlonzo http://t.co/1epzMlIF9S",33,11,0,0,0,"2015-08-02 21:07:56","2015-08-11 22:38:34",0,NA
"57",601899331050811392,175614590,"Fri May 22 23:55:57 +0000 2015","2015-05-22 23:55:57",NA,NA,"","RT @PRICULTURAL: #LosMejoresCandidatos @NerioTorresA @LiborioVidalA @LucelyAlpizarC @PabloGamboa_MX @FelipeCervera @FTorresRivas #Vamoscont…",1,0,0,0,0,"2015-08-02 21:07:55","2015-08-11 22:38:34",1,NA
"58",601924294105374720,175614590,"Sat May 23 01:35:09 +0000 2015","2015-05-23 01:35:09",NA,NA,"","Que alegría saludar a todas las mamás de la colonia Francisco I Madero, seccional 753, vamos a trabajar juntos !! http://t.co/vzETCf57yM",1,1,0,0,0,"2015-08-02 21:07:55","2015-08-11 22:38:34",0,NA
"59",601932974313975808,175614590,"Sat May 23 02:09:39 +0000 2015","2015-05-23 02:09:39",152716073,601931735123697664,"lnetomartinez","@lnetomartinez gracias por acompañarnos Diputado. #JuntasNadieNosPara",0,0,0,0,0,"2015-08-02 21:07:55","2015-08-11 22:38:34",0,NA
"60",601933068702588928,175614590,"Sat May 23 02:10:01 +0000 2015","2015-05-23 02:10:01",NA,NA,"","RT @lnetomartinez: Muy grato acompañar a nuestros candidatos en Progreso @jc_ramirezmarin @JessiSaiden  @LucelyAlpizarC @mariaesteralmo htt…",4,0,0,0,0,"2015-08-02 21:07:55","2015-08-11 22:38:34",1,NA
"61",601933469703245824,175614590,"Sat May 23 02:11:37 +0000 2015","2015-05-23 02:11:37",72472562,601928872670601216,"Cid_Aguilar","@Cid_Aguilar gracia por acompañarnos amigo !!",1,1,0,0,0,"2015-08-02 21:07:55","2015-08-11 22:38:34",0,NA
"62",601954453613219840,175614590,"Sat May 23 03:35:00 +0000 2015","2015-05-23 03:35:00",NA,NA,"","RT @jorgemendezba: #LosMejoresCandidatos recorren las calles de Progreso @jc_ramirezmarin @JessiSaiden @MariesterAlonzo @LucelyAlpizarC htt…",5,0,0,0,0,"2015-08-02 21:07:54","2015-08-11 22:38:34",1,NA
"63",601976337620959232,175614590,"Sat May 23 05:01:57 +0000 2015","2015-05-23 05:01:57",NA,NA,"","http://t.co/ddmbaFXHUr",0,1,0,0,0,"2015-08-02 21:07:54","2015-08-11 22:38:34",0,NA
"64",602098692447969280,175614590,"Sat May 23 13:08:09 +0000 2015","2015-05-23 13:08:09",NA,NA,"","Muy buen día para tod@s, seguimos trabajando en el #DistritoIIFederal en cercanía con la gente, escuchándola y... http://t.co/rHYSV2f0EH",0,0,0,0,0,"2015-08-02 21:07:54","2015-08-11 22:38:34",0,NA
"65",602176561136078848,175614590,"Sat May 23 18:17:34 +0000 2015","2015-05-23 18:17:34",2244747697,602107960723025920,"WarnelMayE","@WarnelMayMx @eligamboasolis mucho éxito este sábado amig@s.",1,0,0,0,0,"2015-08-02 21:07:54","2015-08-11 22:38:34",0,NA
"66",602176589468540928,175614590,"Sat May 23 18:17:41 +0000 2015","2015-05-23 18:17:41",NA,NA,"","RT @PRICULTURAL: Excelente día #LosMejoresCandidatos #VamosConTodo @eligamboasolis @LucelyAlpizarC @veronicacamino @CeliaRivasR  @CharytinO…",2,0,0,0,0,"2015-08-02 21:07:53","2015-08-11 22:38:34",1,NA
"67",602176616710610944,175614590,"Sat May 23 18:17:47 +0000 2015","2015-05-23 18:17:47",NA,NA,"","RT @jorgemendezba: Gran caminata en #Progreso en compañía de @jc_ramirezmarin, @JessiSaiden, @MariesterAlonzo y @LucelyAlpizarC. http://t.c…",2,0,0,0,0,"2015-08-02 21:07:53","2015-08-11 22:38:34",1,NA
"68",602206120774471680,175614590,"Sat May 23 20:15:02 +0000 2015","2015-05-23 20:15:02",NA,NA,"","Quiero trabajar con y para los jóvenes; ser esa mano amiga que les apoye cuando más lo necesiten. http://t.co/5wtCoroMKD",1,2,0,0,0,"2015-08-02 21:07:53","2015-08-11 22:38:33",0,NA
"69",602210242567479296,175614590,"Sat May 23 20:31:25 +0000 2015","2015-05-23 20:31:25",NA,NA,"","Quiero trabajar con y para los jóvenes; ser esa mano amiga que les apoye cuando más lo necesiten. Ustedes son el... http://t.co/t3fd9b94Th",1,2,0,0,0,"2015-08-02 21:07:53","2015-08-11 22:38:33",0,NA
"70",602231945980944384,175614590,"Sat May 23 21:57:39 +0000 2015","2015-05-23 21:57:39",NA,NA,"","Estoy muy entusiasmada de intercambiar opiniones con la gente de Yobaín. Quiero estar cerca de ustedes y trabajar... http://t.co/7U91ZKyk0P",1,0,0,0,0,"2015-08-02 21:07:52","2015-08-16 12:53:02",0,NA
"71",602245876279541760,175614590,"Sat May 23 22:53:00 +0000 2015","2015-05-23 22:53:00",NA,NA,"","Hoy tuve el gusto de trabajar y compartir los alimentos con los protagonistas de la Marina mercante  en el... http://t.co/2hNno95YDw",1,0,0,0,0,"2015-08-02 21:07:52","2015-08-16 12:53:02",0,NA
"72",602262895431299072,175614590,"Sun May 24 00:00:38 +0000 2015","2015-05-24 00:00:38",NA,NA,"","Estoy platicando con la gente Yobaín, juntos firmaremos parte de este gran proyecto del #DistritoIIFederal http://t.co/zuFg8oyY18",2,1,0,0,0,"2015-08-02 21:07:52","2015-08-16 12:53:02",0,NA
"73",602439835362680832,175614590,"Sun May 24 11:43:44 +0000 2015","2015-05-24 11:43:44",NA,NA,"","Buen día mis estimados amig@s , en un rato más estaré en Telchac Pueblo junto a la gente. Quiero platicarles... http://t.co/QdjNs9noav",0,0,0,0,0,"2015-08-02 21:07:52","2015-08-16 12:53:02",0,NA
"74",602480520694337536,175614590,"Sun May 24 14:25:24 +0000 2015","2015-05-24 14:25:24",NA,NA,"","Esta mañana en Telchac Pueblo me reuní con la estructura del partido para dialogar sobre el próximo 7 de Junio. http://t.co/JCcMYB0xsP",3,3,0,0,0,"2015-08-02 21:07:52","2015-08-16 12:53:02",0,NA
"75",602513226908184576,175614590,"Sun May 24 16:35:22 +0000 2015","2015-05-24 16:35:22",NA,NA,"","Empezamos con la reta de futbolero con mi pequeño compañero del #EquipoLucy en Telchac Pueblo. http://t.co/23Fw9uli4W",0,1,0,0,0,"2015-08-02 21:07:51","2015-08-16 12:53:02",0,NA
"76",602547234325065728,175614590,"Sun May 24 18:50:30 +0000 2015","2015-05-24 18:50:30",NA,NA,"","Una mañana muy bonita en Telchac Pueblo! Gracias amig@s Todos Con Maria Ester Alonzo Carlos Cabrera Rivero http://t.co/ckz2Nyt8RJ",0,1,0,0,0,"2015-08-02 21:07:51","2015-08-16 12:53:02",0,NA
"77",602663046423584768,175614590,"Mon May 25 02:30:41 +0000 2015","2015-05-25 02:30:41",NA,NA,"","RT @MovPRIMXOficial: #LosMejoresCandidatos a Dip. Federales de @PRI_Yucatan: @LiborioVidalA @LucelyAlpizarC @PabloGamboa_MX @FelipeCervera …",50,0,0,0,0,"2015-08-02 21:07:51","2015-08-16 12:53:02",1,NA
"78",602793238693486592,175614590,"Mon May 25 11:08:02 +0000 2015","2015-05-25 11:08:02",NA,NA,"","En un rato más estaré en Kimbilá tomando nota y escuchando a la ciudadanía. http://t.co/N71Ps94pZm",0,0,0,0,0,"2015-08-02 21:07:51","2015-08-16 12:53:02",0,NA
"79",602841185858691072,175614590,"Mon May 25 14:18:33 +0000 2015","2015-05-25 14:18:33",NA,NA,"","Con atención, sensibilidad y orden estoy escuchando y tomado nota de los comentarios de la gente de Kimbilá. http://t.co/q6Cx7Lm65Z",3,4,0,0,0,"2015-08-02 21:07:51","2015-08-16 12:53:02",0,NA
"80",602843524225212416,175614590,"Mon May 25 14:27:51 +0000 2015","2015-05-25 14:27:51",NA,NA,"","Con atención, sensibilidad y orden estoy escuchando y tomado nota de los comentarios de la gente de Kimbilá. http://t.co/XzdLYmCZjE",0,1,0,0,0,"2015-08-02 21:07:50","2015-08-16 12:53:02",0,NA
"81",602885349820489728,175614590,"Mon May 25 17:14:03 +0000 2015","2015-05-25 17:14:03",NA,NA,"","Faltan 12 días para celebrar de una gran fiesta cívica. Con Sensibilidad y Orden estaré cerca de ti con las... http://t.co/LXIkGXSFDS",0,0,0,0,0,"2015-08-02 21:07:50","2015-08-16 12:53:02",0,NA
"82",602935621749854208,175614590,"Mon May 25 20:33:48 +0000 2015","2015-05-25 20:33:48",NA,NA,"","Felicito a todos los contadores, hoy los conmemoramos por su maravilloso trabajo. Les mando un cordial saludo. http://t.co/bSpKuhRfZi",0,4,0,0,0,"2015-08-02 21:07:50","2015-08-16 12:53:02",0,NA
"83",602979014869823488,175614590,"Mon May 25 23:26:14 +0000 2015","2015-05-25 23:26:14",NA,NA,"","RT @IcadepYucatan: Conoce a nuestros candidatos a una Diputación Federal @FelipeCervera @LucelyAlpizarC @PabloGamboa_MX @LiborioVidalA http…",4,0,0,0,0,"2015-08-02 21:07:50","2015-08-18 14:59:41",1,NA
"84",602979026529955840,175614590,"Mon May 25 23:26:17 +0000 2015","2015-05-25 23:26:17",NA,NA,"","RT @ComuniqueInform: @LucelyAlpizarC  en Kimbilá escuchando a la gente http://t.co/OzFXe0bw0S",3,0,0,0,0,"2015-08-02 21:07:50","2015-08-19 15:24:42",1,NA
"85",603016012947136512,175614590,"Tue May 26 01:53:15 +0000 2015","2015-05-26 01:53:15",NA,NA,"","Buenas noches amig@s, estoy rumbo a Buctzotz para ratificar mi compromiso con la gente. Quiero ser su Diputada... http://t.co/CPkTUQamWc",1,1,0,0,0,"2015-08-02 21:07:50","2015-08-19 15:24:42",0,NA
"86",603024074294501376,175614590,"Tue May 26 02:25:17 +0000 2015","2015-05-26 02:25:17",NA,NA,"","RT @PRI_Yucatan: Gente honesta, sensible, que se compromete y les cumplirá a la gente de Buctzotz, ellos son #LosMejoresCandidatos http://t…",5,0,0,0,0,"2015-08-02 21:07:49","2015-08-19 15:24:42",1,NA
"87",603025330060730368,175614590,"Tue May 26 02:30:17 +0000 2015","2015-05-26 02:30:17",NA,NA,"","En Buctzotz estamos listos para ganar con las mejores propuestas y #LosMejoresCandidatos. Vamos con todo !! http://t.co/VcLnLH0rFg",3,3,0,0,0,"2015-08-02 21:07:49","2015-08-19 15:24:42",0,NA
"88",603043977651163136,175614590,"Tue May 26 03:44:22 +0000 2015","2015-05-26 03:44:22",NA,NA,"","En Buctzotz estamos listos para ganar este 7 de junio porque tenemos a #LosMejoresCandidatos y las mejores... http://t.co/TJ6DrbIFgD",0,2,0,0,0,"2015-08-02 21:07:49","2015-08-19 15:24:42",0,NA
"89",603179422083055616,175614590,"Tue May 26 12:42:35 +0000 2015","2015-05-26 12:42:35",NA,NA,"","En un rato más estaré con la gente de Kanasín. Es muy grato para mi poder trabajar en cercanía de todos ustedes.... http://t.co/mX5LE0JTMK",0,1,0,0,0,"2015-08-02 21:07:49","2015-08-20 15:37:20",0,NA
"90",603210123209609216,175614590,"Tue May 26 14:44:35 +0000 2015","2015-05-26 14:44:35",NA,NA,"","En Kanasín trabajaremos como equipo, con Sensibilidad y Orden estaremos en cada casa sumando a más gente al proyecto. http://t.co/A36a3bsdpK",2,2,0,0,0,"2015-08-02 21:07:49","2015-08-20 15:37:20",0,NA
