"","id_tweet","id_twitter","created_at","created_at_datetime","in_reply_to_user_id","in_reply_to_status_id","in_reply_to_screen_name","text","retweet_count","favorite_count","longitude","latitude","retweeted","creation_date","modification_date","RT_temp","is_retweeted"
"1293",700490873805664256,175614590,"Fri Feb 19 01:23:33 +0000 2016","2016-02-19 01:23:33",NA,NA,"","¿has vivido un atardecer asi? tomate un segundo y conozcamos nuestro Estado #ViveYucatán #Progreso... https://t.co/TaHEaLknZk",2,1,0,0,0,"2016-02-19 10:39:27","2016-05-10 15:26:27",0,0
"1294",700398733259902976,175614590,"Thu Feb 18 19:17:25 +0000 2016","2016-02-18 19:17:25",NA,NA,"","Esta mañana nos reunimos con el Lic. Gerardo Ruiz Esparza, Secretario de Comunicaciones y Transportes del... https://t.co/rMFI7oz88p",1,2,0,0,0,"2016-02-19 10:39:30","2016-05-10 15:26:27",0,0
"1295",700361380461809664,175614590,"Thu Feb 18 16:48:59 +0000 2016","2016-02-18 16:48:59",NA,NA,"","Nueva infraestructura y programas en #telecomunicaciones. #redcompartida #internetparatodos   https://t.co/2r0DUBFpN7",1,1,0,0,0,"2016-02-19 10:39:32","2016-05-10 15:26:27",0,0
"1296",700359170470445056,175614590,"Thu Feb 18 16:40:12 +0000 2016","2016-02-18 16:40:12",NA,NA,"","Esta mañana los @DiputadosPRI nos reunimos con el secretario @gruizesp para saber los avances del #apagónanalógico. https://t.co/UdPrSiB6Yp",1,1,0,0,0,"2016-02-19 10:39:34","2016-05-10 15:26:27",0,0
"1297",700146984011874304,175614590,"Thu Feb 18 02:37:03 +0000 2016","2016-02-18 02:37:03",NA,NA,"","Hoy tuve el gusto de ser recibida por el Secretsrio de la SAGARPA. Un hombre sensible a las necesidades de l@s... https://t.co/V1b3hamXeg",1,1,0,0,0,"2016-02-19 10:39:34","2016-05-10 15:26:27",0,0
"1298",700048084378783744,175614590,"Wed Feb 17 20:04:04 +0000 2016","2016-02-17 20:04:04",NA,NA,"","Hoy conmemoramos el día del Inventor Mexicano, reconocemos su talento e innovación que impulsa el crecimiento de... https://t.co/JPy1QlKMzy",1,1,0,0,0,"2016-02-19 10:39:36","2016-05-09 23:52:14",0,0
"1299",699948960564310016,175614590,"Wed Feb 17 13:30:11 +0000 2016","2016-02-17 13:30:11",NA,NA,"","https://t.co/DfxJHbcfoc",1,1,0,0,0,"2016-02-19 10:39:39","2016-05-06 23:59:42",0,0
"1300",699754927103545344,175614590,"Wed Feb 17 00:39:10 +0000 2016","2016-02-17 00:39:10",NA,NA,"","https://t.co/EI99PYO5iC",0,1,0,0,0,"2016-02-19 10:39:41","2016-05-06 23:59:42",0,0
"1301",700848846054752256,175614590,"Sat Feb 20 01:06:00 +0000 2016","2016-02-20 01:06:00",NA,NA,"","LAS MUJERES ESTAMOS AQUÍ PARA TRABAJAR, PARA CONSTRUIR Y PARA SUMAR. https://t.co/JtVZKEtamg",2,1,0,0,0,"2016-02-19 23:06:15","2016-05-10 15:26:27",0,0
"1302",700836757529608192,175614590,"Sat Feb 20 00:17:58 +0000 2016","2016-02-20 00:17:58",NA,NA,"","Esta tarde fui testigo de la donación al Instituto Mexicano del Seguro Social del terrero para la ampliación y... https://t.co/t9Y6CCrNO6",1,0,0,0,0,"2016-02-19 23:06:18","2016-05-10 15:26:27",0,0
"1303",700817843001098240,175614590,"Fri Feb 19 23:02:48 +0000 2016","2016-02-19 23:02:48",NA,NA,"","Buenas tardes amigos, les agradezco la confianza y su cariño asi como la oportunidad de compartir día a día a... https://t.co/sGDuyrjIRe",0,1,0,0,0,"2016-02-19 23:06:20","2016-05-10 15:26:27",0,0
"1304",700711619551215616,175614590,"Fri Feb 19 16:00:43 +0000 2016","2016-02-19 16:00:43",NA,NA,"","Buenos días amigos, hoy me encuentro en el municipio de Conkal acompañando al Gobernador de nuestro Estado Lic.... https://t.co/KNUrkJSt4s",2,1,0,0,0,"2016-02-19 23:06:22","2016-05-10 15:26:27",0,0
"1305",701147637962117120,175614590,"Sat Feb 20 20:53:18 +0000 2016","2016-02-20 20:53:18",NA,NA,"","Buenas tardes amigos, el día de ayer me reuni con motivo del Día del Amor y la amistad con la estructura Estatal... https://t.co/pQF7euxwa6",1,1,0,0,0,"2016-02-22 01:40:45","2016-05-14 01:51:58",0,0
"1306",701068290253258752,175614590,"Sat Feb 20 15:38:00 +0000 2016","2016-02-20 15:38:00",NA,NA,"","10 Cosas que aprendes cuando eres criada por una madre de carácter fuerte https://t.co/29jjpt0tDn",1,1,0,0,0,"2016-02-22 01:40:47","2016-05-10 15:26:27",0,0
"1307",701860938039873536,175614590,"Mon Feb 22 20:07:42 +0000 2016","2016-02-22 20:07:42",NA,NA,"","Buenas tardes amigos, quiero invitarles a participar en la primera carrera y caminata familiar con motivo del Día... https://t.co/yoFSMFw5BJ",2,2,0,0,0,"2016-02-22 16:47:53","2016-05-14 01:51:58",0,0
"1308",702317081258229760,175614590,"Wed Feb 24 02:20:15 +0000 2016","2016-02-24 02:20:15",NA,NA,"","¡Hoy aprobamos reformas en beneficio de los adultos mayores y de las personas con discapacidad! Además, aprobamos... https://t.co/dfFXrusWJF",1,3,0,0,0,"2016-02-23 22:53:56","2016-05-16 09:41:22",0,0
"1309",702314964237881344,175614590,"Wed Feb 24 02:11:50 +0000 2016","2016-02-24 02:11:50",NA,NA,"","https://t.co/plwNg8gEFd",0,1,0,0,0,"2016-02-23 22:53:58","2016-05-15 11:36:01",0,0
"1310",702221805864534016,175614590,"Tue Feb 23 20:01:39 +0000 2016","2016-02-23 20:01:39",NA,NA,"","P https://t.co/9pS3tKPRdC",0,0,0,0,0,"2016-02-23 22:54:00","2016-05-15 11:36:01",0,0
"1311",702161955486883840,175614590,"Tue Feb 23 16:03:50 +0000 2016","2016-02-23 16:03:50",NA,NA,"","Comenzamos el día activamente. En este momento en el desarrollo de la 4ta Reunión de la Comisión de Ciencia y... https://t.co/eG56RV5aJn",0,0,0,0,0,"2016-02-23 22:54:03","2016-05-15 11:36:01",0,0
"1312",702158586730786816,175614590,"Tue Feb 23 15:50:27 +0000 2016","2016-02-23 15:50:27",NA,NA,"","#FelizMartes. En @Mx_Diputados con #CCyT y #foroconsultivo trabajos en favor de la ciencia y la tecnología. https://t.co/Xw805tPnkZ",0,0,0,0,0,"2016-02-23 22:54:05","2016-05-14 01:51:58",0,0
"1313",701914380653436928,175614590,"Mon Feb 22 23:40:03 +0000 2016","2016-02-22 23:40:03",NA,NA,"","Buenas tardes amigos, quiero invitarles a participar en la primera carrera y caminata familiar con motivo del Día... https://t.co/OsoswTz9HC",2,1,0,0,0,"2016-02-23 22:54:05","2016-05-14 01:51:58",0,0
"1314",702669885860679680,175614590,"Thu Feb 25 01:42:10 +0000 2016","2016-02-25 01:42:10",NA,NA,"","Les comparto mi participación ante la Comisión de Gobernación de la H. Cámara de Diputados, para respaldar el... https://t.co/V3V8Xz0hw4",0,0,0,0,0,"2016-02-25 08:45:47","2016-05-16 09:41:22",0,0
"1315",702669491692552192,175614590,"Thu Feb 25 01:40:36 +0000 2016","2016-02-25 01:40:36",NA,NA,"","Buenas noches amigos, les agradezco su amistad y el permitirme estar en contacto por este medio, hemos llegado al... https://t.co/cai0POCPlC",0,1,0,0,0,"2016-02-25 08:45:49","2016-05-16 09:41:22",0,0
"1316",702564275529900032,175614590,"Wed Feb 24 18:42:30 +0000 2016","2016-02-24 18:42:30",NA,NA,"","Generando mecanismos de acción positiva en pro del género femenino, el día de hoy participe desde la Comisión de... https://t.co/mBzKU8qMe3",0,0,0,0,0,"2016-02-25 08:45:51","2016-05-16 09:41:22",0,0
"1317",702911371344793600,175614590,"Thu Feb 25 17:41:45 +0000 2016","2016-02-25 17:41:45",NA,NA,"","Buen día amigos. El día de hoy la dirigencia nacional del ONMPRI tomó protesta a la Dip. Araceli Guerrero, como... https://t.co/Revivx3PPq",2,3,0,0,0,"2016-02-25 14:07:13","2016-05-16 09:41:22",0,0
"1318",702936530755706880,175614590,"Thu Feb 25 19:21:43 +0000 2016","2016-02-25 19:21:43",NA,NA,"","I posted a new video to Facebook https://t.co/7TCjf4UuZg",1,1,0,0,0,"2016-02-26 03:13:21","2016-05-16 09:41:22",0,0
"1319",704077001825583104,175614590,"Sun Feb 28 22:53:33 +0000 2016","2016-02-28 22:53:33",NA,NA,"","https://t.co/AYWgsDfPwL",0,0,0,0,0,"2016-02-29 00:33:56","2016-05-18 05:31:31",0,0
"1320",704064070006218752,175614590,"Sun Feb 28 22:02:09 +0000 2016","2016-02-28 22:02:09",NA,NA,"","Buenas tardes amigos, bonito domingo a todos que tienen planeado para disfrutar este último domingo del mes de... https://t.co/e2vcvHrh2z",1,1,0,0,0,"2016-02-29 00:33:56","2016-05-18 05:31:31",0,0
"1321",703746471481450496,175614590,"Sun Feb 28 01:00:08 +0000 2016","2016-02-28 01:00:08",NA,NA,"","Buenas noches amigos, acompañando a nuestro Gobernador del Estado Lic. Rolando Zapata Bello  al arranque del mega... https://t.co/I7Asc1jN63",1,1,0,0,0,"2016-02-29 00:33:58","2016-05-18 05:31:31",0,0
"1322",703738172962951168,175614590,"Sun Feb 28 00:27:09 +0000 2016","2016-02-28 00:27:09",NA,NA,"","Buenas tardes amigos, hoy en el municipio de Telchac Pueblo se dio inauguración a las actividades del Mes de la... https://t.co/idMMAxKNgc",1,1,0,0,0,"2016-02-29 00:33:59","2016-05-17 09:32:19",0,0
"1323",703656189784137728,175614590,"Sat Feb 27 19:01:23 +0000 2016","2016-02-27 19:01:23",NA,NA,"","Buenas tardes amigos, les comparto que ayer tome protesta a los miembros de la Asociación Civil ""Unidos Para... https://t.co/GBpCLRVokT",1,1,0,0,0,"2016-02-29 00:34:01","2016-05-17 09:32:19",0,0
"1324",703416425298456576,175614590,"Sat Feb 27 03:08:39 +0000 2016","2016-02-27 03:08:39",NA,NA,"","Buenas noches amigos, y para acabar este viernes estuve en el municipio de Conkal en la MacroClase de activación... https://t.co/rycxv2GahN",1,1,0,0,0,"2016-02-29 00:34:01","2016-05-17 09:32:19",0,0
"1325",703298709287600128,175614590,"Fri Feb 26 19:20:53 +0000 2016","2016-02-26 19:20:53",NA,NA,"","Cambia tus focos incandescentes por ahorradores y #AhórrateUnaLuz. Ubica tu tienda @Diconsa_Mx y participa. https://t.co/14koB5VspR",2,3,0,0,0,"2016-02-29 00:34:03","2016-05-17 09:32:19",0,0
"1326",703290894439428096,175614590,"Fri Feb 26 18:49:50 +0000 2016","2016-02-26 18:49:50",NA,NA,"","El #embarazo #adolescente interrumpe la educación y limita oportunidades de desarrollo y empleo. Informémonos en https://t.co/av8jwXjvjm",1,1,0,0,0,"2016-02-29 00:34:04","2016-05-17 09:32:19",0,0
"1327",703286901931962368,175614590,"Fri Feb 26 18:33:58 +0000 2016","2016-02-26 18:33:58",NA,NA,"","Queridos amigos, les solicito de su apoyo para que compartan y difundan entre sus conocidos una plataforma que... https://t.co/S5gaMwcTEQ",1,1,0,0,0,"2016-02-29 00:34:04","2016-05-16 16:29:20",0,0
"1328",704448916373241856,175614590,"Mon Feb 29 23:31:24 +0000 2016","2016-02-29 23:31:24",NA,NA,"","Buena tarde amigos. Me encuentro en entrevista para TelenoticiasMX #Yucatán, para presentar las acciones que el... https://t.co/92YiZheErB",1,2,0,0,0,"2016-02-29 23:51:56","2016-05-18 05:31:31",0,0
"1329",704732891973025792,175614590,"Tue Mar 01 18:19:49 +0000 2016","2016-03-01 18:19:49",NA,NA,"","https://t.co/DmAhBOjOIJ",0,1,0,0,0,"2016-03-01 17:37:35","2016-05-18 05:31:31",0,0
"1330",704702285876690944,175614590,"Tue Mar 01 16:18:12 +0000 2016","2016-03-01 16:18:12",NA,NA,"","Les invito a ver la Sesión Plenaria de hoy martes a partir de las 11:00 am desde el Canal del Congreso .... https://t.co/B5txCgJQed",1,1,0,0,0,"2016-03-01 17:37:38","2016-05-18 05:31:31",0,0
"1331",705529244416237568,175614590,"Thu Mar 03 23:04:14 +0000 2016","2016-03-03 23:04:14",NA,NA,"","H https://t.co/TSjudYDFev",0,0,0,0,0,"2016-03-04 21:42:55","2016-05-20 09:00:25",0,0
"1332",705522547081609216,175614590,"Thu Mar 03 22:37:37 +0000 2016","2016-03-03 22:37:37",NA,NA,"","RT @DiputadosPRI: .@LucelyAlpizarC agradece a todas las mujeres que han aportado esfuerzo en favor de los derechos de las mujeres. https://…",7,0,0,0,0,"2016-03-04 21:42:58","2016-05-20 09:00:25",1,1
"1333",705522528119234560,175614590,"Thu Mar 03 22:37:33 +0000 2016","2016-03-03 22:37:33",NA,NA,"","RT @DiputadosPRI: Esta declaratoria es un reconocimoento a la génesis del feminismo contemporáneo en México: @LucelyAlpizarC https://t.co/R…",5,0,0,0,0,"2016-03-04 21:42:58","2016-05-20 09:00:25",1,1
"1334",705522509051883520,175614590,"Thu Mar 03 22:37:28 +0000 2016","2016-03-03 22:37:28",NA,NA,"","RT @DiputadosPRI: A partir de los congresos feministas de Yucatán se reconoció en las mujeres una fuente de liderazgo: @LucelyAlpizarC http…",7,0,0,0,0,"2016-03-04 21:42:58","2016-05-20 09:00:25",1,1
"1335",705490681154945024,175614590,"Thu Mar 03 20:31:00 +0000 2016","2016-03-03 20:31:00",NA,NA,"","https://t.co/LffQbwHt58",1,1,0,0,0,"2016-03-04 21:42:58","2016-05-18 05:31:31",0,0
"1336",705226569464324096,175614590,"Thu Mar 03 03:01:31 +0000 2016","2016-03-03 03:01:31",NA,NA,"","Buenas noches amigos, hoy estuve en el programa de ""Mi punto de vista"" con mi amigo Jose Alejandro Lopez Munguia... https://t.co/zB5GlIisG3",1,3,0,0,0,"2016-03-04 21:43:01","2016-05-18 05:31:31",0,0
"1337",706264021142474752,175614590,"Sat Mar 05 23:43:59 +0000 2016","2016-03-05 23:43:59",NA,NA,"","Buenas tardes amigos, hoy a compañe a mi amigo y líder del sindicato de la secretaria de salud Doc. Eulogio Piña... https://t.co/WVoX8QRgQk",2,2,0,0,0,"2016-03-06 07:33:32","2016-05-20 09:00:25",0,0
"1338",706179534580785152,175614590,"Sat Mar 05 18:08:15 +0000 2016","2016-03-05 18:08:15",NA,NA,"","Buenas tardes amigos, hoy me reúne con la estructura Estatal de nuestro Organismo y nuestras presidentas y... https://t.co/q1BSjMm6Sv",3,2,0,0,0,"2016-03-06 07:33:35","2016-05-20 09:00:25",0,0
"1339",706853921428533248,175614590,"Mon Mar 07 14:48:02 +0000 2016","2016-03-07 14:48:02",NA,NA,"","Buenos días, quiero agradecer a todo el comité del ONMPRI estatal que me enorgullezco de presidir, a las decenas... https://t.co/KEgwc8HWSQ",1,2,0,0,0,"2016-03-07 19:27:58","2016-05-24 05:07:48",0,0
"1340",706593478587883520,175614590,"Sun Mar 06 21:33:07 +0000 2016","2016-03-06 21:33:07",NA,NA,"","I posted a new video to Facebook https://t.co/nF1AOVUi6z",2,2,0,0,0,"2016-03-07 19:28:01","2016-05-22 16:26:47",0,0
"1341",706590610812243968,175614590,"Sun Mar 06 21:21:44 +0000 2016","2016-03-06 21:21:44",NA,NA,"","I posted a new video to Facebook https://t.co/klAY4jEzqT",0,0,0,0,0,"2016-03-07 19:28:04","2016-05-22 16:26:47",0,0
"1342",706500333414047744,175614590,"Sun Mar 06 15:23:00 +0000 2016","2016-03-06 15:23:00",NA,NA,"","https://t.co/6c5N2RopCC",0,0,0,0,0,"2016-03-07 19:28:07","2016-05-22 16:26:47",0,0
"1343",706489238829842432,175614590,"Sun Mar 06 14:38:55 +0000 2016","2016-03-06 14:38:55",NA,NA,"","Y llego para quedarse, Gracias a los más de 2500 corredores por participar en la primera  Caminata y Carrera por... https://t.co/PzjzthALMi",2,2,0,0,0,"2016-03-07 19:28:09","2016-05-20 09:00:25",0,0
"1344",707044866983862272,175614590,"Tue Mar 08 03:26:47 +0000 2016","2016-03-08 03:26:47",NA,NA,"","Buenas noches amigos. En el marco del Día Internacional de la Mujer el ONMPRI Yucatán en coordinación con el... https://t.co/HdPbZm3R7x",1,1,0,0,0,"2016-03-08 12:52:38","2016-05-24 05:07:48",0,0
"1345",707772567692640256,175614590,"Thu Mar 10 03:38:24 +0000 2016","2016-03-10 03:38:24",NA,NA,"","Buenas noches amigos y acabando la gira de trabajo de este día, el ONMPRI Yucatán organizó en el marco del Día... https://t.co/EV4DjcRMRL",1,1,0,0,0,"2016-03-10 02:06:02","2016-05-25 18:29:18",0,0
"1346",707755441321807872,175614590,"Thu Mar 10 02:30:21 +0000 2016","2016-03-10 02:30:21",NA,NA,"","Buenas noches amigos, esta noche en el marco de la conmemoración del Día Internacional de la Mujer participe en... https://t.co/5J7D5kZjru",1,0,0,0,0,"2016-03-10 02:06:05","2016-05-25 18:29:18",0,0
"1347",707712529607303168,175614590,"Wed Mar 09 23:39:50 +0000 2016","2016-03-09 23:39:50",NA,NA,"","I posted a new video to Facebook https://t.co/RrGv250naP",0,0,0,0,0,"2016-03-10 02:06:08","2016-05-25 18:29:18",0,0
"1348",707612180653481984,175614590,"Wed Mar 09 17:01:05 +0000 2016","2016-03-09 17:01:05",NA,NA,"","Buenos días amigos, esta mañana en el municipio de Panaba tuve la oportunidad de acompañar a nuestro Gobernador... https://t.co/dmb1fgSzij",1,0,0,0,0,"2016-03-10 02:06:10","2016-05-25 18:29:18",0,0
"1349",707592237505454080,175614590,"Wed Mar 09 15:41:50 +0000 2016","2016-03-09 15:41:50",NA,NA,"","Buenos días amigos, en el marco del Día Internacional de la Mujer el ONMPRI Yucatán organizó el foro "" Por un... https://t.co/XUEP1tHiqc",2,1,0,0,0,"2016-03-10 02:06:13","2016-05-24 05:07:48",0,0
"1350",707293352979521536,175614590,"Tue Mar 08 19:54:10 +0000 2016","2016-03-08 19:54:10",NA,NA,"","I posted a new video to Facebook https://t.co/lmsmNEod01",1,1,0,0,0,"2016-03-10 02:06:16","2016-05-24 05:07:48",0,0
"1351",707273159863607296,175614590,"Tue Mar 08 18:33:56 +0000 2016","2016-03-08 18:33:56",NA,NA,"","https://t.co/jFkfVAn32a",1,1,0,0,0,"2016-03-10 02:06:19","2016-05-24 05:07:48",0,0
"1352",709532374606995456,175614590,"Tue Mar 15 00:11:15 +0000 2016","2016-03-15 00:11:15",NA,NA,"","Buenas tardes amigos, nos encontramos en el  municipio de Kanasin donde se llevó acabó la entrega  de contratos... https://t.co/GOAzzhTfIs",1,1,0,0,0,"2016-03-15 05:10:54","2016-05-27 02:24:52",0,0
"1353",708470521885802496,175614590,"Sat Mar 12 01:51:49 +0000 2016","2016-03-12 01:51:49",NA,NA,"","Esta noche en el municipio de Akil, estuvimos participando en el foro ""Por un planeta 50/50 demos paso a la... https://t.co/3airBQu75h",2,3,0,0,0,"2016-03-15 05:10:55","2016-05-27 02:24:52",0,0
"1354",709899233663574016,175614590,"Wed Mar 16 00:29:01 +0000 2016","2016-03-16 00:29:01",NA,NA,"","En Yucatán los compromisos con la niñez y la juventud se cumplen, esta mañana en el municipio de Maxcanu el... https://t.co/O3iu4lFELV",1,2,0,0,0,"2016-03-16 09:59:42","2016-05-27 02:24:52",0,0
"1355",710118002562359296,175614590,"Wed Mar 16 14:58:19 +0000 2016","2016-03-16 14:58:19",NA,NA,"","https://t.co/xcn9ZRX8qz",0,0,0,0,0,"2016-03-17 01:45:37","2016-05-27 02:24:52",0,0
"1356",710113479458496512,175614590,"Wed Mar 16 14:40:21 +0000 2016","2016-03-16 14:40:21",NA,NA,"","https://t.co/Mp6vnDXgXe",0,0,0,0,0,"2016-03-17 01:45:40","2016-05-27 02:24:52",0,0
"1357",710874105030045696,175614590,"Fri Mar 18 17:02:48 +0000 2016","2016-03-18 17:02:48",NA,NA,"","Esta mañana acompañamos a nuestro Gobernador del Estado Lic. Rolando Zapata al banderazo de inicio del operativo... https://t.co/niXawQNsyt",1,1,0,0,0,"2016-03-18 23:01:47","2016-05-27 02:24:52",0,0
"1358",710865215475359744,175614590,"Fri Mar 18 16:27:29 +0000 2016","2016-03-18 16:27:29",NA,NA,"","Buenos días amigos esta mañana acompañe a nuestro Gobernador del Estado Lic. Rolando Zapata Bello a la ceremonia... https://t.co/62nJftXPyH",1,1,0,0,0,"2016-03-18 23:01:50","2016-05-27 02:24:52",0,0
"1359",711326099343474688,175614590,"Sat Mar 19 22:58:52 +0000 2016","2016-03-19 22:58:52",NA,NA,"","https://t.co/T08WvnMQ8K",0,0,0,0,0,"2016-03-20 09:53:05","2016-05-27 02:24:52",0,0
"1360",711234631094423552,175614590,"Sat Mar 19 16:55:24 +0000 2016","2016-03-19 16:55:24",NA,NA,"","Esta mañana en el municipio de Tizimín el ONMPRI Yucatán en el marco de Marzo mes de la mujer organizó el foro... https://t.co/DhD0LCMY4p",1,2,0,0,0,"2016-03-20 09:53:08","2016-05-27 02:24:52",0,0
"1361",711782860345221120,175614590,"Mon Mar 21 05:13:52 +0000 2016","2016-03-21 05:13:52",NA,NA,"","https://t.co/WDEkLh3Jw3",0,1,0,0,0,"2016-03-21 08:19:39","2016-05-27 02:24:52",0,0
"1362",711941952338595840,175614590,"Mon Mar 21 15:46:03 +0000 2016","2016-03-21 15:46:03",NA,NA,"","Buenos días amigos esta mañana acompañamos a nuestro Gobernador Lic.Rolando Zapata Bello a la ceremonia por el... https://t.co/2LHqfaiF1f",2,2,0,0,0,"2016-03-21 15:14:39","2016-05-27 02:24:52",0,0
"1363",714891489151696896,175614590,"Tue Mar 29 19:06:27 +0000 2016","2016-03-29 19:06:27",NA,NA,"","https://t.co/ZjZuIR9THB",0,0,0,0,0,"2016-03-29 23:31:21","2016-05-27 02:24:52",0,0
"1364",714886600858157056,175614590,"Tue Mar 29 18:47:02 +0000 2016","2016-03-29 18:47:02",NA,NA,"","Hace unos momentos, durante el desarrollo de la Comisión de Ciencia y Tecnología, tuvimos un invitado de honor,... https://t.co/Ee0OS68Zpf",1,1,0,0,0,"2016-03-29 23:31:24","2016-05-27 02:24:52",0,0
"1365",714838206584397824,175614590,"Tue Mar 29 15:34:44 +0000 2016","2016-03-29 15:34:44",NA,NA,"","Damos inicio a las actividades del día con la 5ta reunión de la Comisión de Ciencia y Tecnología, en la que nos... https://t.co/esJEP60lbH",2,5,0,0,0,"2016-03-29 23:31:24","2016-05-27 02:24:52",0,0
"1366",714837852648054784,175614590,"Tue Mar 29 15:33:19 +0000 2016","2016-03-29 15:33:19",NA,NA,"","Hoy martes nos espera un gran dia lleno de retos y aprendizajes ! Buenos días !",1,3,0,0,0,"2016-03-29 23:31:27","2016-05-27 02:24:52",0,0
"1367",714491970136252416,175614590,"Mon Mar 28 16:38:54 +0000 2016","2016-03-28 16:38:54",NA,NA,"","Buenos días amigos, les deseo que tengan un excelente inicio de semana a todos los que retoman hoy sus... https://t.co/DbKh46GAFU",1,1,0,0,0,"2016-03-29 23:31:27","2016-05-27 02:24:52",0,0
"1368",715269428850651136,175614590,"Wed Mar 30 20:08:15 +0000 2016","2016-03-30 20:08:15",NA,NA,"","Esta tarde participé como ponente en el foro nacional de la generación del conocimiento científico y tecnológico... https://t.co/Id6dgHiynV",1,2,0,0,0,"2016-03-30 22:28:32","2016-05-30 16:35:42",0,0
"1369",715208895099244544,175614590,"Wed Mar 30 16:07:43 +0000 2016","2016-03-30 16:07:43",NA,NA,"","Hoy Miércoles  nos espera un gran dia lleno de retos y aprendizajes ! Buenos días !",1,1,0,0,0,"2016-03-30 22:28:36","2016-05-27 02:24:52",0,0
"1370",715581286061117440,175614590,"Thu Mar 31 16:47:28 +0000 2016","2016-03-31 16:47:28",NA,NA,"","Estamos en el ultimo día del mes de marzo, puede ser un gran dia si te lo propones, todo depende de ti,... https://t.co/wg7DtwHfKy",2,1,0,0,0,"2016-03-31 19:32:23","2016-05-31 12:17:56",0,0
"1371",717182210856656896,175614590,"Tue Apr 05 02:48:58 +0000 2016","2016-04-05 02:48:58",NA,NA,"","Un día más ha finalizado, y llego el momento de ir a descansar amigos ! Que tengan buenas noches y dulces sueños!... https://t.co/7MOA1lRPM6",1,1,0,0,0,"2016-04-05 02:08:25","2016-06-04 02:57:53",0,0
"1372",717158905403482112,175614590,"Tue Apr 05 01:16:21 +0000 2016","2016-04-05 01:16:21",NA,NA,"","Con el plan Escudo Yucatán las estructuras de videovigilancia pasarán de 2 a 14 unidades para toda la costa yucateca https://t.co/oKEY0srIIg",4,3,0,0,0,"2016-04-05 02:08:29","2016-06-04 02:57:53",0,0
"1373",717157796106645504,175614590,"Tue Apr 05 01:11:57 +0000 2016","2016-04-05 01:11:57",NA,NA,"","El gobernador  de nuestro Estado Lic. Rolando Zapata Bello con el compromiso permanente de garantizar la... https://t.co/Wkld3h8TWt",1,1,0,0,0,"2016-04-05 02:08:29","2016-06-02 00:36:35",0,0
"1374",717152275957846016,175614590,"Tue Apr 05 00:50:01 +0000 2016","2016-04-05 00:50:01",NA,NA,"","A pocos kilómetros de Tixkokob se encentran las ruinas mayas de Aké ¿Las conoces?, 
#TomateUnSegundoyConoceYucatán https://t.co/mkyHnWaH0D",2,3,0,0,0,"2016-04-05 02:08:32","2016-06-02 00:36:35",0,0
"1375",717149934122704896,175614590,"Tue Apr 05 00:40:42 +0000 2016","2016-04-05 00:40:42",NA,NA,"","la Comisión  de igual de genero organizó el foro de análisis ""Reglas de BANGKOK, perspectivas para su aplicación https://t.co/ljdr2QQdwu",1,5,0,0,0,"2016-04-05 02:08:32","2016-06-02 00:36:35",0,0
"1376",717024774111817728,175614590,"Mon Apr 04 16:23:22 +0000 2016","2016-04-04 16:23:22",NA,NA,"","La Comisión para la Igualdad de Género de la Camara de Diputados en coordinación con la Comisión Nacional de los... https://t.co/R1mlA1WPry",1,1,0,0,0,"2016-04-05 02:08:32","2016-06-02 00:36:35",0,0
"1377",716963680638922752,175614590,"Mon Apr 04 12:20:36 +0000 2016","2016-04-04 12:20:36",NA,NA,"","Buenos días amigos, ya lunes y de regreso a la Escuela ¡Espero que estos días haya estado cargado de mucha... https://t.co/CfaV6l8M63",1,1,0,0,0,"2016-04-05 02:08:36","2016-06-02 00:36:35",0,0
"1378",716810610395242496,175614590,"Mon Apr 04 02:12:21 +0000 2016","2016-04-04 02:12:21",NA,NA,"","Buenas noches amigos,  ¡Siempre termina tu Semana con un pensamiento positivo! Que descansen
#DiputadaAmiga #Yucatán #2doDistritoFederal",1,4,0,0,0,"2016-04-05 02:08:39","2016-05-31 12:17:56",0,0
"1379",716616853301424128,175614590,"Sun Apr 03 13:22:26 +0000 2016","2016-04-03 13:22:26",NA,NA,"","Buenos días amigos, y abril nos regala su primer domingo que hoy sea un gran día. ¡Disfrutemos a   a nuestras... https://t.co/ZS0sFwpO2A",1,2,0,0,0,"2016-04-05 02:08:40","2016-05-31 12:17:56",0,0
"1380",716616763862073344,175614590,"Sun Apr 03 13:22:05 +0000 2016","2016-04-03 13:22:05",NA,NA,"","Buenos días amigos, y abril nos regala su primer domingo que hoy sea un gran día. ¡Disfrutemos a   a nuestras... https://t.co/2XWVvbLQaV",1,2,0,0,0,"2016-04-05 02:08:43","2016-05-31 12:17:56",0,0
"1381",716283530456731648,175614590,"Sat Apr 02 15:17:56 +0000 2016","2016-04-02 15:17:56",NA,NA,"","Buenos días amigos ¡Excelente sábado! Disfruten en compañía de amigos y familia, este lindo día ! 
#DiputadaAmiga... https://t.co/IRrzoGCfVF",0,0,0,0,0,"2016-04-05 02:08:46","2016-05-31 12:17:56",0,0
"1382",715930612465590272,175614590,"Fri Apr 01 15:55:34 +0000 2016","2016-04-01 15:55:34",NA,NA,"","Buenos días amigos, y cerramos la semana con todo el ánimo, y le damos la bienvenida al mes de Abril ! feliz... https://t.co/2jQviUd963",0,1,0,0,0,"2016-04-05 02:08:49","2016-05-31 12:17:56",0,0
"1383",717343997505761280,175614590,"Tue Apr 05 13:31:51 +0000 2016","2016-04-05 13:31:51",NA,NA,"","Que este día este lleno de sonrisas, inundado de buenas noticias, alegría y buen humor ¡ feliz martes amigos !... https://t.co/hZ5zCJKy0M",1,2,0,0,0,"2016-04-05 16:18:01","2016-06-04 02:57:53",0,0
"1384",717693073694830592,175614590,"Wed Apr 06 12:38:57 +0000 2016","2016-04-06 12:38:57",NA,NA,"","! hoy es día donde cosas maravillosas pueden suceder a todos !
Buenos días amigos, ya estamos a media semana.... https://t.co/KluEBnVAe3",1,1,0,0,0,"2016-04-06 09:37:22","2016-06-07 18:46:03",0,0
"1385",717536583713304576,175614590,"Wed Apr 06 02:17:07 +0000 2016","2016-04-06 02:17:07",NA,NA,"","Todos nuestros sueños se pueden hacer realidad si tenemos el coraje de perseguirlos, buenas noches amigos !! Que descansen !!
#Martes",0,0,0,0,0,"2016-04-06 09:37:25","2016-06-07 18:46:03",0,0
