"","id_tweet","id_twitter","created_at","created_at_datetime","in_reply_to_user_id","in_reply_to_status_id","in_reply_to_screen_name","text","retweet_count","favorite_count","longitude","latitude","retweeted","creation_date","modification_date","RT_temp","is_retweeted"
"1",597197061180805120,191940022,"Sun May 10 00:30:49 +0000 2015","2015-05-10 00:30:49",NA,NA,"","Nosotros, #LosMejoresCandidatos, queremos darte más y mejores resultados. https://t.co/fMQSuyj7A4 @pri_edomex #EstoyDeTuLado",1,0,0,0,0,"2015-08-02 21:18:20","2015-08-04 14:47:45",0,NA
"2",597271257604718592,191940022,"Sun May 10 05:25:39 +0000 2015","2015-05-10 05:25:39",NA,NA,"","RT @MovPRImx_Ecatep: #LosMejoresCandidatos @NallelyGtzR @pablobedolla @JoseAlfredoTH @luisfelipevg @Bren_Alvarado @ISIDROMORENO_13 @Sue_Ber…",1,0,0,0,0,"2015-08-02 21:18:20","2015-08-04 14:47:45",1,NA
"3",597275284530855936,191940022,"Sun May 10 05:41:39 +0000 2015","2015-05-10 05:41:39",282390541,597129983086080000,"REYVAJOSEG","@REYVAJOSEG ¡Muchas gracias por tu apoyo, amigo! Sigamos así",0,0,0,0,0,"2015-08-02 21:18:20","2015-08-11 22:41:55",0,NA
"4",597403406362419200,191940022,"Sun May 10 14:10:45 +0000 2015","2015-05-10 14:10:45",NA,NA,"","Hoy me disfracé para dejarles un gran abrazo a todas las mamás. ¡Gracias x ser el motor más grande que tiene #México! http://t.co/fwIj5u7roB",0,1,0,0,0,"2015-08-02 21:18:20","2015-08-11 22:41:55",0,NA
"5",597436296018006016,191940022,"Sun May 10 16:21:27 +0000 2015","2015-05-10 16:21:27",NA,NA,"","Me encuentro caminando por las calles de #CódiceMendocino2, tengo la oportunidad de felicitar a las madres #Ecatepec http://t.co/blDAr25c7c",2,2,0,0,0,"2015-08-02 21:18:20","2015-08-11 22:41:55",0,NA
"6",597438787141009408,191940022,"Sun May 10 16:31:21 +0000 2015","2015-05-10 16:31:21",NA,NA,"","Con todo el ánimo voy #DeLaManoConLaGente ¡Mi gran propósito es trabajar por tod@s! #Distrito17 http://t.co/TR8rki0Dpj",2,1,0,0,0,"2015-08-02 21:18:20","2015-08-11 22:41:55",0,NA
"7",597444366257401856,191940022,"Sun May 10 16:53:31 +0000 2015","2015-05-10 16:53:31",NA,NA,"","Un honor caminar a lado de nuestra Candidata a Diputada Plurinominal, Marcela González, gracias por todo tú apoyo. http://t.co/LVzjyy7i4q",1,3,0,0,0,"2015-08-02 21:18:20","2015-08-18 15:02:33",0,NA
"8",597449911957872640,191940022,"Sun May 10 17:15:33 +0000 2015","2015-05-10 17:15:33",NA,NA,"","En nuestro estado 8.5 de cada 10 pesos se invierten en gasto social. #OrgulloPriista http://t.co/d5KJ7vY5gK",0,1,0,0,0,"2015-08-02 21:18:20","2015-08-18 15:02:33",0,NA
"9",597455739557253120,191940022,"Sun May 10 17:38:43 +0000 2015","2015-05-10 17:38:43",NA,NA,"","Gracias por las millones de enseñanzas a lo largo de 41 años, gracias por acompañarme y siempre #EstarDeMiLado. http://t.co/2dO9WF9Ggd",1,1,0,0,0,"2015-08-02 21:18:20","2015-08-19 15:26:40",0,NA
"10",597461172577705984,191940022,"Sun May 10 18:00:18 +0000 2015","2015-05-10 18:00:18",NA,NA,"","Voy recorriendo codo a codo con nuestra gente de #NovelaMexicana2 ¡Un placer ir saludándonos! #EstoyDeTuLado http://t.co/8gsYYF3nRl",1,1,0,0,0,"2015-08-02 21:18:19","2015-08-19 15:26:40",0,NA
"11",597465666719862784,191940022,"Sun May 10 18:18:09 +0000 2015","2015-05-10 18:18:09",NA,NA,"","Con gran cariño voy saludando a nuestra gente, gracias por recibirme en este día tan importante ¡Felicidades! http://t.co/byIrEtYDQ7",1,1,0,0,0,"2015-08-02 21:18:19","2015-08-21 13:19:01",0,NA
"12",597467464759279616,191940022,"Sun May 10 18:25:18 +0000 2015","2015-05-10 18:25:18",NA,NA,"","Mi compromiso es muy fuerte, estaré ¡Trabajando por lo que más quieres! #PRImeroUstedes http://t.co/V5g5e5N5eQ",1,1,0,0,0,"2015-08-02 21:18:19","2015-08-21 13:19:01",0,NA
"13",597511540309368832,191940022,"Sun May 10 21:20:27 +0000 2015","2015-05-10 21:20:27",NA,NA,"","Con todas las propuestas publicadas durante esta semana pretendo mejorar la situación que atraviesa nuestro municipio http://t.co/aRZn2XJjoe",0,1,0,0,0,"2015-08-02 21:18:19","2015-08-21 13:19:01",0,NA
"14",597522184878170112,191940022,"Sun May 10 22:02:44 +0000 2015","2015-05-10 22:02:44",NA,NA,"","RT @PRI_EDOMEX: Muchas gracias por su entrega incansable y por construir cada día una mejor sociedad. ¡Muchas Felicidades Mamás! http://t.c…",21,0,0,0,0,"2015-08-02 21:18:19","2015-08-21 13:19:01",1,NA
"15",597755720638066688,191940022,"Mon May 11 13:30:44 +0000 2015","2015-05-11 13:30:44",NA,NA,"","Excelente lunes, la fecha del cambio en el Distrito 17 está cada vez más cerca. ¡Los invito a participar en la jornada electoral!",0,1,0,0,0,"2015-08-02 21:18:19","2015-08-21 13:19:01",0,NA
"16",597811164802732032,191940022,"Mon May 11 17:11:03 +0000 2015","2015-05-11 17:11:03",NA,NA,"","Comienzo este lunes en colonia #CiudadAzteca 3ra sección junto con las vecinas y vecinos ¡Nos reunimos para platicar juntos mis propuestas!",0,1,0,0,0,"2015-08-02 21:18:19","2015-08-21 13:19:01",0,NA
"17",597813022699098112,191940022,"Mon May 11 17:18:26 +0000 2015","2015-05-11 17:18:26",NA,NA,"","Trabajemos #DeLaMano, trabajemos muy cerca, con mucho gusto saludo a la señora Conchita ¡Muchas gracias por su apoyo! http://t.co/BEpVnBjpSO",2,1,0,0,0,"2015-08-02 21:18:19","2015-08-25 22:52:33",0,NA
"18",597816298614165504,191940022,"Mon May 11 17:31:27 +0000 2015","2015-05-11 17:31:27",NA,NA,"","¿Sabían que el #EstadoDeMéxico es la entidad del país que más apoya a jóvenes en materia del becas y apoyos? http://t.co/bZ6xfz3jzW",0,1,0,0,0,"2015-08-02 21:18:19","2015-08-27 16:44:41",0,NA
"19",597819860085641216,191940022,"Mon May 11 17:45:36 +0000 2015","2015-05-11 17:45:36",NA,NA,"","Tengo la oportunidad de poder ir reuniéndome con más vecinos de #CiudadAzteca 3rasección, agradezco infinitamente su atención #EstoyDeTuLado",0,1,0,0,0,"2015-08-02 21:18:19","2015-08-27 16:44:41",0,NA
"20",597827446533017600,191940022,"Mon May 11 18:15:45 +0000 2015","2015-05-11 18:15:45",NA,NA,"","Trabajando muy de cerca, entre nuestra gente y un servidor, podremos rescatar al #Distrito17 de la inseguridad #PropuestaConVecinos",0,0,0,0,0,"2015-08-02 21:18:19","2015-08-27 16:44:41",0,NA
"21",597829574508969984,191940022,"Mon May 11 18:24:12 +0000 2015","2015-05-11 18:24:12",NA,NA,"","Regularización del agua potable y fomentar una conciencia del cuidado del agua #PropuestaConVecinos ¡Nos escuchamos y acordamos! #Ecatepec",0,0,0,0,0,"2015-08-02 21:18:19","2015-08-27 16:44:41",0,NA
"22",597832881579249664,191940022,"Mon May 11 18:37:20 +0000 2015","2015-05-11 18:37:20",NA,NA,"","Recuperemos la interacción, debemos crear comunidad entre nosotros; vengo a buscar soluciones junto a ustedes #PropuestaConVecinos",0,1,0,0,0,"2015-08-02 21:18:19","2015-08-27 16:44:41",0,NA
"23",597837722485596160,191940022,"Mon May 11 18:56:34 +0000 2015","2015-05-11 18:56:34",NA,NA,"","¡Muchísimas gracias por el caluroso recibimiento que nuestros vecinos de #CiudadAzteca 3ra sección me brindaron! http://t.co/UrJXn57NBy",3,1,0,0,0,"2015-08-02 21:18:19","2015-08-29 18:38:55",0,NA
"24",597875171001765888,191940022,"Mon May 11 21:25:23 +0000 2015","2015-05-11 21:25:23",NA,NA,"","Propondré programas que fortalezcan la capacitación para el trabajo para las y los jóvenes de nuestro distrito. http://t.co/SIcI9dRNvA",0,1,0,0,0,"2015-08-02 21:18:19","2015-08-31 14:39:44",0,NA
"25",597884163648135168,191940022,"Mon May 11 22:01:07 +0000 2015","2015-05-11 22:01:07",NA,NA,"","Estoy reunido con mis vecinos de la Unidad Habitacional A.S.A. aquí en mi casa de campaña; esto me permite estar más cerca de nuestra gente.",0,0,0,0,0,"2015-08-02 21:18:19","2015-09-01 22:58:01",0,NA
"26",597887971497390080,191940022,"Mon May 11 22:16:15 +0000 2015","2015-05-11 22:16:15",NA,NA,"","En el #Distrito17 necesitamos restaurar la participación ciudadana, el apoyo coordinado será nuestra fuerza. #PropuestaConVecinos",0,1,0,0,0,"2015-08-02 21:18:19","2015-09-02 15:01:52",0,NA
"27",597896127829016576,191940022,"Mon May 11 22:48:39 +0000 2015","2015-05-11 22:48:39",NA,NA,"","Nuestra gente y un servidor trabajaremos fuerte y tener #UnMejorEcatepec para nuestros hijos ¡Es mi compromiso! http://t.co/bvdP5B9cZQ",3,1,0,0,0,"2015-08-02 21:18:19","2015-09-04 22:50:58",0,NA
"28",597896904639254528,191940022,"Mon May 11 22:51:45 +0000 2015","2015-05-11 22:51:45",NA,NA,"","¡Somos un gran equipo y juntos recuperáremos el #Distrito17! Trabajando por lo que más quieres. #PRImeroUstedes http://t.co/vzXxNXaU94",3,1,0,0,0,"2015-08-02 21:18:19","2015-09-04 22:50:58",0,NA
"29",597898713520939008,191940022,"Mon May 11 22:58:56 +0000 2015","2015-05-11 22:58:56",NA,NA,"","Platiqué con nuestra gente de Unidad Habitacional A.S.A. y juntos trabajaremos coordinadamente #EstoyDeTuLado http://t.co/6FXZs7Cz3t",3,1,0,0,0,"2015-08-02 21:18:19","2015-09-07 22:25:01",0,NA
"30",597914272845271040,191940022,"Tue May 12 00:00:46 +0000 2015","2015-05-12 00:00:46",NA,NA,"","Vengo con mucho ánimo de saludar a nuestra gente de #VillasDeAragón ¡La colaboración mutua será nuestro triunfo! http://t.co/ZxAmONoBYF",3,1,0,0,0,"2015-08-02 21:18:19","2015-09-10 14:54:56",0,NA
"31",597918794602840064,191940022,"Tue May 12 00:18:44 +0000 2015","2015-05-12 00:18:44",NA,NA,"","Luminarias y sistema de recolección de basura son mis #PRIoridades para el #Distrito17 ¡Beneficios pata tod@s! #VillasDeAragón",1,0,0,0,0,"2015-08-02 21:18:19","2015-09-11 16:25:16",0,NA
"32",597937762466078720,191940022,"Tue May 12 01:34:06 +0000 2015","2015-05-12 01:34:06",NA,NA,"","Fundamental recuperar valores y principios en nuestras familias, junto con mis propuestas tendremos #UnMejorEcatepec http://t.co/2dhFN2Hu3T",4,2,0,0,0,"2015-08-02 21:18:19","2015-09-23 14:53:10",0,NA
"33",597939374630817792,191940022,"Tue May 12 01:40:30 +0000 2015","2015-05-12 01:40:30",NA,NA,"","Propongo ampliar los programas de apoyo a jóvenes con el fin de evitar que tengan que dejar las aulas para trabajar. http://t.co/G5BiBIXuBa",0,1,0,0,0,"2015-08-02 21:18:19","2015-09-24 14:05:16",0,NA
"34",598125990892699648,191940022,"Tue May 12 14:02:03 +0000 2015","2015-05-12 14:02:03",NA,NA,"","Deseo que tengan un martes maravilloso. Cuéntenme cuáles son las metas que se trazaron para esta semana. #EstoyDeTuLado",0,0,0,0,0,"2015-08-02 21:18:19","2015-09-24 14:05:16",0,NA
"35",598179741208858624,191940022,"Tue May 12 17:35:38 +0000 2015","2015-05-12 17:35:38",NA,NA,"","Vivir en el estado con la mayor red carretera y ferroviaria del país es una oportunidad para generar más empleos. http://t.co/7KaA0aoU8F",1,0,0,0,0,"2015-08-02 21:18:19","2015-09-26 02:05:42",0,NA
"36",598238984087691264,191940022,"Tue May 12 21:31:03 +0000 2015","2015-05-12 21:31:03",NA,NA,"","Propongo la modificación de leyes para que inmuebles confiscados x actividades ilícitas sirvan para atender a jóvenes http://t.co/ZUPsDP3GGu",0,0,0,0,0,"2015-08-02 21:18:19","2015-09-26 02:05:42",0,NA
"37",598256416323817472,191940022,"Tue May 12 22:40:19 +0000 2015","2015-05-12 22:40:19",NA,NA,"","RT @CmEcatepec: Vamos #PRImerosEnLasEncuestas este 7 de junio #VotaPRI @NallelyGtzR @pablobedolla @JoseAlfredoTH @luisfelipevg http://t.co/…",2,0,0,0,0,"2015-08-02 21:18:18","2015-09-26 02:05:42",1,NA
"38",598292935348776960,191940022,"Wed May 13 01:05:26 +0000 2015","2015-05-13 01:05:26",NA,NA,"","Debemos atender a jóvenes que a causa de violencia o accidentes tengan alguna discapacidad.  #EstoyDeTuLado http://t.co/WYBnRMePjm",1,0,0,0,0,"2015-08-02 21:18:18","2015-09-26 02:05:42",0,NA
"39",598298485109067776,191940022,"Wed May 13 01:27:29 +0000 2015","2015-05-13 01:27:29",NA,NA,"","Les deseo una excelente noche a todas y a todos, ¡cuídense de la lluvia! http://t.co/Jvsg8nNdEu",0,0,0,0,0,"2015-08-02 21:18:18","2015-09-26 02:05:42",0,NA
"40",598484275688775680,191940022,"Wed May 13 13:45:45 +0000 2015","2015-05-13 13:45:45",NA,NA,"","¡Estamos llegando al ombligo de la semana! Tomemos con alegría todos nuestros triunfos y fracasos. ¡Les envío un gran abrazo!",1,0,0,0,0,"2015-08-02 21:18:18","2015-09-26 02:05:42",0,NA
"41",598525945616535552,191940022,"Wed May 13 16:31:20 +0000 2015","2015-05-13 16:31:20",NA,NA,"","Con mucho gusto voy recorriendo la colonia #AldeasdeAragón y #LaFlorida ¡Les mando un afectivo saludo! #EstoyDeTuLado http://t.co/Ytg5GHj8n7",4,0,0,0,0,"2015-08-02 21:18:18","2015-09-26 02:05:42",0,NA
"42",598530870727737344,191940022,"Wed May 13 16:50:54 +0000 2015","2015-05-13 16:50:54",NA,NA,"","Caminando por Unidad Villa 1° de agosto voy #ConLaGente ¡Mi compromiso es con ustedes! #EstoyDeTuLado http://t.co/7IEEjwt0mQ",3,0,0,0,0,"2015-08-02 21:18:18","2015-09-26 02:05:42",0,NA
"43",598543040966328320,191940022,"Wed May 13 17:39:16 +0000 2015","2015-05-13 17:39:16",NA,NA,"","Voy compartiendo con mis vecinos de #LaFlorida mis propuestas para ustedes ¡Los beneficios serán para todos! http://t.co/b8vjqhwp1c",3,0,0,0,0,"2015-08-02 21:18:18","2015-09-26 02:05:42",0,NA
"44",598553596104286208,191940022,"Wed May 13 18:21:12 +0000 2015","2015-05-13 18:21:12",NA,NA,"","Gracias a mis amigos de #LaFlorida, junto con su apoyo recuperaremos el #Distrito17 #EstoyDeTuLado http://t.co/iw1Zpdmzvd",4,0,0,0,0,"2015-08-02 21:18:18","2015-09-26 02:05:42",0,NA
"45",598563140935110656,191940022,"Wed May 13 18:59:08 +0000 2015","2015-05-13 18:59:08",NA,NA,"","Un servidor estará ¡Trabajando por lo que más quieres! Estoy seguro que con ustedes #VamosAGanar http://t.co/c0Flg2wwRS",2,3,0,0,0,"2015-08-02 21:18:18","2015-09-26 02:05:42",0,NA
"46",598573893041856512,191940022,"Wed May 13 19:41:51 +0000 2015","2015-05-13 19:41:51",NA,NA,"","Caminando por Av. Central saludando a mis amigos y amigas ¡Nuestras sonrisas son nuestra mayor fuerza! #EstoyDeTuLado http://t.co/Pjk9sQkVf8",2,0,0,0,0,"2015-08-02 21:18:18","2015-09-26 02:05:42",0,NA
"47",598579626349178880,191940022,"Wed May 13 20:04:38 +0000 2015","2015-05-13 20:04:38",NA,NA,"","Tomándonos un relax al terminar el recorrido ¡Un placer ir de casa en casa saludando a todos nuestros amigos! http://t.co/kriFjDqgLI",2,0,0,0,0,"2015-08-02 21:18:18","2015-09-26 02:05:42",0,NA
"48",598585815040589824,191940022,"Wed May 13 20:29:14 +0000 2015","2015-05-13 20:29:14",NA,NA,"","Gracias a la señora Estela por invitarme a pasar a su casa y platicar sobre nuestros proyectos para el #Distrito17 http://t.co/xSsWU81dh4",2,1,0,0,0,"2015-08-02 21:18:18","2015-09-26 02:05:42",0,NA
"49",598598746188939264,191940022,"Wed May 13 21:20:37 +0000 2015","2015-05-13 21:20:37",NA,NA,"","Debemos garantizar el acceso a servicios de salud a miles de jóvenes con trastornos psicológicos o de nutrición. http://t.co/1ctzutIukz",1,0,0,0,0,"2015-08-02 21:18:18","2015-09-26 02:05:42",0,NA
"50",598615270031130624,191940022,"Wed May 13 22:26:16 +0000 2015","2015-05-13 22:26:16",NA,NA,"","¡Muchísimas gracias a nuestra gente de #LaFlorida CiudadAzteca, su cariño es lo más importante! #VamosAGanar http://t.co/V2xBLUqeEa",1,0,0,0,0,"2015-08-02 21:18:18","2015-09-26 02:05:42",0,NA
"51",598615781665054720,191940022,"Wed May 13 22:28:18 +0000 2015","2015-05-13 22:28:18",80488796,598521573809598464,"MakitaCelaya","@MakitaCelaya es uno de los ejes centrales de esta campaña, te invito a consultar las propuestas de este proyecto. http://t.co/VWDO2GGAaC",0,0,0,0,0,"2015-08-02 21:18:18","2015-09-26 02:05:42",0,NA
"52",598616580189200384,191940022,"Wed May 13 22:31:29 +0000 2015","2015-05-13 22:31:29",3154151168,598538465232359424,"Deborah_Prz","@Deborah_Prz el respeto y aunque no sea un valor, el sentimiento de comunidad, pues al colaborar en conjunto la sociedad se fortalece.",0,0,0,0,0,"2015-08-02 21:18:18","2015-09-26 02:05:42",0,NA
"53",598618476102594560,191940022,"Wed May 13 22:39:01 +0000 2015","2015-05-13 22:39:01",NA,NA,"","#ConLaGente de #LaFlorida Ciudad Azteca platiqué y l@s escuché, juntos trabajaremos coordinadamente #EstoyDeTuLado http://t.co/AaZeszsAOA",4,1,0,0,0,"2015-08-02 21:18:18","2015-09-26 02:05:42",0,NA
"54",598624251747442688,191940022,"Wed May 13 23:01:58 +0000 2015","2015-05-13 23:01:58",NA,NA,"","RT @pabsperalta: Fundamental el apoyo al deporte en las escuelas mexiquenses . En el #EdoMéx #EstamosDeTuLado http://t.co/YKV3YzRWwK",1,0,0,0,0,"2015-08-02 21:18:17","2015-09-26 02:05:42",1,NA
"55",598654375599431680,191940022,"Thu May 14 01:01:40 +0000 2015","2015-05-14 01:01:40",NA,NA,"","Impulsaré la creación de instancias de apoyo que permitan borrar, paulatinamente, este tipo de violencia.  #Propuesta http://t.co/sTqZdenpRk",0,0,0,0,0,"2015-08-02 21:18:17","2015-09-26 02:05:42",0,NA
"56",598692433182871552,191940022,"Thu May 14 03:32:53 +0000 2015","2015-05-14 03:32:53",NA,NA,"","RT @Eje19periodico: En movilidad a Texas 75 alumnos y docentes de la UAEM http://t.co/XQyd74EUWl http://t.co/5yu5jDNuAO",1,0,0,0,0,"2015-08-02 21:18:17","2015-09-26 02:05:42",1,NA
"57",598850899138711552,191940022,"Thu May 14 14:02:35 +0000 2015","2015-05-14 14:02:35",NA,NA,"","Se acerca el fin de semana, ¿cómo van con sus metas? ¿Ya cumplieron todas? Les deseo un maravilloso día. #EstoyDeTuLado",0,0,0,0,0,"2015-08-02 21:18:17","2015-09-26 02:05:42",0,NA
"58",598903371161083904,191940022,"Thu May 14 17:31:05 +0000 2015","2015-05-14 17:31:05",NA,NA,"","Debemos continuar con la política de tener e invertir en tener las mejores instalaciones hospitalarias en #México. http://t.co/GGECXsNPgs",0,0,0,0,0,"2015-08-02 21:18:17","2015-09-26 02:05:42",0,NA
"59",598952991492800512,191940022,"Thu May 14 20:48:15 +0000 2015","2015-05-14 20:48:15",NA,NA,"","El apoyo y el cariño de nuestras y nuestros vecinos son gasolina pura para un servidor. #EstoyDeTuLado http://t.co/cax79SdgsE",0,0,0,0,0,"2015-08-02 21:18:17","2015-09-26 02:05:42",0,NA
"60",598961134356467712,191940022,"Thu May 14 21:20:37 +0000 2015","2015-05-14 21:20:37",NA,NA,"","Queremos que las y los jóvenes tengan acceso a becas de estudio para que sus sueños no se queden sólo en eso. http://t.co/E18Flyh2Ss",0,0,0,0,0,"2015-08-02 21:18:17","2015-09-26 02:05:42",0,NA
"61",598979583648669696,191940022,"Thu May 14 22:33:55 +0000 2015","2015-05-14 22:33:55",3107738430,598891258904322048,"VochoLapaz","@VochoLapaz Saludos, amigo",0,0,0,0,0,"2015-08-02 21:18:17","2015-09-26 02:05:42",0,NA
"62",599017687323389952,191940022,"Fri May 15 01:05:20 +0000 2015","2015-05-15 01:05:20",NA,NA,"","Trabajaré codo a codo con los jóvenes de #Ecatepec para atender y dar solución a todas sus necesidades y solicitudes. http://t.co/NI36kTekT2",0,1,0,0,0,"2015-08-02 21:18:17","2015-09-26 02:05:42",0,NA
"63",599211487299825664,191940022,"Fri May 15 13:55:26 +0000 2015","2015-05-15 13:55:26",NA,NA,"","Les deseo un feliz día a todas y todos los maestros de #Ecatepec; reconozco la incansable tarea de los formadores de los líderes del mañana.",0,0,0,0,0,"2015-08-02 21:18:17","2015-09-26 02:05:42",0,NA
"64",599251639317311488,191940022,"Fri May 15 16:34:59 +0000 2015","2015-05-15 16:34:59",NA,NA,"","Comienzo esta mañana de viernes saludando a nuestra gente de #FuentesdeAragón ¡Con mucho ánimo voy con ustedes! http://t.co/9B88tITp5b",2,0,0,0,0,"2015-08-02 21:18:17","2015-09-26 02:05:42",0,NA
"65",599254641658888192,191940022,"Fri May 15 16:46:54 +0000 2015","2015-05-15 16:46:54",NA,NA,"","Mis propuestas de campaña van en beneficio de toda nuestra gente, para un servidor, ustedes son #PRImero #Ecatepec http://t.co/CNYgeUJ3cD",2,0,0,0,0,"2015-08-02 21:18:16","2015-09-26 02:05:42",0,NA
"66",599257331570909184,191940022,"Fri May 15 16:57:36 +0000 2015","2015-05-15 16:57:36",NA,NA,"","Agradezco infinitamente a toda la gente d #FuentesdeAragón, en especial a Doña Soco por su gran apoyo #EstoyDeTuLado http://t.co/nEnr4MqZAo",1,1,0,0,0,"2015-08-02 21:18:16","2015-09-26 02:05:42",0,NA
"67",599269095284965376,191940022,"Fri May 15 17:44:20 +0000 2015","2015-05-15 17:44:20",NA,NA,"","Somos #FamiliaPRI por ello mi #FF es para @CmEcatepec @PRI_EDOMEX @NallelyGtzR @indalecio_r_v @ChavezInocencio @MovPRIMXOficial @IDedomex",1,1,0,0,0,"2015-08-02 21:18:16","2015-09-26 02:05:42",0,NA
"68",599272364409368576,191940022,"Fri May 15 17:57:20 +0000 2015","2015-05-15 17:57:20",NA,NA,"","Somos #FamiliaPRI @ICADEP @ENC_ICADEP @gdeloya @MovPRImx_Ecatep @MT_EdoMexico @AnaLuisaP20 @RJXMex @RJXMex_EM @EmprendeRJxM #FF",2,1,0,0,0,"2015-08-02 21:18:16","2015-09-26 02:05:42",0,NA
"69",599281098326085632,191940022,"Fri May 15 18:32:02 +0000 2015","2015-05-15 18:32:02",NA,NA,"","Voy con mucho ánimo recorriendo las calles de la colonia #MéxicoInsurgentes ¡Mi apoyo es incondicional para ustedes! http://t.co/b6StgCZnTK",1,1,0,0,0,"2015-08-02 21:18:16","2015-09-26 02:05:42",0,NA
"70",599282496581214208,191940022,"Fri May 15 18:37:35 +0000 2015","2015-05-15 18:37:35",NA,NA,"","¡Trabajando por lo más quieres! Estaré atento a las necesidades de las personitas que serán el futuro de #Ecatepec http://t.co/NfdIHdX5ly",1,0,0,0,0,"2015-08-02 21:18:16","2015-09-26 02:05:42",0,NA
"71",599285935608438784,191940022,"Fri May 15 18:51:15 +0000 2015","2015-05-15 18:51:15",NA,NA,"","El mejor equipo es de la gente que todos los días quiere ver #UnMejorEcatepec ¡Juntos lo lograremos! http://t.co/Rj8Agc0eHv",2,0,0,0,0,"2015-08-02 21:18:15","2015-09-26 02:05:42",0,NA
"72",599289380730064896,191940022,"Fri May 15 19:04:57 +0000 2015","2015-05-15 19:04:57",NA,NA,"","#ConLaGente de #MéxicoInsurgentes vamos platicando de las mejores soluciones que juntos implementaremos. http://t.co/bKwB5H7UQ5",1,0,0,0,0,"2015-08-02 21:18:15","2015-09-26 02:05:42",0,NA
"73",599294391291809792,191940022,"Fri May 15 19:24:51 +0000 2015","2015-05-15 19:24:51",NA,NA,"","Nuestra fuerza se encuentra en cada sonrisa y abrazo ¡Agradezco profundamente a la gente de #MéxicoInsurgentes! http://t.co/zNmVB4xgcC",1,0,0,0,0,"2015-08-02 21:18:15","2015-09-26 02:05:42",0,NA
"74",599324696082051072,191940022,"Fri May 15 21:25:17 +0000 2015","2015-05-15 21:25:17",NA,NA,"","¿Se imaginan que en vez de que no puedan continuar estudiando, tengan acceso a créditos que impulsen sus ideas? http://t.co/q8cwk4o8Qf",0,0,0,0,0,"2015-08-02 21:18:15","2015-09-26 02:05:42",0,NA
"75",599387600709890048,191940022,"Sat May 16 01:35:14 +0000 2015","2015-05-16 01:35:14",NA,NA,"","Propongo la creación de un Servicio Social que contribuya al desarrollo de localidades indígenas con alta marginación http://t.co/iyGUjxlUat",0,0,0,0,0,"2015-08-02 21:18:15","2015-09-26 02:05:42",0,NA
"76",599575513313730560,191940022,"Sat May 16 14:01:56 +0000 2015","2015-05-16 14:01:56",NA,NA,"","¡Muy buenos días, deseo que tengan un excelente fin de semana! #EstoyDeTuLado",0,0,0,0,0,"2015-08-02 21:18:15","2015-09-26 02:05:42",0,NA
"77",599629222223679488,191940022,"Sat May 16 17:35:21 +0000 2015","2015-05-16 17:35:21",NA,NA,"","¿Ya conocen todas las propuestas de este equipo que integramos todas y todos los habitantes del Distrito 17? http://t.co/VWDO2GGAaC",2,1,0,0,0,"2015-08-02 21:18:15","2015-09-26 02:05:42",0,NA
"78",599683353181298688,191940022,"Sat May 16 21:10:27 +0000 2015","2015-05-16 21:10:27",NA,NA,"","Debemos garantizar a personas discapacitadas el acceso pleno a plazas, sitios educativos, deportivos y de recreación. http://t.co/NL7YZQ4jM8",0,0,0,0,0,"2015-08-02 21:18:15","2015-09-26 02:05:42",0,NA
"79",599706884862382080,191940022,"Sat May 16 22:43:58 +0000 2015","2015-05-16 22:43:58",NA,NA,"","Con todo el entusiasmo día a día nos ganamos las calles en #LasAméricas Voy con todo por el #Distrito17! #VamosAGanar http://t.co/kYsYERxiov",8,3,0,0,0,"2015-08-02 21:18:15","2015-09-26 02:05:42",0,NA
"80",599784255758082048,191940022,"Sun May 17 03:51:24 +0000 2015","2015-05-17 03:51:24",168791655,599776828761317376,"JCTANQUE","@JCTANQUE buenas noches, te invito a conocer mis propuestas en mi página web: http://t.co/VWDO2GYb2a 
Gracias por tu interés y participación",0,0,0,0,0,"2015-08-02 21:18:15","2015-09-26 02:05:42",0,NA
"81",599784726082101248,191940022,"Sun May 17 03:53:16 +0000 2015","2015-05-17 03:53:16",3079987323,599738372035219456,"Metro07Moy","@Metro07Moy muchas gracias por tu apoyo, vamos juntos para recuperar nuestro Distrito 17. Saludos.",0,1,0,0,0,"2015-08-02 21:18:15","2015-09-26 02:05:42",0,NA
"82",599796971826647040,191940022,"Sun May 17 04:41:56 +0000 2015","2015-05-17 04:41:56",168791655,599776582434160640,"JCTANQUE","@JCTANQUE adicionalmente te comento que mis propuestas se basan en Ejes Temáticos: Seguridad, Empleo, Educación, Desarrollo Soc y Servicios",0,0,0,0,0,"2015-08-02 21:18:15","2015-09-26 02:05:42",0,NA
"83",599952903651090432,191940022,"Sun May 17 15:01:33 +0000 2015","2015-05-17 15:01:33",NA,NA,"","¡Excelente día! Les deseo un domingo maravilloso. #EstoyDeTuLado",0,0,0,0,0,"2015-08-02 21:18:15","2015-09-26 02:05:42",0,NA
"84",599987866257723392,191940022,"Sun May 17 17:20:29 +0000 2015","2015-05-17 17:20:29",NA,NA,"","Los invito a estar en contacto con un servidor a través de mi página de internet. ¡Estoy al pendiente las 24 horas! http://t.co/VWDO2GGAaC",1,0,0,0,0,"2015-08-02 21:18:15","2015-09-26 02:05:42",0,NA
"85",599995835955351552,191940022,"Sun May 17 17:52:09 +0000 2015","2015-05-17 17:52:09",NA,NA,"","Comienzo caminando en este hermoso domingo con mis vecinos de la #LaFlorida ¡Nos escuchamos y proponemos! #Distrito17 http://t.co/hkiQDQCpKP",3,1,0,0,0,"2015-08-02 21:18:15","2015-09-26 02:05:42",0,NA
"86",600000476965273600,191940022,"Sun May 17 18:10:35 +0000 2015","2015-05-17 18:10:35",NA,NA,"","El entusiasmo de nuestra gente me hace caminar con mas alegría y fuerza por las calles de #LaFlorida #PRImeroUstedes. http://t.co/WjWiuEksYt",3,0,0,0,0,"2015-08-02 21:18:15","2015-09-26 02:05:42",0,NA
"87",600004764126941184,191940022,"Sun May 17 18:27:37 +0000 2015","2015-05-17 18:27:37",NA,NA,"","En #CiudadAzteca 2da sección vamos compartiendo nuestras ideas, ¡Juntos construiremos #UnMejorEcatepec http://t.co/6nbJisXgL3",1,0,0,0,0,"2015-08-02 21:18:14","2015-09-26 02:05:42",0,NA
