"","id_tweet","id_twitter","created_at","created_at_datetime","in_reply_to_user_id","in_reply_to_status_id","in_reply_to_screen_name","text","retweet_count","favorite_count","longitude","latitude","retweeted","creation_date","modification_date","RT_temp","is_retweeted"
"883",723305682519228416,191940022,"Fri Apr 22 00:21:27 +0000 2016","2016-04-22 00:21:27",NA,NA,"","RT @DiputadosPRI: Votamos el Código Militar de Procedimientos Penales. ¡Nuestra postura es en favor de los Derechos Humanos! https://t.co/r…",36,0,0,0,0,"2016-04-25 20:53:02","2016-07-15 00:03:57",1,1
"884",723305634158911488,191940022,"Fri Apr 22 00:21:16 +0000 2016","2016-04-22 00:21:16",NA,NA,"","RT @DiputadosPRI: ¡Aprobado el Código Militar de Procedimientos Penales! Pasa al @senadomexicano. #LegislandoContigo https://t.co/Zzq09bRHo0",29,0,0,0,0,"2016-04-25 20:53:02","2016-07-15 00:03:57",1,1
"885",723305616265990144,191940022,"Fri Apr 22 00:21:11 +0000 2016","2016-04-22 00:21:11",NA,NA,"","RT @DiputadosPRI: Aprobamos Punto de Acuerdo con el que nos solidarizamos con víctimas de la explosión en #Coatzacoalcos. https://t.co/uKMN…",12,0,0,0,0,"2016-04-25 20:53:02","2016-07-15 00:03:57",1,1
"886",725076306870685696,191940022,"Tue Apr 26 21:37:17 +0000 2016","2016-04-26 21:37:17",NA,NA,"","Por unanimidad aprobamos reforma para facilitar vivienda digna a integrantes de las Fuerzas Armadas. https://t.co/rU0wTWZqbp",5,8,0,0,0,"2016-04-26 21:04:35","2016-07-19 19:13:29",0,0
"887",724986335862235136,191940022,"Tue Apr 26 15:39:46 +0000 2016","2016-04-26 15:39:46",NA,NA,"","Continuamos trabajando, ahora en la Séptima Reunión Ordinaria de la Comisión de Defensa Nacional. https://t.co/HZ4kLgUMDf",9,12,0,0,0,"2016-04-26 21:04:35","2016-07-19 19:13:29",0,0
"888",724973854821519360,191940022,"Tue Apr 26 14:50:11 +0000 2016","2016-04-26 14:50:11",NA,NA,"","El día de hoy iniciamos con la asistencia a la Novena Reunión de Junta Directiva de la Comisión de Defensa Nacional. https://t.co/bAQq1UN6bY",9,16,0,0,0,"2016-04-26 21:04:35","2016-07-19 19:13:29",0,0
"889",724822042911072256,191940022,"Tue Apr 26 04:46:56 +0000 2016","2016-04-26 04:46:56",NA,NA,"","RT @eruviel_avila: Representando a América Latina y el Caribe; presentamos los proyectos para construir #CiudadesDelMañana. #Hábitat3 https…",514,0,0,0,0,"2016-04-26 21:04:35","2016-07-19 19:13:29",1,1
"890",725426290157715456,191940022,"Wed Apr 27 20:47:59 +0000 2016","2016-04-27 20:47:59",3241443717,725414089321668608,"MyInfo94036277","Muchas gracias @MyInfo94036277 y de igual forma deseo que Dios te bendiga a ti y a toda tú familia, que tengas una bonita tarde. Saludos",0,0,0,0,0,"2016-04-27 17:43:22","2016-07-19 19:13:29",0,0
"891",725405891806138368,191940022,"Wed Apr 27 19:26:56 +0000 2016","2016-04-27 19:26:56",NA,NA,"","Me encuentro en la instalación del Consejo Técnico de la Secretaría de Cultura, buen provecho. https://t.co/upHMULOOpW",4,4,0,0,0,"2016-04-27 17:43:22","2016-07-19 19:13:29",0,0
"892",725339909452484608,191940022,"Wed Apr 27 15:04:45 +0000 2016","2016-04-27 15:04:45",NA,NA,"","#SabíasQué https://t.co/tk0lq7dLLF",5,5,0,0,0,"2016-04-27 17:43:22","2016-07-19 19:13:29",0,0
"893",725715872820531200,191940022,"Thu Apr 28 15:58:41 +0000 2016","2016-04-28 15:58:41",NA,NA,"","Todos tenemos derecho a la seguridad y a la salud en el Trabajo.
#FelizJueves https://t.co/ffQ9g7cKKc",6,8,0,0,0,"2016-04-28 20:22:37","2016-07-19 19:13:29",0,0
"894",725528583045681152,191940022,"Thu Apr 28 03:34:28 +0000 2016","2016-04-28 03:34:28",NA,NA,"","RT @alfredodelmazo: Reformamos la Ley de Cambio Climático para implementar políticas que atenúan el impacto de los desastres naturales. htt…",41,0,0,0,0,"2016-04-28 20:22:37","2016-07-19 19:13:29",1,1
"895",726193833663295488,191940022,"Fri Apr 29 23:37:56 +0000 2016","2016-04-29 23:37:56",NA,NA,"","Sin duda los niños son la esperanza del mundo. Esta tarde la pase muy bien con mis amiguitos de la col. Sagitario 7 https://t.co/GaI3n9tMwV",10,12,0,0,0,"2016-04-29 20:26:02","2016-07-19 19:13:29",0,0
"896",726089929625759744,191940022,"Fri Apr 29 16:45:03 +0000 2016","2016-04-29 16:45:03",NA,NA,"","""El Arte de la Danza consiste en dejar que el cuerpo y la mente se casen con la música"". #DiaInternacionalDeLaDanza https://t.co/peNvoiMlAa",8,12,0,0,0,"2016-04-29 20:26:02","2016-07-19 19:13:29",0,0
"897",727145123033665536,191940022,"Mon May 02 14:38:01 +0000 2016","2016-05-02 14:38:01",NA,NA,"","¡Excelente inicio de semana tuiteros! https://t.co/NmaNbB4Vp0",5,6,0,0,0,"2016-05-03 04:48:56","2016-07-19 19:13:29",0,0
"898",726866183543123968,191940022,"Sun May 01 20:09:37 +0000 2016","2016-05-01 20:09:37",NA,NA,"","Feliz Cumpleaños Sr. Gobernador @eruviel_avila su entrega, compromiso y dedicación al @edomex se lo reconocemos. https://t.co/VceRBRLSa0",18,14,0,0,0,"2016-05-03 04:48:56","2016-07-19 19:13:29",0,0
"899",726823852609667072,191940022,"Sun May 01 17:21:24 +0000 2016","2016-05-01 17:21:24",NA,NA,"","La recompensa del trabajo bien hecho es la oportunidad de hacer más trabajo bien hecho. 

#DíaDelTrabajo https://t.co/8WgYYy0A4n",5,7,0,0,0,"2016-05-03 04:48:56","2016-07-19 19:13:29",0,0
"900",726571014398705664,191940022,"Sun May 01 00:36:43 +0000 2016","2016-05-01 00:36:43",NA,NA,"","¡Felicidades a todos los Niñ@s de #Ecatepec! Gracias por el recibimiento a los vecinos de Granjas Independencia https://t.co/7DAqGbE2nh",11,14,0,0,0,"2016-05-03 04:48:56","2016-07-19 19:13:29",0,0
"901",726238082790346752,191940022,"Sat Apr 30 02:33:46 +0000 2016","2016-04-30 02:33:46",NA,NA,"","Esta noche sigo con entusiasmo en la supervisión de luminarias en la colonia Sagitario 8. https://t.co/YnQSc5O4XM",7,10,0,0,0,"2016-05-03 04:48:56","2016-07-19 19:13:29",0,0
"902",727715223956819968,191940022,"Wed May 04 04:23:24 +0000 2016","2016-05-04 04:23:24",2490321066,726265724985954304,"castorivan73","Hola @castorivan73 claro que también están en mi mente. Buenas noches.",0,1,0,0,0,"2016-05-04 01:19:29","2016-07-25 11:18:30",0,0
"903",727678110376677376,191940022,"Wed May 04 01:55:55 +0000 2016","2016-05-04 01:55:55",NA,NA,"","Les saludo con el gusto de siempre desde la col.Sagitario 8 con el programa""Ecatepec+Prendido""#CumpliendoCompromisos https://t.co/ezcm62d1TQ",16,15,0,0,0,"2016-05-04 01:19:29","2016-07-25 11:18:30",0,0
"904",727538719129894912,191940022,"Tue May 03 16:42:02 +0000 2016","2016-05-03 16:42:02",NA,NA,"","RT @radiomex: El Diputado Federal @luisfelipevg celebra el Día del Niño en Granjas Independencia ""El Corralòn"" @DiputadosPRI  https://t.co/…",4,0,0,0,0,"2016-05-04 01:19:29","2016-07-19 19:13:29",1,1
"905",727538626247036928,191940022,"Tue May 03 16:41:40 +0000 2016","2016-05-03 16:41:40",NA,NA,"","Hoy, Día de la Santa Cruz, mi felicitación a los trabajadores de la construcción. https://t.co/pxdAPrjCwJ",4,3,0,0,0,"2016-05-04 01:19:29","2016-07-19 19:13:29",0,0
"906",727538297333932032,191940022,"Tue May 03 16:40:21 +0000 2016","2016-05-03 16:40:21",NA,NA,"","RT @DiputadosPRI: Hoy conmemoramos un pilar de la democracia, hoy es el Día Mundial de la Libertad de Prensa. ???? ???? ???? ???? https://t.co/Q2V64nT0…",59,0,0,0,0,"2016-05-04 01:19:29","2016-07-19 19:13:29",1,1
"907",728019490428977152,191940022,"Thu May 05 00:32:27 +0000 2016","2016-05-05 00:32:27",NA,NA,"","Cumpliendo con mi compromiso y obligación como Servidor Público, presenté hoy mi declaración de Bienes Patrimoniales https://t.co/IwndFxFhyz",7,14,0,0,0,"2016-05-04 20:59:25","2016-07-28 07:34:54",0,0
"908",728017866805510144,191940022,"Thu May 05 00:26:00 +0000 2016","2016-05-05 00:26:00",NA,NA,"","La @CAMegalopolis determinó mantener la Fase 1 de Contingencia Ambiental y el doble #HoyNoCircula para mañana jueves https://t.co/RTM1hFa2T5",5,10,0,0,0,"2016-05-04 20:59:25","2016-07-27 06:56:04",0,0
"909",727962711288483840,191940022,"Wed May 04 20:46:49 +0000 2016","2016-05-04 20:46:49",NA,NA,"","Saludos, buenas tardes.  https://t.co/aGitUmkaIQ",0,0,0,0,0,"2016-05-04 20:59:25","2016-07-25 21:40:31",0,0
"910",727904304472825856,191940022,"Wed May 04 16:54:44 +0000 2016","2016-05-04 16:54:44",NA,NA,"","RT @eruviel_avila: Doy la bienvenida a @JoseAMeadeK para la firma el convenio entre @SEDESOL_mx y @Walmart. Se apoyará a la gente para que…",464,0,0,0,0,"2016-05-04 20:59:30","2016-07-25 21:40:31",1,1
"911",727904196171698176,191940022,"Wed May 04 16:54:18 +0000 2016","2016-05-04 16:54:18",NA,NA,"","RT @EPN: Fue un honor recibirte esta tarde, Olga. Eres un orgullo y una gran promesa para México. Mucho éxito. https://t.co/3ZO1KFuW2H",1842,0,0,0,0,"2016-05-04 20:59:31","2016-07-25 11:18:30",1,1
"912",728743823820521472,191940022,"Sat May 07 00:30:41 +0000 2016","2016-05-07 00:30:41",NA,NA,"","Seguimos festejando a nuestros niños de #Ecatepec gracias a mis vecinos de Ciudad Azteca 3era. Sección por recibirme https://t.co/LHeHN6W1YP",8,11,0,0,0,"2016-05-07 00:11:07","2016-07-29 00:41:59",0,0
"913",728667491371638784,191940022,"Fri May 06 19:27:22 +0000 2016","2016-05-06 19:27:22",NA,NA,"","#SabíasQué https://t.co/2BzDoI1Viy",2,6,0,0,0,"2016-05-07 00:11:07","2016-07-29 00:41:59",0,0
"914",728334919278026752,191940022,"Thu May 05 21:25:51 +0000 2016","2016-05-05 21:25:51",NA,NA,"","Aquí les comparto una serie de recomendaciones durante el programa de Contingencia Ambiental fase 1 #MedioAmbiente https://t.co/QAgfIanfDs",2,6,0,0,0,"2016-05-07 00:11:08","2016-07-29 00:41:59",0,0
"915",728236949723471872,191940022,"Thu May 05 14:56:33 +0000 2016","2016-05-05 14:56:33",NA,NA,"","Hoy #5deMayo celebramos la heroica Batalla de Puebla. A 154 años de defender nuestra soberanía como mexicanos. https://t.co/wXygRPJEZD",6,8,0,0,0,"2016-05-07 00:11:08","2016-07-29 00:41:59",0,0
"916",729844887152025600,191940022,"Tue May 10 01:25:55 +0000 2016","2016-05-10 01:25:55",NA,NA,"","EN DIRECTO en #Periscope: Una colonia + https://t.co/3jv3q21sYW",12,9,0,0,0,"2016-05-10 00:02:45","2016-08-05 07:57:33",0,0
"917",729717955672473600,191940022,"Mon May 09 17:01:32 +0000 2016","2016-05-09 17:01:32",NA,NA,"","Vamos haciendo camino al andar creando oportunidades con nuestras acciones. #FelizLunes https://t.co/a9cgdA2aT0",11,10,0,0,0,"2016-05-10 00:02:50","2016-08-02 07:31:34",0,0
"918",729710053184278528,191940022,"Mon May 09 16:30:08 +0000 2016","2016-05-09 16:30:08",NA,NA,"","RT @DiputadosPRI: Hoy es el Día Nacional de la Salud Materna y Perinatal, que aprobamos para cuidar la salud del presente y del futuro http…",40,0,0,0,0,"2016-05-10 00:02:50","2016-08-02 07:31:34",1,1
"919",729341191620190208,191940022,"Sun May 08 16:04:25 +0000 2016","2016-05-08 16:04:25",NA,NA,"","¡Excelente domingo para todos los tuiteros! #BuenDía https://t.co/BeJ6UI1bul",1,4,0,0,0,"2016-05-10 00:02:52","2016-08-02 07:31:34",0,0
"920",728999470176722944,191940022,"Sat May 07 17:26:32 +0000 2016","2016-05-07 17:26:32",NA,NA,"","Fuchila !!! Ya huelen feo Ron y Cholate, urge bañarlos, jijji. #FelizSábado https://t.co/QYbRWzboLL",1,4,0,0,0,"2016-05-10 00:02:52","2016-08-02 07:31:34",0,0
"921",728983969144799232,191940022,"Sat May 07 16:24:56 +0000 2016","2016-05-07 16:24:56",NA,NA,"","""La vida es como el ejercicio, cuánto más duro es, más fuerte te vuelves"" #FelizSábado https://t.co/b962gwdhRu",3,7,0,0,0,"2016-05-10 00:02:52","2016-08-02 07:31:34",0,0
"922",728964545016795136,191940022,"Sat May 07 15:07:45 +0000 2016","2016-05-07 15:07:45",3163105628,728794226532573184,"isabelsedillo59","Saludos @isabelsedillo59 bonito sábado.",0,0,0,0,0,"2016-05-10 00:02:52","2016-07-29 00:41:59",0,0
"923",728803338435887104,191940022,"Sat May 07 04:27:11 +0000 2016","2016-05-07 04:27:11",NA,NA,"","""Ecatepec + Prendido"" en la colonia Sagitario 8, gracias a mis vecinos por la oportunidad que me dan de servirles. https://t.co/RiHPIZsfiP",6,4,0,0,0,"2016-05-10 00:02:52","2016-07-29 00:41:59",0,0
"924",730087075769253888,191940022,"Tue May 10 17:28:17 +0000 2016","2016-05-10 17:28:17",NA,NA,"","No tengo palabras para agradecerle todo lo que me ha dado, muchas gracias Mami. ¡Felicidades! Te Amo. https://t.co/6lHcvWWqTj",12,15,0,0,0,"2016-05-10 15:29:31","2016-08-05 18:47:59",0,0
"925",730043189894119424,191940022,"Tue May 10 14:33:54 +0000 2016","2016-05-10 14:33:54",NA,NA,"","Hoy es un buen día para aprovechar los momentos, olvidar el pasado y buscar lo anhelado, ¡Muy buenos días! https://t.co/3scfubpG9j",4,7,0,0,0,"2016-05-10 15:29:31","2016-08-05 18:47:59",0,0
"926",730024641268355072,191940022,"Tue May 10 13:20:12 +0000 2016","2016-05-10 13:20:12",1000147855,729802819537010688,"d_melgoza","@d_melgoza Muy buenos días Rocío, fueras tan amable de proporcionarme algún número telefónico por favor.",0,0,0,0,0,"2016-05-10 15:29:31","2016-08-05 07:57:33",0,0
"927",731315218014310400,191940022,"Sat May 14 02:48:29 +0000 2016","2016-05-14 02:48:29",NA,NA,"","Comenzamos el día de hoy con el programa  ""Ecatepec + Prendido""  en la colonia Progreso de la Unión. https://t.co/ajyizi6SHf",13,13,0,0,0,"2016-05-14 02:12:03","2016-08-14 09:43:00",0,0
"928",731157162219606016,191940022,"Fri May 13 16:20:26 +0000 2016","2016-05-13 16:20:26",NA,NA,"","Nada impedirá que hoy sea un #BuenViernes https://t.co/eFyx6O7bzK",6,8,0,0,0,"2016-05-14 02:12:03","2016-08-13 16:07:12",0,0
"929",730807555467792384,191940022,"Thu May 12 17:11:13 +0000 2016","2016-05-12 17:11:13",NA,NA,"","Hoy es Día Internacional de la Enfermería, mi reconocimiento a la gran labor que realizan todos los días. https://t.co/UobyNvNCEs",11,12,0,0,0,"2016-05-14 02:12:03","2016-08-11 23:33:13",0,0
"930",730588711868469248,191940022,"Thu May 12 02:41:37 +0000 2016","2016-05-12 02:41:37",NA,NA,"","""Ecatepec + Prendido"" llegará a otra colonia, por lo que me encuentro recorriendo Progreso de la Unión, bonita noche https://t.co/mQBwRZJHu4",10,14,0,0,0,"2016-05-14 02:12:03","2016-08-11 23:33:13",0,0
"931",730584123232768000,191940022,"Thu May 12 02:23:23 +0000 2016","2016-05-12 02:23:23",NA,NA,"","Muy buenas noches a mis amigos que conocen el significado de soñar. https://t.co/vnCYubo7Z3",5,10,0,0,0,"2016-05-14 02:12:03","2016-08-11 23:33:13",0,0
"932",730485978574389248,191940022,"Wed May 11 19:53:23 +0000 2016","2016-05-11 19:53:23",NA,NA,"","#UnDíaComoHoy De 1904 nace Salvador Dalí, uno de los exponentes más importantes del surrealismo https://t.co/pDKLbtHHrp",6,13,0,0,0,"2016-05-14 02:12:03","2016-08-11 23:33:13",0,0
"933",730462392346279936,191940022,"Wed May 11 18:19:40 +0000 2016","2016-05-11 18:19:40",3163105628,730445289765490688,"isabelsedillo59","Hola @isabelsedillo59 que tengas bonita tarde.",0,3,0,0,0,"2016-05-14 02:12:03","2016-08-09 09:11:54",0,0
"934",730446059386757120,191940022,"Wed May 11 17:14:46 +0000 2016","2016-05-11 17:14:46",NA,NA,"","RT @Canal22: ‘Lo único de lo que el mundo no se cansará nunca es de exageración.’ #El22Recuerda a Salvador Dalí https://t.co/PkCMaO9tgP",95,0,0,0,0,"2016-05-14 02:12:03","2016-08-09 09:11:54",1,1
"935",730429757871923200,191940022,"Wed May 11 16:09:59 +0000 2016","2016-05-11 16:09:59",NA,NA,"","Con toda la actitud necesaria para que este Miércoles sea único. ¡Buen Día!",2,5,0,0,0,"2016-05-14 02:12:03","2016-08-09 09:11:54",0,0
"936",730154867042320384,191940022,"Tue May 10 21:57:40 +0000 2016","2016-05-10 21:57:40",NA,NA,"","RT @EPN: A mi madre y a todas las mamás de @Mexico: mi cariño, respeto y profunda admiración #FelizDíaDeLaMadre.",1375,0,0,0,0,"2016-05-14 02:12:03","2016-08-05 18:47:59",1,1
"937",731654102417997824,191940022,"Sun May 15 01:15:06 +0000 2016","2016-05-15 01:15:06",266816891,731637954611798016,"MONTEJO1106","Perfecto, muchas gracias, que tengas una excelente noche @MONTEJO1106",1,3,0,0,0,"2016-05-15 11:40:18","2016-08-16 04:31:51",0,0
"938",731635592383975424,191940022,"Sun May 15 00:01:33 +0000 2016","2016-05-15 00:01:33",266816891,731158595476168704,"MONTEJO1106","@MONTEJO1106 Hola, fueras tan amable de proporcionarme algún número telefónico por favor.",0,1,0,0,0,"2016-05-15 11:40:19","2016-08-14 09:43:00",0,0
"939",731606087208570880,191940022,"Sat May 14 22:04:18 +0000 2016","2016-05-14 22:04:18",NA,NA,"","Es para mí un honor poder celebrar a las Mamás de mi gran #Ecatepec en especial a las de la colonia Prizo 1. https://t.co/nw4m8MpUV6",14,17,0,0,0,"2016-05-15 11:40:19","2016-08-14 09:43:00",0,0
"940",731880123679395840,191940022,"Sun May 15 16:13:13 +0000 2016","2016-05-15 16:13:13",NA,NA,"","Mi reconocimiento a todos los Maestros en su día, su trabajo de formación marca para toda la vida #DíaDelMaestro https://t.co/yn9M44kLBA",7,11,0,0,0,"2016-05-16 09:45:20","2016-08-16 04:31:51",0,0
"941",732275549586919424,191940022,"Mon May 16 18:24:30 +0000 2016","2016-05-16 18:24:30",3163105628,732236009157459968,"isabelsedillo59","Hola @isabelsedillo59 de igual manera deseo que está semana este llena de muchos éxitos. Bonito lunes.",1,3,0,0,0,"2016-05-16 16:30:54","2016-08-16 04:31:51",0,0
"942",732229278973059072,191940022,"Mon May 16 15:20:38 +0000 2016","2016-05-16 15:20:38",NA,NA,"","#FelizLunes https://t.co/QvhOSeUDSm",8,17,0,0,0,"2016-05-16 16:30:54","2016-08-16 04:31:51",0,0
"943",732392846414635008,191940022,"Tue May 17 02:10:36 +0000 2016","2016-05-17 02:10:36",NA,NA,"","RT @radiomex: TvMex Noticias - El Diputado Federal @luisfelipevg @DiputadosPRI  celebró a las Mamás de colonia Prizo 1 #Ecatepec https://t.…",4,0,0,0,0,"2016-05-17 09:36:31","2016-08-16 04:31:51",1,1
"944",732591278295130112,191940022,"Tue May 17 15:19:06 +0000 2016","2016-05-17 15:19:06",NA,NA,"","La discriminación vulnera la igualdad, derechos y libertades de toda persona. Juntos por un país #SinHomofobia https://t.co/DusNqQndgu",7,12,0,0,0,"2016-05-18 03:10:07","2016-08-16 04:31:51",0,0
"945",733315133355655168,191940022,"Thu May 19 15:15:26 +0000 2016","2016-05-19 15:15:26",NA,NA,"","#UnDiaComoHoy En 1932 nace @Eponiatowska escritora, activista y periodista mexicana. ¡Felicidades! https://t.co/OSzeznWeXq",1,4,0,0,0,"2016-05-20 09:08:33","2016-08-16 04:31:51",0,0
"946",733113045958828032,191940022,"Thu May 19 01:52:25 +0000 2016","2016-05-19 01:52:25",NA,NA,"","RT @cultura_mx: Día Internacional de los Museos #DIM2016 https://t.co/gFUTMc6RiR",41,0,0,0,0,"2016-05-20 09:08:33","2016-08-16 04:31:51",1,1
"947",733112999443988480,191940022,"Thu May 19 01:52:14 +0000 2016","2016-05-19 01:52:14",NA,NA,"","RT @INAHmx: #DíaInternacionalMuseos Visita el #Museo Nacional del @Virreinato en Tepotzotlán #EdoMex https://t.co/mZ26Xuzfyx https://t.co/w…",13,0,0,0,0,"2016-05-20 09:08:33","2016-08-16 04:31:51",1,1
"948",733101358895628288,191940022,"Thu May 19 01:05:58 +0000 2016","2016-05-19 01:05:58",NA,NA,"","Con todo el ánimo y la actitud para apoyar a mis poderosísimas águilas del @ClubAmerica #EstaNocheTenemosQueGanar https://t.co/0DFYuxQgxq",2,4,0,0,0,"2016-05-20 09:08:34","2016-08-16 04:31:51",0,0
"949",732962302136197120,191940022,"Wed May 18 15:53:25 +0000 2016","2016-05-18 15:53:25",NA,NA,"","Les comparto la siguiente efeméride.
#FelizMiércoles https://t.co/yQsejDl6pN",2,8,0,0,0,"2016-05-20 09:08:34","2016-08-16 04:31:51",0,0
"950",734429793802846208,191940022,"Sun May 22 17:04:42 +0000 2016","2016-05-22 17:04:42",NA,NA,"","Esta mañana reconocí toda su entrega, dedicación, pasión, valor y honor a mis amigos los Pequeños Vulcanos. https://t.co/GYmrtk9hH2",14,17,0,0,0,"2016-05-22 16:34:37","2016-08-16 04:31:51",0,0
"951",734091972793638912,191940022,"Sat May 21 18:42:19 +0000 2016","2016-05-21 18:42:19",NA,NA,"","Disfrutemos cada minuto de este #FelizSabado. https://t.co/H9XYv2LVDh",7,11,0,0,0,"2016-05-22 16:34:37","2016-08-16 04:31:51",0,0
"952",733840719614332928,191940022,"Sat May 21 02:03:56 +0000 2016","2016-05-21 02:03:56",NA,NA,"","Esta noche superviso la rehabilitación de luminarias del programa ""Ecatepec+Prendido"" en la col.Progreso de la Unión https://t.co/pwQjwt221K",7,15,0,0,0,"2016-05-22 16:34:37","2016-08-16 04:31:51",0,0
"953",733703430145892352,191940022,"Fri May 20 16:58:23 +0000 2016","2016-05-20 16:58:23",NA,NA,"","Feliz #DiaDelPsicologo a todos aquellos que dedican su vida a esta interesante profesión. https://t.co/Sz8TXg9DV3",9,11,0,0,0,"2016-05-22 16:34:37","2016-08-16 04:31:51",0,0
"954",734804751469010944,191940022,"Mon May 23 17:54:39 +0000 2016","2016-05-23 17:54:39",NA,NA,"","Aprovecha tu juventud e inteligencia para convertirte en un buen estudiante. #DíaDelEstudiante https://t.co/sOSaRfjutc",2,7,0,0,0,"2016-05-24 05:13:09","2016-08-16 04:31:51",0,0
"955",734804518651625472,191940022,"Mon May 23 17:53:43 +0000 2016","2016-05-23 17:53:43",NA,NA,"","RT @EllieLeyva: Un lunes lleno de energía positiva para comenzar la semana https://t.co/HuNRCgBK1g",1,0,0,0,0,"2016-05-24 05:13:09","2016-08-16 04:31:51",1,1
"956",734761568387272704,191940022,"Mon May 23 15:03:03 +0000 2016","2016-05-23 15:03:03",NA,NA,"","¡Excelente inicio de semana! #FelizLunes https://t.co/0q9upwVf4X",0,6,0,0,0,"2016-05-24 05:13:09","2016-08-16 04:31:51",0,0
"957",735498944059297792,191940022,"Wed May 25 15:53:07 +0000 2016","2016-05-25 15:53:07",3163105628,735498642480455680,"isabelsedillo59","@isabelsedillo59 muchas gracias, que tengas un bonito miércoles.",1,2,0,0,0,"2016-05-25 18:38:16","2016-08-16 04:31:51",0,0
"958",735498817278119936,191940022,"Wed May 25 15:52:37 +0000 2016","2016-05-25 15:52:37",NA,NA,"","#UnDíaComoHoy Muere en la Ciudad de México la pintora surrealista, Leonora Carrington. https://t.co/AwHK2GzHbR",3,10,0,0,0,"2016-05-25 18:38:16","2016-08-16 04:31:51",0,0
"959",735292652879368192,191940022,"Wed May 25 02:13:24 +0000 2016","2016-05-25 02:13:24",NA,NA,"","Qué gusto saludar a mis vecinos de la col.Progreso de la Unión en la rehabilitación del programa ""Ecatepec+Prendido"" https://t.co/v3GkTKRA4W",9,16,0,0,0,"2016-05-25 18:38:16","2016-08-16 04:31:51",0,0
"960",735165624393965568,191940022,"Tue May 24 17:48:38 +0000 2016","2016-05-24 17:48:38",3163105628,735165366930804736,"isabelsedillo59","Hola @isabelsedillo59 es con mucho gusto y cariño, que tengas una bonita tarde.",0,3,0,0,0,"2016-05-25 18:38:16","2016-08-16 04:31:51",0,0
"961",735138958061899776,191940022,"Tue May 24 16:02:40 +0000 2016","2016-05-24 16:02:40",3163105628,735136503739777024,"isabelsedillo59","Muchas gracias @isabelsedillo59 y de igual forma lo deseo para ti. Saludos",0,2,0,0,0,"2016-05-25 18:38:16","2016-08-16 04:31:51",0,0
"962",735123033740840960,191940022,"Tue May 24 14:59:23 +0000 2016","2016-05-24 14:59:23",NA,NA,"","¡Que tengan un excelente día! Trabajemos con mucho entusiasmo en busca de lograr nuestras metas. 

#FelizMartes https://t.co/eGmWZLfONd",6,11,0,0,0,"2016-05-25 18:38:16","2016-08-16 04:31:51",0,0
"963",735852209330491392,191940022,"Thu May 26 15:16:52 +0000 2016","2016-05-26 15:16:52",NA,NA,"","#SabíasQue https://t.co/Qjxwt4YXuS",2,7,0,0,0,"2016-05-27 02:34:05","2016-08-16 04:31:51",0,0
"964",735610494304686080,191940022,"Wed May 25 23:16:23 +0000 2016","2016-05-25 23:16:23",NA,NA,"","Hoy se celebra el Día del Contador en México. ¡Muchas felicidades! https://t.co/ExbBDYaaQs",5,11,0,0,0,"2016-05-27 02:34:05","2016-08-16 04:31:51",0,0
"965",737367295605891072,191940022,"Mon May 30 19:37:17 +0000 2016","2016-05-30 19:37:17",NA,NA,"","Muchas gracias @isabelsedillo59  bonita tarde.  https://t.co/gVjIr1jxRC",0,3,0,0,0,"2016-05-30 16:52:38","2016-08-16 21:02:04",0,0
"966",737301753201233920,191940022,"Mon May 30 15:16:51 +0000 2016","2016-05-30 15:16:51",NA,NA,"","Excelente inicio de semana tuiteros, vivamos intensamente este día y el día nos dará lo mejor. #FelizLunes https://t.co/itl0LH72ws",2,7,0,0,0,"2016-05-30 16:52:42","2016-08-16 21:02:04",0,0
"967",737009332382883840,191940022,"Sun May 29 19:54:52 +0000 2016","2016-05-29 19:54:52",NA,NA,"","La mejor red social es una mesa rodeada de las personas que tú más quieres. ¡Buen Provecho! ???? https://t.co/jqUoZ0V8xJ",4,9,0,0,0,"2016-05-30 16:52:42","2016-08-16 21:02:04",0,0
"968",736732266831847424,191940022,"Sun May 29 01:33:54 +0000 2016","2016-05-29 01:33:54",NA,NA,"","¡Valorá la vida, si vas a conducir no tomes alcohol!

#FelizNocheDeSábado https://t.co/r5xNVdsLOv",3,6,0,0,0,"2016-05-30 16:52:42","2016-08-16 21:02:04",0,0
"969",736704350760771584,191940022,"Sat May 28 23:42:59 +0000 2016","2016-05-28 23:42:59",NA,NA,"","RT @cultura_mx: ¡Últimos días! #ElArteDeLaMúsica se va de @mbellasartes el 5 de junio. ¿Ya la visitaste? ¡No te la pierdas! https://t.co/vi…",71,0,0,0,0,"2016-05-30 16:52:42","2016-08-16 21:02:04",1,1
"970",736662541221298176,191940022,"Sat May 28 20:56:51 +0000 2016","2016-05-28 20:56:51",NA,NA,"","RT @eruviel_avila: El deporte une a las naciones. #Edoméx será la orgullosa sede de @giroditalia, una de las competencias de ciclismo más i…",526,0,0,0,0,"2016-05-30 16:52:43","2016-08-16 21:02:04",1,1
"971",736383021004136448,191940022,"Sat May 28 02:26:08 +0000 2016","2016-05-28 02:26:08",NA,NA,"","Seguimos trabajando esta noche en la col. Progreso de la Unión con el programa ""Ecatepec + Prendido"" https://t.co/Y3k02LqOcD",8,15,0,0,0,"2016-05-30 16:52:43","2016-08-16 21:02:04",0,0
"972",736222285103669248,191940022,"Fri May 27 15:47:25 +0000 2016","2016-05-27 15:47:25",NA,NA,"","Les deseo un feliz fin de semana a todos ¡Sonrían que ya es viernes! https://t.co/AItaAJqvPO",7,14,0,0,0,"2016-05-30 16:52:43","2016-08-16 04:31:51",0,0
"973",737675294148988928,191940022,"Tue May 31 16:01:10 +0000 2016","2016-05-31 16:01:10",NA,NA,"","#FelizMartes Que tengan un día lleno de éxito. https://t.co/X8LmTCOdCE",4,9,0,0,0,"2016-05-31 12:23:24","2016-08-16 21:02:04",0,0
"974",737440103564353536,191940022,"Tue May 31 00:26:36 +0000 2016","2016-05-31 00:26:36",NA,NA,"","EN DIRECTO en #Periscope: Con progreso de la unión, una colonia + https://t.co/Hc7OdY57UA",4,10,0,0,0,"2016-05-31 12:23:24","2016-08-16 21:02:04",0,0
