"","id_tweet","id_twitter","created_at","created_at_datetime","in_reply_to_user_id","in_reply_to_status_id","in_reply_to_screen_name","text","retweet_count","favorite_count","longitude","latitude","retweeted","creation_date","modification_date","RT_temp","is_retweeted"
"1341",794577724467646464,191940022,"Fri Nov 04 16:31:06 +0000 2016","2016-11-04 16:31:06",NA,NA,"","Iniciamos actividades asistiendo a la Duodécima Reunión de Junta Directiva de la Comisión de Defensa Nacional. https://t.co/gYreXYFd47",6,12,0,0,0,"2016-11-05 12:32:12","2017-02-20 21:01:41",0,0
"1342",794243754769063936,191940022,"Thu Nov 03 18:24:02 +0000 2016","2016-11-03 18:24:02",NA,NA,"","Con gusto les comparto la calaverita que me mandaron el día de ayer. Que tengan una bonita tarde! https://t.co/sUdTsBh7EO",3,7,0,0,0,"2016-11-05 12:32:12","2016-11-05 12:32:12",0,0
"1343",797201669981433856,191940022,"Fri Nov 11 22:17:44 +0000 2016","2016-11-11 22:17:44",NA,NA,"","Con el programa de embellecimiento urbano, nuestro Distrito 17 cada día se ve más bonito. #CumpliendoCompromisos… https://t.co/Lr6iV0OUVV",2,8,0,0,0,"2016-11-11 20:38:58","2017-03-04 03:23:56",0,0
"1344",797041322813227008,191940022,"Fri Nov 11 11:40:34 +0000 2016","2016-11-11 11:40:34",105628727,797038686420561920,"victor_radio","Muchas gracias @victor_radio y de igual forma deseo que tengas un excelente día.",2,2,0,0,0,"2016-11-11 20:39:04","2017-03-04 03:23:56",0,0
"1345",797023943106461696,191940022,"Fri Nov 11 10:31:30 +0000 2016","2016-11-11 10:31:30",NA,NA,"","Aprobado en lo General y en lo Particular el dictamen del #PEF2017 por 4 billones 888 mil 892.5 millones de pesos,… https://t.co/Oq5ULPl475",7,12,0,0,0,"2016-11-11 20:39:04","2017-03-04 03:23:56",0,0
"1346",796912427212357632,191940022,"Fri Nov 11 03:08:23 +0000 2016","2016-11-11 03:08:23",NA,NA,"","Continuamos discutiendo el #PEF17 en la @Mx_Diputados en donde los @DiputadosPRI actuamos con responsabilidad en be… https://t.co/wRNyQL77Y0",4,5,0,0,0,"2016-11-11 20:39:10","2017-03-03 09:41:31",0,0
"1347",796783271355043840,191940022,"Thu Nov 10 18:35:10 +0000 2016","2016-11-10 18:35:10",NA,NA,"","De acuerdo a nuestro cronograma de actividades, esta mañana continuamos con el embellecimiento urbano, ahora en la… https://t.co/J19NXYTRpK",3,4,0,0,0,"2016-11-11 20:39:16","2017-03-03 09:41:31",0,0
"1348",796547843850780672,191940022,"Thu Nov 10 02:59:39 +0000 2016","2016-11-10 02:59:39",NA,NA,"","Con el programa ""Ecatepec + Prendido"" continuamos en la col. Ciudad Azteca y con gusto saludo a mi amiguita Vanesa… https://t.co/GlDIkHwPSh",5,9,0,0,0,"2016-11-11 20:39:21","2017-03-03 09:41:31",0,0
"1349",796481952765345792,191940022,"Wed Nov 09 22:37:50 +0000 2016","2016-11-09 22:37:50",NA,NA,"","Muchas felicidades Secretaría @ArelyGomezGlz le envío un afectuoso abrazo. https://t.co/HkfS97WNQt",0,1,0,0,0,"2016-11-11 20:39:27","2017-03-02 15:49:05",0,0
"1350",796205522332557312,191940022,"Wed Nov 09 04:19:23 +0000 2016","2016-11-09 04:19:23",NA,NA,"","Con el programa ""Ecatepec con + Valores"" seguimos reforzando los principios a nuestros niños.… https://t.co/VYexX8uSBr",4,5,0,0,0,"2016-11-11 20:39:27","2017-03-01 07:37:33",0,0
"1351",796063876467064832,191940022,"Tue Nov 08 18:56:32 +0000 2016","2016-11-08 18:56:32",NA,NA,"","Buenas tardes, les pido me ayuden a difundir esta información, para localizar a Paola, quien es sobrina de uno de m… https://t.co/hPzlQixMeY",6,3,0,0,0,"2016-11-11 20:39:33","2017-03-01 07:37:33",0,0
"1352",796011776672432128,191940022,"Tue Nov 08 15:29:31 +0000 2016","2016-11-08 15:29:31",NA,NA,"","Junto a nuestro Coordinador @CCQ_PRI los @DiputadosdelPRI rendimos honores a nuestro Lábaro Patrio, todo un orgullo… https://t.co/PVILuN4ikb",3,7,0,0,0,"2016-11-11 20:39:38","2017-03-01 07:37:33",0,0
"1353",795866858368991232,191940022,"Tue Nov 08 05:53:40 +0000 2016","2016-11-08 05:53:40",NA,NA,"","Esta noche entrego una silla de ruedas a la Sra. Blanca para su esposo David en Ciudad Azteca para mejorar su calid… https://t.co/YuSKLsSb60",3,11,0,0,0,"2016-11-11 20:39:44","2017-02-28 12:34:54",0,0
"1354",795840028744171520,191940022,"Tue Nov 08 04:07:03 +0000 2016","2016-11-08 04:07:03",NA,NA,"","El programa ""Ecatepec + Prendido"" sigue beneficiando a más vecinos de la col. Ciudad Azteca. #CumpliendoCompromisos… https://t.co/YYf7SCAaTZ",6,11,0,0,0,"2016-11-11 20:39:50","2017-02-27 12:16:09",0,0
"1355",795681066866589696,191940022,"Mon Nov 07 17:35:24 +0000 2016","2016-11-07 17:35:24",NA,NA,"","Continuamos con el embellecimiento de las principales avenidas del #Distrito17 gracias por su apoyo @vicky_colin y… https://t.co/Et1cy0ilbf",6,12,0,0,0,"2016-11-11 20:39:55","2017-02-27 12:16:09",0,0
"1356",795335054956392448,191940022,"Sun Nov 06 18:40:28 +0000 2016","2016-11-06 18:40:28",NA,NA,"","Entrego una ???? a mi amigo Luis, el cual los fines de semana trabaja de viene viene para apoyarse con sus estudios un… https://t.co/UEub7DZAIQ",6,9,0,0,0,"2016-11-11 20:40:01","2017-02-26 11:51:19",0,0
"1357",797663947578949632,191940022,"Sun Nov 13 04:54:39 +0000 2016","2016-11-13 04:54:39",NA,NA,"","Para todos aquellos que me habían hecho el favor de preguntar por Pulques, les comparto este video en donde le ???? un… https://t.co/Upr1AkXbkJ",4,8,0,0,0,"2016-11-13 11:30:20","2017-03-04 03:23:56",0,0
"1358",797575635153592320,191940022,"Sat Nov 12 23:03:44 +0000 2016","2016-11-12 23:03:44",NA,NA,"","Les mando una felicitación a todos los carteros y empleados postales, hoy en su día! https://t.co/vxjtlytZ1i",2,6,0,0,0,"2016-11-13 11:30:25","2017-03-04 03:23:56",0,0
"1359",797480833653190656,191940022,"Sat Nov 12 16:47:01 +0000 2016","2016-11-12 16:47:01",NA,NA,"","RT @carpinteyronews: @luisfelipevg  Gracias diputado por el apoyo de la luminaria por un ""Ecatepec + prendido"" seguimos en contacto para #U…",1,0,0,0,0,"2016-11-13 11:30:25","2017-03-04 03:23:56",1,1
"1360",797327259107520512,191940022,"Sat Nov 12 06:36:46 +0000 2016","2016-11-12 06:36:46",NA,NA,"","Esta noche cumpliendo mis compromisos atendí la petición de @carpinteyronews  y sustituimos la luminaria de Blvd. Q… https://t.co/Jhq5cXRHiL",6,11,0,0,0,"2016-11-13 11:30:25","2017-03-04 03:23:56",0,0
"1361",797290438017200128,191940022,"Sat Nov 12 04:10:28 +0000 2016","2016-11-12 04:10:28",NA,NA,"","Con el programa ""Ecatepec + Prendido"" no solo ilumínalos calles,sino también los parques de nuestros jóvenes y niño… https://t.co/QWDivvkFHL",3,5,0,0,0,"2016-11-13 11:30:28","2017-03-04 03:23:56",0,0
"1362",798249666257162240,191940022,"Mon Nov 14 19:42:05 +0000 2016","2016-11-14 19:42:05",NA,NA,"","Esta tarde entregue un apoyo a la alumna Karla Nuevo de la Escuela Secundaria Técnica Industrial y Comercial ""José… https://t.co/fB7w8PomAG",6,10,0,0,0,"2016-11-14 15:26:33","2017-03-04 03:23:56",0,0
"1363",798380893303803904,191940022,"Tue Nov 15 04:23:32 +0000 2016","2016-11-15 04:23:32",NA,NA,"","Por arriba de las condiciones climatológicas, está la seguridad de mis vecinos del #Distrito17, por tal motivo Ecat… https://t.co/fmp8JQ8gES",5,8,0,0,0,"2016-11-15 02:47:15","2017-03-04 03:23:56",0,0
"1364",798310620588191744,191940022,"Mon Nov 14 23:44:18 +0000 2016","2016-11-14 23:44:18",NA,NA,"","RT @DiputadosPRI: En el Día Mundial de la Diabetes, aprovechamos para recordarte, ¡ojo con esta enfermedad! https://t.co/RqYwVNkZZK",52,0,0,0,0,"2016-11-15 02:47:21","2017-03-04 03:23:56",1,1
"1365",798966647063269376,191940022,"Wed Nov 16 19:11:07 +0000 2016","2016-11-16 19:11:07",NA,NA,"","Buenas tardes amigos, uno de mis platillos favoritos son los bisteces en salsa verde con papas de cambray ¿Y de ust… https://t.co/fMZcYp7tVa",5,9,0,0,0,"2016-11-17 08:50:36","2017-03-04 03:23:56",0,0
"1366",799394958507655168,191940022,"Thu Nov 17 23:33:04 +0000 2016","2016-11-17 23:33:04",NA,NA,"","Buenas tardes, les comparto algunas acciones que implementa la @PresidenciaMX para nuestros paisanos que se encuent… https://t.co/yXzHq0AuEQ",4,6,0,0,0,"2016-11-18 12:46:05","2017-03-04 03:23:56",0,0
"1367",799863008252035072,191940022,"Sat Nov 19 06:32:56 +0000 2016","2016-11-19 06:32:56",NA,NA,"","Hoy aplicamos #ElBuenFin en la col. Ciudad Azteca con el programa ""Ecatepec + Prendido"" sustituyendo más luminarias… https://t.co/pYErjDGx6s",3,6,0,0,0,"2016-11-19 11:34:29","2017-03-04 03:23:56",0,0
"1368",799796702362402816,191940022,"Sat Nov 19 02:09:28 +0000 2016","2016-11-19 02:09:28",NA,NA,"","Muchas felicidades @EllieLeyva deseo que sigas teniendo un extraordinario día, el cual este lleno de muchas bendici… https://t.co/ljxe1VzEDF",1,3,0,0,0,"2016-11-19 11:34:35","2017-03-04 03:23:56",0,0
"1369",800489886272880640,191940022,"Mon Nov 21 00:03:55 +0000 2016","2016-11-21 00:03:55",NA,NA,"","Hoy conmemoramos el 106 aniversario del inicio de la #RevoluciónMexicana https://t.co/tPHK9Im3L6",6,8,0,0,0,"2016-11-20 20:13:06","2017-03-04 03:23:56",0,0
"1370",800408658400215040,191940022,"Sun Nov 20 18:41:09 +0000 2016","2016-11-20 18:41:09",NA,NA,"","Sigo disfrutando muchísimo de jugar ⚽, hoy hasta metí un gol !!! Pero más disfruto el poder convivir con mis amigos… https://t.co/OW3XoWN1Cj",5,7,0,0,0,"2016-11-20 20:13:06","2017-03-04 03:23:56",0,0
"1371",800109358298365952,191940022,"Sat Nov 19 22:51:50 +0000 2016","2016-11-19 22:51:50",NA,NA,"","RT @DiputadosPRI: Hoy es el primer Día Nacional Contra el Abuso Sexual Infantil. https://t.co/H9xpEUwc5g",105,0,0,0,0,"2016-11-20 20:13:06","2017-03-04 03:23:56",1,1
"1372",800923345940201472,191940022,"Tue Nov 22 04:46:20 +0000 2016","2016-11-22 04:46:20",NA,NA,"","Debemos de seguirle cumpliendo a la ciudadanía, no importando el día  #CumpliendoCompromisos #VamosxMás #Fuerza17 https://t.co/8buJM9YLWS",8,11,0,0,0,"2016-11-22 06:44:05","2017-03-04 03:23:56",0,0
"1373",801575748226191360,191940022,"Wed Nov 23 23:58:45 +0000 2016","2016-11-23 23:58:45",NA,NA,"","Con el programa de embellecimiento urbano, mejoramos la imagen de nuestras avenidas y también generamos empleos par… https://t.co/qVRexiJEZN",3,7,0,0,0,"2016-11-23 20:41:55","2017-03-04 03:23:56",0,0
"1374",801279727067660288,191940022,"Wed Nov 23 04:22:28 +0000 2016","2016-11-23 04:22:28",NA,NA,"","Hoy se suma a ""Ecatepec + Prendido"" #CiudadesSeguras por lo que cada día somos más los que estamos iluminando a nue… https://t.co/GaT2uJN1lT",14,16,0,0,0,"2016-11-23 20:42:01","2017-03-04 03:23:56",0,0
"1375",801991319694544896,191940022,"Fri Nov 25 03:30:05 +0000 2016","2016-11-25 03:30:05",NA,NA,"","Gracias al programa de Empleo Temporal, mejoramos la imagen urbana de nuestro querido Municipio.… https://t.co/xfSQIvO9ZD",6,9,0,0,0,"2016-11-25 00:38:27","2017-03-04 03:23:56",0,0
"1376",801900297664811008,191940022,"Thu Nov 24 21:28:24 +0000 2016","2016-11-24 21:28:24",NA,NA,"","Buenas tardes, les saludo desde la @Mx_Diputados y aprovecho para compartirles el mural en la ""Plaza de los Constit… https://t.co/WGV3iuyEtY",6,7,0,0,0,"2016-11-25 00:38:30","2017-03-04 03:23:56",0,0
"1377",801844181073281024,191940022,"Thu Nov 24 17:45:24 +0000 2016","2016-11-24 17:45:24",NA,NA,"","Muchas felicidades apreciable Secretario @cesar_gmonge deseo que pases un feliz día, recibe un fuerte abrazo ! https://t.co/SrcsD9ywCY",0,2,0,0,0,"2016-11-25 00:38:33","2017-03-04 03:23:56",0,0
"1378",801842275697520640,191940022,"Thu Nov 24 17:37:50 +0000 2016","2016-11-24 17:37:50",NA,NA,"","RT @eruviel_avila: Con la nueva #PlazaEdoméx en Ecatepec, seguimos recuperando espacios públicos y trabajando por nuestras mujeres: https:/…",287,0,0,0,0,"2016-11-25 00:38:33","2017-03-04 03:23:56",1,1
"1379",801649243421364224,191940022,"Thu Nov 24 04:50:48 +0000 2016","2016-11-24 04:50:48",NA,NA,"","En Ciudad Azteca ""Ecatepec + Prendido"" sigue beneficiando cada día a más ciudadanos #CumpliendoCompromisos… https://t.co/yoKLXji8yo",3,6,0,0,0,"2016-11-25 00:38:34","2017-03-04 03:23:56",0,0
"1380",802361268250120192,191940022,"Sat Nov 26 04:00:08 +0000 2016","2016-11-26 04:00:08",NA,NA,"","Gracias a mi vecina Patricia López que me dio un rico ponche mientras seguimos con el programa: ""Ecatepec + Prendid… https://t.co/NtTJ2mDIio",6,7,0,0,0,"2016-11-26 03:10:45","2017-03-05 19:23:17",0,0
"1381",802267366948302848,191940022,"Fri Nov 25 21:47:00 +0000 2016","2016-11-25 21:47:00",105628727,802257487420342272,"victor_radio","Muchas gracias y de igual forma les deseo un  #FelizViernes @victor_radio @makla20 @carlosmecatepec @EllieLeyva @arreolasan",3,9,0,0,0,"2016-11-26 03:10:51","2017-03-05 19:23:17",0,0
"1382",802222135359971328,191940022,"Fri Nov 25 18:47:16 +0000 2016","2016-11-25 18:47:16",NA,NA,"","Juntos podemos erradicar la violencia contra las mujeres y las niñas #NiUnaMás #DíaNaranja https://t.co/OKt5giVApm",5,8,0,0,0,"2016-11-26 03:10:52","2017-03-04 03:23:56",0,0
"1383",802562940826251264,191940022,"Sat Nov 26 17:21:30 +0000 2016","2016-11-26 17:21:30",NA,NA,"","Hoy por la mañana disfruté de un Gran paseo con Ron ???? y Chocolate ????, les deseo que tengan un #FelizSábado https://t.co/AOJvaVJGj5",4,6,0,0,0,"2016-11-27 10:52:16","2017-03-05 19:23:17",0,0
"1384",803056813910282240,191940022,"Mon Nov 28 02:03:59 +0000 2016","2016-11-28 02:03:59",NA,NA,"","Muchas gracias por esta gran alegría @ClubAmerica pasamos a las semifinales ⚽️️ https://t.co/Q0SFxMqDBL",4,6,0,0,0,"2016-11-27 23:03:00","2017-03-05 19:23:17",0,0
"1385",803379226447638528,191940022,"Mon Nov 28 23:25:08 +0000 2016","2016-11-28 23:25:08",NA,NA,"","En el Gabinete Regional V Ecatepec-Tecámac, en donde nos hicieron el favor de informarnos sobre las acciones llevad… https://t.co/E7tTKbB6Tw",4,7,0,0,0,"2016-11-28 21:37:25","2017-03-05 19:23:17",0,0
"1386",803270119891812352,191940022,"Mon Nov 28 16:11:35 +0000 2016","2016-11-28 16:11:35",NA,NA,"","RT @PRI_Nacional: ""En 2018 estará en juego todo lo que hemos logrado, pero no se trata de ganar por ganar, lo que está en juego es el futur…",184,0,0,0,0,"2016-11-28 21:37:31","2017-03-05 19:23:17",1,1
"1387",803267244239093760,191940022,"Mon Nov 28 16:00:09 +0000 2016","2016-11-28 16:00:09",NA,NA,"","Continuamos nuestras actividades dirigiéndonos en el Mexicable a San Andrés de la Cañada al Gabinete Regional V Eca… https://t.co/yeYXKP4SC8",4,5,0,0,0,"2016-11-28 21:37:31","2017-03-05 19:23:17",0,0
"1388",803220141416689664,191940022,"Mon Nov 28 12:52:59 +0000 2016","2016-11-28 12:52:59",1732381970,803219874268987392,"333Hernndez","@333Hernndez ????????",1,3,0,0,0,"2016-11-28 21:37:37","2017-03-05 19:23:17",0,0
"1389",803219660866887680,191940022,"Mon Nov 28 12:51:04 +0000 2016","2016-11-28 12:51:04",NA,NA,"","Que mejor que iniciar el día haciendo ejercicio, les deseo un #FelizLunes al igual que un exitoso inicio de semana. https://t.co/7CSMOJb7hJ",4,11,0,0,0,"2016-11-28 21:37:37","2017-03-05 19:23:17",0,0
"1390",803467606279815168,191940022,"Tue Nov 29 05:16:19 +0000 2016","2016-11-29 05:16:19",771466976291991552,803453653143015424,"0Angy_Any_Love3","Gracias @0Angy_Any_Love3 de igual manera deseo pases una muy bonita noche!",0,2,0,0,0,"2016-11-29 13:56:08","2017-03-08 20:02:41",0,0
"1391",803464217546412032,191940022,"Tue Nov 29 05:02:51 +0000 2016","2016-11-29 05:02:51",NA,NA,"","Continuamos con mis vecinos de la col. ciudad Azteca en la sustitución de luminarias con el programa ""Ecatepec + Pr… https://t.co/Mv5YGmgUT2",4,7,0,0,0,"2016-11-29 13:56:08","2017-03-08 20:02:41",0,0
"1392",803752740417634304,191940022,"Wed Nov 30 00:09:20 +0000 2016","2016-11-30 00:09:20",NA,NA,"","Esta tarde tuve la oportunidad de platicar con @oscargabilondo nieto de #CriCri y a quien le agradezco por este Gra… https://t.co/YjOySAfpQ6",3,6,0,0,0,"2016-11-30 04:11:53","2017-03-13 08:58:16",0,0
"1393",803726296547295232,191940022,"Tue Nov 29 22:24:16 +0000 2016","2016-11-29 22:24:16",NA,NA,"","Les deseo una bonita tarde, ¿Ustedes que van a comer? https://t.co/E3JDiHVa1S",1,3,0,0,0,"2016-11-30 04:12:01","2017-03-10 23:24:08",0,0
"1394",804108291508944896,191940022,"Wed Nov 30 23:42:10 +0000 2016","2016-11-30 23:42:10",NA,NA,"","Junto con mi amigo Beto, vamos a la ciudad de Toluca, para participar en la CV Sesión Extraordinaria del Consejo Po… https://t.co/25Qbq5CuK2",3,5,0,0,0,"2016-12-01 08:48:20","2017-03-13 17:16:24",0,0
"1395",804006057261563904,191940022,"Wed Nov 30 16:55:56 +0000 2016","2016-11-30 16:55:56",NA,NA,"","Esta mañana me encuentro en la Décima Reunión Ordinaria de la Comisión de Transparencia y Anticorrupción. Les deseo… https://t.co/OxdEaWBMLD",2,7,0,0,0,"2016-12-01 08:48:29","2017-03-13 08:58:16",0,0
"1396",804774342378815488,191940022,"Fri Dec 02 19:48:49 +0000 2016","2016-12-02 19:48:49",NA,NA,"","RT @DiputadosPRI: Hoy es el Día Internacional para la abolición de la esclavitud. https://t.co/WWahoAv1Zl",56,0,0,0,0,"2016-12-02 18:40:43","2017-03-15 00:17:32",1,1
"1397",804412060893347840,191940022,"Thu Dec 01 19:49:15 +0000 2016","2016-12-01 19:49:15",NA,NA,"","Un gran orgullo el formar parte de la Sesión Solemne de la Conmemoración del Centenario del Inicio del Congreso Con… https://t.co/Q1lw4MOLpv",4,7,0,0,0,"2016-12-02 18:40:43","2017-03-14 09:13:12",0,0
"1398",804840125905702912,191940022,"Sat Dec 03 00:10:13 +0000 2016","2016-12-03 00:10:13",NA,NA,"","Los invito a que me sigan en mis redes sociales! Que pasen un feliz fin de semana. https://t.co/RBgoYKYxFa",3,8,0,0,0,"2016-12-04 06:02:27","2016-12-04 06:02:27",0,0
"1399",806383004763492352,191940022,"Wed Dec 07 06:21:04 +0000 2016","2016-12-07 06:21:04",NA,NA,"","Seguimos #CumpliendoCompromisos con el programa ""Ecatepec + Prendido"" en la col. ciudad Azteca #VamosxMás https://t.co/iHQnq2LmDh",5,8,0,0,0,"2016-12-07 09:21:17","2017-03-15 00:17:32",0,0
"1400",806142925323243520,191940022,"Tue Dec 06 14:27:05 +0000 2016","2016-12-06 14:27:05",NA,NA,"","Buenos días, les comparto parte de las actividades que llevé a cabo este fin de semana  https://t.co/r5HDCjdKST",8,7,0,0,0,"2016-12-07 09:21:18","2017-03-15 00:17:32",0,0
"1401",806004977181167616,191940022,"Tue Dec 06 05:18:56 +0000 2016","2016-12-06 05:18:56",NA,NA,"","RT @alfredodelmazo: @luisfelipevg ¡Te agradezco Diputado, un abrazo!",1,0,0,0,0,"2016-12-07 09:21:25","2017-03-15 00:17:32",1,1
"1402",806564164588146688,191940022,"Wed Dec 07 18:20:56 +0000 2016","2016-12-07 18:20:56",NA,NA,"","Me encuentro con mi compañero y amigo Gabriel Casillas Zanatta en Sesión Ordinaria en la @Mx_Diputados les deseo un… https://t.co/pna1zNosnD",1,3,0,0,0,"2016-12-08 12:07:17","2017-03-15 00:17:32",0,0
"1403",807089318133112832,191940022,"Fri Dec 09 05:07:43 +0000 2016","2016-12-09 05:07:43",NA,NA,"","Esta noche sigo #CumpliendoCompromisos con el programa:""Ecatepec + Prendido"", en el Banco de Sangre Regional las Am… https://t.co/np3ZeNsvpj",2,5,0,0,0,"2016-12-09 11:48:55","2017-03-16 10:22:50",0,0
"1404",807475226686746624,191940022,"Sat Dec 10 06:41:10 +0000 2016","2016-12-10 06:41:10",NA,NA,"","Después de las actividades de hoy, que satisfacción el llegar a casa a darles de cenar y jugar un rato a quienes me… https://t.co/Y6RjkSiKgy",3,7,0,0,0,"2016-12-10 07:44:05","2017-03-16 10:22:50",0,0
"1405",807386255516311552,191940022,"Sat Dec 10 00:47:38 +0000 2016","2016-12-10 00:47:38",NA,NA,"","Muchas felicidades querida @_sandramendez deseo que la estés pasando muy bien !!! Te envío un fuerte abrazo. https://t.co/ImJZBnA4NJ",0,3,0,0,0,"2016-12-10 07:44:12","2017-03-16 10:22:50",0,0
"1406",807776950722985984,191940022,"Sun Dec 11 02:40:07 +0000 2016","2016-12-11 02:40:07",NA,NA,"","Los invito a ver las fotos del partido de hoy con mi amigo @CasillasZanatta https://t.co/5T5aTlPGaM https://t.co/DS4iFlGfg7",6,8,0,0,0,"2016-12-10 21:58:36","2017-03-19 04:58:35",0,0
"1407",807661290307145728,191940022,"Sat Dec 10 19:00:31 +0000 2016","2016-12-10 19:00:31",NA,NA,"","Lamento el fallecimiento del Secretario @rtovarydeteresa gran luchador y promotor de la cultura, mi más sentido pés… https://t.co/rb9CTFvVAN",3,5,0,0,0,"2016-12-10 21:58:43","2017-03-18 15:21:23",0,0
"1408",808161811589517312,191940022,"Mon Dec 12 04:09:25 +0000 2016","2016-12-12 04:09:25",NA,NA,"","EN DIRECTO en #Periscope: Vamos con todo el ánimo a darle  Gracias a la Virgencita. https://t.co/FVJEFqN3zg",6,9,0,0,0,"2016-12-12 03:04:08","2017-03-20 00:54:46",0,0
"1409",807995329496879104,191940022,"Sun Dec 11 17:07:53 +0000 2016","2016-12-11 17:07:53",420432654,807991445160271872,"javovillan2007","Muchas gracias @javovillan2007 deseo de igual manera que pases un bonito domingo!",0,2,0,0,0,"2016-12-12 03:04:16","2017-03-19 04:58:35",0,0
"1410",808265490888007680,191940022,"Mon Dec 12 11:01:24 +0000 2016","2016-12-12 11:01:24",NA,NA,"","Muy agradecido con nuestra Virgencita de Guadalupe por tantas bendiciones. https://t.co/Gt2Qcx8kSs",4,8,0,0,0,"2016-12-12 07:23:53","2017-03-21 05:49:49",0,0
"1411",808837131120549888,191940022,"Wed Dec 14 00:52:54 +0000 2016","2016-12-14 00:52:54",NA,NA,"","Un gusto recibir el día de hoy en mi oficina de la @Mx_Diputados a mi amigo Mauricio Herrera, a quién le agradezco… https://t.co/SIraRMz86b",2,4,0,0,0,"2016-12-14 05:22:10","2017-03-21 05:49:49",0,0
"1412",809234377884520448,191940022,"Thu Dec 15 03:11:25 +0000 2016","2016-12-15 03:11:25",NA,NA,"","Hoy aprobamos distintos dictámenes en pro de la salud de los mexicanos, así mismo fortalecimos las medidas de segur… https://t.co/6IH7vHZAQH",2,5,0,0,0,"2016-12-15 03:00:17","2017-03-22 11:41:59",0,0
"1413",809160965111435264,191940022,"Wed Dec 14 22:19:42 +0000 2016","2016-12-14 22:19:42",2977149124,809079921020727296,"tellachavez","Al contrario @tellachavez el gusto es para un Servidor, que tengas una bonita tarde y buen provecho !!!",0,3,0,0,0,"2016-12-15 03:00:25","2017-03-22 11:41:59",0,0
"1414",809599084487131136,191940022,"Fri Dec 16 03:20:38 +0000 2016","2016-12-16 03:20:38",NA,NA,"","Les deseo pasen una bonita noche!",2,4,0,0,0,"2016-12-15 23:16:48","2017-03-24 01:53:09",0,0
"1415",810176661635395584,191940022,"Sat Dec 17 17:35:43 +0000 2016","2016-12-17 17:35:43",NA,NA,"","RT @oscargabilondo: Un honor conocerte, saludos atentos. https://t.co/r6XBTDMkdB",2,0,0,0,0,"2016-12-18 03:58:41","2017-03-24 01:53:09",1,1
"1416",810996818695684096,191940022,"Mon Dec 19 23:54:43 +0000 2016","2016-12-19 23:54:43",3163105628,810936414464593920,"isabelsedillo59","Me da mucho gusto saberlo @isabelsedillo59 que tengas una bonita tarde!",0,1,0,0,0,"2016-12-19 23:37:40","2017-03-25 19:33:27",0,0
"1417",810934159438794752,191940022,"Mon Dec 19 19:45:44 +0000 2016","2016-12-19 19:45:44",NA,NA,"","Hoy acompañe a mi coordinador y amigo @alfredodelmazo al XLI Aniversario Luctuoso de Don Alfredo del Mazo Vélez, un… https://t.co/HdmTTxyS55",6,7,0,0,0,"2016-12-19 23:37:40","2017-03-25 19:33:27",0,0
"1418",810876030097338368,191940022,"Mon Dec 19 15:54:45 +0000 2016","2016-12-19 15:54:45",NA,NA,"","#MisLunesSonPara expresarles lo entusiasmado que me siento por contar con su amistad. Que tengan un exitoso comienz… https://t.co/D6WGEe39Yy",6,10,0,0,0,"2016-12-19 23:37:47","2017-03-25 19:33:27",0,0
"1419",811428379727724544,191940022,"Wed Dec 21 04:29:35 +0000 2016","2016-12-21 04:29:35",NA,NA,"","Mi solidaridad con la gente de #Tultepec , estamos con ustedes. https://t.co/x0zN8WqRye",19,17,0,0,0,"2016-12-21 02:24:31","2017-03-25 19:33:27",0,0
"1420",812106802414452736,191940022,"Fri Dec 23 01:25:24 +0000 2016","2016-12-23 01:25:24",NA,NA,"","RT @alfredodelmazo: Unidos somos más fuertes. Se avecinan nuevos retos, seguiremos trabajando por tu bienestar y tranquilidad. ¡Felices fie…",153,0,0,0,0,"2016-12-23 02:57:02","2017-03-29 00:54:32",1,1
"1421",811965077733703680,191940022,"Thu Dec 22 16:02:14 +0000 2016","2016-12-22 16:02:14",NA,NA,"","Muy contento de disfrutar de este convivio con mis amigos. Que tengan bonito día.  #Fuerza17 #VamosxMás https://t.co/7o0TzgHz4H",6,9,0,0,0,"2016-12-23 02:57:02","2017-03-29 00:54:32",0,0
"1422",811964866521079808,191940022,"Thu Dec 22 16:01:24 +0000 2016","2016-12-22 16:01:24",NA,NA,"","Hola @isabelsedillo59 muchas gracias a ti por tu apoyo! Que tengas bonito día. https://t.co/6GpBGKwRC9",0,1,0,0,0,"2016-12-23 02:57:02","2017-03-29 00:54:32",0,0
"1423",811964520688209920,191940022,"Thu Dec 22 16:00:01 +0000 2016","2016-12-22 16:00:01",NA,NA,"","Muchas gracias, que tengas bonito día y de igual manera deseo que pases una feliz Navidad y exitoso 2017. https://t.co/NM9A2rTsDT",0,0,0,0,0,"2016-12-23 02:57:10","2017-03-27 23:58:08",0,0
"1424",811840871582879744,191940022,"Thu Dec 22 07:48:41 +0000 2016","2016-12-22 07:48:41",NA,NA,"","Muy contento de poder disfrutar con mis amigos de este convivio de fin de año. #Fuerza17 #VamosxMás https://t.co/L2b4epBfzk",2,6,0,0,0,"2016-12-23 02:57:19","2017-03-27 23:58:08",0,0
"1425",811840725608497152,191940022,"Thu Dec 22 07:48:06 +0000 2016","2016-12-22 07:48:06",NA,NA,"","Muchas gracias Lupita @fenixleyva02 por todo tu apoyo, deseo de igual manera tengas un exitoso 2017. https://t.co/VTGSAsNQs3",0,1,0,0,0,"2016-12-23 02:57:19","2017-03-27 23:58:08",0,0
"1426",812442858393403392,191940022,"Fri Dec 23 23:40:46 +0000 2016","2016-12-23 23:40:46",NA,NA,"","Buenas tardes amigas y amigos, les comparto este #SabíasQue de uno de nuestros patrimonios culturales, me refiero a… https://t.co/pzKMVK93v1",8,4,0,0,0,"2016-12-23 22:01:00","2017-03-29 00:54:32",0,0
"1427",813182826786889728,191940022,"Mon Dec 26 00:41:08 +0000 2016","2016-12-26 00:41:08",NA,NA,"","Una vez concluidas mis actividades domésticas, vamos a ver a las poderosísimas Águilas del América !!! #MiCampeonEs… https://t.co/OLt2EQn2h3",2,6,0,0,0,"2016-12-25 20:27:54","2017-03-29 00:54:32",0,0
"1428",813212700595499008,191940022,"Mon Dec 26 02:39:51 +0000 2016","2016-12-26 02:39:51",NA,NA,"","Goooool, vaaamos, vaaamos Amééérica, esta noche tenemos que ganar ♪♫♬ !!!",1,4,0,0,0,"2016-12-26 00:41:55","2017-03-29 00:54:32",0,0
