"","id_tweet","id_twitter","created_at","created_at_datetime","in_reply_to_user_id","in_reply_to_status_id","in_reply_to_screen_name","text","retweet_count","favorite_count","longitude","latitude","retweeted","creation_date","modification_date","RT_temp","is_retweeted"
"438",649629521746903040,191940022,"Thu Oct 01 16:58:42 +0000 2015","2015-10-01 16:58:42",NA,NA,"","Los #Diputados #Priista de la #LXIIILegislatura aprobaremos un #PresupuestoResponsable en beneficio de los #Mexicanos http://t.co/obChrbcyaf",0,1,0,0,0,"2015-10-01 14:10:08","2016-02-15 22:07:03",0,NA
"439",650844745225273344,191940022,"Mon Oct 05 01:27:34 +0000 2015","2015-10-05 01:27:34",2830152387,650066696795918336,"DelMarMariaJ","Exactamente @DelMarMariaJ ese es el #México que yo también quiero, por lo que te invito a que juntos promovamos y difunfamos la ...",0,2,0,0,0,"2015-10-19 00:25:01","2016-02-16 17:18:39",0,NA
"440",650844950582587392,191940022,"Mon Oct 05 01:28:22 +0000 2015","2015-10-05 01:28:22",NA,NA,"","Ley General para el Control del Tabaco #LibreDeHumo, que tengas una linda noche.",2,2,0,0,0,"2015-10-19 00:25:01","2016-02-16 17:18:39",0,NA
"441",652261325477842944,191940022,"Thu Oct 08 23:16:33 +0000 2015","2015-10-08 23:16:33",557321339,652236205761806336,"RocioDiazPRI","Muchas gracias amiga Diputada @RocioDiazPRI, sé que tú también harás un excelente trabajo como Secretaria de la Comisión del D.F.",0,1,0,0,0,"2015-10-19 00:25:01","2016-02-16 17:18:39",0,NA
"442",652924755855601664,191940022,"Sat Oct 10 19:12:47 +0000 2015","2015-10-10 19:12:47",NA,NA,"","Un gusto acompañar en su registro a nuestro amigo @carlosiriarte_, enhorabuena !!! http://t.co/KEuw2bWkS4",0,1,0,0,0,"2015-10-19 00:25:01","2016-02-16 17:18:39",0,NA
"443",653314374740799488,191940022,"Sun Oct 11 21:00:59 +0000 2015","2015-10-11 21:00:59",3079987323,653275527881453568,"Metro07Moy","Hola @Metro07Moy, como ya te lo hicimos de tú conocimiento vía telefónica requerimos de los oficios para darle seguimiento a tú solicitud,..",0,0,0,0,0,"2015-10-19 00:25:01","2016-02-16 17:18:39",0,NA
"444",653314543733477376,191940022,"Sun Oct 11 21:01:39 +0000 2015","2015-10-11 21:01:39",3079987323,653275527881453568,"Metro07Moy","@Metro07Moy por lo que través de medio te los solicitamos nuevamente, que tengas una linda tarde.",0,1,0,0,0,"2015-10-19 00:25:01","2016-02-16 17:18:39",0,NA
"445",654032457646280704,191940022,"Tue Oct 13 20:34:23 +0000 2015","2015-10-13 20:34:23",NA,NA,"","Muy buenas tardes Amigas y Amigos, les comparto las #ComisionesPRI de la #LXIIILegislatura, de las que formo parte. http://t.co/97UbnnYo0j",1,1,0,0,0,"2015-10-19 00:25:01","2016-02-16 17:18:39",0,NA
"446",654052104227569664,191940022,"Tue Oct 13 21:52:28 +0000 2015","2015-10-13 21:52:28",370300301,654015776060366848,"karinopop","@karinopop Al contrario Karina, el gusto fue para un Servidor, que tengas una hermosa tarde.",0,0,0,0,0,"2015-10-19 00:25:01","2016-02-16 17:18:39",0,NA
"447",654069296109252608,191940022,"Tue Oct 13 23:00:46 +0000 2015","2015-10-13 23:00:46",NA,NA,"","En cumplimiento con mis obligaciones como Dip. Federal, vengo a presentar mi Declaración de Situación Patrimonial. http://t.co/HQpiOFwALi",1,2,0,0,0,"2015-10-19 00:25:01","2016-02-16 17:18:39",0,NA
"448",654097267129892864,191940022,"Wed Oct 14 00:51:55 +0000 2015","2015-10-14 00:51:55",136375506,654057212323713024,"JOVNSMEXIQENSES","@JOVNSMEXIQENSES Muchas gracias y reciban un afectuoso saludo, que tengan una excelente noche.",0,0,0,0,0,"2015-10-19 00:25:01","2016-02-19 10:50:32",0,NA
"449",654098791318945792,191940022,"Wed Oct 14 00:57:59 +0000 2015","2015-10-14 00:57:59",3079987323,654092436226969600,"Metro07Moy","Nada que agradecer @Metro07Moy, como siempre estamos a las órdenes, que tengas una excelente noche.",0,1,0,0,0,"2015-10-19 00:25:01","2016-02-19 10:50:32",0,NA
"450",654309570681044992,191940022,"Wed Oct 14 14:55:32 +0000 2015","2015-10-14 14:55:32",NA,NA,"","Me encuentro en la Instalación de la Comisión de Transparencia y Anticorrupción, les deseo que tengan un hermoso día http://t.co/OBwRdgZ9Ts",1,1,0,0,0,"2015-10-19 00:25:01","2016-02-19 10:50:32",0,NA
"451",654317087653957632,191940022,"Wed Oct 14 15:25:24 +0000 2015","2015-10-14 15:25:24",NA,NA,"","Ahora me encuentro en la Instalación de la Comisión de Cultura y Cinematografía. http://t.co/OEhAG2F5tb",1,2,0,0,0,"2015-10-19 00:25:01","2016-02-19 10:50:32",0,NA
"452",654694074260176896,191940022,"Thu Oct 15 16:23:25 +0000 2015","2015-10-15 16:23:25",NA,NA,"","Me encuentro en la Instalación de la Comisión de la Defensa Nacional, un alto honor fungir como primer Secretario. http://t.co/XpKJIwzdf4",1,4,0,0,0,"2015-10-19 00:25:01","2016-02-19 10:50:32",0,NA
"453",654696247836577792,191940022,"Thu Oct 15 16:32:03 +0000 2015","2015-10-15 16:32:03",NA,NA,"","RT @Ana_Luisa_PRI: Un gusto saludarlos amigos! Dignos representantes del Edo de Mex! Diputados Federales @Susana_Osorno @luisfelipevg http:…",2,0,0,0,0,"2015-10-19 00:25:01","2016-02-19 10:50:32",1,NA
"454",656162945731203072,191940022,"Mon Oct 19 17:40:11 +0000 2015","2015-10-19 17:40:11",NA,NA,"","La #LXIIILegislatura de la Cámara de Diputados, nos sumamos: http://t.co/oJT2xDAHOe",2,1,0,0,0,"2015-10-20 16:07:54","2016-02-19 10:50:32",0,NA
"455",656562524741963776,191940022,"Tue Oct 20 20:07:58 +0000 2015","2015-10-20 20:07:58",NA,NA,"","Los @DiputadosPRI aprobamos con responsabilidad la ""Ley de Ingresos de la Federación para el ejercicio 2016"". https://t.co/u4E1i4FGrq",1,1,0,0,0,"2015-10-21 13:08:14","2016-02-19 10:50:32",0,NA
"456",656920245374849024,191940022,"Wed Oct 21 19:49:26 +0000 2015","2015-10-21 19:49:26",461787734,NA,"GablueHinojosa","@GablueHinojosa Hola Gabriela, fueras tan amable de proporcionarme algún número telefónico por favor.",0,0,0,0,0,"2015-10-23 20:19:13","2016-02-19 10:50:32",0,NA
"457",656975784612007936,191940022,"Wed Oct 21 23:30:07 +0000 2015","2015-10-21 23:30:07",NA,NA,"","Me encuentro en la comparecencia del Secretarío de @SEP_mx @aurelionuno en la @Mx_Diputados https://t.co/gN1dnz1f2F",1,1,0,0,0,"2015-10-23 20:19:13","2016-02-20 05:23:15",0,NA
"458",657720719258742784,191940022,"Sat Oct 24 00:50:13 +0000 2015","2015-10-24 00:50:13",NA,NA,"","Muchas gracias por cuidarnos !!! https://t.co/RvygGEsF2E",1,1,0,0,0,"2015-10-27 18:04:31","2016-02-20 05:23:15",0,NA
"459",659034749273436160,191940022,"Tue Oct 27 15:51:43 +0000 2015","2015-10-27 15:51:43",NA,NA,"","Está mañana iniciamos actividades con la 1era. reunión Ordinaria de la Comisión de Transparencia y Anticorrupción. https://t.co/QwxumpX51E",1,1,0,0,0,"2015-10-27 18:04:31","2016-02-20 05:23:15",0,NA
"460",659813507731353600,191940022,"Thu Oct 29 19:26:13 +0000 2015","2015-10-29 19:26:13",NA,NA,"","El día de hoy por la mañana llevamos a cabo la primera reunión Ordinaria de la Comisión de Defensa Nacional. https://t.co/79W822wfGB",2,4,0,0,0,"2015-10-29 22:12:00","2016-02-22 01:44:16",0,NA
"461",744998332481703936,191940022,"Mon Jun 20 21:00:18 +0000 2016","2016-06-20 21:00:18",183826170,744985483390787584,"josseline_baby","Saludos @josseline_baby que tengas una bonita tarde.",0,1,0,0,0,"2016-06-20 18:48:16","2016-08-29 10:32:30",0,0
"462",744978182667833344,191940022,"Mon Jun 20 19:40:14 +0000 2016","2016-06-20 19:40:14",NA,NA,"","Continuamos entregando vales en la Prim. Lázaro Cárdenas, agradecemos a @eruviel_avila @indalecio_r_v estos apoyos https://t.co/Ud6U48RLfy",6,11,0,0,0,"2016-06-20 18:48:16","2016-08-29 10:32:30",0,0
"463",667539923528847360,191940022,"Fri Nov 20 03:08:14 +0000 2015","2015-11-20 03:08:14",NA,NA,"","Un alto honor el acompañar a nuestro Gobernador, Dr. @eruviel_avila en la presentación del libro José María Morelos https://t.co/qLEfIocMqF",1,2,0,0,0,"2015-11-20 15:57:00","2016-02-22 16:50:39",0,NA
"464",667458507608735744,191940022,"Thu Nov 19 21:44:43 +0000 2015","2015-11-19 21:44:43",NA,NA,"","Acabamos de aprobar de manera unánime la Reforma Constitucional de la Desindexación del Salario Mínimo. https://t.co/Xn3mAbyWQX",1,2,0,0,0,"2015-11-20 15:57:00","2016-02-22 16:50:39",0,NA
"465",667136418293022720,191940022,"Thu Nov 19 00:24:51 +0000 2015","2015-11-19 00:24:51",NA,NA,"","Inicia en la @Mx_Diputados la Comparecencia del Mtro. @VirgilioAndrad, Secretario de la Función Pública. https://t.co/mdJrR6nP0n",1,1,0,0,0,"2015-11-20 15:57:00","2016-02-22 16:50:39",0,NA
"466",665589497887756288,191940022,"Sat Nov 14 17:57:57 +0000 2015","2015-11-14 17:57:57",2492362884,665566619356172288,"NallelyGtzR","@NallelyGtzR Muchas gracias Amiga y de igual forma recibe un afectuoso saludo, que tengas un hermoso día.",0,0,0,0,0,"2015-11-20 15:57:00","2016-02-22 16:50:39",0,NA
"467",665197700602695680,191940022,"Fri Nov 13 16:01:05 +0000 2015","2015-11-13 16:01:05",NA,NA,"","Después de más de 12 hrs., aprobamos responsablemente los @DiputadosPRI el #PEF2016 @Mx_Diputados https://t.co/BtPglV6RMC",2,3,0,0,0,"2015-11-20 15:57:00","2016-02-22 16:50:39",0,NA
"468",669173288694714368,191940022,"Tue Nov 24 15:18:39 +0000 2015","2015-11-24 15:18:39",NA,NA,"","Apunto de iniciar la tercera reunión de junta directiva de la Comisión de Defensa Nacional, les deseo un hermoso día https://t.co/FGCnD394zd",2,3,0,0,0,"2015-11-24 16:29:27","2016-02-22 16:50:39",0,NA
"469",669912649358929920,191940022,"Thu Nov 26 16:16:36 +0000 2015","2015-11-26 16:16:36",NA,NA,"","Me encuentro en la 3ra. reunión ordinaria de la Comisión de Transparencia y Anticorrupcion. https://t.co/Ql4ml8IaWe",1,2,0,0,0,"2015-11-26 13:58:03","2016-02-22 16:50:39",0,NA
"470",669585914478260224,191940022,"Wed Nov 25 18:38:16 +0000 2015","2015-11-25 18:38:16",NA,NA,"","#YaBasta https://t.co/PQNqiZEHAl",1,1,0,0,0,"2015-11-26 13:58:03","2016-02-22 16:50:39",0,NA
"471",671710826609291264,191940022,"Tue Dec 01 15:21:55 +0000 2015","2015-12-01 15:21:55",NA,NA,"","Les deseo un bonito día, al igual que un excelente inicio de mes. https://t.co/WmwzujsuVz",1,1,0,0,0,"2015-12-01 13:55:43","2016-02-24 05:44:06",0,NA
"472",671787219640672256,191940022,"Tue Dec 01 20:25:29 +0000 2015","2015-12-01 20:25:29",NA,NA,"","Hoy iniciamos con una nueva actividad en la cual invitaremos a grupos escolares a la Cámara de Diputados. https://t.co/377HqrQCou",1,1,0,0,0,"2015-12-02 00:20:35","2016-02-26 03:17:01",0,NA
"473",672540322665119744,191940022,"Thu Dec 03 22:18:02 +0000 2015","2015-12-03 22:18:02",NA,NA,"","Nuevamente tenemos el gusto de contar con la visita de una escuela de nuestro querido Municipio. https://t.co/rDwwSJtopb",1,2,0,0,0,"2015-12-03 17:31:40","2016-02-26 03:17:01",0,NA
"474",672473544983314432,191940022,"Thu Dec 03 17:52:41 +0000 2015","2015-12-03 17:52:41",NA,NA,"","Les deseo un bonito día. https://t.co/0qENUwfnpt",1,2,0,0,0,"2015-12-03 17:31:40","2016-02-26 03:17:01",0,NA
"475",673335077816922112,191940022,"Sun Dec 06 02:56:07 +0000 2015","2015-12-06 02:56:07",NA,NA,"","Siempre es muy gratificante el poder acompañar a nuestros amigos en su cumpleaños, Muchas Felicidades Conchita !!! https://t.co/vB8JTS4Pkg",2,1,0,0,0,"2015-12-06 20:04:41","2016-02-26 03:17:01",0,NA
"476",673298390810251264,191940022,"Sun Dec 06 00:30:20 +0000 2015","2015-12-06 00:30:20",NA,NA,"","De igual forma tuve el gusto de saludar a mi amiga Alejandra de la colonia Ciudad Azteca 3a. sección. https://t.co/Ago0TRFcRQ",2,3,0,0,0,"2015-12-06 20:04:41","2016-02-26 03:17:01",0,NA
"477",673291466266050560,191940022,"Sun Dec 06 00:02:49 +0000 2015","2015-12-06 00:02:49",NA,NA,"","Ahora me encuentro con mis Amigos Marcelino y Carmen de la col La Florida Cd. Azteca, que gusto volverlos a saludar https://t.co/aPZsIALESD",2,1,0,0,0,"2015-12-06 20:04:41","2016-02-26 03:17:01",0,NA
"478",673286052426162176,191940022,"Sat Dec 05 23:41:18 +0000 2015","2015-12-05 23:41:18",NA,NA,"","Nuevamente tengo el gusto de visitar, saludar y apoyar a mis amigos Miguel y Belém de la colonia Novela Mexicana 2. https://t.co/djNIflxC6x",2,3,0,0,0,"2015-12-06 20:04:41","2016-02-26 03:17:01",0,NA
"479",672840074862583808,191940022,"Fri Dec 04 18:09:09 +0000 2015","2015-12-04 18:09:09",NA,NA,"","Me encuentro en la @Mx_Diputados en la mesa de trabajo Institucional de la Comisión de Cultura y Cinematografía. https://t.co/TUsRgwkBH6",1,1,0,0,0,"2015-12-06 20:04:41","2016-02-26 03:17:01",0,NA
"480",674306635330818048,191940022,"Tue Dec 08 19:16:44 +0000 2015","2015-12-08 19:16:44",NA,NA,"","Durante la tercera reunión ordinaria de la Comisión de Defensa Nacional. https://t.co/UBoLb31Ki7",1,3,0,0,0,"2015-12-09 01:09:47","2016-02-29 09:38:02",0,NA
"481",675040818651119616,191940022,"Thu Dec 10 19:54:07 +0000 2015","2015-12-10 19:54:07",NA,NA,"","En el pleno de la @Mx_Diputados, acabamos de aprobar la creación de la Secretaría de Cultura. https://t.co/nCWOf3HBbq",6,8,0,0,0,"2015-12-11 00:44:49","2016-02-29 09:38:02",0,NA
"482",674790244172959744,191940022,"Thu Dec 10 03:18:25 +0000 2015","2015-12-10 03:18:25",NA,NA,"","Acabamos de aprobar el dictamen a la iniciativa de decreto para la creación de la Secretaría de Cultura. https://t.co/nx8aRTC0AC",7,5,0,0,0,"2015-12-11 00:44:49","2016-02-29 09:38:02",0,NA
"483",674765239473192960,191940022,"Thu Dec 10 01:39:04 +0000 2015","2015-12-10 01:39:04",NA,NA,"","Me encuentro en la Primera Reunión Extraordinaria de la Comisión de Cultura y Cinematografía, bonita noche. https://t.co/yjWLyi1KeJ",2,2,0,0,0,"2015-12-11 00:44:49","2016-02-29 09:38:02",0,NA
"484",675623854706966528,191940022,"Sat Dec 12 10:30:54 +0000 2015","2015-12-12 10:30:54",NA,NA,"","Por 4to. año consecutivo voy de peregrino a la Basílica para poder Felicitar a nuestra Virgencita de Guadalupe. https://t.co/v1dVnBkyX4",2,4,0,0,0,"2015-12-14 00:33:37","2016-02-29 09:38:02",0,NA
"485",675407302707585024,191940022,"Fri Dec 11 20:10:24 +0000 2015","2015-12-11 20:10:24",NA,NA,"","Les deseo una linda tarde, al igual que un feliz fin de semana. https://t.co/ABuA6SIg4q",1,2,0,0,0,"2015-12-14 00:33:37","2016-02-29 09:38:02",0,NA
"486",679449067869474816,191940022,"Tue Dec 22 23:50:55 +0000 2015","2015-12-22 23:50:55",NA,NA,"","""No hay otra nobleza que la de la virtud, el saber, el patriotismo y la caridad"". Don José María Morelos y Pavón. https://t.co/Twc49wLJ0j",2,3,0,0,0,"2015-12-23 01:19:41","2016-02-29 09:38:02",0,NA
"487",680794104880484352,191940022,"Sat Dec 26 16:55:37 +0000 2015","2015-12-26 16:55:37",NA,NA,"","Ellos son Chocolate y Ron los nuevos integrantes de la familia; les deseo un excelente día sábado. https://t.co/QnibbSvF3N",1,10,0,0,0,"2015-12-27 07:33:33","2016-02-29 09:38:02",0,NA
"488",684061071695593472,191940022,"Mon Jan 04 17:17:23 +0000 2016","2016-01-04 17:17:23",NA,NA,"","Muy buenos días amigas y amigos, les comparto está nota del periódico El Universal, que tengan un hermoso día. https://t.co/VkBFgCcLWM",2,7,0,0,0,"2016-01-04 23:34:25","2016-02-29 09:38:02",0,NA
"489",686746191724441600,191940022,"Tue Jan 12 03:07:05 +0000 2016","2016-01-12 03:07:05",NA,NA,"","Hace unos momentos dimos inicio junto con nuestro amigo @indalecio_r_v, el programa ""Ecatepec + Prendido"". https://t.co/DRHKwptNZX",4,9,0,0,0,"2016-01-12 18:20:38","2016-02-29 09:38:02",0,NA
"490",687350812465577984,191940022,"Wed Jan 13 19:09:38 +0000 2016","2016-01-13 19:09:38",NA,NA,"","Muy buenas y frías tardes, les comparto la entrevista que amablemente me hicieron nuestros amigos de @radiomex https://t.co/ITfKzly8j0",8,10,0,0,0,"2016-01-13 15:35:26","2016-02-29 09:38:02",0,NA
"491",687852721433632768,191940022,"Fri Jan 15 04:24:03 +0000 2016","2016-01-15 04:24:03",NA,NA,"","Ahora me encuentro en Valle de Ecatepec realizando un recorrido para valorar que luminarias debemos de sustituir. https://t.co/Eeb5TlJ1zA",4,7,0,0,0,"2016-01-15 00:25:18","2016-02-29 09:38:02",0,NA
"492",687814999776063488,191940022,"Fri Jan 15 01:54:09 +0000 2016","2016-01-15 01:54:09",NA,NA,"","Me encuentro supervisando la sustitución de luminarias en Jardines de Morelos Quinta Sección #Ecatepec+Prendido https://t.co/JkNO6v5pAJ",4,8,0,0,0,"2016-01-15 00:25:18","2016-02-29 09:38:02",0,NA
"493",688850486158438400,191940022,"Sun Jan 17 22:28:48 +0000 2016","2016-01-17 22:28:48",NA,NA,"","RT @gobmx: La #CinetecaNacional rescata, conserva, restaura, preserva y difunde la obra cinematográfica de México y el mundo.",6,0,0,0,0,"2016-01-17 18:20:44","2016-03-01 17:41:49",1,NA
"494",688832275325136896,191940022,"Sun Jan 17 21:16:26 +0000 2016","2016-01-17 21:16:26",NA,NA,"","Muchas felicidades a la @CinetecaMexico por su aniversario número 42.
 ¡Asiste con tu familia! @cultura_mx https://t.co/DFy09wnaZ5",11,14,0,0,0,"2016-01-17 18:20:44","2016-03-01 17:41:49",0,NA
"495",688761941527904256,191940022,"Sun Jan 17 16:36:58 +0000 2016","2016-01-17 16:36:58",NA,NA,"","Chocolate y Ron disfrutando de un #FelizDomingo y les deseo que el suyo sea igual. https://t.co/8UIEJ2XBQu",5,7,0,0,0,"2016-01-17 18:20:44","2016-03-01 17:41:49",0,NA
"496",688482251101749248,191940022,"Sat Jan 16 22:05:34 +0000 2016","2016-01-16 22:05:34",NA,NA,"","En recorrido por Jardines de Morelos, Quinta Sección, supervisé la sustitución de luminarias  ""Ecatepec+Prendido"" https://t.co/JtxZp9bBDs",18,17,0,0,0,"2016-01-17 18:20:44","2016-03-01 17:41:49",0,NA
"497",688428159650234368,191940022,"Sat Jan 16 18:30:38 +0000 2016","2016-01-16 18:30:38",NA,NA,"","Nuestras familias de #Ecatepec merecen siempre lo mejor, en su amigo Luis Felipe tendrán un aliado. https://t.co/SEUDNjYbIX",17,15,0,0,0,"2016-01-17 18:20:44","2016-03-01 05:20:27",0,NA
"498",688419795524403200,191940022,"Sat Jan 16 17:57:24 +0000 2016","2016-01-16 17:57:24",NA,NA,"","En la Celebración de #DíaDeReyes de la Región V #Ecatepec #Tecámac  @Edomex https://t.co/vTLXGJs01L",22,20,0,0,0,"2016-01-17 18:20:45","2016-03-01 05:20:27",0,NA
"499",688221431193157632,191940022,"Sat Jan 16 04:49:10 +0000 2016","2016-01-16 04:49:10",NA,NA,"","Entregando la rehabilitación de luminaria en calle Acapulco en Jardines de Morelos   #CumpliendoCompromisos https://t.co/arY7htODoP",14,10,0,0,0,"2016-01-17 18:20:45","2016-03-01 05:20:27",0,NA
"500",688189293961990144,191940022,"Sat Jan 16 02:41:28 +0000 2016","2016-01-16 02:41:28",NA,NA,"","Continuamos con la supervisión del programa “Ecatepec + Prendido” en cerrada San Luis Potosí, Jardines de Morelos. https://t.co/a2IWUsZyp5",17,13,0,0,0,"2016-01-17 18:20:45","2016-03-01 05:20:27",0,NA
"501",688181955028848640,191940022,"Sat Jan 16 02:12:18 +0000 2016","2016-01-16 02:12:18",NA,NA,"","¡Muchas Felicidades a todos los compositores en su día! https://t.co/qc5d2LoKXJ",16,13,0,0,0,"2016-01-17 18:20:45","2016-03-01 05:20:27",0,NA
"502",688933840694296576,191940022,"Mon Jan 18 04:00:02 +0000 2016","2016-01-18 04:00:02",NA,NA,"","RT @nachoperaltacol: Gracias Colimenses por su confianza. El triunfo es de tod@s ¡Junt@s construiremos bienestar y más oportunidades! ¡Gana…",1326,0,0,0,0,"2016-01-18 05:53:59","2016-03-01 17:41:49",1,NA
"503",688932284385234944,191940022,"Mon Jan 18 03:53:50 +0000 2016","2016-01-18 03:53:50",NA,NA,"","Muchas felicidades a la sociedad de #Colima que decidió de forma democrática el rumbo de su Estado, un abrazo @nachoperaltacol @PRI_Nacional",14,12,0,0,0,"2016-01-18 05:53:59","2016-03-01 17:41:49",0,NA
"504",689617894024552448,191940022,"Wed Jan 20 01:18:13 +0000 2016","2016-01-20 01:18:13",NA,NA,"","Está noche seguimos supervisando los avances del Programa ""Ecatepec + Prendido"" en la U.H. Valle de Ecatepec https://t.co/GIdY9OfsQk",13,15,0,0,0,"2016-01-20 01:35:07","2016-03-02 16:10:29",0,NA
"505",689615788815200256,191940022,"Wed Jan 20 01:09:51 +0000 2016","2016-01-20 01:09:51",NA,NA,"","RT @eruviel_avila: Para tener #MexiquensesMásSanos inauguramos Centro de Salud Urbano en #ElOro. Consultas y medicamentos son gratuitos htt…",462,0,0,0,0,"2016-01-20 01:35:07","2016-03-02 16:10:29",1,NA
"506",689615645768478720,191940022,"Wed Jan 20 01:09:17 +0000 2016","2016-01-20 01:09:17",NA,NA,"","RT @eruviel_avila: Héroes verdaderos comparten sus hazañas. Este miércoles no se pierdan el 2do capítulo de #RelampagosLaSerie2T. https://t…",542,0,0,0,0,"2016-01-20 01:35:07","2016-03-02 16:10:29",1,NA
"507",689615293191032832,191940022,"Wed Jan 20 01:07:52 +0000 2016","2016-01-20 01:07:52",NA,NA,"","RT @CulturaEdomex: La #PreseaEdoméx2015 en Artes y Letras ""Sor Juana Inés de la Cruz"" busca a mexiquenses destacados ¿Conoces a alguno? htt…",14,0,0,0,0,"2016-01-20 01:35:07","2016-03-02 16:10:29",1,NA
"508",689615125532119040,191940022,"Wed Jan 20 01:07:13 +0000 2016","2016-01-20 01:07:13",NA,NA,"","RT @EduardoGascaP: Trabajando en equipo para brindar las mejores condiciones para q Mexiquenses reciban a @Pontifex_es @eruviel_avila https…",17,0,0,0,0,"2016-01-20 01:35:10","2016-03-02 16:10:29",1,NA
"509",689508140597940224,191940022,"Tue Jan 19 18:02:05 +0000 2016","2016-01-19 18:02:05",NA,NA,"","¡Feliz Martes! Comparto este relevante acontecimiento sobre el Escritor Edgar Allan Poe. 

#LaEfemérideDeHoy https://t.co/TJtBa7cJf9",11,8,0,0,0,"2016-01-20 01:35:10","2016-03-02 16:10:29",0,NA
"510",689497829014769664,191940022,"Tue Jan 19 17:21:07 +0000 2016","2016-01-19 17:21:07",1093549692,689484002248364032,"felixacoltzi","@felixacoltzi saludos Felix, gracias por seguirme en esta red social.",0,0,0,0,0,"2016-01-20 01:35:10","2016-03-02 16:10:29",0,NA
"511",689497756835012608,191940022,"Tue Jan 19 17:20:50 +0000 2016","2016-01-19 17:20:50",NA,NA,"","RT @felixacoltzi: @luisfelipevg Muchas Gracias Diputado, Igualmente, el mejor de los éxitos!",1,0,0,0,0,"2016-01-20 01:35:10","2016-03-02 16:10:29",1,NA
"512",689263778626547712,191940022,"Tue Jan 19 01:51:05 +0000 2016","2016-01-19 01:51:05",NA,NA,"","Seguimos esta noche con el programa “Ecatepec + Prendido” en  unidad Valle de Ecatepec #CumpliendoCompromisos https://t.co/dM9M75dqSu",16,13,0,0,0,"2016-01-20 01:35:10","2016-03-02 16:10:29",0,NA
"513",689203639152279552,191940022,"Mon Jan 18 21:52:07 +0000 2016","2016-01-18 21:52:07",NA,NA,"","Les comparto este dato interesante para las personas que les gusta #Cantar ¡Excelente tarde tuiteros! https://t.co/Cool1QfX9I",10,9,0,0,0,"2016-01-20 01:35:10","2016-03-02 16:10:29",0,NA
"514",689095972966809600,191940022,"Mon Jan 18 14:44:17 +0000 2016","2016-01-18 14:44:17",NA,NA,"","¡Buenos días! Con la mejor actitud, deseo que tengan un exitoso y próspero inicio de semana.",8,8,0,0,0,"2016-01-20 01:35:10","2016-03-01 17:41:49",0,NA
"515",689905037342965760,191940022,"Wed Jan 20 20:19:13 +0000 2016","2016-01-20 20:19:13",NA,NA,"","RT @Mx_Diputados: #Destacados: Emiten la declaratoria de constitucionalidad de #ReformaPolíticaDF #CDMX",30,0,0,0,0,"2016-01-20 16:01:12","2016-03-02 16:10:29",1,NA
"516",689879663116623872,191940022,"Wed Jan 20 18:38:23 +0000 2016","2016-01-20 18:38:23",NA,NA,"","RT @edomex: ¿Ya te registraste? #PreseaEdomex2015 a la Juventud ""Felipe Sánchez Solís"". Más info en https://t.co/mxGDEDkGJW https://t.co/Ps…",52,0,0,0,0,"2016-01-20 16:01:12","2016-03-02 16:10:29",1,NA
"517",689879042107899904,191940022,"Wed Jan 20 18:35:55 +0000 2016","2016-01-20 18:35:55",NA,NA,"","RT @cultura_mx: ¿Eres fotógrafo? Tienes que ver esta convocatoria del @cimagen https://t.co/9nWydhhWKH",24,0,0,0,0,"2016-01-20 16:01:15","2016-03-02 16:10:29",1,NA
"518",689878628218236928,191940022,"Wed Jan 20 18:34:16 +0000 2016","2016-01-20 18:34:16",NA,NA,"","RT @gobmx: Informa @conagua_mx q el #FrenteFrío 32 provocará bajas temperaturas en el norte de México  https://t.co/abfXqoYjJr https://t.co…",26,0,0,0,0,"2016-01-20 16:01:17","2016-03-02 16:10:29",1,NA
"519",689878544390889472,191940022,"Wed Jan 20 18:33:56 +0000 2016","2016-01-20 18:33:56",NA,NA,"","RT @eruviel_avila: Hoy iniciamos la campaña de prevención y combate de incendios forestales y tala clandestina, instalando bases y torres d…",528,0,0,0,0,"2016-01-20 16:01:18","2016-03-02 16:10:29",1,NA
"520",690299572288008192,191940022,"Thu Jan 21 22:26:57 +0000 2016","2016-01-21 22:26:57",NA,NA,"","¡Felicidades a todos los Mariachis hoy en su día! https://t.co/Ovt5dcyhSS",4,7,0,0,0,"2016-01-21 20:17:23","2016-03-05 06:51:15",0,NA
"521",690208822539857920,191940022,"Thu Jan 21 16:26:21 +0000 2016","2016-01-21 16:26:21",NA,NA,"","Gracias al periódico @HoyEstado por la nota que publicó referente al programa “Ecatepec + Prendido” https://t.co/T1hOzUUHUb",17,15,0,0,0,"2016-01-21 20:17:23","2016-03-05 06:51:15",0,NA
"522",689989470670708736,191940022,"Thu Jan 21 01:54:43 +0000 2016","2016-01-21 01:54:43",NA,NA,"","¡Gracias a los vecinos por su confianza!
El programa ""Ecatepec + Prendido"" es una realidad
https://t.co/xLyfB9XDsk 
#CumpliendoCompromisos",16,15,0,0,0,"2016-01-21 20:17:23","2016-03-05 06:51:15",0,NA
"523",689949714251436032,191940022,"Wed Jan 20 23:16:45 +0000 2016","2016-01-20 23:16:45",NA,NA,"","RT @Mx_Diputados: Inicia #CDMX nueva etapa, #ReformaPolíticaDF es último acto del Congreso sobre su régimen interior:@Jesus_ZambranoG -http…",16,0,0,0,0,"2016-01-21 20:17:25","2016-03-05 06:51:15",1,NA
"524",689923462689865728,191940022,"Wed Jan 20 21:32:26 +0000 2016","2016-01-20 21:32:26",NA,NA,"","Les dejo este dato para todos los enamorados, seguramente mas de uno se identificará.¡Buen Provecho! https://t.co/iSrwz8TG1X",11,14,0,0,0,"2016-01-21 20:17:27","2016-03-04 21:55:37",0,NA
"525",690377067838468096,191940022,"Fri Jan 22 03:34:54 +0000 2016","2016-01-22 03:34:54",NA,NA,"","EN DIRECTO en #Periscope: Presentación de un Servidor. https://t.co/L5Vq6uHpqZ",11,8,0,0,0,"2016-01-22 11:12:23","2016-03-05 06:51:15",0,NA
"526",690697064427175936,191940022,"Sat Jan 23 00:46:27 +0000 2016","2016-01-23 00:46:27",NA,NA,"","Que gusto saludar y poder apoyar a la Sra. María Elizabeth Evangelista Cisneros de la col. Izcalli Santa Clara. https://t.co/L2gCOSavpy",12,13,0,0,0,"2016-01-23 07:18:35","2016-03-06 07:35:37",0,NA
