"","id_tweet","id_twitter","created_at","created_at_datetime","in_reply_to_user_id","in_reply_to_status_id","in_reply_to_screen_name","text","retweet_count","favorite_count","longitude","latitude","retweeted","creation_date","modification_date","RT_temp","is_retweeted"
"1404",797635016511537152,108686024,"Sun Nov 13 02:59:41 +0000 2016","2016-11-13 02:59:41",NA,NA,"","Mi propósito es que cada quien que desee estudiar pueda hacerlo  #4AñosPorNayarit",15,16,0,0,0,"2016-11-13 09:33:08","2017-03-13 14:42:11",0,0
"1405",797634825012162560,108686024,"Sun Nov 13 02:58:56 +0000 2016","2016-11-13 02:58:56",NA,NA,"","Mi propósito es que cada quien pueda superarse a sí mismo y alcance la meta que se proponga #4AñosPorNayarit",12,19,0,0,0,"2016-11-13 09:33:08","2017-03-13 08:15:07",0,0
"1406",797633002079535104,108686024,"Sun Nov 13 02:51:41 +0000 2016","2016-11-13 02:51:41",NA,NA,"","Quiero ser apoyo, alguien para confiar, una mano amiga. Hoy desde el Senado, mañana donde Dios y ustedes manden. #4AñosPorNayarit",31,27,0,0,0,"2016-11-13 09:33:08","2017-03-12 19:52:19",0,0
"1407",797632689738162176,108686024,"Sun Nov 13 02:50:27 +0000 2016","2016-11-13 02:50:27",NA,NA,"","Con Amparo tengo 30 años y hemos pasado por las buenas, las malas y las muy malas, pero mi  dicha es indescriptible. #4AñosPorNayarit",12,21,0,0,0,"2016-11-13 09:33:08","2017-03-12 19:52:19",0,0
"1408",797632070310727680,108686024,"Sun Nov 13 02:47:59 +0000 2016","2016-11-13 02:47:59",NA,NA,"","Mucha gente me apoyó en la vida, comenzando por mi esposa Amparo #4AñosPorNayarit",26,21,0,0,0,"2016-11-13 09:33:08","2017-03-10 13:44:17",0,0
"1409",797631870338895872,108686024,"Sun Nov 13 02:47:11 +0000 2016","2016-11-13 02:47:11",NA,NA,"","A los que nos ha tocado luchar, sabemos lo valioso que es salir adelante. #4AñosPorNayarit",23,17,0,0,0,"2016-11-13 09:33:08","2017-03-10 13:44:17",0,0
"1410",797631752483131392,108686024,"Sun Nov 13 02:46:43 +0000 2016","2016-11-13 02:46:43",NA,NA,"","No ha sido fácil. Lo que mas nos cuesta es lo q mas disfrutamos: un título, un 1er carro, un pequeño negocio. #4AñosPorNayarit",25,19,0,0,0,"2016-11-13 09:33:08","2017-03-10 13:44:17",0,0
"1411",797630977866502144,108686024,"Sun Nov 13 02:43:39 +0000 2016","2016-11-13 02:43:39",NA,NA,"","Desde chavo estuve en varios trabajos. Muchos me dijeron que no. Nunca me rendí y aquí estoy para servirles con pasión. #4AñosPorNayarit",40,50,0,0,0,"2016-11-13 09:33:08","2017-03-10 13:44:17",0,0
"1412",797630774400851968,108686024,"Sun Nov 13 02:42:50 +0000 2016","2016-11-13 02:42:50",NA,NA,"","Muchos de nosotros no nacimos en cuna de oro. Nos tocó duro desde temprano, sabemos lo que es levantar una familia. #4AñosPorNayarit",34,23,0,0,0,"2016-11-13 09:33:08","2017-03-10 13:44:17",0,0
"1413",797626114277445632,108686024,"Sun Nov 13 02:24:19 +0000 2016","2016-11-13 02:24:19",NA,NA,"","Mi madre me enseñó, con su ejemplo, a luchar, a no rendirme nunca, a mirar siempre hacia delante #4AñosPorNayarit",33,27,0,0,0,"2016-11-13 09:33:08","2017-03-10 13:44:17",0,0
"1414",797622193836306432,108686024,"Sun Nov 13 02:08:44 +0000 2016","2016-11-13 02:08:44",NA,NA,"","Gracias por escuchar a este nayarita soñador que quiere aportarle lo mejor a su estado. #4AñosPorNayarit",30,20,0,0,0,"2016-11-13 09:33:08","2017-03-10 13:44:17",0,0
"1415",797611454337691648,108686024,"Sun Nov 13 01:26:04 +0000 2016","2016-11-13 01:26:04",NA,NA,"","Sigue la Transmisión en vivo de mi 4to Informe de Actividades. 
https://t.co/qXtB97vXEM",42,37,0,0,0,"2016-11-13 09:33:08","2017-03-10 13:44:17",0,0
"1416",797489457574412288,108686024,"Sat Nov 12 17:21:17 +0000 2016","2016-11-12 17:21:17",NA,NA,"","Como siempre es un gusto saludar a mi querido Pedro Pinto, plática rápida pero muy amena. https://t.co/3U0RL9g3Oy",20,37,0,0,0,"2016-11-13 09:33:12","2017-03-10 13:44:17",0,0
"1417",797168976308662272,108686024,"Fri Nov 11 20:07:49 +0000 2016","2016-11-11 20:07:49",NA,NA,"","En compañía del Dr. @EnriqueOchoaR, clausuramos los trabajos de la 4ta. generación de la Escuela Nacional de Cuadro… https://t.co/7SLIwRd58k",31,47,0,0,0,"2016-11-13 09:33:12","2017-03-10 13:44:17",0,0
"1418",798040157169586176,108686024,"Mon Nov 14 05:49:34 +0000 2016","2016-11-14 05:49:34",NA,NA,"","Mi barrio del Santuario. Un lugar lleno de tantos y tantos recuerdos. https://t.co/YKXqYzQyIT",21,44,0,0,0,"2016-11-14 04:57:32","2017-03-19 04:29:00",0,0
"1419",797916286110093312,108686024,"Sun Nov 13 21:37:21 +0000 2016","2016-11-13 21:37:21",NA,NA,"","Una bonita mañana en #Tepic... Te pareces tanto a mi hija de cabello chinito. 
¡Los niños, una Bendición de Dios! https://t.co/eAxeTS02X9",21,41,0,0,0,"2016-11-14 04:57:32","2017-03-19 04:29:00",0,0
"1420",797850892011716608,108686024,"Sun Nov 13 17:17:30 +0000 2016","2016-11-13 17:17:30",NA,NA,"","No cabe duda que se cosecha lo que siembra, hemos sembrado esperanza y hemos cosechado,grandes bendiciones Gracias… https://t.co/Ha5uakwaWO",37,54,0,0,0,"2016-11-14 04:57:32","2017-03-19 04:29:00",0,0
"1421",799269677755207680,108686024,"Thu Nov 17 15:15:15 +0000 2016","2016-11-17 15:15:15",NA,NA,"","La filosofía es la unificación del pensamiento y la esencia del conocimiento. #DíaMundialDeLaFilosofía
¡Que tengan… https://t.co/qrn8OCNObn",21,30,0,0,0,"2016-11-18 09:15:21","2017-03-19 04:29:00",0,0
"1422",800567995755995136,108686024,"Mon Nov 21 05:14:18 +0000 2016","2016-11-21 05:14:18",NA,NA,"","Hoy disfruté con mi familia y amigos  de la belleza del desfile y exhibición del club de autos antiguos de #Tepic. https://t.co/A8ttPq9X7Z",29,39,0,0,0,"2016-11-21 03:41:50","2017-03-19 04:29:00",0,0
"1423",800790145607733248,108686024,"Mon Nov 21 19:57:03 +0000 2016","2016-11-21 19:57:03",NA,NA,"","Disfrutando al aire libre en compañía de mis amigos, rodamos en bicicleta por la hermosa ciudad de #Tepic  fomentan… https://t.co/k4UmCcawLh",31,56,0,0,0,"2016-11-22 04:12:34","2017-03-19 04:29:00",0,0
"1424",801160041248256000,108686024,"Tue Nov 22 20:26:53 +0000 2016","2016-11-22 20:26:53",NA,NA,"","Acuerdo parlamentario, para elegir al nuevo secretario de la Mesa Directiva derivado de la renuncia de Luis Humbert… https://t.co/C5RGqBp1nE",21,42,0,0,0,"2016-11-22 17:17:51","2017-03-19 04:29:00",0,0
"1425",801134845049110528,108686024,"Tue Nov 22 18:46:46 +0000 2016","2016-11-22 18:46:46",NA,NA,"","Me siento muy contento de asistir a la exposición de pintura del artista Amador Montes del Estado de #Oaxaca. ¡Enho… https://t.co/XerJNuX6wL",14,27,0,0,0,"2016-11-22 17:17:57","2017-03-19 04:29:00",0,0
"1426",801112917051658240,108686024,"Tue Nov 22 17:19:38 +0000 2016","2016-11-22 17:19:38",NA,NA,"","Sesión de la XIX Reunión de la Comisión de Agricultura y Ganadería, para el beneficio de los agricultores y ganader… https://t.co/ll4NNAK00L",16,24,0,0,0,"2016-11-22 17:18:03","2017-03-19 04:29:00",0,0
"1427",801079023166226432,108686024,"Tue Nov 22 15:04:57 +0000 2016","2016-11-22 15:04:57",NA,NA,"","¡Feliz #DíaDelMúsico a todos los grandes talentos de Nayarit y de México!
¿Cuál es tu músico favorito? https://t.co/RDM8Jd0Vyn",21,24,0,0,0,"2016-11-22 17:18:09","2017-03-19 04:29:00",0,0
"1428",801879074834698240,108686024,"Thu Nov 24 20:04:04 +0000 2016","2016-11-24 20:04:04",NA,NA,"","Medalla Belisario Domínguez PostMortem; a Gonzalo Miguel Rivas Cámara .Héroe de la gasolinera de Chilpancingo. QEPD. https://t.co/yMzUovHs6Z",18,36,0,0,0,"2016-11-24 22:33:02","2017-03-19 04:29:00",0,0
"1429",801614571773591552,108686024,"Thu Nov 24 02:33:01 +0000 2016","2016-11-24 02:33:01",NA,NA,"","Toma de Protesta del Ing. León Felipe de Jesús Ramírez Hernandez. https://t.co/89asenZqwj",41,56,0,0,0,"2016-11-24 22:33:02","2017-03-19 04:29:00",0,0
"1430",802213352365768704,108686024,"Fri Nov 25 18:12:22 +0000 2016","2016-11-25 18:12:22",NA,NA,"","Me llena de gusto recibir en mi tierra #Nayarit, a grandes amigos que asisten al 38 Congreso de la Confederación Na… https://t.co/HGPUZhPBJN",35,63,0,0,0,"2016-11-25 23:48:57","2017-03-19 04:29:00",0,0
"1431",802165998140923904,108686024,"Fri Nov 25 15:04:12 +0000 2016","2016-11-25 15:04:12",NA,NA,"","El mundo es mucho más grande que un puño cerrado; unamos fuerzas #DiaContraLaViolenciaDeLaMujer.
#DíaNaranja… https://t.co/W8FNosNTYh",13,15,0,0,0,"2016-11-25 23:49:04","2017-03-19 04:29:00",0,0
"1432",802596294170705920,108686024,"Sat Nov 26 19:34:02 +0000 2016","2016-11-26 19:34:02",NA,NA,"","¡Empezando con un buen desayuno y a trabajar! https://t.co/pbqG9dSJz6",12,24,0,0,0,"2016-11-27 08:14:38","2017-03-19 04:29:00",0,0
"1433",802592964572835840,108686024,"Sat Nov 26 19:20:48 +0000 2016","2016-11-26 19:20:48",NA,NA,"","¡Patria o Muerte! ¡Hasta la victoria siempre! Q.E.P.D. #FidelCasto https://t.co/ymPlyE7wrE",13,35,0,0,0,"2016-11-27 08:14:38","2017-03-19 04:29:00",0,0
"1434",803730309338505216,108686024,"Tue Nov 29 22:40:12 +0000 2016","2016-11-29 22:40:12",NA,NA,"","Esta tarde tuve el honor de estar acompañado de amigos diputados; contando con la presencia del Dr. @CCQ_PRI 
¡Mome… https://t.co/1S4i6Z9Lwd",47,58,0,0,0,"2016-11-30 00:47:28","2017-03-19 04:29:00",0,0
"1435",804344708440924160,108686024,"Thu Dec 01 15:21:37 +0000 2016","2016-12-01 15:21:37",NA,NA,"","#DíaMundialContraElSida 
La detección temprana del VIH es fundamental para proteger tu salud y la de los demás. ¡Pr… https://t.co/WdR4e8vXnJ",22,38,0,0,0,"2016-12-02 13:02:52","2017-03-19 04:29:00",0,0
"1436",805904628151975936,108686024,"Mon Dec 05 22:40:10 +0000 2016","2016-12-05 22:40:10",NA,NA,"","El verdadero éxito está en transformar palabras en realidades e ideas en hechos ¡Felicidades CANACINTRA por su aniversario!
#Canacintra75",17,28,0,0,0,"2016-12-06 03:20:37","2017-03-19 04:29:00",0,0
"1437",805791236594536448,108686024,"Mon Dec 05 15:09:36 +0000 2016","2016-12-05 15:09:36",NA,NA,"","Celebremos la importancia del suelo como base de la agricultura, manteniéndola y cuidando de nuestros ecosistemas.… https://t.co/tJgFpuk7y2",22,39,0,0,0,"2016-12-06 03:20:38","2017-03-19 04:29:00",0,0
"1438",806312779875491840,108686024,"Wed Dec 07 01:42:01 +0000 2016","2016-12-07 01:42:01",NA,NA,"","Esta tarde asisti a firma  de convenio específico de colaboración Chapingo-CNC
¡Seguimos trabajando por el bienesta… https://t.co/lijqXwyYz4",41,60,0,0,0,"2016-12-07 04:16:13","2017-03-19 04:29:00",0,0
"1439",806549714518745088,108686024,"Wed Dec 07 17:23:31 +0000 2016","2016-12-07 17:23:31",NA,NA,"","Esta mañana tuve la oportunidad de estar presente en el Congreso Nacional Arrocero 2016.
¡Vamos por un mejor bienes… https://t.co/q0xEAHWbPt",22,32,0,0,0,"2016-12-08 07:59:17","2017-03-19 04:29:00",0,0
"1440",806952820976992256,108686024,"Thu Dec 08 20:05:19 +0000 2016","2016-12-08 20:05:19",NA,NA,"","Me dio gusto asistir a la Inauguración de la Feria ""México Alimentaria 2016"" contando con la presencia de nuestro p… https://t.co/L8H71RYXQC",27,36,0,0,0,"2016-12-09 07:54:56","2017-03-19 04:29:00",0,0
"1441",806878056560345088,108686024,"Thu Dec 08 15:08:14 +0000 2016","2016-12-08 15:08:14",NA,NA,"","Hoy celebramos la fiesta en honor a la Inmaculada Concepción; se festeja con mucha fe y devoción por todos los Naya… https://t.co/NgZurVRvKF",25,44,0,0,0,"2016-12-09 07:55:03","2017-03-19 04:29:00",0,0
"1442",807240466571919360,108686024,"Fri Dec 09 15:08:19 +0000 2016","2016-12-09 15:08:19",NA,NA,"","Luchemos juntos por la transparencia, es necesaria en todos los ámbitos de nuestra Sociedad y Gobierno.… https://t.co/yYGTzjK1LS",23,38,0,0,0,"2016-12-10 04:39:41","2017-03-19 04:29:00",0,0
"1443",807654047184539648,108686024,"Sat Dec 10 18:31:44 +0000 2016","2016-12-10 18:31:44",NA,NA,"","Descanse en paz, un pilar de la cultura de nuestro país: Rafael Tovar y de Teresa. Me uno a la tristeza que embarga a su familia.",20,34,0,0,0,"2016-12-10 20:03:53","2017-03-19 04:29:00",0,0
"1444",807606767660179456,108686024,"Sat Dec 10 15:23:52 +0000 2016","2016-12-10 15:23:52",NA,NA,"","Tenemos derechos por el hecho de que somos humanos. 
Son tuyos, nuestros y de todos. 
¡Respétalos y hazlos valer!… https://t.co/GBwfSru7LV",22,34,0,0,0,"2016-12-10 20:03:53","2017-03-19 04:29:00",0,0
"1445",808134750754000896,108686024,"Mon Dec 12 02:21:53 +0000 2016","2016-12-12 02:21:53",NA,NA,"","¡Que bonito es ver reunidos a todos los nayaritas en la celebración de nuestra morenita! https://t.co/59qJ2IO1PG",27,60,0,0,0,"2016-12-12 00:28:24","2017-03-19 04:29:00",0,0
"1446",808117791614234624,108686024,"Mon Dec 12 01:14:30 +0000 2016","2016-12-12 01:14:30",NA,NA,"","Una hermosa tradición, nuestra visita al #Pichón https://t.co/1lpXBqtKZq",20,34,0,0,0,"2016-12-12 00:28:24","2017-03-19 04:29:00",0,0
"1447",808325838466850816,108686024,"Mon Dec 12 15:01:12 +0000 2016","2016-12-12 15:01:12",NA,NA,"","Hoy es tu día morenita, y nosotros los mexicanos te festejamos con mucha fe y devoción. ¡Porque eres la madre de Mé… https://t.co/Skz9VrTmvg",22,51,0,0,0,"2016-12-12 14:32:21","2017-03-19 04:29:00",0,0
"1448",808719516255580160,108686024,"Tue Dec 13 17:05:32 +0000 2016","2016-12-13 17:05:32",NA,NA,"","XX Reunión Ordinaria de la Comisión de Agricultura y Ganadería, donde se trataron diferentes temas en beneficio del… https://t.co/93ceXV4ULk",44,62,0,0,0,"2016-12-13 13:39:03","2017-03-19 04:29:00",0,0
"1449",809224975563522048,108686024,"Thu Dec 15 02:34:03 +0000 2016","2016-12-15 02:34:03",NA,NA,"","XXXVlll Sesión Extraordinaria Consejo Político Nacional, donde fue un placer poder saludar a @EnriqueOchoaR. https://t.co/1QoqSmhwFp",63,80,0,0,0,"2016-12-15 00:37:30","2017-03-19 04:29:00",0,0
"1450",810515769373163520,108686024,"Sun Dec 18 16:03:12 +0000 2016","2016-12-18 16:03:12",NA,NA,"","Un fuerte abrazo a todos aquellos, que por situaciones dificiles tienen que dejar su familia, trabajo y ciudad.… https://t.co/zacwwH0XOC",35,65,0,0,0,"2016-12-18 22:54:57","2017-03-19 04:29:00",0,0
"1451",810902572663967744,108686024,"Mon Dec 19 17:40:13 +0000 2016","2016-12-19 17:40:13",NA,NA,"","Encuentro con la Clase Política y la Militancia en el #EdoMex, se realizó la presentación del Delegado del CEN del… https://t.co/on3UlkQkd2",52,69,0,0,0,"2016-12-19 20:50:11","2017-03-19 04:29:00",0,0
"1452",811230246934548480,108686024,"Tue Dec 20 15:22:17 +0000 2016","2016-12-20 15:22:17",NA,NA,"","#Solidaridad no es dar lo que te sobra,
Es dar lo que me realmente te hace falta de todo corazón...… https://t.co/fgP9zMGzjI",23,32,0,0,0,"2016-12-20 13:55:36","2017-03-19 04:29:00",0,0
"1453",811591279494590464,108686024,"Wed Dec 21 15:16:54 +0000 2016","2016-12-21 15:16:54",NA,NA,"","Este día es dedicado a todos nuestros pequeños valientes que nunca pierdan la sonrisa. #DíaNacionalDelNiñoConCáncer. https://t.co/GeYakBParD",48,60,0,0,0,"2016-12-21 21:15:00","2017-03-19 04:29:00",0,0
"1454",811456664788467712,108686024,"Wed Dec 21 06:21:59 +0000 2016","2016-12-21 06:21:59",NA,NA,"","Lamento profundamente la tragedia en #Tultepec. Mi solidaridad con sus familiares y seres queridos.",13,16,0,0,0,"2016-12-21 21:15:00","2017-03-19 04:29:00",0,0
"1455",811455847599579136,108686024,"Wed Dec 21 06:18:44 +0000 2016","2016-12-21 06:18:44",NA,NA,"","Junto al gobernador @RobertoSandoval y a @EnriqueOchoaR, Presidente @PRI_Nacional en la Instalación del Consejo Pol… https://t.co/YWTSphJ1MG",16,22,0,0,0,"2016-12-21 21:15:00","2017-03-19 04:29:00",0,0
"1456",814126060870795264,108686024,"Wed Dec 28 15:09:13 +0000 2016","2016-12-28 15:09:13",NA,NA,"","¿Sabes por qué se celebra el #DíaDeLosSantosInocentes? Te comparto un poco de su historia.
Escribe cuáles bromas co… https://t.co/C5a6KEmIh9",25,37,0,0,0,"2016-12-28 20:15:42","2017-03-19 04:29:00",0,0
"1457",815437794923466752,108686024,"Sun Jan 01 06:01:35 +0000 2017","2017-01-01 06:01:35",NA,NA,"","Reciban mis mejores deseos, que la paz que abunde en sus hogares esta noche sea tan sólo el inicio de un año pleno… https://t.co/n0D9zI2mH6",43,80,0,0,0,"2017-01-01 02:01:19","2017-03-19 04:29:00",0,0
"1458",815476835760959488,108686024,"Sun Jan 01 08:36:43 +0000 2017","2017-01-01 08:36:43",NA,NA,"","¡Un Globo, Un Deseo! Siempre juntos... https://t.co/jEpGwiImKZ",31,44,0,0,0,"2017-01-01 19:35:23","2017-03-19 04:29:00",0,0
"1459",816733535520190464,108686024,"Wed Jan 04 19:50:23 +0000 2017","2017-01-04 19:50:23",NA,NA,"","Enhorabuena y mucho éxito a @mcristina_gc por su nueva encomienda al frente de Secretaria de @cultura_mx.",11,26,0,0,0,"2017-01-05 00:39:28","2017-03-19 04:29:00",0,0
"1460",816727871586783232,108686024,"Wed Jan 04 19:27:53 +0000 2017","2017-01-04 19:27:53",NA,NA,"","Felicito a @LVidegaray quien hoy es nombrado Secretario De Relaciones Exteriores por el Presidente @EPN. Expreso nu… https://t.co/pjioL0lL02",30,41,0,0,0,"2017-01-05 00:39:29","2017-03-19 04:29:00",0,0
"1461",816660463215788032,108686024,"Wed Jan 04 15:00:01 +0000 2017","2017-01-04 15:00:01",NA,NA,"","Nuestro reconocimiento a los que día a día realizan su trabajo con compromiso para informar a toda la sociedad ¡Fel… https://t.co/ryPIHX5eyF",26,36,0,0,0,"2017-01-05 00:39:36","2017-03-19 04:29:00",0,0
"1462",817222269734977536,108686024,"Fri Jan 06 04:12:27 +0000 2017","2017-01-06 04:12:27",NA,NA,"","Me siento complacido de poder asistir al Encuentro Cenecista en compañia del Srio. de la SAGARPA, el Lic. José Calz… https://t.co/KPMSpTmk5d",33,49,0,0,0,"2017-01-05 23:39:37","2017-03-19 04:29:00",0,0
"1463",817208483212886016,108686024,"Fri Jan 06 03:17:40 +0000 2017","2017-01-06 03:17:40",NA,NA,"","Reunión con los Presidentes de Ligas de las 32 Entidades Federativas. ¡Juntos por un mejor bienestar! https://t.co/tAGWtgdBVA",37,57,0,0,0,"2017-01-05 23:39:45","2017-03-19 04:29:00",0,0
"1464",817186734068875264,108686024,"Fri Jan 06 01:51:14 +0000 2017","2017-01-06 01:51:14",NA,NA,"","Esta tarde tuve la oportunidad de reunirme con la estructura de la confederación Nacional Agronómica. https://t.co/3qiJ3Bu5Xk",26,39,0,0,0,"2017-01-05 23:39:45","2017-03-19 04:29:00",0,0
"1465",817176639486513152,108686024,"Fri Jan 06 01:11:07 +0000 2017","2017-01-06 01:11:07",NA,NA,"","¡Los jóvenes siempre contarán conmigo!
Me siento honrado de estar junto a la Estructura de la Vanguardia Juvenil Ag… https://t.co/xfXiwMjckt",44,58,0,0,0,"2017-01-05 23:39:45","2017-03-19 04:29:00",0,0
"1466",817165069360439296,108686024,"Fri Jan 06 00:25:09 +0000 2017","2017-01-06 00:25:09",NA,NA,"","Reunión con la estructura femenil, para impulsar la comercialización de los productos de la Marca Cenecista. https://t.co/j8C024RcZU",25,41,0,0,0,"2017-01-05 23:39:54","2017-03-19 04:29:00",0,0
"1467",817136910661537792,108686024,"Thu Jan 05 22:33:15 +0000 2017","2017-01-05 22:33:15",NA,NA,"","Reunión con alcaldes de la fundación de Municipios Cenecistas, en la celebración del 102 aniversario de la Promulga… https://t.co/3pXfRIQ0EM",27,37,0,0,0,"2017-01-05 23:39:54","2017-03-19 04:29:00",0,0
"1468",817434720963133440,108686024,"Fri Jan 06 18:16:39 +0000 2017","2017-01-06 18:16:39",NA,NA,"","Homenaje con Ofrenda Floral y Guardia de honor en el Faro Monumento a Venustiano Carranza. https://t.co/0MGS0m1A5f",54,86,0,0,0,"2017-01-06 23:57:48","2017-03-19 23:33:03",0,0
"1469",817387104623849472,108686024,"Fri Jan 06 15:07:26 +0000 2017","2017-01-06 15:07:26",NA,NA,"","Feliz #DíaDeReyes para todos, volvamos a celebrar el nacimiento del niño Jesús y disfrutemos una vez más de reunirn… https://t.co/oGmhFWEAXq",27,46,0,0,0,"2017-01-06 23:57:48","2017-03-19 23:33:03",0,0
"1470",817292692463882240,108686024,"Fri Jan 06 08:52:17 +0000 2017","2017-01-06 08:52:17",NA,NA,"","RT @PresidenciaMX: #ENVIVO: Mensaje a la Nación del Presidente @EPN con motivo del inicio de Año 2017. https://t.co/FAlAWb3Kx4 https://t.co…",580,0,0,0,0,"2017-01-06 23:57:57","2017-03-19 04:29:00",1,1
"1471",817261623932948480,108686024,"Fri Jan 06 06:48:49 +0000 2017","2017-01-06 06:48:49",NA,NA,"","Lamento la muerte del obispo emérito Humberto Robles Cota, un gran ser humano, un hombre de fe en Dios. Descanse en paz.",23,38,0,0,0,"2017-01-06 23:58:03","2017-03-19 04:29:00",0,0
"1472",820475733160161280,108686024,"Sun Jan 15 03:40:33 +0000 2017","2017-01-15 03:40:33",NA,NA,"","Fue un placer para mi convivir en la colonia ZITACUA de la etnia Huichol en #Tepic. ¡Bella cultura Nayarita! https://t.co/k90cZajT5d",33,59,0,0,0,"2017-01-14 23:43:53","2017-03-19 23:33:03",0,0
"1473",820647235553783808,108686024,"Sun Jan 15 15:02:02 +0000 2017","2017-01-15 15:02:02",NA,NA,"","¡Feliz #DíaDelCompositor! a todos aquellos que encuentran la inspiración que buscan y la reflejan en sus letras de… https://t.co/jkGq1G99pd",22,44,0,0,0,"2017-01-15 14:25:37","2017-03-19 23:33:03",0,0
"1474",821054406288437248,108686024,"Mon Jan 16 17:59:59 +0000 2017","2017-01-16 17:59:59",NA,NA,"","Toma de protesta de los Magistrados de los Órganos Jurisdiccionales locales en Materia Electoral del Estado de Naya… https://t.co/2mi4Hid6m2",35,63,0,0,0,"2017-01-16 18:48:51","2017-03-19 23:33:03",0,0
"1475",821881391998783488,108686024,"Thu Jan 19 00:46:08 +0000 2017","2017-01-19 00:46:08",NA,NA,"","Esta tarde se realizó Toma de Protesta de los Alcaldes Cenecistas. https://t.co/aCozmulM8t",38,50,0,0,0,"2017-01-18 23:05:59","2017-03-19 23:33:03",0,0
"1476",821831198494203904,108686024,"Wed Jan 18 21:26:41 +0000 2017","2017-01-18 21:26:41",NA,NA,"","Mi solidaridad con las familias de todos los involucrados en este hecho tan lamentable ocurrido en Nuevo León.",22,38,0,0,0,"2017-01-18 23:05:59","2017-03-19 23:33:03",0,0
"1477",823909469977382912,108686024,"Tue Jan 24 15:04:59 +0000 2017","2017-01-24 15:04:59",NA,NA,"","Hoy celebramos la Fiesta en honor a Nuestra #SeñoradeLaPaz en #Bucerías Municipio de #BahíadeBanderas en el Estado… https://t.co/T1vOpAhEiu",27,54,0,0,0,"2017-01-24 20:27:33","2017-03-19 23:33:03",0,0
"1478",831369076878536704,108686024,"Tue Feb 14 05:06:48 +0000 2017","2017-02-14 05:06:48",NA,NA,"","¡Hermoso municipio de San Blas! ¡Muchas gracias por sus muestras de apoyo! #SomosLaFortalezaDeNayarit https://t.co/GNL1JIObXl",30,60,0,0,0,"2017-02-14 08:03:02","2017-04-01 14:53:32",0,0
"1479",824347841086656512,108686024,"Wed Jan 25 20:06:55 +0000 2017","2017-01-25 20:06:55",NA,NA,"","Hoy en el #DíaNaranja vamos unidos por la erradicación de la violencia contra las mujeres. #YaNoMásViolencia https://t.co/0Ua3NFvVIk",22,48,0,0,0,"2017-01-26 03:16:25","2017-03-19 23:33:03",0,0
"1480",825085987223015424,108686024,"Fri Jan 27 21:00:03 +0000 2017","2017-01-27 21:00:03",NA,NA,"","Para llevar una vida saludable debemos tener una buena alimentación. Festejemos a los que hacen de esto posible hoy… https://t.co/NB09lltd1T",33,50,0,0,0,"2017-01-28 00:27:05","2017-03-21 01:00:27",0,0
"1481",824998542657871872,108686024,"Fri Jan 27 15:12:34 +0000 2017","2017-01-27 15:12:34",NA,NA,"","Como cada 27 de Enero Honremos la memoria de las #VíctimasDelHolocausto, recordamos este terrible suceso mediante l… https://t.co/dOfn3WGfNl",38,58,0,0,0,"2017-01-28 00:27:12","2017-03-19 23:33:03",0,0
"1482",826964326716174336,108686024,"Thu Feb 02 01:23:54 +0000 2017","2017-02-02 01:23:54",NA,NA,"","Solo escuchando a quienes trabajan nuestro campo, podremos darle más vida a la tierra que nos vio nacer. https://t.co/7Ve6ySDk3b",36,66,0,0,0,"2017-02-02 03:34:03","2017-03-21 01:00:27",0,0
"1483",827256249712513024,108686024,"Thu Feb 02 20:43:54 +0000 2017","2017-02-02 20:43:54",NA,NA,"","Les comparto que estoy muy contento porque el día de hoy el Senado de la República autorizó mi solicitud de licencia.
¡Vamos por Nayarit!",100,176,0,0,0,"2017-02-02 21:04:00","2017-03-21 01:00:27",0,0
"1484",827359554962722816,108686024,"Fri Feb 03 03:34:24 +0000 2017","2017-02-03 03:34:24",NA,NA,"","Cuando a las mujeres les va bien, a Nayarit le va mejor. https://t.co/ZOhPpkKLac",49,87,0,0,0,"2017-02-03 17:54:51","2017-03-22 05:04:35",0,0
"1485",827342870482939904,108686024,"Fri Feb 03 02:28:06 +0000 2017","2017-02-03 02:28:06",NA,NA,"","Senadora Hilaria Dominguez,  gracias por tu lucha en favor de los nuestros y por tu apoyo en todos los proyectos. https://t.co/SGJx4nOP6z",28,49,0,0,0,"2017-02-03 17:54:51","2017-03-21 01:00:27",0,0
"1486",827739529838686208,108686024,"Sat Feb 04 04:44:17 +0000 2017","2017-02-04 04:44:17",NA,NA,"","Hagamos que Nayarit sea un mar de oportunidades para todos. https://t.co/rRka8uHOaW",70,97,0,0,0,"2017-02-04 05:39:43","2017-03-23 16:49:16",0,0
"1487",827704562861514752,108686024,"Sat Feb 04 02:25:20 +0000 2017","2017-02-04 02:25:20",NA,NA,"","Gracias por permitirme luchar a tu lado por esta causa que llevaré siempre conmigo. ¡Que viva el campo mexicano! ¡Q… https://t.co/7M6UcNVbjD",50,69,0,0,0,"2017-02-04 05:39:43","2017-03-23 16:49:16",0,0
"1488",827702746828595200,108686024,"Sat Feb 04 02:18:07 +0000 2017","2017-02-04 02:18:07",NA,NA,"","Mi gran cariño por #Nayarit, me lleva a buscar la precandidatura a la gubernatura de mi bello estado. https://t.co/mlgCYd9kTU",54,77,0,0,0,"2017-02-04 05:39:46","2017-03-22 05:04:35",0,0
"1489",827701482111717376,108686024,"Sat Feb 04 02:13:05 +0000 2017","2017-02-04 02:13:05",NA,NA,"","Hoy me separe del cargo como presidente del @CEN_CNC, que representé estos últimos años con pasión y entrega. https://t.co/TA3ImjD9FI",78,94,0,0,0,"2017-02-04 05:39:46","2017-03-22 05:04:35",0,0
"1490",827925080164425728,108686024,"Sat Feb 04 17:01:35 +0000 2017","2017-02-04 17:01:35",NA,NA,"","Recuerda que en la lucha contra el cáncer NO ESTÁS SOLO. ¡Yo me uno! #DíaMundialDeLaLuchaContraElCáncer https://t.co/UitXaDGWYu",27,33,0,0,0,"2017-02-04 16:18:26","2017-03-23 16:49:16",0,0
"1491",828084636387516416,108686024,"Sun Feb 05 03:35:37 +0000 2017","2017-02-05 03:35:37",NA,NA,"","Entender a nuestros chavos es entender nuestro futuro. https://t.co/u08cSXGJie",22,52,0,0,0,"2017-02-05 05:45:28","2017-03-23 16:49:16",0,0
