"","id_tweet","id_twitter","created_at","created_at_datetime","in_reply_to_user_id","in_reply_to_status_id","in_reply_to_screen_name","text","retweet_count","favorite_count","longitude","latitude","retweeted","creation_date","modification_date","RT_temp","is_retweeted"
"1",522740926549340160,108686024,"Thu Oct 16 13:28:43 +0000 2014","2014-10-16 13:28:43",NA,NA,"","RT @AlexRomeroSanch: En el #DiaMundialdelaAlimentacion hay que alimentar al mundo, cuidar nuestro planeta @ManuelCota @Mely_Romero @ruben_e…",9,0,0,0,0,"2015-05-28 19:19:10","2015-05-28 19:44:02",1,NA
"2",522745281818152960,108686024,"Thu Oct 16 13:46:01 +0000 2014","2014-10-16 13:46:01",NA,NA,"","Hoy es una importante fecha. Los Cenecistas trabajamos día a día cultivando los alimentos para toda una Nación #DíaMundialdelaAlimentación",137,9,0,0,0,"2015-05-28 19:19:10","2015-06-03 14:36:31",0,NA
"3",522746331417567232,108686024,"Thu Oct 16 13:50:12 +0000 2014","2014-10-16 13:50:12",NA,NA,"","En @CNC_CEN, sus Diputados y Senadores trabajaremos con @EPN para garantizar la seguridad alimentaria #DíaMundialdelaAlimentación",128,8,0,0,0,"2015-05-28 19:19:10","2015-06-05 10:27:14",0,NA
"4",522747256731344896,108686024,"Thu Oct 16 13:53:52 +0000 2014","2014-10-16 13:53:52",NA,NA,"","Los Productores de @CNC_CEN se están preparando cada día para producir no sólo en cantidad sino con calidad #DíaMundialdelaAlimentación",149,12,0,0,0,"2015-05-28 19:19:10","2015-06-05 10:27:14",0,NA
"5",522749053034315776,108686024,"Thu Oct 16 14:01:01 +0000 2014","2014-10-16 14:01:01",NA,NA,"","RT @Liliana01: Luchando juntos por un México sin hambre #DiaMundialdelaAlimentacion @Rosario_Robles_ @ManuelCota CNC_CEN @Mely_Romero @Rube…",48,0,0,0,0,"2015-05-28 19:19:10","2015-06-05 10:27:14",1,NA
"6",522750455164964864,108686024,"Thu Oct 16 14:06:35 +0000 2014","2014-10-16 14:06:35",NA,NA,"","RT @KarlaEVM: Una mente exitosa, es el resultado de una buena alimentación #DiaMundialdelaAlimentacion. @ManuelCota @CNC_CEN http://t.co/ab…",24,0,0,0,0,"2015-05-28 19:19:10","2015-06-05 10:27:14",1,NA
"7",523103095749107712,108686024,"Fri Oct 17 13:27:51 +0000 2014","2014-10-17 13:27:51",NA,NA,"","Hoy es el #DíaInternacionalParaLaErradicacióndelaPobreza , un gran compromiso de nuestro Presidente @EPN @Senado_PRI y @DiputadosPRI",139,13,0,0,0,"2015-05-28 19:19:10","2015-06-07 21:57:03",0,NA
"8",523104861882425344,108686024,"Fri Oct 17 13:34:52 +0000 2014","2014-10-17 13:34:52",NA,NA,"","En CNC estamos trabajando para q el campo no sea sinónimo de pobreza, sino de desarrollo #DíaInternacionalParaLaErradicacióndelaPobreza",144,17,0,0,0,"2015-05-28 19:19:10","2015-06-16 09:49:38",0,NA
"9",523105668719718400,108686024,"Fri Oct 17 13:38:04 +0000 2014","2014-10-17 13:38:04",NA,NA,"","Para nuestro Presidente @EPN  @Prospera_MX y @SinHambreMx son los ejes del desarrollo social #DíaInternacionalParaLaErradicacióndelaPobreza",138,15,0,0,0,"2015-05-28 19:19:10","2015-06-17 00:06:28",0,NA
"10",523201510608744448,108686024,"Fri Oct 17 19:58:55 +0000 2014","2014-10-17 19:58:55",NA,NA,"","RT @CNCCoahuila: Productores de algodón de la Laguna en reunión de trabajo con el sen. @ManuelCota    @rubenmoreiravdz @aguillondavid http:…",24,0,0,0,0,"2015-05-28 19:19:09","2015-06-17 00:06:28",1,NA
"11",523240075208171520,108686024,"Fri Oct 17 22:32:09 +0000 2014","2014-10-17 22:32:09",NA,NA,"","Acompañando a la Unión Nacional de Productores de Cacahuate en Asamblea Constitutiva como Rama de Producción @CNC_CEN http://t.co/Um0DUGpwqJ",31,7,0,0,0,"2015-05-28 19:19:09","2015-06-20 23:48:31",0,NA
"12",523242886037786624,108686024,"Fri Oct 17 22:43:20 +0000 2014","2014-10-17 22:43:20",NA,NA,"","La Unión Nacional de Productores de Cacahuate es la primera Rama de Producción que nace en esta admon http://t.co/mDfTQEV34y",38,9,0,0,0,"2015-05-28 19:19:09","2015-06-25 10:14:35",0,NA
"13",523637593993666560,108686024,"Sun Oct 19 00:51:45 +0000 2014","2014-10-19 00:51:45",NA,NA,"","RT @BCEjidos: @ManuelCota celebramos su presencia en Baja California y agradecemos su apoyo a los temas planteados. Saludos!! http://t.co/1…",14,0,0,0,0,"2015-05-28 19:19:09","2015-06-25 10:14:35",1,NA
"14",523639692068413440,108686024,"Sun Oct 19 01:00:06 +0000 2014","2014-10-19 01:00:06",NA,NA,"","La Unidad de los Cenecistas de BC es muestra del gran compromiso para trabajar en #AccionesParaReformarElCampo http://t.co/OC90ooEspK",102,16,0,0,0,"2015-05-28 19:19:09","2015-06-25 10:14:35",0,NA
"15",524533968176422912,108686024,"Tue Oct 21 12:13:38 +0000 2014","2014-10-21 12:13:38",NA,NA,"","Les deseo excelente Martes a mis amigos de esta Red Social, Gracias por estar atentos a mis publicaciones. Saludos!!",25,19,0,0,0,"2015-05-28 19:19:09","2015-06-25 10:14:35",0,NA
"16",524635349642141696,108686024,"Tue Oct 21 18:56:29 +0000 2014","2014-10-21 18:56:29",NA,NA,"","Hoy 21 de octubre se celebra el #DiaMundialdelAhorrodeEnergia ¡Hagamos conciencia y cuidemos nuestra energía! http://t.co/LO36pnP1A6",117,14,0,0,0,"2015-05-28 19:19:09","2015-06-25 10:14:35",0,NA
"17",524636700057026560,108686024,"Tue Oct 21 19:01:51 +0000 2014","2014-10-21 19:01:51",108686024,524635349642141696,"ManuelCota","En @CNC_CEN impulsamos la generación de energías limpias, teniendo como eje el desarrollo rural sustentable #DíaMundialdelAhorrodeEnergía",101,9,0,0,0,"2015-05-28 19:19:09","2015-06-25 10:14:35",0,NA
"18",524745579281539072,108686024,"Wed Oct 22 02:14:30 +0000 2014","2014-10-22 02:14:30",NA,NA,"","Como Presidente de la Comisión de Agricultura presenté el Punto de Acuerdo para apoyar a productores de café y frijol http://t.co/0zBbMqpweJ",73,13,0,0,0,"2015-05-28 19:19:09","2015-06-30 13:18:30",0,NA
"19",524939267005751296,108686024,"Wed Oct 22 15:04:08 +0000 2014","2014-10-22 15:04:08",NA,NA,"","En Reunión con los distinguidos integrantes de la Comisión de Honor y Justicia de @CNC_CEN http://t.co/BxkImsafXT",99,16,0,0,0,"2015-05-28 19:19:09","2015-07-01 10:09:11",0,NA
"20",524974070954463232,108686024,"Wed Oct 22 17:22:26 +0000 2014","2014-10-22 17:22:26",NA,NA,"","Importante Reunión de Planeación para gestión de Proyectos de Capacitación para los Equipos Técnicos de CNC. http://t.co/xiOdKhRLBJ",61,11,0,0,0,"2015-05-28 19:19:09","2015-07-01 10:09:11",0,NA
"21",525013010822475776,108686024,"Wed Oct 22 19:57:10 +0000 2014","2014-10-22 19:57:10",NA,NA,"","Gran evento de la Vieja Guardia Agrarista, A.C son ejemplo de Historia de Lucha, y Compromiso con @CNC_CEN y el campo http://t.co/PInJqoSV1M",98,14,0,0,0,"2015-05-28 19:19:09","2015-07-01 10:09:11",0,NA
"22",525279100689469440,108686024,"Thu Oct 23 13:34:31 +0000 2014","2014-10-23 13:34:31",NA,NA,"","Gran labor de las mujeres y hombres médicos de México. Su dedicación construirá una sociedad saludable #DíaDelMédico http://t.co/mdtaga3KSv",138,18,0,0,0,"2015-05-28 19:19:09","2015-07-01 10:09:11",0,NA
"23",526405581515812864,108686024,"Sun Oct 26 16:10:45 +0000 2014","2014-10-26 16:10:45",NA,NA,"","Les deseo un excelente Domingo en #HorariodeInvierno http://t.co/SMb3sCapaT",27,9,0,0,0,"2015-05-28 19:19:09","2015-07-02 00:14:41",0,NA
"24",526754356226691072,108686024,"Mon Oct 27 15:16:39 +0000 2014","2014-10-27 15:16:39",NA,NA,"","RT @IAgraristaMX: Hoy se conmemora el 165 aniversario de la #ErecciónDelEstadoDeGuerrero @ManuelCota @CNC_CEN @CesarSilerio http://t.co/eD8…",51,0,0,0,0,"2015-05-28 19:19:09","2015-07-02 00:14:41",1,NA
"25",526928785346920448,108686024,"Tue Oct 28 02:49:46 +0000 2014","2014-10-28 02:49:46",NA,NA,"","RT @tomas_drago: En Reunión de @CNC_CEN con nuestro Líder y Presidente Sen. @ManuelCota para trabajar en #AccionesParaReformarElCampo http:…",16,0,0,0,0,"2015-05-28 19:19:09","2015-07-02 00:14:41",1,NA
"26",527243584547082240,108686024,"Tue Oct 28 23:40:40 +0000 2014","2014-10-28 23:40:40",NA,NA,"","Trabajando en la Comisión de Agricultura y Asuntos Agrarios del Consejo Político Nacional de mi partido http://t.co/rwEhKZ0Ps8",121,17,0,0,0,"2015-05-28 19:19:09","2015-07-02 00:14:41",0,NA
"27",527534639855185920,108686024,"Wed Oct 29 18:57:13 +0000 2014","2014-10-29 18:57:13",NA,NA,"","RT @sergiobalboa1: Es el altar de muertos ganador del concurso de altares @CNC_CEN @ManuelCota @Tomasgloria @JMANUELV5 @FENAPROT_AC http://…",49,0,0,0,0,"2015-05-28 19:19:09","2015-07-02 00:14:41",1,NA
"28",527994474203742208,108686024,"Fri Oct 31 01:24:26 +0000 2014","2014-10-31 01:24:26",NA,NA,"","Hoy en la Reunión de Capacitación del Movimiento @IAgraristaMX  en Estrategia Digital e Innovación para el Campo http://t.co/9G1qp4jEO3",28,17,0,0,0,"2015-05-28 19:19:09","2015-07-06 16:35:44",0,NA
"29",529436693041274880,108686024,"Tue Nov 04 00:55:18 +0000 2014","2014-11-04 00:55:18",NA,NA,"","RT @CNC_CEN: La CNC crea al Movimiento @IAgraristaMX, organismo especializado en la Estrategia Digital y TIC para el Campo http://t.co/wmU5…",170,0,0,0,0,"2015-05-28 19:19:09","2015-07-06 16:35:44",1,NA
"30",529809287028441088,108686024,"Wed Nov 05 01:35:52 +0000 2014","2014-11-05 01:35:52",NA,NA,"","Saliendo de la Reunión de la Comisión de Agricultura y Asuntos Agrarios del Consejo Político Nacional del @PRI_Nacional",39,14,0,0,0,"2015-05-28 19:19:09","2015-07-06 21:41:20",0,NA
"31",529839673968193536,108686024,"Wed Nov 05 03:36:36 +0000 2014","2014-11-05 03:36:36",NA,NA,"","RT @CNC_CEN: Convocatorias http://t.co/si1Vw0URQd",96,0,0,0,0,"2015-05-28 19:19:09","2015-07-06 21:41:20",1,NA
"32",530892399376347136,108686024,"Sat Nov 08 01:19:46 +0000 2014","2014-11-08 01:19:46",NA,NA,"","Hoy en el Primer Consejo Político y Desarrollo Rural de @CNC_CEN, bien dirigido por mi amigo @JoseAntonioRojo http://t.co/UOpkaO28es",41,16,0,0,0,"2015-05-28 19:19:09","2015-07-07 13:56:03",0,NA
"33",530951779572518912,108686024,"Sat Nov 08 05:15:43 +0000 2014","2014-11-08 05:15:43",NA,NA,"","Posterior al Consejo Político, platiqué con los Líderes,  y acudí a la Capacitación de los Futuros Delegados CNC http://t.co/x8czbW7yad",32,12,0,0,0,"2015-05-28 19:19:09","2015-07-07 13:56:03",0,NA
"34",530951842105409536,108686024,"Sat Nov 08 05:15:58 +0000 2014","2014-11-08 05:15:58",NA,NA,"","RT @susy_dlsl: Sólo hay un secreto: dar siempre hasta la última gota. #Motivación @dip_patyaraujo @ManuelCota @ruben_escajeda http://t.co/M…",12,0,0,0,0,"2015-05-28 19:19:09","2015-07-07 13:56:03",1,NA
"35",531244365562540032,108686024,"Sun Nov 09 00:38:21 +0000 2014","2014-11-09 00:38:21",NA,NA,"","Hoy acudí a la Toma de Protesta de 84 Comités Municipales de @CNC_Hidalgo en compañía de mi amigo @Paco_Olvera http://t.co/uU79AjCmJE",86,12,0,0,0,"2015-05-28 19:19:09","2015-07-08 18:13:22",0,NA
"36",531800409598599168,108686024,"Mon Nov 10 13:27:52 +0000 2014","2014-11-10 13:27:52",NA,NA,"","RT @AlexRomeroSanch: Hoy 10 de noviembre es declarado por la UNESCO como el #DiaMundialdelaCiencia @ManuelCota @CNC_CEN @CesarSilerio http:…",16,0,0,0,0,"2015-05-28 19:19:09","2015-07-08 18:13:22",1,NA
"37",531801408832802816,108686024,"Mon Nov 10 13:31:50 +0000 2014","2014-11-10 13:31:50",NA,NA,"","Les deseo un Excelente Lunes y una exitosa semana.",22,10,0,0,0,"2015-05-28 19:19:09","2015-07-09 17:29:59",0,NA
"38",531959656357572608,108686024,"Tue Nov 11 00:00:40 +0000 2014","2014-11-11 00:00:40",NA,NA,"","RT @Senado_PRI: #Boletín Es necesario que la @SAGARPA_mx  actúe para evitar un mayor perjuicio a los productores mexicanos: @ManuelCota",26,0,0,0,0,"2015-05-28 19:19:09","2015-07-13 15:18:58",1,NA
"39",531960150421417984,108686024,"Tue Nov 11 00:02:37 +0000 2014","2014-11-11 00:02:37",NA,NA,"","RT @Senado_PRI: #Boletín @Mely_Romero @ManuelCota y @Gerardo_Sanchz_ piden apoyar a productores ante la caída del precio del maíz http://t.…",26,0,0,0,0,"2015-05-28 19:19:09","2015-07-13 15:18:58",1,NA
"40",532206256560537600,108686024,"Tue Nov 11 16:20:34 +0000 2014","2014-11-11 16:20:34",NA,NA,"","Hoy en la Apertura de la Capacitación para Presidentes Municipales Rurales. Gran éxito. http://t.co/CVpdtfbVtR",120,22,0,0,0,"2015-05-28 19:19:09","2015-07-13 15:18:58",0,NA
"41",532329828603543552,108686024,"Wed Nov 12 00:31:36 +0000 2014","2014-11-12 00:31:36",NA,NA,"","Llegando a la 2a. Reunión de la Comisión de Agricultura y Asuntos Agrarios del Consejo Político del @PRI_Nacional http://t.co/uKcDtBFYfd",29,9,0,0,0,"2015-05-28 19:19:09","2015-07-13 15:18:58",0,NA
"42",532571217715560448,108686024,"Wed Nov 12 16:30:47 +0000 2014","2014-11-12 16:30:47",NA,NA,"","RT @CNC_CEN: Hoy los Cenecistas Conmemoramos el Aniversario Luctuoso de nuestro Fundador, Graciano Sánchez Romo. http://t.co/0HcUj2bYDZ",74,0,0,0,0,"2015-05-28 19:19:09","2015-07-13 15:18:58",1,NA
"43",532655247098146816,108686024,"Wed Nov 12 22:04:41 +0000 2014","2014-11-12 22:04:41",NA,NA,"","Hoy en el @senadomexicano rendimos un Homenaje Póstumo al Ing. Luis Ernesto Miramontes Cárdenas, inventor de la Píldora Anticonceptiva.",100,13,0,0,0,"2015-05-28 19:19:09","2015-07-13 15:18:58",0,NA
"44",532656420119126016,108686024,"Wed Nov 12 22:09:21 +0000 2014","2014-11-12 22:09:21",NA,NA,"","Fotos del Homenaje Póstumo al Ing. Luis Ernesto Miramontes Cárdenas, inventor de la Píldora Anticonceptiva. http://t.co/vrPsTbu9Oc",132,18,0,0,0,"2015-05-28 19:19:09","2015-07-13 15:18:58",0,NA
"45",532950385414389760,108686024,"Thu Nov 13 17:37:28 +0000 2014","2014-11-13 17:37:28",NA,NA,"","Esta mañana iniciamos la XIV Reunión de la Comisión de Agricultura y Ganadería, relevantes temas del campo mexicano. http://t.co/v5iI57rcLq",56,11,0,0,0,"2015-05-28 19:19:09","2015-07-13 15:18:58",0,NA
"46",533060688529600512,108686024,"Fri Nov 14 00:55:46 +0000 2014","2014-11-14 00:55:46",NA,NA,"","RT @PRI_Nacional: Es urgente el relanzamiento del campo: @ManuelCota @CNC_CEN  http://t.co/9eZzOV3QC6 #ComunicadeoPRI. http://t.co/KQF2aDMn…",49,0,0,0,0,"2015-05-28 19:19:09","2015-07-13 15:18:58",1,NA
"47",533075236452057088,108686024,"Fri Nov 14 01:53:35 +0000 2014","2014-11-14 01:53:35",NA,NA,"","Felicito al nuevo presidente de la @CNDH Luis Raúl González Pérez, su candidatura fue aprobada por el @senadomexicano http://t.co/MJnx3UZWwD",29,10,0,0,0,"2015-05-28 19:19:09","2015-07-20 22:23:54",0,NA
"48",534871148992135168,108686024,"Wed Nov 19 00:49:54 +0000 2014","2014-11-19 00:49:54",NA,NA,"","RT @RoberDeAlba: Hace unos momentos tomé protesta como nuevo Consejero Político Nacional de PRI, representando a mi Sector #CNC @ManuelCota…",12,0,0,0,0,"2015-05-28 19:19:09","2015-07-20 22:23:54",1,NA
"49",534874944778547200,108686024,"Wed Nov 19 01:04:58 +0000 2014","2014-11-19 01:04:58",NA,NA,"","En la XXXI Sesión Extraordinaria del Consejo Político Nacional del @PRI_Nacional http://t.co/eSjPcLW0bP",40,14,0,0,0,"2015-05-28 19:19:09","2015-07-20 22:23:54",0,NA
"50",535150109957578752,108686024,"Wed Nov 19 19:18:23 +0000 2014","2014-11-19 19:18:23",NA,NA,"","En SAGARPA, en la Presentación  del Presupuesto Agroalimentario 2015,  con los Srios. @LVidegaray y @Enrique_MtzyMtz http://t.co/EwZlCnMyRe",32,16,0,0,0,"2015-05-28 19:19:09","2015-07-20 22:23:54",0,NA
"51",535309586207866880,108686024,"Thu Nov 20 05:52:05 +0000 2014","2014-11-20 05:52:05",NA,NA,"","Hoy en la Presentación del Libro Biográfico  del Lic. Maximiliano Silerio Esparza,  ""El Águila, la Roca y el Poder"" http://t.co/oQ0vyAt7OL",22,15,0,0,0,"2015-05-28 19:19:09","2015-07-20 22:23:54",0,NA
"52",535507801989464064,108686024,"Thu Nov 20 18:59:43 +0000 2014","2014-11-20 18:59:43",NA,NA,"","En @CNC_CEN estrenamos la radio en línea 'La Campesina', los invitamos a escucharnos!! http://t.co/gOgQ8qC1iS http://t.co/MzRraExeuK",133,27,0,0,0,"2015-05-28 19:19:09","2015-07-20 22:23:54",0,NA
"53",535509296646455296,108686024,"Thu Nov 20 19:05:40 +0000 2014","2014-11-20 19:05:40",NA,NA,"","La Estación de Radio Digital ""La Campesina"" será un espacio que irá evolucionando. Los Invitamos a escucharnos! http://t.co/YA2J1rwPel",124,19,0,0,0,"2015-05-28 19:19:09","2015-07-20 22:23:54",0,NA
"54",535517128192184320,108686024,"Thu Nov 20 19:36:47 +0000 2014","2014-11-20 19:36:47",NA,NA,"","Los Cenecistas conmemoramos un aniversario más de la #RevoluciónMexicana con #AccionesParaReformarElCampo http://t.co/jQakRp5WIv",114,28,0,0,0,"2015-05-28 19:19:09","2015-07-20 22:23:54",0,NA
"55",537294301940965376,108686024,"Tue Nov 25 17:18:38 +0000 2014","2014-11-25 17:18:38",NA,NA,"","RT @AlexRomeroSanch: somos más ...... unidad por México #respaldoaEPN @IAgraristaMX @EPN @CCQ_PRI @ManuelCota @ruben_escajeda @CNC_CEN http…",15,0,0,0,0,"2015-05-28 19:19:08","2015-07-20 22:23:54",1,NA
"56",537298957471604736,108686024,"Tue Nov 25 17:37:08 +0000 2014","2014-11-25 17:37:08",NA,NA,"","RT @danieluxcruz: Visita ahora @LaCampesinaMX órgano oficial de difusión @CNC_CEN http://t.co/TXtiS5mnUB @ManuelCota @CesarSilerio http://t…",19,0,0,0,0,"2015-05-28 19:19:08","2015-07-20 22:23:54",1,NA
"57",537708845150130176,108686024,"Wed Nov 26 20:45:53 +0000 2014","2014-11-26 20:45:53",NA,NA,"","Felicito afectuosamente a mi amiga @IvonneOP Secretaria General del @PRI_Nacional, con motivo de su cumpleaños.",16,8,0,0,0,"2015-05-28 19:19:08","2015-07-20 22:23:54",0,NA
"58",537717263428628480,108686024,"Wed Nov 26 21:19:20 +0000 2014","2014-11-26 21:19:20",NA,NA,"","RT @CCQ_PRI: Partido unido, el PRI es partido convocante que busca estrechar lazos con los aliados de México, como los que integran la @cir…",128,0,0,0,0,"2015-05-28 19:19:08","2015-07-25 20:52:12",1,NA
"59",538080323293024256,108686024,"Thu Nov 27 21:22:00 +0000 2014","2014-11-27 21:22:00",NA,NA,"","Punto #1 del Presidente EPN:
Ley Contra la Infiltración del Crimen Organizado en las autoridades municipales.
#PorUnMexicoEnPaz",98,15,0,0,0,"2015-05-28 19:19:08","2015-07-25 20:52:12",0,NA
"60",538082672887611392,108686024,"Thu Nov 27 21:31:20 +0000 2014","2014-11-27 21:31:20",NA,NA,"","Punto #2 del Presidente EPN:
Iniciativa para redefinir la competencia de cada autoridad en el combate al delito.
#PorUnMexicoEnPaz",95,10,0,0,0,"2015-05-28 19:19:08","2015-07-28 22:51:30",0,NA
"61",538082715523092480,108686024,"Thu Nov 27 21:31:31 +0000 2014","2014-11-27 21:31:31",NA,NA,"","RT @SEMARNAT_mx: La paz también se construye con desarrollo; nos corresponde a todos darle prioridad al sur de @Mexico: @EPN, #PorUnMéxicoE…",48,0,0,0,0,"2015-05-28 19:19:08","2015-07-28 22:51:30",1,NA
"62",538085559650889728,108686024,"Thu Nov 27 21:42:49 +0000 2014","2014-11-27 21:42:49",NA,NA,"","Punto #3 del Presidente @EPN:
Creación obligatoria de policías únicas estatales.
#PorUnMéxicoEnPaz",102,16,0,0,0,"2015-05-28 19:19:08","2015-07-28 22:51:30",0,NA
"63",538088552832049152,108686024,"Thu Nov 27 21:54:42 +0000 2014","2014-11-27 21:54:42",NA,NA,"","Punto #4 del Presidente @EPN:
Un número nacional para emergencias: el 911, por ser el más reconocido a nivel mundial.
#PorUnMéxicoEnPaz",95,13,0,0,0,"2015-05-28 19:19:08","2015-07-28 22:51:30",0,NA
"64",538090231892017152,108686024,"Thu Nov 27 22:01:23 +0000 2014","2014-11-27 22:01:23",NA,NA,"","Punto 5 #PorUnMéxicoEnPaz se impulsará el establecimiento de una Clave Única de identidad personal.""",90,9,0,0,0,"2015-05-28 19:19:08","2015-07-28 22:51:30",0,NA
"65",538090432815960064,108686024,"Thu Nov 27 22:02:11 +0000 2014","2014-11-27 22:02:11",NA,NA,"","Punto 6 #PorUnMéxicoEnPaz @EPN ha ordenado al Gabinete de Seguridad realizar un Operativo Especial en región conocida como Tierra Caliente",93,12,0,0,0,"2015-05-28 19:19:08","2015-07-28 22:51:30",0,NA
"66",538090574164025344,108686024,"Thu Nov 27 22:02:44 +0000 2014","2014-11-27 22:02:44",NA,NA,"","Punto 7  @EPN impulsará acciones y reformas adicionales, para hacer efectivo el derecho humano a la Justicia #PorUnMéxicoEnPaz",94,10,0,0,0,"2015-05-28 19:19:08","2015-07-28 22:51:30",0,NA
"67",538090900149518336,108686024,"Thu Nov 27 22:04:02 +0000 2014","2014-11-27 22:04:02",NA,NA,"","Punto 8 se fortalecerán y pondrán al día los instrumentos para proteger los Derechos Humanos. #PorUnMéxicoEnPaz",92,9,0,0,0,"2015-05-28 19:19:08","2015-07-28 22:51:30",0,NA
"68",538091028948197376,108686024,"Thu Nov 27 22:04:33 +0000 2014","2014-11-27 22:04:33",NA,NA,"","Punto 9 @EPN promoverá la pronta aprobación de diversas leyes y reformas en materia de combate a la corrupción #PorUnMéxicoEnPaz",92,7,0,0,0,"2015-05-28 19:19:08","2015-07-28 22:51:30",0,NA
"69",538091214713921536,108686024,"Thu Nov 27 22:05:17 +0000 2014","2014-11-27 22:05:17",NA,NA,"","Punto 10 Seguirá promoción de los principios de transparencia, rendición de cuentas, participación ciudadana e innovación #PorUnMéxicoEnPaz",94,12,0,0,0,"2015-05-28 19:19:08","2015-07-28 22:51:30",0,NA
"70",538357736673906688,108686024,"Fri Nov 28 15:44:21 +0000 2014","2014-11-28 15:44:21",NA,NA,"","RT @AlexRomeroSanch: Conmemoración del 103 aniversario de la promulgación del #PlanDeAyala @ManuelCota @IAgraristaMX @CNC_CEN @IvonneOP htt…",11,0,0,0,0,"2015-05-28 19:19:08","2015-07-28 22:51:30",1,NA
"71",538460874726727680,108686024,"Fri Nov 28 22:34:11 +0000 2014","2014-11-28 22:34:11",NA,NA,"","Hoy acudí a la Inauguración del Congreso Nacional Agronómico presidido por @LinoVelazquez. Éxito en sus Actividades http://t.co/JQEFVoiJTf",51,15,0,0,0,"2015-05-28 19:19:08","2015-07-28 22:51:30",0,NA
"72",538783210184769536,108686024,"Sat Nov 29 19:55:02 +0000 2014","2014-11-29 19:55:02",NA,NA,"","Felicito a Raúl Ramírez Cerda ahora como Dirigente de @CNC_NuevoLeon gracias a la Unidad Cenecista. http://t.co/spbKAHuXXn",23,12,0,0,0,"2015-05-28 19:19:08","2015-08-03 00:01:24",0,NA
"73",538860856864694272,108686024,"Sun Nov 30 01:03:34 +0000 2014","2014-11-30 01:03:34",NA,NA,"","En @CNC_QuintanaRoo con  el Gobernador @BetoBorge acompañadolos en Reunión de Consejo Político y de Desarrollo Rural http://t.co/mt0tQkiZvN",31,11,0,0,0,"2015-05-28 19:19:08","2015-08-04 14:32:51",0,NA
"74",538921524317532160,108686024,"Sun Nov 30 05:04:38 +0000 2014","2014-11-30 05:04:38",NA,NA,"","RT @betoborge: Hoy junto con el Sen. @ManuelCota asistí a la toma de protesta del Consejo Político de la Fed. Agronómica de Q. Roo http://t…",521,0,0,0,0,"2015-05-28 19:19:08","2015-08-04 14:32:51",1,NA
"75",539472109546655744,108686024,"Mon Dec 01 17:32:28 +0000 2014","2014-12-01 17:32:28",NA,NA,"","Dos años de gobierno del Presidente @EPN: Aciertos y nuevos retos | http://t.co/jZpdV7QGu4",24,8,0,0,0,"2015-05-28 19:19:08","2015-08-04 14:32:51",0,NA
"76",540171120352448512,108686024,"Wed Dec 03 15:50:05 +0000 2014","2014-12-03 15:50:05",NA,NA,"","RT @AlexRomeroSanch: Hoy 3 de #diciembre es el #DíaInternacionalDelMédico ¡Saludos a todos los profesionales de la salud! @ManuelCota http:…",15,0,0,0,0,"2015-05-28 19:19:08","2015-08-04 14:32:51",1,NA
"77",540330587081703424,108686024,"Thu Dec 04 02:23:45 +0000 2014","2014-12-04 02:23:45",NA,NA,"","En la Instalación del Consejo Técnico Consultivo de @CNC_CEN integrado por grandes expertos en materia del Campo http://t.co/275RrWRhpK",92,12,0,0,0,"2015-05-28 19:19:08","2015-08-04 14:32:51",0,NA
"78",540340845543960576,108686024,"Thu Dec 04 03:04:31 +0000 2014","2014-12-04 03:04:31",NA,NA,"","Encontrándome en @CNC_CEN a Jóvenes Líderes del Distrito Federal preocupados y ocupados por el Campo http://t.co/Ur4lxWls5l",22,7,0,0,0,"2015-05-28 19:19:08","2015-08-10 14:54:33",0,NA
"79",540587495491387392,108686024,"Thu Dec 04 19:24:37 +0000 2014","2014-12-04 19:24:37",NA,NA,"","Encuentro de Miembros de @CNC_CEN con el Dr. @LVidegaray Secretario de @SHCP_mx tratando temas en beneficio del Campo http://t.co/mph1RdCYSH",31,9,0,0,0,"2015-05-28 19:19:08","2015-08-10 14:54:33",0,NA
"80",540915225277775872,108686024,"Fri Dec 05 17:06:54 +0000 2014","2014-12-05 17:06:54",NA,NA,"","RT @PRI_Nacional: Con las mujeres podremos construir una sociedad más integrada, y por lo tanto, más justa: @CCQ_PRI #MujerEsPoder. http://…",61,0,0,0,0,"2015-05-28 19:19:08","2015-08-10 14:54:33",1,NA
"81",541274181875544064,108686024,"Sat Dec 06 16:53:16 +0000 2014","2014-12-06 16:53:16",NA,NA,"","RT @AlexRomeroSanch: Mensaje de nuestro Lider del @CNC_CEN @ManuelCota en #EncuentroCenecista #ZacatecasConCota @IAgraristaMX http://t.co/V…",12,0,0,0,0,"2015-05-28 19:19:08","2015-08-11 22:22:33",1,NA
"82",541336018159665152,108686024,"Sat Dec 06 20:58:58 +0000 2014","2014-12-06 20:58:58",NA,NA,"","Comparto Fotos del Encuentro Cenecista en @CNC_Zacatecas, agradezco la compañía de mi amiga la Sen @AngelicaAraujo http://t.co/VQaZOOxeum",22,4,0,0,0,"2015-05-28 19:19:08","2015-08-11 22:22:33",0,NA
"83",541337793143005184,108686024,"Sat Dec 06 21:06:02 +0000 2014","2014-12-06 21:06:02",NA,NA,"","Acompañé a mi amigo Senador @ATelloC en su 2º informe d actividades legislativas #2InformeTello #Zacatecas http://t.co/cHEiUpSIE1",16,4,0,0,0,"2015-05-28 19:19:08","2015-08-11 22:22:33",0,NA
"84",541960661677645824,108686024,"Mon Dec 08 14:21:05 +0000 2014","2014-12-08 14:21:05",NA,NA,"","RT @PRI_Nacional: #EnVivo, @CCQ_PRI con @magdalgonzalez por @mileniotv http://t.co/4NDnzeERuA",21,0,0,0,0,"2015-05-28 19:19:08","2015-08-11 22:22:33",1,NA
"85",541985250298302464,108686024,"Mon Dec 08 15:58:47 +0000 2014","2014-12-08 15:58:47",NA,NA,"","RT @BereOlmoss: @ManuelCota ""Con casi 90 Dip. Fed., la @CNC_CEN es una real fuerza parlamentaria que decide sobre nuevas leyes"". #ElCampoEs…",15,0,0,0,0,"2015-05-28 19:19:08","2015-08-16 12:41:37",1,NA
"86",542146005299630080,108686024,"Tue Dec 09 02:37:34 +0000 2014","2014-12-09 02:37:34",NA,NA,"","RT @CCQ_PRI: El @PRI_Nacional quiere ganar elecciones para consolidar el proyecto transformador de @EPN y que la prosperidad llegue a todos…",179,0,0,0,0,"2015-05-28 19:19:08","2015-08-16 12:41:37",1,NA
"87",542181027024998400,108686024,"Tue Dec 09 04:56:44 +0000 2014","2014-12-09 04:56:44",NA,NA,"","Agradezco a mi amigo @jc_ramirezmarin  Srio. de @SEDATU_mx por las atenciones en la Reunión con miembros @CNC_CEN http://t.co/2akOLWJY47",18,4,0,0,0,"2015-05-28 19:19:08","2015-08-16 12:41:37",0,NA
