"","id_tweet","id_twitter","created_at","created_at_datetime","in_reply_to_user_id","in_reply_to_status_id","in_reply_to_screen_name","text","retweet_count","favorite_count","longitude","latitude","retweeted","creation_date","modification_date","RT_temp","is_retweeted"
"1138",730619357689090048,115556255,"Thu May 12 04:43:23 +0000 2016","2016-05-12 04:43:23",NA,NA,"","Da gusto ver el ánimo y la participación de tanta gente. Hagamos equipo para construir #CiudadesSeguras. https://t.co/3Q7S9FiNwb",280,279,0,0,0,"2016-05-13 23:20:08","2016-08-16 19:37:59",0,0
"1139",730618681114300416,115556255,"Thu May 12 04:40:42 +0000 2016","2016-05-12 04:40:42",NA,NA,"","Esta noche en Jalisco, recorrimos colonias con vecinas, para definir juntos, acciones de prevención social y contra la violencia de género.",216,187,0,0,0,"2016-05-13 23:20:08","2016-08-16 02:08:24",0,0
"1140",730584655611600896,115556255,"Thu May 12 02:25:30 +0000 2016","2016-05-12 02:25:30",NA,NA,"","Recorremos colonias de Guadalajara, escuchando a las vecinas para construir, con ellas, espacios más seguros. https://t.co/fcifOiKlNT",292,275,0,0,0,"2016-05-13 23:20:08","2016-08-16 02:08:24",0,0
"1141",730573024617865216,115556255,"Thu May 12 01:39:17 +0000 2016","2016-05-12 01:39:17",NA,NA,"","Iniciando caminata nocturna en Tonalá, Jalisco para construir ciudades seguras para las mujeres. https://t.co/XBMRgbP2dS",353,464,0,0,0,"2016-05-13 23:20:08","2016-08-14 09:07:38",0,0
"1142",730535499685756928,115556255,"Wed May 11 23:10:10 +0000 2016","2016-05-11 23:10:10",NA,NA,"","Hasta el momento no se reportan afectaciones mayores por sismo de 4.8 en Guadalajara, Jalisco. Continúan protocolos de @PcSegob.",428,254,0,0,0,"2016-05-13 23:20:10","2016-08-13 14:02:19",0,0
"1143",730251415889678336,115556255,"Wed May 11 04:21:19 +0000 2016","2016-05-11 04:21:19",NA,NA,"","Gracias Gobernador @JHerreraCaldera por la hospitalidad durante esta #CaminataNoctura en Durango.",169,142,0,0,0,"2016-05-13 23:20:10","2016-08-13 14:02:19",0,0
"1144",730250966813933568,115556255,"Wed May 11 04:19:32 +0000 2016","2016-05-11 04:19:32",NA,NA,"","Aquí en #Durango y en todo el país, vamos juntos para poner punto final a la violencia contra las mujeres.",193,146,0,0,0,"2016-05-13 23:20:10","2016-08-11 21:55:21",0,0
"1145",730250583370653696,115556255,"Wed May 11 04:18:01 +0000 2016","2016-05-11 04:18:01",NA,NA,"","La fuerza está en la unidad y en la participación de la sociedad. Cuando trabajamos así, no hay retos imposibles. https://t.co/UfZzxDtHh1",314,281,0,0,0,"2016-05-13 23:20:10","2016-08-11 04:51:13",0,0
"1146",730213388828086272,115556255,"Wed May 11 01:50:13 +0000 2016","2016-05-11 01:50:13",NA,NA,"","Hoy 10 de mayo recorremos calles de Durango escuchando a vecinas para construir juntos #EspaciosSegurosParaLasMamás https://t.co/EKKsnQqZWZ",275,308,0,0,0,"2016-05-13 23:20:10","2016-08-09 06:30:20",0,0
"1147",730206857298468864,115556255,"Wed May 11 01:24:16 +0000 2016","2016-05-11 01:24:16",NA,NA,"","Iniciando caminata nocturna en Durango, con @Rosario_Robles_ #EspaciosSegurosParaLasMamás https://t.co/fGbbLiYz3z",232,297,0,0,0,"2016-05-13 23:20:10","2016-08-09 06:30:20",0,0
"1148",730115900322373632,115556255,"Tue May 10 19:22:50 +0000 2016","2016-05-10 19:22:50",NA,NA,"","Con el Pdte. @EPN festejamos a quienes dedican su vida a servir a México y a la vez, a la gran labor de ser madres. https://t.co/KBmWKmX9gM",353,295,0,0,0,"2016-05-13 23:20:13","2016-08-09 06:30:20",0,0
"1149",730110157485563904,115556255,"Tue May 10 19:00:00 +0000 2016","2016-05-10 19:00:00",NA,NA,"","¡Muchas felicidades a todas las mamás en su día! Ustedes son un gran ejemplo de amor, dedicación y entrega. https://t.co/cAPgKIBZbC",276,253,0,0,0,"2016-05-13 23:20:13","2016-08-09 06:30:20",0,0
"1150",731899156143341568,115556255,"Sun May 15 17:28:51 +0000 2016","2016-05-15 17:28:51",NA,NA,"","Mi felicitación y reconocimiento a las y los maestros que asumen con orgullo y responsabilidad la gran tarea de educar. #DíaDelMaestro",393,470,0,0,0,"2016-05-16 09:01:06","2016-08-16 19:37:59",0,0
"1151",732279088484737024,115556255,"Mon May 16 18:38:34 +0000 2016","2016-05-16 18:38:34",NA,NA,"","LIVE on #Periscope: Sumando esfuerzos con la #CTM para ir juntos contra la violencia de género.  https://t.co/yANWQmztSm",274,292,0,0,0,"2016-05-16 15:49:07","2016-08-16 19:37:59",0,0
"1152",732315918957576192,115556255,"Mon May 16 21:04:55 +0000 2016","2016-05-16 21:04:55",NA,NA,"","Los temas de género no sólo son temas de mujeres. Cambiar formas de pensar y de actuar, empieza con el compromiso decidido de todas y todos.",350,292,0,0,0,"2016-05-17 08:43:51","2016-08-22 13:59:16",0,0
"1153",732315840314384384,115556255,"Mon May 16 21:04:36 +0000 2016","2016-05-16 21:04:36",NA,NA,"","Hoy dimos un gran paso al sumar capacidades con @CTM_MX para poner un alto a la violencia contra las mujeres. https://t.co/sMESXNp0vn",392,293,0,0,0,"2016-05-17 08:43:51","2016-08-22 13:59:16",0,0
"1154",732315382086668288,115556255,"Mon May 16 21:02:47 +0000 2016","2016-05-16 21:02:47",NA,NA,"","Millones de trabajadoras y obreras alrededor del país, son el motor de sus familias, de sus lugares de trabajo, y con ello, de todo México.",255,213,0,0,0,"2016-05-17 08:43:51","2016-08-16 19:37:59",0,0
"1155",732772016994967552,115556255,"Wed May 18 03:17:17 +0000 2016","2016-05-18 03:17:17",NA,NA,"","Con @CorteIDH y con todos los organismos internacionales, seguiremos trabajando por un México de derechos y libertades.",223,238,0,0,0,"2016-05-18 01:52:49","2016-08-23 11:22:47",0,0
"1156",732771824333787136,115556255,"Wed May 18 03:16:31 +0000 2016","2016-05-18 03:16:31",NA,NA,"","Esta tarde, me reuní con el Pdte. de @CorteIDH Roberto Caldas y su Vicepresidente, Eduardo Ferrer. https://t.co/C2r0mll3xP",250,301,0,0,0,"2016-05-18 01:52:49","2016-08-23 11:22:47",0,0
"1157",732659743781584896,115556255,"Tue May 17 19:51:09 +0000 2016","2016-05-17 19:51:09",NA,NA,"","Con las reformas y acciones anunciadas por el Presidente @EPN damos grandes pasos en favor de la igualdad y la no discriminación.",266,237,0,0,0,"2016-05-18 01:52:49","2016-08-23 11:22:47",0,0
"1158",732659357846884352,115556255,"Tue May 17 19:49:37 +0000 2016","2016-05-17 19:49:37",NA,NA,"","El Pdte. @EPN encabezó una reunión histórica hoy, con la que México se reconoce como un país diverso e incluyente. https://t.co/ykSeE5q7wL",288,255,0,0,0,"2016-05-18 01:52:49","2016-08-23 11:22:47",0,0
"1159",732610725777018880,115556255,"Tue May 17 16:36:22 +0000 2016","2016-05-17 16:36:22",NA,NA,"","Lograr un México de mayor inclusión, respeto y no discriminación requiere de todas y todos. Hagamos lo que nos toca. #SinHomofobia",300,235,0,0,0,"2016-05-18 01:52:49","2016-08-23 11:22:47",0,0
"1160",732610308011745280,115556255,"Tue May 17 16:34:43 +0000 2016","2016-05-17 16:34:43",NA,NA,"","En el Día Nacional de Lucha Contra La Homofobia la @SEGOB_MX se pinta con los colores #LGBTI #SinHomofobia https://t.co/L1EMAIrqep",333,285,0,0,0,"2016-05-18 01:52:49","2016-08-23 11:22:47",0,0
"1161",733132292420304896,115556255,"Thu May 19 03:08:54 +0000 2016","2016-05-19 03:08:54",NA,NA,"","Lamento el fallecimiento de Don Luis H. Álvarez, hombre comprometido con la inclusión y la democracia. Mi solidaridad con su familia.",224,300,0,0,0,"2016-05-20 07:50:54","2016-08-29 09:47:21",0,0
"1162",733024492058857472,115556255,"Wed May 18 20:00:32 +0000 2016","2016-05-18 20:00:32",NA,NA,"","Gracias @CarlosLozanoAgs por la hospitalidad y sobre todo, a las mujeres que hoy nos acompañaron. Su participación marca la diferencia.",235,173,0,0,0,"2016-05-20 07:50:54","2016-08-28 19:05:28",0,0
"1163",733024039317307392,115556255,"Wed May 18 19:58:44 +0000 2016","2016-05-18 19:58:44",NA,NA,"","Con el Centro de Justicia para Mujeres de Aguascalientes, ya son 28 en México. El compromiso: al menos uno por edo. https://t.co/AvPB6yLLUO",364,314,0,0,0,"2016-05-20 07:50:54","2016-08-23 11:22:47",0,0
"1164",733023481617469440,115556255,"Wed May 18 19:56:31 +0000 2016","2016-05-18 19:56:31",NA,NA,"","A la violencia contra las mujeres se le pone fin desde lo cotidiano, haciendo cambios en el hogar,  espacios públicos y lugares de trabajo.",369,267,0,0,0,"2016-05-20 07:50:54","2016-08-23 11:22:47",0,0
"1165",734079683063468032,115556255,"Sat May 21 17:53:29 +0000 2016","2016-05-21 17:53:29",NA,NA,"","Muchas felicidades a la comunidad del @IPN_MX que hoy celebra los primeros 80 años de una gran institución.",255,273,0,0,0,"2016-05-22 14:35:09","2016-08-29 09:47:21",0,0
"1166",734982212077027328,115556255,"Tue May 24 05:39:49 +0000 2016","2016-05-24 05:39:49",NA,NA,"","Mi reconocimiento estimado @lopezdoriga por 16 años de entrega y compromiso con la información desde #ElNoticiero. ¡Éxito en lo que venga!",239,250,0,0,0,"2016-05-24 04:13:35","2016-08-29 09:47:21",0,0
"1167",734847249679716352,115556255,"Mon May 23 20:43:31 +0000 2016","2016-05-23 20:43:31",NA,NA,"","Los grandes objetivos se plantean a largo plazo. Así debemos trabajar en favor de la niñez y la juventud de México. https://t.co/xZ4JVVemzI",361,323,0,0,0,"2016-05-24 04:13:35","2016-08-29 09:47:21",0,0
"1168",734846730005413888,115556255,"Mon May 23 20:41:27 +0000 2016","2016-05-23 20:41:27",NA,NA,"","Con organizaciones, legisladores y academia estamos definiendo la ruta para proteger mejor los #DDHH de niñas, niños y adolescentes.",228,182,0,0,0,"2016-05-24 04:13:35","2016-08-29 09:47:21",0,0
"1169",734830882553397248,115556255,"Mon May 23 19:38:29 +0000 2016","2016-05-23 19:38:29",NA,NA,"","Hasta el momento no se reporta ningún daño por sismo de magnitud de 5.4 con epicentro en Cintalapa, Chiapas.",244,188,0,0,0,"2016-05-24 04:13:35","2016-08-29 09:47:21",0,0
"1170",734601233328164864,115556255,"Mon May 23 04:25:56 +0000 2016","2016-05-23 04:25:56",NA,NA,"","Me dio mucho gusto saludar a directivos y jugadores de @Tuzos y León. Felicidades a ambos equipos por un gran partido.",251,311,0,0,0,"2016-05-24 04:13:35","2016-08-29 09:47:21",0,0
"1171",734600748726681600,115556255,"Mon May 23 04:24:01 +0000 2016","2016-05-23 04:24:01",NA,NA,"","Eso @Tuzos ! Vamos con todo a la final!",282,293,0,0,0,"2016-05-24 04:13:35","2016-08-29 09:47:21",0,0
"1172",735571855742902272,115556255,"Wed May 25 20:42:51 +0000 2016","2016-05-25 20:42:51",NA,NA,"","Gracias @raulpeimbert por la entrevista. Un gran saludo para nuestros paisanos en Estados Unidos. https://t.co/JzfnHPvqXD",221,253,0,0,0,"2016-05-25 17:38:07","2016-08-29 09:47:21",0,0
"1173",735562355141054464,115556255,"Wed May 25 20:05:06 +0000 2016","2016-05-25 20:05:06",NA,NA,"","Agradezco a @FedericaMog y a quienes conforman la delegación europea por esta oportunidad de intercambiar ideas y mejores prácticas.",172,147,0,0,0,"2016-05-25 17:38:07","2016-08-29 09:47:21",0,0
"1174",735562161422880768,115556255,"Wed May 25 20:04:20 +0000 2016","2016-05-25 20:04:20",NA,NA,"","Fue un gusto iniciar hoy el 2o Diálogo @Mexico - @Union_Europea sobre Seguridad y Procuración de Justicia. https://t.co/Zq3lnDA5QX",233,233,0,0,0,"2016-05-25 17:38:07","2016-08-29 09:47:21",0,0
"1175",735561334457131008,115556255,"Wed May 25 20:01:02 +0000 2016","2016-05-25 20:01:02",NA,NA,"","México y Europa tenemos contextos y retos distintos, pero nos unen los principios de seguridad ciudadana, libertad y legalidad.",201,188,0,0,0,"2016-05-25 17:38:08","2016-08-29 09:47:21",0,0
"1176",735205431165882368,115556255,"Tue May 24 20:26:48 +0000 2016","2016-05-24 20:26:48",NA,NA,"","Guerrero es prioridad del Gobierno del Presidente @EPN. Así lo refrendamos hoy con más acciones y programas de todas las dependencias.",306,246,0,0,0,"2016-05-25 17:38:08","2016-08-29 09:47:21",0,0
"1177",735205314920734720,115556255,"Tue May 24 20:26:21 +0000 2016","2016-05-24 20:26:21",NA,NA,"","Hoy estuvimos en Acapulco escuchando y sumando a la sociedad, porque su participación es una gran fortaleza. https://t.co/xjAWcHdVq2",343,324,0,0,0,"2016-05-25 17:38:08","2016-08-29 09:47:21",0,0
"1178",735204838720442368,115556255,"Tue May 24 20:24:27 +0000 2016","2016-05-24 20:24:27",NA,NA,"","La seguridad duradera se logra fortaleciendo el tejido social y generando más oportunidades y condiciones de desarrollo.",265,185,0,0,0,"2016-05-25 17:38:08","2016-08-29 09:47:21",0,0
"1179",735177264095105024,115556255,"Tue May 24 18:34:53 +0000 2016","2016-05-24 18:34:53",NA,NA,"","En Acapulco, dialogando con vecinos de colonias donde opera el Programa de Prevención. https://t.co/3hurtti5oy",278,212,0,0,0,"2016-05-25 17:38:08","2016-08-29 09:47:21",0,0
"1180",735999577015255040,115556255,"Fri May 27 01:02:28 +0000 2016","2016-05-27 01:02:28",NA,NA,"","Vamos Tuzosss !!!!",200,299,0,0,0,"2016-05-27 00:47:57","2016-08-29 09:47:21",0,0
"1181",735968016844922880,115556255,"Thu May 26 22:57:03 +0000 2016","2016-05-26 22:57:03",NA,NA,"","La clave de @AAMBER_mx está en la suma de esfuerzos y en la participación de ciudadanos como tú. Conócela y súmate: https://t.co/PGEr60S3Ec",253,172,0,0,0,"2016-05-27 00:47:57","2016-08-29 09:47:21",0,0
"1182",735967845977182208,115556255,"Thu May 26 22:56:22 +0000 2016","2016-05-26 22:56:22",NA,NA,"","Con @ArelyGomezGlz, clausuré el Encuentro México-EEUU-Canadá. Así se fortalece @AAMBER_mx más allá de fronteras. https://t.co/XzLhvMJNZH",208,264,0,0,0,"2016-05-27 00:48:01","2016-08-29 09:47:21",0,0
"1183",735966946693242880,115556255,"Thu May 26 22:52:48 +0000 2016","2016-05-26 22:52:48",NA,NA,"","Con @AAMBER_mx, sociedad y gobierno hemos localizado a cientos de niñas y niños alrededor del país, devolviéndolos a salvo, a sus familias.",250,181,0,0,0,"2016-05-27 00:48:01","2016-08-29 09:47:21",0,0
"1184",737340568775200768,115556255,"Mon May 30 17:51:05 +0000 2016","2016-05-30 17:51:05",NA,NA,"","Watch on #Periscope: En Cuernavaca inauguramos espacios públicos para generar mayor comunidad.  https://t.co/VRgYrJ7JUQ",228,256,0,0,0,"2016-05-30 14:37:40","2016-08-29 09:47:21",0,0
"1185",736288204542726144,115556255,"Fri May 27 20:09:22 +0000 2016","2016-05-27 20:09:22",NA,NA,"","Bienvenida Roberta Jacobson, embajadora de EEUU en México. Estoy seguro de que con su llegada se seguirá fortaleciendo la relación bilateral",241,271,0,0,0,"2016-05-30 14:37:44","2016-08-29 09:47:21",0,0
"1186",736270332080726016,115556255,"Fri May 27 18:58:21 +0000 2016","2016-05-27 18:58:21",NA,NA,"","Mi más sentido pésame a la Familia Colosio por el fallecimiento de Doña Ofelia Murrieta de Colosio. Un abrazo solidario.",270,250,0,0,0,"2016-05-30 14:37:44","2016-08-29 09:47:21",0,0
"1187",737369936259997696,115556255,"Mon May 30 19:47:47 +0000 2016","2016-05-30 19:47:47",NA,NA,"","Gracias Gob. @gracoramirez por la hospitalidad y a vecinos de Cuernavaca y Jiutepec por su participación. Eso es lo que marca la diferencia.",224,201,0,0,0,"2016-05-31 11:12:58","2016-08-29 09:47:21",0,0
"1188",737369567773614080,115556255,"Mon May 30 19:46:19 +0000 2016","2016-05-30 19:46:19",NA,NA,"","Hoy entregamos a habitantes de Cuernavaca, un parque que beneficiará a 14 mil personas. Es un espacio de ciudadanos y para ciudadanos.",229,217,0,0,0,"2016-05-31 11:12:58","2016-08-29 09:47:21",0,0
"1189",737369192022704128,115556255,"Mon May 30 19:44:49 +0000 2016","2016-05-30 19:44:49",NA,NA,"","Con acciones de prevención juntos, sociedad y gobierno, estamos construyendo comunidades más fuertes. https://t.co/JabxgdnsBv",305,318,0,0,0,"2016-05-31 11:12:58","2016-08-29 09:47:21",0,0
"1190",738171952473341952,115556255,"Thu Jun 02 00:54:42 +0000 2016","2016-06-02 00:54:42",NA,NA,"","Repruebo también a quien hace alianzas que fomentan esta violencia y no piensa en la educación de las niñas y niños de México.",1215,626,0,0,0,"2016-06-01 22:45:51","2016-08-29 09:47:21",0,0
"1191",738170590754807808,115556255,"Thu Jun 02 00:49:18 +0000 2016","2016-06-02 00:49:18",NA,NA,"","Repudio tajantemente la agresión que sufrieron profesores de Chiapas el día de ayer. Nada lo justifica y no quedará impune.",1424,760,0,0,0,"2016-06-01 22:45:51","2016-08-29 09:47:21",0,0
"1192",738141303310024704,115556255,"Wed Jun 01 22:52:55 +0000 2016","2016-06-01 22:52:55",NA,NA,"","Trabajamos juntos, en lo que a cada uno corresponde, para que las elecciones se desarrollen en tranquilidad y los ciudadanos ejerzan su voto",282,238,0,0,0,"2016-06-01 22:45:51","2016-08-29 09:47:21",0,0
"1193",738140896173002752,115556255,"Wed Jun 01 22:51:18 +0000 2016","2016-06-01 22:51:18",NA,NA,"","De cara a las elecciones locales del 5 de junio, me reuní con legisladores de la Comisión Especial de Seguimiento. https://t.co/goLfX4w0Lb",292,305,0,0,0,"2016-06-01 22:45:51","2016-08-29 09:47:21",0,0
"1194",738076222626762752,115556255,"Wed Jun 01 18:34:18 +0000 2016","2016-06-01 18:34:18",NA,NA,"","La @SEMAR_mx es una gran institución, que se entiende gracias al compromiso y valor de sus integrantes. ¡Muchas felicidades! #DíaDeLaMarina",272,290,0,0,0,"2016-06-01 22:45:51","2016-08-29 09:47:21",0,0
"1195",738432214149386240,115556255,"Thu Jun 02 18:08:53 +0000 2016","2016-06-02 18:08:53",NA,NA,"","RT @EPN: Sé parte de esta consulta en https://t.co/K8ptfqf1OV. Por un México incluyente y respetuoso de la diversidad",895,0,0,0,0,"2016-06-04 01:01:28","2016-09-08 23:12:50",1,1
"1196",738432206322831360,115556255,"Thu Jun 02 18:08:52 +0000 2016","2016-06-02 18:08:52",NA,NA,"","RT @EPN: Para construir una Sociedad de Derechos, necesitamos de tu participación. Ayúdanos a identificar las normas mexicanas que discrimi…",971,0,0,0,0,"2016-06-04 01:01:32","2016-09-08 23:12:50",1,1
"1197",739558466772033536,115556255,"Sun Jun 05 20:44:13 +0000 2016","2016-06-05 20:44:13",NA,NA,"","Igual que millones de mexicanos, hoy emití mi voto. La mejor forma de fortalecer nuestra democracia es participando. https://t.co/tz0RlqdKY5",487,734,0,0,0,"2016-06-05 22:29:09","2016-09-08 23:12:50",0,0
"1198",740285915629654016,115556255,"Tue Jun 07 20:54:50 +0000 2016","2016-06-07 20:54:50",NA,NA,"","Estamos a 11 días de cumplir con el plazo del #NSJP. Lograrlo será muestra de lo que podemos hacer sociedad y gobierno, trabajando juntos.",243,270,0,0,0,"2016-06-07 17:17:04","2016-09-08 23:12:50",0,0
"1199",740285108926615552,115556255,"Tue Jun 07 20:51:38 +0000 2016","2016-06-07 20:51:38",NA,NA,"","Acompañé al Pdte. @EPN en la inauguración del #8ForoSeguridadyJusticia, espacio clave para esta gran transformación. https://t.co/BGOiWmFKCq",264,332,0,0,0,"2016-06-07 17:17:04","2016-09-08 23:12:50",0,0
"1200",740256284037943296,115556255,"Tue Jun 07 18:57:06 +0000 2016","2016-06-07 18:57:06",NA,NA,"","Hoy celebramos el #DíaDeLaLibertadDeExpresión. https://t.co/zPepQqzJY7",236,238,0,0,0,"2016-06-07 17:17:04","2016-09-08 23:12:50",0,0
"1201",741361741477486592,115556255,"Fri Jun 10 20:09:47 +0000 2016","2016-06-10 20:09:47",NA,NA,"","Gracias @PanchDominguez y a las y los cientos de estudiantes, organizaciones e instituciones que se sumaron a la ceremonia de abanderamiento",189,258,0,0,0,"2016-06-10 17:47:16","2016-09-15 20:01:39",0,0
"1202",741361355337302016,115556255,"Fri Jun 10 20:08:15 +0000 2016","2016-06-10 20:08:15",NA,NA,"","México somos todas y todos. Trabajemos en unidad por nuestro gran país. https://t.co/gUNk1wXa9J",285,333,0,0,0,"2016-06-10 17:47:16","2016-09-15 20:01:39",0,0
"1203",741294408360812544,115556255,"Fri Jun 10 15:42:14 +0000 2016","2016-06-10 15:42:14",NA,NA,"","Hoy celebramos el 5° Aniversario de la Reforma Constitucional de Derechos Humanos. https://t.co/5q9YOzWbM4",371,361,0,0,0,"2016-06-10 17:47:16","2016-09-15 20:01:39",0,0
"1204",740987447698325504,115556255,"Thu Jun 09 19:22:29 +0000 2016","2016-06-09 19:22:29",NA,NA,"","Rumbo al 18 de junio seguimos trabajando y avanzando juntos los 3 poderes, órdenes de gobierno y sociedad. https://t.co/rd0FnIi6O7",289,392,0,0,0,"2016-06-10 17:47:16","2016-09-15 20:01:39",0,0
"1205",740717385603108864,115556255,"Thu Jun 09 01:29:21 +0000 2016","2016-06-09 01:29:21",NA,NA,"","Gracias @Alejandro_Marti y a quienes forman parte del #8ForoSeguridadyJusticia. Seguimos en unidad consolidando el #NSJP.",154,142,0,0,0,"2016-06-10 17:47:16","2016-09-15 20:01:39",0,0
"1206",740717012997963776,115556255,"Thu Jun 09 01:27:52 +0000 2016","2016-06-09 01:27:52",NA,NA,"","Sumar esfuerzos, sociedad y gobierno, hace la diferencia entre resolver coyunturas y construir un proyecto de Nación https://t.co/zghYe6c4I6",325,324,0,0,0,"2016-06-10 17:47:16","2016-09-15 20:01:39",0,0
"1207",740690493311352832,115556255,"Wed Jun 08 23:42:29 +0000 2016","2016-06-08 23:42:29",NA,NA,"","EN DIRECTO en #Periscope: Conversando con organizaciones de la sociedad civil en la clausura del 8 Foro de Segurida… https://t.co/vshvdaDxsh",251,202,0,0,0,"2016-06-10 17:47:16","2016-09-08 23:12:50",0,0
"1208",740358856283283456,115556255,"Wed Jun 08 01:44:41 +0000 2016","2016-06-08 01:44:41",NA,NA,"","RT @PanchDominguez: Me reuní con el Secretario de Gobernación, @osoriochong. Trabajando coordinadamente con el Gobierno Federal. https://t.…",86,0,0,0,0,"2016-06-10 17:47:18","2016-09-08 23:12:50",1,1
"1209",742454800504086528,115556255,"Mon Jun 13 20:33:13 +0000 2016","2016-06-13 20:33:13",NA,NA,"","Juntos fortalecemos acciones para que las y los jóvenes puedan construir su propio proyecto de vida. https://t.co/OwGlnQ8FcQ",368,432,0,0,0,"2016-06-14 04:26:18","2016-09-15 20:01:39",0,0
"1210",742080134862110720,115556255,"Sun Jun 12 19:44:25 +0000 2016","2016-06-12 19:44:25",NA,NA,"","Lamento y repudio lo ocurrido en #Orlando. Es resultado del odio y la intolerancia, conductas que debemos erradicar de nuestras sociedades.",688,699,0,0,0,"2016-06-14 04:26:18","2016-09-15 20:01:39",0,0
"1211",741832733006008320,115556255,"Sun Jun 12 03:21:20 +0000 2016","2016-06-12 03:21:20",NA,NA,"","RT @Silvano_A: Agradezco al Secretario de Gobernación, @osoriochong, el respaldo a las acciones para el desarrollo de Michoacán. https://t.…",154,0,0,0,0,"2016-06-14 04:26:18","2016-09-15 20:01:39",1,1
"1212",742783195540643840,115556255,"Tue Jun 14 18:18:08 +0000 2016","2016-06-14 18:18:08",NA,NA,"","A partir de hoy opera en todo el país, el Nuevo Sistema de Justicia Penal para delitos federales. https://t.co/zSxHhSGqTv",751,507,0,0,0,"2016-06-15 05:18:09","2016-09-15 20:01:39",0,0
"1213",743080282534727680,115556255,"Wed Jun 15 13:58:39 +0000 2016","2016-06-15 13:58:39",NA,NA,"","Se activa protocolo @PcSegob por sismo de magnitud preliminar de 5.6 Loc. 81 km al sureste de Cd. Hidalgo, Chiapas.",239,265,0,0,0,"2016-06-15 18:21:52","2016-09-15 20:01:39",0,0
"1214",743931618239275008,115556255,"Fri Jun 17 22:21:34 +0000 2016","2016-06-17 22:21:34",NA,NA,"","Mis condolencias para @JoaquinColdwell, y toda su familia, por la pérdida de su padre. Un fuerte abrazo.",124,148,0,0,0,"2016-06-17 21:35:53","2016-09-15 20:01:39",0,0
"1215",743665746362806272,115556255,"Fri Jun 17 04:45:05 +0000 2016","2016-06-17 04:45:05",NA,NA,"","Con más de 40 mil elementos capacitados y una Unidad de Seguridad Procesal, @PoliciaFedMx está lista para el #NSJP. https://t.co/SXarsseYnX",338,393,0,0,0,"2016-06-17 21:35:53","2016-09-15 20:01:39",0,0
"1216",744043242027622400,115556255,"Sat Jun 18 05:45:07 +0000 2016","2016-06-18 05:45:07",NA,NA,"","Las y los mexicanos dimos un gran paso. Sigamos trabajando en unidad para consolidar el Sistema de #JusticiaPenal. https://t.co/ZkWC9Q9KiB",667,698,0,0,0,"2016-06-18 20:14:54","2016-09-15 20:01:39",0,0
"1217",744042467582959616,115556255,"Sat Jun 18 05:42:02 +0000 2016","2016-06-18 05:42:02",NA,NA,"","A partir de hoy, en todo el país y para todos los delitos, opera el Nuevo Sistema de #JusticiaPenal. https://t.co/ftdzkHbfas",662,586,0,0,0,"2016-06-18 20:14:54","2016-09-15 20:01:39",0,0
"1218",745723616474456064,115556255,"Wed Jun 22 21:02:19 +0000 2016","2016-06-22 21:02:19",NA,NA,"","Hoy me reuniré con representantes del magisterio para buscar, por la vía del diálogo, soluciones para Oaxaca. Les estaré informando.",3014,2706,0,0,0,"2016-06-22 22:18:01","2016-09-25 02:24:05",0,0
"1219",745711926185865216,115556255,"Wed Jun 22 20:15:52 +0000 2016","2016-06-22 20:15:52",NA,NA,"","Para quienes han querido confundir a la ciudadanía, aquí está lo que dije sobre #Nochixtlán: se investigará a fondo. https://t.co/BeJJN2CRZR",1579,1112,0,0,0,"2016-06-22 22:18:01","2016-09-25 02:24:05",0,0
"1220",745830710242643968,115556255,"Thu Jun 23 04:07:52 +0000 2016","2016-06-23 04:07:52",NA,NA,"","EN DIRECTO en #Periscope https://t.co/p3TTEIZpYy",513,483,0,0,0,"2016-06-23 13:16:40","2016-09-26 21:11:22",0,0
"1221",745830206137634816,115556255,"Thu Jun 23 04:05:52 +0000 2016","2016-06-23 04:05:52",NA,NA,"","Hemos concluido la reunión de trabajo con representantes del magisterio en la @SEGOB_mx. En breve compartiré un mensaje a medios.",310,327,0,0,0,"2016-06-23 13:16:42","2016-09-25 02:24:05",0,0
"1222",746081605668610048,115556255,"Thu Jun 23 20:44:50 +0000 2016","2016-06-23 20:44:50",NA,NA,"","Roberta Jacobson ha demostrado ser una gran amiga de México, estoy seguro de que su presencia acercará aún más a nuestros países.",395,214,0,0,0,"2016-06-25 00:45:46","2016-09-27 05:07:58",0,0
"1223",746081206907740160,115556255,"Thu Jun 23 20:43:15 +0000 2016","2016-06-23 20:43:15",NA,NA,"","Hoy tuve el gusto de recibir a la nueva embajadora de Estados Unidos en México, Roberta Jacobson @USEmbassyMEX. https://t.co/nODIq0XiLj",430,355,0,0,0,"2016-06-25 00:45:46","2016-09-27 05:07:58",0,0
"1224",746877193435811840,115556255,"Sun Jun 26 01:26:13 +0000 2016","2016-06-26 01:26:13",NA,NA,"","Todas y todos debemos trabajar por un #MéxicoIncluyente donde la diversidad se reconozca y se respete.",416,413,0,0,0,"2016-06-26 08:59:26","2016-09-27 05:07:58",0,0
"1225",747506248493391872,115556255,"Mon Jun 27 19:05:52 +0000 2016","2016-06-27 19:05:52",NA,NA,"","EN DIRECTO en #Periscope: En Michoacán, vamos todas y todos contra la violencia de género  https://t.co/BRwvNhR5DN",318,223,0,0,0,"2016-06-27 15:17:34","2016-09-27 14:30:17",0,0
