"","id_tweet","id_twitter","created_at","created_at_datetime","in_reply_to_user_id","in_reply_to_status_id","in_reply_to_screen_name","text","retweet_count","favorite_count","longitude","latitude","retweeted","creation_date","modification_date","RT_temp","is_retweeted"
"529",634482149882658816,115556255,"Thu Aug 20 21:48:27 +0000 2015","2015-08-20 21:48:27",NA,NA,"","Coordinación y visión compartida. Así es como trabajando juntos, estamos avanzando en la transformación de nuestro Sistema de Justicia.",117,99,0,0,0,"2015-08-20 23:08:56","2015-10-23 19:02:21",0,NA
"530",634482609939066880,115556255,"Thu Aug 20 21:50:16 +0000 2015","2015-08-20 21:50:16",NA,NA,"","Me dio gusto estar nuevamente con titulares de las procuradurías del país en la #CNJP en su Ceremonia de Clausura. http://t.co/YyMtDnkThX",120,108,0,0,0,"2015-08-20 23:08:56","2015-10-23 19:02:21",0,NA
"531",634482829057900544,115556255,"Thu Aug 20 21:51:09 +0000 2015","2015-08-20 21:51:09",NA,NA,"","A quienes tienen a su cargo fiscalías y procuradurías, les reitero mi reconocimiento por los importantes acuerdos que alcanzaron.",117,103,0,0,0,"2015-08-20 23:08:56","2015-10-23 19:02:21",0,NA
"532",634483359914192896,115556255,"Thu Aug 20 21:53:15 +0000 2015","2015-08-20 21:53:15",NA,NA,"","Les agradezco a quienes integran la #CNPJ y en particular a la Procuradora General @ArelyGomezGlz, por la invitación.",113,101,0,0,0,"2015-08-20 23:08:55","2015-10-27 16:40:40",0,NA
"533",634786066780680192,115556255,"Fri Aug 21 17:56:06 +0000 2015","2015-08-21 17:56:06",NA,NA,"","Felicidades a @MFBeltrones por haber asumido el día de ayer la Presidencia del @PRI_Nacional. Mucho éxito.",139,112,0,0,0,"2015-08-24 22:50:53","2015-10-27 16:40:40",0,NA
"534",634892519050842112,115556255,"Sat Aug 22 00:59:06 +0000 2015","2015-08-22 00:59:06",NA,NA,"","Hoy, en la sesión del #CNSP el Presidente @EPN refrendó el compromiso con la seguridad de las y los mexicanos.",108,102,0,0,0,"2015-08-24 22:50:53","2015-10-27 16:40:40",0,NA
"535",634892793547132928,115556255,"Sat Aug 22 01:00:12 +0000 2015","2015-08-22 01:00:12",NA,NA,"","La fortaleza de nuestras instituciones es más grande que cualquier desafío. Ningún objetivo es inalcanzable para el Estado Mexicano.",114,108,0,0,0,"2015-08-24 22:50:53","2015-10-27 16:40:40",0,NA
"536",634893287208259584,115556255,"Sat Aug 22 01:02:10 +0000 2015","2015-08-22 01:02:10",NA,NA,"","La sociedad juega un papel clave en el #CNSP; reconozco la labor de consejeros salientes y damos la bienvenida a los que hoy se integraron.",110,99,0,0,0,"2015-08-24 22:50:53","2015-10-27 16:40:40",0,NA
"537",634893937077981184,115556255,"Sat Aug 22 01:04:45 +0000 2015","2015-08-22 01:04:45",NA,NA,"","Les comparto fotos de la Sesión del Consejo Nacional de Seguridad Pública. http://t.co/nmXCy6Ef9f",109,109,0,0,0,"2015-08-24 22:50:53","2015-10-28 02:49:18",0,NA
"538",634908931039453184,115556255,"Sat Aug 22 02:04:19 +0000 2015","2015-08-22 02:04:19",NA,NA,"","Una felicitación a @RicardoAnayaC, nuevo presidente de @AccionNacional.",74,57,0,0,0,"2015-08-24 22:50:53","2015-10-28 02:49:18",0,NA
"539",635203431284633600,115556255,"Sat Aug 22 21:34:34 +0000 2015","2015-08-22 21:34:34",NA,NA,"","De cara al inicio de la LXIII Legislatura, compartí con las y los @DiputadosPRI y @DiputadosPVEM la agenda de gobernabilidad y seguridad.",163,107,0,0,0,"2015-08-24 22:50:53","2015-10-28 02:49:18",0,NA
"540",635203747228942336,115556255,"Sat Aug 22 21:35:49 +0000 2015","2015-08-22 21:35:49",NA,NA,"","Los invité a mantener una comunicación estrecha y a impulsar a través del diálogo, los acuerdos para seguir avanzando.",124,110,0,0,0,"2015-08-24 22:50:53","2015-10-28 02:49:18",0,NA
"541",635204194023018496,115556255,"Sat Aug 22 21:37:36 +0000 2015","2015-08-22 21:37:36",NA,NA,"","Gracias al Coordinador @CCQ_PRI y a las diputadas y diputados por la invitación. http://t.co/KQY6SP0mVn",148,111,0,0,0,"2015-08-24 22:50:53","2015-10-29 21:53:38",0,NA
"542",635204630146711552,115556255,"Sat Aug 22 21:39:20 +0000 2015","2015-08-22 21:39:20",NA,NA,"","No me queda duda: en @DiputadosPRI y @DiputadosPVEM hay mujeres y hombres con experiencia y compromiso absoluto con México.",184,140,0,0,0,"2015-08-24 22:50:53","2015-10-29 21:53:38",0,NA
"543",635911910722940928,115556255,"Mon Aug 24 20:29:48 +0000 2015","2015-08-24 20:29:48",NA,NA,"","Desde Mérida, con el Gob. @RolandoZapataB y @NotariadoMex lanzamos la campaña nacional #SeptiembreMesdelTestamento. http://t.co/6rYaCsBPsm",114,89,0,0,0,"2015-08-24 22:50:53","2015-10-29 21:53:38",0,NA
"544",635912197206487040,115556255,"Mon Aug 24 20:30:57 +0000 2015","2015-08-24 20:30:57",NA,NA,"","El testamento es un acto de responsabilidad que genera certeza a la familia y evita futuros conflictos. ¡Infórmate! http://t.co/nJqJBS0Ih5",152,117,0,0,0,"2015-08-24 22:50:53","2015-10-29 21:53:38",0,NA
"545",635912850989432832,115556255,"Mon Aug 24 20:33:33 +0000 2015","2015-08-24 20:33:33",NA,NA,"","También fue un gusto acompañar a diputadas y diputados del @CongresoYucatan en la inauguración de su nueva sede. http://t.co/3sX0pOHX2x",115,88,0,0,0,"2015-08-24 22:50:53","2015-10-29 21:53:38",0,NA
"546",635913112865017856,115556255,"Mon Aug 24 20:34:35 +0000 2015","2015-08-24 20:34:35",NA,NA,"","Mi reconocimiento al Gobernador @RolandoZapataB por su compromiso y como siempre, gracias por la hospitalidad.",111,91,0,0,0,"2015-08-24 22:50:53","2015-10-29 21:53:37",0,NA
"547",635986008102731776,115556255,"Tue Aug 25 01:24:15 +0000 2015","2015-08-25 01:24:15",NA,NA,"","En reunión con diputadas y diputados electos de @NuevaAlianza, en su Asamblea General. http://t.co/lGbSdwXTeH",136,118,0,0,0,"2015-08-24 22:50:53","2015-10-29 21:53:37",0,NA
"548",635987764429783040,115556255,"Tue Aug 25 01:31:13 +0000 2015","2015-08-25 01:31:13",NA,NA,"","Compartí temas centrales de la agenda de gobernabilidad y seguridad y acordamos mantener una estrecha comunicación en la LXIII Legislatura.",113,102,0,0,0,"2015-08-24 22:50:53","2015-10-29 21:53:37",0,NA
"549",635988014087311360,115556255,"Tue Aug 25 01:32:13 +0000 2015","2015-08-25 01:32:13",NA,NA,"","Muchas gracias al nuevo coordinador de @NuevaAlianza, @alfredvalles y a @Luiscasob por la invitación.",132,116,0,0,0,"2015-08-24 22:50:53","2015-10-29 21:53:37",0,NA
"550",635996188970369024,115556255,"Tue Aug 25 02:04:42 +0000 2015","2015-08-25 02:04:42",NA,NA,"","Felicidades @MBarbosaMX por tu ratificación como coordinador de @SenadoresPRD.",41,42,0,0,0,"2015-08-24 22:50:52","2015-10-30 21:22:07",0,NA
"551",636008003796209664,115556255,"Tue Aug 25 02:51:39 +0000 2015","2015-08-25 02:51:39",NA,NA,"","Una felicitación a @MarkoCortes por su designación como coordinador de @diputadospan.",48,44,0,0,0,"2015-08-25 22:41:11","2015-11-03 15:39:17",0,NA
"552",636598740447440896,115556255,"Wed Aug 26 17:59:01 +0000 2015","2015-08-26 17:59:01",NA,NA,"","Una felicitación a @fmartinezneri nuevo Coordinador del Grupo Parlamentario del @PRDMexico en @Mx_Diputados.",43,33,0,0,0,"2015-08-27 01:11:50","2015-11-03 15:39:17",0,NA
"553",636645593721368576,115556255,"Wed Aug 26 21:05:12 +0000 2015","2015-08-26 21:05:12",NA,NA,"","En el #77CongresoNacionalCNC en Durango, el Pdte @EPN refrendó su compromiso con las y los campesinos de todo el país http://t.co/UhmE3eeoNx",170,137,0,0,0,"2015-08-27 01:11:50","2015-11-03 15:39:17",0,NA
"554",636646161437224960,115556255,"Wed Aug 26 21:07:27 +0000 2015","2015-08-26 21:07:27",NA,NA,"","Como lo dijo el Presidente @EPN hacer del campo mexicano uno más productivo, moderno y justo es prioridad del Gobierno de la República.",132,119,0,0,0,"2015-08-27 01:11:50","2015-11-04 00:58:17",0,NA
"555",636646910644785152,115556255,"Wed Aug 26 21:10:26 +0000 2015","2015-08-26 21:10:26",NA,NA,"","Muchas gracias al Senador @ManuelCota por la invitación y al Gobernador @JHerreraCaldera por su hospitalidad. #77CongresoNacionalCNC",127,119,0,0,0,"2015-08-27 01:11:50","2015-11-04 00:58:17",0,NA
"556",636960668185300992,115556255,"Thu Aug 27 17:57:12 +0000 2015","2015-08-27 17:57:12",NA,NA,"","Muchas gracias a las y los senadores de @Senado_PRI y @VerdeSenadoMex por la oportunidad de acompañarlos en su Reunión Plenaria esta mañana.",121,105,0,0,0,"2015-08-27 16:09:38","2015-11-04 00:58:17",0,NA
"557",636960941318344704,115556255,"Thu Aug 27 17:58:17 +0000 2015","2015-08-27 17:58:17",NA,NA,"","Ha sido con diálogo, acuerdo y unidad, como se han logrado transformaciones históricas durante estos tres años. Sigamos por esa ruta.",113,106,0,0,0,"2015-08-27 16:09:38","2015-11-04 00:58:17",0,NA
"558",636961655113428992,115556255,"Thu Aug 27 18:01:07 +0000 2015","2015-08-27 18:01:07",NA,NA,"","Mi reconocimiento a @Emilio_Gamboa_  y @CarlosPuenteZAC por su trabajo y liderazgo como coordinadores parlamentarios. http://t.co/1Tcst1aBDI",155,110,0,0,0,"2015-08-27 16:09:38","2015-11-04 00:58:17",0,NA
"559",637016888858443776,115556255,"Thu Aug 27 21:40:36 +0000 2015","2015-08-27 21:40:36",NA,NA,"","Un abrazo y mi reconocimiento a @JuanJoseGuerra @Enrique_MtzyMtz @EChuayffet y Murillo Karam, quienes formaron parte del gabinete de @EPN.",162,127,0,0,0,"2015-08-29 18:12:07","2015-11-04 00:58:17",0,NA
"560",637023113629184000,115556255,"Thu Aug 27 22:05:20 +0000 2015","2015-08-27 22:05:20",NA,NA,"","Mucho éxito a @ruizmassieu @JoseAMeadeK @RafaelPacchiano @ppcalzada @aurelionuno @Rosario_Robles_ @edelamadrid  @Fco__Guzman y @ReyesBaeza",220,128,0,0,0,"2015-08-29 18:12:07","2015-11-04 00:58:17",0,NA
"561",637023774513041408,115556255,"Thu Aug 27 22:07:57 +0000 2015","2015-08-27 22:07:57",NA,NA,"","Quienes hoy asumen una nueva responsabilidad en el equipo del Presidente @EPN. http://t.co/SJk7opUpgb",285,160,0,0,0,"2015-08-29 18:12:07","2015-11-04 00:58:17",0,NA
"562",637091661160407040,115556255,"Fri Aug 28 02:37:43 +0000 2015","2015-08-28 02:37:43",NA,NA,"","Por instrucciones del Presidente @EPN, di posesión a los nuevos Secretarios y Secretarias. Felicidades y mucho éxito! http://t.co/bMFP6az3g6",395,252,0,0,0,"2015-08-29 18:12:07","2015-11-04 00:58:17",0,NA
"563",637365514986098688,115556255,"Fri Aug 28 20:45:55 +0000 2015","2015-08-28 20:45:55",NA,NA,"","Siguiendo la instrucción del Presidente @EPN, hoy di posesión de la Dirección General del @ISSSTE_MX a @ReyesBaeza. http://t.co/pfsyb6ouPH",201,138,0,0,0,"2015-08-29 18:12:07","2015-11-04 00:58:17",0,NA
"564",637426919848316928,115556255,"Sat Aug 29 00:49:55 +0000 2015","2015-08-29 00:49:55",NA,NA,"","A partir de la decisión anunciada por el Pdte @EPN, di posesión a Renato Sales como Comisionado Nacional de Seguridad http://t.co/zhQRdmA78t",151,119,0,0,0,"2015-08-29 18:12:07","2015-11-04 00:58:17",0,NA
"565",637427387588718592,115556255,"Sat Aug 29 00:51:46 +0000 2015","2015-08-29 00:51:46",NA,NA,"","Mi reconocimiento y el de la @SEGOB_mx a Monte Alejandro Rubido, a quien le reitero mi afecto permanente.",120,110,0,0,0,"2015-08-29 18:12:07","2015-11-04 00:58:17",0,NA
"566",637757981921177600,115556255,"Sat Aug 29 22:45:26 +0000 2015","2015-08-29 22:45:26",NA,NA,"","Mucho éxito a @Jesus_ZambranoG , electo hoy Presidente de la Mesa Directiva de la @Mx_Diputados.",118,113,0,0,0,"2015-08-29 21:27:16","2015-11-04 00:58:17",0,NA
"567",637824517667074048,115556255,"Sun Aug 30 03:09:49 +0000 2015","2015-08-30 03:09:49",NA,NA,"","RT @GoberDuarte: Hoy sostuve una reunión con un gran aliado de Chihuahua, el Secretario de Gobernación @osoriochong http://t.co/qlvgByKUaE",115,0,0,0,0,"2015-08-30 19:44:40","2015-11-04 00:58:17",1,NA
"568",637824534351970304,115556255,"Sun Aug 30 03:09:53 +0000 2015","2015-08-30 03:09:53",NA,NA,"","RT @GoberDuarte: Junto al Secretario @osoriochong revisamos diferentes temas que conciernen al futuro y crecimiento de #Chihuahua ¡Que pase…",110,0,0,0,0,"2015-08-30 19:44:40","2015-11-04 00:58:17",1,NA
"569",638485008441720832,115556255,"Mon Aug 31 22:54:23 +0000 2015","2015-08-31 22:54:23",NA,NA,"","Felicidades y mucho éxito a @rgilzuarth quien a partir de hoy asume la Presidencia del @senadomexicano.",113,106,0,0,0,"2015-09-01 22:29:13","2015-11-04 00:58:17",0,NA
"570",638486339952881664,115556255,"Mon Aug 31 22:59:40 +0000 2015","2015-08-31 22:59:40",NA,NA,"","Hoy en la Col. Palmitas en Pachuca, Hidalgo, el Presidente @EPN inauguró el mural más grande de América Latina: son 209 casas y 190 colores.",225,142,0,0,0,"2015-09-01 22:29:13","2015-11-04 00:58:17",0,NA
"571",638486860507934720,115556255,"Mon Aug 31 23:01:44 +0000 2015","2015-08-31 23:01:44",NA,NA,"","En #Palmitas, se transformó mucho más que fachadas. El cambio de fondo está en sus habitantes, que unidos le dicen NO a la violencia.",143,117,0,0,0,"2015-09-01 22:29:13","2015-11-04 00:58:17",0,NA
"572",638487143367634944,115556255,"Mon Aug 31 23:02:52 +0000 2015","2015-08-31 23:02:52",NA,NA,"","Además del mural, @nosmuevelapaz aporta proyectos productivos, de salud y educación, para lograr mejores oportunidades y condiciones de vida",137,114,0,0,0,"2015-09-01 22:29:13","2015-11-04 00:58:17",0,NA
"573",638487639687958528,115556255,"Mon Aug 31 23:04:50 +0000 2015","2015-08-31 23:04:50",NA,NA,"","Juntos, sociedad y gobierno, estamos fortaleciendo el tejido social para así erradicar la violencia desde sus causas. http://t.co/kMo0XQ8Ema",285,184,0,0,0,"2015-09-01 22:29:13","2015-11-04 00:58:17",0,NA
"574",638488232800358400,115556255,"Mon Aug 31 23:07:11 +0000 2015","2015-08-31 23:07:11",NA,NA,"","Agradezco al Gobernador @Paco_Olvera por su hospitalidad. Les comparto un video de este #MacroMural en #Palmitas  http://t.co/ytqjcNmYBf",254,162,0,0,0,"2015-09-01 22:29:12","2015-11-10 01:59:12",0,NA
"575",745121048803172352,115556255,"Tue Jun 21 05:07:56 +0000 2016","2016-06-21 05:07:56",NA,NA,"","Trabajaremos para encontrar, por la vía del diálogo y en el marco de la ley, las soluciones a la situación que vive Oaxaca.",421,369,0,0,0,"2016-06-21 12:59:27","2016-09-25 02:24:05",0,0
"576",638859856951164928,115556255,"Tue Sep 01 23:43:53 +0000 2015","2015-09-01 23:43:53",NA,NA,"","Por instrucción del Pdte. @EPN y cumpliendo el mandato constitucional, entregué el #TercerInforme en @Mx_Diputados. http://t.co/RWwUHUKuTB",439,192,0,0,0,"2015-09-01 22:29:12","2015-11-10 01:59:12",0,NA
"577",638860157124919296,115556255,"Tue Sep 01 23:45:05 +0000 2015","2015-09-01 23:45:05",NA,NA,"","A nombre del Pdte. @EPN, reconocí la labor y voluntad política de la LXII Legislatura, que permitió dar pasos históricos en estos 3 años.",286,147,0,0,0,"2015-09-01 22:29:12","2015-11-10 01:59:12",0,NA
"578",638860652526768128,115556255,"Tue Sep 01 23:47:03 +0000 2015","2015-09-01 23:47:03",NA,NA,"","Debemos seguir privilegiando el diálogo para hacer frente a los retos que tenemos como país y dar respuesta a las exigencias ciudadanas.",263,135,0,0,0,"2015-09-01 22:29:12","2015-11-10 15:12:17",0,NA
"579",638861123433820160,115556255,"Tue Sep 01 23:48:55 +0000 2015","2015-09-01 23:48:55",NA,NA,"","Como lo ha señalado el Pdte. @EPN es momento de trabajar en unidad para consolidar el México de igualdad y desarrollo al que todos aspiramos",359,179,0,0,0,"2015-09-01 22:29:12","2015-11-10 15:12:17",0,NA
"580",639173534527320064,115556255,"Wed Sep 02 20:30:20 +0000 2015","2015-09-02 20:30:20",NA,NA,"","Esta tarde el Presidente @EPN dirigió su mensaje a la Nación con motivo del #TercerInforme. http://t.co/Z44XgzFx3V",325,199,0,0,0,"2015-09-03 14:42:07","2015-11-10 15:12:17",0,NA
"581",639174002724880384,115556255,"Wed Sep 02 20:32:12 +0000 2015","2015-09-02 20:32:12",NA,NA,"","El Pdte. @EPN señaló avances, reconoció retos e invitó a todos los mexicanos a trabajar juntos para consolidar la transformación del país.",298,188,0,0,0,"2015-09-03 14:42:07","2015-11-10 15:12:17",0,NA
"582",639174859205963776,115556255,"Wed Sep 02 20:35:36 +0000 2015","2015-09-02 20:35:36",NA,NA,"","El #TercerInforme es ante todo, un ejercicio de transparencia y rendición de cuentas. Conócelo en: http://t.co/GRZ0cbgV16",392,227,0,0,0,"2015-09-03 14:42:07","2015-11-10 15:12:17",0,NA
"583",639544140506632192,115556255,"Thu Sep 03 21:02:59 +0000 2015","2015-09-03 21:02:59",NA,NA,"","El sismo de 1985 marcó un antes y un después para la #CDMX y para la #ProtecciónCivil en todo México. http://t.co/7xNrHJbWXp",215,166,0,0,0,"2015-09-03 23:29:52","2015-11-10 15:12:17",0,NA
"584",639544413501304832,115556255,"Thu Sep 03 21:04:04 +0000 2015","2015-09-03 21:04:04",NA,NA,"","A 30 años, el próximo 19 de septiembre debe convocarnos a seguir trabajando para ser más eficaces en el propósito compartido de salvar vidas",193,162,0,0,0,"2015-09-03 23:29:52","2015-11-10 15:12:17",0,NA
"585",639544734621413376,115556255,"Thu Sep 03 21:05:21 +0000 2015","2015-09-03 21:05:21",NA,NA,"","Con ese objetivo, hoy dimos a conocer una serie de acciones que llevaremos a cabo en todo México. Conócelas vía @PcSegob y #SimulacroMx",181,146,0,0,0,"2015-09-03 23:29:52","2015-11-11 19:17:01",0,NA
"586",639544984492896256,115556255,"Thu Sep 03 21:06:21 +0000 2015","2015-09-03 21:06:21",NA,NA,"","Agradezco a @S_Cienfuegos_Z, @AlmSoberon, @_MJuan_,  @ManceraMiguelMX, dependencias y OSC por sumarse decididamente a esta iniciativa.",160,141,0,0,0,"2015-09-03 23:29:51","2015-11-11 19:17:01",0,NA
"587",639609508273123328,115556255,"Fri Sep 04 01:22:44 +0000 2015","2015-09-04 01:22:44",NA,NA,"","Trabajamos juntos y sumamos esfuerzos para que en junio de 2016 el #NSJP opere en todo el país. http://t.co/8GheMWRwyd",200,154,0,0,0,"2015-09-03 23:29:51","2015-11-11 19:17:01",0,NA
"588",639609725017915392,115556255,"Fri Sep 04 01:23:36 +0000 2015","2015-09-04 01:23:36",NA,NA,"","Hoy con @SCJN y @PGR_mx firmamos acuerdos y solicitudes para la entrada en vigor del nuevo sistema de #JusticiaPenal en 16 entidades.",199,156,0,0,0,"2015-09-03 23:29:51","2015-11-11 19:17:01",0,NA
"589",639609977494069248,115556255,"Fri Sep 04 01:24:36 +0000 2015","2015-09-04 01:24:36",NA,NA,"","La transformación del Sistema de Justicia cambiará la vida de millones de mexicanos, especialmente de quienes han sido víctimas del delito.",236,181,0,0,0,"2015-09-03 23:29:51","2015-11-11 19:17:01",0,NA
"590",640608835992850432,115556255,"Sun Sep 06 19:33:43 +0000 2015","2015-09-06 19:33:43",NA,NA,"","RT @EPN: He dado indicaciones para que las investigaciones de los trágicos sucesos de Iguala tomen en cuenta los elementos aportados por el…",1331,0,0,0,0,"2015-09-06 18:06:12","2015-11-11 19:17:01",1,NA
"591",640608874928599040,115556255,"Sun Sep 06 19:33:52 +0000 2015","2015-09-06 19:33:52",NA,NA,"","RT @EPN: También le he dado indicaciones a las dependencias del @Gobmx para que analicen cada una de las recomendaciones que han presentado…",1038,0,0,0,0,"2015-09-06 18:06:12","2015-11-11 19:17:01",1,NA
"592",640609929116553216,115556255,"Sun Sep 06 19:38:03 +0000 2015","2015-09-06 19:38:03",NA,NA,"","RT @EPN: El @gobmx agradece nuevamente el trabajo del. GIEI y el apoyo de la CIDH, para la investigación de estos hechos tan lamentables.",876,0,0,0,0,"2015-09-06 18:06:11","2015-11-11 19:17:01",1,NA
"593",640609944438337536,115556255,"Sun Sep 06 19:38:07 +0000 2015","2015-09-06 19:38:07",NA,NA,"","RT @EPN: México seguirá sumando esfuerzos en favor del Estado de Derecho y la protección de los Derechos Humanos.",1121,0,0,0,0,"2015-09-06 18:06:11","2015-11-11 19:17:01",1,NA
"594",640622355715260416,115556255,"Sun Sep 06 20:27:26 +0000 2015","2015-09-06 20:27:26",NA,NA,"","Ante los lamentables sucesos de Iguala, el Estado Mexicano ha mantenido plena apertura y compromiso con la transparencia.",195,171,0,0,0,"2015-09-06 18:06:11","2015-11-11 19:17:01",0,NA
"595",640622831600951296,115556255,"Sun Sep 06 20:29:19 +0000 2015","2015-09-06 20:29:19",NA,NA,"","Por instrucción del Presidente @EPN, se analizarán y tomarán en cuenta las recomendaciones dadas a conocer hoy por el #GIEI de la @CIDH.",334,225,0,0,0,"2015-09-06 18:06:11","2015-11-11 19:17:01",0,NA
"596",640623301178617856,115556255,"Sun Sep 06 20:31:11 +0000 2015","2015-09-06 20:31:11",NA,NA,"","Se han detenido 110 presuntos responsables, incluido el entonces alcalde de Iguala. NO habrá impunidad. Se castigará a todos los culpables.",258,197,0,0,0,"2015-09-06 18:06:11","2015-11-11 19:17:01",0,NA
"597",640623875160600576,115556255,"Sun Sep 06 20:33:28 +0000 2015","2015-09-06 20:33:28",NA,NA,"","También, seguiremos trabajando para que México cuente a la brevedad con leyes de avanzada en materia de búsqueda de personas y desaparición.",190,162,0,0,0,"2015-09-06 18:06:11","2015-11-11 19:17:01",0,NA
"598",640992896552820736,115556255,"Mon Sep 07 20:59:50 +0000 2015","2015-09-07 20:59:50",NA,NA,"","Seguimos trabajando región por región, estado por estado. Hoy sostuvimos reunión en Tuxtla Gutiérrez, Chiapas. http://t.co/UTcCKxVbNt",244,179,0,0,0,"2015-09-07 21:53:04","2015-11-11 19:17:01",0,NA
"599",640993136454447104,115556255,"Mon Sep 07 21:00:47 +0000 2015","2015-09-07 21:00:47",NA,NA,"","Con Gobernadores revisamos indicadores delictivos que muestran resultados positivos en la región y tomamos decisiones para profundizarlos.",189,162,0,0,0,"2015-09-07 21:53:04","2015-11-11 19:17:01",0,NA
"600",640993460720308224,115556255,"Mon Sep 07 21:02:04 +0000 2015","2015-09-07 21:02:04",NA,NA,"","El compromiso del Pdte. @EPN con la región sur es integral, impulsando el desarrollo, brindando más oportunidades y educación de calidad.",223,168,0,0,0,"2015-09-07 21:53:04","2015-11-11 19:17:01",0,NA
"601",640993816934133760,115556255,"Mon Sep 07 21:03:29 +0000 2015","2015-09-07 21:03:29",NA,NA,"","Reconozco al Gobernador @ferortegab, quien próximamente concluye su mandato, por los resultados y compromiso con Campeche.",192,152,0,0,0,"2015-09-07 21:53:04","2015-11-11 19:17:01",0,NA
"602",640994640364068864,115556255,"Mon Sep 07 21:06:46 +0000 2015","2015-09-07 21:06:46",NA,NA,"","Muchas gracias al Gobernador @VelascoM_ por su hospitalidad en Tuxtla Gutiérrez, Chiapas.",195,177,0,0,0,"2015-09-07 21:53:03","2015-11-11 19:17:01",0,NA
"603",641065256261828608,115556255,"Tue Sep 08 01:47:22 +0000 2015","2015-09-08 01:47:22",NA,NA,"","Por instrucción del Pdte @EPN recibí a @JaimeRdzNL. Acordamos mantener un diálogo permanente y trabajar juntos por NL http://t.co/BANRtnO2SI",265,208,0,0,0,"2015-09-07 21:53:03","2015-11-11 19:17:01",0,NA
"604",641360010123980800,115556255,"Tue Sep 08 21:18:36 +0000 2015","2015-09-08 21:18:36",NA,NA,"","Mucho éxito a Miguel Basáñez, nuevo Emb. en EEUU, con quien me reuní para revisar la agenda de migración, cooperación bilateral y seguridad.",172,139,0,0,0,"2015-09-09 11:41:47","2015-11-11 19:17:01",0,NA
"605",641360205834420224,115556255,"Tue Sep 08 21:19:23 +0000 2015","2015-09-08 21:19:23",NA,NA,"","Les comparto foto de la reunión con el Embajador Miguel Basáñez. http://t.co/sRPVrAReY9",193,147,0,0,0,"2015-09-09 11:41:47","2015-11-11 19:17:01",0,NA
"606",641370185375444992,115556255,"Tue Sep 08 21:59:02 +0000 2015","2015-09-08 21:59:02",NA,NA,"","Un gran gusto haber estado hoy en Hidalgo, para acompañar al Gobernador @Paco_Olvera en su 5to Informe. Felicidades. http://t.co/WuDk0FIaLP",307,227,0,0,0,"2015-09-09 11:41:46","2015-11-11 19:17:01",0,NA
"607",641727438414725120,115556255,"Wed Sep 09 21:38:38 +0000 2015","2015-09-09 21:38:38",NA,NA,"","Bienvenidos al equipo de la @SEGOB_mx a las y los funcionarios que se integran a partir de hoy. http://t.co/1Ux0lBwvsZ",528,286,0,0,0,"2015-09-10 13:59:04","2015-11-11 19:17:01",0,NA
"608",641728205804564480,115556255,"Wed Sep 09 21:41:41 +0000 2015","2015-09-09 21:41:41",NA,NA,"","Sigamos trabajando para y por los mexicanos, con profesionalismo y compromiso. http://t.co/uWWyrvNSLP",300,216,0,0,0,"2015-09-10 13:59:04","2015-11-11 19:17:01",0,NA
"609",641810174160732160,115556255,"Thu Sep 10 03:07:24 +0000 2015","2015-09-10 03:07:24",NA,NA,"","RT @VelascoM_: Encuentro con el Srio. @osoriochong donde acordamos redoblar esfuerzos en seguridad para Chiapas con más coordinación http:/…",115,0,0,0,0,"2015-09-10 13:59:04","2015-11-11 19:17:01",1,NA
"610",642085413083987968,115556255,"Thu Sep 10 21:21:06 +0000 2015","2015-09-10 21:21:06",NA,NA,"","Hoy tuve el gusto de presentar, junto con el Gobernador @CarlosLozanoAGS, el libro ""La Última Expedición de Morelos"". http://t.co/BGTxgluQ4h",223,155,0,0,0,"2015-09-10 23:06:20","2015-11-11 19:17:01",0,NA
"611",642086012995239936,115556255,"Thu Sep 10 21:23:29 +0000 2015","2015-09-10 21:23:29",NA,NA,"","Morelos sentó grandes bases y nos dejó un legado. Nos toca a todos, seguir construyendo el México que queremos.",181,157,0,0,0,"2015-09-10 23:06:20","2015-11-11 19:17:01",0,NA
"612",642172222065344512,115556255,"Fri Sep 11 03:06:03 +0000 2015","2015-09-11 03:06:03",NA,NA,"","Mucho éxito al Gobernador de Baja California Sur, @cmendozadavis quien hoy rindió protesta.",155,153,0,0,0,"2015-09-11 15:53:33","2015-11-11 19:17:01",0,NA
"613",642740161445425152,115556255,"Sat Sep 12 16:42:50 +0000 2015","2015-09-12 16:42:50",NA,NA,"","RT @SEGOB_mx: Prepárate para #SimulacroMx. Familiarízate con la #AlertaSísmica. A las 12:00 hrs se escuchará en los altavoces http://t.co/7…",180,0,0,0,0,"2015-09-15 00:17:18","2015-11-20 15:00:26",1,NA
"614",642986521482522624,115556255,"Sun Sep 13 09:01:47 +0000 2015","2015-09-13 09:01:47",NA,NA,"","Se activan protocolos por SISMO Magnitud Preliminar 6.4 Loc. 104 km al NORESTE de LA PAZ, BCS",167,90,0,0,0,"2015-09-15 00:17:18","2015-11-23 05:43:41",0,NA
"615",643083668907397120,115556255,"Sun Sep 13 15:27:49 +0000 2015","2015-09-13 15:27:49",NA,NA,"","Felicidades y mucho éxito a la primera gobernadora de Sonora @claudiapavlovic.",325,299,0,0,0,"2015-09-15 00:17:18","2015-11-23 05:43:41",0,NA
"616",643150275969028096,115556255,"Sun Sep 13 19:52:29 +0000 2015","2015-09-13 19:52:29",NA,NA,"","En su 168 aniversario, conmemoramos con el Presidente @EPN la lealtad de los niños héroes por México. http://t.co/PMSyirV08z",235,167,0,0,0,"2015-09-15 00:17:18","2015-11-23 05:43:41",0,NA
