"","id_tweet","id_twitter","created_at","created_at_datetime","in_reply_to_user_id","in_reply_to_status_id","in_reply_to_screen_name","text","retweet_count","favorite_count","longitude","latitude","retweeted","creation_date","modification_date","RT_temp","is_retweeted"
"1",511211379228172288,115556255,"Sun Sep 14 17:54:25 +0000 2014","2014-09-14 17:54:25",NA,NA,"","Se instaló el Comité Nacional de Emergencias en #CENAPRED que en coordinación con los  estados trabajará para prevenir posibles afectaciones",161,74,0,0,0,"2015-05-28 19:20:43","2015-05-28 19:44:37",0,NA
"2",511213399825731584,115556255,"Sun Sep 14 18:02:27 +0000 2014","2014-09-14 18:02:27",NA,NA,"","Invitamos a la población de BC a estar atentos de la evolución de #Odile y seguir las recomendaciones de autoridades. http://t.co/3aYYyVPN9m",371,121,0,0,0,"2015-05-28 19:20:43","2015-05-28 19:44:37",0,NA
"3",511664628288741376,115556255,"Mon Sep 15 23:55:28 +0000 2014","2014-09-15 23:55:28",NA,NA,"","El Comité Nacional de Emergencias informó de las acciones realizadas para atender a la población y el pronóstico de #Odile para las próx hrs",56,33,0,0,0,"2015-05-28 19:20:43","2015-06-01 01:12:55",0,NA
"4",511676098233765888,115556255,"Tue Sep 16 00:41:02 +0000 2014","2014-09-16 00:41:02",NA,NA,"","Hasta el último reporte, #Odile es Categoría I y está a 50 km al oeste-noroeste de Loreto, BCS. Estén atentos a @pcsegob @conagua_clima",85,28,0,0,0,"2015-05-28 19:20:43","2015-06-04 14:27:40",0,NA
"5",511719905050505216,115556255,"Tue Sep 16 03:35:07 +0000 2014","2014-09-16 03:35:07",NA,NA,"","En Palacio Nacional, acompañé al Presidente @EPN durante la Ceremonia del Grito de Independencia. ",69,56,0,0,0,"2015-05-28 19:20:43","2015-06-04 14:27:40",0,NA
"6",511721342501421056,115556255,"Tue Sep 16 03:40:50 +0000 2014","2014-09-16 03:40:50",NA,NA,"","Hace 204 años la historia vio nacer a nuestra patria. Estemos orgullosos de lo que hemos logrado desde entonces. ¡Viva México!  ",128,78,0,0,0,"2015-05-28 19:20:43","2015-06-05 10:27:49",0,NA
"7",511935288911073280,115556255,"Tue Sep 16 17:50:58 +0000 2014","2014-09-16 17:50:58",NA,NA,"","Arribando a  Los Cabos, BCS con integrantes del Gabinete del @gobrep para evaluar daños y afectaciones por el Huracán #Odile.",233,114,0,0,0,"2015-05-28 19:20:43","2015-06-05 10:27:49",0,NA
"8",511935965552996352,115556255,"Tue Sep 16 17:53:40 +0000 2014","2014-09-16 17:53:40",NA,NA,"","Autoridades federales y locales coordinaremos acciones para iniciar la recuperación de las zonas afectadas por #Odile lo antes posible.",177,88,0,0,0,"2015-05-28 19:20:43","2015-06-05 10:27:49",0,NA
"9",511966577789788160,115556255,"Tue Sep 16 19:55:18 +0000 2014","2014-09-16 19:55:18",NA,NA,"","A partir de este momento, queda habilitado el puente aéreo en Baja California Sur. http://t.co/UvE1hLvQRX",264,121,0,0,0,"2015-05-28 19:20:43","2015-06-05 10:27:49",0,NA
"10",512048565779435520,115556255,"Wed Sep 17 01:21:06 +0000 2014","2014-09-17 01:21:06",NA,NA,"","Hace unos momentos terminó la reunión de trabajo encabezada por el Pdte @EPN. Instruyó acciones inmediatas en apoyo a la población de #BCS.",225,139,0,0,0,"2015-05-28 19:20:43","2015-06-07 21:57:55",0,NA
"11",512318692374614016,115556255,"Wed Sep 17 19:14:29 +0000 2014","2014-09-17 19:14:29",NA,NA,"","En representación del Presidente @EPN, asistí al Segundo Informe de Gobierno de @ManceraMiguelMX http://t.co/iDn3RReOJn",66,31,0,0,0,"2015-05-28 19:20:43","2015-06-16 09:50:56",0,NA
"12",512319773636837376,115556255,"Wed Sep 17 19:18:47 +0000 2014","2014-09-17 19:18:47",NA,NA,"","Felicito a @ManceraMiguelMX por la rendición de cuentas en favor de los habitantes de la gran Ciudad de México. http://t.co/JZTlfYVurD",71,44,0,0,0,"2015-05-28 19:20:43","2015-06-16 09:50:56",0,NA
"13",512320326051852288,115556255,"Wed Sep 17 19:20:58 +0000 2014","2014-09-17 19:20:58",NA,NA,"","Gracias a los integrantes de la @AsambleaDF por su hospitalidad.",28,19,0,0,0,"2015-05-28 19:20:43","2015-06-16 09:50:56",0,NA
"14",512432422701768704,115556255,"Thu Sep 18 02:46:24 +0000 2014","2014-09-18 02:46:24",NA,NA,"","En Acapulco, por instrucción del  Pdte. @EPN, integrantes del Gabinete del @GobRep rendimos cuentas de los avances del #PlanNuevoGuerrero",68,31,0,0,0,"2015-05-28 19:20:43","2015-06-16 09:50:56",0,NA
"15",512433716862656512,115556255,"Thu Sep 18 02:51:33 +0000 2014","2014-09-18 02:51:33",NA,NA,"","Hoy están en marcha obras y acciones sin precedentes en infraestructura, desarrollo económico y social para transformar a Guerrero.",72,37,0,0,0,"2015-05-28 19:20:43","2015-06-17 00:07:22",0,NA
"16",512435526612582400,115556255,"Thu Sep 18 02:58:44 +0000 2014","2014-09-18 02:58:44",NA,NA,"","La instrucción del Pdte. @EPN es seguir trabajando juntos, gobierno y sociedad, para mejorar las condiciones de vida de los guerrerenses.",80,43,0,0,0,"2015-05-28 19:20:43","2015-06-17 00:07:22",0,NA
"17",512435977194065920,115556255,"Thu Sep 18 03:00:32 +0000 2014","2014-09-18 03:00:32",NA,NA,"","Agradezco al Gobernador @AngelAguirreGro   su hospitalidad. http://t.co/LLVSJ3JdJc",61,34,0,0,0,"2015-05-28 19:20:43","2015-06-17 00:07:22",0,NA
"18",512786897916018688,115556255,"Fri Sep 19 02:14:58 +0000 2014","2014-09-19 02:14:58",NA,NA,"","En BCS, integrantes del Gabinete acompañamos al Presidente @EPN en recorridos por zonas afectadas y sostuvimos una reunión de evaluación.",94,49,0,0,0,"2015-05-28 19:20:43","2015-06-17 00:07:22",0,NA
"19",512786990241050624,115556255,"Fri Sep 19 02:15:20 +0000 2014","2014-09-19 02:15:20",NA,NA,"","Instruyó concentrar esfuerzos en garantizar la seguridad, restablecer servicios básicos e iniciar trabajos de reconstrucción a la brevedad.",97,54,0,0,0,"2015-05-28 19:20:43","2015-06-17 00:07:22",0,NA
"20",512959132388061184,115556255,"Fri Sep 19 13:39:22 +0000 2014","2014-09-19 13:39:22",NA,NA,"","Acompañé al Pdte. @EPN en el izamiento de Bandera en memoria de las personas que fallecieron en el sismo de 1985. http://t.co/0JIQV9oYxX",209,118,0,0,0,"2015-05-28 19:20:43","2015-06-17 00:07:22",0,NA
"21",513046223461568512,115556255,"Fri Sep 19 19:25:26 +0000 2014","2014-09-19 19:25:26",NA,NA,"","Felicito a Carmen Lira y a todo el equipo de la @LaJornada por su treinta aniversario.",59,26,0,0,0,"2015-05-28 19:20:43","2015-06-22 12:31:06",0,NA
"22",513163887815196672,115556255,"Sat Sep 20 03:12:59 +0000 2014","2014-09-20 03:12:59",NA,NA,"","Se activaron los protocolos por sismo con epicentro Loc. 96 km al SUROESTE de PIJIJIAPAN, CHIS de magnitud preliminar de 5.5",77,34,0,0,0,"2015-05-28 19:20:43","2015-06-22 12:31:06",0,NA
"23",513541334922452992,115556255,"Sun Sep 21 04:12:50 +0000 2014","2014-09-21 04:12:50",NA,NA,"","Felicidades a Irma ""Torbellino"" García por su triunfo en el box. Es un orgullo de la @PoliciaFedMx",69,65,0,0,0,"2015-05-28 19:20:43","2015-06-22 12:31:06",0,NA
"24",514071396436414464,115556255,"Mon Sep 22 15:19:06 +0000 2014","2014-09-22 15:19:06",NA,NA,"","Felicidades a toda la comunidad de la @UNAM_MX por 104 años de éxitos. Orgullo de México desde su fundación.",101,53,0,0,0,"2015-05-28 19:20:43","2015-06-23 14:11:30",0,NA
"25",514096003751084032,115556255,"Mon Sep 22 16:56:53 +0000 2014","2014-09-22 16:56:53",NA,NA,"","Mucho éxito @Adela_Micha en tu nuevo espacio ""El Origen de la Noticia"" en @Imagen_Mx",36,24,0,0,0,"2015-05-28 19:20:43","2015-06-23 14:11:30",0,NA
"26",514167218071146496,115556255,"Mon Sep 22 21:39:52 +0000 2014","2014-09-22 21:39:52",NA,NA,"","En Chihuahua, con @jc_ramirezmarin y @GoberDuarte inauguramos el Centro Deportivo y de Esparcimiento Familiar para policías.",110,50,0,0,0,"2015-05-28 19:20:43","2015-06-23 16:54:45",0,NA
"27",514168025491447808,115556255,"Mon Sep 22 21:43:04 +0000 2014","2014-09-22 21:43:04",NA,NA,"","El Centro contribuye al bienestar de policías y sus familias, reconoce su trabajo y es muestra del esfuerzo integral que impulsa el @gobrep.",59,34,0,0,0,"2015-05-28 19:20:43","2015-06-23 16:54:45",0,NA
"28",514168738070167552,115556255,"Mon Sep 22 21:45:54 +0000 2014","2014-09-22 21:45:54",NA,NA,"","Como lo comprometió el Presidente @EPN, Juárez y Chihuahua tendrán los próximos días nuevas patrullas.",67,41,0,0,0,"2015-05-28 19:20:43","2015-06-24 11:19:58",0,NA
"29",514169050646466560,115556255,"Mon Sep 22 21:47:09 +0000 2014","2014-09-22 21:47:09",NA,NA,"","Cuando trabajamos juntos, @GobRep y los estados, entregamos mejores resultados. Este Centro es muestra de ello.",77,46,0,0,0,"2015-05-28 19:20:43","2015-06-24 11:19:58",0,NA
"30",514169337293590528,115556255,"Mon Sep 22 21:48:17 +0000 2014","2014-09-22 21:48:17",NA,NA,""," Gracias @GoberDuarte por tu hospitalidad.",40,25,0,0,0,"2015-05-28 19:20:43","2015-06-25 10:15:41",0,NA
"31",514207430407102464,115556255,"Tue Sep 23 00:19:39 +0000 2014","2014-09-23 00:19:39",NA,NA,"","Llegando a #BCS con integrantes del Gabinete. Sostendremos reunión para evaluar daños y avances de las acciones tras el huracán Odile.",96,53,0,0,0,"2015-05-28 19:20:43","2015-06-25 10:15:41",0,NA
"32",514258355104534528,115556255,"Tue Sep 23 03:42:00 +0000 2014","2014-09-23 03:42:00",NA,NA,"","Vista aerea de los cabos! Informa @CFEmx que al momento ya tiene 20% de recuperacion electrica! http://t.co/UqZ3QSUhUJ",141,66,0,0,0,"2015-05-28 19:20:43","2015-06-25 10:15:41",0,NA
"33",514498491981529088,115556255,"Tue Sep 23 19:36:14 +0000 2014","2014-09-23 19:36:14",NA,NA,"","En La Paz, con miembros del Gabinete y @MCV_Gobernador informamos de las acciones para la recuperación de BCS. http://t.co/sW0RNuZAia",111,55,0,0,0,"2015-05-28 19:20:43","2015-06-25 10:15:41",0,NA
"34",514542745785217024,115556255,"Tue Sep 23 22:32:05 +0000 2014","2014-09-23 22:32:05",NA,NA,"","Hoy Día Internacional contra la Explotación Sexual reiteramos nuestro compromiso con erradicar los delitos que denigren la dignidad humana.",156,70,0,0,0,"2015-05-28 19:20:43","2015-06-29 10:54:15",0,NA
"35",514846182951378944,115556255,"Wed Sep 24 18:37:50 +0000 2014","2014-09-24 18:37:50",NA,NA,"","Le agradezco a @causaencomun y  @MaElenaMorera por la invitación al III #ForoSumemosCausas por la Seguridad, Ciudadanos + Policías.",40,21,0,0,0,"2015-05-28 19:20:43","2015-06-29 10:54:15",0,NA
"36",514846643473367040,115556255,"Wed Sep 24 18:39:39 +0000 2014","2014-09-24 18:39:39",NA,NA,"","Trabajando juntos, sociedad y gobierno, damos mejores resultados. http://t.co/ozbtegPm08",77,30,0,0,0,"2015-05-28 19:20:43","2015-06-29 10:54:15",0,NA
"37",514847234576617472,115556255,"Wed Sep 24 18:42:00 +0000 2014","2014-09-24 18:42:00",NA,NA,"","En el gobierno de @EPN estamos convencidos de que las soluciones duraderas requieren del respaldo y la participación de la sociedad civil.",101,48,0,0,0,"2015-05-28 19:20:43","2015-07-02 00:16:08",0,NA
"38",514894656027787264,115556255,"Wed Sep 24 21:50:26 +0000 2014","2014-09-24 21:50:26",NA,NA,"","RT @PresidenciaMX: Texto de la Intervención del Presidente @EPN en la Asamblea General de la @UN @ONU_es #UNGA http://t.co/2icddo95q2 http:…",135,0,0,0,0,"2015-05-28 19:20:43","2015-07-06 16:36:30",1,NA
"39",514897024433795072,115556255,"Wed Sep 24 21:59:51 +0000 2014","2014-09-24 21:59:51",NA,NA,"","RT @PresidenciaMX: Es tiempo de construir una nueva Organización de las Naciones Unidas @UN  @ONU_es para un nuevo siglo: @EPN http://t.co/…",61,0,0,0,0,"2015-05-28 19:20:43","2015-07-06 16:36:30",1,NA
"40",514967374265847808,115556255,"Thu Sep 25 02:39:24 +0000 2014","2014-09-25 02:39:24",NA,NA,"","Felicito al Gobernador @eruviel_avila por su Tercer Informe de Gobierno. Un saludo a todos los mexiquenses.",128,91,0,0,0,"2015-05-28 19:20:43","2015-07-06 16:36:30",0,NA
"41",515305496266682368,115556255,"Fri Sep 26 01:02:58 +0000 2014","2014-09-26 01:02:58",NA,NA,"","Esta tarde, integrantes del Gabinete acompañamos al Presidente @EPN a una gira de trabajo en Los Cabos, Baja California Sur.",76,46,0,0,0,"2015-05-28 19:20:43","2015-07-06 16:36:30",0,NA
"42",515305966049718272,115556255,"Fri Sep 26 01:04:50 +0000 2014","2014-09-26 01:04:50",NA,NA,"","El Presidente @EPN se reunió con prestadores de servicios turísticos, supervisó avances y acciones tras Odile. http://t.co/dJSTpd4Pej",81,50,0,0,0,"2015-05-28 19:20:43","2015-07-06 16:36:30",0,NA
"43",515306480472715264,115556255,"Fri Sep 26 01:06:53 +0000 2014","2014-09-26 01:06:53",NA,NA,"","A 9 días del huracán #Odile, Baja California Sur se encuentra ya en la etapa de reactivación económica y reconstrucción.",88,50,0,0,0,"2015-05-28 19:20:43","2015-07-06 16:36:30",0,NA
"44",515343493196414976,115556255,"Fri Sep 26 03:33:58 +0000 2014","2014-09-26 03:33:58",NA,NA,"","Felicidades @Denise_Maerker y a todo el equipo de trabajo de @puntopartida por su noveno aniversario.",66,35,0,0,0,"2015-05-28 19:20:43","2015-07-06 21:42:02",0,NA
"45",515692505682440192,115556255,"Sat Sep 27 02:40:49 +0000 2014","2014-09-27 02:40:49",NA,NA,"","Acudí a la Cámara de @Mx_Diputados para informar de los avances en materia de política interior con motivo de la glosa del #SegundoInforme",59,41,0,0,0,"2015-05-28 19:20:43","2015-07-06 21:42:02",0,NA
"46",515693148983799808,115556255,"Sat Sep 27 02:43:22 +0000 2014","2014-09-27 02:43:22",NA,NA,"","Agradezco a los integrantes de comisiones de Gobernación y Seguridad de @MX_Diputados por este importante ejercicio de rendición de cuentas.",103,55,0,0,0,"2015-05-28 19:20:43","2015-07-06 21:42:02",0,NA
"47",515693489888452608,115556255,"Sat Sep 27 02:44:43 +0000 2014","2014-09-27 02:44:43",NA,NA,"","Cuando los Poderes de la Unión colaboramos, dialogamos y trabajamos juntos damos mejores resultados a los ciudadanos.",169,135,0,0,0,"2015-05-28 19:20:43","2015-07-07 13:57:01",0,NA
"48",515694411448352768,115556255,"Sat Sep 27 02:48:23 +0000 2014","2014-09-27 02:48:23",NA,NA,"","RT @CONAPO_mx: ""Yo me informé en el Centro de Salud."" Día Mundial para la Prevención del Embarazo  no Planificado en Adolescentes https://t…",43,0,0,0,0,"2015-05-28 19:20:43","2015-07-07 13:57:01",1,NA
"49",515700600773025792,115556255,"Sat Sep 27 03:12:59 +0000 2014","2014-09-27 03:12:59",NA,NA,"","Felicidades Gobernador Fernando Toranzo por su Quinto Informe de Gobierno @slpgobmx.",62,42,0,0,0,"2015-05-28 19:20:43","2015-07-07 13:57:01",0,NA
"50",516982985166696448,115556255,"Tue Sep 30 16:08:43 +0000 2014","2014-09-30 16:08:43",NA,NA,"","Felicito al @senadomexicano  por la aprobación del dictamen de la Ley General de los Derechos de Niñas, Niños y Adolescentes.",124,65,0,0,0,"2015-05-28 19:20:43","2015-07-07 13:57:01",0,NA
"51",516983303476641792,115556255,"Tue Sep 30 16:09:59 +0000 2014","2014-09-30 16:09:59",NA,NA,"","Con la aprobación de esta #IniciativaPreferente, México avanza en garantizar y proteger los derechos humanos de nuestra infancia.",96,47,0,0,0,"2015-05-28 19:20:43","2015-07-07 13:57:01",0,NA
"52",517066143987937280,115556255,"Tue Sep 30 21:39:10 +0000 2014","2014-09-30 21:39:10",NA,NA,"","En representación del Presidente @EPN asistí a la inauguración del “Encuentro por la Federación y la Unidad Nacional” en el @SenadoMexicano.",130,44,0,0,0,"2015-05-28 19:20:43","2015-07-07 13:57:01",0,NA
"53",517066645094027264,115556255,"Tue Sep 30 21:41:09 +0000 2014","2014-09-30 21:41:09",NA,NA,"","La instrucción del Presidente @EPN es impulsar un federalismo que articule esfuerzos y potencie capacidades. http://t.co/DttFRvK6yw",244,99,0,0,0,"2015-05-28 19:20:43","2015-07-07 13:57:01",0,NA
"54",517067599310778368,115556255,"Tue Sep 30 21:44:56 +0000 2014","2014-09-30 21:44:56",NA,NA,"","México vive un momento histórico de transformación nacional, que debe venir acompañado de cambios desde lo local.",314,182,0,0,0,"2015-05-28 19:20:43","2015-07-09 17:30:57",0,NA
"55",517068788886667264,115556255,"Tue Sep 30 21:49:40 +0000 2014","2014-09-30 21:49:40",NA,NA,"","Reconozco a @MBarbosaMx y al @SenadoMexicano su voluntad e interés en reflexionar sobre los retos y fortalezas del federalismo.",165,69,0,0,0,"2015-05-28 19:20:43","2015-07-09 17:30:57",0,NA
"56",518482902255165440,115556255,"Sat Oct 04 19:28:51 +0000 2014","2014-10-04 19:28:51",NA,NA,"","Se activaron los protocolos de @PcSegob para el SISMO Magnitud Preliminar de 6.2 Loc. 47 km al SURESTE de SAYULA DE ALEMAN, VER.",232,77,0,0,0,"2015-05-28 19:20:43","2015-07-09 17:30:57",0,NA
"57",518488445791240192,115556255,"Sat Oct 04 19:50:53 +0000 2014","2014-10-04 19:50:53",NA,NA,"","Hasta el momento @PcSegob reporta que se sintió en los estados de Veracruz, Puebla, Oaxaca y Chiapas. La magnitud final fue de 5.6",153,53,0,0,0,"2015-05-28 19:20:43","2015-07-12 22:41:23",0,NA
"58",519184556705218560,115556255,"Mon Oct 06 17:56:58 +0000 2014","2014-10-06 17:56:58",NA,NA,"","RT @EPN: Ante los lamentables hechos de violencia en Iguala, Guerrero, instruí al gabinete de seguridad del @GobRep esclarecer el acontecim…",808,0,0,0,0,"2015-05-28 19:20:43","2015-07-12 22:41:23",1,NA
"59",519184580830842880,115556255,"Mon Oct 06 17:57:04 +0000 2014","2014-10-06 17:57:04",NA,NA,"","RT @EPN: Como toda la sociedad mexicana, me encuentro indignado y consternado ante esta situación, y les aseguro que no habrá impunidad.",714,0,0,0,0,"2015-05-28 19:20:43","2015-07-13 15:19:53",1,NA
"60",519184625428885504,115556255,"Mon Oct 06 17:57:15 +0000 2014","2014-10-06 17:57:15",NA,NA,"","RT @EPN: A través del gabinete de seguridad se mantendrá informada a la sociedad sobre las investigaciones y avances hasta esclarecer esta …",656,0,0,0,0,"2015-05-28 19:20:43","2015-07-13 15:19:53",1,NA
"61",519273353774125056,115556255,"Mon Oct 06 23:49:49 +0000 2014","2014-10-06 23:49:49",NA,NA,"","En León, asistí al encuentro constitutivo de la @CONAMM. http://t.co/FlgHnYNeYY",115,44,0,0,0,"2015-05-28 19:20:43","2015-07-13 15:19:53",0,NA
"62",519274010027503616,115556255,"Mon Oct 06 23:52:26 +0000 2014","2014-10-06 23:52:26",NA,NA,"","La instrucción del Pdte @EPN es fortalecer al municipio; que cuente con mejores capacidades y herramientas para hacer frente a sus desafíos.",158,76,0,0,0,"2015-05-28 19:20:43","2015-07-13 15:19:53",0,NA
"63",519275782963986432,115556255,"Mon Oct 06 23:59:28 +0000 2014","2014-10-06 23:59:28",NA,NA,"","Mi reconocimiento a @RenanBarrera @Barbara_Botello @Leticia_Quezada. El mayor de los éxitos en sus nuevas responsabilidades en la @CONAMM.",157,55,0,0,0,"2015-05-28 19:20:43","2015-07-13 15:19:53",0,NA
"64",519686284365676544,115556255,"Wed Oct 08 03:10:40 +0000 2014","2014-10-08 03:10:40",NA,NA,"","Sismo de 6.1 Loc. 88 km al suroeste de Navolato, Sin. @PcSegob reporta que se sintió en Sinaloa, sin daños hasta el momento.",192,111,0,0,0,"2015-05-28 19:20:43","2015-07-13 15:19:53",0,NA
"65",519908985299009536,115556255,"Wed Oct 08 17:55:36 +0000 2014","2014-10-08 17:55:36",NA,NA,"","Felicidades a @mcmaricarmen,  @Marco_Mares, @JoseYuste y a todo el equipo de #FórmulaFinanciera por su 17o aniversario.",34,20,0,0,0,"2015-05-28 19:20:43","2015-07-13 15:19:53",0,NA
"66",519910718062465024,115556255,"Wed Oct 08 18:02:29 +0000 2014","2014-10-08 18:02:29",NA,NA,"","Felicito a @CarlosLoret y  a su equipo por el séptimo aniversario de su programa Contraportada en @Radio_Formula.",45,21,0,0,0,"2015-05-28 19:20:43","2015-07-20 22:26:43",0,NA
"67",520330493712433152,115556255,"Thu Oct 09 21:50:31 +0000 2014","2014-10-09 21:50:31",NA,NA,"","Felicito a la Ministra Olga Sánchez por haber sido galardonada con la Medalla al Mérito Cívico Eduardo Neri. ¡Primera mujer en recibirla!",85,50,0,0,0,"2015-05-28 19:20:43","2015-07-20 22:26:43",0,NA
"68",520399016056877056,115556255,"Fri Oct 10 02:22:48 +0000 2014","2014-10-10 02:22:48",NA,NA,"","RT @EPN: Reconozco la acción coordinada del Gabinete de Seguridad, que permitió la detención de Vicente Carrillo Fuentes.",661,0,0,0,0,"2015-05-28 19:20:43","2015-07-20 22:26:43",1,NA
"69",520683737714294784,115556255,"Fri Oct 10 21:14:11 +0000 2014","2014-10-10 21:14:11",NA,NA,"","En Aguascalientes, acompañé al Presidente @EPN a la ceremonia conmemorativa del Centenario de la Soberana Convención Militar Revolucionaria.",46,29,0,0,0,"2015-05-28 19:20:43","2015-07-20 22:26:43",0,NA
"70",520684152790994944,115556255,"Fri Oct 10 21:15:50 +0000 2014","2014-10-10 21:15:50",NA,NA,"","Asimismo, asistí la XLVII Reunión Ordinaria de la @CONAGO_oficial. http://t.co/upmxVkhf2D",58,36,0,0,0,"2015-05-28 19:20:43","2015-07-20 22:26:43",0,NA
"71",520684757529939968,115556255,"Fri Oct 10 21:18:14 +0000 2014","2014-10-10 21:18:14",NA,NA,"","Celebro que los integrantes de la @CONAGO_oficial hayan tomado importantes acuerdos en materia de DDHH y por la igualdad de género.",90,51,0,0,0,"2015-05-28 19:20:43","2015-07-20 22:26:43",0,NA
"72",520685159566565376,115556255,"Fri Oct 10 21:19:50 +0000 2014","2014-10-10 21:19:50",NA,NA,"","Felicito a @CarlosLozanoAgs presidente saliente de @CONAGO_oficial y le deseo éxito a @JHerreraCaldera al frente de esta responsabilidad.",86,44,0,0,0,"2015-05-28 19:20:43","2015-07-25 20:53:55",0,NA
"73",520986805458731008,115556255,"Sat Oct 11 17:18:28 +0000 2014","2014-10-11 17:18:28",NA,NA,"","La magnitud del sismo registrado esta mañana en Oaxaca y Puebla es de 5.6. @PcSegob no reporta daños hasta el momento.",247,98,0,0,0,"2015-05-28 19:20:43","2015-07-25 20:53:55",0,NA
"74",521744280109715456,115556255,"Mon Oct 13 19:28:24 +0000 2014","2014-10-13 19:28:24",NA,NA,"","En Puebla, acompañé al Presidente @EPN al XII Encuentro Iberoamericano de la Sociedad Civil. http://t.co/qRMohBQSi8",116,50,0,0,0,"2015-05-28 19:20:43","2015-07-25 20:53:55",0,NA
"75",521745142622191616,115556255,"Mon Oct 13 19:31:50 +0000 2014","2014-10-13 19:31:50",NA,NA,"","Para el gobierno de @EPN la participación de la sociedad civil en el diseño y ejecución de los programas es fundamental.",163,66,0,0,0,"2015-05-28 19:20:43","2015-07-25 20:53:55",0,NA
"76",521776115543982080,115556255,"Mon Oct 13 21:34:54 +0000 2014","2014-10-13 21:34:54",NA,NA,"","La prevención es la mejor manera de salvaguardar la vida y el patrimonio de los mexicanos. #DíaInternacionalParaReducciónDeDesastres",123,69,0,0,0,"2015-05-28 19:20:43","2015-07-25 20:53:55",0,NA
"77",521776422474764288,115556255,"Mon Oct 13 21:36:07 +0000 2014","2014-10-13 21:36:07",NA,NA,"","Por ello, el Presidente @EPN instruyó cambiar el enfoque de la política de protección civil, para privilegiar la prevención.",103,56,0,0,0,"2015-05-28 19:20:43","2015-07-25 20:53:55",0,NA
"78",521834440310677504,115556255,"Tue Oct 14 01:26:40 +0000 2014","2014-10-14 01:26:40",NA,NA,"","Un abrazo para @Adela_Micha por el décimo aniversario de las @NoticiasxAdela. ¡Felicidades!",71,64,0,0,0,"2015-05-28 19:20:43","2015-07-25 20:53:55",0,NA
"79",522161769138356224,115556255,"Tue Oct 14 23:07:21 +0000 2014","2014-10-14 23:07:21",NA,NA,"","Hoy @CarlosLozanoAgs rindió cuentas de sus avances y resultados durante su IV Informe de Gobierno.",43,27,0,0,0,"2015-05-28 19:20:43","2015-07-28 22:52:20",0,NA
"80",522445936174571520,115556255,"Wed Oct 15 17:56:32 +0000 2014","2014-10-15 17:56:32",NA,NA,"","Un saludo a quienes laboran en @ElFinanciero_Mx con motivo de su 33 aniversario.",47,23,0,0,0,"2015-05-28 19:20:43","2015-07-28 22:52:20",0,NA
"81",522529392774639616,115556255,"Wed Oct 15 23:28:10 +0000 2014","2014-10-15 23:28:10",NA,NA,"","Éxito en el ejercicio de rendición de cuentas que realizará @RodrigoMedina con motivo de su V Informe de Gobierno en Nuevo León.",45,29,0,0,0,"2015-05-28 19:20:43","2015-07-28 22:52:20",0,NA
"82",522563359909351424,115556255,"Thu Oct 16 01:43:08 +0000 2014","2014-10-16 01:43:08",NA,NA,"","Mi reconocimiento a @AnaPOrdorica por su importante labor en estos siete años en #FrentealPaís por @Imagen_Mx.",43,28,0,0,0,"2015-05-28 19:20:43","2015-07-28 22:52:20",0,NA
"83",522817814080794624,115556255,"Thu Oct 16 18:34:15 +0000 2014","2014-10-16 18:34:15",NA,NA,"","Hoy en su aniversario, envío una felicitación a quienes hacen posible @antenaradio de @imerhoy.",82,27,0,0,0,"2015-05-28 19:20:43","2015-07-28 22:52:20",0,NA
"84",525436865596620800,115556255,"Fri Oct 24 00:01:25 +0000 2014","2014-10-24 00:01:25",NA,NA,"","Esta tarde, me reuní con legisladores locales de todo el país en la V Asamblea Plenaria de @CopecolMx. http://t.co/lROfTpDDcn",94,65,0,0,0,"2015-05-28 19:20:43","2015-07-28 22:52:20",0,NA
"85",525437495639810048,115556255,"Fri Oct 24 00:03:55 +0000 2014","2014-10-24 00:03:55",NA,NA,"","El compromiso es seguir trabajando juntos para afrontar los retos que vive el país y entregar los resultados que la sociedad espera.",138,80,0,0,0,"2015-05-28 19:20:43","2015-07-28 22:52:20",0,NA
"86",525711892413960192,115556255,"Fri Oct 24 18:14:17 +0000 2014","2014-10-24 18:14:17",NA,NA,"","Acompañé al Presidente @EPN durante la clausura de la V Asamblea de la @CopecolMx. http://t.co/8xljAaaeRD",114,79,0,0,0,"2015-05-28 19:20:43","2015-07-28 22:52:20",0,NA
"87",525712228277026816,115556255,"Fri Oct 24 18:15:37 +0000 2014","2014-10-24 18:15:37",NA,NA,"","Como lo señaló el Presidente @EPN, la corresponsabilidad es fundamental para asegurar que el Estado de Derecho impere en todo el territorio.",139,76,0,0,0,"2015-05-28 19:20:43","2015-07-28 22:52:20",0,NA
"88",525712474885349376,115556255,"Fri Oct 24 18:16:35 +0000 2014","2014-10-24 18:16:35",NA,NA,"","Desde @SEGOB_mx seguiremos fortaleciendo el diálogo y la colaboración con los demás poderes y órdenes de gobierno para cumplir ese objetivo.",112,67,0,0,0,"2015-05-28 19:20:43","2015-07-28 22:52:20",0,NA
"89",526097270685839360,115556255,"Sat Oct 25 19:45:38 +0000 2014","2014-10-25 19:45:38",NA,NA,"","Hoy @SEDENAmx , institución pilar de México, cumple 77 años. Mi reconocimiento a sus integrantes por su entrega, lealtad y profesionalismo.",85,55,0,0,0,"2015-05-28 19:20:43","2015-08-03 00:03:14",0,NA
