"","id_tweet","id_twitter","created_at","created_at_datetime","in_reply_to_user_id","in_reply_to_status_id","in_reply_to_screen_name","text","retweet_count","favorite_count","longitude","latitude","retweeted","creation_date","modification_date","RT_temp","is_retweeted"
"1750",828375960491732992,115556255,"Sun Feb 05 22:53:14 +0000 2017","2017-02-05 22:53:14",NA,NA,"","Honremos nuestra historia, recordando los ideales que forjaron los Constituyentes al crear la #Constitución1917",299,370,0,0,0,"2017-02-06 00:54:45","2017-04-18 17:24:30",0,0
"1751",828374163228237824,115556255,"Sun Feb 05 22:46:05 +0000 2017","2017-02-05 22:46:05",NA,NA,"","Con el Pdte. @EPN conmemoramos el Centenario de la #Constitución1917, pieza fundamental del México que somos. https://t.co/7FVbLKLijp",279,281,0,0,0,"2017-02-06 00:54:45","2017-04-18 17:24:30",0,0
"1752",828284721314426880,115556255,"Sun Feb 05 16:50:41 +0000 2017","2017-02-05 16:50:41",NA,NA,"","Un momento de transformación histórica para la #CDMX, que se ha logrado gracias al diálogo y los acuerdos. https://t.co/wZFcAr2HgT",258,276,0,0,0,"2017-02-06 00:54:46","2017-04-18 17:24:30",0,0
"1753",828283150706962432,115556255,"Sun Feb 05 16:44:26 +0000 2017","2017-02-05 16:44:26",NA,NA,"","En representación del Pdte. @EPN participé en la Ceremonia de Promulgación de la Constitución de la #CDMX junto con… https://t.co/Ltm8zB5Wmr",261,238,0,0,0,"2017-02-06 00:54:46","2017-04-18 17:24:30",0,0
"1754",828246343382478848,115556255,"Sun Feb 05 14:18:10 +0000 2017","2017-02-05 14:18:10",NA,NA,"","En la promulgación de la Constitución de la Ciudad de México #CDMX https://t.co/UpH6RruDKA",444,426,0,0,0,"2017-02-06 00:54:54","2017-04-13 05:59:30",0,0
"1755",828238045979635712,115556255,"Sun Feb 05 13:45:12 +0000 2017","2017-02-05 13:45:12",NA,NA,"","Honremos a los Constituyentes siguiendo su ejemplo de unidad y amor a México, para construir el país que todas y to… https://t.co/4GadzludWs",264,237,0,0,0,"2017-02-06 00:54:58","2017-04-13 05:59:30",0,0
"1756",829432247312801792,115556255,"Wed Feb 08 20:50:32 +0000 2017","2017-02-08 20:50:32",NA,NA,"","En la renovación de la dirigencia de la Conferencia Nacional de Municipios de México #CONAMM https://t.co/lHueTjHyXq",332,354,0,0,0,"2017-02-08 15:54:41","2017-04-25 03:39:45",0,0
"1757",829198122706415616,115556255,"Wed Feb 08 05:20:12 +0000 2017","2017-02-08 05:20:12",NA,NA,"","Gran participación de #México en la #SerieDelCaribe @Culiacan2017. Mi reconocimiento a las @AguilasDeMxli por poner en alto a nuestro país.",233,300,0,0,0,"2017-02-08 15:54:50","2017-04-25 03:39:45",0,0
"1758",829176388796170240,115556255,"Wed Feb 08 03:53:51 +0000 2017","2017-02-08 03:53:51",NA,NA,"","Con el Pdte. @EPN recibimos a connacionales repatriados de los EEUU y reiteramos el compromiso de generar mejores o… https://t.co/Idm0cUnA9l",442,502,0,0,0,"2017-02-08 15:54:51","2017-04-25 03:39:45",0,0
"1759",829138180943142912,115556255,"Wed Feb 08 01:22:01 +0000 2017","2017-02-08 01:22:01",NA,NA,"","Muchas felicidades Dolores Colín @rf59 por tu nueva columna en @diario24horas.",151,188,0,0,0,"2017-02-08 15:54:59","2017-04-25 03:39:45",0,0
"1760",829123548081909760,115556255,"Wed Feb 08 00:23:52 +0000 2017","2017-02-08 00:23:52",NA,NA,"","Paisano nos une el orgullo de ser mexicanos y el amor a nuestra patria. En tu regreso a casa el Programa Somos Mexi… https://t.co/KfeuVA5YKC",411,424,0,0,0,"2017-02-08 15:54:59","2017-04-21 23:32:32",0,0
"1761",829110587380502528,115556255,"Tue Feb 07 23:32:22 +0000 2017","2017-02-07 23:32:22",NA,NA,"","Nuestros connacionales que retornan son un activo para México, les brindaremos todo el apoyo para que se reincorporen con éxito.",389,422,0,0,0,"2017-02-08 15:55:07","2017-04-21 23:32:32",0,0
"1762",829110386934681600,115556255,"Tue Feb 07 23:31:35 +0000 2017","2017-02-07 23:31:35",NA,NA,"","Hoy el Pdte. @EPN recibió personalmente a connacionales repatriados de los EEUU. En éste, su país, cuentan con nues… https://t.co/3mxjtjJlMz",479,465,0,0,0,"2017-02-08 15:55:07","2017-04-21 23:32:32",0,0
"1763",829096700937658368,115556255,"Tue Feb 07 22:37:12 +0000 2017","2017-02-07 22:37:12",NA,NA,"","Acordé con el Srio. John Kelly reunirnos próximamente en la Cd. de México para abordar de manera personal la amplia agenda común.",332,309,0,0,0,"2017-02-08 15:55:15","2017-04-21 23:32:32",0,0
"1764",829096333684379648,115556255,"Tue Feb 07 22:35:44 +0000 2017","2017-02-07 22:35:44",NA,NA,"","Hoy sostuve una llamada con el Srio. John Kelly de @DHSgov. Ambos coincidimos en la importancia de la cooperación entre nuestros países.",337,300,0,0,0,"2017-02-08 15:55:15","2017-04-21 23:32:32",0,0
"1765",828749854243450880,115556255,"Mon Feb 06 23:38:57 +0000 2017","2017-02-06 23:38:57",NA,NA,"","Mucho éxito al equipo mexicano de béisbol en la semifinal vs Cuba de la #SeriedelCaribe. ¡Vamos México! #SDC2017 @AguilasDeMxli",309,381,0,0,0,"2017-02-08 15:55:15","2017-04-20 16:52:25",0,0
"1766",829872367711031296,115556255,"Fri Feb 10 01:59:25 +0000 2017","2017-02-10 01:59:25",NA,NA,"","Felicito a @aaguirre_g por su regreso a las noticias de radio para #Veracruz, en @olivanoticias.",234,262,0,0,0,"2017-02-10 06:20:47","2017-04-25 03:39:45",0,0
"1767",829806363421270016,115556255,"Thu Feb 09 21:37:08 +0000 2017","2017-02-09 21:37:08",NA,NA,"","RT @EPN: Les deseo el mayor de los éxitos en esta nueva e importante responsabilidad dentro del Sistema Nacional Anticorrupción #SNA.",782,0,0,0,0,"2017-02-10 06:20:48","2017-04-25 03:39:45",1,1
"1768",829806136329007104,115556255,"Thu Feb 09 21:36:14 +0000 2017","2017-02-09 21:36:14",NA,NA,"","RT @EPN: Felicito a los integrantes del Comité de Participación Ciudadana del #SNA, que este día recibieron su constancia de nombramiento.",711,0,0,0,0,"2017-02-10 06:20:48","2017-04-25 03:39:45",1,1
"1769",829801409625206784,115556255,"Thu Feb 09 21:17:27 +0000 2017","2017-02-09 21:17:27",NA,NA,"","Hoy y siempre, debemos de sentirnos orgullosos de ser mexicanos y creer en la grandeza de nuestro país.",578,695,0,0,0,"2017-02-10 06:20:48","2017-04-25 03:39:45",0,0
"1770",829800815095324672,115556255,"Thu Feb 09 21:15:05 +0000 2017","2017-02-09 21:15:05",NA,NA,"","En el 104 Aniversario de la #MarchaDeLaLealtad, con el Pdte @EPN, reconocemos el gran trabajo que realizan a diario… https://t.co/JFMNtDhnjA",406,333,0,0,0,"2017-02-10 06:20:48","2017-04-25 03:39:45",0,0
"1771",829484119759392768,115556255,"Thu Feb 09 00:16:39 +0000 2017","2017-02-09 00:16:39",NA,NA,"","Mi felicitación para @DrRamonEnriquez como nuevo presidente de la @CONAMM, mucho éxito en su gestión. https://t.co/EMc8bshF6U",317,305,0,0,0,"2017-02-10 06:20:57","2017-04-25 03:39:45",0,0
"1772",829483592300503040,115556255,"Thu Feb 09 00:14:34 +0000 2017","2017-02-09 00:14:34",NA,NA,"","La unidad nacional se construye desde el municipio; por ello y para sumar esfuerzos en favor de México, me reuní ho… https://t.co/Kss5aq9lkN",368,353,0,0,0,"2017-02-10 06:20:57","2017-04-25 03:39:45",0,0
"1773",830227238113062912,115556255,"Sat Feb 11 01:29:33 +0000 2017","2017-02-11 01:29:33",NA,NA,"","En el Aniversario de la #FuerzaAéreaMexicana reconocemos a mujeres y hombres comprometidos y leales con México. https://t.co/HHHsieHP0B",278,318,0,0,0,"2017-02-11 04:15:20","2017-04-26 22:37:52",0,0
"1774",830164526620352512,115556255,"Fri Feb 10 21:20:21 +0000 2017","2017-02-10 21:20:21",NA,NA,"","Junto a @S_Cienfuegos_Z y @AlmSoberon asistí a la Ceremonia de la Imposición de la Medalla “Gran Orden de la Victor… https://t.co/7RpbQY6Yek",297,335,0,0,0,"2017-02-11 04:15:20","2017-04-26 22:37:52",0,0
"1775",830057792744591360,115556255,"Fri Feb 10 14:16:14 +0000 2017","2017-02-10 14:16:14",NA,NA,"","Hoy reconocemos el compromiso, lealtad y valor de la Fuerza Aérea Mexicana. https://t.co/N5Ze4XUk5S",564,700,0,0,0,"2017-02-11 04:15:29","2017-04-26 22:37:52",0,0
"1776",830544572358991872,115556255,"Sat Feb 11 22:30:31 +0000 2017","2017-02-11 22:30:31",NA,NA,"","Escuchemos todas las voces para construir un país más unido e incluyente. Hoy México necesita de cada una y cada un… https://t.co/F0kanmAwdw",525,498,0,0,0,"2017-02-12 10:35:49","2017-04-26 22:37:52",0,0
"1777",830909680029409280,115556255,"Sun Feb 12 22:41:19 +0000 2017","2017-02-12 22:41:19",NA,NA,"","A nuestros paisanos en EUA, les comparto información relevante. https://t.co/O72ff9lhBi",754,542,0,0,0,"2017-02-12 23:52:04","2017-04-26 22:37:52",0,0
"1778",831256286226288640,115556255,"Mon Feb 13 21:38:37 +0000 2017","2017-02-13 21:38:37",NA,NA,"","Hoy en reunión con @AIMexico reafirmamos el compromiso del @gobmx con la promoción y defensa de los derechos humano… https://t.co/GNxLJRoVbj",483,472,0,0,0,"2017-02-14 08:39:33","2017-04-26 22:37:52",0,0
"1779",831667129959272448,115556255,"Wed Feb 15 00:51:10 +0000 2017","2017-02-15 00:51:10",NA,NA,"","Erradicar la violencia contra las mujeres requiere del compromiso de todas y todos. Trabajemos juntos para cerrarle… https://t.co/2RbGfNyr5S",670,512,0,0,0,"2017-02-14 22:09:16","2017-04-28 00:53:19",0,0
"1780",831620916325076992,115556255,"Tue Feb 14 21:47:31 +0000 2017","2017-02-14 21:47:31",NA,NA,"","Digamos basta a la violencia contra las mujeres, digamos basta a las acciones que lastiman y denigran a la mujer. https://t.co/jNJJoFej6z",531,467,0,0,0,"2017-02-14 22:09:26","2017-04-28 00:53:19",0,0
"1781",831617874674511872,115556255,"Tue Feb 14 21:35:26 +0000 2017","2017-02-14 21:35:26",NA,NA,"","Con @TonyGali inauguramos el 2do Centro de Justicia para las Mujeres en Puebla, el cual estará al servicio de miles… https://t.co/of88EKw9Qj",372,342,0,0,0,"2017-02-14 22:09:26","2017-04-28 00:53:19",0,0
"1782",831562347256770560,115556255,"Tue Feb 14 17:54:47 +0000 2017","2017-02-14 17:54:47",NA,NA,"","Inaugurando el Centro de Justicia para las Mujeres de Tehuacán, Puebla https://t.co/baCeUYpDVW",474,458,0,0,0,"2017-02-14 22:09:35","2017-04-28 00:53:19",0,0
"1783",831937384430370816,115556255,"Wed Feb 15 18:45:03 +0000 2017","2017-02-15 18:45:03",NA,NA,"","Mi reconocimiento a quienes con su entrega y compromiso hacen de ésta una gran Nación. #DíadelaMujerMexicana https://t.co/qkoIc4lbSC",635,660,0,0,0,"2017-02-16 06:12:26","2017-04-28 00:53:19",0,0
"1784",832381456181772288,115556255,"Fri Feb 17 00:09:38 +0000 2017","2017-02-17 00:09:38",NA,NA,"","Felicito a @jpcastanon por su trabajo y compromiso al frente del @cceoficialmx. #CCE40Aniversario.",372,308,0,0,0,"2017-02-17 03:27:25","2017-04-29 10:54:13",0,0
"1785",832381238396727296,115556255,"Fri Feb 17 00:08:46 +0000 2017","2017-02-17 00:08:46",NA,NA,"","Hoy con el Pdte. @EPN asistí al 40 Aniversario y XXXIV Asamblea General Ordinaria del Consejo Coordinador Empresari… https://t.co/1MxiUEXn2M",357,296,0,0,0,"2017-02-17 03:27:25","2017-04-29 10:54:13",0,0
"1786",833489339006976000,115556255,"Mon Feb 20 01:31:58 +0000 2017","2017-02-20 01:31:58",NA,NA,"","En el CIV Aniversario del Ejército, acompañé al Pdte. @EPN y @S_Cienfuegos_Z  a la inauguración de la Escuela Milit… https://t.co/8E9EskOH0d",285,350,0,0,0,"2017-02-20 01:05:17","2017-05-01 07:37:23",0,0
"1787",833351568602836992,115556255,"Sun Feb 19 16:24:31 +0000 2017","2017-02-19 16:24:31",NA,NA,"","Mi reconocimiento a nuestro Ejército, por su entrega y lealtad a la patria para salvaguardar la soberanía de México… https://t.co/HPVd9eTWlw",571,655,0,0,0,"2017-02-20 01:05:26","2017-04-29 10:54:13",0,0
"1788",833758885441830912,115556255,"Mon Feb 20 19:23:03 +0000 2017","2017-02-20 19:23:03",NA,NA,"","Junto con @aurelionuno presentamos acciones para fortalecer la seguridad y la convivencia escolar. #EsTareaDeTodos. https://t.co/llnyrr7EhO",460,404,0,0,0,"2017-02-20 18:43:29","2017-05-02 13:39:13",0,0
"1789",833754099904557056,115556255,"Mon Feb 20 19:04:02 +0000 2017","2017-02-20 19:04:02",NA,NA,"","Nuestra niñez es lo más importante. Garantizar que la escuela siga siendo el espacio más seguro #EsTareaDeTodos. https://t.co/aJ4FQ0qPr8",391,376,0,0,0,"2017-02-20 18:43:29","2017-05-02 13:39:13",0,0
"1790",833722398436306944,115556255,"Mon Feb 20 16:58:04 +0000 2017","2017-02-20 16:58:04",NA,NA,"","Presentando el Plan de Acción para la Convivencia Escolar y la Prevención Social de la Violencia https://t.co/sjOaplPs1W",489,469,0,0,0,"2017-02-20 18:43:29","2017-05-02 13:39:13",0,0
"1791",833703343038029824,115556255,"Mon Feb 20 15:42:21 +0000 2017","2017-02-20 15:42:21",NA,NA,"","RT @aurelionuno: Esta mañana, con el Srio. @osoriochong , presentaremos el Plan de Acción para la Convivencia Escolar y la Prevención Socia…",252,0,0,0,0,"2017-02-20 18:43:33","2017-05-02 13:39:13",1,1
"1792",834536415484637184,115556255,"Wed Feb 22 22:52:41 +0000 2017","2017-02-22 22:52:41",NA,NA,"","A un año de firmar el pacto #NosotrosPorEllas, somos el tercer país con más adherentes por la igualdad. ¡Sigamos su… https://t.co/if9ByiAI28",506,526,0,0,0,"2017-02-23 02:01:18","2017-05-02 13:39:13",0,0
"1793",834511242584809472,115556255,"Wed Feb 22 21:12:39 +0000 2017","2017-02-22 21:12:39",NA,NA,"","Hagamos una sola voz que se escuche fuerte: ¡Basta de violencia contra las mujeres! #VocalesPorLaIgualdad https://t.co/cI80FGfYjB",514,436,0,0,0,"2017-02-23 02:01:28","2017-05-02 13:39:13",0,0
"1794",834504516888326144,115556255,"Wed Feb 22 20:45:55 +0000 2017","2017-02-22 20:45:55",NA,NA,"","En el Estado de México con @eruviel_avila  @SEDESOL_mx e @inmujeres pusimos en marcha el Programa Vocales por la Ig… https://t.co/Bet4eXFJ4Y",387,330,0,0,0,"2017-02-23 02:01:28","2017-05-02 13:39:13",0,0
"1795",834472858503901184,115556255,"Wed Feb 22 18:40:07 +0000 2017","2017-02-22 18:40:07",NA,NA,"","Lanzando el Programa ""Vocales por la Igualdad"", un esfuerzo conjunto con Prospera https://t.co/VlYnQrBen0",625,502,0,0,0,"2017-02-23 02:01:38","2017-05-02 13:39:13",0,0
"1796",834445388379803648,115556255,"Wed Feb 22 16:50:58 +0000 2017","2017-02-22 16:50:58",NA,NA,"","Gran gusto haberme reunido con Senadoras del @PRI_Nacional para escuchar y compartir puntos de vista sobre los reto… https://t.co/zg9nCPmSpB",339,383,0,0,0,"2017-02-23 02:01:43","2017-05-02 13:39:13",0,0
"1797",835178537317462016,115556255,"Fri Feb 24 17:24:14 +0000 2017","2017-02-24 17:24:14",NA,NA,"","La bandera de México es reflejo de nuestra historia. Su escudo y sus colores son motivo de orgullo y de unidad naci… https://t.co/c4p7ch9Jmh",502,526,0,0,0,"2017-02-24 13:01:20","2017-05-03 19:54:48",0,0
"1798",834868715548250112,115556255,"Thu Feb 23 20:53:07 +0000 2017","2017-02-23 20:53:07",NA,NA,"","Toda acción que involucre a México deberá partir de un diálogo que considere las necesidades e intereses de nuestro País.",425,512,0,0,0,"2017-02-24 13:01:30","2017-05-03 19:54:48",0,0
"1799",834868320654520320,115556255,"Thu Feb 23 20:51:33 +0000 2017","2017-02-23 20:51:33",NA,NA,"","Expresamos las preocupaciones de los mexicanos sobre migración y seguridad, e insistimos en construir mejores condiciones de entendimiento.",367,408,0,0,0,"2017-02-24 13:01:30","2017-05-03 19:54:48",0,0
"1800",834868119336259584,115556255,"Thu Feb 23 20:50:45 +0000 2017","2017-02-23 20:50:45",NA,NA,"","El día de hoy nos reunimos los Srios. @LVidegaray, @JoseAMeadeK, Tillerson y Kelly para dialogar sobre la relación… https://t.co/PUaYGCXfUS",336,380,0,0,0,"2017-02-24 13:01:30","2017-05-03 19:54:48",0,0
"1801",835701176360439808,115556255,"Sun Feb 26 04:01:01 +0000 2017","2017-02-26 04:01:01",NA,NA,"","Me uno a la pena de la familia Carvajal por el fallecimiento de Gustavo Carvajal quien destacó como dirigente del PRI, senador y diputado.",302,425,0,0,0,"2017-02-26 08:45:35","2017-05-03 19:54:48",0,0
"1802",835537675964796928,115556255,"Sat Feb 25 17:11:20 +0000 2017","2017-02-25 17:11:20",NA,NA,"","Erradicar la violencia contra niñas y mujeres requiere de la suma de esfuerzos de todas y todos. #DíaNaranja https://t.co/n5tmcy8uKl",507,574,0,0,0,"2017-02-26 08:45:35","2017-05-03 19:54:48",0,0
"1803",835241571398402048,115556255,"Fri Feb 24 21:34:43 +0000 2017","2017-02-24 21:34:43",NA,NA,"","Hoy en Campo Marte con el Pdte. @EPN, rendimos homenaje a nuestra bandera, símbolo de unidad nacional. #EsMiBandera https://t.co/ArXC3zsmTv",321,374,0,0,0,"2017-02-26 08:45:35","2017-05-03 19:54:48",0,0
"1804",835941411270832128,115556255,"Sun Feb 26 19:55:38 +0000 2017","2017-02-26 19:55:38",NA,NA,"","La convivencia escolar, los derechos de las mujeres y la protección de nuestros connacionales, fueron las prioridad… https://t.co/80GQHsXDkm",323,335,0,0,0,"2017-02-27 10:01:58","2017-05-03 19:54:48",0,0
"1805",836345819762667520,115556255,"Mon Feb 27 22:42:36 +0000 2017","2017-02-27 22:42:36",NA,NA,"","Construir democracia no es labor de un día, sino tarea permanente que requiere la participación cotidiana de las y… https://t.co/xTlbUbgdpp",574,566,0,0,0,"2017-02-28 08:57:46","2017-05-05 12:49:16",0,0
"1806",836306589845975040,115556255,"Mon Feb 27 20:06:43 +0000 2017","2017-02-27 20:06:43",NA,NA,"","En las y los ciudadanos está el mayor activo que tiene México para fortalecer su democracia. #ENCCÍVICA",403,453,0,0,0,"2017-02-28 08:57:56","2017-05-03 19:54:48",0,0
"1807",836305789128179712,115556255,"Mon Feb 27 20:03:32 +0000 2017","2017-02-27 20:03:32",NA,NA,"","Hoy con el @INEMexico se presentó la Estrategia Nacional de Cultura Cívica, un mecanismo que impulsa la participaci… https://t.co/pw2uqHNtRF",395,358,0,0,0,"2017-02-28 08:57:56","2017-05-03 19:54:48",0,0
"1808",836262020915712000,115556255,"Mon Feb 27 17:09:37 +0000 2017","2017-02-27 17:09:37",NA,NA,"","Presentando la estrategia de cultura cívica del INE. Nuestra democracia es lo más importante que tenemos. https://t.co/YNbqEXMJrF",401,326,0,0,0,"2017-02-28 08:58:07","2017-05-03 19:54:48",0,0
"1809",836759993194070016,115556255,"Wed Mar 01 02:08:23 +0000 2017","2017-03-01 02:08:23",NA,NA,"","Un gusto reunirme con el Gobernador @Silvano_A para revisar la agenda conjunta que tenemos en favor de las y los mi… https://t.co/aKyJw6YiZC",225,249,0,0,0,"2017-03-01 04:08:03","2017-05-05 12:49:16",0,0
"1810",836681793252249600,115556255,"Tue Feb 28 20:57:38 +0000 2017","2017-02-28 20:57:38",NA,NA,"","Todo apoyo a gobiernos estatales en seguridad debe estar acompañado, siempre, del compromiso de construir corporaciones locales confiables.",403,387,0,0,0,"2017-03-01 04:08:12","2017-05-05 12:49:16",0,0
"1811",836681259241832448,115556255,"Tue Feb 28 20:55:31 +0000 2017","2017-02-28 20:55:31",NA,NA,"","El compromiso es trabajar en equipo con el gobierno estatal para erradicar la violencia y regresar la tranquilidad a Veracruz.",336,394,0,0,0,"2017-03-01 04:08:12","2017-05-05 12:49:16",0,0
"1812",836680851173879808,115556255,"Tue Feb 28 20:53:54 +0000 2017","2017-02-28 20:53:54",NA,NA,"","Córdoba y Xalapa contarán con el respaldo de más elementos de la @PoliciaFedMx para brindar mayor seguridad a las regiones.",358,354,0,0,0,"2017-03-01 04:08:12","2017-05-05 12:49:16",0,0
"1813",836680402957975552,115556255,"Tue Feb 28 20:52:07 +0000 2017","2017-02-28 20:52:07",NA,NA,"","Me reuní con el gobernador de Veracruz @YoconYunes para tratar asuntos prioritarios para las y los veracruzanos. https://t.co/3W3fMCKT0o",323,326,0,0,0,"2017-03-01 04:08:12","2017-05-05 12:49:16",0,0
"1814",836660987491049472,115556255,"Tue Feb 28 19:34:58 +0000 2017","2017-02-28 19:34:58",NA,NA,"","En Córdoba, Veracruz dialogando con representantes de la sociedad civil. https://t.co/5PbQmBiWmC",354,390,0,0,0,"2017-03-01 04:08:13","2017-05-05 12:49:16",0,0
"1815",837116896889683968,115556255,"Thu Mar 02 01:46:35 +0000 2017","2017-03-02 01:46:35",NA,NA,"","En el Día Internacional para la #CeroDiscriminación ratifiquemos nuestro compromiso con una convivencia basada en e… https://t.co/9vDgRArdtf",443,404,0,0,0,"2017-03-02 05:49:56","2017-05-05 12:49:16",0,0
"1816",837061554117963776,115556255,"Wed Mar 01 22:06:41 +0000 2017","2017-03-01 22:06:41",NA,NA,"","Es necesaria una Ley que defina alcances y plazos para la acción corresponsable de las instituciones del Estado Mexicano #SeguridadInterior",442,409,0,0,0,"2017-03-02 05:50:06","2017-05-05 12:49:16",0,0
"1817",837056534748278784,115556255,"Wed Mar 01 21:46:44 +0000 2017","2017-03-01 21:46:44",NA,NA,"","Hoy en reunión con la #Jucopo de @Mx_Diputados intercambiamos puntos de vista sobre la legislación de… https://t.co/Al0GTR26vG",321,285,0,0,0,"2017-03-02 05:50:07","2017-05-05 12:49:16",0,0
"1818",837483294048518144,115556255,"Fri Mar 03 02:02:31 +0000 2017","2017-03-03 02:02:31",NA,NA,"","Con la entrega de equipamiento de #ProtecciónCivil a la @PoliciaFedMx, fortalecemos su capacidad de respuesta ante… https://t.co/BcGyyfKn7H",354,370,0,0,0,"2017-03-03 08:11:25","2017-05-12 22:54:09",0,0
"1819",837442946538536960,115556255,"Thu Mar 02 23:22:12 +0000 2017","2017-03-02 23:22:12",NA,NA,"","Hoy conmemoramos el 188 aniversario luctuoso de Josefa Ortiz de Domínguez y su participación en la construcción del… https://t.co/ocjUceTpkZ",341,423,0,0,0,"2017-03-03 08:11:25","2017-05-12 22:54:09",0,0
"1820",837426322431410176,115556255,"Thu Mar 02 22:16:08 +0000 2017","2017-03-02 22:16:08",NA,NA,"","RT @SEGOB_mx: Mejora tus capacidades en #ProtecciónCivil. Consulta la oferta educativa 2017 de #ENAPROC. ¡Inscríbete! https://t.co/cKGOBu8w…",63,0,0,0,0,"2017-03-03 08:11:36","2017-05-12 22:54:09",1,1
"1821",837416859179892736,115556255,"Thu Mar 02 21:38:32 +0000 2017","2017-03-02 21:38:32",NA,NA,"","Nuestro reconocimiento a las y los integrantes de la @PoliciaFedMx y @CONAFOR por su vocación de servicio y destaca… https://t.co/rUmJBDa8jQ",377,328,0,0,0,"2017-03-03 08:11:36","2017-05-12 22:54:09",0,0
"1822",837415382289903616,115556255,"Thu Mar 02 21:32:40 +0000 2017","2017-03-02 21:32:40",NA,NA,"","Hoy entregamos equipamiento de #ProtecciónCivil a la @PoliciaFedMx para fortalecer su labor de prevención y atenció… https://t.co/tpg0dWuKs8",294,308,0,0,0,"2017-03-03 08:11:37","2017-05-12 22:54:09",0,0
"1823",837400647444025344,115556255,"Thu Mar 02 20:34:07 +0000 2017","2017-03-02 20:34:07",NA,NA,"","Muy buena reunión de trabajo. Sin duda, un privilegio compartido. https://t.co/lF2N4fKsDM",303,333,0,0,0,"2017-03-03 08:11:47","2017-05-12 22:54:09",0,0
"1824",837383700895559680,115556255,"Thu Mar 02 19:26:46 +0000 2017","2017-03-02 19:26:46",NA,NA,"","Demostración de protección civil maniobra contra incendio https://t.co/siNxniPeQi",284,272,0,0,0,"2017-03-03 08:11:47","2017-05-09 20:55:08",0,0
"1825",837380413060349952,115556255,"Thu Mar 02 19:13:42 +0000 2017","2017-03-02 19:13:42",NA,NA,"","Demostración de protección civil https://t.co/lKYPTNI478",278,312,0,0,0,"2017-03-03 08:11:52","2017-05-09 20:55:08",0,0
"1826",837374129690959872,115556255,"Thu Mar 02 18:48:44 +0000 2017","2017-03-02 18:48:44",NA,NA,"","Entregando equipamiento de protección civil a la policia federal https://t.co/CVoIfjlUSP",337,366,0,0,0,"2017-03-03 08:11:53","2017-05-05 12:49:16",0,0
"1827",837765847573651456,115556255,"Fri Mar 03 20:45:17 +0000 2017","2017-03-03 20:45:17",NA,NA,"","Bienvenido @gdeloya al equipo de @SEGOB_mx para encabezar la importante agenda federalista. Estoy seguro de que harás un gran trabajo.",398,446,0,0,0,"2017-03-04 00:07:10","2017-05-15 23:17:39",0,0
"1828",837735148489588736,115556255,"Fri Mar 03 18:43:18 +0000 2017","2017-03-03 18:43:18",NA,NA,"","Muchas felicidades a todo el equipo de @CanalOnceTV por sus 58 años de entrega con la información. #CanalOnce58Años",240,306,0,0,0,"2017-03-04 00:07:10","2017-05-12 22:54:09",0,0
"1829",838471634960822272,115556255,"Sun Mar 05 19:29:50 +0000 2017","2017-03-05 19:29:50",NA,NA,"","Un gusto haber compartido el 88 aniversario del @PRI_Nacional con grandes amigos. https://t.co/7M3hbFlWfG",346,494,0,0,0,"2017-03-05 16:40:53","2017-05-15 23:17:39",0,0
"1830",838426192999026688,115556255,"Sun Mar 05 16:29:16 +0000 2017","2017-03-05 16:29:16",NA,NA,"","Las niñas son presente y futuro del país, sigamos trabajando para ampliar sus oportunidades de desarrollo. https://t.co/ZidXU2zgTy",523,508,0,0,0,"2017-03-05 16:40:53","2017-05-15 23:17:39",0,0
"1831",838174971335692288,115556255,"Sat Mar 04 23:51:00 +0000 2017","2017-03-04 23:51:00",NA,NA,"","Esta semana trabajamos en el impulso a la cultura cívica, la seguridad de las y los mexicanos y en temas de protecc… https://t.co/7sRYGIgIxA",291,320,0,0,0,"2017-03-05 16:40:53","2017-05-15 23:17:39",0,0
"1832",838156477906960384,115556255,"Sat Mar 04 22:37:31 +0000 2017","2017-03-04 22:37:31",NA,NA,"","El PRI está unido y preparado. Así lo reiteramos hoy en el 88 aniversario con el Presidente @EPN y nuestra gran mil… https://t.co/vsnMHFmVVp",511,540,0,0,0,"2017-03-05 16:41:02","2017-05-15 23:17:39",0,0
"1833",839528402357010432,115556255,"Wed Mar 08 17:29:03 +0000 2017","2017-03-08 17:29:03",NA,NA,"","Es un orgullo trabajar con mujeres comprometidas y talentosas que todos los días ponen su empeño por servir a Méxic… https://t.co/IoC0WvmfEu",518,538,0,0,0,"2017-03-08 12:55:55","2017-05-21 04:03:30",0,0
"1834",839308445853560832,115556255,"Wed Mar 08 02:55:01 +0000 2017","2017-03-08 02:55:01",NA,NA,"","RT @EPN: Estas cifras acreditan que, no obstante la volatilidad financiera internacional, la economía mexicana mantiene su dinamismo.",1029,0,0,0,0,"2017-03-08 12:56:05","2017-05-21 04:03:30",1,1
"1835",839308431735599104,115556255,"Wed Mar 08 02:54:58 +0000 2017","2017-03-08 02:54:58",NA,NA,"","RT @EPN: En los primeros dos meses del año, se han registrado 237,347 nuevos empleos ante @Tu_IMSS, 12% más que en el mismo periodo de 2016.",1063,0,0,0,0,"2017-03-08 12:56:05","2017-05-21 04:03:30",1,1
"1836",839308414765383680,115556255,"Wed Mar 08 02:54:54 +0000 2017","2017-03-08 02:54:54",NA,NA,"","RT @EPN: México sigue rompiendo marcas: en febrero se crearon 154,055 empleos formales; es el mayor incremento reportado para un mes de feb…",1203,0,0,0,0,"2017-03-08 12:56:06","2017-05-18 14:35:10",1,1
