"","id_tweet","id_twitter","created_at","created_at_datetime","in_reply_to_user_id","in_reply_to_status_id","in_reply_to_screen_name","text","retweet_count","favorite_count","longitude","latitude","retweeted","creation_date","modification_date","RT_temp","is_retweeted"
"707",658298424110878720,236673083,"Sun Oct 25 15:05:49 +0000 2015","2015-10-25 15:05:49",NA,NA,"","50 años informando con responsabilidad a los Mexicanos, muchas felicidades a quienes laboran y participan con @elsolde_mexico !",7,4,0,0,0,"2015-10-27 18:31:11","2016-01-08 09:31:37",0,NA
"708",659029942525542400,236673083,"Tue Oct 27 15:32:37 +0000 2015","2015-10-27 15:32:37",NA,NA,"","Cumpliendo nuestro compromiso con las familias mexicanas, en el @Senado_PRI aprobamos la desindexación del salario https://t.co/fc6oUbrx5I",19,4,0,0,0,"2015-10-27 18:31:11","2016-01-09 06:16:39",0,NA
"709",659030324333010944,236673083,"Tue Oct 27 15:34:08 +0000 2015","2015-10-27 15:34:08",NA,NA,"","Sobre la Desindexación del Salario Mínimo https://t.co/ciocW4vA2x",18,3,0,0,0,"2015-10-27 18:31:11","2016-01-09 06:16:39",0,NA
"710",659030491257966592,236673083,"Tue Oct 27 15:34:47 +0000 2015","2015-10-27 15:34:47",NA,NA,"","RT @MarcoRangelMR: #QueNoTeEngañen Es mejor estar bien informados. ¡La gasolina NO sube!
@PRIMX_Hgo https://t.co/d3xHz6KkwP",14,0,0,0,0,"2015-10-27 18:31:11","2016-01-13 05:00:22",1,NA
"711",659412897232130048,236673083,"Wed Oct 28 16:54:20 +0000 2015","2015-10-28 16:54:20",NA,NA,"","RT @senadomexicano: Compartimos el Orden del Día de la sesión ordinaria de #HoyEnElSenado. https://t.co/5HEjOdjZ6s",10,0,0,0,0,"2015-10-29 04:02:34","2016-01-15 00:30:37",1,NA
"712",659412921122840576,236673083,"Wed Oct 28 16:54:26 +0000 2015","2015-10-28 16:54:26",NA,NA,"","RT @senadomexicano: El @IBDSenado nos comparte la Gaceta Plus, síntesis de los asuntos agendados en la Sesión. https://t.co/lWCVfdQXJd. htt…",7,0,0,0,0,"2015-10-29 04:02:33","2016-01-15 00:30:37",1,NA
"713",659474989062619136,236673083,"Wed Oct 28 21:01:04 +0000 2015","2015-10-28 21:01:04",NA,NA,"","La Com. de Procesos Internos inicia hoy el Proceso para la elección de la nueva Dirigencia Estatal del @PRIHidalg_o https://t.co/AJ5GaOKJyc",8,3,0,0,0,"2015-10-29 04:02:33","2016-01-15 00:30:37",0,NA
"714",659475648398798848,236673083,"Wed Oct 28 21:03:41 +0000 2015","2015-10-28 21:03:41",NA,NA,"","Confiamos en que como siempre el Priísmo Hidalguense dará muestras de unidad y compromiso https://t.co/loIXOqw2Qn",8,2,0,0,0,"2015-10-29 04:02:33","2016-01-17 18:31:35",0,NA
"715",659567368004222976,236673083,"Thu Oct 29 03:08:09 +0000 2015","2015-10-29 03:08:09",NA,NA,"","Sesionamos ahora para debatir y aprobar dictámenes sobre #LeydeIngresos y #MisceláneaFiscal2016 https://t.co/jf3ytnkAqr",4,3,0,0,0,"2015-10-29 04:02:33","2016-01-18 05:55:58",0,NA
"716",659628066885373952,236673083,"Thu Oct 29 07:09:21 +0000 2015","2015-10-29 07:09:21",NA,NA,"","Aprobamos con 88 votos en pro, 21 en contra y 0 abs en lo general la #MisceláneaFiscal.",6,3,0,0,0,"2015-10-29 04:02:33","2016-01-18 05:55:58",0,NA
"717",659697624912539648,236673083,"Thu Oct 29 11:45:45 +0000 2015","2015-10-29 11:45:45",NA,NA,"","RT @senadomexicano: Termina la sesión y se cita para la siguiente, el miércoles 4 de noviembre a las 11 horas.",15,0,0,0,0,"2015-10-29 22:17:08","2016-01-18 05:55:58",1,NA
"718",659698084054568960,236673083,"Thu Oct 29 11:47:34 +0000 2015","2015-10-29 11:47:34",NA,NA,"","En una sesión de larga duración aprobamos hace unos minutos la Ley de Ingresos de la Federación 2016. Conoce más: https://t.co/AQwABA0nCy",15,7,0,0,0,"2015-10-29 22:17:07","2016-01-18 05:55:58",0,NA
"719",660142781596233728,236673083,"Fri Oct 30 17:14:38 +0000 2015","2015-10-30 17:14:38",NA,NA,"","Le deseo muchas felicidades al Secretario General de Servicios Parlamentarios del @senadomexicano Dr. Arturo Garita @artujgv",8,5,0,0,0,"2015-10-30 21:48:14","2016-01-18 05:55:58",0,NA
"720",660297805194395648,236673083,"Sat Oct 31 03:30:39 +0000 2015","2015-10-31 03:30:39",NA,NA,"","Ante el apagón analógico primero el beneficio de los mexicanos. Es la posición del @Senado_PRI #ConferenciaMedios https://t.co/Q1F1KZIMll",7,4,0,0,0,"2015-11-03 16:26:12","2016-01-18 05:55:58",0,NA
"721",660298216227803136,236673083,"Sat Oct 31 03:32:17 +0000 2015","2015-10-31 03:32:17",NA,NA,"","Comparto el video de la Conferencia ante Medios en la que en nombre del @Senado_PRI hablé sobre el apagón analógico https://t.co/TttVoR9N3e",12,4,0,0,0,"2015-11-03 16:26:11","2016-01-20 01:48:51",0,NA
"722",660501797316853760,236673083,"Sat Oct 31 17:01:14 +0000 2015","2015-10-31 17:01:14",NA,NA,"","RT @senadomexicano: ""Por la recuperación del salario"", columna del senador @RaulPozosMx en @elsolde_mexico. https://t.co/SjuIN0r1Ka https:/…",22,0,0,0,0,"2015-11-03 16:26:10","2016-01-20 01:48:51",1,NA
"723",663774182166032384,236673083,"Mon Nov 09 17:44:32 +0000 2015","2015-11-09 17:44:32",NA,NA,"","RT @senadomexicano: Piden senadores del GPPRI impulsar inversión en plantas de potabilización de aguas residuales. https://t.co/lqRYeYlsyW",25,0,0,0,0,"2015-11-10 03:10:52","2016-01-29 15:40:13",1,NA
"724",663765301398376448,236673083,"Mon Nov 09 17:09:14 +0000 2015","2015-11-09 17:09:14",NA,NA,"","Le deseo un gran día de cumpleaños a mi amiga Procuradora @ArelyGomezGlz recibe un abrazo con afecto !",6,3,0,0,0,"2015-11-10 03:10:53","2016-01-29 15:40:13",0,NA
"725",663517594951942144,236673083,"Mon Nov 09 00:44:56 +0000 2015","2015-11-09 00:44:56",NA,NA,"","Fue un honor compartir esta semana con nuestro Presidente Partidista  @MFBeltrones y con @Emilio_Gamboa_ https://t.co/JKq8k57hSR",14,5,0,0,0,"2015-11-10 03:10:53","2016-01-29 05:39:23",0,NA
"726",663516758758690816,236673083,"Mon Nov 09 00:41:37 +0000 2015","2015-11-09 00:41:37",NA,NA,"","RT @MarcoOpengo: @RaulPozosMx trabajando con el Srio. @gruizesp en la presentación de avances del Sist. Satelital Mexicano MEXSAT. https://…",6,0,0,0,0,"2015-11-10 03:10:53","2016-01-28 21:40:15",1,NA
"727",663117922554908672,236673083,"Sat Nov 07 22:16:47 +0000 2015","2015-11-07 22:16:47",NA,NA,"","Fue un honor representar al @PRI_Nacional la Elección de la nueva Dirigencia del @cdeprihidalgo @MFBeltrones #Unidad https://t.co/5QiNoIjWm9",11,7,0,0,0,"2015-11-10 03:10:53","2016-01-28 14:43:06",0,NA
"728",663116255830781952,236673083,"Sat Nov 07 22:10:10 +0000 2015","2015-11-07 22:10:10",NA,NA,"","Empieza una nueva historia de éxito del PRI de Hidalgo, felicitamos a Alberto @melendezapodaca y a @EmilseMiranda1 https://t.co/jWy7OrhCe2",8,4,0,0,0,"2015-11-10 03:10:53","2016-01-28 14:43:06",0,NA
"729",663115327622877184,236673083,"Sat Nov 07 22:06:28 +0000 2015","2015-11-07 22:06:28",NA,NA,"","Felicitamos el gran esfuerzo con buenos resultados de la Dirigencia de @RicardoCrespoA y @pontigoloyola éxito ! https://t.co/CNk1MZmTsu",15,11,0,0,0,"2015-11-10 03:10:53","2016-01-28 09:26:00",0,NA
"730",663056592946855936,236673083,"Sat Nov 07 18:13:05 +0000 2015","2015-11-07 18:13:05",NA,NA,"","Estamos en el registro para encabezar el PRI HIDALGO de  @melendezapodaca y @EmilseMiranda1 #UnidosRumboALaVictoria https://t.co/q3Pxm54EDJ",6,3,0,0,0,"2015-11-10 03:10:53","2016-01-28 09:26:00",0,NA
"731",663021247991648256,236673083,"Sat Nov 07 15:52:38 +0000 2015","2015-11-07 15:52:38",NA,NA,"","RT @senadomexicano: ""Presupuesto inteligente y con sentido social"": Sen. @RaulPozosMx en @elsolde_mexico. https://t.co/iEA8nzMmLx https://t…",18,0,0,0,0,"2015-11-10 03:10:53","2016-01-28 09:26:00",1,NA
"732",662769227351257088,236673083,"Fri Nov 06 23:11:12 +0000 2015","2015-11-06 23:11:12",NA,NA,"","Hoy trabajando con la @SCT_mx y el Srio. @gruizesp en la presentación de avances del Sist. Satelital Mexicano MEXSAT https://t.co/L87RW1uWPA",12,6,0,0,0,"2015-11-10 03:10:55","2016-01-26 17:29:28",0,NA
"733",662616252494381056,236673083,"Fri Nov 06 13:03:20 +0000 2015","2015-11-06 13:03:20",NA,NA,"","En unos momentos participaré en este importante noticiero escucha por https://t.co/H4k3kLsHQb https://t.co/CveGHpv0v7",9,1,0,0,0,"2015-11-10 03:10:55","2016-01-26 17:29:28",0,NA
"734",662615631615799296,236673083,"Fri Nov 06 13:00:52 +0000 2015","2015-11-06 13:00:52",NA,NA,"","Les invito a escuchar hoy el noticiero de @CiroGomezL @Radioformulasa  en entrevista trataremos temas importantes https://t.co/2NzkjropzN",12,3,0,0,0,"2015-11-10 03:10:56","2016-01-26 17:29:28",0,NA
"735",662377065295953920,236673083,"Thu Nov 05 21:12:53 +0000 2015","2015-11-05 21:12:53",NA,NA,"","En Conferencia ante Medios de Comunicación con nuestro Coordinador @Emilio_Gamboa_ #ApagónAnalógico https://t.co/dk40VNi4Fz",20,8,0,0,0,"2015-11-10 03:10:56","2016-01-26 17:29:28",0,NA
"736",662374952784400384,236673083,"Thu Nov 05 21:04:29 +0000 2015","2015-11-05 21:04:29",NA,NA,"","En breve acompañaré al Coordinador del Grupo Parlamentario del @Senado_PRI @Emilio_Gamboa_ en conferencia de Prensa #ApagónAnalógico",9,4,0,0,0,"2015-11-10 03:10:56","2016-01-26 17:29:28",0,NA
"737",662370230857957376,236673083,"Thu Nov 05 20:45:43 +0000 2015","2015-11-05 20:45:43",NA,NA,"","El @senadomexicano tiene ahora un Consejo Consultivo integrado por Presidentes de la Mesa Directiva desde 1999. https://t.co/YBmLH090L6",11,5,0,0,0,"2015-11-10 03:10:56","2016-01-26 17:29:28",0,NA
"738",662368055649918976,236673083,"Thu Nov 05 20:37:05 +0000 2015","2015-11-05 20:37:05",NA,NA,"","Reconocemos hoy al Secretario General de Servicios Parlamentarios Dr. Arturo Garita, 21 años al servicio del @senadomexicano Felicidades !",5,1,0,0,0,"2015-11-10 03:10:56","2016-01-26 17:29:28",0,NA
"739",662367550886440960,236673083,"Thu Nov 05 20:35:04 +0000 2015","2015-11-05 20:35:04",NA,NA,"","RT @Emilio_Gamboa_: Hoy se instalará en el @senadomexicano su Consejo Consultivo, integrado por quienes han sido Presidentes de su Mesa Dir…",25,0,0,0,0,"2015-11-10 03:10:56","2016-01-25 18:27:17",1,NA
"740",662367215648243712,236673083,"Thu Nov 05 20:33:45 +0000 2015","2015-11-05 20:33:45",NA,NA,"","Felicito a quienes conforman el nuevo Consejo Consultivo del @senadomexicano su experiencia ayudará a tener un mejor órgano legislativo",3,1,0,0,0,"2015-11-10 03:10:56","2016-01-25 18:27:17",0,NA
"741",662366764777365504,236673083,"Thu Nov 05 20:31:57 +0000 2015","2015-11-05 20:31:57",NA,NA,"","RT @senadomexicano: Se hace entrega del nombramiento y distintivo a integrantes del Consejo Consultivo del Senado de la República. https://…",9,0,0,0,0,"2015-11-10 03:10:56","2016-01-25 18:27:17",1,NA
"742",662365816608854016,236673083,"Thu Nov 05 20:28:11 +0000 2015","2015-11-05 20:28:11",NA,NA,"","RT @CanalCongreso: #SesiónSenado Los integrantes del Consejo Consultivo del #Senado toman protesta a sus puestos.",6,0,0,0,0,"2015-11-10 03:10:56","2016-01-24 06:00:56",1,NA
"743",662276602051477504,236673083,"Thu Nov 05 14:33:41 +0000 2015","2015-11-05 14:33:41",NA,NA,"","RT @senadomexicano: Ratifica Senado Acuerdo que modifica el Convenio sobre Transporte Aéreo entre México y Cuba. https://t.co/qlmKOiDFzA",11,0,0,0,0,"2015-11-10 03:10:56","2016-01-24 06:00:56",1,NA
"744",662276225524613120,236673083,"Thu Nov 05 14:32:11 +0000 2015","2015-11-05 14:32:11",NA,NA,"","RT @senadomexicano: Compartimos las actividades que se tienen en agenda para #HoyEnElSenado https://t.co/80jHpjkz0b",21,0,0,0,0,"2015-11-10 03:10:58","2016-01-23 07:24:09",1,NA
"745",662060600529321984,236673083,"Thu Nov 05 00:15:22 +0000 2015","2015-11-05 00:15:22",NA,NA,"","Muchas Felicidades al Secretario @RafaelPacchiano le deseamos un gran día de cumpleaños",2,2,0,0,0,"2015-11-10 03:10:58","2016-01-23 07:24:09",0,NA
"746",661957458399641600,236673083,"Wed Nov 04 17:25:31 +0000 2015","2015-11-04 17:25:31",NA,NA,"","RT @senadomexicano: Compartimos los asuntos que se tienen en agenda para la sesión de #HoyEnElSenado. https://t.co/DPJVdzBWkG https://t.co/…",9,0,0,0,0,"2015-11-10 03:10:58","2016-01-23 07:24:09",1,NA
"747",661941997960237056,236673083,"Wed Nov 04 16:24:05 +0000 2015","2015-11-04 16:24:05",NA,NA,"","RT @IBDSenado: Compartimos la #GacetaPlus del día, contiene los asuntos a atender por el @senadomexicano https://t.co/oEPaCZFLTh https://t.…",7,0,0,0,0,"2015-11-10 03:10:58","2016-01-20 01:48:51",1,NA
"748",661940811395829760,236673083,"Wed Nov 04 16:19:22 +0000 2015","2015-11-04 16:19:22",NA,NA,"","RT @Vazquezdomingo: Apagón analógico, ni programa electoral, ni perjudicial para la población: @RaulPozosMx https://t.co/h8rFSW3HjH",5,0,0,0,0,"2015-11-10 03:10:59","2016-01-20 01:48:51",1,NA
"749",664124903340118016,236673083,"Tue Nov 10 16:58:10 +0000 2015","2015-11-10 16:58:10",NA,NA,"","RT @senadomexicano: Compartimos las actividades que se tienen en agenda para #HoyEnElSenado https://t.co/eG57kHTAan",38,0,0,0,0,"2015-11-10 15:28:39","2016-01-29 15:40:13",1,NA
"750",664124513215315968,236673083,"Tue Nov 10 16:56:37 +0000 2015","2015-11-10 16:56:37",NA,NA,"","Te invitamos a consultar la #GacetaPlus, síntesis de los asuntos agendados pare el Senado. ¡Descarga aquí!  https://t.co/2EJGs868bI",5,1,0,0,0,"2015-11-10 15:28:39","2016-01-29 15:40:13",0,NA
"751",664124306473926656,236673083,"Tue Nov 10 16:55:48 +0000 2015","2015-11-10 16:55:48",NA,NA,"","Les comparto los asuntos a tratar en la Sesión del día de hoy en el @Senado_PRI https://t.co/2EX4T4fNCN",5,1,0,0,0,"2015-11-10 15:28:41","2016-01-29 15:40:13",0,NA
"752",664489718550102016,236673083,"Wed Nov 11 17:07:49 +0000 2015","2015-11-11 17:07:49",NA,NA,"","RT @NoticiasMVS: #ENTREVISTA @RaulPozosMx: no se retrasará #ApagónAnalógico, se cumplirán tiempos https://t.co/vDWdPNNm03 https://t.co/tKxZ…",9,0,0,0,0,"2015-11-11 19:52:16","2016-02-22 16:56:24",1,NA
"753",664488637032108032,236673083,"Wed Nov 11 17:03:31 +0000 2015","2015-11-11 17:03:31",NA,NA,"","El Plan Estatal de Desarrollo que presenta el Gober. @alitomorenoc generará más oportunidades a la gente de Campeche https://t.co/NnIvZDJDXg",9,4,0,0,0,"2015-11-11 19:52:17","2016-02-20 05:24:42",0,NA
"754",664477012392722432,236673083,"Wed Nov 11 16:17:19 +0000 2015","2015-11-11 16:17:19",NA,NA,"","Un gusto asistir hoy a la presentación que hará nuestro Gobernador Alejandro Moreno del  Plan Estatal de Desarrollo 2015-2021@alitomorenoc",11,7,0,0,0,"2015-11-11 19:52:17","2016-02-20 05:24:42",0,NA
"755",664458887714594816,236673083,"Wed Nov 11 15:05:18 +0000 2015","2015-11-11 15:05:18",NA,NA,"","RT @CiroGomezL: No hay motivos para modificar fecha del apagón analógico: @RaulPozosMx https://t.co/SuUt5SPXtR #PorLaMañana",7,0,0,0,0,"2015-11-11 19:52:17","2016-02-19 11:11:06",1,NA
"756",664442155704844288,236673083,"Wed Nov 11 13:58:49 +0000 2015","2015-11-11 13:58:49",NA,NA,"","Muchas gracias a @NoticiasMVS y al Periodista @Cachoperiodista por el tiempo otorgado para informar la postura del @Senado_PRI",6,2,0,0,0,"2015-11-11 19:52:18","2016-02-19 11:11:06",0,NA
"757",664441548696743936,236673083,"Wed Nov 11 13:56:24 +0000 2015","2015-11-11 13:56:24",NA,NA,"","Muchas gracias al Periodista @CiroGomezL y a todo el equipo de @Radioformulasa por el espacio de comunicación brindado @Senado_PRI",6,3,0,0,0,"2015-11-11 19:52:18","2016-02-19 11:11:06",0,NA
"758",664438724436979712,236673083,"Wed Nov 11 13:45:11 +0000 2015","2015-11-11 13:45:11",NA,NA,"","RT @CiroGomezL: #AlAire en #PorLaMañana el senador @RaulPozosMx. La fracción del PRI en el Senado votó por sostener el apagón analógico.",8,0,0,0,0,"2015-11-11 19:52:18","2016-02-16 17:23:50",1,NA
"759",664438370085376000,236673083,"Wed Nov 11 13:43:46 +0000 2015","2015-11-11 13:43:46",NA,NA,"","Por iniciar entrevista con @CiroGomezL en @Radioformulasa https://t.co/zmkw9xG3pB https://t.co/kfEQ53K2VE",4,5,0,0,0,"2015-11-11 19:52:18","2016-02-16 17:23:50",0,NA
"760",664436548968906752,236673083,"Wed Nov 11 13:36:32 +0000 2015","2015-11-11 13:36:32",NA,NA,"","RT @NoticiasMVS: Gob. federal ha hecho un gran esfuerzo para que el menor número de familias se vea afectada por la transición a TV digital…",8,0,0,0,0,"2015-11-11 19:52:20","2016-02-16 17:23:50",1,NA
"761",664436367112323072,236673083,"Wed Nov 11 13:35:49 +0000 2015","2015-11-11 13:35:49",NA,NA,"","RT @NoticiasMVS: .@RaulPozosMx: el objetivo es que se haga cumplir la Constitución y que los mexicanos tengan acceso a la televisión digita…",9,0,0,0,0,"2015-11-11 19:52:20","2016-02-14 04:52:50",1,NA
"762",664436201634467840,236673083,"Wed Nov 11 13:35:09 +0000 2015","2015-11-11 13:35:09",NA,NA,"","RT @NoticiasMVS: .@RaulPozosMx: no consideramos deseable modificar la Constitución ya que se puede cumplir con los tiempos para llegar al a…",6,0,0,0,0,"2015-11-11 19:52:20","2016-02-12 10:54:09",1,NA
"763",664436188262961152,236673083,"Wed Nov 11 13:35:06 +0000 2015","2015-11-11 13:35:06",NA,NA,"","RT @NoticiasMVS: .@RaulPozosMx: nos reunimos con la #SCT, Sedesol y el IFT quienes nos plantearon las acciones para concretar el apagón ana…",7,0,0,0,0,"2015-11-11 19:52:20","2016-02-12 10:54:09",1,NA
"764",664436121187651584,236673083,"Wed Nov 11 13:34:50 +0000 2015","2015-11-11 13:34:50",NA,NA,"","RT @NoticiasMVS: AL AIRE @RaulPozosMx, senador del #PRI, comenta sobre el apagón analógico con @Cachoperiodista 102.5 FM https://t.co/WhIr8…",6,0,0,0,0,"2015-11-11 19:52:20","2016-02-12 07:13:57",1,NA
"765",664435587105972224,236673083,"Wed Nov 11 13:32:43 +0000 2015","2015-11-11 13:32:43",NA,NA,"","Iniciando platica con Alejandro Cacho @NoticiasMVS https://t.co/fgajuJC3JA",3,2,0,0,0,"2015-11-11 19:52:20","2016-02-11 16:48:41",0,NA
"766",664435025660657664,236673083,"Wed Nov 11 13:30:29 +0000 2015","2015-11-11 13:30:29",NA,NA,"","Agradezco a @mileniotv el espacio para comunicar la postura del @Senado_PRI sobre no posponer el #ApagónAnalógico les invito a verlo ahora",3,2,0,0,0,"2015-11-11 19:52:20","2016-02-11 16:48:41",0,NA
"767",664430119390326784,236673083,"Wed Nov 11 13:10:59 +0000 2015","2015-11-11 13:10:59",NA,NA,"","En breve estaré platicando con el periodista titular de @NoticiasMVS Alejandro Cacho #ApagónAnalógico",7,5,0,0,0,"2015-11-11 19:52:20","2016-02-08 10:40:51",0,NA
"768",664301499627913216,236673083,"Wed Nov 11 04:39:54 +0000 2015","2015-11-11 04:39:54",136067256,664261324830998528,"marco_mares","Muchas gracias a  @marco_mares y a todo el equipo de  @Radio_Formula por la oportunidad de compartir información a su auditorio",6,4,0,0,0,"2015-11-11 19:52:20","2016-02-08 10:40:51",0,NA
"769",664300050990804992,236673083,"Wed Nov 11 04:34:08 +0000 2015","2015-11-11 04:34:08",NA,NA,"","RT @QuadratinMexico: Confirma PRI en el Senado apagón analógico para el 31 de diciembre https://t.co/Oe58zHES5o @RaulPozosMx",4,0,0,0,0,"2015-11-11 19:52:20","2016-02-08 10:40:51",1,NA
"770",664299928504504320,236673083,"Wed Nov 11 04:33:39 +0000 2015","2015-11-11 04:33:39",NA,NA,"","RT @NoticiasMVS: #ENTREVISTA @RaulPozosMx: A 1 de cada 3 hogares de bajos recursos se llevará un televisor https://t.co/99McMkD2fd https://…",9,0,0,0,0,"2015-11-11 19:52:21","2016-02-04 06:36:07",1,NA
"771",664265661946793984,236673083,"Wed Nov 11 02:17:29 +0000 2015","2015-11-11 02:17:29",NA,NA,"","Ahora en @Excelsior tv estaré hablando del #ApagonAnalogico",7,5,0,0,0,"2015-11-11 19:52:22","2016-02-04 06:36:07",0,NA
"772",664253634847203328,236673083,"Wed Nov 11 01:29:42 +0000 2015","2015-11-11 01:29:42",NA,NA,"","Les invito a escuchar hoy en vivo, cerca de las 19:45 pm la entrevista que me hará Alicia Salgado en https://t.co/jNt7lwl3fI @allizesalgado",4,4,0,0,0,"2015-11-11 19:52:22","2016-02-04 06:36:07",0,NA
"773",664248660524331008,236673083,"Wed Nov 11 01:09:56 +0000 2015","2015-11-11 01:09:56",NA,NA,"","Me entrevista ahora en el 90.5 el periodista @J_Fdz_Menendez pueden escucharla en la web en imagen radio",6,7,0,0,0,"2015-11-11 19:52:23","2016-02-04 06:36:07",0,NA
"774",664248309125525504,236673083,"Wed Nov 11 01:08:32 +0000 2015","2015-11-11 01:08:32",NA,NA,"","Les invito a escuchar en @Imagen_Mx en 90.5 la entrevista que tendré ahora con el Jorge Fernández https://t.co/92AszaJmeA",5,4,0,0,0,"2015-11-11 19:52:23","2016-02-04 06:36:07",0,NA
"775",664240825035984896,236673083,"Wed Nov 11 00:38:48 +0000 2015","2015-11-11 00:38:48",141668931,664215428743327744,"RicardoAlemanMx","@RicardoAlemanMx muchas gracias por la oportunidad de informarle a la gente sobre el #ApagónAnalógico",1,1,0,0,0,"2015-11-11 19:52:24","2016-02-04 06:36:07",0,NA
"776",664240645817503744,236673083,"Wed Nov 11 00:38:05 +0000 2015","2015-11-11 00:38:05",NA,NA,"","RT @RicardoAlemanMx: Se llegó a la conclusión de que existen condiciones para que el 31 de diciembre sea el apagón analógico comenta  @Raul…",8,0,0,0,0,"2015-11-11 19:52:24","2016-02-04 06:36:07",1,NA
"777",664240593548111872,236673083,"Wed Nov 11 00:37:53 +0000 2015","2015-11-11 00:37:53",NA,NA,"","RT @RicardoAlemanMx: Una de cada tres familias ha recibido una televisión por parte del gobierno, agrega el senador @RaulPozosMx, por 90.5FM",6,0,0,0,0,"2015-11-11 19:52:24","2016-02-03 18:39:50",1,NA
"778",664240525160005632,236673083,"Wed Nov 11 00:37:36 +0000 2015","2015-11-11 00:37:36",1393097221,664219917730734080,"ezshabot","@ezshabot muchas gracias por el espacio y sus comentarios durante la entrevista",2,2,0,0,0,"2015-11-11 19:52:24","2016-02-03 18:39:50",0,NA
"779",664240387159003136,236673083,"Wed Nov 11 00:37:03 +0000 2015","2015-11-11 00:37:03",NA,NA,"","RT @ezshabot: Entrevisto a @RaulPozosMx, senador del @PRI_Nacional, sobre #ApagonAnalogico",7,0,0,0,0,"2015-11-11 19:52:24","2016-02-03 18:39:50",1,NA
"780",664240362207100928,236673083,"Wed Nov 11 00:36:57 +0000 2015","2015-11-11 00:36:57",NA,NA,"","RT @NoticiasMVS: #AlAire @RaulPozosMx: se van a cumplir en tiempo y forma con todos los retos que están en la Constitución 102.5 FM",4,0,0,0,0,"2015-11-11 19:52:24","2016-02-03 18:39:50",1,NA
"781",664240338878394368,236673083,"Wed Nov 11 00:36:52 +0000 2015","2015-11-11 00:36:52",NA,NA,"","RT @NoticiasMVS: #AlAire @RaulPozosMx: en uno de cada tres hogares mexicanos de bajos recursos se llevará un televisor 102.5 FM",4,0,0,0,0,"2015-11-11 19:52:24","2016-02-03 18:39:50",1,NA
"782",664240300768935936,236673083,"Wed Nov 11 00:36:43 +0000 2015","2015-11-11 00:36:43",NA,NA,"","RT @NoticiasMVS: #AlAire @RaulPozosMx: el espíritu social de la reforma nos hace llegar a los sectores vulnerables; no tendrán que gastar u…",5,0,0,0,0,"2015-11-11 19:52:24","2016-02-02 11:53:04",1,NA
"783",664240149065129984,236673083,"Wed Nov 11 00:36:07 +0000 2015","2015-11-11 00:36:07",NA,NA,"","RT @NoticiasMVS: #AlAire @RaulPozosMx: tenemos hasta el 31 de diciembre para entregar televisores al 90% de los hogares mexicanos 102.5 FM",7,0,0,0,0,"2015-11-11 19:52:24","2016-02-02 11:53:04",1,NA
"784",664240111547060224,236673083,"Wed Nov 11 00:35:58 +0000 2015","2015-11-11 00:35:58",NA,NA,"","RT @Politico_Mexico: El #ApagónAnalógico se mantiene para este año https://t.co/7UEJM5JpxO https://t.co/KxnNxyqCCT",7,0,0,0,0,"2015-11-11 19:52:24","2016-02-02 11:53:04",1,NA
"785",664239780134170624,236673083,"Wed Nov 11 00:34:39 +0000 2015","2015-11-11 00:34:39",207684122,553415893230039040,"_CapitalDF","Agradezco el espacio para comunicar sobre la postura del PRI de no cambiar la fecha del #ApagónAnalógico a @_CapitalDF @YulianaEscobedo",7,3,0,0,0,"2015-11-11 19:52:25","2016-02-02 11:53:04",0,NA
"786",664213038237552640,236673083,"Tue Nov 10 22:48:23 +0000 2015","2015-11-10 22:48:23",NA,NA,"","Les invito a escuchar la entrevista que tendré en unos minutos con @RicardoAlemanMx en @Imagen_Mx por internet https://t.co/izqy8z4utf",9,2,0,0,0,"2015-11-11 19:52:25","2016-01-31 19:13:10",0,NA
"787",664212306541219840,236673083,"Tue Nov 10 22:45:29 +0000 2015","2015-11-10 22:45:29",NA,NA,"","Les invito a escuchar la entrevista que en breve me hará el reconocido analista @RicardoAlemanMx @Imagen_Mx 90.5 Fm https://t.co/rMccBRCSf1",6,1,0,0,0,"2015-11-11 19:52:26","2016-01-31 19:13:10",0,NA
"788",664203759984111616,236673083,"Tue Nov 10 22:11:31 +0000 2015","2015-11-10 22:11:31",NA,NA,"","ACUERDA EL PRI EN EL SENADO NO POSTERGAR EL APAGÓN ANALÓGICO, les comparto el #video de mi mensaje ante medios https://t.co/jUvauSO4RX",7,4,0,0,0,"2015-11-11 19:52:26","2016-01-29 15:40:13",0,NA
"789",667551656645554176,236673083,"Fri Nov 20 03:54:52 +0000 2015","2015-11-20 03:54:52",NA,NA,"","RT @Emilio_Gamboa_: La fuerza de @PRI_Nacional seguirá trabajando por las familias de Hidalgo con @melendezapodaca y @EmilseMiranda1 al fre…",20,0,0,0,0,"2015-11-20 16:23:26","2016-02-26 03:23:55",1,NA
"790",667524071471513600,236673083,"Fri Nov 20 02:05:15 +0000 2015","2015-11-20 02:05:15",NA,NA,"","Renovación con unidad y la fortaleza necesaria para seguir construyendo el #PRIganador2016 @cdeprihidalgo https://t.co/0pTaeh45e7",6,1,0,0,0,"2015-11-20 16:23:27","2016-02-26 03:23:55",0,NA
"791",667523136603058176,236673083,"Fri Nov 20 02:01:32 +0000 2015","2015-11-20 02:01:32",NA,NA,"","Reconocemos a @RicardoCrespoA y todo el CDE. Sin duda @melendezapodaca tiene buenas bases para impulsar un nuevo proyecto ganador en Hdgo.",7,3,0,0,0,"2015-11-20 16:23:27","2016-02-26 03:23:55",0,NA
"792",667522493725339648,236673083,"Fri Nov 20 01:58:59 +0000 2015","2015-11-20 01:58:59",NA,NA,"","RT @melendezapodaca: Todo mi reconocimiento a nuestro 1er. Priísta @Paco_Olvera por su liderazgo y ejemplar trabajo al frente del @gobierno…",13,0,0,0,0,"2015-11-20 16:23:27","2016-02-26 03:23:55",1,NA
"793",667522323507908608,236673083,"Fri Nov 20 01:58:18 +0000 2015","2015-11-20 01:58:18",NA,NA,"","RT @melendezapodaca: Hoy tengo el honor de asumir el cargo de Presidente del @cdeprihidalgo en un momento histórico para el Estado.",23,0,0,0,0,"2015-11-20 16:23:27","2016-02-26 03:23:55",1,NA
"794",667522155660210176,236673083,"Fri Nov 20 01:57:38 +0000 2015","2015-11-20 01:57:38",NA,NA,"","Hoy con unidad partidista Presidente Nacional @MFBeltrones toma la protesta a  @melendezapodaca y @EmilseMiranda1 https://t.co/2YtaXylhJW",8,4,0,0,0,"2015-11-20 16:23:27","2016-02-26 03:23:55",0,NA
