"","id_tweet","id_twitter","created_at","created_at_datetime","in_reply_to_user_id","in_reply_to_status_id","in_reply_to_screen_name","text","retweet_count","favorite_count","longitude","latitude","retweeted","creation_date","modification_date","RT_temp","is_retweeted"
"2024",809943359557160960,236673083,"Sat Dec 17 02:08:39 +0000 2016","2016-12-17 02:08:39",NA,NA,"","RT @CarlosPuenteZAC: Con mis amigos @Pabloescuderom @RaulPozosMx @JLavalleMaury @Gerardo_Sanchz_ y @Sofio_Ramirez en el informe legislativo…",13,0,0,0,0,"2016-12-17 03:33:41","2017-03-16 11:25:35",1,1
"2025",809939702904160256,236673083,"Sat Dec 17 01:54:07 +0000 2016","2016-12-17 01:54:07",NA,NA,"","Fue un gusto acompañarte Senador. Te felicito por tu compromiso con Chiapas y con México. Enhorabuena amigo! https://t.co/oVzwGhlolR",4,6,0,0,0,"2016-12-17 03:33:42","2017-03-16 11:25:35",0,0
"2026",809915500755087360,236673083,"Sat Dec 17 00:17:57 +0000 2016","2016-12-17 00:17:57",NA,NA,"","RT @Asoc_InternetMX: Felicitamos y reconocemos la visión del Senador @RaulPozosMx por esta iniciativa en beneficio del sector #TIC y la #ec…",6,0,0,0,0,"2016-12-17 03:33:48","2017-03-16 11:25:35",1,1
"2027",809809870274916352,236673083,"Fri Dec 16 17:18:13 +0000 2016","2016-12-16 17:18:13",NA,NA,"","Reconozco el liderazgo de nuestro Coordinador @Emilio_Gamboa_ y la labor de mis compañeros Senadores en este períod… https://t.co/KQ3Gi7Ql4H",5,3,0,0,0,"2016-12-17 03:33:49","2017-03-16 11:25:35",0,0
"2028",809809608688734208,236673083,"Fri Dec 16 17:17:10 +0000 2016","2016-12-16 17:17:10",NA,NA,"","RT @Emilio_Gamboa_: En México tenemos un sistema que pone en el centro de la acción pública y privada a las niñas, niños y adolescentes. #S…",10,0,0,0,0,"2016-12-17 03:33:56","2017-03-16 11:25:35",1,1
"2029",809744835125055488,236673083,"Fri Dec 16 12:59:47 +0000 2016","2016-12-16 12:59:47",NA,NA,"","Muchas felicidades amigo Senador @CarlosPuenteZAC te mando un fuerte abrazo con motivo de tu cumpleaños!",2,4,0,0,0,"2016-12-17 03:33:56","2017-03-16 11:25:35",0,0
"2030",810303338973687808,236673083,"Sun Dec 18 01:59:05 +0000 2016","2016-12-18 01:59:05",NA,NA,"","Es tan posible nuestro amor que hoy estamos Mari, Vale, Tu y Yo... Las amo! Feliz Aniversario #17/17 https://t.co/FQdXkDebf3",12,22,0,0,0,"2016-12-18 04:24:08","2017-03-21 06:39:08",0,0
"2031",810262672436555776,236673083,"Sat Dec 17 23:17:29 +0000 2016","2016-12-17 23:17:29",NA,NA,"","Frente a ello es cierto que el Ejército ha quedado en medio. Ha estado haciendo tareas que legalmente no le corresp… https://t.co/QRgxlELC0P",7,5,0,0,0,"2016-12-18 04:24:08","2017-03-21 06:39:08",0,0
"2032",810580804971757568,236673083,"Sun Dec 18 20:21:38 +0000 2016","2016-12-18 20:21:38",NA,NA,"","Participé en la 2da. Sesión Ordinaria del Consejo Político Estatal de mi Partido. https://t.co/3hoNlNQfHj",4,2,0,0,0,"2016-12-19 01:28:01","2017-03-21 06:39:08",0,0
"2033",810577090735198208,236673083,"Sun Dec 18 20:06:52 +0000 2016","2016-12-18 20:06:52",NA,NA,"","RT @aortizlanz: Con los legisladores campechanos  federales @oscarrosasg @RaulPozosMx @MiguelSulub en el Consejo Político Estatal @PRICampe…",24,0,0,0,0,"2016-12-19 01:28:01","2017-03-21 06:39:08",1,1
"2034",810547832381992960,236673083,"Sun Dec 18 18:10:37 +0000 2016","2016-12-18 18:10:37",NA,NA,"","Desde el Senado trabajamos para la defensa de la dignidad y la protección de los migrantes Mexicanos. https://t.co/Ti8EkLesYe",4,3,0,0,0,"2016-12-19 01:28:01","2017-03-21 06:39:08",0,0
"2035",810970234777726976,236673083,"Mon Dec 19 22:09:05 +0000 2016","2016-12-19 22:09:05",NA,NA,"","Muchas felicidades estimado Senador @JoelAyalaA! Te mando un abrazo amigo.",2,2,0,0,0,"2016-12-20 00:08:26","2017-03-21 06:39:08",0,0
"2036",811301802624880640,236673083,"Tue Dec 20 20:06:37 +0000 2016","2016-12-20 20:06:37",NA,NA,"","Debemos aprender a vivir juntos como hermanos o vamos a perecer juntos como tontos.-Martin Luther King, Jr. https://t.co/1fXfXvSXXS",10,12,0,0,0,"2016-12-20 15:22:16","2017-03-21 06:39:08",0,0
"2037",811253654552543232,236673083,"Tue Dec 20 16:55:18 +0000 2016","2016-12-20 16:55:18",NA,NA,"","Les comparto algunos resultados obtenidos en el Senado en el período anterior en materia de justicia, combate a la… https://t.co/gUdiXxtFNh",7,6,0,0,0,"2016-12-20 15:22:16","2017-03-21 06:39:08",0,0
"2038",811350327089831936,236673083,"Tue Dec 20 23:19:26 +0000 2016","2016-12-20 23:19:26",NA,NA,"","RT @edelamadrid: Les comparto estas fotos de las puertas en las casonas de #Campeche, una ciudad llena de leyendas e historias. #ViajemosTo…",143,0,0,0,0,"2016-12-21 02:51:27","2017-03-21 06:39:08",1,1
"2039",811744014907088896,236673083,"Thu Dec 22 01:23:49 +0000 2016","2016-12-22 01:23:49",NA,NA,"","Me dio mucho gusto sumarme al esfuerzo del Comité Municipal del PRI en Escárcega con material de construcción para… https://t.co/uVm7v422NZ",8,12,0,0,0,"2016-12-22 01:01:00","2017-03-22 12:55:48",0,0
"2040",811612499707654144,236673083,"Wed Dec 21 16:41:13 +0000 2016","2016-12-21 16:41:13",NA,NA,"","RT @alitomorenoc: Elementos policiacos bien capacitados, preparados y comprometidos para garantizar seguridad a las familias, es un comprom…",71,0,0,0,0,"2016-12-22 01:01:07","2017-03-22 12:55:48",1,1
"2041",812091278569697280,236673083,"Fri Dec 23 00:23:43 +0000 2016","2016-12-23 00:23:43",NA,NA,"","Muchas felicidades amigo Senador @LariosHector te mando un fuerte abrazo por tu cumpleaños.",3,4,0,0,0,"2016-12-23 03:33:41","2017-03-22 12:55:48",0,0
"2042",812780157383704576,236673083,"Sat Dec 24 22:01:04 +0000 2016","2016-12-24 22:01:04",NA,NA,"","Estos son días para estar con la familia. Que esta Noche Buena y Navidad haya buena salud y paz en sus hogares! https://t.co/340EvAdwpM",8,11,0,0,0,"2016-12-25 00:17:46","2017-03-22 12:55:48",0,0
"2043",813417111519367168,236673083,"Mon Dec 26 16:12:06 +0000 2016","2016-12-26 16:12:06",NA,NA,"","Muchas felicidades Senadora @Laura_Rojas_ te mando un fuerte abrazo!",2,4,0,0,0,"2016-12-26 20:45:19","2017-03-22 12:55:48",0,0
"2044",816472260991156224,236673083,"Wed Jan 04 02:32:10 +0000 2017","2017-01-04 02:32:10",NA,NA,"","RT @senadomexicano: Avala Senado declarar 2017 “Año del Centenario de la Constitución”. https://t.co/vBPqgyWeiv",86,0,0,0,0,"2017-01-05 06:30:35","2017-03-22 12:55:48",1,1
"2045",819033210831024128,236673083,"Wed Jan 11 04:08:29 +0000 2017","2017-01-11 04:08:29",NA,NA,"","RT @melendezapodaca: En compañía de @EmilseMiranda1, nuestro Delegado, Senador @RaulPozosMx y compañeros del @cdeprihidalgo partimos la tra…",10,0,0,0,0,"2017-01-10 23:37:44","2017-03-24 03:55:44",1,1
"2046",819033164374904832,236673083,"Wed Jan 11 04:08:17 +0000 2017","2017-01-11 04:08:17",NA,NA,"","RT @cdeprihidalgo: Contamos con la compañía de nuestro Delegado, Sen. @RaulPozosMx, quien al igual que @melendezapodaca, compartió un mensa…",9,0,0,0,0,"2017-01-10 23:37:44","2017-03-24 03:55:44",1,1
"2047",819382675530092544,236673083,"Thu Jan 12 03:17:07 +0000 2017","2017-01-12 03:17:07",NA,NA,"","Gran encuentro juvenil de la @RedJovenesHgo un gusto compartir hoy con mi paisano @PabloAnguloB el Gobernador… https://t.co/4zdDbe2Xkv",11,9,0,0,0,"2017-01-12 08:12:43","2017-03-24 03:55:44",0,0
"2048",819316195467919360,236673083,"Wed Jan 11 22:52:57 +0000 2017","2017-01-11 22:52:57",NA,NA,"","Hoy trabajamos unidos los Ptes. y Srios. de los CDEs, así como mis compañeros Delegados con nuestro Presidente @EnriqueOchoaR @PRI_Nacional",8,6,0,0,0,"2017-01-12 08:12:51","2017-03-24 03:55:44",0,0
"2049",820475604252266496,236673083,"Sun Jan 15 03:40:02 +0000 2017","2017-01-15 03:40:02",NA,NA,"","RT @senadomexicano: ""La urgencia de contar con una Ley de Seguridad Interior"", columna del senador @RaulPozosMx en @elsolde_mexico. https:/…",9,0,0,0,0,"2017-01-15 03:39:18","2017-03-24 03:55:44",1,1
"2050",821527592364896256,236673083,"Wed Jan 18 01:20:15 +0000 2017","2017-01-18 01:20:15",NA,NA,"","El día de hoy trabajamos con la Junta de Coordinación Política del @senadomexicano para eficientar los recursos públicos. @ComAdmonSenado",5,7,0,0,0,"2017-01-18 01:54:16","2017-03-24 03:55:44",0,0
"2051",821401157432131584,236673083,"Tue Jan 17 16:57:51 +0000 2017","2017-01-17 16:57:51",NA,NA,"","La iniciativa respalda a la que hiciera nuestro Gob. @alitomorenoc ante la Conago y es para apoyar a la economía de las familias mexicanas.",5,2,0,0,0,"2017-01-18 01:54:17","2017-03-24 03:55:44",0,0
"2052",821400013179908096,236673083,"Tue Jan 17 16:53:18 +0000 2017","2017-01-17 16:53:18",NA,NA,"","Legisladores Campechanos, presentamos al Congreso una iniciativa en apoyo a la del Gob. Moreno para recortar el pre… https://t.co/FrDX0QVH50",20,20,0,0,0,"2017-01-18 01:54:17","2017-03-24 03:55:44",0,0
"2053",821922830027784192,236673083,"Thu Jan 19 03:30:47 +0000 2017","2017-01-19 03:30:47",NA,NA,"","Felicito a nuevo Alcalde de Omitlán, Hidalgo, mi amigo @UlisesHVazquez le deseamos éxito en la gestión que hoy inicia",8,11,0,0,0,"2017-01-19 04:08:17","2017-03-25 20:58:00",0,0
"2054",821865463827206144,236673083,"Wed Jan 18 23:42:50 +0000 2017","2017-01-18 23:42:50",NA,NA,"","Hoy trabajamos en la 11a Reunión de la Comisión de Comunicaciones y Transportes del #SenadoMexicano.… https://t.co/FLDfP8gQ45",9,8,0,0,0,"2017-01-19 04:08:17","2017-03-25 20:58:00",0,0
"2055",822181316745658368,236673083,"Thu Jan 19 20:37:55 +0000 2017","2017-01-19 20:37:55",NA,NA,"","Felicito hoy que celebra un año más de vida a mi amigo y compañero Senador Miguel Romo @RomoMedina_ pásalo muy bien !",2,6,0,0,0,"2017-01-20 01:31:53","2017-03-28 01:17:41",0,0
"2056",822904862086139904,236673083,"Sat Jan 21 20:33:02 +0000 2017","2017-01-21 20:33:02",NA,NA,"","RT @senadomexicano: ""Apoyo a los que producen y a los que menos tienen"", columna del senador @RaulPozosMx en @elsolde_mexico. https://t.co/…",9,0,0,0,0,"2017-01-22 00:26:09","2017-03-28 01:17:41",1,1
"2057",824433771680190464,236673083,"Thu Jan 26 01:48:23 +0000 2017","2017-01-26 01:48:23",NA,NA,"","Necesitamos estar seguros que se están tomando las medidas para reducir los contaminantes generados por vehículos #Senarnat #MedioAmbiente",4,6,0,0,0,"2017-01-26 08:50:01","2017-03-29 02:11:28",0,0
"2058",824431470814957568,236673083,"Thu Jan 26 01:39:14 +0000 2017","2017-01-26 01:39:14",NA,NA,"","Presenté un exhorto a la SEMARNAT: Que informe sobre la implementación de la NOM que establece los niveles de conta… https://t.co/dJGJKJ6p8y",5,6,0,0,0,"2017-01-26 08:50:01","2017-03-28 01:17:41",0,0
"2059",825358428151246848,236673083,"Sat Jan 28 15:02:38 +0000 2017","2017-01-28 15:02:38",NA,NA,"","Les comparto mi colaboración semanal para El Sol De México https://t.co/FgVOWRQQDs",5,8,0,0,0,"2017-01-28 21:06:56","2017-03-29 02:11:28",0,0
"2060",825529863243063296,236673083,"Sun Jan 29 02:23:51 +0000 2017","2017-01-29 02:23:51",NA,NA,"","RT @senadomexicano: ""Ante la incertidumbre: unidad y firmeza"", columna del senador @RaulPozosMx en @elsolde_mexico. https://t.co/J37Wx2bqNZ…",13,0,0,0,0,"2017-01-30 03:15:08","2017-03-29 02:11:28",1,1
"2061",826277075363454976,236673083,"Tue Jan 31 03:53:00 +0000 2017","2017-01-31 03:53:00",NA,NA,"","#XPlenariaPRI | Trabajamos con @JoaquinColdwell, @JAGlezAnaya y @JaimeFHM en un importante análisis en materia ener… https://t.co/MNXwV0Kd2a",8,8,0,0,0,"2017-01-31 06:32:30","2017-04-03 15:41:58",0,0
"2062",826251227377836032,236673083,"Tue Jan 31 02:10:18 +0000 2017","2017-01-31 02:10:18",NA,NA,"","#10aPlenariaSenadoPRI Les comparto mi intervención ante @aurelionuno Secretario de Educación VIDEO:  https://t.co/o3eLbPWSdb",10,6,0,0,0,"2017-01-31 06:32:39","2017-04-03 15:41:58",0,0
"2063",826197697162002432,236673083,"Mon Jan 30 22:37:35 +0000 2017","2017-01-30 22:37:35",NA,NA,"","#XPlenariaPRI | Acabamos de concluir una productiva reunión con el Secretario de Economía @ildefonsogv https://t.co/IDl0yAEFna",7,9,0,0,0,"2017-01-31 06:32:47","2017-04-01 19:22:08",0,0
"2064",826156820804804608,236673083,"Mon Jan 30 19:55:09 +0000 2017","2017-01-30 19:55:09",NA,NA,"","#XPlenariaPRI | Terminamos la mesa de análisis en materia de relaciones exteriores con el Canciller @LVidegaray… https://t.co/D5lruAAFdk",14,16,0,0,0,"2017-01-31 06:32:48","2017-03-31 01:24:31",0,0
"2065",826142848789704704,236673083,"Mon Jan 30 18:59:38 +0000 2017","2017-01-30 18:59:38",NA,NA,"","RT @EnriqueOchoaR: Con gran gusto inauguré los trabajos de la #XPlenariaPRI, @Senado_PRI. Con visión crítica y autocrítica trabajaremos por…",161,0,0,0,0,"2017-01-31 06:32:59","2017-03-31 01:24:31",1,1
"2066",826142642949996544,236673083,"Mon Jan 30 18:58:49 +0000 2017","2017-01-30 18:58:49",NA,NA,"","RT @Emilio_Gamboa_: #XPlenariaPRI | Nos acompaña el Canciller @LVidegaray en la mesa de análisis en materia de política exterior. @SRE_mx h…",31,0,0,0,0,"2017-01-31 06:32:59","2017-03-29 02:11:28",1,1
"2067",826133141274390528,236673083,"Mon Jan 30 18:21:04 +0000 2017","2017-01-30 18:21:04",NA,NA,"","Iniciamos la construcción de la Agenda Legislativa en nuestra #10aReuniónPlenariaSenadoPRI Compartimos con nuestro… https://t.co/XIYWQ1cxew",19,27,0,0,0,"2017-01-31 06:32:59","2017-03-29 02:11:28",0,0
"2068",826495835257044992,236673083,"Tue Jan 31 18:22:17 +0000 2017","2017-01-31 18:22:17",NA,NA,"","Solicité a @JoseAMeadeK titular de la @SHCP_mx que no se incrementen más los precios de los combustibles VIDEO: https://t.co/pxRrqLhtYb",15,8,0,0,0,"2017-01-31 14:29:27","2017-04-05 01:34:21",0,0
"2069",826481392187944960,236673083,"Tue Jan 31 17:24:53 +0000 2017","2017-01-31 17:24:53",NA,NA,"","Iniciamos el segundo día de la Plenaria del Grupo Parlamentario del PRI. Con el gusto de escuchar al Secretario de… https://t.co/HGRaVgwmz3",8,10,0,0,0,"2017-01-31 14:29:27","2017-04-05 01:34:21",0,0
"2070",826539298958630912,236673083,"Tue Jan 31 21:14:59 +0000 2017","2017-01-31 21:14:59",NA,NA,"","Solicité que la @SCJN aclare los alcances de los derechos de las audiencias y asegurar el derecho de expresión e in… https://t.co/rgTbrTmT9J",11,13,0,0,0,"2017-02-01 05:55:26","2017-04-05 01:34:21",0,0
"2071",826979385244733440,236673083,"Thu Feb 02 02:23:44 +0000 2017","2017-02-02 02:23:44",NA,NA,"","Agradezco a los medios de comunicación la oportunidad de poder informarle a nuestra gente de Campeche sobre los tem… https://t.co/CA17nS21pB",13,11,0,0,0,"2017-02-02 07:35:37","2017-04-05 01:34:21",0,0
"2072",826961967516631040,236673083,"Thu Feb 02 01:14:31 +0000 2017","2017-02-02 01:14:31",NA,NA,"","#Campeche da la muestra hoy en la #MarchaPorLaUnidad que la suma siempre será la mejor fórmula para lograr el desar… https://t.co/00idLTnUdG",10,13,0,0,0,"2017-02-02 07:35:41","2017-04-05 01:34:21",0,0
"2073",826955242654879744,236673083,"Thu Feb 02 00:47:48 +0000 2017","2017-02-02 00:47:48",NA,NA,"","RT @alfredo_bejos: En Sesión de Congreso General iniciamos el 2do Periodo de Sesiones Ordinarias del 2do Año de Ejercicio de la LXIII Legis…",10,0,0,0,0,"2017-02-02 07:35:44","2017-04-05 01:34:21",1,1
"2074",826955128167079936,236673083,"Thu Feb 02 00:47:21 +0000 2017","2017-02-02 00:47:21",NA,NA,"","Felicito la iniciativa del Gobernador @alitomorenoc de sumar a miles de Campechanos que estamos dispuestos a trabaj… https://t.co/7toEkwNY5Q",11,8,0,0,0,"2017-02-02 07:35:44","2017-04-05 01:34:21",0,0
"2075",826954014277378048,236673083,"Thu Feb 02 00:42:55 +0000 2017","2017-02-02 00:42:55",NA,NA,"","RT @alitomorenoc: Con firmeza, con ideas y con profundo compromiso con nuestro pueblo, vamos a resolver los retos que tenemos por delante.…",125,0,0,0,0,"2017-02-02 07:35:50","2017-04-05 01:34:21",1,1
"2076",826953770936442880,236673083,"Thu Feb 02 00:41:57 +0000 2017","2017-02-02 00:41:57",NA,NA,"","Convencido de que la unidad es lo más importante, me sumé hoy a la convocatoria de nuestro Gob. @alitomorenoc… https://t.co/t2O5MWIavP",8,11,0,0,0,"2017-02-02 07:35:50","2017-04-05 01:34:21",0,0
"2077",827336119847104512,236673083,"Fri Feb 03 02:01:16 +0000 2017","2017-02-03 02:01:16",NA,NA,"","RT @RomoMedina_: Respaldando a mi amigo, @ManuelCota deseándole todo el éxito por el bien de Nayarit. https://t.co/d0S0yYSQWJ",14,0,0,0,0,"2017-02-03 01:53:41","2017-04-19 03:11:43",1,1
"2078",827336095364964352,236673083,"Fri Feb 03 02:01:10 +0000 2017","2017-02-03 02:01:10",NA,NA,"","RT @AlonsoCastilloG: Dialogué con mi amigo el Senador de la República @RaulPozosMx ,muchos temas de interés. Reconozco en él talento y voca…",73,0,0,0,0,"2017-02-03 01:53:42","2017-04-19 03:11:43",1,1
"2079",827319353943040000,236673083,"Fri Feb 03 00:54:39 +0000 2017","2017-02-03 00:54:39",NA,NA,"","Felicito a mi amigo @ManuelCota por el reconocimiento que recibe hoy en el Senado. Estoy seguro que serás el próxim… https://t.co/ud15arW3YI",13,19,0,0,0,"2017-02-03 01:53:42","2017-04-19 03:11:43",0,0
"2080",827285885121028096,236673083,"Thu Feb 02 22:41:39 +0000 2017","2017-02-02 22:41:39",NA,NA,"","Hoy en Sesión Solemne recibimos la importante visita del Presidente László Kövér, Presidente de la Asamblea Naciona… https://t.co/8eJg64KGv7",7,5,0,0,0,"2017-02-03 01:53:50","2017-04-19 03:11:43",0,0
"2081",827256773094486016,236673083,"Thu Feb 02 20:45:59 +0000 2017","2017-02-02 20:45:59",NA,NA,"","Iniciamos con mucho entusiasmo el 2o Periodo Ordinario del Segundo Año de Ejercicio de la LXIII Legislatura… https://t.co/kYnZ98J4j4",8,9,0,0,0,"2017-02-03 01:53:58","2017-04-13 10:36:40",0,0
"2082",827256466952163328,236673083,"Thu Feb 02 20:44:46 +0000 2017","2017-02-02 20:44:46",NA,NA,"","RT @senadomexicano: Compartimos los asuntos que se tienen en agenda para la sesión de #HoyEnElSenado. https://t.co/2BonW5PE9H https://t.co/…",7,0,0,0,0,"2017-02-03 01:54:06","2017-04-13 10:36:40",1,1
"2083",827200199772798976,236673083,"Thu Feb 02 17:01:10 +0000 2017","2017-02-02 17:01:10",NA,NA,"","RT @senadomexicano: Compartimos las actividades que se tienen en agenda para #HoyEnElSenado. https://t.co/IgTYjE632Q",29,0,0,0,0,"2017-02-03 01:54:14","2017-04-11 21:52:09",1,1
"2084",827659662463864832,236673083,"Fri Feb 03 23:26:55 +0000 2017","2017-02-03 23:26:55",NA,NA,"","Seguimos trabajando para ustedes #GrupoSenadoPRI https://t.co/nvvgzAdZu9",7,8,0,0,0,"2017-02-03 21:59:26","2017-04-19 03:11:43",0,0
"2085",827536481858105344,236673083,"Fri Feb 03 15:17:26 +0000 2017","2017-02-03 15:17:26",NA,NA,"","Recordaremos en México y en muchas partes del mundo el legado empresarial y social de Don. Lorenzo Servitje, descanse en paz",6,5,0,0,0,"2017-02-03 21:59:27","2017-04-19 03:11:43",0,0
"2086",827741379438669824,236673083,"Sat Feb 04 04:51:38 +0000 2017","2017-02-04 04:51:38",NA,NA,"","RT @ManuelCota: Hagamos que Nayarit sea un mar de oportunidades para todos. https://t.co/rRka8uHOaW",70,0,0,0,0,"2017-02-04 06:36:33","2017-04-22 04:20:17",1,1
"2087",828011594785312768,236673083,"Sat Feb 04 22:45:22 +0000 2017","2017-02-04 22:45:22",NA,NA,"","Lamento mucho la pérdida que sufre toda la Familia Beltrones en especial abrazo a @MFBeltrones, descanse en paz Orestes Beltrones Rivera.",5,2,0,0,0,"2017-02-04 18:39:28","2017-04-22 04:20:17",0,0
"2088",827925727567761408,236673083,"Sat Feb 04 17:04:10 +0000 2017","2017-02-04 17:04:10",NA,NA,"","RT @senadomexicano: ""La práctica de la ley suprema"", columna del senador @RaulPozosMx en @elsolde_mexico. https://t.co/O7HajfnKRF https://t…",7,0,0,0,0,"2017-02-04 18:39:28","2017-04-22 04:20:17",1,1
"2089",827896722265305088,236673083,"Sat Feb 04 15:08:54 +0000 2017","2017-02-04 15:08:54",780843185857699840,NA,"LuisEMirandaN","@LuisEMirandaN Felicidades en su cumpleaños Secretario, le deseo un gran año y que especialmente hoy lo disfrute con su familia",3,6,0,0,0,"2017-02-04 18:39:37","2017-04-22 04:20:17",0,0
"2090",827896157967835136,236673083,"Sat Feb 04 15:06:40 +0000 2017","2017-02-04 15:06:40",NA,NA,"","RT @ONU_es: #DíaMundialContraElCáncer, 4F - En la lucha contra el #cáncer, la prevención y la detección temprana son claves https://t.co/8Q…",670,0,0,0,0,"2017-02-04 18:39:37","2017-04-22 04:20:17",1,1
"2091",827895898122317824,236673083,"Sat Feb 04 15:05:38 +0000 2017","2017-02-04 15:05:38",NA,NA,"","Hoy es el  #DíaMundialContraElCáncer  Les comparto información para prevenir este gran mal que afecta a millones. https://t.co/4veSlO8g8d",2,4,0,0,0,"2017-02-04 18:39:38","2017-04-22 04:20:17",0,0
"2092",828331429108944896,236673083,"Sun Feb 05 19:56:17 +0000 2017","2017-02-05 19:56:17",NA,NA,"","RT @senadomexicano: Presidente de la República, @EPN firma decreto promulgatorio de reforma constitucional sobre justicia cotidiana https:/…",11,0,0,0,0,"2017-02-06 03:28:23","2017-04-25 11:58:42",1,1
"2093",828331340164521984,236673083,"Sun Feb 05 19:55:55 +0000 2017","2017-02-05 19:55:55",NA,NA,"","RT @senadomexicano: Hace cien años en este mismo lugar México alzó la voz y levantó las miras con visión de futuro: @Pabloescuderom https:/…",11,0,0,0,0,"2017-02-06 03:28:24","2017-04-25 11:58:42",1,1
"2094",828331305343471616,236673083,"Sun Feb 05 19:55:47 +0000 2017","2017-02-05 19:55:47",NA,NA,"","RT @senadomexicano: #Constitución1917 refleja el dinamismo de una sociedad, su determinación por avanzar: Sen. @Pabloescuderom https://t.co…",8,0,0,0,0,"2017-02-06 03:28:24","2017-04-25 11:58:42",1,1
"2095",828331163399843840,236673083,"Sun Feb 05 19:55:13 +0000 2017","2017-02-05 19:55:13",NA,NA,"","RT @senadomexicano: En el Centario de la Constitución el Senado convierte el Teatro de la República en un legado para la Nación. https://t.…",74,0,0,0,0,"2017-02-06 03:28:24","2017-04-25 11:58:42",1,1
"2096",828289049785831424,236673083,"Sun Feb 05 17:07:52 +0000 2017","2017-02-05 17:07:52",NA,NA,"","Un gran Campechano reconocido en Latinoamérica el Dr. Jorge Carpizo nos regaló frases que les comparto… https://t.co/wiiZdPBmfF",8,9,0,0,0,"2017-02-06 03:28:24","2017-04-25 11:58:42",0,0
"2097",828287206594744320,236673083,"Sun Feb 05 17:00:33 +0000 2017","2017-02-05 17:00:33",NA,NA,"","#CentenarioDeLaConstitucion Les comparto la columna que escribí sobre nuestras leyes  https://t.co/xHQwc3eaO7 @elsolde_mexico",4,4,0,0,0,"2017-02-06 03:28:32","2017-04-25 11:58:42",0,0
"2098",829526918101946368,236673083,"Thu Feb 09 03:06:43 +0000 2017","2017-02-09 03:06:43",NA,NA,"","Estamos trabajando en una reunión con el Secretario de @SAGARPA_mx nuestro amigo @JoseCalzadaR https://t.co/mC065UIFwe",7,7,0,0,0,"2017-02-08 22:42:31","2017-04-28 07:18:33",0,0
"2099",829380070624030720,236673083,"Wed Feb 08 17:23:12 +0000 2017","2017-02-08 17:23:12",NA,NA,"","Estamos trabajando en la iniciativa preferente de @EPN  en materia de revalidación de estudios de migrantes expatri… https://t.co/wYKbQ0cA8v",8,8,0,0,0,"2017-02-08 22:42:32","2017-04-27 07:00:31",0,0
"2100",829361551635316736,236673083,"Wed Feb 08 16:09:37 +0000 2017","2017-02-08 16:09:37",NA,NA,"","#Entérate sobre la Estrategia #SomosMexicanos pensada para ti que has sido repatriado de #EU #EstamosContigo https://t.co/SvJkQ7JxQ5",8,4,0,0,0,"2017-02-08 22:42:40","2017-04-27 07:00:31",0,0
"2101",829361439718666240,236673083,"Wed Feb 08 16:09:10 +0000 2017","2017-02-08 16:09:10",NA,NA,"","Celebramos las acciones del Pdte. @EPN de recibir a connacionales repatriados, reiterándoles el compromiso de generar mejores oportunidades.",6,5,0,0,0,"2017-02-08 22:42:48","2017-04-27 07:00:31",0,0
"2102",829193980113981440,236673083,"Wed Feb 08 05:03:45 +0000 2017","2017-02-08 05:03:45",NA,NA,"","RT @TelemarNoticias: ¿Conoces los sitios turísticos para visitar en el estado de Campeche? Aquí te los presentamos. https://t.co/Ubj1OCOeIl",7,0,0,0,0,"2017-02-08 22:42:48","2017-04-27 07:00:31",1,1
"2103",828835758089703424,236673083,"Tue Feb 07 05:20:18 +0000 2017","2017-02-07 05:20:18",NA,NA,"","Les comparto un video que muestra el respaldo y ánimo con el que vivimos el registro de nuestro amigo @ManuelCota… https://t.co/pJRh1sNvk1",15,10,0,0,0,"2017-02-08 22:42:56","2017-04-27 07:00:31",0,0
"2104",828681477160210432,236673083,"Mon Feb 06 19:07:14 +0000 2017","2017-02-06 19:07:14",NA,NA,"","Acompañando al futuro Gobernador de Nayarit mi amigo @ManuelCota en su registro como Candidato #PRI https://t.co/xoh99UWMkJ",15,10,0,0,0,"2017-02-08 22:43:06","2017-04-25 11:58:42",0,0
"2105",828626310003953664,236673083,"Mon Feb 06 15:28:02 +0000 2017","2017-02-06 15:28:02",NA,NA,"","Los invito a que escuchar ahora la entrevista que tuve con @ABCRadio Para hablar sobre los lineamientos del IFT. https://t.co/juOLsTJZZH",6,4,0,0,0,"2017-02-08 22:43:06","2017-04-25 11:58:42",0,0
"2106",830077588764717056,236673083,"Fri Feb 10 15:34:53 +0000 2017","2017-02-10 15:34:53",NA,NA,"","RT @Senado_PRI: #CentenarioDeLaConstitución | Reformas por periodo presidencial. https://t.co/ryLqS0Mw9v",34,0,0,0,0,"2017-02-10 11:35:49","2017-04-29 17:01:11",1,1
"2107",829789693327745024,236673083,"Thu Feb 09 20:30:54 +0000 2017","2017-02-09 20:30:54",NA,NA,"","Me reuní con la Subsecretaria de Desarrollo Rural, Mely Romero para gestionar mayores beneficios a los campechanos… https://t.co/ex6p7KaWZd",9,8,0,0,0,"2017-02-10 11:35:49","2017-04-28 07:18:33",0,0
"2108",829763325466599424,236673083,"Thu Feb 09 18:46:07 +0000 2017","2017-02-09 18:46:07",NA,NA,"","El día de hoy llevé a cabo una reunión de trabajo con la Secretaría General de Servicios Administrativos y la Tesor… https://t.co/SSKsZ8kwx3",8,8,0,0,0,"2017-02-10 11:35:57","2017-04-28 07:18:33",0,0
"2109",829538033871392768,236673083,"Thu Feb 09 03:50:54 +0000 2017","2017-02-09 03:50:54",NA,NA,"","El desarrollo de la agricultura, Ganaderia y pesca es fundamental para que México logre superar sus retos. Trabajan… https://t.co/kxwI8RaY0V",11,8,0,0,0,"2017-02-10 11:36:06","2017-04-28 07:18:33",0,0
"2110",830205489392742400,236673083,"Sat Feb 11 00:03:07 +0000 2017","2017-02-11 00:03:07",NA,NA,"","El compromiso es trabajar por ustedes @Senado_PRI https://t.co/9wJQJNIo3b",9,10,0,0,0,"2017-02-11 06:12:00","2017-05-02 19:26:45",0,0
