"","id_tweet","id_twitter","created_at","created_at_datetime","in_reply_to_user_id","in_reply_to_status_id","in_reply_to_screen_name","text","retweet_count","favorite_count","longitude","latitude","retweeted","creation_date","modification_date","RT_temp","is_retweeted"
"1",526192009510674432,236673083,"Sun Oct 26 02:02:05 +0000 2014","2014-10-26 02:02:05",NA,NA,"","Les comparto mi participación en @senadomexicano sobre mi iniciativa de promocionar el consumo de productos pesqueros http://t.co/YXhGZBzXNw",18,2,0,0,0,"2015-05-28 19:32:52","2015-05-28 19:49:26",0,NA
"2",526200694655971328,236673083,"Sun Oct 26 02:36:36 +0000 2014","2014-10-26 02:36:36",NA,NA,"","Felicidades a la nueva dirigencia de @FColosioCAM que será encabezada por @Ilsacervera; éxito en su nueva encomienda! http://t.co/HUEqHBvyhi",14,4,0,0,0,"2015-05-28 19:32:52","2015-05-28 19:49:26",0,NA
"3",526468550282977280,236673083,"Sun Oct 26 20:20:58 +0000 2014","2014-10-26 20:20:58",NA,NA,"","¡Felicidades a mi amigo Senador @Pepe_Yunes por su Informe de Actividades Legislativas! #MéxicoTieneRumbo http://t.co/TcW77ZzwKC",5,4,0,0,0,"2015-05-28 19:32:52","2015-05-28 19:49:26",0,NA
"4",526894280573722624,236673083,"Tue Oct 28 00:32:40 +0000 2014","2014-10-28 00:32:40",NA,NA,"","Fue un placer haber compartido con ustedes y recordar mis inicios en el partido. #Diálogos #Tenabo http://t.co/4dbzzXR56n",6,3,0,0,0,"2015-05-28 19:32:52","2015-05-28 19:49:26",0,NA
"5",526911387906625536,236673083,"Tue Oct 28 01:40:39 +0000 2014","2014-10-28 01:40:39",NA,NA,"","Les reitero mi compromiso por luchar por su felicidad y su bienestar de las mujeres campechanas. #Diálogos #Tenabo http://t.co/v6NfaSoBfX",12,5,0,0,0,"2015-05-28 19:32:52","2015-05-28 19:49:26",0,NA
"6",527132508736204800,236673083,"Tue Oct 28 16:19:18 +0000 2014","2014-10-28 16:19:18",NA,NA,"","Les comparto mi columna ""Beneficios del programa Prospera"" en la que colaboro cada semana con @elsolde_mexico http://t.co/aMfqxxoTpl",22,3,0,0,0,"2015-05-28 19:32:52","2015-05-28 19:49:26",0,NA
"7",527157969944084480,236673083,"Tue Oct 28 18:00:28 +0000 2014","2014-10-28 18:00:28",NA,NA,"","Hoy iniciamos con #YoCreoCampeche, una aplicación en la que podremos interactuar y opinar sobre cómo #CampecheSíPuede salir adelante.",17,4,0,0,0,"2015-05-28 19:32:52","2015-06-01 23:28:22",0,NA
"8",527177748864045056,236673083,"Tue Oct 28 19:19:04 +0000 2014","2014-10-28 19:19:04",NA,NA,"","Les invito a ver la Sesión, presentaré un Dictamen de la Comisión de Salud. Exhorto para formalizar recursos  #HospitalGeneralParaCampeche",22,3,0,0,0,"2015-05-28 19:32:52","2015-06-02 16:52:17",0,NA
"9",527192745740218368,236673083,"Tue Oct 28 20:18:40 +0000 2014","2014-10-28 20:18:40",NA,NA,"","Inicio mi intervención ahora, en vivo por http://t.co/9fAF5B7bqD",7,2,0,0,0,"2015-05-28 19:32:52","2015-06-02 16:52:17",0,NA
"10",527196528461348864,236673083,"Tue Oct 28 20:33:41 +0000 2014","2014-10-28 20:33:41",NA,NA,"","RT @senadomexicano: Para Campeche es prioritario contar con infraestructura apegada a sus necesidades, enfatiza el Sen. @RaulPozosMx.",20,0,0,0,0,"2015-05-28 19:32:52","2015-06-03 20:23:02",1,NA
"11",527196754521751552,236673083,"Tue Oct 28 20:34:35 +0000 2014","2014-10-28 20:34:35",NA,NA,"","RT @senadomexicano: Sen. @RaulPozosMx aborda dictamen referente al equipamiento de un hospital general de 72 camas en el Fraccionamiento Si…",20,0,0,0,0,"2015-05-28 19:32:52","2015-06-05 10:34:03",1,NA
"12",527220978116747264,236673083,"Tue Oct 28 22:10:51 +0000 2014","2014-10-28 22:10:51",NA,NA,"","Te invito a participar en la dinámica de nuestra aplicación #YoCreoCampeche; ingresa en: http://t.co/u8SKqpYiHa",12,1,0,0,0,"2015-05-28 19:32:52","2015-06-05 10:34:03",0,NA
"13",527221355620868096,236673083,"Tue Oct 28 22:12:21 +0000 2014","2014-10-28 22:12:21",NA,NA,"","Para más informes pueden seguir la cuenta de @YoCreoCampeche",12,2,0,0,0,"2015-05-28 19:32:52","2015-06-05 10:34:03",0,NA
"14",527265871128186880,236673083,"Wed Oct 29 01:09:14 +0000 2014","2014-10-29 01:09:14",NA,NA,"","Con su compromiso y trabajo duro sacaremos a nuestros jóvenes adelante y demostraremos que #CampechePuede #Educación http://t.co/i7zovzWfYr",18,10,0,0,0,"2015-05-28 19:32:52","2015-06-05 10:34:03",0,NA
"15",527289045077213184,236673083,"Wed Oct 29 02:41:19 +0000 2014","2014-10-29 02:41:19",NA,NA,"","¿Y tú ya eres parte de #YoCreoCampeche? Ingresa, participa con nosotros. http://t.co/u8SKqpYiHa",12,3,0,0,0,"2015-05-28 19:32:52","2015-06-05 10:34:03",0,NA
"16",527549590405656576,236673083,"Wed Oct 29 19:56:38 +0000 2014","2014-10-29 19:56:38",NA,NA,"","#CampechePuede tener mejor atención médica con un nuevo Hospital General. http://t.co/VDu7BRskew",7,5,0,0,0,"2015-05-28 19:32:52","2015-06-05 10:34:03",0,NA
"17",527577817689509888,236673083,"Wed Oct 29 21:48:48 +0000 2014","2014-10-29 21:48:48",NA,NA,"","¡Felicitaciones a los estudiantes, docentes y administrativos del @itescham en su VIII Aniversario! http://t.co/GfRmKrEYQt",6,3,0,0,0,"2015-05-28 19:32:52","2015-06-05 10:34:03",0,NA
"18",527615259352133632,236673083,"Thu Oct 30 00:17:35 +0000 2014","2014-10-30 00:17:35",NA,NA,"","Iniciamos nuestra Sesión, se analizará el Dictamen sobre la Ley de Ingresos de la Federación para el presupuesto 2015",3,4,0,0,0,"2015-05-28 19:32:52","2015-06-05 10:34:03",0,NA
"19",527617358844923904,236673083,"Thu Oct 30 00:25:55 +0000 2014","2014-10-30 00:25:55",NA,NA,"","#CampechePuede tener mejor atención médica con un nuevo Hospital General. http://t.co/puLeMNHcOe",7,2,0,0,0,"2015-05-28 19:32:52","2015-06-07 22:05:45",0,NA
"20",527685569237614592,236673083,"Thu Oct 30 04:56:58 +0000 2014","2014-10-30 04:56:58",NA,NA,"","Se aprueba en lo General la Ley de Ingresos para la Federación para el ejercicio del presupuesto 2015 #AsiCumplimos @Senado_PRI",6,3,0,0,0,"2015-05-28 19:32:52","2015-06-17 00:13:31",0,NA
"21",527686092837773312,236673083,"Thu Oct 30 04:59:03 +0000 2014","2014-10-30 04:59:03",NA,NA,"","Les invito a ver mi participación en el debate sobre los ingresos tributarios y petroleros en vivo @CanalCongreso #LeyDeIngresos",4,6,0,0,0,"2015-05-28 19:32:52","2015-06-29 11:01:12",0,NA
"22",527712040446480384,236673083,"Thu Oct 30 06:42:09 +0000 2014","2014-10-30 06:42:09",NA,NA,"","En breve haré uso de la Tribuna del @senadomexicano para hablar sobre el Dictamen de la Ley de Ingresos con el tema de ingresos petroleros",5,4,0,0,0,"2015-05-28 19:32:52","2015-06-29 23:28:15",0,NA
"23",527771285557084160,236673083,"Thu Oct 30 10:37:34 +0000 2014","2014-10-30 10:37:34",NA,NA,"","RT @senadomexicano: Creo que la transparencia y la claridad del destino de recursos hacendarios deben tener una visión con esencia social: …",9,0,0,0,0,"2015-05-28 19:32:52","2015-06-29 23:28:15",1,NA
"24",527771392969048064,236673083,"Thu Oct 30 10:38:00 +0000 2014","2014-10-30 10:38:00",NA,NA,"","RT @BordePolitico: #Sen @RaulPozosMx #PRI: Transparencia y la calidad de recursos que emanan del pueblo deben canalizarse para bienestar #L…",1,0,0,0,0,"2015-05-28 19:32:52","2015-06-29 23:28:15",1,NA
"25",527771443233558528,236673083,"Thu Oct 30 10:38:12 +0000 2014","2014-10-30 10:38:12",NA,NA,"","RT @OParlamen: #LeydeIngresos | Señala @RaulPozosMx #PRI que @EPN no solo vino a administrar el país, sino también a transformarlo.",4,0,0,0,0,"2015-05-28 19:32:52","2015-06-29 23:28:15",1,NA
"26",527863647435907072,236673083,"Thu Oct 30 16:44:35 +0000 2014","2014-10-30 16:44:35",NA,NA,"","Será un placer poder platicar a detalle la visión que tengo para nuestro estado. Yo creo, Campeche sí puede! http://t.co/UqJ5XFwWEn",22,8,0,0,0,"2015-05-28 19:32:52","2015-06-29 23:28:15",0,NA
"27",527960820622577664,236673083,"Thu Oct 30 23:10:43 +0000 2014","2014-10-30 23:10:43",NA,NA,"","Les comparto el video de mi intervención en el debate de la Ley de Ingresos de la Federación para el ejercicio 2015.
http://t.co/2dDcd5OVRr",15,1,0,0,0,"2015-05-28 19:32:52","2015-06-29 23:28:15",0,NA
"28",528000415619903488,236673083,"Fri Oct 31 01:48:03 +0000 2014","2014-10-31 01:48:03",NA,NA,"","Estoy a unos minutos de empezar la plática a la que fui invitado para platicar acerca de la visión de #CampechePuede http://t.co/9VmzrEp5sR",5,1,0,0,0,"2015-05-28 19:32:52","2015-06-30 13:25:59",0,NA
"29",528016132461318144,236673083,"Fri Oct 31 02:50:30 +0000 2014","2014-10-31 02:50:30",NA,NA,"","Es un gusto compartir con ustedes mi perspectiva de la administración pública y mi visión Yo creo, Campeche sí puede. http://t.co/eTmVETRgEI",35,10,0,0,0,"2015-05-28 19:32:52","2015-06-30 13:25:59",0,NA
"30",528393659595882496,236673083,"Sat Nov 01 03:50:40 +0000 2014","2014-11-01 03:50:40",NA,NA,"","Tenemos todo para aprovechar nuestro potencial, como ustedes, estoy convencido que #CampecheSíPuede http://t.co/aLdHftGFXi",24,7,0,0,0,"2015-05-28 19:32:52","2015-06-30 13:25:59",0,NA
"31",528594020256473088,236673083,"Sat Nov 01 17:06:49 +0000 2014","2014-11-01 17:06:49",NA,NA,"","Disfrutemos la tradición de recordar a nuestros seres queridos y la comida que en su honor se prepara #DiáDeMuertos http://t.co/JCCZvA3yc9",26,15,0,0,0,"2015-05-28 19:32:52","2015-06-30 13:25:59",0,NA
"32",528627852431085568,236673083,"Sat Nov 01 19:21:16 +0000 2014","2014-11-01 19:21:16",NA,NA,"","#CampecheSíPuede trabajando en unidad y llevando por delante acciones con resultados diseñados para todos! http://t.co/ssCvGsW9fy",26,8,0,0,0,"2015-05-28 19:32:52","2015-06-30 13:25:59",0,NA
"33",529410726650458112,236673083,"Mon Nov 03 23:12:07 +0000 2014","2014-11-03 23:12:07",NA,NA,"","Con el gusto de recibir en #Campeche a mi amigo y compañero Sen. @Pepe_Yunes @PRICampeche #PlataformaElectoral2015 http://t.co/svbq40QOlh",15,8,0,0,0,"2015-05-28 19:32:52","2015-06-30 13:25:59",0,NA
"34",529469771700764672,236673083,"Tue Nov 04 03:06:45 +0000 2014","2014-11-04 03:06:45",NA,NA,"","Un placer haber participado en el encuentro temático #ProsperidadParaTodos organizado por @FColosioCAM @PRI_Campeche http://t.co/1j3TuwrtU6",6,8,0,0,0,"2015-05-28 19:32:52","2015-06-30 13:25:59",0,NA
"35",529694473526456320,236673083,"Tue Nov 04 17:59:38 +0000 2014","2014-11-04 17:59:38",NA,NA,"","Hoy presentaremos una proposición con punto de acuerdo sobre el Ébola @senadomexicano http://t.co/GAZDqBJqWV",7,4,0,0,0,"2015-05-28 19:32:52","2015-06-30 13:25:59",0,NA
"36",529719304280096768,236673083,"Tue Nov 04 19:38:18 +0000 2014","2014-11-04 19:38:18",NA,NA,"","Celebramos que Campeche sea parte de la visita a México del Príncipe Carlos y su esposa Camila #CampechePuede http://t.co/NugMxCvej9",4,9,0,0,0,"2015-05-28 19:32:52","2015-06-30 13:25:59",0,NA
"37",529806137332596736,236673083,"Wed Nov 05 01:23:21 +0000 2014","2014-11-05 01:23:21",NA,NA,"","RT @PRI_Campeche: Grandes aportaciones en el foro @FColosioCAM en el marco del Encuentro Temático #Prosperidadparatodos @anagcrisanty http:…",14,0,0,0,0,"2015-05-28 19:32:52","2015-06-30 13:25:59",1,NA
"38",529815574080012288,236673083,"Wed Nov 05 02:00:51 +0000 2014","2014-11-05 02:00:51",NA,NA,"","Estoy muy contento de compartir con ustedes el documento Yo Creo, Campeche Sí Puede. #CampecheSíPuede http://t.co/nCg42vhJCl",12,4,0,0,0,"2015-05-28 19:32:52","2015-06-30 13:25:59",0,NA
"39",529828291545681920,236673083,"Wed Nov 05 02:51:23 +0000 2014","2014-11-05 02:51:23",NA,NA,"","RT @YoCreoCampeche: @RaulPozosMx está listo, ¡nosotros también! #CampecheSíPuede #YoCreoCampeche http://t.co/WcFYrFIMML",16,0,0,0,0,"2015-05-28 19:32:52","2015-06-30 13:25:59",1,NA
"40",529841214695407616,236673083,"Wed Nov 05 03:42:44 +0000 2014","2014-11-05 03:42:44",NA,NA,"","Yo Creo que ustedes también pueden escribir su propia historia de éxito... #CampecheSíPuede ! 
http://t.co/0C1aXAfPKr",11,5,0,0,0,"2015-05-28 19:32:51","2015-06-30 13:25:59",0,NA
"41",530108502350766080,236673083,"Wed Nov 05 21:24:50 +0000 2014","2014-11-05 21:24:50",NA,NA,"","#YoCreo que la principal fortaleza de Campeche es su gente. #CampecheSíPuede http://t.co/wxvgGEKurs",16,5,0,0,0,"2015-05-28 19:32:51","2015-06-30 13:25:59",0,NA
"42",530148238490214400,236673083,"Thu Nov 06 00:02:44 +0000 2014","2014-11-06 00:02:44",NA,NA,"","Aunque sea doloroso.. Acude al dentista regularmente, la salud bucal es muy importante #Salud http://t.co/drFz32L7oh",13,9,0,0,0,"2015-05-28 19:32:51","2015-06-30 13:25:59",0,NA
"43",530183313118347264,236673083,"Thu Nov 06 02:22:06 +0000 2014","2014-11-06 02:22:06",NA,NA,"","Por fin termina mi sesión odontológica!  Gracias Dr. Boris, siempre vale la pena prevenir cuando se trata de nuestra salud.",4,4,0,0,0,"2015-05-28 19:32:51","2015-06-30 13:25:59",0,NA
"44",530183798105714688,236673083,"Thu Nov 06 02:24:02 +0000 2014","2014-11-06 02:24:02",NA,NA,"","RT @VerdeSenadoMex: Los Sen @RaulPozosMx @JesusCasillas06 @marianagc y @GerardoFloresR durante la Comisión de los Derechos de los niñ@s htt…",26,0,0,0,0,"2015-05-28 19:32:51","2015-06-30 13:25:59",1,NA
"45",530415438807990272,236673083,"Thu Nov 06 17:44:29 +0000 2014","2014-11-06 17:44:29",NA,NA,"","RT @senadomexicano: Inicia la sesión del Senado de la República, síguela #EnVivo aquí https://t.co/UX8cHuuH5u",4,0,0,0,0,"2015-05-28 19:32:51","2015-06-30 13:25:59",1,NA
"46",530415619825762304,236673083,"Thu Nov 06 17:45:13 +0000 2014","2014-11-06 17:45:13",NA,NA,"","RT @DesdeLasCamaras: No te pierdas entrevista a @RaulPozosMx del @senadomexicano por @vsanchezbanos a las 11:30 PM en @Proyecto40 ""volatili…",11,0,0,0,0,"2015-05-28 19:32:51","2015-06-30 13:25:59",1,NA
"47",530419435475963904,236673083,"Thu Nov 06 18:00:22 +0000 2014","2014-11-06 18:00:22",NA,NA,"","Les comparto la Gaceta de la Sesión de hoy, los Senadores de la Comisión de Medio Ambiente presentaremos dictámenes http://t.co/lhtzSIukuZ",9,5,0,0,0,"2015-05-28 19:32:51","2015-06-30 13:25:59",0,NA
"48",530435781996077056,236673083,"Thu Nov 06 19:05:20 +0000 2014","2014-11-06 19:05:20",NA,NA,"","Aprobamos el Dictamen por el cual el Senado designa a Roberto del Cueto Legaspi como SubGobernador del Banco de México. Le deseamos éxito !",7,4,0,0,0,"2015-05-28 19:32:51","2015-06-30 13:25:59",0,NA
"49",530448088696381440,236673083,"Thu Nov 06 19:54:14 +0000 2014","2014-11-06 19:54:14",NA,NA,"","Hago uso de la tribuna ahora para presentar un Dictamen sobre el impulso del ecoturismo responsable de las zonas de manglares",11,5,0,0,0,"2015-05-28 19:32:51","2015-06-30 13:25:59",0,NA
"50",530534839884464128,236673083,"Fri Nov 07 01:38:57 +0000 2014","2014-11-07 01:38:57",NA,NA,"","Mejorar la economía de México y de Campeche es un gran reto, felicito a todos los economistas en su día! #DiaDelEconomista",9,6,0,0,0,"2015-05-28 19:32:51","2015-06-30 13:25:59",0,NA
"51",530538390392176640,236673083,"Fri Nov 07 01:53:03 +0000 2014","2014-11-07 01:53:03",NA,NA,"","Les comparto el video completo de la visión ""Yo creo, Campeche sí puede"" #CampecheSiPuede http://t.co/zyZRjmgq8d",30,9,0,0,0,"2015-05-28 19:32:51","2015-06-30 13:25:59",0,NA
"52",530567875795619840,236673083,"Fri Nov 07 03:50:13 +0000 2014","2014-11-07 03:50:13",NA,NA,"","Les invito a ver a las 23:30 h mi entrevista en @DesdeLasCamaras por @Proyecto40 canal 140 o http://t.co/c3PHw71QRK",13,6,0,0,0,"2015-05-28 19:32:51","2015-06-30 13:25:59",0,NA
"53",530812117977677824,236673083,"Fri Nov 07 20:00:45 +0000 2014","2014-11-07 20:00:45",NA,NA,"","El #Ecoturismo es estratégico para el crecimiento económico y la conservación ambiental de Campeche #CampechePuede 
http://t.co/SSyH77LKZi",9,2,0,0,0,"2015-05-28 19:32:51","2015-06-30 13:25:59",0,NA
"54",530840339893215232,236673083,"Fri Nov 07 21:52:54 +0000 2014","2014-11-07 21:52:54",NA,NA,"","Impulsando el #Ecoturismo responsable en las zonas de manglar podemos mejorar la economía de la gente #CampechePuede http://t.co/qFgugzL9Y7",8,3,0,0,0,"2015-05-28 19:32:51","2015-06-30 13:25:59",0,NA
"55",530865636474626048,236673083,"Fri Nov 07 23:33:25 +0000 2014","2014-11-07 23:33:25",NA,NA,"","Presenté un Dictamen de la Comisión de Medio Ambiente del Senado para impulsar el #Ecoturismo #CampechePuede http://t.co/n0jKdM9vw4",7,1,0,0,0,"2015-05-28 19:32:51","2015-06-30 13:25:59",0,NA
"56",530880979024744448,236673083,"Sat Nov 08 00:34:23 +0000 2014","2014-11-08 00:34:23",NA,NA,"","Felicito a mi amiga y compañera Senadora @MarcelaGuerraNL por su cumpleaños, te mandó un fuerte abrazo.",2,4,0,0,0,"2015-05-28 19:32:51","2015-07-02 00:25:40",0,NA
"57",531137526128734208,236673083,"Sat Nov 08 17:33:48 +0000 2014","2014-11-08 17:33:48",NA,NA,"","Con la fuerza y talento de sus mujeres, Campeche Si Puede! http://t.co/g2v2F28OQo",28,10,0,0,0,"2015-05-28 19:32:51","2015-07-02 00:25:40",0,NA
"58",531148499719827456,236673083,"Sat Nov 08 18:17:25 +0000 2014","2014-11-08 18:17:25",NA,NA,"","Mi esposa @MaritereCastro acompaño a nuestra amiga @marigelyeca y a todo el equipo del @difmc12_15 en su 2o Informe. http://t.co/OxZAAZyZoQ",7,3,0,0,0,"2015-05-28 19:32:51","2015-07-02 00:25:40",0,NA
"59",531497488101146624,236673083,"Sun Nov 09 17:24:10 +0000 2014","2014-11-09 17:24:10",NA,NA,"","RT @senadomexicano: ""Ecoturismo"" opinión del Senador @RaulPozosMx en @elsolde_mexico http://t.co/jzMstTA4Vv http://t.co/KSX3nCiJGw",11,0,0,0,0,"2015-05-28 19:32:51","2015-07-02 00:25:40",1,NA
"60",531540311441698816,236673083,"Sun Nov 09 20:14:20 +0000 2014","2014-11-09 20:14:20",NA,NA,"","Les comparto un video especial de mi diálogo con la Asociación ""Por nosotras"" #CampecheSíPuede http://t.co/bdOKEPK8kX",14,5,0,0,0,"2015-05-28 19:32:51","2015-07-02 00:25:40",0,NA
"61",531573409772474368,236673083,"Sun Nov 09 22:25:51 +0000 2014","2014-11-09 22:25:51",NA,NA,"","Le deseo a mi amiga @SenArelyGomez un gran día y éxito en este nuevo año de vida, te mando un abrazo desde Campeche !",2,2,0,0,0,"2015-05-28 19:32:51","2015-07-02 00:25:40",0,NA
"62",531887771687088128,236673083,"Mon Nov 10 19:15:01 +0000 2014","2014-11-10 19:15:01",NA,NA,"","Les comparto una entrevista que me hicieron para el programa @DesdeLasCamaras del @Proyecto40 http://t.co/SiWT0brTcV",9,2,0,0,0,"2015-05-28 19:32:51","2015-07-02 00:25:40",0,NA
"63",531939162451357696,236673083,"Mon Nov 10 22:39:13 +0000 2014","2014-11-10 22:39:13",NA,NA,"","Les comparto mi columna ""Ecoturismo"" en @elsolde_mexico http://t.co/E9Xb67rHCt",7,2,0,0,0,"2015-05-28 19:32:51","2015-07-02 00:25:40",0,NA
"64",531983460307861504,236673083,"Tue Nov 11 01:35:15 +0000 2014","2014-11-11 01:35:15",NA,NA,"","Les comparto este vídeo del diálogo con la Asociación ""Por Nosotras"" #CampecheSíPuede http://t.co/WlWTDom0AX",12,3,0,0,0,"2015-05-28 19:32:51","2015-07-02 00:25:40",0,NA
"65",532276029260595200,236673083,"Tue Nov 11 20:57:49 +0000 2014","2014-11-11 20:57:49",NA,NA,"","Reprobamos la agresión física y verbal que sufrió nuestro compañero Senador @A_Encinas_R que no quede impune este o cualquier delito.",7,9,0,0,0,"2015-05-28 19:32:51","2015-07-02 00:25:40",0,NA
"66",532283059622920192,236673083,"Tue Nov 11 21:25:45 +0000 2014","2014-11-11 21:25:45",NA,NA,"","Es un gusto compartir la jornada legislativa con mi amigo y vecino tabasqueño @aoramasvargas http://t.co/pnz7UyUfja",6,4,0,0,0,"2015-05-28 19:32:51","2015-07-02 00:25:40",0,NA
"67",532343497366724608,236673083,"Wed Nov 12 01:25:54 +0000 2014","2014-11-12 01:25:54",NA,NA,"","Felicidades a mi amigo Sen @EvielPM  por ser promotor de buen arte. Les comparto mi foto con el pintor Amador Montes http://t.co/51lDQgC1LH",13,6,0,0,0,"2015-05-28 19:32:51","2015-07-02 00:25:40",0,NA
"68",532349573759782912,236673083,"Wed Nov 12 01:50:03 +0000 2014","2014-11-12 01:50:03",NA,NA,"","Siempre he considerado el Diálogo como la mejor forma de conocer lo que las mujeres aspiran y sueñan #CampecheSíPuede http://t.co/oijw2sbn2U",8,4,0,0,0,"2015-05-28 19:32:50","2015-07-02 00:25:40",0,NA
"69",532724454510825472,236673083,"Thu Nov 13 02:39:42 +0000 2014","2014-11-13 02:39:42",NA,NA,"","Les comparto un video con una parte de mi historia. Como ustedes, Yo creo que #CampecheSíPuede !
http://t.co/ShGyNgH0nO",16,11,0,0,0,"2015-05-28 19:32:50","2015-07-02 00:25:40",0,NA
"70",533008331921969152,236673083,"Thu Nov 13 21:27:43 +0000 2014","2014-11-13 21:27:43",NA,NA,"","Elegimos en el @senadomexicano al nuevo Presidente de la Comisión Nacional de Derechos Humanos, Luis R. González Pérez, le deseamos éxito!",9,4,0,0,0,"2015-05-28 19:32:50","2015-07-02 00:25:40",0,NA
"71",533249543803273216,236673083,"Fri Nov 14 13:26:13 +0000 2014","2014-11-14 13:26:13",243309706,533041928280236032,"Alpuuchee","“@Alpuuchee: Con el Senador @RaulPozosMx Muchas Gracias!/ gracias por tu confianza y visitarme en el @Senado_PRI ! http://t.co/UlVyfiDRAb”",6,1,0,0,0,"2015-05-28 19:32:50","2015-07-02 00:25:40",0,NA
"72",533249670349594624,236673083,"Fri Nov 14 13:26:43 +0000 2014","2014-11-14 13:26:43",NA,NA,"","RT @VerdeSenadoMex: Los Sen @CarlosPuenteZAC @RaulPozosMx y @DavidMonrealA durante la Sesión Ordinaria en el @senadomexicano http://t.co/Ni…",13,0,0,0,0,"2015-05-28 19:32:50","2015-07-02 00:25:40",1,NA
"73",533366966430736384,236673083,"Fri Nov 14 21:12:48 +0000 2014","2014-11-14 21:12:48",NA,NA,"","Hoy será un placer dialogar con las mujeres Carmelitas! Muchas Gracias por la invitación! http://t.co/0kUJ7rgxmy",12,7,0,0,0,"2015-05-28 19:32:50","2015-07-02 00:25:40",0,NA
"74",533738525813125120,236673083,"Sat Nov 15 21:49:15 +0000 2014","2014-11-15 21:49:15",NA,NA,"","Por su talento, fortaleza y sensibilidad las Mujeres Carmelitas son indispensables para hacer que Campeche Pueda! http://t.co/mbcjrPReOB",14,6,0,0,0,"2015-05-28 19:32:50","2015-07-02 00:25:40",0,NA
"75",533790127290863616,236673083,"Sun Nov 16 01:14:18 +0000 2014","2014-11-16 01:14:18",NA,NA,"","Les comparto la nota de La Prensa OEM ""Ejerce el Senado presupuesto austero y sobrio"" http://t.co/PB5JR9ruRW",9,2,0,0,0,"2015-05-28 19:32:50","2015-07-02 00:25:40",0,NA
"76",534039880981299200,236673083,"Sun Nov 16 17:46:44 +0000 2014","2014-11-16 17:46:44",NA,NA,"","Apostemos por el diálogo tolerante para el encuentro de ideas y demandas. #DiaDeLaTolerancia http://t.co/gv4QTKPinc",11,5,0,0,0,"2015-05-28 19:32:50","2015-07-02 00:25:40",0,NA
"77",534066143045373952,236673083,"Sun Nov 16 19:31:05 +0000 2014","2014-11-16 19:31:05",NA,NA,"","Cuando alguien tiene seguridad, empleo y oportunidades económicas es más fácil ser feliz #CampecheSíPuede ! 
http://t.co/AiUArhQM6s",15,8,0,0,0,"2015-05-28 19:32:50","2015-07-02 00:25:40",0,NA
"78",534083367420329984,236673083,"Sun Nov 16 20:39:32 +0000 2014","2014-11-16 20:39:32",NA,NA,"","RT @MujeresdeMexico: Que importante es tener #GrandesAliados como el Senador @RaulPozosMx #LecturaNecesaria http://t.co/3PCOeXeJ0A #RT http…",13,0,0,0,0,"2015-05-28 19:32:50","2015-07-02 00:25:40",1,NA
"79",534148975855960064,236673083,"Mon Nov 17 01:00:14 +0000 2014","2014-11-17 01:00:14",NA,NA,"","Yo crecí como miles de jóvenes campechanos. ¡Sí yo pude, ustedes también pueden! http://t.co/pqCx8aRhfH",21,8,0,0,0,"2015-05-28 19:32:50","2015-07-02 00:25:40",0,NA
"80",534849710348324864,236673083,"Tue Nov 18 23:24:42 +0000 2014","2014-11-18 23:24:42",NA,NA,"","RT @elbenne13: UNANSE @miguelsulub @RaulPozosMx @alitomorenoc @JLavalleMaury @EnriquEscalante @RenatoCampeche #diSialavida ayúdame http://t…",4,0,0,0,0,"2015-05-28 19:32:50","2015-07-28 22:59:13",1,NA
"81",534883359689043968,236673083,"Wed Nov 19 01:38:25 +0000 2014","2014-11-19 01:38:25",NA,NA,"","Les comparto este video de mi encuentro con las Mujeres Unidas por Carmen. http://t.co/u41lsHEjNG",9,6,0,0,0,"2015-05-28 19:32:50","2015-07-28 22:59:13",0,NA
"82",534891702017077248,236673083,"Wed Nov 19 02:11:34 +0000 2014","2014-11-19 02:11:34",NA,NA,"","RT @IQMujer: Les compartimos la Columna del Senador @RaulPozosMx ""Empoderamiento de la mujer"" http://t.co/PSwalKTwed … #YosoyIQM @Blanca_apc",8,0,0,0,0,"2015-05-28 19:32:50","2015-07-28 22:59:13",1,NA
"83",535092698290868224,236673083,"Wed Nov 19 15:30:15 +0000 2014","2014-11-19 15:30:15",NA,NA,"","Feliz Cumpleaños Amor, pásalo muy bien ! @MaritereCastro http://t.co/XBPr9uKoMX",38,30,0,0,0,"2015-05-28 19:32:50","2015-07-28 22:59:13",0,NA
"84",535152767573446656,236673083,"Wed Nov 19 19:28:57 +0000 2014","2014-11-19 19:28:57",NA,NA,"","Hoy se cumplen 30 años de la tragedia de #SanJuanico La Protección Civil somos Todos! #PrevenirEsVivir http://t.co/7CT1OMKv9X",27,13,0,0,0,"2015-05-28 19:32:50","2015-07-28 22:59:13",0,NA
"85",535239064195440640,236673083,"Thu Nov 20 01:11:51 +0000 2014","2014-11-20 01:11:51",NA,NA,"","Estoy convencido que la participación ciudadana es la mejor guía de los políticos! #CampecheSíPuede
http://t.co/LSkfTcQBsC",35,14,0,0,0,"2015-05-28 19:32:50","2015-07-28 22:59:13",0,NA
"86",535946123555659776,236673083,"Sat Nov 22 00:01:27 +0000 2014","2014-11-22 00:01:27",NA,NA,"","Luchar por la felicidad de las mujeres campechanas, es uno de los compromisos que me he trazado en la vida. http://t.co/YnI6QrakjH",30,16,0,0,0,"2015-05-28 19:32:50","2015-08-04 14:52:25",0,NA
"87",535991334222692352,236673083,"Sat Nov 22 03:01:06 +0000 2014","2014-11-22 03:01:06",NA,NA,"","Fué un placer haber compartido con ustedes, y recordar mis inicios en el partido en mi querido pueblo de Champotón. http://t.co/CloP0Tap7x",25,19,0,0,0,"2015-05-28 19:32:50","2015-08-04 14:52:25",0,NA
"88",535995359403966464,236673083,"Sat Nov 22 03:17:06 +0000 2014","2014-11-22 03:17:06",NA,NA,"","RT @omartalango: Agradecemos al Senador @RaulPozosMx la oportunidad que nos brindó de visitar la Camara Alta del C.U. @YoCreoCampeche http:…",15,0,0,0,0,"2015-05-28 19:32:50","2015-08-04 14:52:25",1,NA
"89",535995598257016832,236673083,"Sat Nov 22 03:18:03 +0000 2014","2014-11-22 03:18:03",NA,NA,"","RT @Vazquezdomingo: Jóvenes con la capacidad, creatividad y talento para hacer grandes cosas: @RaulPozosMx /@YoCreoCampeche @Raloeza http:/…",9,0,0,0,0,"2015-05-28 19:32:50","2015-08-04 14:52:25",1,NA
