"","id_tweet","id_twitter","created_at","created_at_datetime","in_reply_to_user_id","in_reply_to_status_id","in_reply_to_screen_name","text","retweet_count","favorite_count","longitude","latitude","retweeted","creation_date","modification_date","RT_temp","is_retweeted"
"1",506923134243852288,1061408623,"Tue Sep 02 21:54:28 +0000 2014","2014-09-02 21:54:28",NA,NA,"","Publiqué una nueva foto en Facebook http://t.co/nvqbvGcfUK",0,0,0,0,0,"2015-08-02 22:56:37","2015-08-03 01:13:38",0,NA
"2",507319168623185920,1061408623,"Thu Sep 04 00:08:09 +0000 2014","2014-09-04 00:08:09",NA,NA,"","Un gusto estar presente en la inauguración de obras en el municipio de Tuxtla Chico #SPDFSyECI #ChiapasNosUne http://t.co/5ogh7yoSax",2,2,0,0,0,"2015-08-02 22:56:37","2015-08-03 01:13:38",0,NA
"3",507562655180410880,1061408623,"Thu Sep 04 16:15:41 +0000 2014","2014-09-04 16:15:41",NA,NA,"","Inauguración de obras en el municipio de Tuxtla Chico. #ChiapasNosUne #SPDFSyECI http://t.co/6w5kaVLftZ",2,1,0,0,0,"2015-08-02 22:56:37","2015-08-03 01:13:38",0,NA
"4",507676852677521408,1061408623,"Thu Sep 04 23:49:28 +0000 2014","2014-09-04 23:49:28",NA,NA,"","Apertura de Oficina de Cooperación Internacional en Palenque #ChiapasNosUne #SPDFSyECI @VelascoM_ @gubernaturachis http://t.co/zJhzSQYxvu",1,0,0,0,0,"2015-08-02 22:56:37","2015-08-03 01:13:38",0,NA
"5",507916444508889088,1061408623,"Fri Sep 05 15:41:31 +0000 2014","2014-09-05 15:41:31",NA,NA,"","Esta mañana dimos la patada inicial del torneo CONALEP 2014. Éxito a todos los participantes y que gane el mejor. http://t.co/sx5ANuWUyc",2,0,0,0,0,"2015-08-02 22:56:37","2015-08-03 01:13:38",0,NA
"6",508970292639981568,1061408623,"Mon Sep 08 13:29:08 +0000 2014","2014-09-08 13:29:08",NA,NA,"","Iniciemos una semana de trabajo con una buena taza de #CaféChiapaneco. Éxito y bendiciones",1,0,0,0,0,"2015-08-02 22:56:37","2015-08-03 01:13:38",0,NA
"7",509074549754068992,1061408623,"Mon Sep 08 20:23:25 +0000 2014","2014-09-08 20:23:25",NA,NA,"","Mi respeto, reconocimiento y admiración a todos los periodistas hoy en el Día Internacional del Periodista #SPDFSyECI #AmigosDeEnrique",1,1,0,0,0,"2015-08-02 22:56:37","2015-08-03 01:13:38",0,NA
"8",509154610087755776,1061408623,"Tue Sep 09 01:41:33 +0000 2014","2014-09-09 01:41:33",NA,NA,"","RT @VelascoM_: En reunión con el Secretario @OsorioChong le agradecí todo su apoyo para tener una #FronteraSur más segura. #Chiapas. http:/…",100,0,0,0,0,"2015-08-02 22:56:37","2015-08-03 01:13:38",1,NA
"9",509194604827398144,1061408623,"Tue Sep 09 04:20:28 +0000 2014","2014-09-09 04:20:28",NA,NA,"","Hoy tuve el honor de inaugurar el tramo carretero Ejido Mexiquito-Finca Argovia-Finca El Chanjul #ChiapasNosUne http://t.co/KIau37LsWF",2,1,0,0,0,"2015-08-02 22:56:37","2015-08-03 01:13:38",0,NA
"10",509340487539785728,1061408623,"Tue Sep 09 14:00:09 +0000 2014","2014-09-09 14:00:09",NA,NA,"","No hay nada mejor en este mundo que iniciar el día compartiendo el desayuno con tus hijos, antes de irse a la escuela. #Amoamishijos",1,0,0,0,0,"2015-08-02 22:56:37","2015-08-03 01:13:38",0,NA
"11",509440638996082688,1061408623,"Tue Sep 09 20:38:07 +0000 2014","2014-09-09 20:38:07",NA,NA,"","México es grande y su gente tambien #HalaMadridYNadaMas http://t.co/q4fz67GrvC",0,0,0,0,0,"2015-08-02 22:56:36","2015-08-03 01:13:38",0,NA
"12",510888308202041344,1061408623,"Sat Sep 13 20:30:39 +0000 2014","2014-09-13 20:30:39",NA,NA,"","Gracias al apoyo del gobernador @VelascoM_ las familias de Tapachula cuentan con una #CanastaBásica @gubernaturachis http://t.co/AQkxknDjG3",1,0,0,0,0,"2015-08-02 22:56:36","2015-08-03 01:13:38",0,NA
"13",510888965776613376,1061408623,"Sat Sep 13 20:33:15 +0000 2014","2014-09-13 20:33:15",NA,NA,"","El día de hoy celebramos la gesta heróica de los #NinosHeroes #VivaMéxico http://t.co/IRo6HSiDGL",1,0,0,0,0,"2015-08-02 22:56:36","2015-08-03 01:13:38",0,NA
"14",510889911625728000,1061408623,"Sat Sep 13 20:37:01 +0000 2014","2014-09-13 20:37:01",NA,NA,"","Gracias al gobernador @VelascoM_ nuestros niños cuentan con uniformes escolares y con mejores condiciones educativas http://t.co/p7QOGHgsKh",1,0,0,0,0,"2015-08-02 22:56:36","2015-08-03 01:13:38",0,NA
"15",510890654843813888,1061408623,"Sat Sep 13 20:39:58 +0000 2014","2014-09-13 20:39:58",NA,NA,"","Hoy Chiapas tiene un nuevo rostro, en el que existen mejores condiciones educativas @VelascoM_ @gubernaturachis http://t.co/DmUtNwtvGf",1,0,0,0,0,"2015-08-02 22:56:36","2015-08-03 01:13:38",0,NA
"16",510932093459628032,1061408623,"Sat Sep 13 23:24:38 +0000 2014","2014-09-13 23:24:38",NA,NA,"","En el marco del CLXVII del aniversario de la gesta heroica de los niños héroes de Chapultepec, se reconoce la... http://t.co/O4KQX2KDri",2,0,0,0,0,"2015-08-02 22:56:36","2015-08-03 01:13:38",0,NA
"17",511775714849595392,1061408623,"Tue Sep 16 07:16:53 +0000 2014","2014-09-16 07:16:53",NA,NA,"","Celebremos hoy y siempre el orgullo de ser mexicanos #VivaMexico http://t.co/2x0unjStdd",3,1,0,0,0,"2015-08-02 22:56:36","2015-08-03 01:13:38",0,NA
"18",513366082460348416,1061408623,"Sat Sep 20 16:36:26 +0000 2014","2014-09-20 16:36:26",NA,NA,"","Gracias por la invitación a la facultad de contaduria de la UNACH al evento carrera de 5 Km #AmigosDeEnrique http://t.co/kE6occDnWi",0,0,0,0,0,"2015-08-02 22:56:36","2015-08-03 01:13:38",0,NA
"19",513379291896487936,1061408623,"Sat Sep 20 17:28:55 +0000 2014","2014-09-20 17:28:55",NA,NA,"","Golazo de @CH14_ Mexicanos triunfando en el extranjero #HalaMadrid #VamosPorMas http://t.co/nngf8L1g9x",1,0,0,0,0,"2015-08-02 22:56:36","2015-08-03 01:13:38",0,NA
"20",513385647394918400,1061408623,"Sat Sep 20 17:54:11 +0000 2014","2014-09-20 17:54:11",NA,NA,"","En el marco de la celebración por el XL Aniversario de la Universidad Autónoma De Chiapas, ante mas de 1000... http://t.co/AcOjApl93L",0,1,0,0,0,"2015-08-02 22:56:36","2015-08-03 01:13:38",0,NA
"21",513387385854259200,1061408623,"Sat Sep 20 18:01:05 +0000 2014","2014-09-20 18:01:05",NA,NA,"","Tras el arranque de la entrega de uniformes a los niños y jóvenes de los niveles Preescolar, Primaría y... http://t.co/St4g7OAVZo",1,1,0,0,0,"2015-08-02 22:56:35","2015-08-27 02:53:02",0,NA
"22",513416448761679872,1061408623,"Sat Sep 20 19:56:34 +0000 2014","2014-09-20 19:56:34",NA,NA,"","Celebrando la victoria del @realmadrid y el golazo @CH14_ #HalaMadrid http://t.co/XZ7Iup0N3F",1,2,0,0,0,"2015-08-02 22:56:35","2015-08-27 02:53:02",0,NA
"23",514079816782737408,1061408623,"Mon Sep 22 15:52:34 +0000 2014","2014-09-22 15:52:34",NA,NA,"","Reunión con constructoras, empresarios y sociedad civil para eveluar avances de construcción de avenidas centrales http://t.co/3ElRsUVxx9",3,1,0,0,0,"2015-08-02 22:56:35","2015-08-27 02:53:02",0,NA
"24",514582396729970688,1061408623,"Wed Sep 24 01:09:38 +0000 2014","2014-09-24 01:09:38",NA,NA,"","Con fin de dar seguimiento, respaldo y reforzamiento a las acciones emprendidas en tema de cooperación... http://t.co/diBJvvX9FJ",1,0,0,0,0,"2015-08-02 22:56:35","2015-08-27 02:53:02",0,NA
"25",514587538275991552,1061408623,"Wed Sep 24 01:30:04 +0000 2014","2014-09-24 01:30:04",NA,NA,"","Dando seguimiento al inicio de acciones del Parque Agroindustrial para el desarrollo regional del sureste, se... http://t.co/3CqDX0cvnB",2,0,0,0,0,"2015-08-02 22:56:35","2015-08-27 02:53:02",0,NA
"26",515545131479760896,1061408623,"Fri Sep 26 16:55:12 +0000 2014","2014-09-26 16:55:12",NA,NA,"","Los niños son la razón que nos une e impulsa a mover a Tapachula #ChiapasNosUne #SPDFSyECI http://t.co/GenNU98Zn2",1,1,0,0,0,"2015-08-02 22:56:34","2015-08-27 02:53:02",0,NA
"27",515589530758676480,1061408623,"Fri Sep 26 19:51:37 +0000 2014","2014-09-26 19:51:37",NA,NA,"","No hay duda, que las mejores llamadas que pueda recibir, son las de mis hijos #Amoamishijos",1,2,0,0,0,"2015-08-02 22:56:34","2015-08-27 02:53:02",0,NA
"28",515987515162263552,1061408623,"Sat Sep 27 22:13:04 +0000 2014","2014-09-27 22:13:04",NA,NA,"","Un gusto saludar a mis amigos y grandes funcionarios @LAMelgar @castellanosfer  Emilio Salazar y regidores http://t.co/AjNJ5zFkgX",5,1,0,0,0,"2015-08-02 22:56:34","2015-08-27 02:53:02",0,NA
"29",516011763394174976,1061408623,"Sat Sep 27 23:49:26 +0000 2014","2014-09-27 23:49:26",NA,NA,"","Con dos grandes amigos. Un placer trabajar en conjunto por el bienestar de Chiapas @ramirezlalo_ @castellanosfer http://t.co/e28kHTM1TW",5,0,0,0,0,"2015-08-02 22:56:34","2015-08-27 02:53:02",0,NA
"30",516012103522861056,1061408623,"Sat Sep 27 23:50:47 +0000 2014","2014-09-27 23:50:47",NA,NA,"","Hoy tuvimos la visita de  @ramirezlalo_ un aliado y amigo de los tapachultecos y de Chiapas http://t.co/IShIMgcSfc",4,0,0,0,0,"2015-08-02 22:56:34","2015-08-27 02:53:02",0,NA
"31",516612854100025344,1061408623,"Mon Sep 29 15:37:57 +0000 2014","2014-09-29 15:37:57",NA,NA,"","Iniciemos la semana con mucha energia y deseo de hacer las cosas. Recuerda que el limte de poder hacer las cosas, lo pones tu #Animo",3,1,0,0,0,"2015-08-02 22:56:34","2015-08-27 02:53:02",0,NA
"32",516653104251809792,1061408623,"Mon Sep 29 18:17:53 +0000 2014","2014-09-29 18:17:53",NA,NA,"","En la SPDFSyECI capacitamos a funcionarios y miembros de A. C. en materia migratoria http://t.co/FjptfddbFN",2,2,0,0,0,"2015-08-02 22:56:34","2015-08-27 02:53:02",0,NA
"33",516829563603939328,1061408623,"Tue Sep 30 05:59:04 +0000 2014","2014-09-30 05:59:04",NA,NA,"","Mi más sentido pesame a mi amigo y colaborador @aadrianGonzalez por la lamentable pérdida de su sra. madre. Que Dios la tenga en su gloria",0,1,0,0,0,"2015-08-02 22:56:34","2015-08-29 19:22:31",0,NA
"34",517321339448082432,1061408623,"Wed Oct 01 14:33:13 +0000 2014","2014-10-01 14:33:13",NA,NA,"","Iniciamos la mitad de la semana haciendo deporte #ElDeporteEsSalud #ElDeporteNosUne #SiempreDaLoMejorDeTi",4,2,0,0,0,"2015-08-02 22:56:34","2015-08-29 19:22:31",0,NA
"35",517752573911379968,1061408623,"Thu Oct 02 19:06:47 +0000 2014","2014-10-02 19:06:47",NA,NA,"","Felicidades al Colegio de Arquitectos por su aniversario y agradezco el haber jugado un partido de futbol con ellos en su día #SPDFSyECI",1,1,0,0,0,"2015-08-02 22:56:34","2015-08-29 19:22:31",0,NA
"36",517770279817191424,1061408623,"Thu Oct 02 20:17:09 +0000 2014","2014-10-02 20:17:09",NA,NA,"","He publicado una foto nueva en Facebook http://t.co/bLcRKK7oxS",1,1,0,0,0,"2015-08-02 22:56:34","2015-08-29 19:22:31",0,NA
"37",517771454310805504,1061408623,"Thu Oct 02 20:21:49 +0000 2014","2014-10-02 20:21:49",NA,NA,"","RT @castellanosfer: En Chiapas la jornada electoral local será el 3er domingo de julio del 2015 y la jornada electoral federal el 1er domin…",8,0,0,0,0,"2015-08-02 22:56:34","2015-08-29 19:22:31",1,NA
"38",518066767982518272,1061408623,"Fri Oct 03 15:55:17 +0000 2014","2014-10-03 15:55:17",NA,NA,"","Reunión de trabajo con diversas Cámaras de Tap y la Del. de Trans. del Edo. para atender el congestionamiento vial http://t.co/FKh3kybfXm",5,2,0,0,0,"2015-08-02 22:56:34","2015-08-29 19:22:31",0,NA
"39",518076638329044992,1061408623,"Fri Oct 03 16:34:30 +0000 2014","2014-10-03 16:34:30",NA,NA,"","Comparte tus ideas, razones y propuestas con.... #AmigosDeEnrique http://t.co/YUmXW6Zpdr",2,1,0,0,0,"2015-08-02 22:56:34","2015-08-29 19:22:31",0,NA
"40",518078195393134592,1061408623,"Fri Oct 03 16:40:41 +0000 2014","2014-10-03 16:40:41",NA,NA,"","Gracias a la implementación de elementos viales en #Tapachula, la circulación vial es más rápida #SPDDSyECI http://t.co/Ma2qnlA0xa",3,1,0,0,0,"2015-08-02 22:56:34","2015-08-29 19:22:31",0,NA
"41",518514091791757312,1061408623,"Sat Oct 04 21:32:47 +0000 2014","2014-10-04 21:32:47",NA,NA,"","Vamos #Ocelotes de la UNACH! http://t.co/99h543CJzX",2,1,0,0,0,"2015-08-02 22:56:34","2015-08-29 19:22:31",0,NA
"42",518805768104325120,1061408623,"Sun Oct 05 16:51:48 +0000 2014","2014-10-05 16:51:48",NA,NA,"","Promoviendo el deporte en las colonias de #Tapachula con clases de #Zumba gratuitas #AmigosDeEnrique http://t.co/nCFlbOMBhr",3,1,0,0,0,"2015-08-02 22:56:33","2015-08-29 19:22:31",0,NA
"43",518816187363233792,1061408623,"Sun Oct 05 17:33:12 +0000 2014","2014-10-05 17:33:12",NA,NA,"","Sigamos promoviendo actividades deportivas con las clases de #Zumba #Gratuitas en #Tapachula http://t.co/mnfqlJldKl",2,2,0,0,0,"2015-08-02 22:56:33","2015-08-29 19:22:31",0,NA
"44",518961304649084928,1061408623,"Mon Oct 06 03:09:51 +0000 2014","2014-10-06 03:09:51",NA,NA,"","Muy buen programa #LaVozMexico y sin duda alguna #JulionAlvarez esta conformando un gran equipo #ChiapasPresenteEnLosGrandesEventos",3,0,0,0,0,"2015-08-02 22:56:33","2015-08-29 19:22:31",0,NA
"45",519159663720665088,1061408623,"Mon Oct 06 16:18:04 +0000 2014","2014-10-06 16:18:04",NA,NA,"","Felicito a @AnahiyManuel27 por su compromiso y próxima boda. Mis mejores deseos y bendiciones para la nueva etapa juntos #Felicidades",3,0,0,0,0,"2015-08-02 22:56:33","2015-08-29 19:22:31",0,NA
"46",519161399579537408,1061408623,"Mon Oct 06 16:24:57 +0000 2014","2014-10-06 16:24:57",NA,NA,"","Hoy cumple 107 años de nacimiento #FranciscoGabilondoSoler, gracias por haber sido importante en la infancia de muchas generaciones",1,0,0,0,0,"2015-08-02 22:56:33","2015-08-29 19:22:31",0,NA
"47",519284401629581312,1061408623,"Tue Oct 07 00:33:43 +0000 2014","2014-10-07 00:33:43",NA,NA,"","Felicito a mi amigo y gran funcionario chiapaneco @JCGomezAranda por un año más de vida. Mi reconocimiento y mejores deseos #Felicidades",3,1,0,0,0,"2015-08-02 22:56:33","2015-08-29 19:22:31",0,NA
"48",519292321549283328,1061408623,"Tue Oct 07 01:05:12 +0000 2014","2014-10-07 01:05:12",NA,NA,"","¿Quién es el que anda aquí?...es Cri Cri, es Cri Cri! #RecordandoAFranciscoGabilondoSoler",3,1,0,0,0,"2015-08-02 22:56:33","2015-09-01 23:56:03",0,NA
"49",519304570514976768,1061408623,"Tue Oct 07 01:53:52 +0000 2014","2014-10-07 01:53:52",NA,NA,"","Escuché y apoyaré a un grupo de mujeres de la col. 5 de febrero #UnGobiernoCercanoALaGente #AmigosDeEnrique http://t.co/mdmxJ4VFvh",2,1,0,0,0,"2015-08-02 22:56:33","2015-09-02 16:03:56",0,NA
"50",519579178354487296,1061408623,"Tue Oct 07 20:05:04 +0000 2014","2014-10-07 20:05:04",NA,NA,"","Hoy conmemoramos el #DíaDeLaLibertadDeExpresión mi felicitación y reconocimiento a quienes ejercen este derecho #SPDFSyECI",1,0,0,0,0,"2015-08-02 22:56:32","2015-09-02 16:03:56",0,NA
"51",520019404147675136,1061408623,"Thu Oct 09 01:14:22 +0000 2014","2014-10-09 01:14:22",NA,NA,"","Un gusto saludar a mi amigo caricaturista @azabache91 una persona con un gran talento y compromiso http://t.co/3hukUROpc6",2,1,0,0,0,"2015-08-02 22:56:32","2015-09-02 16:03:56",0,NA
"52",520259622423527424,1061408623,"Thu Oct 09 17:08:54 +0000 2014","2014-10-09 17:08:54",NA,NA,"","Un gusto ser testigo de la entrega de apoyos del programa #UnaSemillaParaCrecer con la Sra. Leticia y @sasildeleon http://t.co/SsbYspLEBO",2,1,0,0,0,"2015-08-02 22:56:32","2015-09-02 16:03:56",0,NA
"53",520375911641010176,1061408623,"Fri Oct 10 00:51:00 +0000 2014","2014-10-10 00:51:00",NA,NA,"","Listos para apoyar al #Tri #PonteLaVerde #JuntosApoyemosALaSeleccion @miseleccionmx http://t.co/7hilJ97u17",1,0,0,0,0,"2015-08-02 22:56:32","2015-09-02 16:03:56",0,NA
"54",520376485086244864,1061408623,"Fri Oct 10 00:53:16 +0000 2014","2014-10-10 00:53:16",NA,NA,"","Así luce de espectacular nuestro estadio #VictorManuelReina en nuestro bello estado de #Chiapas http://t.co/DToLs3RrUM",1,0,0,0,0,"2015-08-02 22:56:32","2015-09-02 16:03:56",0,NA
"55",520378440974098432,1061408623,"Fri Oct 10 01:01:03 +0000 2014","2014-10-10 01:01:03",NA,NA,"","Apoyando a @miseleccionmx con mi amigo @ramirezlalo_ #PonteLaVerdeChiapas #VamosTri http://t.co/g1pXYTcAqQ",1,1,0,0,0,"2015-08-02 22:56:32","2015-09-02 16:03:56",0,NA
"56",520418606522589184,1061408623,"Fri Oct 10 03:40:39 +0000 2014","2014-10-10 03:40:39",NA,NA,"","Gracias a @miseleccionmx que nos brindó a todos los chiapanecos un momento agradable con el gran partido del #Tri #PonteLaVerde #Chiapas",1,1,0,0,0,"2015-08-02 22:56:32","2015-09-02 16:03:56",0,NA
"57",520577405346668544,1061408623,"Fri Oct 10 14:11:39 +0000 2014","2014-10-10 14:11:39",NA,NA,"","#UnaSemillaParaCrecer #FortaleciendoALasMujeresDeLaFronteraSur #SPDFSyECI http://t.co/ZySeLcehPU",1,1,0,0,0,"2015-08-02 22:56:32","2015-09-06 19:50:26",0,NA
"58",520663557193469952,1061408623,"Fri Oct 10 19:54:00 +0000 2014","2014-10-10 19:54:00",NA,NA,"","Publiqué una nueva foto en Facebook http://t.co/vDePBErkrU",0,1,0,0,0,"2015-08-02 22:56:31","2015-09-06 19:50:26",0,NA
"59",520973225472565248,1061408623,"Sat Oct 11 16:24:30 +0000 2014","2014-10-11 16:24:30",NA,NA,"","Iniciemos el fin de semana con la mejor actitud y #nuncatedesporvencido #AmigosDeEnrique",1,2,0,0,0,"2015-08-02 22:56:31","2015-09-07 23:14:47",0,NA
"60",521487006489407488,1061408623,"Mon Oct 13 02:26:05 +0000 2014","2014-10-13 02:26:05",NA,NA,"","#DiadelaRaza #AmigosDeEnrique #ChiapasNosUne #SPDFSyECI http://t.co/eInOfQE9E5",0,0,0,0,0,"2015-08-02 22:56:31","2015-09-07 23:14:47",0,NA
"61",521497116389044224,1061408623,"Mon Oct 13 03:06:16 +0000 2014","2014-10-13 03:06:16",NA,NA,"","Feliz día de la raza http://t.co/PUXd47zYWr",0,0,0,0,0,"2015-08-02 22:56:31","2015-09-07 23:14:47",0,NA
"62",521695889443028992,1061408623,"Mon Oct 13 16:16:07 +0000 2014","2014-10-13 16:16:07",NA,NA,"","Felicito a mi gran amigo y fucionario @ramirezlalo_ por su cumpleaños. Mis mejores deseos y bendiciones para el y su familia #Felicidades",1,0,0,0,0,"2015-08-02 22:56:31","2015-09-07 23:14:47",0,NA
"63",522384665098092544,1061408623,"Wed Oct 15 13:53:04 +0000 2014","2014-10-15 13:53:04",NA,NA,"","RT @DiezNoticias: Reconoce Chiapas a una mujer valiente, que ha hecho de su pluma la mejor arma para defender los derechos humanos http://t…",4,0,0,0,0,"2015-08-02 22:56:31","2015-09-07 23:14:47",1,NA
"64",522775955610562560,1061408623,"Thu Oct 16 15:47:55 +0000 2014","2014-10-16 15:47:55",NA,NA,"","Firmamos un convenio de cooperación en materia comercial con la CANACO SERVITUR Merida y la #SPDFSyECI #ChiapasNosUne http://t.co/n3Gsa0a2Jp",1,0,0,0,0,"2015-08-02 22:56:31","2015-09-07 23:14:47",0,NA
"65",522819139602100224,1061408623,"Thu Oct 16 18:39:31 +0000 2014","2014-10-16 18:39:31",NA,NA,"","Los adultos mayores son prioridad para este Gobierno es por eso que se entregaron más de mil tarjetas INAPAM,... http://t.co/qcVxMwYqIK",3,0,0,0,0,"2015-08-02 22:56:30","2015-09-07 23:14:47",0,NA
"66",522975542640132096,1061408623,"Fri Oct 17 05:01:00 +0000 2014","2014-10-17 05:01:00",NA,NA,"","Impulsamos el desarrollo económico de la #FronteraSur con la firma de convenio entre CANACO Merida Yuc y la SPDFSyECI http://t.co/cCUGxnBPaU",3,0,0,0,0,"2015-08-02 22:56:30","2015-09-09 13:18:05",0,NA
"67",523490440218443776,1061408623,"Sat Oct 18 15:07:01 +0000 2014","2014-10-18 15:07:01",NA,NA,"","Previo al #DiaInternacionalContraElCancerDeMama invitamos a la población a acitivarse y a la autoexploración http://t.co/RobPhfni6L",1,0,0,0,0,"2015-08-02 22:56:30","2015-09-09 13:18:05",0,NA
"68",523926052620750848,1061408623,"Sun Oct 19 19:57:59 +0000 2014","2014-10-19 19:57:59",NA,NA,"","#Caminata del  #DiaInternacionalContraElCancerDeMama por una cultura de prevención #AmigosDeEnrique #SPDFSyECI http://t.co/eNIZ6JuvbN",4,1,0,0,0,"2015-08-02 22:56:30","2015-09-09 13:18:05",0,NA
"69",524006807657000960,1061408623,"Mon Oct 20 01:18:53 +0000 2014","2014-10-20 01:18:53",NA,NA,"","#DiaInternacionalContraElCancerDeMama nos unimos a la lucha contra esta enfermedad #PorUnaVidaSana #AmigosDeEnrique http://t.co/YcSKADxa6Z",2,1,0,0,0,"2015-08-02 22:56:30","2015-09-09 13:18:05",0,NA
"70",524019787324989440,1061408623,"Mon Oct 20 02:10:27 +0000 2014","2014-10-20 02:10:27",NA,NA,"","Gracias a todos por unirse a esta lucha contra el cáncer de mama #diamundialcontraelcancerdemama  #AmigosDeEnrique http://t.co/ZOyVdMDxrp",3,1,0,0,0,"2015-08-02 22:56:30","2015-09-09 13:18:05",0,NA
"71",524029700721496064,1061408623,"Mon Oct 20 02:49:51 +0000 2014","2014-10-20 02:49:51",NA,NA,"","Publiqué una nueva foto en Facebook http://t.co/7eC6M6NHcV",0,0,0,0,0,"2015-08-02 22:56:30","2015-09-10 16:06:37",0,NA
"72",524338972680810496,1061408623,"Mon Oct 20 23:18:47 +0000 2014","2014-10-20 23:18:47",NA,NA,"","Toda una experiencia jugar #Jenga con los alumnos de la Universidad Maya en la semana cultural #AmigosDeEnrique http://t.co/IiInp6JC8K",3,1,0,0,0,"2015-08-02 22:56:30","2015-09-10 16:06:37",0,NA
"73",524339973831819264,1061408623,"Mon Oct 20 23:22:46 +0000 2014","2014-10-20 23:22:46",NA,NA,"","Gracias a los alumnos de la Universidad Maya por esta bonita experiencia en su semana cultural #AmigosDeEnrique http://t.co/9S8lFhOPiV",4,0,0,0,0,"2015-08-02 22:56:30","2015-09-11 00:32:09",0,NA
"74",524340891654565888,1061408623,"Mon Oct 20 23:26:25 +0000 2014","2014-10-20 23:26:25",NA,NA,"","Un honor haber compartido con los alumnos de la Universidad Maya las acciones del gobierno de @VelascoM_ http://t.co/A5fhMzdG58",3,0,0,0,0,"2015-08-02 22:56:30","2015-09-11 17:22:23",0,NA
"75",524349196304789504,1061408623,"Mon Oct 20 23:59:24 +0000 2014","2014-10-20 23:59:24",NA,NA,"","Gracias a los alumnos de la Universidad Maya por haberme invitado a la inauguracion y actividades de la semana... http://t.co/S9KkGLpTVQ",3,1,0,0,0,"2015-08-02 22:56:29","2015-09-11 17:22:23",0,NA
"76",525046261003870208,1061408623,"Wed Oct 22 22:09:18 +0000 2014","2014-10-22 22:09:18",NA,NA,"","Gracias a los niños ganadores del proyecto Escuelas México en Centroamerica por si visita a la #SPDFSyECI http://t.co/lxUuvszlja",4,1,0,0,0,"2015-08-02 22:56:29","2015-09-11 17:22:23",0,NA
"77",525138280577511424,1061408623,"Thu Oct 23 04:14:57 +0000 2014","2014-10-23 04:14:57",NA,NA,"","RT @VelascoM_: Se decreta la suspensión de clases en 6,998 escuelas de 47 municipios en Alerta Naranja. #Chiapas. http://t.co/wOJI2Z99Ai",96,0,0,0,0,"2015-08-02 22:56:29","2015-09-11 17:22:23",1,NA
"78",525138330678489088,1061408623,"Thu Oct 23 04:15:09 +0000 2014","2014-10-23 04:15:09",NA,NA,"","RT @VelascoM_: Instruí a @RadioyTvChiapas intensificar labor informativa para orientar a la población ante pronóstico de lluvias. http://t.…",76,0,0,0,0,"2015-08-02 22:56:29","2015-09-11 17:22:23",1,NA
"79",525138457631653888,1061408623,"Thu Oct 23 04:15:39 +0000 2014","2014-10-23 04:15:39",NA,NA,"","RT @VelascoM_: En marcha protocolos preventivos por fase de Alerta Naranja en zonas Norte, Mezcalapa, Bosques, Tulijá, Maya y Selva. http:/…",70,0,0,0,0,"2015-08-02 22:56:29","2015-09-11 17:22:23",1,NA
"80",525265012735377408,1061408623,"Thu Oct 23 12:38:32 +0000 2014","2014-10-23 12:38:32",NA,NA,"","Felicito a todos los Médicos en su día y agradezco su empeño y dedicación para cuidar y mejorar siempre la salud todos nosotros #SPDFSyECI",2,1,0,0,0,"2015-08-02 22:56:29","2015-09-11 17:22:23",0,NA
"81",525284803642654720,1061408623,"Thu Oct 23 13:57:11 +0000 2014","2014-10-23 13:57:11",NA,NA,"","#FelizDiaDelMedico gracias por cuidar siempre nuestra salud http://t.co/Vbb1kUAPZF",3,1,0,0,0,"2015-08-02 22:56:29","2015-09-11 17:22:23",0,NA
"82",525389934497386496,1061408623,"Thu Oct 23 20:54:56 +0000 2014","2014-10-23 20:54:56",NA,NA,"","Felicidades a todos los Médicos http://t.co/3MUwGGtM7L",2,1,0,0,0,"2015-08-02 22:56:29","2015-09-11 17:22:23",0,NA
"83",525644084078452736,1061408623,"Fri Oct 24 13:44:50 +0000 2014","2014-10-24 13:44:50",NA,NA,"","Agradezco al Club de Industriales de Chiapas, por la interesante reunión que sostuvimos en materia comercial #SPDFS http://t.co/tJnOypWP3e",4,1,0,0,0,"2015-08-02 22:56:29","2015-09-11 17:22:23",0,NA
"84",525791644428550144,1061408623,"Fri Oct 24 23:31:11 +0000 2014","2014-10-24 23:31:11",NA,NA,"","Ánimo, cerremos con la mejor actitud la semana #AmigosDeEnrique #SPDFSyECI",4,1,0,0,0,"2015-08-02 22:56:29","2015-09-11 17:22:23",0,NA
"85",525802626961920000,1061408623,"Sat Oct 25 00:14:49 +0000 2014","2014-10-25 00:14:49",NA,NA,"","Un gusto saludar a la Dip. Itzel de León Villard presidenta de la Junta de Coord. Política del Congreso del Estado http://t.co/JHwE76aeXC",3,0,0,0,0,"2015-08-02 22:56:29","2015-09-15 19:30:24",0,NA
"86",525811969123962880,1061408623,"Sat Oct 25 00:51:57 +0000 2014","2014-10-25 00:51:57",NA,NA,"","Saludando al Magistrado Presidente del @PJE_Chiapas @rutilioescandon http://t.co/va3vIpKMid",2,1,0,0,0,"2015-08-02 22:56:29","2015-09-15 19:30:24",0,NA
"87",525830428159008768,1061408623,"Sat Oct 25 02:05:18 +0000 2014","2014-10-25 02:05:18",NA,NA,"","Clausura del Programa ""Conectando Fronteras Niños Inmigrantes"" #SPDFSyECI http://t.co/xYuYcXR0GM",3,2,0,0,0,"2015-08-02 22:56:29","2015-09-15 19:30:24",0,NA
"88",525839600070062080,1061408623,"Sat Oct 25 02:41:44 +0000 2014","2014-10-25 02:41:44",NA,NA,"","Día de la Naciones Unidas. En Chiapas reafirmamos nuestro compromiso con las causas justas de Naciones Unidas http://t.co/1IlIdFHIZ0",1,1,0,0,0,"2015-08-02 22:56:29","2015-09-15 19:30:24",0,NA
"89",525847851771772928,1061408623,"Sat Oct 25 03:14:32 +0000 2014","2014-10-25 03:14:32",NA,NA,"","Publiqué una nueva foto en Facebook http://t.co/TExug0CfCr",1,1,0,0,0,"2015-08-02 22:56:28","2015-09-15 19:30:24",0,NA
"90",526073560587317248,1061408623,"Sat Oct 25 18:11:25 +0000 2014","2014-10-25 18:11:25",NA,NA,"","Felicidades a mi equipo @realmadrid por su contundente triunfo en el clásico español #HalaMadrid",2,1,0,0,0,"2015-08-02 22:56:28","2015-09-15 19:30:24",0,NA
"91",526214763786039296,1061408623,"Sun Oct 26 03:32:30 +0000 2014","2014-10-26 03:32:30",NA,NA,"","Recuerden que hay este domingo hay que atrasar el reloj una hora, termina el horario de verano!!! http://t.co/U2Jlh2ZMTa",1,2,0,0,0,"2015-08-02 22:56:28","2015-09-15 19:30:24",0,NA
"92",527552304921059328,1061408623,"Wed Oct 29 20:07:25 +0000 2014","2014-10-29 20:07:25",NA,NA,"","Publiqué una nueva foto en Facebook http://t.co/ntbGyWTOS2",0,0,0,0,0,"2015-08-02 22:56:28","2015-09-15 19:30:24",0,NA
